number,value,datetime_start,datetime_complete,duration,params_activation,params_batch_size,params_h,params_lr,params_seq_length,state
288,0.0003310333995614201,2025-07-12 22:13:51.149320,2025-07-12 22:14:35.247069,0 days 00:00:44.097749,identity,32,89,0.0017484225944186288,23,COMPLETE
289,0.0003760466061066836,2025-07-12 22:14:35.247810,2025-07-12 22:15:21.946193,0 days 00:00:46.698383,identity,32,93,0.0016027032924127828,23,COMPLETE
290,0.0003595018060877919,2025-07-12 22:15:21.946947,2025-07-12 22:16:03.080889,0 days 00:00:41.133942,identity,32,82,0.0012739087160152946,22,COMPLETE
291,0.00032071801251731813,2025-07-12 22:16:03.081615,2025-07-12 22:16:49.919117,0 days 00:00:46.837502,identity,32,95,0.0013837588020494513,23,COMPLETE
292,0.00034146246616728604,2025-07-12 22:16:49.919846,2025-07-12 22:17:36.717738,0 days 00:00:46.797892,identity,32,95,0.0014245550003019788,23,COMPLETE
293,0.0003594070440158248,2025-07-12 22:17:36.718476,2025-07-12 22:18:17.339632,0 days 00:00:40.621156,identity,32,96,0.00163689935851076,22,COMPLETE
294,0.00035364122595638037,2025-07-12 22:18:17.340365,2025-07-12 22:19:03.206787,0 days 00:00:45.866422,identity,32,91,0.0014864342431920776,23,COMPLETE
295,0.00034012197284027934,2025-07-12 22:19:03.207536,2025-07-12 22:19:47.333318,0 days 00:00:44.125782,identity,32,97,0.00134837141720708,23,COMPLETE
296,0.00032163161085918546,2025-07-12 22:19:47.334011,2025-07-12 22:20:35.026433,0 days 00:00:47.692422,identity,32,94,0.0017799053637073438,24,COMPLETE
297,0.0003407435433473438,2025-07-12 22:20:35.027178,2025-07-12 22:20:56.915440,0 days 00:00:21.888262,identity,128,90,0.0013300062931863768,23,COMPLETE
298,0.0003177582111675292,2025-07-12 22:20:56.916117,2025-07-12 22:21:45.933597,0 days 00:00:49.017480,identity,32,95,0.001182838078791849,24,COMPLETE
299,0.0003619278722908348,2025-07-12 22:21:45.934328,2025-07-12 22:22:34.865813,0 days 00:00:48.931485,identity,32,95,0.0011588332102087152,24,COMPLETE
300,0.0003202635853085667,2025-07-12 22:22:34.866528,2025-07-12 22:23:20.532404,0 days 00:00:45.665876,identity,32,98,0.0011911873673976616,24,COMPLETE
301,0.00032837523031048477,2025-07-12 22:23:20.533138,2025-07-12 22:24:06.227425,0 days 00:00:45.694287,identity,32,98,0.0010991465405845028,24,COMPLETE
302,0.00037415241240523756,2025-07-12 22:24:06.228153,2025-07-12 22:24:52.602760,0 days 00:00:46.374607,identity,32,97,0.0012618719390214248,24,COMPLETE
303,0.00033993524266406894,2025-07-12 22:24:52.603497,2025-07-12 22:25:38.115595,0 days 00:00:45.512098,identity,32,100,0.0016585980598157323,24,COMPLETE
304,0.0003395490057300776,2025-07-12 22:25:38.116326,2025-07-12 22:26:24.385561,0 days 00:00:46.269235,identity,32,97,0.0011940514619841673,24,COMPLETE
305,0.0003686179406940937,2025-07-12 22:26:24.386299,2025-07-12 22:27:14.833253,0 days 00:00:50.446954,identity,32,60,0.001348286200804181,24,COMPLETE
306,0.0003333934582769871,2025-07-12 22:27:14.834002,2025-07-12 22:28:02.268875,0 days 00:00:47.434873,identity,32,94,0.0010507702379005594,24,COMPLETE
307,0.0003505638742353767,2025-07-12 22:28:02.269587,2025-07-12 22:28:45.991256,0 days 00:00:43.721669,identity,32,100,0.0014602324668859096,23,COMPLETE
308,0.00033285224344581366,2025-07-12 22:28:45.991943,2025-07-12 22:29:28.209577,0 days 00:00:42.217634,identity,32,96,0.0019062140468637573,23,COMPLETE
309,0.00034406824852339923,2025-07-12 22:29:28.210296,2025-07-12 22:30:10.166242,0 days 00:00:41.955946,identity,32,65,0.0012779556371186756,24,COMPLETE
310,0.0003221284714527428,2025-07-12 22:30:10.166996,2025-07-12 22:31:00.242596,0 days 00:00:50.075600,identity,32,102,0.0009477389611212949,25,COMPLETE
311,0.00036189774982631207,2025-07-12 22:31:00.243341,2025-07-12 22:31:28.717903,0 days 00:00:28.474562,identity,64,99,0.001730383563549802,22,COMPLETE
312,0.00032534784986637533,2025-07-12 22:31:28.718618,2025-07-12 22:32:16.919284,0 days 00:00:48.200666,identity,32,94,0.0015559794196074715,24,COMPLETE
313,0.0003483856562525034,2025-07-12 22:32:16.920023,2025-07-12 22:33:01.186980,0 days 00:00:44.266957,identity,32,98,0.001150867843734708,23,COMPLETE
314,0.00035877537447959185,2025-07-12 22:33:01.187662,2025-07-12 22:33:51.226536,0 days 00:00:50.038874,identity,32,102,0.00231412348993117,25,COMPLETE
315,0.00032701113377697766,2025-07-12 22:33:51.227288,2025-07-12 22:34:41.711978,0 days 00:00:50.484690,identity,32,122,0.0013630667233382621,24,COMPLETE
316,0.0003542245540302247,2025-07-12 22:34:41.712667,2025-07-12 22:35:31.809717,0 days 00:00:50.097050,identity,32,93,0.0010349733257580447,25,COMPLETE
317,0.00034469502861611545,2025-07-12 22:35:31.810457,2025-07-12 22:36:16.502668,0 days 00:00:44.692211,identity,32,96,0.0014786977119905192,24,COMPLETE
318,0.00033165651257149875,2025-07-12 22:36:16.503420,2025-07-12 22:37:06.441581,0 days 00:00:49.938161,identity,32,101,0.0012311315229247837,25,COMPLETE
319,0.00035329259117133915,2025-07-12 22:37:06.442327,2025-07-12 22:37:48.796269,0 days 00:00:42.353942,identity,32,98,0.0018459432293649457,22,COMPLETE
320,0.000321191328112036,2025-07-12 22:37:48.796977,2025-07-12 22:38:33.748493,0 days 00:00:44.951516,identity,32,104,0.0016291843885680125,24,COMPLETE
321,0.006365227047353983,2025-07-12 22:38:33.749188,2025-07-12 22:38:55.354770,0 days 00:00:21.605582,identity,128,73,0.0001795420689244205,23,COMPLETE
322,0.00033226830419152975,2025-07-12 22:38:55.355497,2025-07-12 22:39:41.579471,0 days 00:00:46.223974,identity,32,88,0.0008818477030930944,25,COMPLETE
323,0.0004076791228726506,2025-07-12 22:39:41.580214,2025-07-12 22:40:04.648756,0 days 00:00:23.068542,identity,32,95,0.002025432293899836,7,COMPLETE
324,0.00034471903927624226,2025-07-12 22:40:04.649436,2025-07-12 22:40:51.275410,0 days 00:00:46.625974,identity,32,93,0.0011007038104715273,23,COMPLETE
325,0.0005538577679544687,2025-07-12 22:40:51.276142,2025-07-12 22:41:21.259546,0 days 00:00:29.983404,identity,32,29,0.0007355500155332938,21,COMPLETE
326,0.00032529461896046996,2025-07-12 22:41:21.260272,2025-07-12 22:42:07.940398,0 days 00:00:46.680126,identity,32,99,0.0013823712964090894,24,COMPLETE
327,0.00036710724816657603,2025-07-12 22:42:07.941132,2025-07-12 22:42:55.952477,0 days 00:00:48.011345,identity,32,103,0.0011874433206631842,24,COMPLETE
328,0.0003646102559287101,2025-07-12 22:42:55.953162,2025-07-12 22:43:45.980487,0 days 00:00:50.027325,identity,32,101,0.0012858857885577875,25,COMPLETE
329,0.0003646003024186939,2025-07-12 22:43:45.981224,2025-07-12 22:44:31.416621,0 days 00:00:45.435397,relu,32,77,0.0016749724711955657,23,COMPLETE
330,0.00034761230926960707,2025-07-12 22:44:31.417383,2025-07-12 22:45:19.916400,0 days 00:00:48.499017,identity,32,92,0.0014656852325267882,25,COMPLETE
331,0.00033570799860171974,2025-07-12 22:45:19.917143,2025-07-12 22:46:04.398601,0 days 00:00:44.481458,identity,32,96,0.000987985451040781,24,COMPLETE
332,0.0003423445450607687,2025-07-12 22:46:04.399359,2025-07-12 22:46:56.788021,0 days 00:00:52.388662,identity,32,107,0.0010844093885867877,25,COMPLETE
333,0.00033704546513035893,2025-07-12 22:46:56.788769,2025-07-12 22:47:41.960650,0 days 00:00:45.171881,identity,32,87,0.0018255188123690196,23,COMPLETE
334,0.0003261848178226501,2025-07-12 22:47:41.961399,2025-07-12 22:48:26.884380,0 days 00:00:44.922981,identity,32,104,0.002164644502356732,24,COMPLETE
335,0.00039126924821175635,2025-07-12 22:48:26.885093,2025-07-12 22:48:57.849324,0 days 00:00:30.964231,identity,64,98,0.0015584197316356777,24,COMPLETE
336,0.00032438308699056506,2025-07-12 22:48:57.850055,2025-07-12 22:49:46.351790,0 days 00:00:48.501735,identity,32,89,0.0013183890287517411,25,COMPLETE
337,0.00037591560976579785,2025-07-12 22:49:46.352539,2025-07-12 22:50:33.155544,0 days 00:00:46.803005,identity,32,95,0.0006564680317800223,23,COMPLETE
338,0.0003255324554629624,2025-07-12 22:50:33.156273,2025-07-12 22:51:16.496591,0 days 00:00:43.340318,identity,32,68,0.0012130689309345659,25,COMPLETE
339,0.0003297243092674762,2025-07-12 22:51:16.497321,2025-07-12 22:52:03.221109,0 days 00:00:46.723788,identity,32,92,0.0014666100925676123,24,COMPLETE
340,0.0005010207532905042,2025-07-12 22:52:03.221857,2025-07-12 22:52:34.695169,0 days 00:00:31.473312,identity,32,19,0.00168968946847113,24,COMPLETE
341,0.0003441047156229615,2025-07-12 22:52:34.695852,2025-07-12 22:53:25.151671,0 days 00:00:50.455819,identity,32,100,0.0013695143034996027,25,COMPLETE
342,0.00032179264235310256,2025-07-12 22:53:25.152413,2025-07-12 22:54:11.751810,0 days 00:00:46.599397,identity,32,97,0.002500857035737641,24,COMPLETE
343,0.00035256962291896343,2025-07-12 22:54:11.752546,2025-07-12 22:54:51.048008,0 days 00:00:39.295462,identity,32,102,0.0011454423026218024,19,COMPLETE
344,0.00033499710843898356,2025-07-12 22:54:51.048698,2025-07-12 22:55:33.069002,0 days 00:00:42.020304,identity,32,85,0.0009360019008461167,22,COMPLETE
345,1.7197859287261963,2025-07-12 22:55:33.069742,2025-07-12 22:56:18.876537,0 days 00:00:45.806795,relu,32,94,0.0019719718457050697,23,COMPLETE
346,0.0003325561119709164,2025-07-12 22:56:18.877272,2025-07-12 22:56:40.771066,0 days 00:00:21.893794,identity,128,108,0.0015528138796393478,23,COMPLETE
347,0.00035395516897551715,2025-07-12 22:56:40.771783,2025-07-12 22:57:35.268546,0 days 00:00:54.496763,identity,32,55,0.0012714623272188999,25,COMPLETE
348,0.00033846235601231456,2025-07-12 22:57:35.269291,2025-07-12 22:58:24.728046,0 days 00:00:49.458755,identity,32,105,0.000841426459111486,24,COMPLETE
349,0.00035435426980257034,2025-07-12 22:58:24.728740,2025-07-12 22:59:13.649603,0 days 00:00:48.920863,identity,32,90,0.0010484367436770327,25,COMPLETE
350,0.0003599913907237351,2025-07-12 22:59:13.650345,2025-07-12 22:59:56.019086,0 days 00:00:42.368741,identity,32,98,0.0014363796805389273,22,COMPLETE
351,0.0003696378553286195,2025-07-12 22:59:56.019776,2025-07-12 23:00:23.389918,0 days 00:00:27.370142,identity,32,101,0.0018493357686720337,10,COMPLETE
352,0.00032056975760497153,2025-07-12 23:00:23.390588,2025-07-12 23:01:11.787788,0 days 00:00:48.397200,identity,32,93,0.0016273040809315555,24,COMPLETE
353,0.00034085995866917074,2025-07-12 23:01:11.788513,2025-07-12 23:02:00.206335,0 days 00:00:48.417822,identity,32,93,0.0017189296613247633,24,COMPLETE
354,0.00031622129608877003,2025-07-12 23:02:00.207110,2025-07-12 23:02:46.954249,0 days 00:00:46.747139,identity,32,90,0.0021782063981165673,24,COMPLETE
355,0.00043964205542579293,2025-07-12 23:02:46.955024,2025-07-12 23:03:32.942805,0 days 00:00:45.987781,identity,32,88,0.0028546555257256195,25,COMPLETE
356,0.00037900693132542074,2025-07-12 23:03:32.943566,2025-07-12 23:04:19.577613,0 days 00:00:46.634047,identity,32,82,0.002148365019819311,25,COMPLETE
357,0.0003686988784465939,2025-07-12 23:04:19.578353,2025-07-12 23:05:06.415000,0 days 00:00:46.836647,identity,32,86,0.0023628217781170658,24,COMPLETE
358,0.00036240636836737394,2025-07-12 23:05:06.415745,2025-07-12 23:05:40.070257,0 days 00:00:33.654512,identity,64,91,0.0021756990790528998,24,COMPLETE
359,0.00037343893200159073,2025-07-12 23:05:40.071021,2025-07-12 23:06:31.680434,0 days 00:00:51.609413,identity,32,105,0.002002006084066312,25,COMPLETE
360,0.0003537728334777057,2025-07-12 23:06:31.681176,2025-07-12 23:07:18.409293,0 days 00:00:46.728117,identity,32,108,0.0018480805564772033,24,COMPLETE
361,0.0003209855640307069,2025-07-12 23:07:18.410041,2025-07-12 23:08:07.281258,0 days 00:00:48.871217,identity,32,90,0.0011648615684876895,25,COMPLETE
362,0.00034694504574872553,2025-07-12 23:08:07.282000,2025-07-12 23:08:58.134759,0 days 00:00:50.852759,identity,32,103,0.002664148933027987,25,COMPLETE
363,0.00036023088614456356,2025-07-12 23:08:58.135525,2025-07-12 23:09:37.504365,0 days 00:00:39.368840,identity,32,100,0.000987909322328873,20,COMPLETE
364,0.0003192853182554245,2025-07-12 23:09:37.505069,2025-07-12 23:10:23.797623,0 days 00:00:46.292554,identity,32,97,0.0012482851789810535,24,COMPLETE
365,1.7192953824996948,2025-07-12 23:10:23.798379,2025-07-12 23:11:12.917985,0 days 00:00:49.119606,relu,32,114,0.0013007266383348566,24,COMPLETE
366,0.00031031190883368254,2025-07-12 23:11:12.918704,2025-07-12 23:12:02.280382,0 days 00:00:49.361678,identity,32,95,0.0023206811148730106,24,COMPLETE
367,0.00032377862953580916,2025-07-12 23:12:02.281158,2025-07-12 23:12:48.852443,0 days 00:00:46.571285,identity,32,96,0.0021632388628730847,25,COMPLETE
368,0.0003812928043771535,2025-07-12 23:12:48.853198,2025-07-12 23:13:42.985035,0 days 00:00:54.131837,identity,32,47,0.0021906792699309375,24,COMPLETE
369,0.000359160389052704,2025-07-12 23:13:42.985752,2025-07-12 23:14:28.834029,0 days 00:00:45.848277,identity,32,100,0.002307249846713182,24,COMPLETE
370,0.00033601661561988294,2025-07-12 23:14:28.834769,2025-07-12 23:15:19.323410,0 days 00:00:50.488641,identity,32,111,0.003045871198062979,25,COMPLETE
371,0.0003372193896211684,2025-07-12 23:15:19.324131,2025-07-12 23:15:45.595070,0 days 00:00:26.270939,identity,128,95,0.002730780458761988,25,COMPLETE
372,0.0003507426881697029,2025-07-12 23:15:45.595796,2025-07-12 23:16:33.694866,0 days 00:00:48.099070,identity,32,103,0.002452504635841313,24,COMPLETE
373,0.0003331894113216549,2025-07-12 23:16:33.695614,2025-07-12 23:17:25.023143,0 days 00:00:51.327529,identity,32,97,0.0020105397483347136,25,COMPLETE
374,0.0003254553594160825,2025-07-12 23:17:25.023874,2025-07-12 23:18:13.610970,0 days 00:00:48.587096,identity,32,106,0.0019078404426632995,24,COMPLETE
375,0.0003465593617875129,2025-07-12 23:18:13.611681,2025-07-12 23:18:59.435878,0 days 00:00:45.824197,identity,32,98,0.0017748033501506016,24,COMPLETE
376,0.00038234193925745785,2025-07-12 23:18:59.436635,2025-07-12 23:19:50.064853,0 days 00:00:50.628218,identity,32,101,0.0023852880496171977,25,COMPLETE
377,0.00032369367545470595,2025-07-12 23:19:50.065616,2025-07-12 23:20:36.397747,0 days 00:00:46.332131,identity,32,109,0.0015921070686665212,23,COMPLETE
378,0.0003411494835745543,2025-07-12 23:20:36.398454,2025-07-12 23:21:24.128481,0 days 00:00:47.730027,identity,32,94,0.0014966648500815275,24,COMPLETE
379,0.00036732445005327463,2025-07-12 23:21:24.129244,2025-07-12 23:22:12.988492,0 days 00:00:48.859248,identity,32,99,0.0020408347309438116,25,COMPLETE
380,0.0003530787362251431,2025-07-12 23:22:12.989267,2025-07-12 23:23:02.250438,0 days 00:00:49.261171,identity,32,105,0.00169820609922639,24,COMPLETE
381,0.00037120896740816534,2025-07-12 23:23:02.251159,2025-07-12 23:23:49.027742,0 days 00:00:46.776583,identity,32,92,0.0014651596413208328,24,COMPLETE
382,0.00034029458765871823,2025-07-12 23:23:49.028523,2025-07-12 23:24:35.988459,0 days 00:00:46.959936,identity,32,96,0.0012999620105721783,25,COMPLETE
383,0.0003453657845966518,2025-07-12 23:24:35.989229,2025-07-12 23:25:08.016955,0 days 00:00:32.027726,identity,64,103,0.0025789515575151173,23,COMPLETE
384,1.7192953824996948,2025-07-12 23:25:08.017711,2025-07-12 23:25:56.185912,0 days 00:00:48.168201,relu,32,87,0.0015983352501200098,24,COMPLETE
385,0.0003286135906819254,2025-07-12 23:25:56.186649,2025-07-12 23:26:44.852566,0 days 00:00:48.665917,identity,32,90,0.001382017314980704,25,COMPLETE
386,0.0003434591053519398,2025-07-12 23:26:44.853317,2025-07-12 23:27:33.046685,0 days 00:00:48.193368,identity,32,101,0.0018677437085952374,24,COMPLETE
387,0.0003466331691015512,2025-07-12 23:27:33.047421,2025-07-12 23:28:18.282903,0 days 00:00:45.235482,identity,32,94,0.0012471395548728009,23,COMPLETE
388,0.00031014170963317156,2025-07-12 23:28:18.283627,2025-07-12 23:29:10.867195,0 days 00:00:52.583568,identity,32,107,0.0014989345508615816,25,COMPLETE
389,0.00034662146936170757,2025-07-12 23:29:10.867979,2025-07-12 23:30:01.801889,0 days 00:00:50.933910,identity,32,106,0.001814196087363435,25,COMPLETE
390,0.00032214217935688794,2025-07-12 23:30:01.802651,2025-07-12 23:30:54.638968,0 days 00:00:52.836317,identity,32,107,0.0015642628651519126,25,COMPLETE
391,0.00031708573806099594,2025-07-12 23:30:54.639728,2025-07-12 23:31:43.027011,0 days 00:00:48.387283,identity,32,98,0.0022671347445054825,25,COMPLETE
392,0.00036464029108174145,2025-07-12 23:31:43.027800,2025-07-12 23:32:06.210835,0 days 00:00:23.183035,identity,128,97,0.002364463039037615,25,COMPLETE
393,0.0003499535087030381,2025-07-12 23:32:06.211593,2025-07-12 23:32:55.234970,0 days 00:00:49.023377,identity,32,99,0.0030517403653600246,25,COMPLETE
394,0.0003548972017597407,2025-07-12 23:32:55.235736,2025-07-12 23:33:43.190870,0 days 00:00:47.955134,identity,32,96,0.0021451962218073653,25,COMPLETE
395,0.00043141847709193826,2025-07-12 23:33:43.191617,2025-07-12 23:34:04.232178,0 days 00:00:21.040561,identity,32,93,0.0024775716464401757,6,COMPLETE
396,0.0003087451041210443,2025-07-12 23:34:04.232872,2025-07-12 23:34:53.082777,0 days 00:00:48.849905,identity,32,99,0.0017209027045866727,25,COMPLETE
397,0.0004059716302435845,2025-07-12 23:34:53.083568,2025-07-12 23:35:21.281592,0 days 00:00:28.198024,identity,32,98,0.0020274598255740134,11,COMPLETE
398,0.0003341688134241849,2025-07-12 23:35:21.282348,2025-07-12 23:36:12.801999,0 days 00:00:51.519651,identity,32,95,0.0017509291469874702,25,COMPLETE
399,0.0005583542515523732,2025-07-12 23:36:12.802793,2025-07-12 23:37:22.423317,0 days 00:01:09.620524,identity,16,63,0.0019468132454545288,25,COMPLETE
400,0.0003321981930639595,2025-07-12 23:37:22.424285,2025-07-12 23:38:11.115848,0 days 00:00:48.691563,identity,32,89,0.002211956942567838,25,COMPLETE
401,0.0003280261589679867,2025-07-12 23:38:11.116649,2025-07-12 23:39:00.017270,0 days 00:00:48.900621,identity,32,92,0.0016837648464710009,25,COMPLETE
402,0.000325448956573382,2025-07-12 23:39:00.018035,2025-07-12 23:39:48.104474,0 days 00:00:48.086439,identity,32,100,0.0019163697600766126,25,COMPLETE
403,0.0003330546896904707,2025-07-12 23:39:48.105230,2025-07-12 23:40:34.676737,0 days 00:00:46.571507,identity,32,96,0.0015812234529503613,25,COMPLETE
404,0.00034699856769293547,2025-07-12 23:40:34.677515,2025-07-12 23:41:24.660977,0 days 00:00:49.983462,identity,32,102,0.002042773984324615,25,COMPLETE
405,1.7180771827697754,2025-07-12 23:41:24.661730,2025-07-12 23:42:13.300872,0 days 00:00:48.639142,relu,32,98,0.0023521180949138023,25,COMPLETE
406,0.00032398771145381033,2025-07-12 23:42:13.301648,2025-07-12 23:43:04.012287,0 days 00:00:50.710639,identity,32,93,0.0017368703006843211,25,COMPLETE
407,0.0003637814079411328,2025-07-12 23:43:04.013036,2025-07-12 23:43:51.794100,0 days 00:00:47.781064,identity,32,83,0.002687047541039071,25,COMPLETE
408,0.0003726319409906864,2025-07-12 23:43:51.794892,2025-07-12 23:44:26.515976,0 days 00:00:34.721084,identity,64,95,0.0014603176293454163,24,COMPLETE
409,0.000339303573127836,2025-07-12 23:44:26.516743,2025-07-12 23:45:15.293810,0 days 00:00:48.777067,identity,32,89,0.0018182759858792693,24,COMPLETE
410,0.0003905259654857218,2025-07-12 23:45:15.294568,2025-07-12 23:46:02.919099,0 days 00:00:47.624531,identity,32,102,0.002247965497145216,24,COMPLETE
411,0.0003655723121482879,2025-07-12 23:46:02.919848,2025-07-12 23:46:51.641710,0 days 00:00:48.721862,identity,32,99,0.0015826354824609974,25,COMPLETE
412,0.00034509095712564886,2025-07-12 23:46:51.642460,2025-07-12 23:47:37.922243,0 days 00:00:46.279783,identity,32,92,0.001398062618544755,24,COMPLETE
413,0.00033676077146083117,2025-07-12 23:47:37.923029,2025-07-12 23:48:27.150419,0 days 00:00:49.227390,identity,32,97,0.002036016369941871,25,COMPLETE
414,0.0003419932327233255,2025-07-12 23:48:27.151220,2025-07-12 23:49:22.329460,0 days 00:00:55.178240,identity,32,52,0.0016944945094961676,25,COMPLETE
415,0.000330200680764392,2025-07-12 23:49:22.330226,2025-07-12 23:50:09.693705,0 days 00:00:47.363479,identity,32,94,0.00141228508112354,24,COMPLETE
416,0.0003359011607244611,2025-07-12 23:50:09.694495,2025-07-12 23:50:57.749054,0 days 00:00:48.054559,identity,32,59,0.0015368830659676933,25,COMPLETE
417,0.0003266266721766442,2025-07-12 23:50:57.749998,2025-07-12 23:51:27.866530,0 days 00:00:30.116532,identity,128,87,0.0013200370946166255,24,COMPLETE
418,0.00034050014801323414,2025-07-12 23:51:27.867213,2025-07-12 23:52:15.836351,0 days 00:00:47.969138,identity,32,103,0.001871076192251987,24,COMPLETE
419,0.00032727100187912583,2025-07-12 23:52:15.837081,2025-07-12 23:53:06.181603,0 days 00:00:50.344522,identity,32,91,0.0016729392826257917,25,COMPLETE
420,0.0003191154100932181,2025-07-12 23:53:06.182388,2025-07-12 23:53:51.810832,0 days 00:00:45.628444,identity,32,100,0.0022379386036250905,24,COMPLETE
421,0.00036697793984785676,2025-07-12 23:53:51.811588,2025-07-12 23:54:39.756375,0 days 00:00:47.944787,identity,32,100,0.002476888159223148,25,COMPLETE
422,0.0003474992699921131,2025-07-12 23:54:39.757162,2025-07-12 23:55:30.173369,0 days 00:00:50.416207,identity,32,103,0.0026215796251850094,25,COMPLETE
423,0.0003961323818657547,2025-07-12 23:55:30.174144,2025-07-12 23:57:20.359840,0 days 00:01:50.185696,identity,16,104,0.002260257281598091,24,COMPLETE
424,0.00032319972524419427,2025-07-12 23:57:20.360793,2025-07-12 23:58:09.121758,0 days 00:00:48.760965,relu,32,100,0.002122363886974116,25,COMPLETE
425,0.0003670425503514707,2025-07-12 23:58:09.122549,2025-07-12 23:58:55.159736,0 days 00:00:46.037187,identity,32,85,0.002838529626479068,24,COMPLETE
426,0.00033247246756218374,2025-07-12 23:58:55.160513,2025-07-12 23:59:43.014636,0 days 00:00:47.854123,identity,32,109,0.0019846966103422964,24,COMPLETE
427,0.0003602179349400103,2025-07-12 23:59:43.015394,2025-07-13 00:00:34.771066,0 days 00:00:51.755672,identity,32,79,0.0022585253373414824,25,COMPLETE
428,0.00036547635681927204,2025-07-13 00:00:34.771857,2025-07-13 00:01:20.541431,0 days 00:00:45.769574,identity,32,98,0.0018966224878798387,24,COMPLETE
429,0.000356914330041036,2025-07-13 00:01:20.542239,2025-07-13 00:02:11.972566,0 days 00:00:51.430327,identity,32,105,0.0017402921646065205,25,COMPLETE
430,0.0003387434990145266,2025-07-13 00:02:11.973335,2025-07-13 00:03:01.857848,0 days 00:00:49.884513,identity,32,128,0.0024213686051986127,25,COMPLETE
