number,value,datetime_start,datetime_complete,duration,params_activation,params_batch_size,params_h,params_lr,params_seq_length,state
0,0.00041041389340534806,2025-07-12 18:35:51.299418,2025-07-12 18:36:21.869587,0 days 00:00:30.570169,identity,32,34,0.008364273112221807,19,COMPLETE
1,0.006136469077318907,2025-07-12 18:36:21.870486,2025-07-12 18:36:30.104172,0 days 00:00:08.233686,identity,128,32,0.00027650106668370274,10,COMPLETE
2,0.000346652464941144,2025-07-12 18:36:30.104678,2025-07-12 18:37:02.170530,0 days 00:00:32.065852,identity,64,68,0.00381333122381037,24,COMPLETE
3,0.00036176215508021414,2025-07-12 18:37:02.171334,2025-07-12 18:37:36.545607,0 days 00:00:34.374273,identity,32,107,0.0026194218581004347,14,COMPLETE
4,0.0027984874323010445,2025-07-12 18:37:36.546350,2025-07-12 18:38:38.973188,0 days 00:01:02.426838,identity,16,25,0.0022991133830733276,24,COMPLETE
5,1.6742475032806396,2025-07-12 18:38:38.974006,2025-07-12 18:39:48.386148,0 days 00:01:09.412142,relu,16,107,0.007763104611135861,9,COMPLETE
6,0.0005098857218399644,2025-07-12 18:39:48.386949,2025-07-12 18:40:10.584237,0 days 00:00:22.197288,relu,32,124,0.0004973225584603664,6,COMPLETE
7,0.0014336659805849195,2025-07-12 18:40:10.584692,2025-07-12 18:40:24.861103,0 days 00:00:14.276411,identity,128,20,0.003051464618918349,23,COMPLETE
8,0.0003383413713891059,2025-07-12 18:40:24.861605,2025-07-12 18:41:18.886129,0 days 00:00:54.024524,relu,32,48,0.0009309693544186097,25,COMPLETE
9,1.7157435417175293,2025-07-12 18:41:18.886705,2025-07-12 18:42:11.188821,0 days 00:00:52.302116,relu,16,29,0.0016565521164216485,19,COMPLETE
10,0.0024370490573346615,2025-07-12 18:42:11.189421,2025-07-12 18:42:34.447029,0 days 00:00:23.257608,relu,64,61,0.00011425292760786632,18,COMPLETE
11,0.0007924010860733688,2025-07-12 18:42:34.447632,2025-07-12 18:43:04.298621,0 days 00:00:29.850989,relu,64,66,0.0007944436806534923,25,COMPLETE
12,0.0004316223203204572,2025-07-12 18:43:04.299124,2025-07-12 18:43:29.108598,0 days 00:00:24.809474,identity,64,56,0.0010822672895076909,22,COMPLETE
13,1.7041062116622925,2025-07-12 18:43:29.109113,2025-07-12 18:43:59.657141,0 days 00:00:30.548028,relu,32,81,0.004496264599420091,15,COMPLETE
14,0.0009300259407609701,2025-07-12 18:43:59.657722,2025-07-12 18:44:26.431686,0 days 00:00:26.773964,relu,64,82,0.0003231533999271854,21,COMPLETE
15,0.0008172247326001525,2025-07-12 18:44:26.432188,2025-07-12 18:44:51.818149,0 days 00:00:25.385961,identity,64,47,0.001135335695225859,25,COMPLETE
16,0.00035295315319672227,2025-07-12 18:44:51.818642,2025-07-12 18:45:22.656085,0 days 00:00:30.837443,relu,32,82,0.0006230194935778928,15,COMPLETE
17,0.0028386893682181835,2025-07-12 18:45:22.656705,2025-07-12 18:45:35.729909,0 days 00:00:13.073204,identity,128,11,0.003911677785835654,20,COMPLETE
18,0.0004899828927591443,2025-07-12 18:45:35.730389,2025-07-12 18:45:57.181734,0 days 00:00:21.451345,identity,64,47,0.001715068047120883,17,COMPLETE
19,1.7199455499649048,2025-07-12 18:45:57.182208,2025-07-12 18:46:40.335314,0 days 00:00:43.153106,relu,32,98,0.005402749133929767,22,COMPLETE
20,0.001712098834104836,2025-07-12 18:46:40.335886,2025-07-12 18:46:57.235978,0 days 00:00:16.900092,identity,64,48,0.00012319746163794065,13,COMPLETE
21,1.6851037740707397,2025-07-12 18:46:57.236484,2025-07-12 18:47:22.778657,0 days 00:00:25.542173,relu,32,80,0.0005974487354519022,11,COMPLETE
22,1.6493552923202515,2025-07-12 18:47:22.779141,2025-07-12 18:47:41.989421,0 days 00:00:19.210280,relu,32,74,0.0003353397172202391,5,COMPLETE
23,1.7113302946090698,2025-07-12 18:47:41.989910,2025-07-12 18:48:17.217470,0 days 00:00:35.227560,relu,32,92,0.0006675167834550048,17,COMPLETE
24,1.7199456691741943,2025-07-12 18:48:17.218048,2025-07-12 18:49:00.811234,0 days 00:00:43.593186,relu,32,70,0.0013301396273771831,23,COMPLETE
25,0.000494747597258538,2025-07-12 18:49:00.811832,2025-07-12 18:49:24.566966,0 days 00:00:23.755134,relu,32,89,0.00045947818985740154,8,COMPLETE
26,0.00467859348282218,2025-07-12 18:49:24.567408,2025-07-12 18:49:41.432053,0 days 00:00:16.864645,relu,128,57,0.0001913393131671324,25,COMPLETE
27,0.0005270242691040039,2025-07-12 18:49:41.432577,2025-07-12 18:50:24.497721,0 days 00:00:43.065144,relu,16,38,0.000779401127639591,12,COMPLETE
28,0.0003731634933501482,2025-07-12 18:50:24.498307,2025-07-12 18:50:57.201460,0 days 00:00:32.703153,identity,32,71,0.0018878186976899643,16,COMPLETE
29,0.0004887913237325847,2025-07-12 18:50:57.202061,2025-07-12 18:51:48.406088,0 days 00:00:51.204027,identity,32,40,0.008857194942078756,21,COMPLETE
30,1.7162741422653198,2025-07-12 18:51:48.406699,2025-07-12 18:52:12.695597,0 days 00:00:24.288898,relu,64,61,0.0009113355953074119,19,COMPLETE
31,0.0004489495768211782,2025-07-12 18:52:12.696208,2025-07-12 18:52:45.286959,0 days 00:00:32.590751,identity,32,101,0.0026821370901836017,14,COMPLETE
32,0.000570559233892709,2025-07-12 18:52:45.287406,2025-07-12 18:53:19.114312,0 days 00:00:33.826906,identity,32,115,0.005107911210688286,14,COMPLETE
33,0.0004122326208744198,2025-07-12 18:53:19.114916,2025-07-12 18:53:56.493884,0 days 00:00:37.378968,identity,32,125,0.003121071335580851,15,COMPLETE
34,0.0004044927773065865,2025-07-12 18:53:56.494470,2025-07-12 18:54:25.385531,0 days 00:00:28.891061,identity,32,112,0.0024234784906081402,12,COMPLETE
35,0.00041093677282333374,2025-07-12 18:54:25.386016,2025-07-12 18:55:22.394465,0 days 00:00:57.008449,identity,16,93,0.0060241626402868995,9,COMPLETE
36,0.000349523063050583,2025-07-12 18:55:22.395094,2025-07-12 18:55:40.671855,0 days 00:00:18.276761,identity,128,106,0.0013108318593533354,16,COMPLETE
37,0.0009116881410591304,2025-07-12 18:55:40.672357,2025-07-12 18:56:02.087158,0 days 00:00:21.414801,identity,128,86,0.0004626638543511148,23,COMPLETE
38,0.0003675465704873204,2025-07-12 18:56:02.087784,2025-07-12 18:56:22.448698,0 days 00:00:20.360914,identity,128,76,0.001503325433901487,24,COMPLETE
39,0.0015008108457550406,2025-07-12 18:56:22.449193,2025-07-12 18:56:44.490486,0 days 00:00:22.041293,relu,128,105,0.00021503906696276572,20,COMPLETE
40,0.0005555032985284925,2025-07-12 18:56:44.491035,2025-07-12 18:57:04.091840,0 days 00:00:19.600805,identity,128,119,0.0005754038429035802,16,COMPLETE
41,0.0005128681077621877,2025-07-12 18:57:04.092452,2025-07-12 18:58:17.452273,0 days 00:01:13.359821,identity,16,98,0.0018820301461141154,13,COMPLETE
42,0.00038415074232034385,2025-07-12 18:58:17.453092,2025-07-12 18:58:55.651943,0 days 00:00:38.198851,identity,32,108,0.0035201210544738037,18,COMPLETE
43,0.00038085461710579693,2025-07-12 18:58:55.652538,2025-07-12 18:59:09.683717,0 days 00:00:14.031179,identity,128,119,0.0012008761469138624,10,COMPLETE
44,1.662611484527588,2025-07-12 18:59:09.684116,2025-07-12 18:59:22.132120,0 days 00:00:12.448004,relu,64,66,0.0009313834854325049,7,COMPLETE
45,0.00035779643803834915,2025-07-12 18:59:22.132586,2025-07-12 18:59:46.689478,0 days 00:00:24.556892,identity,32,23,0.002070915243268122,15,COMPLETE
46,0.0009578110184520483,2025-07-12 18:59:46.690007,2025-07-12 19:00:18.696219,0 days 00:00:32.006212,identity,32,21,0.00138843888779483,24,COMPLETE
47,0.002413048641756177,2025-07-12 19:00:18.696812,2025-07-12 19:00:34.578631,0 days 00:00:15.881819,identity,64,13,0.0020221788348004912,18,COMPLETE
48,0.002245483687147498,2025-07-12 19:00:34.579135,2025-07-12 19:00:44.533363,0 days 00:00:09.954228,relu,128,32,0.0007573059637341343,16,COMPLETE
49,0.0003621129726525396,2025-07-12 19:00:44.533754,2025-07-12 19:01:07.655941,0 days 00:00:23.122187,identity,32,27,0.0073247453403642955,13,COMPLETE
50,0.0009190382552333176,2025-07-12 19:01:07.656448,2025-07-12 19:01:32.624441,0 days 00:00:24.967993,relu,64,55,0.0010086509631006236,22,COMPLETE
51,0.00037570865242742,2025-07-12 19:01:32.625062,2025-07-12 19:02:10.854372,0 days 00:00:38.229310,identity,32,51,0.0022377123396918057,14,COMPLETE
52,0.0003441827720962465,2025-07-12 19:02:10.854871,2025-07-12 19:02:50.915194,0 days 00:00:40.060323,identity,32,41,0.004247387857675196,15,COMPLETE
53,0.0003559902834240347,2025-07-12 19:02:50.915817,2025-07-12 19:03:32.184318,0 days 00:00:41.268501,identity,32,41,0.004250808663059069,17,COMPLETE
54,0.000362113059964031,2025-07-12 19:03:32.184940,2025-07-12 19:04:15.017209,0 days 00:00:42.832269,identity,32,41,0.003951175284035179,17,COMPLETE
55,0.0003269868902862072,2025-07-12 19:04:15.017830,2025-07-12 19:04:44.311078,0 days 00:00:29.293248,identity,32,35,0.006854433129792502,18,COMPLETE
56,1.7180771827697754,2025-07-12 19:04:44.311554,2025-07-12 19:05:49.926249,0 days 00:01:05.614695,relu,16,35,0.007105227287078332,25,COMPLETE
57,0.00042103559826500714,2025-07-12 19:05:49.927076,2025-07-12 19:06:36.509741,0 days 00:00:46.582665,identity,32,50,0.009140033417597036,20,COMPLETE
58,0.0012589336838573217,2025-07-12 19:06:36.510382,2025-07-12 19:06:55.232459,0 days 00:00:18.722077,relu,64,16,0.0058975369429758685,24,COMPLETE
59,0.0007198185194283724,2025-07-12 19:06:55.232935,2025-07-12 19:07:41.946924,0 days 00:00:46.713989,identity,32,63,0.00037789037431706105,19,COMPLETE
60,0.0003532263799570501,2025-07-12 19:07:41.947542,2025-07-12 19:07:55.796606,0 days 00:00:13.849064,relu,128,43,0.004774835553059049,16,COMPLETE
61,1.707970380783081,2025-07-12 19:07:55.797176,2025-07-12 19:08:08.497798,0 days 00:00:12.700622,relu,128,44,0.005045410935189573,16,COMPLETE
62,0.0004949532449245453,2025-07-12 19:08:08.498205,2025-07-12 19:08:19.277049,0 days 00:00:10.778844,relu,128,36,0.003115493491021271,15,COMPLETE
63,1.7113302946090698,2025-07-12 19:08:19.277491,2025-07-12 19:08:30.045175,0 days 00:00:10.767684,relu,128,29,0.007053121426988856,17,COMPLETE
64,0.0004014387959614396,2025-07-12 19:08:30.045565,2025-07-12 19:08:41.304960,0 days 00:00:11.259395,relu,128,54,0.004621597208916169,12,COMPLETE
65,0.00035358540480956435,2025-07-12 19:08:41.305520,2025-07-12 19:09:18.953258,0 days 00:00:37.647738,relu,32,44,0.006172072336963146,15,COMPLETE
66,1.7140681743621826,2025-07-12 19:09:18.953873,2025-07-12 19:09:42.639694,0 days 00:00:23.685821,relu,64,61,0.009689616088335053,18,COMPLETE
67,0.0008994378731586039,2025-07-12 19:09:42.640186,2025-07-12 19:09:57.520708,0 days 00:00:14.880522,identity,128,78,0.000709496777991694,16,COMPLETE
68,0.0003569207328837365,2025-07-12 19:09:57.521263,2025-07-12 19:10:29.243904,0 days 00:00:31.722641,relu,32,32,0.0028016172567309886,23,COMPLETE
69,0.0003776454832404852,2025-07-12 19:10:29.244358,2025-07-12 19:11:10.800868,0 days 00:00:41.556510,identity,32,83,0.0005388709333796395,21,COMPLETE
70,1.6998299360275269,2025-07-12 19:11:10.801512,2025-07-12 19:12:00.766871,0 days 00:00:49.965359,relu,16,72,0.003603925737102496,14,COMPLETE
71,1.7041062116622925,2025-07-12 19:12:00.767506,2025-07-12 19:12:56.852850,0 days 00:00:56.085344,relu,32,42,0.0057329139039582954,15,COMPLETE
72,1.6951563358306885,2025-07-12 19:12:56.853492,2025-07-12 19:13:28.125800,0 days 00:00:31.272308,relu,32,58,0.008281273485778045,13,COMPLETE
73,1.6998299360275269,2025-07-12 19:13:28.126274,2025-07-12 19:14:04.692564,0 days 00:00:36.566290,relu,32,46,0.0065491264630517364,14,COMPLETE
74,1.7041062116622925,2025-07-12 19:14:04.693182,2025-07-12 19:14:45.982595,0 days 00:00:41.289413,relu,32,50,0.005039511582592332,15,COMPLETE
75,1.707970380783081,2025-07-12 19:14:45.983248,2025-07-12 19:15:23.310116,0 days 00:00:37.326868,relu,32,128,0.0045679841953407425,16,COMPLETE
76,0.0004739084397442639,2025-07-12 19:15:23.310733,2025-07-12 19:15:36.836286,0 days 00:00:13.525553,identity,128,38,0.003498601259210543,19,COMPLETE
77,0.0009546043584123254,2025-07-12 19:15:36.836858,2025-07-12 19:15:58.556586,0 days 00:00:21.719728,relu,64,47,0.000662856744331309,18,COMPLETE
78,0.00045955373207107186,2025-07-12 19:15:58.557053,2025-07-12 19:16:38.599402,0 days 00:00:40.042349,identity,32,44,0.006373417887958096,17,COMPLETE
79,0.00038962700637057424,2025-07-12 19:16:38.600005,2025-07-12 19:17:23.843079,0 days 00:00:45.243074,identity,32,67,0.007632951948191592,25,COMPLETE
80,0.0003525779175106436,2025-07-12 19:17:23.843730,2025-07-12 19:17:35.689281,0 days 00:00:11.845551,relu,128,52,0.004173651226020766,14,COMPLETE
81,0.0013955495087429881,2025-07-12 19:17:35.689870,2025-07-12 19:17:46.929228,0 days 00:00:11.239358,relu,128,38,0.0008568356305540896,14,COMPLETE
82,1.7041062116622925,2025-07-12 19:17:46.929622,2025-07-12 19:17:59.935900,0 days 00:00:13.006278,relu,128,54,0.0039849102260900065,15,COMPLETE
83,0.0003715550701599568,2025-07-12 19:17:59.936379,2025-07-12 19:18:10.628002,0 days 00:00:10.691623,relu,128,64,0.005568864215118382,12,COMPLETE
84,0.002530141966417432,2025-07-12 19:18:10.628398,2025-07-12 19:18:21.464895,0 days 00:00:10.836497,relu,128,33,0.0004159048687523371,16,COMPLETE
85,1.6951563358306885,2025-07-12 19:18:21.465431,2025-07-12 19:18:33.131783,0 days 00:00:11.666352,relu,128,58,0.004773809060253607,13,COMPLETE
86,0.0003440109430812299,2025-07-12 19:18:33.132196,2025-07-12 19:19:12.194094,0 days 00:00:39.061898,identity,32,51,0.0012297548329754362,14,COMPLETE
87,0.0007954190368764102,2025-07-12 19:19:12.194700,2025-07-12 19:19:30.183059,0 days 00:00:17.988359,identity,64,50,0.0010702045396370366,14,COMPLETE
88,0.0003115423023700714,2025-07-12 19:19:30.183544,2025-07-12 19:20:22.970422,0 days 00:00:52.786878,identity,32,53,0.001594544448159989,24,COMPLETE
89,0.0003495088021736592,2025-07-12 19:20:22.971041,2025-07-12 19:21:06.378398,0 days 00:00:43.407357,identity,32,96,0.0015825114607570336,23,COMPLETE
90,0.00032577794627286494,2025-07-12 19:21:06.379057,2025-07-12 19:21:51.584821,0 days 00:00:45.205764,identity,32,97,0.001287773093088062,23,COMPLETE
91,0.00035489528090693057,2025-07-12 19:21:51.585453,2025-07-12 19:22:36.224245,0 days 00:00:44.638792,identity,32,100,0.0015916426862826211,23,COMPLETE
92,0.00034879788290709257,2025-07-12 19:22:36.224850,2025-07-12 19:23:22.077780,0 days 00:00:45.852930,identity,32,104,0.0012352316182550243,24,COMPLETE
93,0.0003565762599464506,2025-07-12 19:23:22.078406,2025-07-12 19:24:08.002308,0 days 00:00:45.923902,identity,32,104,0.001449982713838175,24,COMPLETE
94,0.00033856797381304204,2025-07-12 19:24:08.002931,2025-07-12 19:24:49.346799,0 days 00:00:41.343868,identity,32,96,0.001287700608335434,22,COMPLETE
95,0.00032139819813892245,2025-07-12 19:24:49.347364,2025-07-12 19:25:34.276912,0 days 00:00:44.929548,identity,32,92,0.0012158916113811304,23,COMPLETE
96,0.00033083598827943206,2025-07-12 19:25:34.277541,2025-07-12 19:26:21.424427,0 days 00:00:47.146886,identity,32,92,0.0012409801972397044,24,COMPLETE
97,0.0003598081530071795,2025-07-12 19:26:21.425082,2025-07-12 19:27:05.317369,0 days 00:00:43.892287,identity,32,91,0.0011613393112285503,22,COMPLETE
98,0.000360508740413934,2025-07-12 19:27:05.318010,2025-07-12 19:27:53.742555,0 days 00:00:48.424545,identity,32,85,0.000979081916426329,25,COMPLETE
99,0.00034445305936969817,2025-07-12 19:27:53.743209,2025-07-12 19:28:34.174963,0 days 00:00:40.431754,identity,32,86,0.0008180724394439557,21,COMPLETE
100,0.0003511154791340232,2025-07-12 19:28:34.175600,2025-07-12 19:29:15.073429,0 days 00:00:40.897829,identity,32,88,0.0017785456251929008,22,COMPLETE
101,0.00032968222512863576,2025-07-12 19:29:15.074065,2025-07-12 19:29:58.867316,0 days 00:00:43.793251,identity,32,95,0.0008715627146052628,21,COMPLETE
102,0.00034501883783377707,2025-07-12 19:29:58.867943,2025-07-12 19:30:42.632919,0 days 00:00:43.764976,identity,32,95,0.0010306824462855046,21,COMPLETE
103,0.0003503917541820556,2025-07-12 19:30:42.633552,2025-07-12 19:31:25.267789,0 days 00:00:42.634237,identity,32,90,0.0007813205290035868,22,COMPLETE
104,0.0003763284767046571,2025-07-12 19:31:25.268419,2025-07-12 19:32:03.465239,0 days 00:00:38.196820,identity,32,96,0.0008603341830784297,20,COMPLETE
105,0.0003244706313125789,2025-07-12 19:32:03.465860,2025-07-12 19:32:50.328877,0 days 00:00:46.863017,identity,32,93,0.0012528319926302567,23,COMPLETE
106,0.00031879462767392397,2025-07-12 19:32:50.329524,2025-07-12 19:33:36.811653,0 days 00:00:46.482129,identity,32,101,0.0011009774542225963,23,COMPLETE
107,0.0003269152657594532,2025-07-12 19:33:36.812281,2025-07-12 19:34:21.189679,0 days 00:00:44.377398,identity,32,100,0.0012913615699758885,23,COMPLETE
108,0.0003337059752084315,2025-07-12 19:34:21.190307,2025-07-12 19:35:08.173789,0 days 00:00:46.983482,identity,32,110,0.0013342883005953705,23,COMPLETE
109,0.0003381774586159736,2025-07-12 19:35:08.174413,2025-07-12 19:35:52.972868,0 days 00:00:44.798455,identity,32,112,0.0013934848412815806,23,COMPLETE
110,0.00031939425389282405,2025-07-12 19:35:52.973486,2025-07-12 19:36:40.056106,0 days 00:00:47.082620,identity,32,110,0.0014426401250089062,23,COMPLETE
111,0.0003382388676982373,2025-07-12 19:36:40.056741,2025-07-12 19:37:27.020183,0 days 00:00:46.963442,identity,32,110,0.0014094219703884357,23,COMPLETE
112,0.0003525960200931877,2025-07-12 19:37:27.020804,2025-07-12 19:38:16.011223,0 days 00:00:48.990419,identity,32,113,0.0011238208885869785,24,COMPLETE
113,0.0003276712086517364,2025-07-12 19:38:16.011855,2025-07-12 19:39:04.863393,0 days 00:00:48.851538,identity,32,118,0.0017649233957908366,23,COMPLETE
114,0.0003517975565046072,2025-07-12 19:39:04.864200,2025-07-12 19:39:53.042427,0 days 00:00:48.178227,identity,32,115,0.0017429870658746637,23,COMPLETE
115,0.00035672361264005303,2025-07-12 19:39:53.043057,2025-07-12 19:40:41.774224,0 days 00:00:48.731167,identity,32,101,0.002155602313824101,24,COMPLETE
116,0.00034972152207046747,2025-07-12 19:40:41.774884,2025-07-12 19:41:30.440506,0 days 00:00:48.665622,identity,32,119,0.0009318126775762153,22,COMPLETE
117,0.00030663885991089046,2025-07-12 19:41:30.441059,2025-07-12 19:42:19.754341,0 days 00:00:49.313282,identity,32,103,0.0019565099890295795,24,COMPLETE
118,0.00033338283537887037,2025-07-12 19:42:19.754992,2025-07-12 19:43:08.325807,0 days 00:00:48.570815,identity,32,93,0.002373847180465118,24,COMPLETE
119,0.00030937991687096655,2025-07-12 19:43:08.326486,2025-07-12 19:43:59.117784,0 days 00:00:50.791298,identity,32,102,0.0015914071451248889,25,COMPLETE
120,0.00042112634400837123,2025-07-12 19:43:59.118460,2025-07-12 19:46:01.251754,0 days 00:02:02.133294,identity,16,103,0.0020258465095538483,25,COMPLETE
121,0.00034741751733236015,2025-07-12 19:46:01.252604,2025-07-12 19:46:47.889425,0 days 00:00:46.636821,identity,32,100,0.0015401232556631732,24,COMPLETE
122,0.000347387685906142,2025-07-12 19:46:47.890062,2025-07-12 19:47:41.391363,0 days 00:00:53.501301,identity,32,107,0.0018707922221832607,25,COMPLETE
123,0.0003493462281767279,2025-07-12 19:47:41.392006,2025-07-12 19:48:26.231189,0 days 00:00:44.839183,identity,32,98,0.0016529035495328884,23,COMPLETE
124,0.0003475150151643902,2025-07-12 19:48:26.231819,2025-07-12 19:49:11.338786,0 days 00:00:45.106967,identity,32,102,0.0010365576862482048,22,COMPLETE
125,0.0003506953071337193,2025-07-12 19:49:11.339417,2025-07-12 19:50:03.070281,0 days 00:00:51.730864,identity,32,106,0.00114308561154407,25,COMPLETE
126,0.00036967822234146297,2025-07-12 19:50:03.070931,2025-07-12 19:50:51.806468,0 days 00:00:48.735537,identity,32,94,0.0014745992884333254,24,COMPLETE
127,0.0003707314608618617,2025-07-12 19:50:51.807093,2025-07-12 19:51:43.924846,0 days 00:00:52.117753,identity,32,122,0.0012678350420244182,23,COMPLETE
128,0.00035377900348976254,2025-07-12 19:51:43.925471,2025-07-12 19:52:28.065005,0 days 00:00:44.139534,identity,32,98,0.002529784361496215,21,COMPLETE
129,0.00031373623642139137,2025-07-12 19:52:28.065627,2025-07-12 19:53:27.890481,0 days 00:00:59.824854,identity,32,89,0.00187025603531103,24,COMPLETE
130,0.000332940457155928,2025-07-12 19:53:27.891163,2025-07-12 19:54:14.481724,0 days 00:00:46.590561,identity,32,115,0.001833839142518721,22,COMPLETE
131,0.00034615586628206074,2025-07-12 19:54:14.482358,2025-07-12 19:55:02.459224,0 days 00:00:47.976866,identity,32,89,0.0016212592347960748,24,COMPLETE
132,0.0003474786935839802,2025-07-12 19:55:02.459901,2025-07-12 19:55:49.732159,0 days 00:00:47.272258,identity,32,99,0.001338778431877049,24,COMPLETE
133,0.00032745779026299715,2025-07-12 19:55:49.732810,2025-07-12 19:56:34.502484,0 days 00:00:44.769674,identity,32,92,0.0011754237545421624,23,COMPLETE
134,0.0003319535462651402,2025-07-12 19:56:34.503156,2025-07-12 19:57:21.771289,0 days 00:00:47.268133,identity,32,109,0.001082883702946465,23,COMPLETE
135,0.0003434097161516547,2025-07-12 19:57:21.771924,2025-07-12 19:58:08.113089,0 days 00:00:46.341165,identity,32,102,0.001922798846046527,23,COMPLETE
136,0.00034788771881721914,2025-07-12 19:58:08.113740,2025-07-12 19:58:54.745246,0 days 00:00:46.631506,identity,32,88,0.002799124939868317,25,COMPLETE
137,0.00034812791272997856,2025-07-12 19:58:54.745902,2025-07-12 19:59:36.833143,0 days 00:00:42.087241,identity,32,80,0.0009325410528676046,22,COMPLETE
138,0.00034779938869178295,2025-07-12 19:59:36.833802,2025-07-12 20:00:22.657031,0 days 00:00:45.823229,identity,32,94,0.0022149198264316077,23,COMPLETE
139,0.0005153106758370996,2025-07-12 20:00:22.657664,2025-07-12 20:02:06.116306,0 days 00:01:43.458642,identity,16,84,0.0014923378109826958,24,COMPLETE
140,0.0003377788816578686,2025-07-12 20:02:06.117229,2025-07-12 20:02:50.905658,0 days 00:00:44.788429,identity,32,97,0.0016854296052949019,23,COMPLETE
141,0.00031459354795515537,2025-07-12 20:02:50.906333,2025-07-12 20:03:39.336630,0 days 00:00:48.430297,identity,32,91,0.001172757641987717,24,COMPLETE
142,0.00031239184318110347,2025-07-12 20:03:39.337277,2025-07-12 20:04:27.980830,0 days 00:00:48.643553,identity,32,91,0.0011922068616387032,24,COMPLETE
143,0.00032083498081192374,2025-07-12 20:04:27.981523,2025-07-12 20:05:18.533576,0 days 00:00:50.552053,identity,32,91,0.001179267432573727,25,COMPLETE
144,0.00035520282108336687,2025-07-12 20:05:18.534260,2025-07-12 20:06:07.687761,0 days 00:00:49.153501,identity,32,90,0.0011664308372973473,25,COMPLETE
