number,value,datetime_start,datetime_complete,duration,params_activation,params_batch_size,params_h,params_lr,params_seq_length,state
145,0.00036183290649205446,2025-07-12 20:06:07.688454,2025-07-12 20:06:56.517194,0 days 00:00:48.828740,identity,32,92,0.0009753258506080906,25,COMPLETE
146,0.0003506308130454272,2025-07-12 20:06:56.517879,2025-07-12 20:07:44.843197,0 days 00:00:48.325318,identity,32,87,0.0013525837708417779,24,COMPLETE
147,0.0003420352004468441,2025-07-12 20:07:44.843886,2025-07-12 20:08:30.866980,0 days 00:00:46.023094,identity,32,81,0.0011235728104348464,25,COMPLETE
148,0.00034406103077344596,2025-07-12 20:08:30.867643,2025-07-12 20:09:19.422420,0 days 00:00:48.554777,identity,32,91,0.001233869487732535,24,COMPLETE
149,0.0003268757136538625,2025-07-12 20:09:19.422949,2025-07-12 20:10:08.705952,0 days 00:00:49.283003,identity,32,106,0.001539000999871491,24,COMPLETE
150,0.0003463244065642357,2025-07-12 20:10:08.706593,2025-07-12 20:10:56.576895,0 days 00:00:47.870302,identity,32,104,0.0014977571577388772,25,COMPLETE
151,0.00037506927037611604,2025-07-12 20:10:56.577544,2025-07-12 20:11:47.823050,0 days 00:00:51.245506,identity,32,107,0.0010783668358256455,24,COMPLETE
152,0.0003345354925841093,2025-07-12 20:11:47.823693,2025-07-12 20:12:35.076167,0 days 00:00:47.252474,identity,32,99,0.0013551129759757942,24,COMPLETE
153,0.00031930344994179904,2025-07-12 20:12:35.076860,2025-07-12 20:13:21.575815,0 days 00:00:46.498955,identity,32,101,0.0012092865039300723,23,COMPLETE
154,0.00033113884273916483,2025-07-12 20:13:21.576472,2025-07-12 20:14:12.390200,0 days 00:00:50.813728,identity,32,101,0.001530679470105048,25,COMPLETE
155,0.0003223246312700212,2025-07-12 20:14:12.390858,2025-07-12 20:14:58.187089,0 days 00:00:45.796231,identity,32,104,0.0010030529154178593,24,COMPLETE
156,0.0003341398842167109,2025-07-12 20:14:58.187730,2025-07-12 20:15:47.544746,0 days 00:00:49.357016,identity,32,106,0.0010305583206588666,24,COMPLETE
157,0.0003535236173775047,2025-07-12 20:15:47.545390,2025-07-12 20:16:31.968099,0 days 00:00:44.422709,identity,32,104,0.002001740438826991,23,COMPLETE
158,0.00032463142997585237,2025-07-12 20:16:31.968751,2025-07-12 20:17:21.466275,0 days 00:00:49.497524,identity,32,111,0.001263728148949768,24,COMPLETE
159,0.0003723199188243598,2025-07-12 20:17:21.466926,2025-07-12 20:18:11.505489,0 days 00:00:50.038563,identity,32,109,0.00166980183415148,25,COMPLETE
160,0.0003485756169538945,2025-07-12 20:18:11.506133,2025-07-12 20:18:58.478609,0 days 00:00:46.972476,identity,32,97,0.0014245027940671714,24,COMPLETE
161,0.0003444536996539682,2025-07-12 20:18:58.479292,2025-07-12 20:19:44.857417,0 days 00:00:46.378125,identity,32,102,0.0012658306396007542,23,COMPLETE
162,0.00034011213574558496,2025-07-12 20:19:44.858057,2025-07-12 20:20:33.273072,0 days 00:00:48.415015,identity,32,110,0.001190361939490849,24,COMPLETE
163,0.0003193168085999787,2025-07-12 20:20:33.273729,2025-07-12 20:21:23.441988,0 days 00:00:50.168259,identity,32,105,0.000983464409690351,24,COMPLETE
164,0.00036824936978518963,2025-07-12 20:21:23.442642,2025-07-12 20:22:13.942051,0 days 00:00:50.499409,identity,32,113,0.0009543017563194817,25,COMPLETE
165,0.00036392323090694845,2025-07-12 20:22:13.942684,2025-07-12 20:23:03.334914,0 days 00:00:49.392230,identity,32,106,0.0010523042648245648,24,COMPLETE
166,0.00033028057077899575,2025-07-12 20:23:03.335562,2025-07-12 20:23:55.407672,0 days 00:00:52.072110,identity,32,95,0.0007143087148977374,25,COMPLETE
167,0.00033987234928645194,2025-07-12 20:23:55.408365,2025-07-12 20:24:39.793793,0 days 00:00:44.385428,identity,32,108,0.0008689172822070434,22,COMPLETE
168,0.0003587830869946629,2025-07-12 20:24:39.794473,2025-07-12 20:25:26.029322,0 days 00:00:46.234849,identity,32,112,0.0014624585594136584,24,COMPLETE
169,0.0003333879285492003,2025-07-12 20:25:26.030013,2025-07-12 20:26:10.415827,0 days 00:00:44.385814,identity,32,104,0.001615098860100856,23,COMPLETE
170,0.00032306963112205267,2025-07-12 20:26:10.416505,2025-07-12 20:28:40.648499,0 days 00:02:30.231994,identity,16,99,0.0011091832412726257,24,COMPLETE
171,0.00034202804090455174,2025-07-12 20:28:40.649374,2025-07-12 20:29:27.440986,0 days 00:00:46.791612,identity,32,98,0.0011350034021204631,24,COMPLETE
172,0.0003849986242130399,2025-07-12 20:29:27.441651,2025-07-12 20:31:20.366008,0 days 00:01:52.924357,identity,16,100,0.00013862380290685704,24,COMPLETE
173,0.00038843409856781363,2025-07-12 20:31:20.366915,2025-07-12 20:33:18.057317,0 days 00:01:57.690402,identity,16,105,0.000984979420973118,24,COMPLETE
174,0.0003527815861161798,2025-07-12 20:33:18.058210,2025-07-12 20:35:04.515331,0 days 00:01:46.457121,identity,16,93,0.0013288501437569227,23,COMPLETE
175,0.0003807334287557751,2025-07-12 20:35:04.516232,2025-07-12 20:37:03.249072,0 days 00:01:58.732840,identity,16,102,0.001201130942671443,25,COMPLETE
176,0.0003303073171991855,2025-07-12 20:37:03.249923,2025-07-12 20:38:54.561187,0 days 00:01:51.311264,identity,16,95,0.0018072453519697733,24,COMPLETE
177,0.00035169991315342486,2025-07-12 20:38:54.562087,2025-07-12 20:39:41.602680,0 days 00:00:47.040593,identity,32,116,0.001071794160980688,23,COMPLETE
178,0.00033108971547335386,2025-07-12 20:39:41.603351,2025-07-12 20:40:31.435268,0 days 00:00:49.831917,identity,32,87,0.0014256279493359187,25,COMPLETE
179,0.00034148109261877835,2025-07-12 20:40:31.435958,2025-07-12 20:41:14.676635,0 days 00:00:43.240677,identity,32,76,0.0009182339501589879,24,COMPLETE
180,0.00034267015871591866,2025-07-12 20:41:14.677332,2025-07-12 20:41:59.218135,0 days 00:00:44.540803,identity,32,98,0.0013130953937725703,23,COMPLETE
181,0.00032829391420818865,2025-07-12 20:41:59.218811,2025-07-12 20:42:43.569673,0 days 00:00:44.350862,identity,32,100,0.0012682053567140382,23,COMPLETE
182,0.00033752850140444934,2025-07-12 20:42:43.570329,2025-07-12 20:43:29.690172,0 days 00:00:46.119843,identity,32,103,0.0015770636777787375,22,COMPLETE
183,0.0003463159955572337,2025-07-12 20:43:29.690832,2025-07-12 20:44:15.232724,0 days 00:00:45.541892,identity,32,108,0.0011643524496411457,23,COMPLETE
184,0.00035883719101548195,2025-07-12 20:44:15.233377,2025-07-12 20:45:05.347131,0 days 00:00:50.113754,identity,32,89,0.0010277300755294095,24,COMPLETE
185,0.0003168887342326343,2025-07-12 20:45:05.347828,2025-07-12 20:45:52.425774,0 days 00:00:47.077946,identity,32,96,0.001393968388791574,25,COMPLETE
186,0.00036787762655876577,2025-07-12 20:45:52.426479,2025-07-12 20:46:42.806818,0 days 00:00:50.380339,identity,32,94,0.001526992636148631,25,COMPLETE
187,0.0007329075015150011,2025-07-12 20:46:42.807525,2025-07-12 20:47:17.363610,0 days 00:00:34.556085,identity,64,90,0.0007957028649969052,25,COMPLETE
188,0.0003180510248057544,2025-07-12 20:47:17.364292,2025-07-12 20:48:04.393361,0 days 00:00:47.029069,identity,32,97,0.0013921209124963707,24,COMPLETE
189,0.00031477308948524296,2025-07-12 20:48:04.394062,2025-07-12 20:48:54.040981,0 days 00:00:49.646919,identity,32,97,0.0013533694862844226,25,COMPLETE
190,0.000344793894328177,2025-07-12 20:48:54.041673,2025-07-12 20:49:41.227184,0 days 00:00:47.185511,identity,32,96,0.0011111892549740582,25,COMPLETE
191,0.0003431350050959736,2025-07-12 20:49:41.227881,2025-07-12 20:50:30.336177,0 days 00:00:49.108296,identity,32,92,0.0013457679399152393,25,COMPLETE
192,0.0003236373304389417,2025-07-12 20:50:30.336853,2025-07-12 20:51:17.465141,0 days 00:00:47.128288,identity,32,97,0.0012256003313789012,24,COMPLETE
193,0.0005528838373720646,2025-07-12 20:51:17.465831,2025-07-12 20:51:37.075110,0 days 00:00:19.609279,identity,32,99,0.0011770900189198518,5,COMPLETE
194,0.00036744773387908936,2025-07-12 20:51:37.075788,2025-07-12 20:52:25.324581,0 days 00:00:48.248793,identity,32,94,0.001404289867164939,24,COMPLETE
195,0.0003490807139314711,2025-07-12 20:52:25.325283,2025-07-12 20:53:16.060750,0 days 00:00:50.735467,identity,32,102,0.0009765201915140568,25,COMPLETE
196,0.0003451044613029808,2025-07-12 20:53:16.061468,2025-07-12 20:54:03.221143,0 days 00:00:47.159675,identity,32,97,0.0017548528046336888,24,COMPLETE
197,0.00033194487332366407,2025-07-12 20:54:03.221842,2025-07-12 20:54:51.865259,0 days 00:00:48.643417,identity,32,91,0.001222865269442004,24,COMPLETE
198,0.00034568432602100074,2025-07-12 20:54:51.865961,2025-07-12 20:55:42.900563,0 days 00:00:51.034602,identity,32,101,0.0010576766441234525,25,COMPLETE
199,0.000331936840666458,2025-07-12 20:55:42.901227,2025-07-12 20:57:25.318724,0 days 00:01:42.417497,identity,16,84,0.001962570486990499,24,COMPLETE
200,0.00032484118128195405,2025-07-12 20:57:25.319626,2025-07-12 20:58:12.540310,0 days 00:00:47.220684,identity,32,96,0.0013408751460804325,25,COMPLETE
201,0.0003168366674799472,2025-07-12 20:58:12.541016,2025-07-12 20:59:00.141791,0 days 00:00:47.600775,identity,32,96,0.0014573327577628052,25,COMPLETE
202,0.00035757359000854194,2025-07-12 20:59:00.142491,2025-07-12 20:59:52.425330,0 days 00:00:52.282839,identity,32,93,0.001437574469632026,25,COMPLETE
203,0.00035191321512684226,2025-07-12 20:59:52.426026,2025-07-12 21:00:39.899592,0 days 00:00:47.473566,identity,32,99,0.0016750120719151958,24,COMPLETE
204,0.0003292332112323493,2025-07-12 21:00:39.900254,2025-07-12 21:01:24.962503,0 days 00:00:45.062249,identity,32,96,0.0011475566745763194,24,COMPLETE
205,0.0003345606382936239,2025-07-12 21:01:24.963210,2025-07-12 21:02:12.922510,0 days 00:00:47.959300,identity,32,104,0.0012781029241846422,25,COMPLETE
206,0.00032717257272452116,2025-07-12 21:02:12.923210,2025-07-12 21:03:00.829647,0 days 00:00:47.906437,identity,32,89,0.0014232791672903573,24,COMPLETE
207,0.00032145832665264606,2025-07-12 21:03:00.830346,2025-07-12 21:03:54.270694,0 days 00:00:53.440348,identity,32,111,0.001603096188395532,25,COMPLETE
208,0.00036079928395338356,2025-07-12 21:03:54.271362,2025-07-12 21:04:53.083835,0 days 00:00:58.812473,identity,32,93,0.002074617082547898,25,COMPLETE
209,0.0003607278922572732,2025-07-12 21:04:53.084550,2025-07-12 21:05:44.532908,0 days 00:00:51.448358,identity,32,98,0.0016721272136745549,25,COMPLETE
210,0.004530482459813356,2025-07-12 21:05:44.533797,2025-07-12 21:06:15.296760,0 days 00:00:30.762963,identity,32,8,0.0017965589585743956,25,COMPLETE
211,0.0003445511974859983,2025-07-12 21:06:15.297369,2025-07-12 21:07:06.107368,0 days 00:00:50.809999,identity,32,109,0.0015492836855540073,24,COMPLETE
212,0.0003396618994884193,2025-07-12 21:07:06.108028,2025-07-12 21:07:55.129893,0 days 00:00:49.021865,identity,32,112,0.0012290088484978204,24,COMPLETE
213,0.00034744778531603515,2025-07-12 21:07:55.130564,2025-07-12 21:08:45.692309,0 days 00:00:50.561745,identity,32,101,0.0010533023705019226,24,COMPLETE
214,0.00032720225863158703,2025-07-12 21:08:45.693007,2025-07-12 21:09:39.046519,0 days 00:00:53.353512,identity,32,105,0.0014362032451047384,25,COMPLETE
215,0.00033768246066756546,2025-07-12 21:09:39.047227,2025-07-12 21:10:26.776059,0 days 00:00:47.728832,identity,32,95,0.0012409433190583403,23,COMPLETE
216,0.0003168762195855379,2025-07-12 21:10:26.776759,2025-07-12 21:11:19.628680,0 days 00:00:52.851921,identity,32,111,0.0008970842958680529,25,COMPLETE
217,0.0003374871448613703,2025-07-12 21:11:19.629322,2025-07-12 21:12:32.252697,0 days 00:01:12.623375,identity,32,87,0.0008990819984829437,25,COMPLETE
218,0.00035557561204768717,2025-07-12 21:12:32.253597,2025-07-12 21:13:24.969426,0 days 00:00:52.715829,identity,32,102,0.0008569782474808134,25,COMPLETE
219,0.00034793937811627984,2025-07-12 21:13:24.970142,2025-07-12 21:14:44.031931,0 days 00:01:19.061789,identity,32,91,0.002322905910769089,25,COMPLETE
220,0.0003846948384307325,2025-07-12 21:14:44.032860,2025-07-12 21:17:11.567340,0 days 00:02:27.534480,identity,16,99,0.0009860364350718408,24,COMPLETE
221,0.000351209775544703,2025-07-12 21:17:11.568252,2025-07-12 21:18:03.098012,0 days 00:00:51.529760,identity,32,111,0.0011124137551807463,24,COMPLETE
222,0.00034774522646330297,2025-07-12 21:18:03.098697,2025-07-12 21:18:53.783486,0 days 00:00:50.684789,identity,32,115,0.001368658117046015,23,COMPLETE
223,0.0003237350902054459,2025-07-12 21:18:53.784171,2025-07-12 21:19:47.750972,0 days 00:00:53.966801,identity,32,107,0.0011260247509745898,25,COMPLETE
224,0.00033775210613384843,2025-07-12 21:19:47.751718,2025-07-12 21:20:41.602207,0 days 00:00:53.850489,identity,32,107,0.001118281199729839,25,COMPLETE
225,0.00034829447395168245,2025-07-12 21:20:41.602956,2025-07-12 21:21:34.744767,0 days 00:00:53.141811,identity,32,105,0.0009744189239167168,25,COMPLETE
226,0.00036638183519244194,2025-07-12 21:21:34.745509,2025-07-12 21:22:09.117421,0 days 00:00:34.371912,identity,64,108,0.001597685627577252,25,COMPLETE
227,0.00033536343835294247,2025-07-12 21:22:09.118138,2025-07-12 21:23:02.221916,0 days 00:00:53.103778,identity,32,103,0.0011749148167130132,25,COMPLETE
228,0.000349079113220796,2025-07-12 21:23:02.222652,2025-07-12 21:23:49.677379,0 days 00:00:47.454727,identity,32,70,0.0018792154459072476,24,COMPLETE
229,0.0003485654015094042,2025-07-12 21:23:49.678126,2025-07-12 21:24:33.662744,0 days 00:00:43.984618,identity,32,96,0.0014685664119085712,23,COMPLETE
230,0.00033426174195483327,2025-07-12 21:24:33.663487,2025-07-12 21:25:22.930127,0 days 00:00:49.266640,identity,32,100,0.0010503635433142336,24,COMPLETE
231,0.00031677656807005405,2025-07-12 21:25:22.930878,2025-07-12 21:26:11.776214,0 days 00:00:48.845336,identity,32,93,0.0013194512925488874,24,COMPLETE
232,0.00033602846087887883,2025-07-12 21:26:11.776974,2025-07-12 21:27:00.572815,0 days 00:00:48.795841,identity,32,93,0.0013664604921077269,24,COMPLETE
233,0.0003294562338851392,2025-07-12 21:27:00.573558,2025-07-12 21:27:50.422655,0 days 00:00:49.849097,identity,32,90,0.001262785055240131,25,COMPLETE
234,0.0003663072129711509,2025-07-12 21:27:50.423393,2025-07-12 21:28:39.851601,0 days 00:00:49.428208,identity,32,97,0.0011536367600686972,24,COMPLETE
235,0.0003619919007178396,2025-07-12 21:28:39.852308,2025-07-12 21:29:26.419569,0 days 00:00:46.567261,identity,32,94,0.0015559083521750749,23,COMPLETE
236,0.0003597485483624041,2025-07-12 21:29:26.420251,2025-07-12 21:30:17.537723,0 days 00:00:51.117472,identity,32,98,0.0013005069166836505,25,COMPLETE
237,0.0004289866774342954,2025-07-12 21:30:17.538432,2025-07-12 21:30:44.787518,0 days 00:00:27.249086,identity,32,106,0.001106722155517581,9,COMPLETE
238,0.00034165021497756243,2025-07-12 21:30:44.788136,2025-07-12 21:31:35.287702,0 days 00:00:50.499566,identity,32,101,0.0009078034679175745,24,COMPLETE
239,0.0003402316360734403,2025-07-12 21:31:35.288397,2025-07-12 21:32:23.366279,0 days 00:00:48.077882,identity,32,91,0.0017155535051882622,24,COMPLETE
240,0.0003440704895183444,2025-07-12 21:32:23.366993,2025-07-12 21:33:07.215550,0 days 00:00:43.848557,identity,32,88,0.0014111784483162202,23,COMPLETE
241,0.00039178706356324255,2025-07-12 21:33:07.216252,2025-07-12 21:33:37.542893,0 days 00:00:30.326641,identity,32,112,0.0012429869027749678,11,COMPLETE
242,0.0003390396886970848,2025-07-12 21:33:37.543533,2025-07-12 21:34:28.653921,0 days 00:00:51.110388,identity,32,109,0.001214299894377445,24,COMPLETE
243,0.00037901458563283086,2025-07-12 21:34:28.654593,2025-07-12 21:35:21.331064,0 days 00:00:52.676471,identity,32,110,0.0013366103159095897,25,COMPLETE
244,0.00034257120569236577,2025-07-12 21:35:21.331715,2025-07-12 21:36:13.139526,0 days 00:00:51.807811,identity,32,113,0.0010059706221260286,24,COMPLETE
245,0.0003165417874697596,2025-07-12 21:36:13.140210,2025-07-12 21:37:06.176981,0 days 00:00:53.036771,identity,32,103,0.0015604381918680713,25,COMPLETE
246,0.0003357354726176709,2025-07-12 21:37:06.177684,2025-07-12 21:37:59.144440,0 days 00:00:52.966756,identity,32,103,0.001552844422686846,25,COMPLETE
247,0.0003744069254025817,2025-07-12 21:37:59.145143,2025-07-12 21:40:00.413411,0 days 00:02:01.268268,identity,16,95,0.0017360871654157413,25,COMPLETE
248,0.0003294292255304754,2025-07-12 21:40:00.414335,2025-07-12 21:40:51.708336,0 days 00:00:51.294001,identity,32,100,0.0014818870544865666,25,COMPLETE
249,0.00031149276765063405,2025-07-12 21:40:51.709043,2025-07-12 21:41:42.456523,0 days 00:00:50.747480,identity,32,104,0.002003637385733985,25,COMPLETE
250,0.0003466540074441582,2025-07-12 21:41:42.457273,2025-07-12 21:42:33.201192,0 days 00:00:50.743919,identity,32,104,0.002047211392195126,25,COMPLETE
251,0.00032208909397013485,2025-07-12 21:42:33.201941,2025-07-12 21:43:26.099570,0 days 00:00:52.897629,identity,32,106,0.0020972661946374186,25,COMPLETE
252,0.00036624641506932676,2025-07-12 21:43:26.100303,2025-07-12 21:44:18.908453,0 days 00:00:52.808150,identity,32,102,0.002394014622281398,25,COMPLETE
253,0.0003173336444888264,2025-07-12 21:44:18.909214,2025-07-12 21:45:11.997984,0 days 00:00:53.088770,identity,32,105,0.002147265720710603,25,COMPLETE
254,0.00034857087302953005,2025-07-12 21:45:11.998752,2025-07-12 21:46:05.129723,0 days 00:00:53.130971,identity,32,105,0.001962098400822064,25,COMPLETE
255,0.00035534054040908813,2025-07-12 21:46:05.130448,2025-07-12 21:46:58.396446,0 days 00:00:53.265998,identity,32,106,0.0021432252291961255,25,COMPLETE
256,0.000372137816157192,2025-07-12 21:46:58.397208,2025-07-12 21:47:51.218052,0 days 00:00:52.820844,identity,32,103,0.002175616198696152,25,COMPLETE
257,0.000334241078235209,2025-07-12 21:47:51.218810,2025-07-12 21:48:25.519980,0 days 00:00:34.301170,identity,64,108,0.0026579300011509007,25,COMPLETE
258,0.0003378294059075415,2025-07-12 21:48:25.520669,2025-07-12 21:49:14.498750,0 days 00:00:48.978081,identity,32,100,0.002010875854695589,24,COMPLETE
259,0.0003513670526444912,2025-07-12 21:49:14.499493,2025-07-12 21:50:08.183075,0 days 00:00:53.683582,identity,32,107,0.001872475389342661,25,COMPLETE
260,0.0003373119398020208,2025-07-12 21:50:08.183774,2025-07-12 21:50:56.764666,0 days 00:00:48.580892,identity,32,104,0.002278371012738205,24,COMPLETE
261,0.0003409243654459715,2025-07-12 21:50:56.765346,2025-07-12 21:53:03.770513,0 days 00:02:07.005167,identity,16,101,0.0017994968395118579,25,COMPLETE
262,0.0003369379846844822,2025-07-12 21:53:03.771452,2025-07-12 21:53:49.849461,0 days 00:00:46.078009,identity,32,98,0.0016587379836700217,24,COMPLETE
263,0.0003596403985284269,2025-07-12 21:53:49.850170,2025-07-12 21:54:40.566525,0 days 00:00:50.716355,identity,32,103,0.0018884830333276478,25,COMPLETE
264,0.00036670922418124974,2025-07-12 21:54:40.567257,2025-07-12 21:55:29.216863,0 days 00:00:48.649606,identity,32,106,0.0016474933015887241,24,COMPLETE
265,0.0003755530051421374,2025-07-12 21:55:29.217545,2025-07-12 21:56:19.109194,0 days 00:00:49.891649,identity,32,110,0.0025138305874302666,25,COMPLETE
266,0.00034558254992589355,2025-07-12 21:56:19.109873,2025-07-12 21:57:08.785662,0 days 00:00:49.675789,identity,32,117,0.00078778757026092,24,COMPLETE
267,0.00034376600524410605,2025-07-12 21:57:08.786356,2025-07-12 21:57:57.810438,0 days 00:00:49.024082,identity,32,99,0.0015709084660453312,25,COMPLETE
268,0.0003465881454758346,2025-07-12 21:57:57.811178,2025-07-12 21:58:41.961972,0 days 00:00:44.150794,identity,32,85,0.002192236088842882,23,COMPLETE
269,0.0003611762367654592,2025-07-12 21:58:41.962712,2025-07-12 21:59:29.967152,0 days 00:00:48.004440,identity,32,93,0.0017943696363996364,24,COMPLETE
270,0.0003641688381321728,2025-07-12 21:59:29.967855,2025-07-12 22:00:17.740976,0 days 00:00:47.773121,identity,32,102,0.001528410530012289,24,COMPLETE
271,0.00035462272353470325,2025-07-12 22:00:17.741677,2025-07-12 22:01:04.489128,0 days 00:00:46.747451,identity,32,96,0.0014174866362000453,25,COMPLETE
272,0.0003307787992525846,2025-07-12 22:01:04.489869,2025-07-12 22:01:54.011110,0 days 00:00:49.521241,identity,32,105,0.0019112178524108665,24,COMPLETE
273,0.0003893122193403542,2025-07-12 22:01:54.011797,2025-07-12 22:03:36.493320,0 days 00:01:42.481523,identity,16,114,0.0017079250637645398,22,COMPLETE
274,0.0003364427248016,2025-07-12 22:03:36.494266,2025-07-12 22:04:24.567745,0 days 00:00:48.073479,identity,32,100,0.0013981537374064832,25,COMPLETE
275,0.0003532773698680103,2025-07-12 22:04:24.568471,2025-07-12 22:05:12.709569,0 days 00:00:48.141098,identity,32,109,0.0009266497806552634,24,COMPLETE
276,0.00031947612296789885,2025-07-12 22:05:12.710244,2025-07-12 22:05:58.799169,0 days 00:00:46.088925,identity,32,91,0.001060113032213956,23,COMPLETE
277,0.0003273471666034311,2025-07-12 22:05:58.799913,2025-07-12 22:06:40.568296,0 days 00:00:41.768383,identity,32,88,0.0019814877922736856,23,COMPLETE
278,0.000358434917870909,2025-07-12 22:06:40.569052,2025-07-12 22:07:26.402815,0 days 00:00:45.833763,identity,32,91,0.0008282916956114922,23,COMPLETE
279,0.00034190929727628827,2025-07-12 22:07:26.403558,2025-07-12 22:08:08.145718,0 days 00:00:41.742160,identity,32,92,0.0010135736792505957,22,COMPLETE
280,0.0003170445270370692,2025-07-12 22:08:08.146446,2025-07-12 22:08:52.629631,0 days 00:00:44.483185,identity,32,90,0.0014919580343427318,23,COMPLETE
281,0.00032095800270326436,2025-07-12 22:08:52.630355,2025-07-12 22:09:38.530647,0 days 00:00:45.900292,identity,32,91,0.0014977992457246379,23,COMPLETE
282,0.0009086368372663856,2025-07-12 22:09:38.531405,2025-07-12 22:10:21.330271,0 days 00:00:42.798866,identity,32,89,0.000290761897573084,22,COMPLETE
283,0.00033005460863932967,2025-07-12 22:10:21.331025,2025-07-12 22:11:06.639476,0 days 00:00:45.308451,identity,32,87,0.0015369748306890093,23,COMPLETE
284,0.0003379768459126353,2025-07-12 22:11:06.640190,2025-07-12 22:11:50.600553,0 days 00:00:43.960363,identity,32,85,0.0013352322984505152,23,COMPLETE
285,0.0003786228771787137,2025-07-12 22:11:50.601259,2025-07-12 22:12:36.465220,0 days 00:00:45.863961,identity,32,91,0.001494283989691376,23,COMPLETE
286,0.0003068887162953615,2025-07-12 22:12:36.465926,2025-07-12 22:13:21.413813,0 days 00:00:44.947887,identity,32,95,0.0016480226538698305,22,COMPLETE
287,0.0004719055723398924,2025-07-12 22:13:21.414542,2025-07-12 22:13:51.148641,0 days 00:00:29.734099,identity,64,94,0.0013930732100704258,22,COMPLETE
