number,value,datetime_start,datetime_complete,duration,params_activation,params_and_operator,params_batch_size,params_lr,params_n_sets,params_shape,params_shuffle,params_weight_decay,state
349,8.883361442713067e-05,2025-07-10 22:56:56.028356,2025-07-10 22:57:01.846273,0 days 00:00:05.817917,identity,prod,128,0.008806023291960102,3,gaussian,False,0.00014996619569450085,COMPLETE
350,4.8270958359353244e-06,2025-07-10 22:57:01.846692,2025-07-10 22:57:30.231343,0 days 00:00:28.384651,relu,prod,16,0.009907093152959809,3,sigmoid,False,0.00013824506668528067,COMPLETE
351,3.6916710541845532e-06,2025-07-10 22:57:30.232043,2025-07-10 22:58:09.497672,0 days 00:00:39.265629,identity,prod,16,0.008774198697304237,9,gaussian,False,0.00017060811268704496,COMPLETE
352,0.002950673457235098,2025-07-10 22:58:09.498372,2025-07-10 22:58:52.488046,0 days 00:00:42.989674,identity,prod,16,0.008893690699763276,9,bell,False,0.00012548220938573496,COMPLETE
353,5.668027370120399e-06,2025-07-10 22:58:52.488752,2025-07-10 22:59:14.537084,0 days 00:00:22.048332,relu,prod,32,0.008570866381274222,9,gaussian,False,1.2678806750204392e-05,COMPLETE
354,4.5710676204180345e-06,2025-07-10 22:59:14.538080,2025-07-10 22:59:53.823545,0 days 00:00:39.285465,identity,prod,16,0.00902867514926423,9,gaussian,False,6.277900076336289e-05,COMPLETE
355,6.133851275080815e-05,2025-07-10 22:59:53.824237,2025-07-10 23:00:06.092841,0 days 00:00:12.268604,relu,prod,64,0.009967428406595744,9,gaussian,False,1.4686848050911979e-05,COMPLETE
356,0.0010352474637329578,2025-07-10 23:00:06.093531,2025-07-10 23:00:45.568222,0 days 00:00:39.474691,identity,prod,16,0.008170280338926807,9,gaussian,True,1.704602609572492e-05,COMPLETE
357,9.417565888725221e-05,2025-07-10 23:00:45.568914,2025-07-10 23:01:25.201602,0 days 00:00:39.632688,identity,prod,16,0.0007543544079869044,9,gaussian,False,2.3102092339025173e-05,COMPLETE
358,4.135655217396561e-06,2025-07-10 23:01:25.202297,2025-07-10 23:02:04.912568,0 days 00:00:39.710271,relu,prod,16,0.009245985211204552,9,gaussian,False,5.0354915537325015e-05,COMPLETE
359,4.442667432158487e-06,2025-07-10 23:02:04.913263,2025-07-10 23:02:36.478062,0 days 00:00:31.564799,identity,prod,16,0.008060712538206966,5,sigmoid,False,0.00016031248952855486,COMPLETE
360,0.236972376704216,2025-07-10 23:02:36.479096,2025-07-10 23:02:46.437017,0 days 00:00:09.957921,relu,prod,64,0.006847968876489381,4,gaussian,False,1.0015351069127294e-05,COMPLETE
361,0.00017419828509446234,2025-07-10 23:02:46.437692,2025-07-10 23:03:13.905836,0 days 00:00:27.468144,identity,prod,16,0.00016170194639281572,2,gaussian,False,0.00018548689080443445,COMPLETE
362,0.0016058539040386677,2025-07-10 23:03:13.906514,2025-07-10 23:03:33.048087,0 days 00:00:19.141573,identity,prod,32,0.0016071486826352245,6,gaussian,False,0.0001709740333120395,COMPLETE
363,4.0520103539165575e-06,2025-07-10 23:03:33.048772,2025-07-10 23:04:02.614481,0 days 00:00:29.565709,relu,prod,16,0.005842475398386679,3,gaussian,False,1.1744021234145713e-05,COMPLETE
364,0.00043182706576772034,2025-07-10 23:04:02.615184,2025-07-10 23:04:45.650695,0 days 00:00:43.035511,identity,prod,16,0.008450370390138498,9,bell,False,1.8833391732678414e-05,COMPLETE
365,3.805025926340022e-06,2025-07-10 23:04:45.651419,2025-07-10 23:05:20.237841,0 days 00:00:34.586422,relu,min,16,0.009953637944628963,7,gaussian,False,0.00015133133285580094,COMPLETE
366,4.162984623690136e-06,2025-07-10 23:05:20.238821,2025-07-10 23:05:54.944869,0 days 00:00:34.706048,relu,min,16,0.009909998879130816,7,gaussian,False,0.00013388062287722556,COMPLETE
367,0.00035345146898180246,2025-07-10 23:05:54.945603,2025-07-10 23:06:05.882280,0 days 00:00:10.936677,relu,min,64,0.009297324908234463,7,gaussian,False,0.0001455446714947132,COMPLETE
368,4.137027644901536e-06,2025-07-10 23:06:05.882795,2025-07-10 23:06:39.720533,0 days 00:00:33.837738,relu,prod,16,0.009927013541362995,6,sigmoid,True,0.00012095104468578058,COMPLETE
369,4.521485152508831e-06,2025-07-10 23:06:39.721158,2025-07-10 23:07:15.980364,0 days 00:00:36.259206,relu,min,16,0.009096397297151696,8,gaussian,False,3.0017859816653955e-05,COMPLETE
370,4.656926194002153e-06,2025-07-10 23:07:15.981066,2025-07-10 23:07:52.132754,0 days 00:00:36.151688,relu,min,16,0.008528227278660377,8,gaussian,False,1.539276722366337e-05,COMPLETE
371,4.009081749245524e-06,2025-07-10 23:07:52.133466,2025-07-10 23:08:11.674792,0 days 00:00:19.541326,relu,min,32,0.008060023581015933,7,gaussian,False,0.00019641430233688503,COMPLETE
372,4.0780691961117554e-06,2025-07-10 23:08:11.675316,2025-07-10 23:08:46.239470,0 days 00:00:34.564154,relu,min,16,0.00997656132694222,7,gaussian,False,0.0001593218650954079,COMPLETE
373,0.0001749442017171532,2025-07-10 23:08:46.240171,2025-07-10 23:08:55.877767,0 days 00:00:09.637596,relu,min,64,0.008954514248821084,4,gaussian,False,0.00018328378925720347,COMPLETE
374,0.4043927490711212,2025-07-10 23:08:55.878219,2025-07-10 23:09:02.379323,0 days 00:00:06.501104,relu,min,128,0.007629750037134322,6,gaussian,False,1.3512746719007622e-05,COMPLETE
375,3.88738817491685e-06,2025-07-10 23:09:02.379755,2025-07-10 23:09:40.424960,0 days 00:00:38.045205,relu,prod,16,0.005119735588325585,8,gaussian,False,0.00014890012740154075,COMPLETE
376,0.11915706843137741,2025-07-10 23:09:40.425686,2025-07-10 23:10:20.288403,0 days 00:00:39.862717,relu,prod,16,0.008450651348641564,7,bell,False,0.00017396110222671953,COMPLETE
377,6.18506055616308e-06,2025-07-10 23:10:20.289111,2025-07-10 23:10:59.231836,0 days 00:00:38.942725,relu,prod,16,0.006754572747888472,9,sigmoid,False,0.00023605056919709112,COMPLETE
378,0.0013160697417333722,2025-07-10 23:10:59.232572,2025-07-10 23:11:09.672547,0 days 00:00:10.439975,relu,prod,64,0.009202322317492212,5,gaussian,False,0.00010435635612406038,COMPLETE
379,4.049413746542996e-06,2025-07-10 23:11:09.673235,2025-07-10 23:11:38.859954,0 days 00:00:29.186719,identity,prod,16,0.007614369740267406,3,gaussian,False,1.0831864807474061e-05,COMPLETE
380,0.00020631906227208674,2025-07-10 23:11:38.860648,2025-07-10 23:12:08.601952,0 days 00:00:29.741304,relu,prod,16,0.00393755794541957,3,gaussian,True,1.6550819486629874e-05,COMPLETE
381,9.344552381662652e-06,2025-07-10 23:12:08.602669,2025-07-10 23:12:24.975300,0 days 00:00:16.372631,identity,prod,32,0.006492000872158928,3,gaussian,False,0.0002036148701579883,COMPLETE
382,3.88465878131683e-06,2025-07-10 23:12:24.975985,2025-07-10 23:12:52.472736,0 days 00:00:27.496751,identity,prod,16,0.008212065280312124,2,gaussian,False,0.00018941921551727977,COMPLETE
383,0.0010649830801412463,2025-07-10 23:12:52.473454,2025-07-10 23:13:22.155441,0 days 00:00:29.681987,relu,prod,16,0.0012982794644986683,3,gaussian,False,2.0811757014678537e-05,COMPLETE
384,0.07717171311378479,2025-07-10 23:13:22.156144,2025-07-10 23:13:32.962290,0 days 00:00:10.806146,identity,prod,64,0.009963456653542944,6,gaussian,False,1.2632027895309708e-05,COMPLETE
385,7.100970833562315e-05,2025-07-10 23:13:32.962960,2025-07-10 23:14:00.452666,0 days 00:00:27.489706,relu,min,16,0.0006479740817323383,3,sigmoid,False,1.4568371289693403e-05,COMPLETE
386,4.328690920374356e-06,2025-07-10 23:14:00.453322,2025-07-10 23:14:29.684537,0 days 00:00:29.231215,identity,prod,16,0.007093090987161289,3,gaussian,False,0.00013281389540988701,COMPLETE
387,4.120588528166991e-06,2025-07-10 23:14:29.685238,2025-07-10 23:14:59.276720,0 days 00:00:29.591482,relu,prod,16,0.00908529471653879,3,gaussian,False,0.00021938821818138032,COMPLETE
388,5.542983672057744e-06,2025-07-10 23:14:59.277249,2025-07-10 23:15:28.461591,0 days 00:00:29.184342,identity,prod,16,0.007614213420110277,3,gaussian,False,0.00016744044281891506,COMPLETE
389,0.013686957769095898,2025-07-10 23:15:28.462307,2025-07-10 23:15:41.626949,0 days 00:00:13.164642,identity,prod,64,0.005609075268857827,9,bell,False,0.00026478107078195225,COMPLETE
390,3.1160783692030236e-05,2025-07-10 23:15:41.627404,2025-07-10 23:15:59.134248,0 days 00:00:17.506844,relu,prod,32,0.004473739532694372,4,gaussian,False,2.6294641801441066e-05,COMPLETE
391,0.00010035890591097996,2025-07-10 23:15:59.134946,2025-07-10 23:16:28.384234,0 days 00:00:29.249288,identity,prod,16,0.00835268367330817,3,gaussian,True,0.00014934677388561628,COMPLETE
392,4.341284238762455e-06,2025-07-10 23:16:28.384957,2025-07-10 23:17:06.407501,0 days 00:00:38.022544,relu,prod,16,0.006348747038231612,8,gaussian,False,8.177173627623562e-05,COMPLETE
393,4.173034540144727e-06,2025-07-10 23:17:06.408206,2025-07-10 23:17:33.899544,0 days 00:00:27.491338,identity,prod,16,0.007094497918698674,2,gaussian,False,1.1699477672915297e-05,COMPLETE
394,4.188865204923786e-06,2025-07-10 23:17:33.900256,2025-07-10 23:18:02.369320,0 days 00:00:28.469064,relu,prod,16,0.009047853709849193,3,sigmoid,False,0.00016850204835531021,COMPLETE
395,0.002279063919559121,2025-07-10 23:18:02.370044,2025-07-10 23:18:12.700363,0 days 00:00:10.330319,identity,prod,64,0.0004774894748433007,5,gaussian,False,0.00019177815558821243,COMPLETE
396,3.907709924533265e-06,2025-07-10 23:18:12.701068,2025-07-10 23:18:41.951569,0 days 00:00:29.250501,identity,prod,16,0.007954627983620857,3,gaussian,False,0.00011850240974582872,COMPLETE
397,3.7341087590903044e-06,2025-07-10 23:18:41.952276,2025-07-10 23:19:11.592778,0 days 00:00:29.640502,relu,prod,16,0.005820818224892963,3,gaussian,False,3.679491683475649e-05,COMPLETE
398,0.06706380844116211,2025-07-10 23:19:11.593494,2025-07-10 23:19:17.466722,0 days 00:00:05.873228,relu,prod,128,0.005850436955749857,3,gaussian,False,3.516341143990592e-05,COMPLETE
399,3.898652721545659e-06,2025-07-10 23:19:17.467183,2025-07-10 23:19:46.708331,0 days 00:00:29.241148,identity,prod,16,0.005075068378228003,3,gaussian,False,1.8417478713508426e-05,COMPLETE
400,1.3225219249725342,2025-07-10 23:19:46.709042,2025-07-10 23:20:02.950023,0 days 00:00:16.240981,relu,min,32,0.0061168260710585416,3,gaussian,False,1.617230138255027e-05,COMPLETE
401,5.975323801976629e-06,2025-07-10 23:20:02.950481,2025-07-10 23:20:39.058125,0 days 00:00:36.107644,identity,prod,16,0.006764935708036544,7,gaussian,False,4.130679156957873e-05,COMPLETE
402,9.914069232763723e-05,2025-07-10 23:20:39.058863,2025-07-10 23:21:11.385923,0 days 00:00:32.327060,identity,prod,16,0.003562638780513787,3,bell,False,5.019935116410336e-05,COMPLETE
403,1.3225219249725342,2025-07-10 23:21:11.386646,2025-07-10 23:21:20.436761,0 days 00:00:09.050115,relu,prod,64,0.005496329229688749,2,gaussian,True,1.3214120873722484e-05,COMPLETE
404,4.134566097491188e-06,2025-07-10 23:21:20.437210,2025-07-10 23:21:58.916278,0 days 00:00:38.479068,identity,prod,16,0.009210322012990373,9,sigmoid,False,0.0001327075118930986,COMPLETE
405,4.036195150547428e-06,2025-07-10 23:21:58.917003,2025-07-10 23:22:30.139752,0 days 00:00:31.222749,relu,prod,16,0.00857617110884371,4,gaussian,False,1.3905339330055242e-05,COMPLETE
406,4.3194027057325e-06,2025-07-10 23:22:30.140500,2025-07-10 23:22:59.401684,0 days 00:00:29.261184,identity,prod,16,0.006148264517923942,3,gaussian,False,3.299796204030373e-05,COMPLETE
407,1.3225219249725342,2025-07-10 23:22:59.402385,2025-07-10 23:23:10.274008,0 days 00:00:10.871623,relu,prod,64,0.009897668564862197,6,gaussian,False,2.2197379148162533e-05,COMPLETE
408,4.244586762069957e-06,2025-07-10 23:23:10.274690,2025-07-10 23:23:39.438580,0 days 00:00:29.163890,identity,prod,16,0.007498437771166802,3,gaussian,False,1.0841054034657543e-05,COMPLETE
409,4.2998576645914e-06,2025-07-10 23:23:39.439315,2025-07-10 23:23:55.984156,0 days 00:00:16.544841,relu,prod,32,0.009992343237201851,3,gaussian,False,1.7781951092638312e-05,COMPLETE
410,4.0171003092837054e-06,2025-07-10 23:23:55.984851,2025-07-10 23:24:25.206446,0 days 00:00:29.221595,identity,prod,16,0.006747316920175515,3,gaussian,False,3.7226545428486155e-05,COMPLETE
411,5.103632247482892e-06,2025-07-10 23:24:25.207164,2025-07-10 23:25:03.010777,0 days 00:00:37.803613,identity,prod,16,0.008285123279422976,8,gaussian,False,0.0001548919816740273,COMPLETE
412,3.7777515444759047e-06,2025-07-10 23:25:03.011490,2025-07-10 23:25:30.453344,0 days 00:00:27.441854,relu,min,16,0.0077219374372657,3,sigmoid,False,1.471874375952467e-05,COMPLETE
413,4.485387307795463e-06,2025-07-10 23:25:30.454079,2025-07-10 23:25:57.872760,0 days 00:00:27.418681,relu,min,16,0.0029228221479734523,3,sigmoid,False,1.5091925192821332e-05,COMPLETE
414,0.00045172811951488256,2025-07-10 23:25:57.873421,2025-07-10 23:26:08.593882,0 days 00:00:10.720461,relu,min,64,0.00864080446437358,7,sigmoid,True,1.5961733693913406e-05,COMPLETE
415,4.388345587358344e-06,2025-07-10 23:26:08.594412,2025-07-10 23:26:34.534506,0 days 00:00:25.940094,relu,min,16,0.00800310360245722,2,sigmoid,False,1.4044852817010664e-05,COMPLETE
416,4.1670750761113595e-06,2025-07-10 23:26:34.535150,2025-07-10 23:27:02.023353,0 days 00:00:27.488203,relu,min,16,0.009296217380728701,3,sigmoid,False,1.1794441988906789e-05,COMPLETE
417,4.320816969993757e-06,2025-07-10 23:27:02.023918,2025-07-10 23:27:30.971331,0 days 00:00:28.947413,relu,min,16,0.007420835697866353,4,sigmoid,False,6.999452913452495e-05,COMPLETE
418,4.887119757768232e-06,2025-07-10 23:27:30.972061,2025-07-10 23:27:51.147430,0 days 00:00:20.175369,relu,min,32,0.008782786329230055,9,sigmoid,False,1.288747822160736e-05,COMPLETE
419,4.034176981804194e-06,2025-07-10 23:27:51.148039,2025-07-10 23:28:18.617915,0 days 00:00:27.469876,relu,min,16,0.007772346589646128,3,sigmoid,False,1.9388732176453823e-05,COMPLETE
420,4.125911800656468e-06,2025-07-10 23:28:18.618670,2025-07-10 23:28:27.562444,0 days 00:00:08.943774,relu,min,64,0.009146820762049684,3,sigmoid,False,1.5110074352459088e-05,COMPLETE
421,4.293724032322643e-06,2025-07-10 23:28:27.563060,2025-07-10 23:28:59.263659,0 days 00:00:31.700599,relu,min,16,0.007257759184425327,3,bell,False,1.7063027649901665e-05,COMPLETE
422,4.59308785139001e-06,2025-07-10 23:28:59.264251,2025-07-10 23:29:31.259721,0 days 00:00:31.995470,relu,prod,16,0.008214625632990358,5,sigmoid,False,9.623649965521146e-05,COMPLETE
423,8.29048003652133e-05,2025-07-10 23:29:31.260436,2025-07-10 23:29:37.130388,0 days 00:00:05.869952,relu,prod,128,0.00998286291755165,3,gaussian,False,1.2550934286435189e-05,COMPLETE
424,3.9944779928191565e-06,2025-07-10 23:29:37.130841,2025-07-10 23:30:06.767872,0 days 00:00:29.637031,relu,prod,16,0.006838227939325731,3,gaussian,False,2.8312768969992838e-05,COMPLETE
425,1.3225219249725342,2025-07-10 23:30:06.768609,2025-07-10 23:30:16.215712,0 days 00:00:09.447103,relu,prod,64,0.008584568991620014,3,gaussian,False,1.3577001927875957e-05,COMPLETE
426,4.134067694394616e-06,2025-07-10 23:30:16.216145,2025-07-10 23:30:51.392793,0 days 00:00:35.176648,relu,min,16,0.006160655413703739,8,sigmoid,True,4.636018065517425e-05,COMPLETE
427,9.43782288231887e-06,2025-07-10 23:30:51.393531,2025-07-10 23:31:22.657059,0 days 00:00:31.263528,relu,prod,16,0.007714255629078823,4,gaussian,False,1.5984555008647935e-05,COMPLETE
428,0.003191965166479349,2025-07-10 23:31:22.657701,2025-07-10 23:31:39.949181,0 days 00:00:17.291480,relu,prod,32,0.00477652326383243,2,bell,False,0.00014075827203296012,COMPLETE
429,5.293616140988888e-06,2025-07-10 23:31:39.949724,2025-07-10 23:32:09.148971,0 days 00:00:29.199247,identity,prod,16,0.009175053467708942,3,gaussian,False,0.00011028228951156979,COMPLETE
430,4.087020442966605e-06,2025-07-10 23:32:09.149710,2025-07-10 23:32:38.714596,0 days 00:00:29.564886,relu,prod,16,0.007157138336812134,3,gaussian,False,1.0017428838027073e-05,COMPLETE
431,0.0005698458990082145,2025-07-10 23:32:38.715330,2025-07-10 23:32:50.865327,0 days 00:00:12.149997,identity,prod,64,0.008121767396435728,9,gaussian,False,1.4317426240136596e-05,COMPLETE
432,6.523326646856731e-06,2025-07-10 23:32:50.866013,2025-07-10 23:33:19.993249,0 days 00:00:29.127236,identity,prod,16,0.005465193224181312,3,gaussian,False,0.00024137307806174687,COMPLETE
433,4.067812824359862e-06,2025-07-10 23:33:19.993987,2025-07-10 23:33:49.545605,0 days 00:00:29.551618,relu,prod,16,0.006703088037038976,3,gaussian,False,1.1682281954252773e-05,COMPLETE
434,4.1736361708899494e-06,2025-07-10 23:33:49.546345,2025-07-10 23:34:22.824903,0 days 00:00:33.278558,identity,prod,16,0.009060652068883518,6,sigmoid,False,1.7783218650910626e-05,COMPLETE
435,inf,2025-07-10 23:34:22.825634,2025-07-10 23:34:57.722643,0 days 00:00:34.897009,relu,prod,16,0.009988493098479207,6,gaussian,False,1.9822212082551412e-05,COMPLETE
436,0.0005301862838678062,2025-07-10 23:34:57.723370,2025-07-10 23:35:06.906592,0 days 00:00:09.183222,identity,min,64,0.007789411089486073,3,gaussian,False,0.00021695315219543698,COMPLETE
437,1.3225219249725342,2025-07-10 23:35:06.907232,2025-07-10 23:35:36.580934,0 days 00:00:29.673702,relu,prod,16,0.008517770935487496,3,gaussian,True,0.00012569095487146052,COMPLETE
438,3.0825718567939475e-05,2025-07-10 23:35:36.581488,2025-07-10 23:35:54.727288,0 days 00:00:18.145800,identity,prod,32,0.004284730049018415,5,gaussian,False,0.00015582407855994988,COMPLETE
439,4.184616955171805e-06,2025-07-10 23:35:54.727926,2025-07-10 23:36:24.255192,0 days 00:00:29.527266,relu,prod,16,0.0062634079441319206,3,gaussian,False,1.2220486393270236e-05,COMPLETE
440,0.00042976587428711355,2025-07-10 23:36:24.255756,2025-07-10 23:37:03.737050,0 days 00:00:39.481294,identity,prod,16,0.007377073936691746,7,bell,False,0.00014242073027315917,COMPLETE
441,1.0067156836157665e-05,2025-07-10 23:37:03.737777,2025-07-10 23:37:33.290934,0 days 00:00:29.553157,relu,prod,16,0.009125413303743338,3,gaussian,False,6.071633937567045e-05,COMPLETE
442,1.3042532373219728e-05,2025-07-10 23:37:33.291684,2025-07-10 23:37:41.828839,0 days 00:00:08.537155,identity,prod,64,0.008115878108872283,2,sigmoid,False,1.58362496982533e-05,COMPLETE
443,3.9132823985710274e-06,2025-07-10 23:37:41.829278,2025-07-10 23:38:13.101268,0 days 00:00:31.271990,relu,prod,16,0.006990833505122225,4,gaussian,False,0.0001803931373997522,COMPLETE
444,4.219060883769998e-06,2025-07-10 23:38:13.101991,2025-07-10 23:38:52.424284,0 days 00:00:39.322293,identity,prod,16,0.008588764618760828,9,gaussian,False,1.4522103298772162e-05,COMPLETE
445,4.475310106499819e-06,2025-07-10 23:38:52.425020,2025-07-10 23:39:21.104070,0 days 00:00:28.679050,relu,min,16,0.006339330220957489,3,gaussian,False,0.0002078389668444969,COMPLETE
446,8.136811629810836e-06,2025-07-10 23:39:21.104743,2025-07-10 23:39:37.503285,0 days 00:00:16.398542,identity,prod,32,0.007538074311833645,3,gaussian,False,1.0756842350826735e-05,COMPLETE
447,4.408628228702582e-06,2025-07-10 23:39:37.503834,2025-07-10 23:40:06.819714,0 days 00:00:29.315880,identity,prod,16,0.005680823797992584,3,gaussian,False,0.0003170682926546289,COMPLETE
448,0.003085413482040167,2025-07-10 23:40:06.820435,2025-07-10 23:40:13.781509,0 days 00:00:06.961074,relu,prod,128,0.009432984083520496,7,gaussian,True,0.000233862391483602,COMPLETE
449,0.016542891040444374,2025-07-10 23:40:13.781952,2025-07-10 23:40:25.236593,0 days 00:00:11.454641,identity,prod,64,0.00801881319146662,8,sigmoid,False,0.0002769389878430538,COMPLETE
450,3.897376245731721e-06,2025-07-10 23:40:25.237290,2025-07-10 23:40:56.618733,0 days 00:00:31.381443,relu,prod,16,0.00690277643278865,4,gaussian,False,0.00017431527532316382,COMPLETE
451,4.1403177419852e-06,2025-07-10 23:40:56.619476,2025-07-10 23:41:25.883052,0 days 00:00:29.263576,identity,prod,16,0.00997392457305252,3,gaussian,False,0.0001605234639855153,COMPLETE
452,4.267511485522846e-06,2025-07-10 23:41:25.883773,2025-07-10 23:41:55.587779,0 days 00:00:29.704006,relu,prod,16,0.008779804263920684,3,gaussian,False,1.2764634636522259e-05,COMPLETE
453,4.63962624053238e-06,2025-07-10 23:41:55.588519,2025-07-10 23:42:23.958352,0 days 00:00:28.369833,identity,min,16,0.007271124846807254,3,gaussian,False,7.742270352003044e-05,COMPLETE
454,1.3225219249725342,2025-07-10 23:42:23.959042,2025-07-10 23:42:33.780097,0 days 00:00:09.821055,relu,prod,64,0.0023649679874765926,2,bell,False,2.4122653801747232e-05,COMPLETE
455,5.23292010257137e-06,2025-07-10 23:42:33.780635,2025-07-10 23:43:01.855978,0 days 00:00:28.075343,identity,prod,16,0.0011120785714726301,3,sigmoid,False,8.675565641553063e-05,COMPLETE
456,0.004113731440156698,2025-07-10 23:43:01.856621,2025-07-10 23:43:23.934137,0 days 00:00:22.077516,relu,prod,32,0.006492780656878931,9,gaussian,False,0.00019984707188453452,COMPLETE
457,5.476865226228256e-06,2025-07-10 23:43:23.934670,2025-07-10 23:43:53.190993,0 days 00:00:29.256323,identity,prod,16,0.005816970791275939,3,gaussian,False,1.7377233148598497e-05,COMPLETE
458,3.982671842095442e-06,2025-07-10 23:43:53.191750,2025-07-10 23:44:24.513498,0 days 00:00:31.321748,relu,prod,16,0.007970834060983123,4,gaussian,False,0.00014704520093695064,COMPLETE
459,8.05471499916166e-05,2025-07-10 23:44:24.514237,2025-07-10 23:44:53.766797,0 days 00:00:29.252560,identity,prod,16,0.002088357999499875,3,gaussian,False,0.00011490982126485622,COMPLETE
460,6.887572089908645e-05,2025-07-10 23:44:53.767552,2025-07-10 23:45:04.238460,0 days 00:00:10.470908,relu,prod,64,0.009190734072879644,5,gaussian,True,5.5557229617557387e-05,COMPLETE
461,4.85138343719882e-06,2025-07-10 23:45:04.238935,2025-07-10 23:45:32.522230,0 days 00:00:28.283295,identity,min,16,0.008556343996808002,3,gaussian,False,0.0007872274167864606,COMPLETE
462,5.401688213169109e-06,2025-07-10 23:45:32.523000,2025-07-10 23:46:00.971710,0 days 00:00:28.448710,relu,prod,16,0.005048504362492568,3,sigmoid,False,0.00025714519143138785,COMPLETE
463,0.0001041722425725311,2025-07-10 23:46:00.972394,2025-07-10 23:46:30.196496,0 days 00:00:29.224102,identity,prod,16,0.000898833112313151,3,gaussian,False,0.0003500815174359265,COMPLETE
464,0.7361859679222107,2025-07-10 23:46:30.197221,2025-07-10 23:46:41.589406,0 days 00:00:11.392185,relu,prod,64,0.00022516318121622192,7,gaussian,False,0.0001344826034232785,COMPLETE
465,3.903135166183347e-06,2025-07-10 23:46:41.589840,2025-07-10 23:47:03.479210,0 days 00:00:21.889370,identity,prod,32,0.009969683676419374,9,gaussian,False,1.41432023583409e-05,COMPLETE
