number,value,datetime_start,datetime_complete,duration,params_activation,params_and_operator,params_batch_size,params_lr,params_n_sets,params_shape,params_shuffle,params_weight_decay,state
466,4.365767836134182e-06,2025-07-10 23:47:03.479948,2025-07-10 23:47:36.238002,0 days 00:00:32.758054,relu,prod,16,0.00744969994897934,3,bell,False,0.00019463666724199488,COMPLETE
467,1.2295972737774719e-05,2025-07-10 23:47:36.238764,2025-07-10 23:48:05.459867,0 days 00:00:29.221103,identity,prod,16,0.00669948656842206,3,gaussian,False,1.1331599109018587e-05,COMPLETE
468,1.3225219249725342,2025-07-10 23:48:05.460625,2025-07-10 23:48:33.214482,0 days 00:00:27.753857,relu,prod,16,0.00805235386363437,2,gaussian,False,0.00016015694417618947,COMPLETE
469,4.1418857108510565e-06,2025-07-10 23:48:33.215208,2025-07-10 23:49:00.276193,0 days 00:00:27.060985,identity,min,16,0.008886954353830117,3,sigmoid,False,0.0002160475583168077,COMPLETE
470,9.219670027960092e-05,2025-07-10 23:49:00.276885,2025-07-10 23:49:09.715850,0 days 00:00:09.438965,relu,prod,64,0.007459152617409737,3,gaussian,False,0.00018371841841531762,COMPLETE
471,4.155495389568387e-06,2025-07-10 23:49:09.716408,2025-07-10 23:49:44.055097,0 days 00:00:34.338689,identity,prod,16,0.006043522792970303,6,gaussian,True,1.505753621406162e-05,COMPLETE
472,0.07282072305679321,2025-07-10 23:49:44.055741,2025-07-10 23:49:49.928038,0 days 00:00:05.872297,relu,prod,128,0.0031789640050581217,3,gaussian,False,0.0001734435687542457,COMPLETE
473,4.151374923822004e-06,2025-07-10 23:49:49.928572,2025-07-10 23:50:27.611478,0 days 00:00:37.682906,identity,prod,16,0.009057317697410562,8,gaussian,False,2.024079834305821e-05,COMPLETE
474,4.145892489759717e-06,2025-07-10 23:50:27.612207,2025-07-10 23:50:58.494042,0 days 00:00:30.881835,identity,prod,16,0.008170007669308995,4,gaussian,False,1.3401961366011396e-05,COMPLETE
475,4.16703960581799e-06,2025-07-10 23:50:58.494791,2025-07-10 23:51:14.447472,0 days 00:00:15.952681,relu,prod,32,0.006946684648100122,3,sigmoid,False,0.0001262246015658102,COMPLETE
476,4.964714662492042e-06,2025-07-10 23:51:14.448180,2025-07-10 23:51:43.718373,0 days 00:00:29.270193,identity,prod,16,0.0026557623744057094,3,gaussian,False,1.7083900097678322e-05,COMPLETE
477,7.63748466852121e-05,2025-07-10 23:51:43.719123,2025-07-10 23:51:55.091710,0 days 00:00:11.372587,relu,min,64,0.009157599860809737,8,gaussian,False,0.0001451012953878105,COMPLETE
478,0.0009042529272846878,2025-07-10 23:51:55.092354,2025-07-10 23:52:25.650942,0 days 00:00:30.558588,identity,prod,16,0.00777660855523377,2,bell,False,0.00016414248189726421,COMPLETE
479,3.6179487779008923e-06,2025-07-10 23:52:25.651691,2025-07-10 23:52:58.679720,0 days 00:00:33.028029,relu,prod,16,0.006401561263856537,5,gaussian,False,0.00022412630926366354,COMPLETE
480,5.192543540033512e-06,2025-07-10 23:52:58.680276,2025-07-10 23:53:31.667660,0 days 00:00:32.987384,relu,prod,16,0.0061761294909215576,5,gaussian,False,0.00023697771685931776,COMPLETE
481,4.197785528958775e-06,2025-07-10 23:53:31.668423,2025-07-10 23:54:02.932015,0 days 00:00:31.263592,relu,prod,16,0.006463067854425825,4,gaussian,False,0.00022195612822985573,COMPLETE
482,3.7710256037826184e-06,2025-07-10 23:54:02.932726,2025-07-10 23:54:35.950009,0 days 00:00:33.017283,relu,prod,16,0.004712770185430908,5,gaussian,False,0.000253987619972723,COMPLETE
483,1.1316742897033691,2025-07-10 23:54:35.950776,2025-07-10 23:55:09.136330,0 days 00:00:33.185554,relu,prod,16,0.005519824563688233,5,gaussian,False,0.00024058591260218442,COMPLETE
484,0.0014409818686544895,2025-07-10 23:55:09.137477,2025-07-10 23:55:42.259760,0 days 00:00:33.122283,relu,prod,16,0.004541136795689923,5,gaussian,True,0.00025430319488490915,COMPLETE
485,3.8544440030818805e-06,2025-07-10 23:55:42.260526,2025-07-10 23:56:16.960874,0 days 00:00:34.700348,relu,prod,16,0.004845686698877422,6,gaussian,False,0.00029562562610118196,COMPLETE
486,3.6286191971157677e-06,2025-07-10 23:56:16.962159,2025-07-10 23:56:51.820708,0 days 00:00:34.858549,relu,prod,16,0.004179642467344955,6,gaussian,False,0.00035566953557769864,COMPLETE
487,6.653279797319556e-06,2025-07-10 23:56:51.821446,2025-07-10 23:57:23.419265,0 days 00:00:31.597819,relu,min,16,0.0037114744469792047,5,gaussian,False,0.0004117751932730272,COMPLETE
488,4.103239461983321e-06,2025-07-10 23:57:23.420337,2025-07-10 23:57:58.134539,0 days 00:00:34.714202,relu,prod,16,0.004280759390474541,6,gaussian,False,0.0002791901115400151,COMPLETE
489,1.3499552551365923e-05,2025-07-10 23:57:58.135271,2025-07-10 23:58:31.187486,0 days 00:00:33.052215,relu,prod,16,0.004382062840163335,5,gaussian,False,0.000304492533311369,COMPLETE
490,4.145500497543253e-06,2025-07-10 23:58:31.188232,2025-07-10 23:59:06.109512,0 days 00:00:34.921280,relu,prod,16,0.0035003918039859185,6,gaussian,False,0.000206919634144592,COMPLETE
491,3.714471858984325e-06,2025-07-10 23:59:06.110247,2025-07-10 23:59:40.860920,0 days 00:00:34.750673,relu,prod,16,0.005133660764124278,6,gaussian,False,0.0002488009976991091,COMPLETE
492,4.206088760838611e-06,2025-07-10 23:59:40.861664,2025-07-11 00:00:15.730026,0 days 00:00:34.868362,relu,prod,16,0.005002729955100162,6,gaussian,False,0.0004498798771896251,COMPLETE
493,3.761412472158554e-06,2025-07-11 00:00:15.730786,2025-07-11 00:00:50.453677,0 days 00:00:34.722891,relu,prod,16,0.005014608237456919,6,gaussian,False,0.0002667606988737554,COMPLETE
494,3.5565193684305996e-05,2025-07-11 00:00:50.454410,2025-07-11 00:01:25.331424,0 days 00:00:34.877014,relu,prod,16,0.004615788536938982,6,gaussian,False,0.0003418935100041547,COMPLETE
495,1.3225219249725342,2025-07-11 00:01:25.332174,2025-07-11 00:02:00.183938,0 days 00:00:34.851764,relu,prod,16,0.00405290988658069,6,gaussian,False,0.000358392389614256,COMPLETE
496,4.226948021823773e-06,2025-07-11 00:02:00.184690,2025-07-11 00:02:33.383563,0 days 00:00:33.198873,relu,min,16,0.0050282119861619345,6,gaussian,False,0.00028116871341980434,COMPLETE
497,1.828604581533e-05,2025-07-11 00:02:33.384341,2025-07-11 00:03:06.418811,0 days 00:00:33.034470,relu,prod,16,0.003952948933752103,5,gaussian,False,0.0002559661074030737,COMPLETE
498,4.103742412553402e-06,2025-07-11 00:03:06.419554,2025-07-11 00:03:41.205382,0 days 00:00:34.785828,relu,prod,16,0.0051415823121333,6,gaussian,False,0.00026599477945107755,COMPLETE
499,7.031721452221973e-06,2025-07-11 00:03:41.206108,2025-07-11 00:04:15.957307,0 days 00:00:34.751199,relu,prod,16,0.0045600833951531,6,gaussian,False,0.000305554277410174,COMPLETE
