number,value,datetime_start,datetime_complete,duration,params_activation,params_and_operator,params_lr,params_n_sets,params_seq_length,params_shape,state
278,0.04100755974650383,2025-07-15 11:47:03.443235,2025-07-15 11:49:46.682265,0 days 00:02:43.239030,relu,min,0.008816105193253095,7,13,bell,COMPLETE
279,3.925776127289282e-06,2025-07-15 11:49:46.683265,2025-07-15 11:52:38.272803,0 days 00:02:51.589538,identity,min,0.007207036998272114,8,14,bell,COMPLETE
280,0.00038035487523302436,2025-07-15 11:52:38.273826,2025-07-15 11:56:25.441867,0 days 00:03:47.168041,identity,min,0.008299307131617742,6,21,bell,COMPLETE
281,5.098533620184753e-06,2025-07-15 11:56:25.442892,2025-07-15 12:00:31.568255,0 days 00:04:06.125363,identity,prod,0.007799342113575021,9,22,bell,COMPLETE
282,3.6552448818838457e-06,2025-07-15 12:00:31.569256,2025-07-15 12:04:02.474625,0 days 00:03:30.905369,identity,min,0.006527033129642609,6,19,bell,COMPLETE
283,0.14678598940372467,2025-07-15 12:04:02.475664,2025-07-15 12:06:59.371914,0 days 00:02:56.896250,identity,min,0.0031741225783885074,6,15,bell,COMPLETE
284,3.864470272674225e-06,2025-07-15 12:06:59.372971,2025-07-15 12:09:30.918374,0 days 00:02:31.545403,identity,min,0.00905626926605885,7,11,bell,COMPLETE
285,4.966018423147034e-06,2025-07-15 12:09:30.919404,2025-07-15 12:12:19.702398,0 days 00:02:48.782994,identity,min,0.005380449647009519,6,14,bell,COMPLETE
286,4.9354312068317086e-06,2025-07-15 12:12:19.703342,2025-07-15 12:15:35.171960,0 days 00:03:15.468618,identity,prod,0.007493609290646072,9,16,bell,COMPLETE
287,0.0004282604204490781,2025-07-15 12:15:35.172976,2025-07-15 12:18:56.265391,0 days 00:03:21.092415,identity,min,0.008487191634637332,7,18,sigmoid,COMPLETE
288,3.865740836772602e-06,2025-07-15 12:18:56.266400,2025-07-15 12:21:44.887562,0 days 00:02:48.621162,identity,min,0.005990893562408192,6,14,bell,COMPLETE
289,3.6868764254904818e-06,2025-07-15 12:21:44.888556,2025-07-15 12:25:23.671374,0 days 00:03:38.782818,identity,min,0.00692871393165025,6,20,bell,COMPLETE
290,9.532926014799159e-06,2025-07-15 12:25:23.672395,2025-07-15 12:29:31.153331,0 days 00:04:07.480936,relu,min,0.009058282568577686,8,23,bell,COMPLETE
291,3.499249942251481e-06,2025-07-15 12:29:31.154390,2025-07-15 12:33:44.652670,0 days 00:04:13.498280,identity,prod,0.00793111772229184,6,24,bell,COMPLETE
292,3.683884187921649e-06,2025-07-15 12:33:44.653717,2025-07-15 12:38:07.935318,0 days 00:04:23.281601,identity,prod,0.008221472462072214,9,24,bell,COMPLETE
293,0.00016052108549047261,2025-07-15 12:38:07.936356,2025-07-15 12:42:16.811147,0 days 00:04:08.874791,identity,prod,0.007630711504925009,6,24,gaussian,COMPLETE
294,5.130998761160299e-05,2025-07-15 12:42:16.812123,2025-07-15 12:45:52.333241,0 days 00:03:35.521118,identity,prod,0.001936860178703859,7,19,bell,COMPLETE
295,3.811673741438426e-05,2025-07-15 12:45:52.334293,2025-07-15 12:50:06.021698,0 days 00:04:13.687405,identity,prod,0.008631766245240114,6,24,bell,COMPLETE
296,3.6056385397387203e-06,2025-07-15 12:50:06.022789,2025-07-15 12:52:38.772717,0 days 00:02:32.749928,identity,prod,0.009996401039000133,6,12,bell,COMPLETE
297,1.2978644917893689e-05,2025-07-15 12:52:38.773786,2025-07-15 12:56:47.189841,0 days 00:04:08.416055,identity,prod,0.007263501081471485,8,23,bell,COMPLETE
298,4.157583589403657e-06,2025-07-15 12:56:47.190885,2025-07-15 12:59:28.255340,0 days 00:02:41.064455,identity,prod,0.008159917907998223,6,13,bell,COMPLETE
299,4.241452643327648e-06,2025-07-15 12:59:28.256417,2025-07-15 13:02:58.385349,0 days 00:03:30.128932,identity,min,0.00913823736644345,9,18,bell,COMPLETE
300,3.7636170873156516e-06,2025-07-15 13:02:58.386503,2025-07-15 13:06:29.910132,0 days 00:03:31.523629,identity,prod,0.007762958075046598,6,19,bell,COMPLETE
301,6.423063041438581e-06,2025-07-15 13:06:29.911160,2025-07-15 13:10:42.520561,0 days 00:04:12.609401,identity,min,0.006888351471589291,6,24,bell,COMPLETE
302,3.519064193824306e-06,2025-07-15 13:10:42.521609,2025-07-15 13:14:25.836663,0 days 00:03:43.315054,relu,min,0.00912926750480063,7,20,bell,COMPLETE
303,3.3590581551834475e-06,2025-07-15 13:14:25.837760,2025-07-15 13:16:41.204644,0 days 00:02:15.366884,relu,min,0.00817368934905382,7,9,bell,COMPLETE
304,0.003758917097002268,2025-07-15 13:16:41.205597,2025-07-15 13:18:38.949501,0 days 00:01:57.743904,relu,min,0.009289220824774675,7,7,bell,COMPLETE
305,1.3204221725463867,2025-07-15 13:18:38.950513,2025-07-15 13:20:29.090919,0 days 00:01:50.140406,relu,prod,0.008197551398397332,7,6,bell,COMPLETE
306,0.000949975335970521,2025-07-15 13:20:29.091814,2025-07-15 13:24:20.696248,0 days 00:03:51.604434,relu,min,0.008503446063158036,7,21,bell,COMPLETE
307,3.414478214835981e-06,2025-07-15 13:24:20.697290,2025-07-15 13:26:35.527999,0 days 00:02:14.830709,relu,min,0.009966927423658518,7,9,bell,COMPLETE
308,1.3189793825149536,2025-07-15 13:26:35.528961,2025-07-15 13:28:50.178915,0 days 00:02:14.649954,relu,min,0.009907995704215022,7,9,bell,COMPLETE
309,7.648998689546715e-06,2025-07-15 13:28:50.179990,2025-07-15 13:30:56.125970,0 days 00:02:05.945980,relu,min,0.009140465415760596,7,8,bell,COMPLETE
310,1.3126665353775024,2025-07-15 13:30:56.126989,2025-07-15 13:33:14.042487,0 days 00:02:17.915498,relu,prod,0.009965741483583701,7,9,bell,COMPLETE
311,0.0004059835337102413,2025-07-15 13:33:14.043652,2025-07-15 13:35:17.453336,0 days 00:02:03.409684,relu,min,0.008880195597758732,7,8,sigmoid,COMPLETE
312,3.955340616812464e-06,2025-07-15 13:35:17.454379,2025-07-15 13:37:37.745381,0 days 00:02:20.291002,relu,min,0.00853535125783497,7,9,bell,COMPLETE
313,0.0006121658952906728,2025-07-15 13:37:37.746509,2025-07-15 13:41:14.095251,0 days 00:03:36.348742,relu,min,0.007446234687824323,7,19,bell,COMPLETE
314,1.1483879089355469,2025-07-15 13:41:14.096331,2025-07-15 13:45:04.067234,0 days 00:03:49.970903,relu,min,0.008185737586133463,7,20,bell,COMPLETE
315,3.895721420121845e-06,2025-07-15 13:45:04.068276,2025-07-15 13:47:25.557041,0 days 00:02:21.488765,relu,prod,0.009263387038703205,7,9,bell,COMPLETE
316,0.9785663485527039,2025-07-15 13:47:25.558107,2025-07-15 13:49:49.268745,0 days 00:02:23.710638,relu,min,0.0008250397103848104,7,10,gaussian,COMPLETE
317,0.6162171959877014,2025-07-15 13:49:49.269870,2025-07-15 13:53:43.148599,0 days 00:03:53.878729,relu,min,0.009989578814597172,7,20,bell,COMPLETE
318,3.7247862110234564e-06,2025-07-15 13:53:43.149685,2025-07-15 13:57:17.890260,0 days 00:03:34.740575,relu,min,0.007265810578691482,7,18,bell,COMPLETE
319,4.61651643490768e-06,2025-07-15 13:57:17.891379,2025-07-15 14:00:36.049362,0 days 00:03:18.157983,relu,min,0.008288184585530163,9,16,bell,COMPLETE
320,0.02375529520213604,2025-07-15 14:00:36.050463,2025-07-15 14:04:27.582085,0 days 00:03:51.531622,relu,prod,0.009058834505268058,7,20,bell,COMPLETE
321,4.4710504880640656e-06,2025-07-15 14:04:27.583246,2025-07-15 14:08:07.957464,0 days 00:03:40.374218,relu,min,0.0077612359546319525,7,19,bell,COMPLETE
322,1.316388487815857,2025-07-15 14:08:07.958603,2025-07-15 14:11:48.240740,0 days 00:03:40.282137,relu,min,0.006564577717592337,9,18,bell,COMPLETE
323,0.05730119347572327,2025-07-15 14:11:48.241815,2025-07-15 14:15:08.076602,0 days 00:03:19.834787,relu,min,0.007825701637330316,9,16,bell,COMPLETE
324,3.6813548831560183e-06,2025-07-15 14:15:08.077697,2025-07-15 14:17:34.253938,0 days 00:02:26.176241,relu,prod,0.009228832808547822,7,10,bell,COMPLETE
325,4.384398835100001e-06,2025-07-15 14:17:34.254996,2025-07-15 14:19:14.986851,0 days 00:01:40.731855,identity,min,0.00721993317419702,7,5,bell,COMPLETE
326,4.251736754667945e-06,2025-07-15 14:19:14.987957,2025-07-15 14:21:31.719980,0 days 00:02:16.732023,identity,min,0.008527387709716124,7,9,bell,COMPLETE
327,0.8771659731864929,2025-07-15 14:21:31.721093,2025-07-15 14:25:12.094249,0 days 00:03:40.373156,identity,min,0.00011380474594456363,9,18,bell,COMPLETE
328,0.050133075565099716,2025-07-15 14:25:12.095267,2025-07-15 14:28:52.512060,0 days 00:03:40.416793,relu,min,0.0065277818890289736,7,19,bell,COMPLETE
329,3.5304651646583807e-06,2025-07-15 14:28:52.513198,2025-07-15 14:32:59.974807,0 days 00:04:07.461609,identity,prod,0.007929684319020839,9,21,bell,COMPLETE
330,3.7820968827873003e-06,2025-07-15 14:32:59.975912,2025-07-15 14:36:04.816095,0 days 00:03:04.840183,identity,min,0.009337370011983809,5,17,bell,COMPLETE
331,0.005287311039865017,2025-07-15 14:36:04.817048,2025-07-15 14:40:36.950794,0 days 00:04:32.133746,identity,min,0.0069385530076406824,7,25,bell,COMPLETE
332,0.0009610997512936592,2025-07-15 14:40:36.951931,2025-07-15 14:43:34.407391,0 days 00:02:57.455460,identity,min,0.008488391353728652,6,15,bell,COMPLETE
333,0.022706622257828712,2025-07-15 14:43:34.408449,2025-07-15 14:46:50.637510,0 days 00:03:16.229061,identity,prod,0.007579838107190951,9,16,sigmoid,COMPLETE
334,3.7035388231743127e-06,2025-07-15 14:46:50.638528,2025-07-15 14:50:21.429724,0 days 00:03:30.791196,identity,min,0.008685136655345054,6,18,bell,COMPLETE
335,3.6721230571856722e-06,2025-07-15 14:50:21.430790,2025-07-15 14:54:04.150023,0 days 00:03:42.719233,relu,min,0.006128264536186446,6,20,bell,COMPLETE
336,0.005496190395206213,2025-07-15 14:54:04.151067,2025-07-15 14:57:28.654428,0 days 00:03:24.503361,identity,min,0.00036939323744192146,7,17,bell,COMPLETE
337,0.0003355809603817761,2025-07-15 14:57:28.655577,2025-07-15 15:00:32.640345,0 days 00:03:03.984768,identity,prod,0.0072601507148173415,6,15,bell,COMPLETE
338,4.485092176764738e-06,2025-07-15 15:00:32.641503,2025-07-15 15:02:41.873071,0 days 00:02:09.231568,identity,min,0.009917423135440695,9,8,gaussian,COMPLETE
339,3.517810910125263e-06,2025-07-15 15:02:41.874099,2025-07-15 15:06:25.702526,0 days 00:03:43.828427,identity,min,0.0076971497336467375,7,19,bell,COMPLETE
340,0.0009844781598076224,2025-07-15 15:06:25.703575,2025-07-15 15:10:10.509367,0 days 00:03:44.805792,identity,min,0.008018515242217849,7,19,bell,COMPLETE
341,3.494894144751015e-06,2025-07-15 15:10:10.510423,2025-07-15 15:13:54.815846,0 days 00:03:44.305423,relu,min,0.009093542495246845,7,19,bell,COMPLETE
342,3.728186129592359e-06,2025-07-15 15:13:54.816928,2025-07-15 15:17:40.377764,0 days 00:03:45.560836,identity,prod,0.00834915723067625,7,19,bell,COMPLETE
343,0.010991670191287994,2025-07-15 15:17:40.378837,2025-07-15 15:21:23.537248,0 days 00:03:43.158411,identity,min,0.0013561432387799415,7,19,bell,COMPLETE
344,3.6532692320179194e-06,2025-07-15 15:21:23.538257,2025-07-15 15:25:08.292140,0 days 00:03:44.753883,identity,min,0.007773679670244122,7,19,bell,COMPLETE
345,4.332889602665091e-06,2025-07-15 15:25:08.293281,2025-07-15 15:28:50.609503,0 days 00:03:42.316222,identity,min,0.007193851646522739,7,18,bell,COMPLETE
346,3.580949623938068e-06,2025-07-15 15:28:50.611251,2025-07-15 15:32:32.519483,0 days 00:03:41.908232,identity,prod,0.009153996111589811,8,18,bell,COMPLETE
347,1.3165440559387207,2025-07-15 15:32:32.520503,2025-07-15 15:36:03.182340,0 days 00:03:30.661837,relu,min,0.00835171277926706,7,17,bell,COMPLETE
348,3.514614490995882e-06,2025-07-15 15:36:03.183418,2025-07-15 15:39:51.467946,0 days 00:03:48.284528,identity,min,0.006879155787423487,7,19,bell,COMPLETE
349,3.4291833799215965e-06,2025-07-15 15:39:51.469017,2025-07-15 15:43:11.306823,0 days 00:03:19.837806,identity,min,0.006559465186135801,8,16,bell,COMPLETE
350,4.7455073399760295e-06,2025-07-15 15:43:11.307847,2025-07-15 15:46:31.546923,0 days 00:03:20.239076,identity,min,0.006548233668210178,8,16,bell,COMPLETE
351,0.006629043258726597,2025-07-15 15:46:31.548113,2025-07-15 15:49:51.641249,0 days 00:03:20.093136,identity,prod,0.0002610540448616812,8,16,bell,COMPLETE
352,3.868697604048066e-06,2025-07-15 15:49:51.642295,2025-07-15 15:53:15.583152,0 days 00:03:23.940857,identity,min,0.00686737106286109,8,16,bell,COMPLETE
353,5.9437676100060344e-05,2025-07-15 15:53:15.584243,2025-07-15 15:56:43.529235,0 days 00:03:27.944992,relu,min,0.006231924415289196,8,17,bell,COMPLETE
354,0.0006774434586986899,2025-07-15 15:56:43.530257,2025-07-15 16:00:19.045926,0 days 00:03:35.515669,identity,min,0.004023004196784004,8,18,bell,COMPLETE
355,0.18111631274223328,2025-07-15 16:00:19.046921,2025-07-15 16:03:51.051953,0 days 00:03:32.005032,identity,min,0.0010356217741702793,8,17,bell,COMPLETE
356,3.660145239336998e-06,2025-07-15 16:03:51.053045,2025-07-15 16:07:00.827806,0 days 00:03:09.774761,identity,prod,0.009967534860337201,8,15,bell,COMPLETE
357,0.011632446199655533,2025-07-15 16:07:00.828764,2025-07-15 16:09:28.886326,0 days 00:02:28.057562,identity,min,0.008643024295479487,9,10,sigmoid,COMPLETE
358,0.011483798734843731,2025-07-15 16:09:28.887337,2025-07-15 16:12:45.359065,0 days 00:03:16.471728,relu,min,0.007009112793467361,8,16,bell,COMPLETE
359,3.807804205280263e-06,2025-07-15 16:12:45.360228,2025-07-15 16:16:29.574884,0 days 00:03:44.214656,identity,min,0.005545441895993705,8,19,bell,COMPLETE
360,1.361680006084498e-05,2025-07-15 16:16:29.575860,2025-07-15 16:18:12.468168,0 days 00:01:42.892308,identity,prod,0.007603427144814947,5,6,bell,COMPLETE
361,3.6414469377632486e-06,2025-07-15 16:18:12.469185,2025-07-15 16:21:53.023307,0 days 00:03:40.554122,identity,min,0.00894325759938058,9,18,bell,COMPLETE
362,3.868995008815546e-06,2025-07-15 16:21:53.024379,2025-07-15 16:25:17.845971,0 days 00:03:24.821592,identity,min,0.007923467933181041,9,17,gaussian,COMPLETE
363,6.048519480827963e-06,2025-07-15 16:25:17.846978,2025-07-15 16:27:14.821104,0 days 00:01:56.974126,relu,min,0.006662590241350022,6,7,bell,COMPLETE
364,3.717355866683647e-06,2025-07-15 16:27:14.822050,2025-07-15 16:29:21.650196,0 days 00:02:06.828146,identity,prod,0.009322780264666361,6,8,bell,COMPLETE
365,3.976924290327588e-06,2025-07-15 16:29:21.651225,2025-07-15 16:33:51.289505,0 days 00:04:29.638280,identity,min,0.008337221105261531,6,15,bell,COMPLETE
366,3.881790689774789e-06,2025-07-15 16:33:51.290569,2025-07-15 16:37:14.258594,0 days 00:03:22.968025,identity,min,0.007383373737428936,8,16,bell,COMPLETE
367,3.6246372019377304e-06,2025-07-15 16:37:14.259617,2025-07-15 16:40:56.417542,0 days 00:03:42.157925,identity,min,0.00864235420993767,9,17,bell,COMPLETE
368,0.030474090948700905,2025-07-15 16:40:56.418634,2025-07-15 16:44:48.140447,0 days 00:03:51.721813,relu,min,0.00045422873578335464,6,19,bell,COMPLETE
369,5.477512331708567e-06,2025-07-15 16:44:48.141512,2025-07-15 16:48:21.780272,0 days 00:03:33.638760,identity,prod,0.006482788686354106,6,18,bell,COMPLETE
370,4.65197945231921e-06,2025-07-15 16:48:21.781271,2025-07-15 16:52:12.597228,0 days 00:03:50.815957,identity,min,0.00993487104228432,8,20,bell,COMPLETE
371,3.5864829897036543e-06,2025-07-15 16:52:12.598283,2025-07-15 16:55:46.484467,0 days 00:03:33.886184,identity,min,0.007241484015506275,9,17,bell,COMPLETE
372,5.9967405832139775e-06,2025-07-15 16:55:46.485548,2025-07-15 16:58:52.670489,0 days 00:03:06.184941,identity,min,0.00797470616774169,6,15,bell,COMPLETE
373,3.4787551612680545e-06,2025-07-15 16:58:52.672530,2025-07-15 17:02:07.601490,0 days 00:03:14.928960,relu,prod,0.008946845417330693,6,16,bell,COMPLETE
374,0.0877559706568718,2025-07-15 17:02:07.603163,2025-07-15 17:05:28.571866,0 days 00:03:20.968703,relu,prod,0.0006360944788681312,7,16,bell,COMPLETE
375,1.3169734477996826,2025-07-15 17:05:28.572964,2025-07-15 17:08:35.535615,0 days 00:03:06.962651,relu,prod,0.009077174123138479,6,15,bell,COMPLETE
376,0.0004795039421878755,2025-07-15 17:08:35.536645,2025-07-15 17:11:59.984340,0 days 00:03:24.447695,relu,prod,0.006063356205272948,9,16,bell,COMPLETE
377,5.3927064982417505e-06,2025-07-15 17:11:59.985371,2025-07-15 17:15:18.534660,0 days 00:03:18.549289,relu,prod,0.008023031193713467,7,16,bell,COMPLETE
378,1.316251516342163,2025-07-15 17:15:18.535680,2025-07-15 17:18:44.477979,0 days 00:03:25.942299,relu,prod,0.00696874207340734,5,19,bell,COMPLETE
379,0.0005110062193125486,2025-07-15 17:18:44.479067,2025-07-15 17:22:01.338742,0 days 00:03:16.859675,relu,prod,0.009119164113103588,8,16,sigmoid,COMPLETE
380,0.11333662271499634,2025-07-15 17:22:01.339774,2025-07-15 17:24:59.561010,0 days 00:02:58.221236,relu,prod,0.00759415457049906,6,14,bell,COMPLETE
381,0.05857525393366814,2025-07-15 17:24:59.561977,2025-07-15 17:28:05.217825,0 days 00:03:05.655848,relu,prod,0.00834262940900753,6,15,bell,COMPLETE
382,3.875026777677704e-06,2025-07-15 17:28:05.218815,2025-07-15 17:30:24.607734,0 days 00:02:19.388919,relu,prod,0.004843908957855757,7,9,bell,COMPLETE
383,0.07063103467226028,2025-07-15 17:30:24.608709,2025-07-15 17:34:07.274341,0 days 00:03:42.665632,identity,prod,0.009318726208880215,7,19,bell,COMPLETE
384,0.0009097856236621737,2025-07-15 17:34:07.275410,2025-07-15 17:38:02.093838,0 days 00:03:54.818428,relu,min,0.006845696082450286,9,15,gaussian,COMPLETE
385,4.005945811513811e-06,2025-07-15 17:38:02.094925,2025-07-15 17:41:42.984867,0 days 00:03:40.889942,identity,min,0.00996173786216025,6,19,bell,COMPLETE
386,4.536841515800916e-06,2025-07-15 17:41:42.985880,2025-07-15 17:45:42.433466,0 days 00:03:59.447586,identity,prod,0.007503240720007934,6,20,bell,COMPLETE
387,4.294291102269199e-06,2025-07-15 17:45:42.434490,2025-07-15 17:49:21.684988,0 days 00:03:39.250498,identity,min,0.008588289206330028,8,18,bell,COMPLETE
388,3.6554515645548236e-06,2025-07-15 17:49:21.686051,2025-07-15 17:52:37.423844,0 days 00:03:15.737793,identity,min,0.006123829990028511,7,15,bell,COMPLETE
389,0.15094101428985596,2025-07-15 17:52:37.424883,2025-07-15 17:56:30.226794,0 days 00:03:52.801911,relu,min,0.008023456466677315,6,20,bell,COMPLETE
390,3.5473265143082244e-06,2025-07-15 17:56:30.227845,2025-07-15 17:58:56.797342,0 days 00:02:26.569497,identity,min,0.007348180589341531,6,10,bell,COMPLETE
391,7.915059541119263e-06,2025-07-15 17:58:56.798384,2025-07-15 18:02:25.353239,0 days 00:03:28.554855,identity,prod,0.009251817392479104,8,16,bell,COMPLETE
392,4.810024165635696e-06,2025-07-15 18:02:25.354300,2025-07-15 18:05:59.428827,0 days 00:03:34.074527,identity,min,0.006732018435311485,7,18,bell,COMPLETE
393,8.963571417552885e-06,2025-07-15 18:05:59.430096,2025-07-15 18:09:03.833632,0 days 00:03:04.403536,relu,min,0.003574476762845529,9,14,bell,COMPLETE
394,0.03571275621652603,2025-07-15 18:09:03.834646,2025-07-15 18:12:49.293483,0 days 00:03:45.458837,identity,min,0.000183787589478499,7,19,bell,COMPLETE
395,0.01868264190852642,2025-07-15 18:12:49.294537,2025-07-15 18:16:03.202623,0 days 00:03:13.908086,identity,prod,0.005720754531698011,6,16,bell,COMPLETE
396,6.4527339418418705e-06,2025-07-15 18:16:03.203676,2025-07-15 18:18:42.547131,0 days 00:02:39.343455,identity,min,0.008355979486850818,9,11,bell,COMPLETE
397,0.00019085381063632667,2025-07-15 18:18:42.548174,2025-07-15 18:21:45.865156,0 days 00:03:03.316982,identity,min,0.007732056047229184,6,15,bell,COMPLETE
398,0.02293766662478447,2025-07-15 18:21:45.866211,2025-07-15 18:25:07.968367,0 days 00:03:22.102156,relu,min,0.009119602646143518,7,17,bell,COMPLETE
399,3.747672053577844e-06,2025-07-15 18:25:07.969488,2025-07-15 18:28:35.197275,0 days 00:03:27.227787,identity,prod,0.007085719565355837,6,17,bell,COMPLETE
400,0.08446332067251205,2025-07-15 18:28:35.198330,2025-07-15 18:32:14.303203,0 days 00:03:39.104873,identity,min,0.008454195586767212,7,18,bell,COMPLETE
401,0.02703511342406273,2025-07-15 18:32:14.304282,2025-07-15 18:36:10.049049,0 days 00:03:55.744767,identity,min,0.0077547535636962334,9,20,sigmoid,COMPLETE
402,3.6321869174571475e-06,2025-07-15 18:36:10.050045,2025-07-15 18:39:13.501756,0 days 00:03:03.451711,identity,min,0.009929787623344266,8,14,bell,COMPLETE
403,3.4619702091731597e-06,2025-07-15 18:39:13.502863,2025-07-15 18:42:31.587234,0 days 00:03:18.084371,relu,prod,0.006372195158408715,6,16,bell,COMPLETE
404,0.00023177138064056635,2025-07-15 18:42:31.588257,2025-07-15 18:45:49.843194,0 days 00:03:18.254937,relu,prod,0.005480476335352646,6,16,bell,COMPLETE
405,4.90874117531348e-06,2025-07-15 18:45:49.844223,2025-07-15 18:49:06.322145,0 days 00:03:16.477922,relu,prod,0.006196110682376843,6,16,bell,COMPLETE
406,3.444651838435675e-06,2025-07-15 18:49:06.323189,2025-07-15 18:52:16.243321,0 days 00:03:09.920132,relu,prod,0.008817786749322558,6,15,bell,COMPLETE
407,4.226521468808642e-06,2025-07-15 18:52:16.244344,2025-07-15 18:55:28.944842,0 days 00:03:12.700498,relu,prod,0.009202891489212455,6,15,bell,COMPLETE
408,1.2906020879745483,2025-07-15 18:55:28.945924,2025-07-15 18:58:38.244439,0 days 00:03:09.298515,relu,prod,0.006420980981936782,6,15,bell,COMPLETE
409,0.15234459936618805,2025-07-15 18:58:38.245487,2025-07-15 19:01:41.111129,0 days 00:03:02.865642,relu,prod,0.007947160276229125,6,15,gaussian,COMPLETE
410,4.646376964956289e-06,2025-07-15 19:01:41.112172,2025-07-15 19:04:48.852231,0 days 00:03:07.740059,relu,prod,0.008666020107671892,6,15,bell,COMPLETE
411,0.7003788352012634,2025-07-15 19:04:48.853238,2025-07-15 19:07:47.620699,0 days 00:02:58.767461,relu,prod,0.007336512098428144,6,14,bell,COMPLETE
412,0.0007461285567842424,2025-07-15 19:07:47.621755,2025-07-15 19:11:06.722225,0 days 00:03:19.100470,relu,prod,0.009299814569302458,6,16,bell,COMPLETE
413,0.0021791839972138405,2025-07-15 19:11:06.723286,2025-07-15 19:14:16.034776,0 days 00:03:09.311490,relu,prod,0.002194080651105958,6,15,bell,COMPLETE
414,4.182148131803842e-06,2025-07-15 19:14:16.035788,2025-07-15 19:18:52.302092,0 days 00:04:36.266304,relu,prod,0.005118126764354542,6,22,bell,COMPLETE
415,1.013498067855835,2025-07-15 19:18:52.303154,2025-07-15 19:22:06.877868,0 days 00:03:14.574714,relu,prod,0.00998002677366674,6,16,bell,COMPLETE
416,2.02630599233089e-05,2025-07-15 19:22:06.879633,2025-07-15 19:25:07.187362,0 days 00:03:00.307729,relu,prod,0.00840742949686079,8,14,bell,COMPLETE
417,1.3167331218719482,2025-07-15 19:25:07.188420,2025-07-15 19:28:28.666226,0 days 00:03:21.477806,relu,prod,0.007383460109766472,9,16,bell,COMPLETE
418,9.373505235998891e-06,2025-07-15 19:28:28.667343,2025-07-15 19:31:33.224144,0 days 00:03:04.556801,relu,prod,0.006428718533235322,6,15,bell,COMPLETE
