number,value,datetime_start,datetime_complete,duration,params_activation,params_and_operator,params_lr,params_n_sets,params_seq_length,params_shape,state
419,3.5894922802981455e-06,2025-07-15 19:31:33.225224,2025-07-15 19:34:38.156837,0 days 00:03:04.931613,relu,prod,0.008653533212694202,6,15,bell,COMPLETE
420,0.00020434707403182983,2025-07-15 19:34:38.157907,2025-07-15 19:38:00.216390,0 days 00:03:22.058483,relu,prod,0.007817207848523204,9,15,bell,COMPLETE
421,3.843350896204356e-06,2025-07-15 19:38:00.217429,2025-07-15 19:40:24.190834,0 days 00:02:23.973405,relu,prod,0.0071850987848694516,6,7,bell,COMPLETE
422,8.069776959018782e-05,2025-07-15 19:40:24.191876,2025-07-15 19:42:55.819564,0 days 00:02:31.627688,relu,prod,0.005865246455005819,8,9,bell,COMPLETE
423,0.9450210928916931,2025-07-15 19:42:55.820617,2025-07-15 19:46:21.618946,0 days 00:03:25.798329,relu,prod,0.008435668371739877,6,16,bell,COMPLETE
424,0.00040403130697086453,2025-07-15 19:46:21.619977,2025-07-15 19:49:11.375821,0 days 00:02:49.755844,relu,prod,0.00996623695435244,6,14,sigmoid,COMPLETE
425,3.5940579437010456e-06,2025-07-15 19:49:11.376894,2025-07-15 19:52:44.398167,0 days 00:03:33.021273,relu,prod,0.0068266134700497695,9,16,bell,COMPLETE
426,3.4227257401653333e-06,2025-07-15 19:52:44.399234,2025-07-15 19:57:20.172106,0 days 00:04:35.772872,identity,prod,0.007876706065655553,6,25,bell,COMPLETE
427,3.860250217257999e-06,2025-07-15 19:57:20.173062,2025-07-15 20:01:54.417107,0 days 00:04:34.244045,identity,prod,0.009117128016253724,8,24,bell,COMPLETE
428,3.9069777812983375e-06,2025-07-15 20:01:54.418111,2025-07-15 20:05:00.956028,0 days 00:03:06.537917,relu,prod,0.007944669812065597,6,15,bell,COMPLETE
429,3.6801934584218543e-06,2025-07-15 20:05:00.957067,2025-07-15 20:09:36.616280,0 days 00:04:35.659213,identity,prod,0.007947314731732439,6,25,bell,COMPLETE
430,0.0006649147253483534,2025-07-15 20:09:36.617371,2025-07-15 20:14:18.653546,0 days 00:04:42.036175,identity,prod,0.008949239642016243,9,25,gaussian,COMPLETE
431,1.9250292098149657e-05,2025-07-15 20:14:18.654624,2025-07-15 20:18:54.329597,0 days 00:04:35.674973,identity,prod,0.0027584580968944904,6,25,bell,COMPLETE
432,3.7026056816102937e-06,2025-07-15 20:18:54.330626,2025-07-15 20:23:35.520336,0 days 00:04:41.189710,relu,prod,0.008211782629389082,8,25,bell,COMPLETE
433,4.377604454930406e-06,2025-07-15 20:23:35.521324,2025-07-15 20:28:01.840025,0 days 00:04:26.318701,identity,prod,0.008982910053755925,6,24,bell,COMPLETE
434,8.65985293785343e-06,2025-07-15 20:28:01.841021,2025-07-15 20:32:51.003738,0 days 00:04:49.162717,identity,prod,0.007409740775106448,9,25,bell,COMPLETE
435,3.815515810856596e-06,2025-07-15 20:32:51.004773,2025-07-15 20:37:17.007778,0 days 00:04:26.003005,identity,prod,0.006766440205842919,6,24,bell,COMPLETE
436,4.4619264372158796e-06,2025-07-15 20:37:17.008823,2025-07-15 20:40:21.375354,0 days 00:03:04.366531,relu,prod,0.009426499807700951,8,14,bell,COMPLETE
437,3.458668743405724e-06,2025-07-15 20:40:21.376410,2025-07-15 20:43:27.323140,0 days 00:03:05.946730,identity,prod,0.008159776772318116,6,15,bell,COMPLETE
438,3.5196528642700287e-06,2025-07-15 20:43:27.324386,2025-07-15 20:48:04.585248,0 days 00:04:37.260862,identity,prod,0.007731479485064273,6,25,bell,COMPLETE
439,4.010147677036002e-06,2025-07-15 20:48:04.586370,2025-07-15 20:51:25.002247,0 days 00:03:20.415877,identity,prod,0.006339546252656155,9,15,bell,COMPLETE
440,7.235200610011816e-05,2025-07-15 20:51:25.003433,2025-07-15 20:54:32.124148,0 days 00:03:07.120715,relu,prod,0.007078833605293522,6,15,bell,COMPLETE
441,3.666429847726249e-06,2025-07-15 20:54:32.125209,2025-07-15 20:57:28.685029,0 days 00:02:56.559820,identity,prod,0.008369960922608307,6,14,bell,COMPLETE
442,4.104486833966803e-06,2025-07-15 20:57:28.686102,2025-07-15 21:01:31.620194,0 days 00:04:02.934092,identity,prod,0.00783397439182328,8,21,bell,COMPLETE
443,4.466419341042638e-06,2025-07-15 21:01:31.621316,2025-07-15 21:04:57.186756,0 days 00:03:25.565440,relu,prod,0.007315478777873744,9,16,bell,COMPLETE
444,3.5536331779439934e-06,2025-07-15 21:04:57.187851,2025-07-15 21:07:27.958169,0 days 00:02:30.770318,identity,prod,0.008560448320956676,7,10,bell,COMPLETE
445,3.649383188530919e-06,2025-07-15 21:07:27.959263,2025-07-15 21:10:43.139861,0 days 00:03:15.180598,identity,prod,0.009965425562329894,6,16,bell,COMPLETE
446,0.00028633573674596846,2025-07-15 21:10:43.140996,2025-07-15 21:13:56.857156,0 days 00:03:13.716160,identity,prod,0.006625709248856878,8,15,bell,COMPLETE
447,3.642714318630169e-06,2025-07-15 21:13:56.858148,2025-07-15 21:17:00.279890,0 days 00:03:03.421742,relu,prod,0.008100950383302582,7,14,bell,COMPLETE
448,1.9116134353680536e-05,2025-07-15 21:17:00.281003,2025-07-15 21:19:03.983961,0 days 00:02:03.702958,identity,prod,0.009048071177907797,6,8,sigmoid,COMPLETE
449,3.519108759064693e-06,2025-07-15 21:19:03.985000,2025-07-15 21:22:46.877026,0 days 00:03:42.892026,identity,prod,0.007315086794008872,6,19,bell,COMPLETE
450,0.021384473890066147,2025-07-15 21:22:46.878055,2025-07-15 21:25:25.657485,0 days 00:02:38.779430,relu,prod,0.005725865613715497,5,13,bell,COMPLETE
451,3.4636470900295535e-06,2025-07-15 21:25:25.658524,2025-07-15 21:29:32.859379,0 days 00:04:07.200855,identity,prod,0.008070475191450625,9,20,bell,COMPLETE
452,0.0326198972761631,2025-07-15 21:29:32.860405,2025-07-15 21:33:37.225872,0 days 00:04:04.365467,identity,prod,0.008476519948338708,9,20,bell,COMPLETE
453,0.002295674290508032,2025-07-15 21:33:37.226951,2025-07-15 21:37:41.698630,0 days 00:04:04.471679,identity,prod,0.006761890860604704,9,20,bell,COMPLETE
454,0.01920744776725769,2025-07-15 21:37:41.699661,2025-07-15 21:41:32.717107,0 days 00:03:51.017446,relu,min,0.009298172600577283,9,19,bell,COMPLETE
455,3.436900078668259e-05,2025-07-15 21:41:32.718179,2025-07-15 21:45:45.991909,0 days 00:04:13.273730,identity,prod,0.007686447618657024,9,21,gaussian,COMPLETE
456,0.00030424827127717435,2025-07-15 21:45:45.993005,2025-07-15 21:49:53.042188,0 days 00:04:07.049183,identity,min,0.004622756686539244,9,20,bell,COMPLETE
457,5.600114491244312e-06,2025-07-15 21:49:53.043316,2025-07-15 21:53:29.301510,0 days 00:03:36.258194,relu,min,0.0086096039207883,7,18,bell,COMPLETE
458,4.189122591924388e-06,2025-07-15 21:53:29.302561,2025-07-15 21:55:18.077061,0 days 00:01:48.774500,identity,prod,0.007092033559269531,9,5,bell,COMPLETE
459,3.654236934380606e-06,2025-07-15 21:55:18.078098,2025-07-15 21:59:12.149265,0 days 00:03:54.071167,identity,min,0.006029643186881935,7,20,bell,COMPLETE
460,2.822168062266428e-05,2025-07-15 21:59:12.150318,2025-07-15 22:02:30.755472,0 days 00:03:18.605154,identity,min,0.009311613419823929,7,16,bell,COMPLETE
461,3.776171752178925e-06,2025-07-15 22:02:30.756553,2025-07-15 22:06:22.400254,0 days 00:03:51.643701,relu,prod,0.00809464349136594,7,19,bell,COMPLETE
462,3.7701524888689164e-06,2025-07-15 22:06:22.401305,2025-07-15 22:09:27.684476,0 days 00:03:05.283171,identity,min,0.006461337444373769,9,14,bell,COMPLETE
463,3.683878048832412e-06,2025-07-15 22:09:27.685607,2025-07-15 22:13:38.345148,0 days 00:04:10.659541,identity,prod,0.007598027945162166,9,21,bell,COMPLETE
464,4.33819877798669e-06,2025-07-15 22:13:38.346222,2025-07-15 22:15:58.436930,0 days 00:02:20.090708,relu,min,0.00850952575678891,7,9,bell,COMPLETE
465,0.0008912222110666335,2025-07-15 22:15:58.438148,2025-07-15 22:19:51.275110,0 days 00:03:52.836962,identity,min,0.0016607614986225453,9,19,bell,COMPLETE
466,3.5482005387166282e-06,2025-07-15 22:19:51.276932,2025-07-15 22:23:31.711043,0 days 00:03:40.434111,identity,prod,0.009250465660677765,7,18,bell,COMPLETE
467,0.012303488329052925,2025-07-15 22:23:31.712188,2025-07-15 22:26:45.208097,0 days 00:03:13.495909,relu,min,0.00996378039622904,7,15,bell,COMPLETE
468,3.7814070310560055e-06,2025-07-15 22:26:45.209169,2025-07-15 22:30:11.170893,0 days 00:03:25.961724,identity,prod,0.007064692102467522,9,16,bell,COMPLETE
469,7.440458830387797e-06,2025-07-15 22:30:11.172059,2025-07-15 22:32:59.334274,0 days 00:02:48.162215,identity,min,0.007729501637284382,7,13,bell,COMPLETE
470,0.05048157274723053,2025-07-15 22:32:59.335342,2025-07-15 22:36:16.406920,0 days 00:03:17.071578,identity,min,0.005259607521248825,9,16,sigmoid,COMPLETE
471,4.3943009586655535e-06,2025-07-15 22:36:16.407928,2025-07-15 22:40:31.187562,0 days 00:04:14.779634,relu,prod,0.008429972382849236,7,22,bell,COMPLETE
472,3.789503898588009e-05,2025-07-15 22:40:31.188676,2025-07-15 22:43:46.787677,0 days 00:03:15.599001,identity,min,0.006309571858219334,9,15,bell,COMPLETE
473,3.5630769161798526e-06,2025-07-15 22:43:46.788880,2025-07-15 22:47:36.346149,0 days 00:03:49.557269,identity,prod,0.0074600201070176755,7,19,bell,COMPLETE
474,3.6410071970749414e-06,2025-07-15 22:47:36.347232,2025-07-15 22:51:29.702141,0 days 00:03:53.354909,relu,min,0.00870930207900605,7,20,bell,COMPLETE
475,4.531556896836264e-06,2025-07-15 22:51:29.703178,2025-07-15 22:55:05.845347,0 days 00:03:36.142169,identity,min,0.006702811446404954,8,18,bell,COMPLETE
476,3.5598523027147166e-06,2025-07-15 22:55:05.846438,2025-07-15 22:58:19.482493,0 days 00:03:13.636055,identity,prod,0.007925695303884345,9,15,gaussian,COMPLETE
477,0.0023592105135321617,2025-07-15 22:58:19.483693,2025-07-15 23:01:17.206441,0 days 00:02:57.722748,relu,min,0.008996559837985377,7,14,bell,COMPLETE
478,4.034063294966472e-06,2025-07-15 23:01:17.207561,2025-07-15 23:04:41.056134,0 days 00:03:23.848573,identity,prod,0.009987371116398611,8,17,bell,COMPLETE
479,3.4610734473972116e-06,2025-07-15 23:04:41.057267,2025-07-15 23:07:47.313776,0 days 00:03:06.256509,identity,min,0.0071690855582006744,9,14,bell,COMPLETE
480,4.227800218359334e-06,2025-07-15 23:07:47.314889,2025-07-15 23:10:49.657683,0 days 00:03:02.342794,identity,min,0.0057886669200041835,9,14,bell,COMPLETE
481,0.024570606648921967,2025-07-15 23:10:49.658739,2025-07-15 23:13:51.954711,0 days 00:03:02.295972,identity,prod,0.0069441767654357415,9,14,bell,COMPLETE
482,3.6509109122562222e-06,2025-07-15 23:13:51.955810,2025-07-15 23:16:45.258431,0 days 00:02:53.302621,identity,min,0.006074226206937803,9,13,bell,COMPLETE
483,4.10042230214458e-06,2025-07-15 23:16:45.259599,2025-07-15 23:20:04.136957,0 days 00:03:18.877358,identity,min,0.007109408239355238,9,15,bell,COMPLETE
484,3.961717084166594e-06,2025-07-15 23:20:04.138018,2025-07-15 23:23:14.372081,0 days 00:03:10.234063,identity,prod,0.006583097153863114,9,14,bell,COMPLETE
485,3.433611254877178e-06,2025-07-15 23:23:14.373194,2025-07-15 23:26:32.369488,0 days 00:03:17.996294,identity,min,0.007586011360624433,9,15,bell,COMPLETE
486,3.704939445015043e-06,2025-07-15 23:26:32.370617,2025-07-15 23:29:30.962123,0 days 00:02:58.591506,identity,min,0.006380629559503182,9,13,bell,COMPLETE
487,0.00035991359618492424,2025-07-15 23:29:30.963222,2025-07-15 23:32:50.930498,0 days 00:03:19.967276,identity,prod,0.00543423293484516,9,15,bell,COMPLETE
488,3.9945020944287535e-06,2025-07-15 23:32:50.931735,2025-07-15 23:34:48.467809,0 days 00:01:57.536074,identity,min,0.007310762756757582,9,6,bell,COMPLETE
489,2.0968498574802652e-05,2025-07-15 23:34:48.468931,2025-07-15 23:37:56.788976,0 days 00:03:08.320045,identity,prod,0.007710965845325041,9,14,bell,COMPLETE
490,0.0003928900696337223,2025-07-15 23:37:56.790083,2025-07-15 23:41:07.972990,0 days 00:03:11.182907,identity,min,0.006866477758460743,9,15,bell,COMPLETE
491,0.00016133030294440687,2025-07-15 23:41:07.974139,2025-07-15 23:44:35.928406,0 days 00:03:27.954267,identity,prod,0.0059741230009989635,9,16,bell,COMPLETE
492,3.665575150080258e-06,2025-07-15 23:44:35.929545,2025-07-15 23:47:38.990854,0 days 00:03:03.061309,identity,min,0.007521293868696098,9,14,bell,COMPLETE
493,2.472261621733196e-05,2025-07-15 23:47:38.991977,2025-07-15 23:50:58.080355,0 days 00:03:19.088378,identity,min,0.008038304975411054,9,16,sigmoid,COMPLETE
494,3.4946872347063618e-06,2025-07-15 23:50:58.081425,2025-07-15 23:54:33.555486,0 days 00:03:35.474061,identity,prod,0.006914158899360891,9,17,bell,COMPLETE
495,3.4753916224872228e-06,2025-07-15 23:54:33.556524,2025-07-15 23:57:51.343930,0 days 00:03:17.787406,identity,min,0.00808352699926336,9,15,bell,COMPLETE
496,7.034762347757351e-06,2025-07-15 23:57:51.345035,2025-07-16 00:00:56.254597,0 days 00:03:04.909562,identity,min,0.006364808749498649,9,14,bell,COMPLETE
497,3.848655524052447e-06,2025-07-16 00:00:56.255638,2025-07-16 00:03:42.685029,0 days 00:02:46.429391,identity,prod,0.007373269092989644,9,11,bell,COMPLETE
498,3.806083668678184e-06,2025-07-16 00:03:42.686126,2025-07-16 00:06:53.331053,0 days 00:03:10.644927,identity,min,0.008171980774883065,9,14,bell,COMPLETE
499,3.673035962492577e-06,2025-07-16 00:06:53.332133,2025-07-16 00:11:09.073003,0 days 00:04:15.740870,identity,prod,0.007353026017486663,9,22,gaussian,COMPLETE
