number,value,datetime_start,datetime_complete,duration,params_activation,params_batch_size,params_h,params_lr,params_seq_length,state
285,1.316251516342163,2025-07-16 15:48:35.427346,2025-07-16 15:54:08.828151,0 days 00:05:33.400805,relu,16,128,0.00040377435158016697,19,COMPLETE
286,4.357278157840483e-06,2025-07-16 15:54:08.829105,2025-07-16 15:59:39.523150,0 days 00:05:30.694045,identity,16,118,0.0003543915985441667,18,COMPLETE
287,7.061860287649324e-06,2025-07-16 15:59:39.524097,2025-07-16 16:02:42.647645,0 days 00:03:03.123548,identity,16,125,0.0004465410512038394,9,COMPLETE
288,3.153313855364104e-06,2025-07-16 16:02:42.648591,2025-07-16 16:08:00.277905,0 days 00:05:17.629314,identity,16,121,0.00037205318761622985,18,COMPLETE
289,3.7374124985944945e-06,2025-07-16 16:08:00.278876,2025-07-16 16:13:00.280367,0 days 00:05:00.001491,identity,16,120,0.00033779226033353,18,COMPLETE
290,3.373316985744168e-06,2025-07-16 16:13:00.281326,2025-07-16 16:18:14.153292,0 days 00:05:13.871966,identity,16,116,0.00038289238213906574,19,COMPLETE
291,3.651724910014309e-06,2025-07-16 16:18:14.154227,2025-07-16 16:24:01.208181,0 days 00:05:47.053954,identity,16,121,0.0003040391038781745,20,COMPLETE
292,3.5066730106336763e-06,2025-07-16 16:24:01.209141,2025-07-16 16:29:21.125524,0 days 00:05:19.916383,identity,16,122,0.0003691687636533745,18,COMPLETE
293,0.0006053575780242682,2025-07-16 16:29:21.126502,2025-07-16 16:31:33.028113,0 days 00:02:11.901611,identity,64,118,0.0002540340478849946,18,COMPLETE
294,4.025634552817792e-06,2025-07-16 16:31:33.029044,2025-07-16 16:39:09.244379,0 days 00:07:36.215335,identity,16,123,0.00040835198293436947,18,COMPLETE
295,2.9291668397490866e-06,2025-07-16 16:39:09.245367,2025-07-16 16:44:33.063653,0 days 00:05:23.818286,identity,16,120,0.00028190685506489433,19,COMPLETE
296,3.6185931548970984e-06,2025-07-16 16:44:33.064622,2025-07-16 16:53:48.588761,0 days 00:09:15.524139,identity,16,113,0.00033089289434930105,19,COMPLETE
297,0.0005892090266570449,2025-07-16 16:53:48.589754,2025-07-16 16:55:36.658325,0 days 00:01:48.068571,identity,128,118,0.0002888689998269306,19,COMPLETE
298,3.940833266824484e-06,2025-07-16 16:55:36.659272,2025-07-16 17:01:16.182337,0 days 00:05:39.523065,identity,16,121,0.0003586483206618135,19,COMPLETE
299,4.457902832655236e-06,2025-07-16 17:01:16.183340,2025-07-16 17:09:19.456915,0 days 00:08:03.273575,identity,16,115,0.00042761207158262433,19,COMPLETE
300,4.162222921877401e-06,2025-07-16 17:09:19.457859,2025-07-16 17:14:59.677146,0 days 00:05:40.219287,identity,16,119,0.00032002092139351944,15,COMPLETE
301,8.921275730244815e-05,2025-07-16 17:14:59.678121,2025-07-16 17:18:11.698446,0 days 00:03:12.020325,identity,16,18,0.0003932213496834975,19,COMPLETE
302,3.827283308055485e-06,2025-07-16 17:18:11.699432,2025-07-16 17:25:04.782844,0 days 00:06:53.083412,identity,16,125,0.00022623073897384295,17,COMPLETE
303,6.679228681605309e-05,2025-07-16 17:25:04.783805,2025-07-16 17:28:24.875744,0 days 00:03:20.091939,identity,32,121,0.00028569588526833903,20,COMPLETE
304,1.3172639608383179,2025-07-16 17:28:24.876892,2025-07-16 17:33:45.928935,0 days 00:05:21.052043,relu,16,123,0.00035693401737565657,14,COMPLETE
305,4.976693617209094e-06,2025-07-16 17:33:45.929951,2025-07-16 17:39:21.782398,0 days 00:05:35.852447,identity,16,117,0.0004424703467292657,19,COMPLETE
306,4.234982952766586e-06,2025-07-16 17:39:21.783364,2025-07-16 17:46:39.226025,0 days 00:07:17.442661,identity,16,126,0.0003154172472874576,17,COMPLETE
307,4.887341674475465e-06,2025-07-16 17:46:39.226967,2025-07-16 17:51:57.579980,0 days 00:05:18.353013,identity,16,120,0.0003944205071154825,18,COMPLETE
308,3.3669314234430203e-06,2025-07-16 17:51:57.580985,2025-07-16 17:58:01.394489,0 days 00:06:03.813504,identity,16,85,0.00034234770148246235,19,COMPLETE
309,3.794388931055437e-06,2025-07-16 17:58:01.395468,2025-07-16 18:05:44.258579,0 days 00:07:42.863111,identity,16,126,0.0004268349222935223,18,COMPLETE
310,3.7931965835014125e-06,2025-07-16 18:05:44.259537,2025-07-16 18:13:09.407382,0 days 00:07:25.147845,identity,16,123,0.0005008981760396596,18,COMPLETE
311,4.149944743403466e-06,2025-07-16 18:13:09.408329,2025-07-16 18:18:54.309272,0 days 00:05:44.900943,identity,16,119,0.0002785260799313966,19,COMPLETE
312,3.6095614177611424e-06,2025-07-16 18:18:54.310200,2025-07-16 18:26:26.692516,0 days 00:07:32.382316,identity,16,124,0.0003824550384927639,18,COMPLETE
313,4.309534688218264e-06,2025-07-16 18:26:26.693455,2025-07-16 18:32:36.139446,0 days 00:06:09.445991,identity,16,111,0.0003174709486442561,17,COMPLETE
314,3.7833347050764132e-06,2025-07-16 18:32:36.140395,2025-07-16 18:39:43.092003,0 days 00:07:06.951608,identity,16,128,0.0002543045721534589,18,COMPLETE
315,0.001718913554213941,2025-07-16 18:39:43.092957,2025-07-16 18:42:52.731573,0 days 00:03:09.638616,identity,16,8,0.00016794836321224098,20,COMPLETE
316,4.815537522517843e-06,2025-07-16 18:42:52.732543,2025-07-16 18:46:59.090412,0 days 00:04:06.357869,identity,16,58,0.00035714340215477566,19,COMPLETE
317,3.961896709370194e-06,2025-07-16 18:46:59.091437,2025-07-16 18:52:17.834213,0 days 00:05:18.742776,identity,16,122,0.0004231895366240253,18,COMPLETE
318,3.4039042020594934e-06,2025-07-16 18:52:17.835191,2025-07-16 18:57:23.228052,0 days 00:05:05.392861,identity,16,116,0.0002960242188715627,18,COMPLETE
319,4.332103344495408e-06,2025-07-16 18:57:23.229012,2025-07-16 19:00:09.307153,0 days 00:02:46.078141,identity,16,126,0.0004567082769716833,8,COMPLETE
320,0.0007481406209990382,2025-07-16 19:00:09.308121,2025-07-16 19:02:02.285282,0 days 00:01:52.977161,identity,64,91,0.00038465840024316437,18,COMPLETE
321,5.1618603720271494e-06,2025-07-16 19:02:02.286229,2025-07-16 19:08:16.041512,0 days 00:06:13.755283,identity,16,77,0.0005392204034451228,19,COMPLETE
322,3.26678782585077e-05,2025-07-16 19:08:16.042513,2025-07-16 19:11:34.168999,0 days 00:03:18.126486,identity,32,121,0.0003381748452762815,19,COMPLETE
323,6.087017482059309e-06,2025-07-16 19:11:34.169964,2025-07-16 19:19:11.463395,0 days 00:07:37.293431,identity,16,124,0.0014005577132247039,18,COMPLETE
324,1.3165440559387207,2025-07-16 19:19:11.464361,2025-07-16 19:20:55.849395,0 days 00:01:44.385034,relu,128,126,0.000221901694970408,17,COMPLETE
325,3.4920010421046754e-06,2025-07-16 19:20:55.850337,2025-07-16 19:26:27.480107,0 days 00:05:31.629770,identity,16,119,0.0002680208085400045,18,COMPLETE
326,3.667992359623895e-06,2025-07-16 19:26:27.481043,2025-07-16 19:32:44.253108,0 days 00:06:16.772065,identity,16,114,0.00041220918802155413,17,COMPLETE
327,3.897387614415493e-06,2025-07-16 19:32:44.254065,2025-07-16 19:39:08.617252,0 days 00:06:24.363187,identity,16,122,0.00048376880946691036,19,COMPLETE
328,3.1319414119934663e-06,2025-07-16 19:39:08.618222,2025-07-16 19:46:20.547838,0 days 00:07:11.929616,identity,16,128,0.00023878964898238475,18,COMPLETE
329,2.5116696633631364e-05,2025-07-16 19:46:20.548850,2025-07-16 19:53:45.622004,0 days 00:07:25.073154,identity,16,128,0.00020154426973204565,18,COMPLETE
330,3.55717111233389e-06,2025-07-16 19:53:45.623118,2025-07-16 19:59:31.943606,0 days 00:05:46.320488,identity,16,128,0.0002404616356847177,16,COMPLETE
331,3.558251364665921e-06,2025-07-16 19:59:31.944579,2025-07-16 20:05:22.908845,0 days 00:05:50.964266,identity,16,126,0.00023713852753950255,19,COMPLETE
332,3.3780765988922212e-06,2025-07-16 20:05:22.909830,2025-07-16 20:10:40.641289,0 days 00:05:17.731459,identity,16,117,0.0002728917623171738,18,COMPLETE
333,3.997314252046635e-06,2025-07-16 20:10:40.642300,2025-07-16 20:18:24.616602,0 days 00:07:43.974302,identity,16,124,0.0002163700754117051,18,COMPLETE
334,4.125930445297854e-06,2025-07-16 20:18:24.617603,2025-07-16 20:23:47.161757,0 days 00:05:22.544154,identity,16,120,0.000306005035037085,19,COMPLETE
335,0.00024068166385404766,2025-07-16 20:23:47.162744,2025-07-16 20:27:04.192130,0 days 00:03:17.029386,identity,16,48,0.00025417471373062237,17,COMPLETE
336,3.31643514073221e-06,2025-07-16 20:27:04.193170,2025-07-16 20:35:06.355187,0 days 00:08:02.162017,identity,16,126,0.00034148906913069433,18,COMPLETE
337,4.107890163140837e-06,2025-07-16 20:35:06.356175,2025-07-16 20:42:33.692936,0 days 00:07:27.336761,identity,16,128,0.00029344972039146874,18,COMPLETE
338,2.891890062528546e-06,2025-07-16 20:42:33.693942,2025-07-16 20:48:38.345997,0 days 00:06:04.652055,identity,16,123,0.00036629135710335153,20,COMPLETE
339,5.121695267007453e-06,2025-07-16 20:48:38.347065,2025-07-16 20:54:28.565299,0 days 00:05:50.218234,identity,16,122,0.0003675260124960229,20,COMPLETE
340,3.1491574645770015e-06,2025-07-16 20:54:28.566304,2025-07-16 21:00:30.990769,0 days 00:06:02.424465,identity,16,125,0.00037004183475362434,20,COMPLETE
341,3.4676709219638724e-06,2025-07-16 21:00:30.991769,2025-07-16 21:06:17.231103,0 days 00:05:46.239334,identity,16,124,0.00034220329238952385,20,COMPLETE
342,3.3713920402078656e-06,2025-07-16 21:06:17.232140,2025-07-16 21:12:08.361847,0 days 00:05:51.129707,identity,16,122,0.0003224584920771616,20,COMPLETE
343,0.0007004799554124475,2025-07-16 21:12:08.362907,2025-07-16 21:14:42.169984,0 days 00:02:33.807077,identity,64,126,0.00037541174820959056,20,COMPLETE
344,1.3161295652389526,2025-07-16 21:14:42.170949,2025-07-16 21:20:35.768570,0 days 00:05:53.597621,relu,16,119,0.0025629759352122877,20,COMPLETE
345,3.009360170835862e-06,2025-07-16 21:20:35.769604,2025-07-16 21:26:15.829063,0 days 00:05:40.059459,identity,16,128,0.00036427689994373576,16,COMPLETE
346,3.525616648403229e-06,2025-07-16 21:26:15.830047,2025-07-16 21:31:58.908150,0 days 00:05:43.078103,identity,16,128,0.0003718501959680149,20,COMPLETE
347,0.0007123315008357167,2025-07-16 21:31:58.909168,2025-07-16 21:33:53.238659,0 days 00:01:54.329491,identity,128,124,0.0004108469965153303,20,COMPLETE
348,3.443942432568292e-06,2025-07-16 21:33:53.239639,2025-07-16 21:39:22.138665,0 days 00:05:28.899026,identity,16,128,0.00035924230082930224,20,COMPLETE
349,1.168320159194991e-05,2025-07-16 21:39:22.139705,2025-07-16 21:42:45.205903,0 days 00:03:23.066198,identity,32,121,0.00044399282572601706,20,COMPLETE
350,4.420265213411767e-06,2025-07-16 21:42:45.206910,2025-07-16 21:50:57.089811,0 days 00:08:11.882901,identity,16,123,0.0003875060455656195,18,COMPLETE
351,3.5135815323883435e-06,2025-07-16 21:50:57.090850,2025-07-16 21:58:27.464109,0 days 00:07:30.373259,identity,16,125,0.0003225112978487573,17,COMPLETE
352,4.87138504468021e-06,2025-07-16 21:58:27.465144,2025-07-16 22:05:29.366189,0 days 00:07:01.901045,identity,16,118,0.0003466736490126017,20,COMPLETE
353,3.775141522055492e-06,2025-07-16 22:05:30.372477,2025-07-16 22:11:37.238034,0 days 00:06:06.865557,identity,16,121,0.00041748956312183985,18,COMPLETE
354,4.385062311484944e-06,2025-07-16 22:11:38.268269,2025-07-16 22:20:51.187039,0 days 00:09:12.918770,identity,16,126,0.0003868632437476552,17,COMPLETE
355,3.941757768188836e-06,2025-07-16 22:20:51.188047,2025-07-16 22:30:10.637403,0 days 00:09:19.449356,identity,16,128,0.0003242679739470461,18,COMPLETE
356,4.008105861430522e-06,2025-07-16 22:30:10.838796,2025-07-16 22:36:24.124345,0 days 00:06:13.285549,identity,16,124,0.00044529678853863665,19,COMPLETE
357,3.346534867887385e-06,2025-07-16 22:36:24.125443,2025-07-16 22:41:55.680497,0 days 00:05:31.555054,identity,16,120,0.00036800579451006453,18,COMPLETE
358,4.275831997802015e-06,2025-07-16 22:41:55.681492,2025-07-16 22:49:30.671577,0 days 00:07:34.990085,identity,16,123,0.0004057517717073038,17,COMPLETE
359,3.4201470953121316e-06,2025-07-16 22:49:30.672641,2025-07-16 22:57:36.421450,0 days 00:08:05.748809,identity,16,126,0.00035249593377207196,18,COMPLETE
360,8.986651664599776e-06,2025-07-16 22:57:36.422453,2025-07-16 23:03:19.781531,0 days 00:05:43.359078,identity,16,117,0.0018368465157418935,19,COMPLETE
361,3.861278401018353e-06,2025-07-16 23:03:19.782519,2025-07-16 23:09:12.372744,0 days 00:05:52.590225,identity,16,122,0.000486967611090547,20,COMPLETE
362,3.5176906294509536e-06,2025-07-16 23:09:12.373733,2025-07-16 23:16:59.716122,0 days 00:07:47.342389,identity,16,128,0.0002953229673514463,18,COMPLETE
363,7.415430900437059e-06,2025-07-16 23:16:59.717120,2025-07-16 23:22:03.936757,0 days 00:05:04.219637,relu,16,120,0.00032569311240888705,18,COMPLETE
364,6.22965490038041e-06,2025-07-16 23:22:03.937784,2025-07-16 23:25:18.962878,0 days 00:03:15.025094,identity,16,68,0.0004332222362847536,15,COMPLETE
365,1.9209412130294368e-05,2025-07-16 23:25:18.963896,2025-07-16 23:31:04.627589,0 days 00:05:45.663693,identity,16,125,0.003448902086839497,19,COMPLETE
366,3.0828566650598077e-06,2025-07-16 23:31:04.628585,2025-07-16 23:39:25.148595,0 days 00:08:20.520010,identity,16,124,0.00037990617052463576,18,COMPLETE
367,2.712347622946254e-06,2025-07-16 23:39:25.149602,2025-07-16 23:44:42.851428,0 days 00:05:17.701826,identity,16,117,0.0003751905104240045,18,COMPLETE
368,5.4792858463770244e-06,2025-07-16 23:44:42.852424,2025-07-16 23:49:58.387843,0 days 00:05:15.535419,identity,16,116,0.0003480233520823395,18,COMPLETE
369,0.0004907837137579918,2025-07-16 23:49:58.388849,2025-07-16 23:52:11.573427,0 days 00:02:13.184578,identity,64,118,0.00031843509732712303,18,COMPLETE
370,3.0012804472789867e-06,2025-07-16 23:52:11.574439,2025-07-17 00:01:24.357942,0 days 00:09:12.783503,identity,16,114,0.00038080239155613454,19,COMPLETE
371,5.1678839554369915e-06,2025-07-17 00:01:24.359001,2025-07-17 00:07:35.498348,0 days 00:06:11.139347,identity,16,113,0.0003776217341106464,17,COMPLETE
372,4.771862677444005e-06,2025-07-17 00:07:35.499353,2025-07-17 00:17:16.775785,0 days 00:09:41.276432,identity,16,115,0.0003979506658282669,20,COMPLETE
373,3.2469215511810035e-06,2025-07-17 00:17:16.776901,2025-07-17 00:23:28.744794,0 days 00:06:11.967893,identity,16,98,0.0003601538003502096,18,COMPLETE
374,0.00033082865411415696,2025-07-17 00:23:28.745806,2025-07-17 00:24:42.494622,0 days 00:01:13.748816,identity,128,113,0.0003495337419380211,13,COMPLETE
375,1.2030725883960258e-05,2025-07-17 00:24:42.495654,2025-07-17 00:27:57.154927,0 days 00:03:14.659273,identity,32,117,0.00040152346673211523,19,COMPLETE
376,8.953587894211523e-06,2025-07-17 00:27:57.155945,2025-07-17 00:31:25.914390,0 days 00:03:28.758445,identity,16,123,0.0003025897918178,10,COMPLETE
377,3.399858542252332e-06,2025-07-17 00:31:25.915392,2025-07-17 00:37:21.812556,0 days 00:05:55.897164,identity,16,128,0.00046165596459705934,16,COMPLETE
378,4.019041170977289e-06,2025-07-17 00:37:21.813585,2025-07-17 00:43:39.625162,0 days 00:06:17.811577,identity,16,110,0.00069998237494923,18,COMPLETE
379,4.092854396731127e-06,2025-07-17 00:43:39.626179,2025-07-17 00:49:15.670744,0 days 00:05:36.044565,identity,16,119,0.00038126994515449763,19,COMPLETE
380,4.000144599558553e-06,2025-07-17 00:49:15.671768,2025-07-17 00:57:38.257829,0 days 00:08:22.586061,identity,16,125,0.00033587122599732855,18,COMPLETE
381,3.752516704480513e-06,2025-07-17 00:57:38.258878,2025-07-17 01:03:33.754649,0 days 00:05:55.495771,identity,16,122,0.000440552696557069,19,COMPLETE
382,3.59159275831189e-06,2025-07-17 01:03:33.755678,2025-07-17 01:11:56.812632,0 days 00:08:23.056954,identity,16,126,0.00037140898888878866,17,COMPLETE
383,4.2415858843014576e-06,2025-07-17 01:11:56.813654,2025-07-17 01:20:45.428121,0 days 00:08:48.614467,identity,16,123,0.0003123673235709337,18,COMPLETE
384,1.316388487815857,2025-07-17 01:20:45.429169,2025-07-17 01:27:05.287886,0 days 00:06:19.858717,relu,16,108,0.0004157289014196658,18,COMPLETE
385,4.369982434582198e-06,2025-07-17 01:27:05.288908,2025-07-17 01:33:26.740972,0 days 00:06:21.452064,identity,16,115,0.0002812100264038462,17,COMPLETE
386,1.779421290848404e-05,2025-07-17 01:33:26.742002,2025-07-17 01:38:42.092906,0 days 00:05:15.350904,identity,16,120,0.006708383516692346,18,COMPLETE
387,0.000442522024968639,2025-07-17 01:38:42.093943,2025-07-17 01:44:33.154987,0 days 00:05:51.061044,identity,16,126,0.00012860973241337226,19,COMPLETE
388,5.134201728651533e-06,2025-07-17 01:44:33.156004,2025-07-17 01:50:06.799168,0 days 00:05:33.643164,identity,16,128,0.0005143877703284523,20,COMPLETE
389,3.735815880645532e-06,2025-07-17 01:50:06.800267,2025-07-17 01:58:32.774363,0 days 00:08:25.974096,identity,16,124,0.00033232956818755513,18,COMPLETE
390,3.2857740279723657e-06,2025-07-17 01:58:32.775395,2025-07-17 02:04:45.010745,0 days 00:06:12.235350,identity,16,119,0.0003762280958393156,18,COMPLETE
391,5.888175110158045e-06,2025-07-17 02:04:45.011772,2025-07-17 02:11:04.759655,0 days 00:06:19.747883,identity,16,121,0.00041743555955405914,16,COMPLETE
392,3.686364607347059e-06,2025-07-17 02:11:04.760659,2025-07-17 02:17:54.134358,0 days 00:06:49.373699,identity,16,117,0.0003462653660908203,19,COMPLETE
393,5.508666617970448e-06,2025-07-17 02:17:54.135443,2025-07-17 02:26:03.872139,0 days 00:08:09.736696,identity,16,124,0.0004724504601910415,18,COMPLETE
394,4.356629688118119e-06,2025-07-17 02:26:03.873151,2025-07-17 02:33:55.046953,0 days 00:07:51.173802,identity,16,126,0.00039631727153712534,17,COMPLETE
395,0.0004583272966556251,2025-07-17 02:33:55.047990,2025-07-17 02:36:17.911102,0 days 00:02:22.863112,identity,64,122,0.00030277081979698263,19,COMPLETE
396,3.4633967516128905e-06,2025-07-17 02:36:17.912155,2025-07-17 02:41:56.368978,0 days 00:05:38.456823,identity,16,128,0.0003596579396865419,20,COMPLETE
397,7.807010842952877e-05,2025-07-17 02:41:56.369994,2025-07-17 02:45:09.570150,0 days 00:03:13.200156,identity,16,34,0.00027761187725705875,18,COMPLETE
398,0.0007171225734055042,2025-07-17 02:45:09.571147,2025-07-17 02:46:54.446216,0 days 00:01:44.875069,identity,128,124,0.0004317541054287724,18,COMPLETE
399,7.38915623514913e-05,2025-07-17 02:46:54.447229,2025-07-17 02:49:40.701109,0 days 00:02:46.253880,identity,32,120,0.00033575549259795963,17,COMPLETE
400,3.7577278817479964e-06,2025-07-17 02:49:40.702140,2025-07-17 02:55:22.724328,0 days 00:05:42.022188,identity,16,126,0.00037860832577759143,19,COMPLETE
401,3.991266112279845e-06,2025-07-17 02:55:22.725393,2025-07-17 03:03:19.977972,0 days 00:07:57.252579,identity,16,114,0.00031026384941149423,18,COMPLETE
402,3.908402050001314e-06,2025-07-17 03:03:19.979025,2025-07-17 03:08:41.373648,0 days 00:05:21.394623,identity,16,122,0.0004504319690876514,18,COMPLETE
403,1.316251516342163,2025-07-17 03:08:41.374701,2025-07-17 03:14:14.893160,0 days 00:05:33.518459,relu,16,118,0.00040168125826636937,19,COMPLETE
404,3.4335760119574843e-06,2025-07-17 03:14:14.894173,2025-07-17 03:22:14.327981,0 days 00:07:59.433808,identity,16,124,0.00035301292140443576,18,COMPLETE
405,3.5596510770119494e-06,2025-07-17 03:22:14.329047,2025-07-17 03:27:48.118929,0 days 00:05:33.789882,identity,16,128,0.0004996630427305426,20,COMPLETE
406,4.677607194025768e-06,2025-07-17 03:27:48.119980,2025-07-17 03:35:32.381318,0 days 00:07:44.261338,identity,16,121,0.0011468808825187212,17,COMPLETE
407,3.693887038025423e-06,2025-07-17 03:35:32.382345,2025-07-17 03:43:42.711987,0 days 00:08:10.329642,identity,16,126,0.00032388340726580286,18,COMPLETE
408,3.2203872706304537e-06,2025-07-17 03:43:42.713043,2025-07-17 03:49:21.953466,0 days 00:05:39.240423,identity,16,116,0.00040449845838078,15,COMPLETE
409,3.510426904540509e-05,2025-07-17 03:49:21.954521,2025-07-17 03:54:58.691313,0 days 00:05:36.736792,identity,16,111,0.00027744872726730906,15,COMPLETE
410,4.921639629174024e-06,2025-07-17 03:54:58.692304,2025-07-17 04:00:18.478614,0 days 00:05:19.786310,identity,16,115,0.0003715278990401256,14,COMPLETE
411,3.6338490190246375e-06,2025-07-17 04:00:18.479630,2025-07-17 04:05:45.671140,0 days 00:05:27.191510,identity,16,117,0.0004148311802463881,14,COMPLETE
412,4.093767074664356e-06,2025-07-17 04:05:45.672163,2025-07-17 04:11:27.353494,0 days 00:05:41.681331,identity,16,116,0.00033978215206316106,15,COMPLETE
413,4.84027214042726e-06,2025-07-17 04:11:27.354517,2025-07-17 04:18:05.559810,0 days 00:06:38.205293,identity,16,119,0.0008087654449424525,17,COMPLETE
414,3.8347739064192865e-06,2025-07-17 04:18:05.560861,2025-07-17 04:23:49.283460,0 days 00:05:43.722599,identity,16,114,0.0003035197216222254,16,COMPLETE
415,5.440376298793126e-06,2025-07-17 04:23:49.284499,2025-07-17 04:28:38.564083,0 days 00:04:49.279584,identity,16,82,0.00039991738649485355,15,COMPLETE
416,4.390864887682255e-06,2025-07-17 04:28:38.565082,2025-07-17 04:34:01.968465,0 days 00:05:23.403383,identity,16,128,0.000245322661484585,16,COMPLETE
417,3.1931087960401783e-06,2025-07-17 04:34:01.969496,2025-07-17 04:39:42.279893,0 days 00:05:40.310397,identity,16,124,0.0003501655503382424,16,COMPLETE
418,3.677799668366788e-06,2025-07-17 04:39:42.280904,2025-07-17 04:45:29.340923,0 days 00:05:47.060019,identity,16,125,0.00029229180846364463,16,COMPLETE
419,3.4995337045984343e-06,2025-07-17 04:45:29.341960,2025-07-17 04:51:16.919952,0 days 00:05:47.577992,identity,16,123,0.0003296222581635297,16,COMPLETE
420,0.00017618377751205117,2025-07-17 04:51:16.920979,2025-07-17 04:53:00.813244,0 days 00:01:43.892265,identity,64,112,0.0009849106440530777,16,COMPLETE
421,4.046572485094657e-06,2025-07-17 04:53:00.814279,2025-07-17 04:58:27.768070,0 days 00:05:26.953791,identity,16,126,0.0003620389519231267,15,COMPLETE
422,3.4187323763035238e-06,2025-07-17 04:58:27.769104,2025-07-17 05:03:53.622966,0 days 00:05:25.853862,identity,16,119,0.0002652238951781868,15,COMPLETE
423,1.9441898984950967e-05,2025-07-17 05:03:53.623996,2025-07-17 05:06:13.222092,0 days 00:02:19.598096,identity,32,128,0.0004386099866701564,14,COMPLETE
424,3.8733132896595635e-06,2025-07-17 05:06:13.223170,2025-07-17 05:11:40.933849,0 days 00:05:27.710679,identity,16,122,0.00038881239695052957,15,COMPLETE
425,1.3167331218719482,2025-07-17 05:11:40.934922,2025-07-17 05:13:14.967532,0 days 00:01:34.032610,relu,128,124,0.00031650222491525664,16,COMPLETE
426,4.121853635297157e-06,2025-07-17 05:13:14.968552,2025-07-17 05:19:17.062068,0 days 00:06:02.093516,identity,16,118,0.00036020007140028746,17,COMPLETE
