number,value,datetime_start,datetime_complete,duration,params_activation,params_batch_size,params_h,params_lr,params_seq_length,state
427,4.018570507469121e-06,2025-07-17 05:19:17.063102,2025-07-17 05:26:13.188732,0 days 00:06:56.125630,identity,16,121,0.00043340307476538443,17,COMPLETE
428,3.7010192954767263e-06,2025-07-17 05:26:13.189772,2025-07-17 05:32:04.373024,0 days 00:05:51.183252,identity,16,126,0.00033640740564423803,16,COMPLETE
429,0.00036400783574208617,2025-07-17 05:32:04.374075,2025-07-17 05:39:04.382480,0 days 00:07:00.008405,identity,16,128,0.0001433543802513914,18,COMPLETE
430,3.914610260835616e-06,2025-07-17 05:39:04.383514,2025-07-17 05:44:30.132353,0 days 00:05:25.748839,identity,16,124,0.0005447267299200848,15,COMPLETE
431,3.4694571695581544e-06,2025-07-17 05:44:30.133382,2025-07-17 05:50:18.937272,0 days 00:05:48.803890,identity,16,116,0.00038286281898754714,18,COMPLETE
432,4.741230441140942e-06,2025-07-17 05:50:18.938293,2025-07-17 05:55:22.260724,0 days 00:05:03.322431,identity,16,120,0.00022137985722803496,18,COMPLETE
433,3.2237937830359442e-06,2025-07-17 05:55:22.261751,2025-07-17 06:02:54.503649,0 days 00:07:32.241898,identity,16,123,0.0002892902803375615,17,COMPLETE
434,2.839907210727688e-06,2025-07-17 06:02:54.504674,2025-07-17 06:09:10.190128,0 days 00:06:15.685454,identity,16,126,0.0004898255031725631,20,COMPLETE
435,5.041315489506815e-06,2025-07-17 06:09:10.191161,2025-07-17 06:15:06.349534,0 days 00:05:56.158373,identity,16,126,0.0004917122188286488,20,COMPLETE
436,3.563594646038837e-06,2025-07-17 06:15:06.350573,2025-07-17 06:21:02.756490,0 days 00:05:56.405917,identity,16,126,0.0004631863168302041,20,COMPLETE
437,3.056286459468538e-06,2025-07-17 06:21:02.757552,2025-07-17 06:26:33.156873,0 days 00:05:30.399321,identity,16,128,0.00026780727628448396,20,COMPLETE
438,5.5922232604643796e-06,2025-07-17 06:26:33.157927,2025-07-17 06:32:03.425944,0 days 00:05:30.268017,identity,16,128,0.0002482226397129538,20,COMPLETE
439,3.4197710192529485e-06,2025-07-17 06:32:03.426996,2025-07-17 06:37:33.704143,0 days 00:05:30.277147,identity,16,128,0.0002742471541862553,20,COMPLETE
440,1.6909501937334426e-05,2025-07-17 06:37:33.705173,2025-07-17 06:43:35.515462,0 days 00:06:01.810289,identity,16,125,0.00020598075042954089,20,COMPLETE
441,3.3561013879079837e-06,2025-07-17 06:43:35.516498,2025-07-17 06:49:06.672646,0 days 00:05:31.156148,identity,16,128,0.0002714718696024957,20,COMPLETE
442,3.6202927731210366e-06,2025-07-17 06:49:06.673696,2025-07-17 06:55:08.884157,0 days 00:06:02.210461,identity,16,125,0.0002449296631155587,20,COMPLETE
443,4.393434664962115e-06,2025-07-17 06:55:08.885202,2025-07-17 07:01:10.233479,0 days 00:06:01.348277,identity,16,125,0.0002925168543902061,20,COMPLETE
444,1.3161295652389526,2025-07-17 07:01:10.234509,2025-07-17 07:06:40.985720,0 days 00:05:30.751211,relu,16,128,0.0006274501674119558,20,COMPLETE
445,0.00021130037202965468,2025-07-17 07:06:40.986740,2025-07-17 07:07:54.153300,0 days 00:01:13.166560,identity,64,123,0.00033558930927797195,9,COMPLETE
446,2.9887823984608985e-06,2025-07-17 07:07:54.154350,2025-07-17 07:13:50.964409,0 days 00:05:56.810059,identity,16,126,0.000308011901123827,20,COMPLETE
447,3.6974424801883288e-06,2025-07-17 07:13:50.965457,2025-07-17 07:19:46.202876,0 days 00:05:55.237419,identity,16,123,0.00031079961989079793,20,COMPLETE
448,6.162566933198832e-06,2025-07-17 07:19:46.203936,2025-07-17 07:25:42.973262,0 days 00:05:56.769326,identity,16,126,0.0021591484595240586,20,COMPLETE
449,0.0009851626818999648,2025-07-17 07:25:42.974323,2025-07-17 07:28:55.355772,0 days 00:03:12.381449,identity,32,128,0.0001875339092382095,20,COMPLETE
450,3.64443326361652e-06,2025-07-17 07:28:55.356822,2025-07-17 07:34:42.122728,0 days 00:05:46.765906,identity,16,124,0.00030536987182128226,20,COMPLETE
451,0.0007150927558541298,2025-07-17 07:34:42.123790,2025-07-17 07:36:38.780223,0 days 00:01:56.656433,identity,128,121,0.00023090828940484676,20,COMPLETE
452,4.025958787678974e-06,2025-07-17 07:36:38.781272,2025-07-17 07:42:40.958050,0 days 00:06:02.176778,identity,16,125,0.00035978033215713977,20,COMPLETE
453,5.361373951018322e-06,2025-07-17 07:42:40.959076,2025-07-17 07:48:31.778195,0 days 00:05:50.819119,identity,16,122,0.00032908528783666884,20,COMPLETE
454,4.064608219778165e-06,2025-07-17 07:48:31.779266,2025-07-17 07:54:27.826430,0 days 00:05:56.047164,identity,16,126,0.0004259585834769877,20,COMPLETE
455,3.1604226933268365e-06,2025-07-17 07:54:27.827508,2025-07-17 07:59:58.140506,0 days 00:05:30.312998,identity,16,128,0.0002596998341366651,20,COMPLETE
456,3.6194037420500536e-06,2025-07-17 07:59:58.141576,2025-07-17 08:05:28.520366,0 days 00:05:30.378790,identity,16,128,0.0002477458530938046,20,COMPLETE
457,3.7533757222263375e-06,2025-07-17 08:05:28.521434,2025-07-17 08:10:58.672386,0 days 00:05:30.150952,identity,16,128,0.0002561675153656517,20,COMPLETE
458,3.1267268241208512e-06,2025-07-17 08:10:58.673485,2025-07-17 08:16:56.251235,0 days 00:05:57.577750,identity,16,126,0.00026497063082446163,20,COMPLETE
459,1.3982837117509916e-05,2025-07-17 08:16:56.252326,2025-07-17 08:22:26.979703,0 days 00:05:30.727377,identity,16,128,0.00021678878589068997,20,COMPLETE
460,5.330858130037086e-06,2025-07-17 08:22:26.980758,2025-07-17 08:28:24.487286,0 days 00:05:57.506528,identity,16,126,0.00023606600803690613,20,COMPLETE
461,3.336107283757883e-06,2025-07-17 08:28:24.488351,2025-07-17 08:34:22.432773,0 days 00:05:57.944422,identity,16,126,0.00026844298692261837,20,COMPLETE
462,3.97753592551453e-06,2025-07-17 08:34:22.433833,2025-07-17 08:41:10.018365,0 days 00:06:47.584532,identity,16,79,0.00026471512709326934,20,COMPLETE
463,3.8105531530163717e-06,2025-07-17 08:41:10.019448,2025-07-17 08:47:46.337881,0 days 00:06:36.318433,relu,16,123,0.0002811113357428037,20,COMPLETE
464,3.3576557143533137e-06,2025-07-17 08:47:46.338939,2025-07-17 08:53:35.179973,0 days 00:05:48.841034,identity,16,126,0.00023563344649851596,20,COMPLETE
465,4.891066964773927e-06,2025-07-17 08:53:35.180976,2025-07-17 08:59:36.029816,0 days 00:06:00.848840,identity,16,121,0.0002132945278746064,20,COMPLETE
466,3.050373152291286e-06,2025-07-17 08:59:36.030879,2025-07-17 09:06:58.837184,0 days 00:07:22.806305,identity,16,128,0.0002972864639798785,20,COMPLETE
467,3.6772808016394265e-06,2025-07-17 09:06:58.838214,2025-07-17 09:12:39.871934,0 days 00:05:41.033720,identity,16,128,0.0002591002169579748,20,COMPLETE
468,3.3481082937214524e-06,2025-07-17 09:12:39.872954,2025-07-17 09:18:28.498742,0 days 00:05:48.625788,identity,16,128,0.0002927099652642065,20,COMPLETE
469,4.112823717150604e-06,2025-07-17 09:18:28.499829,2025-07-17 09:24:24.513453,0 days 00:05:56.013624,identity,16,126,0.00029854532051730665,20,COMPLETE
470,3.767584303204785e-06,2025-07-17 09:24:24.514558,2025-07-17 09:30:10.266953,0 days 00:05:45.752395,identity,16,128,0.0002903944173902799,20,COMPLETE
471,0.0009501386666670442,2025-07-17 09:30:10.267961,2025-07-17 09:32:41.020832,0 days 00:02:30.752871,identity,64,125,0.00025586923398858116,20,COMPLETE
472,4.909738436253974e-06,2025-07-17 09:32:41.021847,2025-07-17 09:38:19.820627,0 days 00:05:38.798780,identity,16,124,0.0003129032777875582,20,COMPLETE
473,4.91699529447942e-06,2025-07-17 09:38:19.821661,2025-07-17 09:43:52.129023,0 days 00:05:32.307362,identity,16,128,0.00026653108591053257,20,COMPLETE
474,0.0005214808625169098,2025-07-17 09:43:52.130016,2025-07-17 09:47:24.594870,0 days 00:03:32.464854,identity,32,125,0.0002431902674462819,20,COMPLETE
475,4.113213435630314e-06,2025-07-17 09:47:24.595913,2025-07-17 09:53:21.462221,0 days 00:05:56.866308,identity,16,123,0.00031335023550177227,20,COMPLETE
476,0.00015868325135670602,2025-07-17 09:53:21.463288,2025-07-17 09:59:03.788877,0 days 00:05:42.325589,identity,16,126,0.00017135440160515107,19,COMPLETE
477,0.0014592333463951945,2025-07-17 09:59:03.789918,2025-07-17 10:01:03.234646,0 days 00:01:59.444728,identity,128,123,0.00020421128504968474,20,COMPLETE
478,3.7791658087371616e-06,2025-07-17 10:01:03.235708,2025-07-17 10:06:36.293898,0 days 00:05:33.058190,identity,16,128,0.0002852628015704493,20,COMPLETE
479,0.0006437502452172339,2025-07-17 10:06:36.295726,2025-07-17 10:10:17.477435,0 days 00:03:41.181709,identity,16,47,0.0002356377265641197,19,COMPLETE
480,3.149830263282638e-06,2025-07-17 10:10:17.478464,2025-07-17 10:16:00.703792,0 days 00:05:43.225328,identity,16,126,0.000267000885106885,19,COMPLETE
481,3.51736048287421e-06,2025-07-17 10:16:00.704792,2025-07-17 10:21:38.095114,0 days 00:05:37.390322,identity,16,122,0.0002601213311899635,19,COMPLETE
482,3.1716519970359514e-06,2025-07-17 10:21:38.096146,2025-07-17 10:27:16.990769,0 days 00:05:38.894623,identity,16,125,0.00028078020472689137,19,COMPLETE
483,3.0958556180848973e-06,2025-07-17 10:27:16.991804,2025-07-17 10:32:27.217207,0 days 00:05:10.225403,identity,16,120,0.0003076068591379806,19,COMPLETE
484,1.316251516342163,2025-07-17 10:32:27.218228,2025-07-17 10:38:03.378156,0 days 00:05:36.159928,relu,16,119,0.00031720462871564207,19,COMPLETE
485,4.6657492021040525e-06,2025-07-17 10:38:03.379199,2025-07-17 10:43:22.369111,0 days 00:05:18.989912,identity,16,120,0.0003171231691615981,19,COMPLETE
486,2.9486443509085802e-06,2025-07-17 10:43:22.370154,2025-07-17 10:48:41.419967,0 days 00:05:19.049813,identity,16,120,0.00029198000081672625,19,COMPLETE
487,3.8023561046429677e-06,2025-07-17 10:48:41.421012,2025-07-17 10:54:13.674479,0 days 00:05:32.253467,identity,16,118,0.0003020937170040164,19,COMPLETE
488,8.9203858806286e-06,2025-07-17 10:54:13.675540,2025-07-17 10:59:42.907351,0 days 00:05:29.231811,identity,16,121,0.0015989213848504051,19,COMPLETE
489,3.333921313242172e-06,2025-07-17 10:59:42.908390,2025-07-17 11:05:13.522619,0 days 00:05:30.614229,identity,16,123,0.00022652706345387152,19,COMPLETE
490,4.983828603144502e-06,2025-07-17 11:05:13.523641,2025-07-17 11:10:52.460903,0 days 00:05:38.937262,identity,16,121,0.0002793502313197422,19,COMPLETE
491,4.072365754836937e-06,2025-07-17 11:10:52.461945,2025-07-17 11:16:26.367474,0 days 00:05:33.905529,identity,16,124,0.0002839006803600366,19,COMPLETE
492,4.570930286718067e-06,2025-07-17 11:16:26.368513,2025-07-17 11:22:04.501123,0 days 00:05:38.132610,identity,16,119,0.0003258429959018277,19,COMPLETE
493,3.2842672226252034e-06,2025-07-17 11:22:04.502163,2025-07-17 11:27:46.047178,0 days 00:05:41.545015,identity,16,123,0.00029984493413710996,19,COMPLETE
494,3.5424993711785646e-06,2025-07-17 11:27:46.048231,2025-07-17 11:33:33.479415,0 days 00:05:47.431184,identity,16,125,0.0002620434139103614,19,COMPLETE
495,5.13798613610561e-06,2025-07-17 11:33:33.480687,2025-07-17 11:39:06.734016,0 days 00:05:33.253329,identity,16,118,0.00032545732351852986,19,COMPLETE
496,0.0006248194840736687,2025-07-17 11:39:06.735057,2025-07-17 11:41:29.104868,0 days 00:02:22.369811,identity,64,122,0.00024520846297006264,19,COMPLETE
497,3.5229529657954117e-06,2025-07-17 11:41:29.105913,2025-07-17 11:47:01.840030,0 days 00:05:32.734117,identity,16,126,0.0002811976975821255,19,COMPLETE
498,4.157362582191126e-06,2025-07-17 11:47:01.841068,2025-07-17 11:52:12.458541,0 days 00:05:10.617473,identity,16,120,0.0003415299397965612,19,COMPLETE
499,1.0810613275680225e-05,2025-07-17 11:52:12.459583,2025-07-17 11:57:43.049756,0 days 00:05:30.590173,identity,16,124,0.00021978995143782506,19,COMPLETE
