number,value,datetime_start,datetime_complete,duration,params_activation,params_and_operator,params_lr,params_n_sets,params_seq_length,params_shape,state
0,0.01238646823912859,2025-07-14 20:21:03.710753,2025-07-14 20:22:57.992702,0 days 00:01:54.281949,relu,prod,0.000868198673616447,6,5,bell,COMPLETE
1,0.003107425756752491,2025-07-14 20:22:57.993837,2025-07-14 20:24:35.844202,0 days 00:01:37.850365,relu,prod,0.0009301262776970101,7,5,sigmoid,COMPLETE
2,0.03446272015571594,2025-07-14 20:24:35.845528,2025-07-14 20:27:30.504978,0 days 00:02:54.659450,identity,min,0.0002995494450947979,9,14,sigmoid,COMPLETE
3,0.0003313568013254553,2025-07-14 20:27:30.505875,2025-07-14 20:30:13.770176,0 days 00:02:43.264301,identity,min,0.0027069084423801196,5,15,sigmoid,COMPLETE
4,0.2447303682565689,2025-07-14 20:30:13.771002,2025-07-14 20:33:06.252260,0 days 00:02:52.481258,identity,prod,0.0007840735193242554,7,14,gaussian,COMPLETE
5,0.0005066326120868325,2025-07-14 20:33:06.253190,2025-07-14 20:35:33.537607,0 days 00:02:27.284417,identity,prod,0.002260334025753572,7,10,bell,COMPLETE
6,1.2044919729232788,2025-07-14 20:35:33.538433,2025-07-14 20:38:18.562114,0 days 00:02:45.023681,relu,min,0.0015434080612524693,5,15,gaussian,COMPLETE
7,0.01228592824190855,2025-07-14 20:38:18.563004,2025-07-14 20:40:49.477908,0 days 00:02:30.914904,identity,prod,0.00028723113751538893,7,11,sigmoid,COMPLETE
8,0.045278243720531464,2025-07-14 20:40:49.478783,2025-07-14 20:42:34.483482,0 days 00:01:45.004699,identity,min,0.00017845993184080342,5,7,sigmoid,COMPLETE
9,0.14120537042617798,2025-07-14 20:42:34.484368,2025-07-14 20:45:40.869077,0 days 00:03:06.384709,identity,prod,0.00014251948506334935,6,16,gaussian,COMPLETE
10,0.017581697553396225,2025-07-14 20:45:40.869973,2025-07-14 20:49:55.499159,0 days 00:04:14.629186,relu,min,0.007886312471601334,9,23,sigmoid,COMPLETE
11,1.8801885744323954e-05,2025-07-14 20:49:55.500068,2025-07-14 20:53:43.478497,0 days 00:03:47.978429,identity,min,0.003433287200786051,8,20,bell,COMPLETE
12,0.0004890955751761794,2025-07-14 20:53:43.479409,2025-07-14 20:57:41.438431,0 days 00:03:57.959022,identity,min,0.005268396503603235,8,21,bell,COMPLETE
13,0.0002530840574763715,2025-07-14 20:57:41.439378,2025-07-14 21:01:21.414902,0 days 00:03:39.975524,identity,min,0.0033567038358327203,8,19,bell,COMPLETE
14,5.003873866371578e-06,2025-07-14 21:01:21.415821,2025-07-14 21:05:28.635483,0 days 00:04:07.219662,identity,min,0.003444832669353738,8,20,bell,COMPLETE
15,3.7884226458118064e-06,2025-07-14 21:05:28.636407,2025-07-14 21:09:59.480946,0 days 00:04:30.844539,identity,min,0.007367592188575081,8,25,bell,COMPLETE
16,3.597609065764118e-06,2025-07-14 21:09:59.481874,2025-07-14 21:14:36.774855,0 days 00:04:37.292981,identity,min,0.009461092507054769,9,25,bell,COMPLETE
17,3.680472900668974e-06,2025-07-14 21:14:36.775819,2025-07-14 21:19:13.289218,0 days 00:04:36.513399,identity,min,0.009233621033433354,9,25,bell,COMPLETE
18,1.4501064470096026e-05,2025-07-14 21:19:13.290210,2025-07-14 21:23:52.072118,0 days 00:04:38.781908,relu,min,0.00927604017218956,9,25,bell,COMPLETE
19,3.8820367080916185e-06,2025-07-14 21:23:52.073028,2025-07-14 21:27:27.203197,0 days 00:03:35.130169,identity,min,0.005633625510760031,9,18,bell,COMPLETE
20,0.004496338777244091,2025-07-14 21:27:27.204067,2025-07-14 21:31:39.221676,0 days 00:04:12.017609,identity,min,0.001511485333298612,9,22,bell,COMPLETE
21,3.6349435958982212e-06,2025-07-14 21:31:39.222660,2025-07-14 21:36:13.576028,0 days 00:04:34.353368,identity,min,0.009778844826237797,8,25,bell,COMPLETE
22,3.823885890597012e-06,2025-07-14 21:36:13.576971,2025-07-14 21:40:35.691409,0 days 00:04:22.114438,identity,min,0.004916914124820515,9,23,bell,COMPLETE
23,3.54955068360141e-06,2025-07-14 21:40:35.692360,2025-07-14 21:45:06.177849,0 days 00:04:30.485489,identity,min,0.00902322420418524,8,25,bell,COMPLETE
24,3.81182712771988e-06,2025-07-14 21:45:06.178826,2025-07-14 21:49:18.965608,0 days 00:04:12.786782,identity,min,0.005651974797959543,8,23,bell,COMPLETE
25,3.240551086491905e-05,2025-07-14 21:49:18.966571,2025-07-14 21:53:38.092255,0 days 00:04:19.125684,identity,min,0.009855845258041307,8,24,gaussian,COMPLETE
26,3.840279077849118e-06,2025-07-14 21:53:38.093183,2025-07-14 21:57:09.000831,0 days 00:03:30.907648,relu,min,0.004816576366905551,8,18,bell,COMPLETE
27,0.00583266094326973,2025-07-14 21:57:09.001807,2025-07-14 22:01:09.598402,0 days 00:04:00.596595,identity,min,0.0005522667270556241,6,22,bell,COMPLETE
28,0.00020699156448245049,2025-07-14 22:01:09.599330,2025-07-14 22:05:38.973611,0 days 00:04:29.374281,identity,min,0.001601218387666352,8,25,bell,COMPLETE
29,0.02271508239209652,2025-07-14 22:05:38.974614,2025-07-14 22:09:44.551780,0 days 00:04:05.577166,relu,prod,0.007121201389511059,7,22,bell,COMPLETE
30,0.00021265439863782376,2025-07-14 22:09:44.552683,2025-07-14 22:13:05.752056,0 days 00:03:21.199373,identity,min,0.002390776968324272,9,17,gaussian,COMPLETE
31,3.4757017601805273e-06,2025-07-14 22:13:05.753003,2025-07-14 22:17:34.649084,0 days 00:04:28.896081,identity,min,0.009399088524089294,9,24,bell,COMPLETE
32,3.738095983862877e-06,2025-07-14 22:17:34.650088,2025-07-14 22:22:02.909781,0 days 00:04:28.259693,identity,min,0.006075843646424922,9,24,bell,COMPLETE
33,3.858566742565017e-06,2025-07-14 22:22:02.910749,2025-07-14 22:26:29.755958,0 days 00:04:26.845209,identity,min,0.009855744839837663,9,24,bell,COMPLETE
34,4.070702289027395e-06,2025-07-14 22:26:29.756910,2025-07-14 22:30:20.350476,0 days 00:03:50.593566,identity,min,0.003907838689276405,8,21,bell,COMPLETE
35,5.161801709618885e-06,2025-07-14 22:30:20.351402,2025-07-14 22:34:32.634203,0 days 00:04:12.282801,identity,prod,0.00758547395213268,7,23,bell,COMPLETE
36,0.0020888429135084152,2025-07-14 22:34:32.635114,2025-07-14 22:38:29.834710,0 days 00:03:57.199596,relu,min,0.004300011361809045,9,21,bell,COMPLETE
37,0.018783561885356903,2025-07-14 22:38:29.835749,2025-07-14 22:41:12.726744,0 days 00:02:42.890995,identity,min,0.007052750319743216,9,13,sigmoid,COMPLETE
38,0.007831326685845852,2025-07-14 22:41:12.727706,2025-07-14 22:45:31.825799,0 days 00:04:19.098093,identity,prod,0.0007027608240448502,8,24,bell,COMPLETE
39,5.7980196288554e-06,2025-07-14 22:45:31.826693,2025-07-14 22:47:17.622629,0 days 00:01:45.795936,identity,min,0.002907666442424955,7,6,gaussian,COMPLETE
40,0.008287311531603336,2025-07-14 22:47:17.623563,2025-07-14 22:51:38.141952,0 days 00:04:20.518389,relu,prod,0.001882330179548099,7,25,sigmoid,COMPLETE
41,0.007457738276571035,2025-07-14 22:51:38.142849,2025-07-14 22:56:10.087621,0 days 00:04:31.944772,identity,min,0.009741215085709366,9,25,bell,COMPLETE
42,2.856942046491895e-05,2025-07-14 22:56:10.088517,2025-07-14 23:00:39.365795,0 days 00:04:29.277278,identity,min,0.006512770841504472,9,24,bell,COMPLETE
43,3.6720446132676443e-06,2025-07-14 23:00:39.366752,2025-07-14 23:02:58.236897,0 days 00:02:18.870145,identity,min,0.007988716653852769,9,9,bell,COMPLETE
44,1.2257539310667198e-05,2025-07-14 23:02:58.237729,2025-07-14 23:05:26.093861,0 days 00:02:27.856132,identity,min,0.007993963629878743,9,10,bell,COMPLETE
45,0.0011663766345009208,2025-07-14 23:05:26.094759,2025-07-14 23:08:01.844975,0 days 00:02:35.750216,identity,min,0.00040513181619833443,8,12,bell,COMPLETE
46,0.021200338378548622,2025-07-14 23:08:01.845790,2025-07-14 23:10:08.377398,0 days 00:02:06.531608,identity,min,0.004283767280696708,9,8,sigmoid,COMPLETE
47,0.0003051023813895881,2025-07-14 23:10:08.378275,2025-07-14 23:12:16.845627,0 days 00:02:08.467352,identity,min,0.006011407136860447,6,9,gaussian,COMPLETE
48,0.1985088288784027,2025-07-14 23:12:16.846544,2025-07-14 23:13:57.117329,0 days 00:01:40.270785,identity,min,0.0001054338177639433,8,5,bell,COMPLETE
49,3.3930682548088953e-06,2025-07-14 23:13:57.118219,2025-07-14 23:16:55.683405,0 days 00:02:58.565186,identity,prod,0.008150970914274924,9,14,bell,COMPLETE
50,3.428472609812161e-06,2025-07-14 23:16:55.684297,2025-07-14 23:19:50.831244,0 days 00:02:55.146947,identity,prod,0.008006574772171064,8,14,bell,COMPLETE
51,3.831044068647316e-06,2025-07-14 23:19:50.832070,2025-07-14 23:22:45.825915,0 days 00:02:54.993845,identity,prod,0.008133221257292256,8,14,bell,COMPLETE
52,0.10089241713285446,2025-07-14 23:22:45.826787,2025-07-14 23:25:50.908214,0 days 00:03:05.081427,identity,prod,0.0064586845252946066,8,15,bell,COMPLETE
53,0.04960702359676361,2025-07-14 23:25:50.909079,2025-07-14 23:28:44.788894,0 days 00:02:53.879815,identity,prod,0.008239247147540141,8,14,bell,COMPLETE
54,4.261009962647222e-06,2025-07-14 23:28:44.789794,2025-07-14 23:32:00.331634,0 days 00:03:15.541840,identity,prod,0.004932825876743992,9,16,bell,COMPLETE
55,0.00018238244228996336,2025-07-14 23:32:00.332551,2025-07-14 23:34:36.352770,0 days 00:02:36.020219,identity,prod,0.0011611390857658329,7,12,bell,COMPLETE
56,2.594482430140488e-05,2025-07-14 23:34:36.353637,2025-07-14 23:37:47.844625,0 days 00:03:11.490988,relu,prod,0.008685395394634537,8,16,bell,COMPLETE
57,0.02652348205447197,2025-07-14 23:37:47.845605,2025-07-14 23:40:32.208157,0 days 00:02:44.362552,identity,prod,0.0037582980003002635,9,13,sigmoid,COMPLETE
58,0.00040109280962496996,2025-07-14 23:40:32.209091,2025-07-14 23:43:17.585614,0 days 00:02:45.376523,identity,prod,0.005388760692417745,8,13,bell,COMPLETE
59,3.6335097775008762e-06,2025-07-14 23:43:17.586506,2025-07-14 23:47:09.685720,0 days 00:03:52.099214,identity,prod,0.00680368568499276,9,20,bell,COMPLETE
60,3.080062015214935e-05,2025-07-14 23:47:09.686731,2025-07-14 23:50:47.102572,0 days 00:03:37.415841,identity,prod,0.0066739770889979195,9,19,gaussian,COMPLETE
61,0.001345750642940402,2025-07-14 23:50:47.103508,2025-07-14 23:55:03.400020,0 days 00:04:16.296512,identity,prod,0.009964166521266814,9,23,bell,COMPLETE
62,3.903413471562089e-06,2025-07-14 23:55:03.400980,2025-07-14 23:59:11.192561,0 days 00:04:07.791581,identity,prod,0.006855111175514982,9,22,bell,COMPLETE
63,5.79912784814951e-06,2025-07-14 23:59:11.193559,2025-07-15 00:03:36.188877,0 days 00:04:24.995318,identity,prod,0.008486803892246885,9,24,bell,COMPLETE
64,0.01936565339565277,2025-07-15 00:03:36.189875,2025-07-15 00:07:40.999461,0 days 00:04:04.809586,identity,prod,0.004492512321005304,5,25,bell,COMPLETE
65,0.0013573894975706935,2025-07-15 00:07:41.000432,2025-07-15 00:11:30.437143,0 days 00:03:49.436711,identity,prod,0.005688791595883076,9,20,bell,COMPLETE
66,0.0019211958860978484,2025-07-15 00:11:30.438087,2025-07-15 00:14:49.341535,0 days 00:03:18.903448,identity,prod,0.0030154167293680685,8,17,bell,COMPLETE
67,0.019882889464497566,2025-07-15 00:14:49.342426,2025-07-15 00:17:47.077350,0 days 00:02:57.734924,relu,min,0.008846438407053603,9,14,bell,COMPLETE
68,3.5157793263351778e-06,2025-07-15 00:17:47.078247,2025-07-15 00:21:55.818278,0 days 00:04:08.740031,identity,min,0.007277966622762391,7,23,bell,COMPLETE
69,3.931259470846271e-06,2025-07-15 00:21:55.819226,2025-07-15 00:26:09.972141,0 days 00:04:14.152915,identity,prod,0.005490055791366819,7,23,bell,COMPLETE
70,0.004197750706225634,2025-07-15 00:26:09.973104,2025-07-15 00:30:01.811141,0 days 00:03:51.838037,identity,min,0.0002423222796660234,7,21,bell,COMPLETE
71,3.905641733581433e-06,2025-07-15 00:30:01.812060,2025-07-15 00:34:20.081734,0 days 00:04:18.269674,identity,min,0.007260374731692386,7,24,bell,COMPLETE
72,3.503263087623054e-06,2025-07-15 00:34:20.082638,2025-07-15 00:37:19.166661,0 days 00:02:59.084023,identity,min,0.008901879818316152,6,15,bell,COMPLETE
73,3.5303753520565806e-06,2025-07-15 00:37:19.167580,2025-07-15 00:40:18.040299,0 days 00:02:58.872719,identity,min,0.006327570432284421,6,15,bell,COMPLETE
74,0.0011652994435280561,2025-07-15 00:40:18.041246,2025-07-15 00:43:17.190544,0 days 00:02:59.149298,identity,min,0.008785317355523483,6,15,bell,COMPLETE
75,0.00016018743917811662,2025-07-15 00:43:17.191506,2025-07-15 00:46:33.795256,0 days 00:03:16.603750,identity,min,0.007296221238054746,6,17,bell,COMPLETE
76,0.010088412091135979,2025-07-15 00:46:33.796140,2025-07-15 00:49:41.598369,0 days 00:03:07.802229,identity,min,0.006110772990145519,6,16,bell,COMPLETE
77,0.005986558273434639,2025-07-15 00:49:41.599304,2025-07-15 00:52:23.794006,0 days 00:02:42.194702,identity,min,0.004821495249796633,5,15,sigmoid,COMPLETE
78,5.758702627645107e-06,2025-07-15 00:52:23.794949,2025-07-15 00:54:54.481147,0 days 00:02:30.686198,relu,min,0.007915981146888367,6,12,gaussian,COMPLETE
79,4.8931151468423195e-06,2025-07-15 00:54:54.482032,2025-07-15 00:57:45.482906,0 days 00:02:51.000874,identity,min,0.009673148693520033,6,14,bell,COMPLETE
80,0.025737443938851357,2025-07-15 00:57:45.483806,2025-07-15 01:00:17.630308,0 days 00:02:32.146502,identity,min,0.0052545580772446485,5,13,bell,COMPLETE
81,0.06640403717756271,2025-07-15 01:00:17.631236,2025-07-15 01:03:25.743651,0 days 00:03:08.112415,identity,min,0.006533208199411307,6,16,bell,COMPLETE
82,0.014943374320864677,2025-07-15 01:03:25.744549,2025-07-15 01:08:00.379454,0 days 00:04:34.634905,identity,min,0.007387069836550708,9,25,bell,COMPLETE
83,7.665711746085435e-05,2025-07-15 01:08:00.380315,2025-07-15 01:11:29.000836,0 days 00:03:28.620521,identity,min,0.008892588856889405,7,18,bell,COMPLETE
84,0.00011498072854010388,2025-07-15 01:11:29.001710,2025-07-15 01:15:55.485571,0 days 00:04:26.483861,identity,min,0.006156925201961763,9,24,bell,COMPLETE
85,3.4567119655548595e-06,2025-07-15 01:15:55.486480,2025-07-15 01:18:57.964019,0 days 00:03:02.477539,identity,min,0.007724731594211787,7,15,bell,COMPLETE
86,6.111800757935271e-06,2025-07-15 01:18:57.964937,2025-07-15 01:21:31.895913,0 days 00:02:33.930976,identity,min,0.007558904760016454,7,11,bell,COMPLETE
87,3.6204896787239704e-06,2025-07-15 01:21:31.896811,2025-07-15 01:24:34.758287,0 days 00:03:02.861476,identity,min,0.00897527706203498,7,15,bell,COMPLETE
88,3.728946921910392e-06,2025-07-15 01:24:34.759245,2025-07-15 01:27:29.234127,0 days 00:02:54.474882,identity,min,0.0038245490007966588,7,14,bell,COMPLETE
89,3.5367236250749556e-06,2025-07-15 01:27:29.235054,2025-07-15 01:30:45.664364,0 days 00:03:16.429310,identity,min,0.009919729395053317,6,17,bell,COMPLETE
90,0.000400583230657503,2025-07-15 01:30:45.665283,2025-07-15 01:33:57.362685,0 days 00:03:11.697402,identity,min,0.008058557565101793,6,17,sigmoid,COMPLETE
91,2.396784293523524e-05,2025-07-15 01:33:57.363620,2025-07-15 01:38:05.244739,0 days 00:04:07.881119,identity,min,0.009232484686304703,6,23,bell,COMPLETE
92,3.566539362509502e-06,2025-07-15 01:38:05.245621,2025-07-15 01:41:13.514635,0 days 00:03:08.269014,identity,min,0.00981131357827013,6,16,bell,COMPLETE
93,4.480677034734981e-06,2025-07-15 01:41:13.515553,2025-07-15 01:44:21.726511,0 days 00:03:08.210958,identity,min,0.009938836846531334,6,16,bell,COMPLETE
94,3.7958159282425186e-06,2025-07-15 01:44:21.727403,2025-07-15 01:47:21.294252,0 days 00:02:59.566849,identity,min,0.007695728044805548,6,15,bell,COMPLETE
95,4.1715797124197707e-05,2025-07-15 01:47:21.295154,2025-07-15 01:50:20.973793,0 days 00:02:59.678639,identity,min,0.005850961182916739,6,15,bell,COMPLETE
96,7.305260805878788e-05,2025-07-15 01:50:20.974737,2025-07-15 01:53:11.855025,0 days 00:02:50.880288,identity,min,0.006679424067706532,6,14,bell,COMPLETE
97,1.2065332157362718e-05,2025-07-15 01:53:11.855958,2025-07-15 01:56:19.036273,0 days 00:03:07.180315,relu,min,0.008471352529957682,5,18,gaussian,COMPLETE
98,4.0944910324469674e-06,2025-07-15 01:56:19.037189,2025-07-15 01:59:35.817155,0 days 00:03:16.779966,identity,min,0.00999594394913569,6,17,bell,COMPLETE
99,0.00048769061686471105,2025-07-15 01:59:35.818068,2025-07-15 02:02:18.197720,0 days 00:02:42.379652,identity,min,0.0011417846147092892,6,13,bell,COMPLETE
100,3.6480978451436386e-06,2025-07-15 02:02:18.198643,2025-07-15 02:05:26.087628,0 days 00:03:07.888985,identity,min,0.007207408589709362,6,16,bell,COMPLETE
101,8.875102139427327e-06,2025-07-15 02:05:26.088553,2025-07-15 02:09:03.299309,0 days 00:03:37.210756,identity,min,0.00832389507865483,7,19,bell,COMPLETE
102,0.02242034487426281,2025-07-15 02:09:03.300211,2025-07-15 02:12:02.868174,0 days 00:02:59.567963,identity,min,0.008919638380648994,6,15,bell,COMPLETE
103,6.0926277001271956e-06,2025-07-15 02:12:02.869100,2025-07-15 02:14:56.735831,0 days 00:02:53.866731,identity,min,0.007446962047099468,7,14,bell,COMPLETE
104,3.67083680430369e-06,2025-07-15 02:14:56.736708,2025-07-15 02:19:24.584451,0 days 00:04:27.847743,identity,min,0.006481926891787357,8,25,bell,COMPLETE
105,9.182494068227243e-06,2025-07-15 02:19:24.585369,2025-07-15 02:23:27.280197,0 days 00:04:02.694828,identity,min,0.005242595338188063,7,22,bell,COMPLETE
106,3.913030468538636e-06,2025-07-15 02:23:27.281155,2025-07-15 02:26:00.769151,0 days 00:02:33.487996,identity,min,0.009287214364882066,6,12,bell,COMPLETE
107,3.57841668119363e-06,2025-07-15 02:26:00.770112,2025-07-15 02:28:46.281085,0 days 00:02:45.510973,identity,min,0.007896712313588568,8,13,bell,COMPLETE
108,6.744712663930841e-06,2025-07-15 02:28:46.281984,2025-07-15 02:31:40.472330,0 days 00:02:54.190346,identity,min,0.00585984968933114,8,14,bell,COMPLETE
109,3.406417590667843e-06,2025-07-15 02:31:40.473261,2025-07-15 02:34:52.041020,0 days 00:03:11.567759,identity,min,0.008086070748399177,8,16,bell,COMPLETE
110,0.007119232323020697,2025-07-15 02:34:52.041911,2025-07-15 02:37:58.073175,0 days 00:03:06.031264,identity,min,0.0044395297139046466,8,16,sigmoid,COMPLETE
111,3.6380504297994776e-06,2025-07-15 02:37:58.074106,2025-07-15 02:40:43.827624,0 days 00:02:45.753518,identity,min,0.007861133822216815,8,13,bell,COMPLETE
112,3.4823649457393913e-06,2025-07-15 02:40:43.828526,2025-07-15 02:44:04.144115,0 days 00:03:20.315589,identity,min,0.008276287589599758,8,17,bell,COMPLETE
113,0.0018073862884193659,2025-07-15 02:44:04.145072,2025-07-15 02:47:32.962858,0 days 00:03:28.817786,identity,min,0.00702573934925459,8,18,bell,COMPLETE
114,4.052909844176611e-06,2025-07-15 02:47:32.963774,2025-07-15 02:50:54.888309,0 days 00:03:21.924535,identity,min,0.008730916765440865,8,17,bell,COMPLETE
115,4.2859071982093155e-05,2025-07-15 02:50:54.889275,2025-07-15 02:53:58.676271,0 days 00:03:03.786996,identity,prod,0.0007327592375725558,8,15,bell,COMPLETE
116,0.001725305337458849,2025-07-15 02:53:58.677188,2025-07-15 02:57:09.784902,0 days 00:03:11.107714,relu,min,0.0004765800322365841,8,16,bell,COMPLETE
117,0.04532437399029732,2025-07-15 02:57:09.785881,2025-07-15 03:00:25.258934,0 days 00:03:15.473053,identity,min,0.006814238393061829,8,17,gaussian,COMPLETE
118,5.150946890353225e-06,2025-07-15 03:00:25.259859,2025-07-15 03:03:24.490885,0 days 00:02:59.231026,identity,min,0.008516699180054285,6,15,bell,COMPLETE
119,4.791539140569512e-06,2025-07-15 03:03:24.491785,2025-07-15 03:06:20.242034,0 days 00:02:55.750249,identity,prod,0.009483413265219091,5,16,bell,COMPLETE
120,4.0208810787589755e-06,2025-07-15 03:06:20.242956,2025-07-15 03:09:19.717115,0 days 00:02:59.474159,identity,min,0.006131328442595905,6,15,bell,COMPLETE
121,3.6120320601185085e-06,2025-07-15 03:09:19.718026,2025-07-15 03:12:13.621280,0 days 00:02:53.903254,identity,min,0.007952663410037189,8,14,bell,COMPLETE
122,0.0004170807369519025,2025-07-15 03:12:13.622189,2025-07-15 03:14:59.298820,0 days 00:02:45.676631,identity,min,0.007603169260746105,8,13,bell,COMPLETE
123,3.612914042605553e-06,2025-07-15 03:14:59.299740,2025-07-15 03:17:33.668265,0 days 00:02:34.368525,identity,min,0.00841523789131376,8,11,bell,COMPLETE
124,3.5238244890933856e-06,2025-07-15 03:17:33.669161,2025-07-15 03:20:10.858329,0 days 00:02:37.189168,identity,min,0.0068811500035505365,8,12,bell,COMPLETE
125,0.0008075782097876072,2025-07-15 03:20:10.859297,2025-07-15 03:22:48.210207,0 days 00:02:37.350910,identity,min,0.00639822889057353,8,12,bell,COMPLETE
126,7.13445624569431e-05,2025-07-15 03:22:48.211158,2025-07-15 03:25:59.524295,0 days 00:03:11.313137,identity,min,0.002234441631494838,8,16,bell,COMPLETE
127,6.129283974587452e-06,2025-07-15 03:25:59.525237,2025-07-15 03:28:22.948190,0 days 00:02:23.422953,identity,prod,0.0051595613373245095,6,10,bell,COMPLETE
128,3.4113281799363904e-06,2025-07-15 03:28:22.949133,2025-07-15 03:31:51.336821,0 days 00:03:28.387688,identity,min,0.007079481705028356,7,18,bell,COMPLETE
129,3.6870183066639584e-06,2025-07-15 03:31:51.337765,2025-07-15 03:35:19.460680,0 days 00:03:28.122915,identity,min,0.007036874128501604,7,18,bell,COMPLETE
130,4.158583124080906e-06,2025-07-15 03:35:19.461620,2025-07-15 03:39:39.359935,0 days 00:04:19.898315,identity,min,0.005761687388153229,7,24,bell,COMPLETE
131,0.00040209421422332525,2025-07-15 03:39:39.360879,2025-07-15 03:42:59.285552,0 days 00:03:19.924673,identity,min,0.009295825313216276,7,17,bell,COMPLETE
132,4.883415840595262e-06,2025-07-15 03:42:59.286435,2025-07-15 03:46:10.252694,0 days 00:03:10.966259,identity,min,0.009987547972895833,7,16,bell,COMPLETE
133,3.5041671253566165e-06,2025-07-15 03:46:10.253598,2025-07-15 03:49:26.610024,0 days 00:03:16.356426,identity,min,0.007210389706874707,6,17,bell,COMPLETE
134,0.0009601586498320103,2025-07-15 03:49:26.610983,2025-07-15 03:52:46.312929,0 days 00:03:19.701946,identity,min,0.0070703906486579106,7,17,bell,COMPLETE
135,6.159202257549623e-06,2025-07-15 03:52:46.313860,2025-07-15 03:56:14.522658,0 days 00:03:28.208798,identity,min,0.006408380112034731,7,18,bell,COMPLETE
136,3.791334165725857e-06,2025-07-15 03:56:14.523600,2025-07-15 03:59:44.445189,0 days 00:03:29.921589,relu,prod,0.0085352488593731,7,18,bell,COMPLETE
137,0.012240484356880188,2025-07-15 03:59:44.446119,2025-07-15 04:02:32.639499,0 days 00:02:48.193380,identity,min,0.007614782006172334,7,14,sigmoid,COMPLETE
138,3.7333752516133245e-06,2025-07-15 04:02:32.640433,2025-07-15 04:06:09.088283,0 days 00:03:36.447850,identity,min,0.005829214818617827,8,19,bell,COMPLETE
