number,value,datetime_start,datetime_complete,duration,params_activation,params_batch_size,params_h,params_lr,params_seq_length,state
0,1.3112996816635132,2025-07-15 13:32:43.969906,2025-07-15 13:33:22.817304,0 days 00:00:38.847398,relu,128,70,0.0012348853531818811,9,COMPLETE
1,9.642467375670094e-06,2025-07-15 13:33:22.818443,2025-07-15 13:36:09.824517,0 days 00:02:47.006074,identity,16,51,0.0037613174791333516,14,COMPLETE
2,0.00033023383002728224,2025-07-15 13:36:09.825421,2025-07-15 13:37:19.643731,0 days 00:01:09.818310,identity,64,104,0.00016622810074498192,11,COMPLETE
3,0.007287580519914627,2025-07-15 13:37:19.644613,2025-07-15 13:38:34.855735,0 days 00:01:15.211122,identity,64,35,0.00012318155106518357,20,COMPLETE
4,0.0012065691407769918,2025-07-15 13:38:34.856586,2025-07-15 13:39:49.478968,0 days 00:01:14.622382,relu,32,21,0.00026454367981392293,13,COMPLETE
5,0.00031897154985927045,2025-07-15 13:39:49.479826,2025-07-15 13:41:11.480955,0 days 00:01:22.001129,identity,128,106,0.0024577867063648277,15,COMPLETE
6,3.0734627216588706e-05,2025-07-15 13:41:11.481849,2025-07-15 13:44:51.010950,0 days 00:03:39.529101,identity,16,86,0.00011321031104945076,11,COMPLETE
7,0.0008411278249695897,2025-07-15 13:44:51.011744,2025-07-15 13:45:36.084157,0 days 00:00:45.072413,identity,128,66,0.00010002452723519078,13,COMPLETE
8,1.3167331218719482,2025-07-15 13:45:36.084758,2025-07-15 13:50:04.306530,0 days 00:04:28.221772,relu,16,86,0.007260564962968234,16,COMPLETE
9,0.0008166268235072494,2025-07-15 13:50:04.307418,2025-07-15 13:51:34.905833,0 days 00:01:30.598415,identity,128,109,0.00019497565840074257,17,COMPLETE
10,1.316251516342163,2025-07-15 13:51:34.906706,2025-07-15 13:55:03.694418,0 days 00:03:28.787712,relu,16,44,0.009952129233497347,19,COMPLETE
11,1.4127563190413639e-05,2025-07-15 13:55:03.695322,2025-07-15 13:57:17.069885,0 days 00:02:13.374563,identity,16,59,0.0005388176507327036,10,COMPLETE
12,1.755824632709846e-05,2025-07-15 13:57:17.070693,2025-07-15 13:59:05.233523,0 days 00:01:48.162830,identity,16,52,0.0005750551882212744,8,COMPLETE
13,4.8992940719472244e-05,2025-07-15 13:59:05.234381,2025-07-15 14:01:08.790993,0 days 00:02:03.556612,identity,16,13,0.002798319793632126,11,COMPLETE
14,0.00016402195615228266,2025-07-15 14:01:08.791839,2025-07-15 14:03:12.218634,0 days 00:02:03.426795,identity,32,59,0.0005260991282028553,14,COMPLETE
15,5.4134528909344226e-05,2025-07-15 14:03:12.219507,2025-07-15 14:05:04.941124,0 days 00:01:52.721617,identity,16,30,0.003931137652351956,9,COMPLETE
16,5.906715614401037e-06,2025-07-15 14:05:04.941992,2025-07-15 14:09:01.694473,0 days 00:03:56.752481,identity,16,74,0.0012070962292225777,18,COMPLETE
17,8.8307660917053e-06,2025-07-15 14:09:01.695333,2025-07-15 14:14:24.176088,0 days 00:05:22.480755,identity,16,126,0.0014364923139997853,18,COMPLETE
18,1.316388487815857,2025-07-15 14:14:24.176930,2025-07-15 14:17:20.637985,0 days 00:02:56.461055,relu,32,124,0.0009612603171591786,18,COMPLETE
19,5.0550384912639856e-05,2025-07-15 14:17:20.638888,2025-07-15 14:19:35.025254,0 days 00:02:14.386366,identity,64,128,0.001203633419980125,20,COMPLETE
20,8.120082384266425e-06,2025-07-15 14:19:35.026088,2025-07-15 14:24:33.177069,0 days 00:04:58.150981,identity,16,87,0.0017172882750950836,18,COMPLETE
21,7.936532711028121e-06,2025-07-15 14:24:33.177925,2025-07-15 14:29:19.307658,0 days 00:04:46.129733,identity,16,82,0.001643915353290153,18,COMPLETE
22,4.408932909427676e-06,2025-07-15 14:29:19.308479,2025-07-15 14:34:08.546860,0 days 00:04:49.238381,identity,16,83,0.0018700898225061226,17,COMPLETE
23,1.4730873772350606e-05,2025-07-15 14:34:08.547689,2025-07-15 14:37:57.387532,0 days 00:03:48.839843,identity,16,75,0.0008566896331836243,17,COMPLETE
24,8.722570782992989e-06,2025-07-15 14:37:57.388400,2025-07-15 14:42:51.711212,0 days 00:04:54.322812,identity,16,95,0.001849920166400537,16,COMPLETE
25,4.8464371502632275e-06,2025-07-15 14:42:51.712072,2025-07-15 14:47:00.880345,0 days 00:04:09.168273,identity,16,71,0.0007565038216032257,19,COMPLETE
26,1.316251516342163,2025-07-15 14:47:00.881207,2025-07-15 14:51:03.094155,0 days 00:04:02.212948,relu,16,76,0.00034823509774278074,19,COMPLETE
27,6.469053914770484e-06,2025-07-15 14:51:03.095056,2025-07-15 14:53:12.963613,0 days 00:02:09.868557,identity,32,96,0.000744352743473356,16,COMPLETE
28,0.0012087944196537137,2025-07-15 14:53:12.964500,2025-07-15 14:55:37.044613,0 days 00:02:24.080113,identity,64,67,0.00038709212376463495,19,COMPLETE
29,1.3165440559387207,2025-07-15 14:55:37.045480,2025-07-15 14:56:40.977226,0 days 00:01:03.931746,relu,128,72,0.0011306959050261882,17,COMPLETE
30,1.648148099775426e-05,2025-07-15 14:56:40.977869,2025-07-15 15:03:21.739671,0 days 00:06:40.761802,identity,16,96,0.0023776842630830156,20,COMPLETE
31,6.390798716893187e-06,2025-07-15 15:03:21.740563,2025-07-15 15:05:40.398096,0 days 00:02:18.657533,identity,32,98,0.0007729053676508394,16,COMPLETE
32,1.3762942216999363e-05,2025-07-15 15:05:40.398977,2025-07-15 15:07:32.249285,0 days 00:01:51.850308,identity,32,80,0.0007093376963871693,15,COMPLETE
33,1.1274038115516305e-05,2025-07-15 15:07:32.250165,2025-07-15 15:10:16.209810,0 days 00:02:43.959645,identity,32,115,0.004169700619952206,17,COMPLETE
34,4.4354837882565334e-05,2025-07-15 15:10:16.210671,2025-07-15 15:13:04.933164,0 days 00:02:48.722493,identity,32,93,0.00041192756042037127,19,COMPLETE
35,0.0007274345844052732,2025-07-15 15:13:04.934001,2025-07-15 15:14:34.483101,0 days 00:01:29.549100,identity,64,60,0.0010195148809903078,15,COMPLETE
36,5.11295229443931e-06,2025-07-15 15:14:34.484067,2025-07-15 15:16:59.879465,0 days 00:02:25.395398,identity,32,102,0.0006887919636607733,16,COMPLETE
37,0.0004857202875427902,2025-07-15 15:16:59.880373,2025-07-15 15:20:46.772853,0 days 00:03:46.892480,identity,16,49,0.00027266158451011685,18,COMPLETE
38,0.0007763249450363219,2025-07-15 15:20:46.773709,2025-07-15 15:22:28.694975,0 days 00:01:41.921266,relu,128,102,0.00200406258351775,20,COMPLETE
39,6.2000303842069115e-06,2025-07-15 15:22:28.695824,2025-07-15 15:27:34.117805,0 days 00:05:05.421981,identity,16,113,0.0014512294707385877,14,COMPLETE
40,1.0137211575056426e-05,2025-07-15 15:27:34.118651,2025-07-15 15:28:57.586097,0 days 00:01:23.467446,identity,64,89,0.0028795216513369244,13,COMPLETE
41,5.878180218132911e-06,2025-07-15 15:28:57.586956,2025-07-15 15:32:42.824251,0 days 00:03:45.237295,identity,16,117,0.0013165773144337414,12,COMPLETE
42,4.928248017677106e-06,2025-07-15 15:32:42.825136,2025-07-15 15:37:37.547631,0 days 00:04:54.722495,identity,16,116,0.0012540084202070003,15,COMPLETE
43,5.8172099670628086e-06,2025-07-15 15:37:37.548510,2025-07-15 15:41:32.672903,0 days 00:03:55.124393,identity,16,119,0.0006865596895687202,12,COMPLETE
44,6.2995950429467484e-06,2025-07-15 15:41:32.673775,2025-07-15 15:45:30.237536,0 days 00:03:57.563761,identity,16,119,0.000614169877253836,12,COMPLETE
45,4.988056389265694e-06,2025-07-15 15:45:30.238406,2025-07-15 15:52:08.957330,0 days 00:06:38.718924,identity,16,107,0.0004915359259839543,15,COMPLETE
46,0.0004619142273440957,2025-07-15 15:52:08.958280,2025-07-15 15:53:18.714632,0 days 00:01:09.756352,identity,128,104,0.00047366430659589987,14,COMPLETE
47,1.3169734477996826,2025-07-15 15:53:18.715282,2025-07-15 16:01:23.410176,0 days 00:08:04.694894,relu,16,106,0.00029618187728755707,15,COMPLETE
48,4.496489509620005e-06,2025-07-15 16:01:23.411099,2025-07-15 16:04:03.185609,0 days 00:02:39.774510,identity,32,109,0.0009005494579040507,16,COMPLETE
49,4.418059688759968e-05,2025-07-15 16:04:03.186463,2025-07-15 16:16:11.536836,0 days 00:12:08.350373,identity,16,113,0.00015616105403885692,15,COMPLETE
50,5.185060672374675e-06,2025-07-15 16:16:11.537680,2025-07-15 16:31:33.620039,0 days 00:15:22.082359,identity,16,108,0.0008837234179340676,17,COMPLETE
51,7.659479706489947e-06,2025-07-15 16:31:33.620926,2025-07-15 16:33:53.779533,0 days 00:02:20.158607,identity,32,100,0.0006257576275599813,16,COMPLETE
52,1.1749747500289232e-05,2025-07-15 16:33:53.780438,2025-07-15 16:36:16.678263,0 days 00:02:22.897825,identity,32,91,0.00046569851078993586,16,COMPLETE
53,6.050738193152938e-06,2025-07-15 16:36:16.679119,2025-07-15 16:38:34.700062,0 days 00:02:18.020943,identity,32,110,0.0010300184256364906,14,COMPLETE
54,0.0005602071760222316,2025-07-15 16:38:34.700905,2025-07-15 16:41:11.086542,0 days 00:02:36.385637,identity,32,122,0.00023077875731947274,15,COMPLETE
55,1.1329663720971439e-05,2025-07-15 16:41:11.087393,2025-07-15 16:43:25.285380,0 days 00:02:14.197987,identity,32,81,0.0021481876462598614,17,COMPLETE
56,7.592696874780813e-06,2025-07-15 16:43:25.286232,2025-07-15 16:51:28.381927,0 days 00:08:03.095695,identity,16,102,0.0015673833070201913,13,COMPLETE
57,1.0461067176947836e-05,2025-07-15 16:51:28.382756,2025-07-15 16:54:56.325844,0 days 00:03:27.943088,identity,16,62,0.0008065630726731176,16,COMPLETE
58,0.0002639495360199362,2025-07-15 16:54:56.326686,2025-07-15 16:57:04.382252,0 days 00:02:08.055566,relu,32,85,0.0003290410197391497,15,COMPLETE
59,1.4846888007014059e-05,2025-07-15 16:57:04.383125,2025-07-15 17:00:48.312809,0 days 00:03:43.929684,identity,16,54,0.0031521162954528366,17,COMPLETE
60,0.0009608853724785149,2025-07-15 17:00:48.313648,2025-07-15 17:02:32.291545,0 days 00:01:43.977897,identity,128,111,0.00047321608678057187,19,COMPLETE
61,7.892355824878905e-06,2025-07-15 17:02:32.292363,2025-07-15 17:11:10.897954,0 days 00:08:38.605591,identity,16,107,0.0008620358100389676,17,COMPLETE
62,7.660321898583788e-06,2025-07-15 17:11:10.898830,2025-07-15 17:19:27.211291,0 days 00:08:16.312461,identity,16,108,0.0009625053412337138,16,COMPLETE
63,5.3572111937683076e-06,2025-07-15 17:19:27.212132,2025-07-15 17:25:44.060912,0 days 00:06:16.848780,identity,16,122,0.0005456334747862144,17,COMPLETE
64,8.26389168651076e-06,2025-07-15 17:25:44.061803,2025-07-15 17:38:22.444289,0 days 00:12:38.382486,identity,16,99,0.001256377367983106,18,COMPLETE
65,1.711107324808836e-05,2025-07-15 17:38:22.445173,2025-07-15 17:41:42.491831,0 days 00:03:20.046658,identity,16,69,0.0008911516682613571,15,COMPLETE
66,0.00013596481585409492,2025-07-15 17:41:42.492838,2025-07-15 17:43:32.293792,0 days 00:01:49.800954,identity,64,116,0.0011055327696332053,16,COMPLETE
67,3.900343472196255e-06,2025-07-15 17:43:32.294653,2025-07-15 17:49:15.354343,0 days 00:05:43.059690,identity,16,128,0.0006381939655566028,17,COMPLETE
68,5.272778707876569e-06,2025-07-15 17:49:15.355183,2025-07-15 17:52:07.611451,0 days 00:02:52.256268,identity,32,123,0.0006643137213833085,16,COMPLETE
69,1.3172639608383179,2025-07-15 17:52:07.612332,2025-07-15 17:57:37.866269,0 days 00:05:30.253937,relu,16,127,0.000584530916482296,14,COMPLETE
70,2.3383156076306477e-05,2025-07-15 17:57:37.867256,2025-07-15 18:04:44.271517,0 days 00:07:06.404261,identity,16,78,0.005746679529321899,15,COMPLETE
71,4.358567366580246e-06,2025-07-15 18:04:44.272392,2025-07-15 18:14:18.807831,0 days 00:09:34.535439,identity,16,112,0.0007665769937955527,17,COMPLETE
72,3.959506102546584e-06,2025-07-15 18:14:18.808689,2025-07-15 18:19:49.786123,0 days 00:05:30.977434,identity,16,119,0.00041531440553040224,18,COMPLETE
73,3.1917177238938166e-06,2025-07-15 18:19:49.787083,2025-07-15 18:25:14.573681,0 days 00:05:24.786598,identity,16,119,0.00039974427656248954,18,COMPLETE
74,3.891292180924211e-06,2025-07-15 18:25:14.574616,2025-07-15 18:31:58.463608,0 days 00:06:43.888992,identity,16,128,0.00041362830594680525,18,COMPLETE
75,4.3331356209819205e-06,2025-07-15 18:31:58.464489,2025-07-15 18:37:34.045741,0 days 00:05:35.581252,identity,16,128,0.00037457550811868817,19,COMPLETE
76,3.379172767381533e-06,2025-07-15 18:37:34.046549,2025-07-15 18:44:06.872237,0 days 00:06:32.825688,identity,16,126,0.00041140878346136576,18,COMPLETE
77,3.4727347610896686e-06,2025-07-15 18:44:06.873119,2025-07-15 18:51:18.749351,0 days 00:07:11.876232,identity,16,127,0.0004057900625344607,18,COMPLETE
78,3.7474962937267264e-06,2025-07-15 18:51:18.750209,2025-07-15 18:57:16.017838,0 days 00:05:57.267629,identity,16,128,0.0003644497138448817,18,COMPLETE
79,3.979681878263364e-06,2025-07-15 18:57:16.018868,2025-07-15 19:04:37.032759,0 days 00:07:21.013891,identity,16,125,0.00039846265842036134,18,COMPLETE
80,1.0022353308158927e-05,2025-07-15 19:04:37.033635,2025-07-15 19:11:21.836870,0 days 00:06:44.803235,identity,16,125,0.00023936902934435674,18,COMPLETE
81,4.571325462165987e-06,2025-07-15 19:11:21.837738,2025-07-15 19:16:45.112417,0 days 00:05:23.274679,identity,16,120,0.0003828069005567385,19,COMPLETE
82,3.4531944947957527e-06,2025-07-15 19:16:45.113302,2025-07-15 19:22:44.850246,0 days 00:05:59.736944,identity,16,128,0.00042018111544947175,18,COMPLETE
83,4.071563580509974e-06,2025-07-15 19:22:44.851101,2025-07-15 19:29:34.645701,0 days 00:06:49.794600,identity,16,125,0.00031972481041722635,18,COMPLETE
84,3.2550299238209845e-06,2025-07-15 19:29:34.646624,2025-07-15 19:34:40.938530,0 days 00:05:06.291906,identity,16,120,0.0004333836402871465,18,COMPLETE
85,3.5423304325377103e-06,2025-07-15 19:34:40.939519,2025-07-15 19:40:32.145065,0 days 00:05:51.205546,identity,16,128,0.00028409673233123234,18,COMPLETE
86,4.080350208823802e-06,2025-07-15 19:40:32.145963,2025-07-15 19:45:55.902984,0 days 00:05:23.757021,identity,16,128,0.0001901047359164546,19,COMPLETE
87,5.637294179905439e-06,2025-07-15 19:45:55.903829,2025-07-15 19:52:00.359243,0 days 00:06:04.455414,relu,16,121,0.00027735921656495214,20,COMPLETE
88,4.79765321870218e-06,2025-07-15 19:52:00.360085,2025-07-15 19:59:09.044506,0 days 00:07:08.684421,identity,16,125,0.00022654451432855202,18,COMPLETE
89,4.28281100539607e-06,2025-07-15 19:59:09.045379,2025-07-15 20:04:38.989410,0 days 00:05:29.944031,identity,16,117,0.00043750178416378406,18,COMPLETE
90,0.000823974609375,2025-07-15 20:04:38.990310,2025-07-15 20:06:50.198148,0 days 00:02:11.207838,identity,64,128,0.0003079430881518519,19,COMPLETE
91,3.446190703471075e-06,2025-07-15 20:06:50.199073,2025-07-15 20:12:21.226522,0 days 00:05:31.027449,identity,16,119,0.0003508528090287075,18,COMPLETE
92,3.2433356409455882e-06,2025-07-15 20:12:21.227368,2025-07-15 20:19:38.800842,0 days 00:07:17.573474,identity,16,123,0.00036320958496465774,18,COMPLETE
93,3.454106717981631e-06,2025-07-15 20:19:38.801712,2025-07-15 20:25:02.015341,0 days 00:05:23.213629,identity,16,121,0.0003529464874260231,18,COMPLETE
94,3.987607669841964e-06,2025-07-15 20:25:02.016203,2025-07-15 20:38:43.191825,0 days 00:13:41.175622,identity,16,114,0.0003464965897576756,19,COMPLETE
95,4.4480453652795404e-05,2025-07-15 20:38:43.192695,2025-07-15 20:45:11.309293,0 days 00:06:28.116598,identity,16,123,0.00019629403234529548,18,COMPLETE
96,3.4810775559890317e-06,2025-07-15 20:45:11.310205,2025-07-15 20:50:46.520940,0 days 00:05:35.210735,identity,16,118,0.00026253865875773856,19,COMPLETE
97,0.0007484196685254574,2025-07-15 20:50:46.521826,2025-07-15 20:52:39.155414,0 days 00:01:52.633588,identity,128,118,0.0002723962559669438,20,COMPLETE
98,6.609926458622795e-06,2025-07-15 20:52:39.156283,2025-07-15 20:56:08.402856,0 days 00:03:29.246573,identity,16,37,0.0005122503199880572,19,COMPLETE
99,4.9347945605404675e-05,2025-07-15 20:56:08.403949,2025-07-15 20:59:13.761791,0 days 00:03:05.357842,identity,16,11,0.00024250477835628608,19,COMPLETE
100,1.319413423538208,2025-07-15 20:59:13.762691,2025-07-15 21:02:07.979603,0 days 00:02:54.216912,relu,16,122,0.00014752264252612047,8,COMPLETE
101,4.7937191993696615e-06,2025-07-15 21:02:07.980514,2025-07-15 21:07:18.030974,0 days 00:05:10.050460,identity,16,120,0.00034770423356914835,18,COMPLETE
102,4.834828814637149e-06,2025-07-15 21:07:18.031831,2025-07-15 21:17:39.048750,0 days 00:10:21.016919,identity,16,115,0.00036726777283287415,18,COMPLETE
103,4.5233482524054125e-06,2025-07-15 21:17:39.049612,2025-07-15 21:24:04.888909,0 days 00:06:25.839297,identity,16,124,0.00030064888149254225,18,COMPLETE
104,4.338461167208152e-06,2025-07-15 21:24:04.889804,2025-07-15 21:29:59.172273,0 days 00:05:54.282469,identity,16,121,0.00021296055880327134,17,COMPLETE
105,3.0414771572395694e-06,2025-07-15 21:29:59.173143,2025-07-15 21:35:42.406232,0 days 00:05:43.233089,identity,16,117,0.00025486896093758954,19,COMPLETE
106,3.7458594306372106e-06,2025-07-15 21:35:42.407117,2025-07-15 21:41:36.745656,0 days 00:05:54.338539,identity,16,118,0.00044326898472010285,20,COMPLETE
107,3.2871353141672444e-06,2025-07-15 21:41:36.746535,2025-07-15 21:50:45.084302,0 days 00:09:08.337767,identity,16,111,0.00026148368081194644,19,COMPLETE
108,1.067032826540526e-05,2025-07-15 21:50:45.085182,2025-07-15 22:01:10.446499,0 days 00:10:25.361317,identity,16,112,0.00025111008183005816,19,COMPLETE
109,0.000890226976480335,2025-07-15 22:01:10.447392,2025-07-15 22:03:25.370934,0 days 00:02:14.923542,identity,64,114,0.00017781133649826458,20,COMPLETE
110,0.0010706062894314528,2025-07-15 22:03:25.371798,2025-07-15 22:05:05.407334,0 days 00:01:40.035536,identity,128,116,0.00013380680488832622,19,COMPLETE
111,3.7083736970089376e-06,2025-07-15 22:05:05.408180,2025-07-15 22:10:57.232119,0 days 00:05:51.823939,identity,16,123,0.0002876706355129695,19,COMPLETE
112,3.6712106066261185e-06,2025-07-15 22:10:57.233016,2025-07-15 22:17:49.162194,0 days 00:06:51.929178,identity,16,125,0.0003212381629642037,18,COMPLETE
113,0.0010420463513582945,2025-07-15 22:17:49.163068,2025-07-15 22:21:05.771435,0 days 00:03:16.608367,identity,16,23,0.0002151893591373935,19,COMPLETE
114,3.603704954002751e-06,2025-07-15 22:21:05.772309,2025-07-15 22:26:52.777050,0 days 00:05:47.004741,identity,16,120,0.0005140828121825289,17,COMPLETE
115,4.096291377209127e-06,2025-07-15 22:26:52.777908,2025-07-15 22:32:22.635079,0 days 00:05:29.857171,identity,16,118,0.0002692840479851661,18,COMPLETE
116,6.5915305640373845e-06,2025-07-15 22:32:22.635979,2025-07-15 22:43:20.913099,0 days 00:10:58.277120,identity,16,111,0.000256217348564426,19,COMPLETE
117,3.1013751140562817e-06,2025-07-15 22:43:20.913960,2025-07-15 22:48:55.161881,0 days 00:05:34.247921,identity,16,122,0.0003241779815991495,18,COMPLETE
118,5.682818027707981e-06,2025-07-15 22:48:55.162779,2025-07-15 22:58:16.965538,0 days 00:09:21.802759,identity,16,115,0.00033243359478256004,17,COMPLETE
119,3.244643039579387e-06,2025-07-15 22:58:16.966450,2025-07-15 23:04:02.322988,0 days 00:05:45.356538,identity,16,122,0.0004578268215118436,19,COMPLETE
120,2.987748530358658e-06,2025-07-15 23:04:02.323880,2025-07-15 23:09:38.267670,0 days 00:05:35.943790,identity,16,122,0.00042818341180905496,18,COMPLETE
121,5.420684374257689e-06,2025-07-15 23:09:38.268523,2025-07-15 23:15:01.005190,0 days 00:05:22.736667,identity,16,122,0.0005642677633842518,18,COMPLETE
122,3.2688037663319847e-06,2025-07-15 23:15:01.006059,2025-07-15 23:22:06.160150,0 days 00:07:05.154091,identity,16,125,0.0004637885823413687,18,COMPLETE
123,3.3718683880579192e-06,2025-07-15 23:22:06.161020,2025-07-15 23:28:20.922638,0 days 00:06:14.761618,identity,16,124,0.00045532611484815056,17,COMPLETE
124,3.814864157902775e-06,2025-07-15 23:28:20.923567,2025-07-15 23:34:21.874020,0 days 00:06:00.950453,identity,16,125,0.0004570362085179712,17,COMPLETE
125,3.422467671043705e-06,2025-07-15 23:34:21.874906,2025-07-15 23:40:16.149878,0 days 00:05:54.274972,identity,16,123,0.0005173519109943644,19,COMPLETE
126,4.724307927972404e-06,2025-07-15 23:40:16.150786,2025-07-15 23:46:29.092884,0 days 00:06:12.942098,relu,16,123,0.000499797029908732,20,COMPLETE
127,4.559265107673127e-06,2025-07-15 23:46:29.093786,2025-07-15 23:52:11.517991,0 days 00:05:42.424205,identity,16,117,0.00043676715198923566,19,COMPLETE
128,5.212160886003403e-06,2025-07-15 23:52:11.518866,2025-07-16 00:01:03.731836,0 days 00:08:52.212970,identity,16,110,0.0005670628235402891,19,COMPLETE
129,4.522994458966423e-06,2025-07-16 00:01:03.732705,2025-07-16 00:11:18.561931,0 days 00:10:14.829226,identity,16,113,0.000475970236986878,19,COMPLETE
130,9.358057468489278e-06,2025-07-16 00:11:18.562827,2025-07-16 00:14:29.452402,0 days 00:03:10.889575,identity,16,120,0.00031326078214527893,10,COMPLETE
131,3.2586699489911553e-06,2025-07-16 00:14:29.453275,2025-07-16 00:22:17.706711,0 days 00:07:48.253436,identity,16,125,0.0003893967395851631,18,COMPLETE
132,3.512181820042315e-06,2025-07-16 00:22:17.707627,2025-07-16 00:30:18.235204,0 days 00:08:00.527577,identity,16,125,0.00038343096329795695,18,COMPLETE
133,3.704782557178987e-06,2025-07-16 00:30:18.236074,2025-07-16 00:36:54.786620,0 days 00:06:36.550546,identity,16,123,0.0005312254677138883,18,COMPLETE
134,3.64688276022207e-06,2025-07-16 00:36:54.787515,2025-07-16 00:42:56.254804,0 days 00:06:01.467289,identity,16,120,0.00036810556051126395,19,COMPLETE
135,4.094365522178123e-06,2025-07-16 00:42:56.255671,2025-07-16 00:49:04.667207,0 days 00:06:08.411536,identity,16,116,0.00040855257840885067,17,COMPLETE
136,0.0007373855914920568,2025-07-16 00:49:04.668069,2025-07-16 00:51:26.700476,0 days 00:02:22.032407,identity,64,125,0.0005950726617345712,18,COMPLETE
137,0.0009989747777581215,2025-07-16 00:51:26.701392,2025-07-16 00:53:23.730201,0 days 00:01:57.028809,identity,128,119,0.00045594505609132313,20,COMPLETE
138,3.90281365980627e-06,2025-07-16 00:53:23.731080,2025-07-16 00:58:50.313468,0 days 00:05:26.582388,identity,16,122,0.0003249440660740861,18,COMPLETE
139,4.156003342359327e-06,2025-07-16 00:58:50.314350,2025-07-16 01:05:58.866991,0 days 00:07:08.552641,identity,16,126,0.00038819745808845975,17,COMPLETE
140,4.3366321733628865e-06,2025-07-16 01:05:58.867851,2025-07-16 01:11:45.264644,0 days 00:05:46.396793,identity,16,117,0.0004903460465212231,19,COMPLETE
141,3.73403463527211e-06,2025-07-16 01:11:45.265549,2025-07-16 01:19:30.314613,0 days 00:07:45.049064,identity,16,126,0.00042157350782489944,18,COMPLETE
142,3.868970452458598e-06,2025-07-16 01:19:30.315558,2025-07-16 01:24:51.065552,0 days 00:05:20.749994,identity,16,122,0.00035093071246441863,18,COMPLETE
