number,value,datetime_start,datetime_complete,duration,params_activation,params_and_operator,params_lr,params_n_sets,params_seq_length,params_shape,state
0,0.020274585112929344,2025-07-14 20:21:09.788969,2025-07-14 20:22:26.564828,0 days 00:01:16.775859,relu,prod,0.0005761869759702646,8,8,bell,COMPLETE
1,0.0464465357363224,2025-07-14 20:22:26.565708,2025-07-14 20:23:31.621522,0 days 00:01:05.055814,identity,prod,0.00013887641731519132,5,8,sigmoid,COMPLETE
2,0.004144396632909775,2025-07-14 20:23:31.622370,2025-07-14 20:24:47.810733,0 days 00:01:16.188363,identity,prod,0.0011584314606021683,7,10,bell,COMPLETE
3,0.005181955173611641,2025-07-14 20:24:47.811543,2025-07-14 20:25:54.686333,0 days 00:01:06.874790,relu,min,0.0002414320302939175,6,9,sigmoid,COMPLETE
4,0.13549406826496124,2025-07-14 20:25:54.687149,2025-07-14 20:27:07.391375,0 days 00:01:12.704226,relu,min,0.0003225252006488889,7,14,gaussian,COMPLETE
5,0.005105485208332539,2025-07-14 20:27:07.392214,2025-07-14 20:28:29.370129,0 days 00:01:21.977915,identity,prod,0.002266047330712862,9,24,sigmoid,COMPLETE
6,0.18230310082435608,2025-07-14 20:28:29.370939,2025-07-14 20:29:44.914775,0 days 00:01:15.543836,identity,prod,0.0005802607729538076,8,18,gaussian,COMPLETE
7,5.978257831884548e-06,2025-07-14 20:29:44.915644,2025-07-14 20:30:56.224206,0 days 00:01:11.308562,identity,min,0.008309335170531743,5,18,gaussian,COMPLETE
8,0.02098063938319683,2025-07-14 20:30:56.225010,2025-07-14 20:32:18.791744,0 days 00:01:22.566734,identity,prod,0.006375864417349605,8,22,bell,COMPLETE
9,0.10702545195817947,2025-07-14 20:32:18.792578,2025-07-14 20:33:35.221929,0 days 00:01:16.429351,identity,min,0.000350024251776085,5,20,bell,COMPLETE
10,4.579148935590638e-06,2025-07-14 20:33:35.222777,2025-07-14 20:34:46.334602,0 days 00:01:11.111825,relu,min,0.009783357795527798,6,15,gaussian,COMPLETE
11,8.021019311854616e-06,2025-07-14 20:34:46.335442,2025-07-14 20:35:57.289673,0 days 00:01:10.954231,relu,min,0.009052605169888,6,15,gaussian,COMPLETE
12,0.001855554524809122,2025-07-14 20:35:57.290493,2025-07-14 20:37:06.480017,0 days 00:01:09.189524,relu,min,0.00408711298333228,6,13,gaussian,COMPLETE
13,0.0019948186818510294,2025-07-14 20:37:06.480852,2025-07-14 20:38:18.143401,0 days 00:01:11.662549,relu,min,0.003001491306919661,5,18,gaussian,COMPLETE
14,1.1069258107454516e-05,2025-07-14 20:38:18.144261,2025-07-14 20:39:31.640488,0 days 00:01:13.496227,identity,min,0.00831859517229135,6,18,gaussian,COMPLETE
15,0.0002319922496099025,2025-07-14 20:39:31.641327,2025-07-14 20:40:38.243661,0 days 00:01:06.602334,relu,min,0.0016419627503307757,5,12,gaussian,COMPLETE
16,0.004134192597121,2025-07-14 20:40:38.244517,2025-07-14 20:41:50.040977,0 days 00:01:11.796460,relu,min,0.004699953185316756,6,16,gaussian,COMPLETE
17,4.901749434793601e-06,2025-07-14 20:41:50.041854,2025-07-14 20:42:54.056611,0 days 00:01:04.014757,identity,min,0.005011808667775108,5,6,gaussian,COMPLETE
18,5.939118182141101e-06,2025-07-14 20:42:54.057456,2025-07-14 20:44:00.644675,0 days 00:01:06.587219,identity,min,0.0034871858296216785,7,5,gaussian,COMPLETE
19,0.009396560490131378,2025-07-14 20:44:00.645552,2025-07-14 20:45:07.270527,0 days 00:01:06.624975,relu,min,0.0020481000046410785,7,6,sigmoid,COMPLETE
20,3.825430030701682e-05,2025-07-14 20:45:07.271404,2025-07-14 20:46:17.093477,0 days 00:01:09.822073,identity,min,0.005192034082043322,6,11,gaussian,COMPLETE
21,0.3276815414428711,2025-07-14 20:46:17.094307,2025-07-14 20:47:23.869207,0 days 00:01:06.774900,identity,min,0.0035795697402306974,7,5,gaussian,COMPLETE
22,3.354588625370525e-05,2025-07-14 20:47:23.870070,2025-07-14 20:48:31.452820,0 days 00:01:07.582750,identity,min,0.005502412200971864,7,6,gaussian,COMPLETE
23,3.8586495065828785e-06,2025-07-14 20:48:31.453636,2025-07-14 20:49:38.109833,0 days 00:01:06.656197,identity,min,0.0031831475739288293,6,7,gaussian,COMPLETE
24,0.02702183835208416,2025-07-14 20:49:38.110660,2025-07-14 20:50:44.793549,0 days 00:01:06.682889,identity,min,0.0013178333927774096,6,7,gaussian,COMPLETE
25,0.04288189113140106,2025-07-14 20:50:44.794395,2025-07-14 20:51:52.244993,0 days 00:01:07.450598,identity,min,0.0025750990144016374,5,10,gaussian,COMPLETE
26,1.31791353225708,2025-07-14 20:51:52.245856,2025-07-14 20:53:00.566044,0 days 00:01:08.320188,relu,min,0.009856011178011142,6,12,gaussian,COMPLETE
27,0.0005447576404549181,2025-07-14 20:53:00.566863,2025-07-14 20:54:17.362182,0 days 00:01:16.795319,identity,min,0.000759832455335388,5,25,gaussian,COMPLETE
28,1.319413423538208,2025-07-14 20:54:17.362998,2025-07-14 20:55:24.125064,0 days 00:01:06.762066,relu,min,0.006492075190493681,6,8,sigmoid,COMPLETE
29,0.0015288688009604812,2025-07-14 20:55:24.126079,2025-07-14 20:56:41.487428,0 days 00:01:17.361349,relu,prod,0.0018544389717002835,9,7,bell,COMPLETE
30,0.00012217683251947165,2025-07-14 20:56:41.488246,2025-07-14 20:57:55.107926,0 days 00:01:13.619680,identity,min,0.007073079588997546,5,16,bell,COMPLETE
31,3.734678466571495e-05,2025-07-14 20:57:55.108731,2025-07-14 20:59:02.827357,0 days 00:01:07.718626,identity,min,0.0033865054327195357,8,5,gaussian,COMPLETE
32,0.09712112694978714,2025-07-14 20:59:02.828172,2025-07-14 21:00:09.836891,0 days 00:01:07.008719,identity,min,0.004240405153521843,7,5,gaussian,COMPLETE
33,0.014604178257286549,2025-07-14 21:00:09.837723,2025-07-14 21:01:18.836795,0 days 00:01:08.999072,identity,min,0.0013870126949268083,7,7,gaussian,COMPLETE
34,0.06292706727981567,2025-07-14 21:01:18.837609,2025-07-14 21:02:31.142623,0 days 00:01:12.305014,identity,prod,0.00010914312449960664,8,9,gaussian,COMPLETE
35,0.0012150810798630118,2025-07-14 21:02:31.143458,2025-07-14 21:03:38.196552,0 days 00:01:07.053094,identity,min,0.0027992565671287177,6,9,sigmoid,COMPLETE
36,0.2102336436510086,2025-07-14 21:03:38.197361,2025-07-14 21:04:47.738062,0 days 00:01:09.540701,identity,min,0.000952799134420002,7,8,gaussian,COMPLETE
37,0.017987968400120735,2025-07-14 21:04:47.738878,2025-07-14 21:05:58.160925,0 days 00:01:10.422047,identity,prod,0.005498805459438974,6,10,gaussian,COMPLETE
38,0.003869702573865652,2025-07-14 21:05:58.161739,2025-07-14 21:07:01.311194,0 days 00:01:03.149455,relu,min,0.0035264347656462467,5,6,sigmoid,COMPLETE
39,0.00038285934715531766,2025-07-14 21:07:01.311818,2025-07-14 21:08:18.578362,0 days 00:01:17.266544,identity,prod,0.0023614570819371766,8,21,gaussian,COMPLETE
40,3.7080269521538867e-06,2025-07-14 21:08:18.579173,2025-07-14 21:09:30.120585,0 days 00:01:11.541412,identity,min,0.007140000553550185,5,11,bell,COMPLETE
41,0.14084762334823608,2025-07-14 21:09:30.121396,2025-07-14 21:10:41.736617,0 days 00:01:11.615221,identity,min,0.006875953302860176,5,11,bell,COMPLETE
42,3.7352015169744845e-06,2025-07-14 21:10:41.737433,2025-07-14 21:11:53.149238,0 days 00:01:11.411805,identity,min,0.007705373773737509,5,14,bell,COMPLETE
43,4.006272774859099e-06,2025-07-14 21:11:53.150073,2025-07-14 21:13:04.330377,0 days 00:01:11.180304,identity,min,0.007532104928120431,5,14,bell,COMPLETE
44,4.116026047995547e-06,2025-07-14 21:13:04.331187,2025-07-14 21:14:15.426378,0 days 00:01:11.095191,identity,min,0.009855717490651224,5,14,bell,COMPLETE
45,3.7990348573657684e-06,2025-07-14 21:14:15.427203,2025-07-14 21:15:26.614509,0 days 00:01:11.187306,identity,min,0.007410631161575204,5,14,bell,COMPLETE
46,3.6861838452750817e-06,2025-07-14 21:15:26.615348,2025-07-14 21:16:37.812371,0 days 00:01:11.197023,identity,min,0.007694872107022616,5,14,bell,COMPLETE
47,0.011617273092269897,2025-07-14 21:16:37.813193,2025-07-14 21:17:48.924252,0 days 00:01:11.111059,identity,prod,0.00021830157867922982,5,13,bell,COMPLETE
48,1.6246984159806743e-05,2025-07-14 21:17:48.925082,2025-07-14 21:19:01.393238,0 days 00:01:12.468156,identity,min,0.006044103467419122,5,16,bell,COMPLETE
49,3.6120577533438336e-06,2025-07-14 21:19:01.394078,2025-07-14 21:20:15.201801,0 days 00:01:13.807723,identity,min,0.00806185335386355,5,17,bell,COMPLETE
50,3.5272423701826483e-06,2025-07-14 21:20:15.202619,2025-07-14 21:21:29.855594,0 days 00:01:14.652975,identity,min,0.007892306864563863,5,17,bell,COMPLETE
51,4.049109520565253e-06,2025-07-14 21:21:29.856510,2025-07-14 21:22:45.440111,0 days 00:01:15.583601,identity,min,0.007921994018885221,5,19,bell,COMPLETE
52,3.485512479528552e-06,2025-07-14 21:22:45.440943,2025-07-14 21:23:59.482245,0 days 00:01:14.041302,identity,min,0.008106310128220488,5,17,bell,COMPLETE
53,5.6913082516985014e-05,2025-07-14 21:23:59.483104,2025-07-14 21:25:13.781243,0 days 00:01:14.298139,identity,min,0.0043252335507080976,5,17,bell,COMPLETE
54,4.477591119211866e-06,2025-07-14 21:25:13.782087,2025-07-14 21:26:28.015950,0 days 00:01:14.233863,identity,min,0.008686745171983624,5,17,bell,COMPLETE
55,3.6469384667725535e-06,2025-07-14 21:26:28.016792,2025-07-14 21:27:43.738497,0 days 00:01:15.721705,identity,min,0.005957520038098984,5,19,bell,COMPLETE
56,1.4177442608342972e-05,2025-07-14 21:27:43.739351,2025-07-14 21:29:00.309069,0 days 00:01:16.569718,identity,min,0.006031057391657539,5,20,bell,COMPLETE
57,3.5736784411710687e-06,2025-07-14 21:29:00.309912,2025-07-14 21:30:16.121652,0 days 00:01:15.811740,identity,min,0.004668641596572953,5,19,bell,COMPLETE
58,4.836895186599577e-06,2025-07-14 21:30:16.122500,2025-07-14 21:31:35.203976,0 days 00:01:19.081476,identity,min,0.004701255670021381,5,22,bell,COMPLETE
59,0.00114824075717479,2025-07-14 21:31:35.204833,2025-07-14 21:32:51.514987,0 days 00:01:16.310154,identity,min,0.0004890329795347675,5,19,bell,COMPLETE
60,3.883649696945213e-06,2025-07-14 21:32:51.515830,2025-07-14 21:34:06.602603,0 days 00:01:15.086773,identity,min,0.005826275120245459,5,17,bell,COMPLETE
61,4.474614797800314e-06,2025-07-14 21:34:06.603474,2025-07-14 21:35:23.155382,0 days 00:01:16.551908,identity,min,0.009186057550870616,5,19,bell,COMPLETE
62,0.00010760678560473025,2025-07-14 21:35:23.156232,2025-07-14 21:36:38.664297,0 days 00:01:15.508065,identity,min,0.005042698343840059,5,18,bell,COMPLETE
63,3.935579115932342e-06,2025-07-14 21:36:38.665161,2025-07-14 21:37:55.948001,0 days 00:01:17.282840,identity,min,0.004030751506763963,5,20,bell,COMPLETE
64,1.3901368220103905e-05,2025-07-14 21:37:55.948860,2025-07-14 21:39:09.022755,0 days 00:01:13.073895,identity,min,0.00863555981111775,5,15,bell,COMPLETE
65,8.67327344167279e-06,2025-07-14 21:39:09.023625,2025-07-14 21:40:24.844906,0 days 00:01:15.821281,identity,min,0.006586548955357246,6,16,bell,COMPLETE
66,0.0006640918436460197,2025-07-14 21:40:24.845771,2025-07-14 21:41:40.158134,0 days 00:01:15.312363,identity,min,0.006662296057644979,5,18,bell,COMPLETE
67,3.964201368944487e-06,2025-07-14 21:41:40.158975,2025-07-14 21:42:57.655246,0 days 00:01:17.496271,identity,min,0.008386468087054363,5,21,bell,COMPLETE
68,0.00010831257532117888,2025-07-14 21:42:57.656091,2025-07-14 21:44:20.322893,0 days 00:01:22.666802,identity,prod,0.0052271700037139265,9,17,bell,COMPLETE
69,4.5284730731509626e-05,2025-07-14 21:44:20.323761,2025-07-14 21:45:34.576665,0 days 00:01:14.252904,identity,min,0.003838304223782216,6,15,bell,COMPLETE
70,0.009589377790689468,2025-07-14 21:45:34.577500,2025-07-14 21:46:53.656242,0 days 00:01:19.078742,identity,min,0.004678349237227788,5,23,bell,COMPLETE
71,8.287326636491343e-06,2025-07-14 21:46:53.657103,2025-07-14 21:48:04.558464,0 days 00:01:10.901361,identity,min,0.007516702666050924,5,13,bell,COMPLETE
72,4.281781457393663e-06,2025-07-14 21:48:04.559375,2025-07-14 21:49:20.463764,0 days 00:01:15.904389,identity,min,0.007898350624838865,5,19,bell,COMPLETE
73,3.887206275976496e-06,2025-07-14 21:49:20.464648,2025-07-14 21:50:34.100609,0 days 00:01:13.635961,identity,min,0.009754403975116102,5,16,bell,COMPLETE
74,2.3985909137991257e-05,2025-07-14 21:50:34.101489,2025-07-14 21:51:44.467774,0 days 00:01:10.366285,identity,min,0.005932759774722598,5,12,bell,COMPLETE
75,0.00023593656078446656,2025-07-14 21:51:44.468670,2025-07-14 21:52:54.284777,0 days 00:01:09.816107,identity,min,0.0068628612856080455,5,17,sigmoid,COMPLETE
76,4.962884486303665e-05,2025-07-14 21:52:54.285663,2025-07-14 21:54:12.346153,0 days 00:01:18.060490,relu,min,0.008313504688052316,6,18,bell,COMPLETE
77,3.891992037097225e-06,2025-07-14 21:54:12.347077,2025-07-14 21:55:29.595263,0 days 00:01:17.248186,identity,min,0.0060606881087905745,5,20,bell,COMPLETE
78,4.097632427146891e-06,2025-07-14 21:55:29.596148,2025-07-14 21:56:42.680606,0 days 00:01:13.084458,identity,min,0.005326485775433376,5,16,bell,COMPLETE
79,4.255565272615058e-06,2025-07-14 21:56:42.681485,2025-07-14 21:57:55.817626,0 days 00:01:13.136141,identity,prod,0.007207140638246275,5,15,bell,COMPLETE
80,3.843370905087795e-06,2025-07-14 21:57:55.818515,2025-07-14 21:59:12.608740,0 days 00:01:16.790225,identity,min,0.009048971691199935,6,18,bell,COMPLETE
81,0.009441730566322803,2025-07-14 21:59:12.609625,2025-07-14 22:00:23.217559,0 days 00:01:10.607934,identity,min,0.007467994885615847,5,13,bell,COMPLETE
82,4.13453108194517e-06,2025-07-14 22:00:23.218448,2025-07-14 22:01:34.569829,0 days 00:01:11.351381,identity,min,0.0045084605902772695,5,14,bell,COMPLETE
83,3.6938822631782386e-06,2025-07-14 22:01:34.570703,2025-07-14 22:02:45.923667,0 days 00:01:11.352964,identity,min,0.009905986906933829,5,14,bell,COMPLETE
84,4.0260997593577486e-06,2025-07-14 22:02:45.924547,2025-07-14 22:03:55.809557,0 days 00:01:09.885010,identity,min,0.009938515479809536,5,12,bell,COMPLETE
85,4.9401282012695447e-05,2025-07-14 22:03:55.810449,2025-07-14 22:05:02.662644,0 days 00:01:06.852195,identity,min,0.006513066146249473,5,15,sigmoid,COMPLETE
86,1.3172639608383179,2025-07-14 22:05:02.663550,2025-07-14 22:06:14.230939,0 days 00:01:11.567389,relu,min,0.00821248079098606,5,14,bell,COMPLETE
87,3.538062628649641e-06,2025-07-14 22:06:14.231802,2025-07-14 22:07:24.617022,0 days 00:01:10.385220,identity,min,0.008915184793047691,5,13,bell,COMPLETE
88,5.157609848538414e-06,2025-07-14 22:07:24.617901,2025-07-14 22:08:36.094533,0 days 00:01:11.476632,identity,min,0.009954485973274507,5,11,bell,COMPLETE
89,3.694977749546524e-06,2025-07-14 22:08:36.095445,2025-07-14 22:09:47.568273,0 days 00:01:11.472828,identity,min,0.005689736868652029,5,11,bell,COMPLETE
90,5.226045686868019e-06,2025-07-14 22:09:47.569157,2025-07-14 22:10:58.029946,0 days 00:01:10.460789,identity,min,0.005587434649800506,5,13,bell,COMPLETE
91,4.014097157778451e-06,2025-07-14 22:10:58.031025,2025-07-14 22:12:08.789214,0 days 00:01:10.758189,identity,min,0.008983401536923388,5,10,bell,COMPLETE
92,3.793724090428441e-06,2025-07-14 22:12:08.790106,2025-07-14 22:13:19.277893,0 days 00:01:10.487787,identity,min,0.006783896577590314,5,12,bell,COMPLETE
93,5.490429884957848e-06,2025-07-14 22:13:19.278798,2025-07-14 22:14:31.147782,0 days 00:01:11.868984,identity,min,0.006099190582286244,5,11,bell,COMPLETE
94,4.516382432484534e-06,2025-07-14 22:14:31.148670,2025-07-14 22:15:41.932856,0 days 00:01:10.784186,identity,min,0.007944370163845747,5,10,bell,COMPLETE
95,0.0025459087919443846,2025-07-14 22:15:41.933743,2025-07-14 22:16:57.448329,0 days 00:01:15.514586,identity,min,0.004881173740983385,5,19,bell,COMPLETE
96,0.004989448469132185,2025-07-14 22:16:57.449196,2025-07-14 22:18:15.468172,0 days 00:01:18.018976,identity,prod,0.00020927249350893894,5,21,bell,COMPLETE
97,1.4387595911102835e-05,2025-07-14 22:18:15.469044,2025-07-14 22:19:31.261209,0 days 00:01:15.792165,identity,min,0.007072562170110656,6,17,bell,COMPLETE
98,5.6274661801580805e-06,2025-07-14 22:19:31.262071,2025-07-14 22:20:41.665181,0 days 00:01:10.403110,identity,min,0.008975410585008997,5,13,bell,COMPLETE
99,0.0035107654985040426,2025-07-14 22:20:41.666057,2025-07-14 22:21:49.816754,0 days 00:01:08.150697,relu,min,0.002906080290803459,5,16,sigmoid,COMPLETE
100,0.0004485465178731829,2025-07-14 22:21:49.817642,2025-07-14 22:23:01.451853,0 days 00:01:11.634211,identity,min,0.000983197501616843,5,11,bell,COMPLETE
101,3.7840745790163055e-06,2025-07-14 22:23:01.452748,2025-07-14 22:24:13.359218,0 days 00:01:11.906470,identity,min,0.0075066344684136645,5,14,bell,COMPLETE
102,5.047439117333852e-06,2025-07-14 22:24:13.360111,2025-07-14 22:25:22.851351,0 days 00:01:09.491240,identity,min,0.005512813224846655,5,12,bell,COMPLETE
103,6.5219819589401595e-06,2025-07-14 22:25:22.852260,2025-07-14 22:26:34.616463,0 days 00:01:11.764203,identity,min,0.006350067397860512,5,15,bell,COMPLETE
104,0.0010441046906635165,2025-07-14 22:26:34.617376,2025-07-14 22:27:45.547873,0 days 00:01:10.930497,identity,min,0.008059028355954899,5,14,bell,COMPLETE
105,3.743661409316701e-06,2025-07-14 22:27:45.548746,2025-07-14 22:28:57.246896,0 days 00:01:11.698150,identity,min,0.008703889016904448,5,15,bell,COMPLETE
106,0.000534161226823926,2025-07-14 22:28:57.247810,2025-07-14 22:30:10.795845,0 days 00:01:13.548035,identity,min,0.003998091154575703,5,17,bell,COMPLETE
107,0.0002975050010718405,2025-07-14 22:30:10.796729,2025-07-14 22:31:23.639015,0 days 00:01:12.842286,identity,min,0.006928832879636371,5,16,bell,COMPLETE
108,0.016732364892959595,2025-07-14 22:31:23.639915,2025-07-14 22:32:34.535242,0 days 00:01:10.895327,identity,min,0.0005362768213612459,5,14,bell,COMPLETE
109,4.487833393795881e-06,2025-07-14 22:32:34.536119,2025-07-14 22:33:45.607354,0 days 00:01:11.071235,identity,min,0.009246664435442874,5,13,bell,COMPLETE
110,4.984302449884126e-06,2025-07-14 22:33:45.608241,2025-07-14 22:35:01.626374,0 days 00:01:16.018133,identity,prod,0.005173656929095633,5,18,bell,COMPLETE
111,0.006694314535707235,2025-07-14 22:35:01.627273,2025-07-14 22:36:13.552975,0 days 00:01:11.925702,identity,min,0.008329074405342309,5,15,bell,COMPLETE
112,3.5563291476137238e-06,2025-07-14 22:36:13.553835,2025-07-14 22:37:25.375907,0 days 00:01:11.822072,identity,min,0.007672811763593307,5,15,bell,COMPLETE
113,0.08116672933101654,2025-07-14 22:37:25.376799,2025-07-14 22:38:37.471997,0 days 00:01:12.095198,identity,min,0.0074980060423681496,5,15,bell,COMPLETE
114,0.21798045933246613,2025-07-14 22:38:37.472861,2025-07-14 22:39:53.755013,0 days 00:01:16.282152,identity,min,0.0008267523490988444,5,20,bell,COMPLETE
115,7.40141149435658e-06,2025-07-14 22:39:53.755924,2025-07-14 22:41:05.066960,0 days 00:01:11.311036,identity,min,0.006039795395371758,5,14,bell,COMPLETE
116,3.638599082478322e-06,2025-07-14 22:41:05.067851,2025-07-14 22:42:20.303555,0 days 00:01:15.235704,identity,min,0.0065269624311329886,5,19,bell,COMPLETE
117,5.107170181872789e-06,2025-07-14 22:42:20.304467,2025-07-14 22:43:35.563221,0 days 00:01:15.258754,identity,min,0.006398930312609905,5,19,bell,COMPLETE
118,0.00012019396672258154,2025-07-14 22:43:35.564112,2025-07-14 22:44:48.316185,0 days 00:01:12.752073,identity,min,0.005595454679212978,5,21,sigmoid,COMPLETE
119,6.0921315707673784e-06,2025-07-14 22:44:48.317089,2025-07-14 22:46:04.336270,0 days 00:01:16.019181,relu,min,0.009962041722040979,5,18,bell,COMPLETE
120,0.002988224383443594,2025-07-14 22:46:04.337180,2025-07-14 22:47:20.437526,0 days 00:01:16.100346,identity,min,0.00036074614758556785,5,19,bell,COMPLETE
121,3.9109590943553485e-06,2025-07-14 22:47:20.438417,2025-07-14 22:48:30.278764,0 days 00:01:09.840347,identity,min,0.007843839996646557,5,9,bell,COMPLETE
122,6.614854555664351e-06,2025-07-14 22:48:30.279628,2025-07-14 22:49:43.975044,0 days 00:01:13.695416,identity,min,0.006815796917644853,5,17,bell,COMPLETE
123,0.007140233181416988,2025-07-14 22:49:43.975933,2025-07-14 22:50:53.407067,0 days 00:01:09.431134,identity,min,0.008938175566145465,5,12,bell,COMPLETE
124,3.6229525903763715e-06,2025-07-14 22:50:53.407918,2025-07-14 22:52:03.696209,0 days 00:01:10.288291,identity,min,0.007674116631286935,5,13,bell,COMPLETE
125,3.771779574890388e-06,2025-07-14 22:52:03.697102,2025-07-14 22:53:19.800355,0 days 00:01:16.103253,identity,min,0.004443524832027139,5,20,bell,COMPLETE
126,3.628583954196074e-06,2025-07-14 22:53:19.801255,2025-07-14 22:54:30.242616,0 days 00:01:10.441361,identity,min,0.00722559315973474,5,13,bell,COMPLETE
127,0.005166918970644474,2025-07-14 22:54:30.243540,2025-07-14 22:55:47.485731,0 days 00:01:17.242191,identity,min,0.0015676428100778216,9,13,bell,COMPLETE
128,1.0119765647687018e-05,2025-07-14 22:55:47.486626,2025-07-14 22:56:59.012321,0 days 00:01:11.525695,identity,min,0.007261061265370863,5,13,bell,COMPLETE
129,3.829301203950308e-05,2025-07-14 22:56:59.013256,2025-07-14 22:58:12.875754,0 days 00:01:13.862498,identity,min,0.004927316416143025,5,16,bell,COMPLETE
130,5.781960680906195e-06,2025-07-14 22:58:12.876671,2025-07-14 22:59:24.641303,0 days 00:01:11.764632,identity,min,0.005775919460325614,5,14,bell,COMPLETE
131,0.0007279363344423473,2025-07-14 22:59:24.642210,2025-07-14 23:00:34.230338,0 days 00:01:09.588128,identity,min,0.006357131149811499,5,12,bell,COMPLETE
132,3.786850584219792e-06,2025-07-14 23:00:34.231248,2025-07-14 23:01:49.428161,0 days 00:01:15.196913,identity,min,0.008215462231968684,8,11,bell,COMPLETE
133,7.12498149368912e-06,2025-07-14 23:01:49.429026,2025-07-14 23:03:00.008079,0 days 00:01:10.579053,identity,min,0.007259487080173514,5,13,bell,COMPLETE
134,4.401317255542381e-06,2025-07-14 23:03:00.008951,2025-07-14 23:04:15.324950,0 days 00:01:15.315999,identity,min,0.008091662479212496,5,19,bell,COMPLETE
135,0.2094121128320694,2025-07-14 23:04:15.325805,2025-07-14 23:05:30.980373,0 days 00:01:15.654568,identity,prod,0.009373126466037423,5,18,bell,COMPLETE
136,4.882815574092092e-06,2025-07-14 23:05:30.981265,2025-07-14 23:06:44.794333,0 days 00:01:13.813068,identity,min,0.0066757977736534874,5,17,bell,COMPLETE
137,3.656481794678257e-06,2025-07-14 23:06:44.795228,2025-07-14 23:07:54.759529,0 days 00:01:09.964301,identity,min,0.008724404929427556,5,12,bell,COMPLETE
138,3.7826166590093635e-06,2025-07-14 23:07:54.760398,2025-07-14 23:09:05.192325,0 days 00:01:10.431927,identity,min,0.009067815784611966,5,12,bell,COMPLETE
