number,value,datetime_start,datetime_complete,duration,params_activation,params_and_operator,params_lr,params_n_sets,params_seq_length,params_shape,state
417,3.982392627221998e-06,2025-07-15 04:43:02.405447,2025-07-15 04:44:12.633743,0 days 00:01:10.228296,identity,min,0.008638329009936389,5,12,bell,COMPLETE
418,4.850795903621474e-06,2025-07-15 04:44:12.634776,2025-07-15 04:45:25.790813,0 days 00:01:13.156037,identity,min,0.008094030162307315,6,13,bell,COMPLETE
419,4.7007115426822565e-06,2025-07-15 04:45:25.791851,2025-07-15 04:46:36.913443,0 days 00:01:11.121592,identity,min,0.009371000924856336,5,13,bell,COMPLETE
420,3.7006855109211756e-06,2025-07-15 04:46:36.914512,2025-07-15 04:47:44.561552,0 days 00:01:07.647040,identity,min,0.00802825203544966,5,6,bell,COMPLETE
421,4.911302767141024e-06,2025-07-15 04:47:44.562603,2025-07-15 04:48:55.176134,0 days 00:01:10.613531,relu,min,0.007720388422564677,5,12,bell,COMPLETE
422,3.4894283089670353e-06,2025-07-15 04:48:55.177184,2025-07-15 04:50:06.274428,0 days 00:01:11.097244,identity,min,0.008608991800244305,5,13,bell,COMPLETE
423,3.987531272287015e-06,2025-07-15 04:50:06.275470,2025-07-15 04:51:17.326178,0 days 00:01:11.050708,identity,min,0.009402098160613733,5,13,bell,COMPLETE
424,6.379808382916963e-06,2025-07-15 04:51:17.327236,2025-07-15 04:52:31.744433,0 days 00:01:14.417197,identity,min,0.008754166986913302,5,17,bell,COMPLETE
425,4.740246367873624e-06,2025-07-15 04:52:31.745521,2025-07-15 04:53:43.630554,0 days 00:01:11.885033,identity,min,0.008645230205206035,5,14,bell,COMPLETE
426,0.011487646959722042,2025-07-15 04:53:43.631619,2025-07-15 04:54:54.657726,0 days 00:01:11.026107,identity,min,0.00999674218999738,5,13,bell,COMPLETE
427,3.541457090250333e-06,2025-07-15 04:54:54.658777,2025-07-15 04:56:05.651711,0 days 00:01:10.992934,identity,min,0.008319302206643783,5,13,bell,COMPLETE
428,2.7690908609656617e-05,2025-07-15 04:56:05.652754,2025-07-15 04:57:19.428651,0 days 00:01:13.775897,identity,min,0.004922023639921812,8,12,bell,COMPLETE
429,4.585006990964757e-06,2025-07-15 04:57:19.429671,2025-07-15 04:58:34.852619,0 days 00:01:15.422948,identity,min,0.007822608250447527,5,18,bell,COMPLETE
430,4.392027676658472e-06,2025-07-15 04:58:34.853657,2025-07-15 04:59:46.020604,0 days 00:01:11.166947,identity,min,0.008035350950038045,5,13,bell,COMPLETE
431,0.4680594205856323,2025-07-15 04:59:46.021633,2025-07-15 05:00:58.084964,0 days 00:01:12.063331,identity,min,0.0004283847086750454,5,14,bell,COMPLETE
432,4.43930912297219e-06,2025-07-15 05:00:58.086022,2025-07-15 05:02:09.323661,0 days 00:01:11.237639,identity,min,0.009281688648841449,5,13,bell,COMPLETE
433,0.005087680649012327,2025-07-15 05:02:09.324687,2025-07-15 05:03:20.642331,0 days 00:01:11.317644,identity,min,0.0073341508971999,5,13,bell,COMPLETE
434,0.0022262814454734325,2025-07-15 05:03:20.643406,2025-07-15 05:04:26.150870,0 days 00:01:05.507464,identity,min,0.0006042864315355925,5,12,sigmoid,COMPLETE
435,3.939439920941368e-06,2025-07-15 05:04:26.151901,2025-07-15 05:05:33.082159,0 days 00:01:06.930258,identity,min,0.00555152306011418,5,5,bell,COMPLETE
436,0.00033907502074725926,2025-07-15 05:05:33.083240,2025-07-15 05:06:45.195470,0 days 00:01:12.112230,identity,min,0.008487271369421314,5,14,bell,COMPLETE
437,0.0008020995301194489,2025-07-15 05:06:45.196555,2025-07-15 05:07:55.476179,0 days 00:01:10.279624,identity,min,0.006885459252172988,5,12,bell,COMPLETE
438,8.065922884270549e-06,2025-07-15 05:07:55.477250,2025-07-15 05:09:06.829018,0 days 00:01:11.351768,identity,min,0.004594870432177413,5,13,bell,COMPLETE
439,3.4384768241579877e-06,2025-07-15 05:09:06.830058,2025-07-15 05:10:18.937842,0 days 00:01:12.107784,identity,min,0.007506936566334692,5,14,bell,COMPLETE
440,1.3169734477996826,2025-07-15 05:10:18.938896,2025-07-15 05:11:32.264829,0 days 00:01:13.325933,relu,min,0.00018851892884058763,5,15,bell,COMPLETE
441,0.03777499496936798,2025-07-15 05:11:32.265886,2025-07-15 05:12:44.481505,0 days 00:01:12.215619,identity,min,0.006606630241873734,5,14,bell,COMPLETE
442,0.06182210519909859,2025-07-15 05:12:44.482567,2025-07-15 05:13:56.605348,0 days 00:01:12.122781,identity,min,0.00027762089794094503,5,14,bell,COMPLETE
443,4.2033898353111e-06,2025-07-15 05:13:56.606431,2025-07-15 05:15:09.553609,0 days 00:01:12.947178,identity,min,0.00524364798710657,5,15,bell,COMPLETE
444,6.800691608077614e-06,2025-07-15 05:15:09.554712,2025-07-15 05:16:23.361372,0 days 00:01:13.806660,identity,min,0.007645450675662334,5,16,bell,COMPLETE
445,6.16015495324973e-06,2025-07-15 05:16:23.362411,2025-07-15 05:17:35.448311,0 days 00:01:12.085900,identity,min,0.005913990352133867,5,14,bell,COMPLETE
446,1.3815746569889598e-05,2025-07-15 05:17:35.449394,2025-07-15 05:18:48.370857,0 days 00:01:12.921463,identity,min,0.006937425164970712,5,15,bell,COMPLETE
447,3.659564526969916e-06,2025-07-15 05:18:48.371913,2025-07-15 05:20:00.554737,0 days 00:01:12.182824,identity,min,0.007479655427240839,5,14,bell,COMPLETE
448,3.8538955777767114e-06,2025-07-15 05:20:00.555806,2025-07-15 05:21:14.394640,0 days 00:01:13.838834,identity,min,0.003796394308399598,5,16,bell,COMPLETE
449,5.566383606492309e-06,2025-07-15 05:21:14.395716,2025-07-15 05:22:30.875942,0 days 00:01:16.480226,identity,min,0.00655913909088634,6,17,bell,COMPLETE
450,3.481961584839155e-06,2025-07-15 05:22:30.877038,2025-07-15 05:23:46.445218,0 days 00:01:15.568180,identity,min,0.00503350038233355,5,18,bell,COMPLETE
451,5.059558588982327e-06,2025-07-15 05:23:46.446268,2025-07-15 05:24:57.547282,0 days 00:01:11.101014,identity,min,0.0049808004877481,5,17,gaussian,COMPLETE
452,3.6357946555654053e-06,2025-07-15 05:24:57.548322,2025-07-15 05:26:12.452294,0 days 00:01:14.903972,identity,min,0.004195637951010944,5,17,bell,COMPLETE
453,3.448612687861896e-06,2025-07-15 05:26:12.453340,2025-07-15 05:27:24.695779,0 days 00:01:12.242439,identity,min,0.0045967672819702075,5,14,bell,COMPLETE
454,3.67781353816099e-06,2025-07-15 05:27:24.696833,2025-07-15 05:28:40.354621,0 days 00:01:15.657788,identity,min,0.004629239989006739,5,18,bell,COMPLETE
455,0.06281378120183945,2025-07-15 05:28:40.355699,2025-07-15 05:29:52.614606,0 days 00:01:12.258907,identity,min,0.00455543364729185,5,14,bell,COMPLETE
456,3.845501851174049e-06,2025-07-15 05:29:52.615656,2025-07-15 05:31:04.869379,0 days 00:01:12.253723,identity,min,0.0053097319200688334,5,14,bell,COMPLETE
457,6.826642220403301e-06,2025-07-15 05:31:04.870456,2025-07-15 05:32:20.488996,0 days 00:01:15.618540,identity,min,0.002979369090846117,5,18,bell,COMPLETE
458,0.001492277137003839,2025-07-15 05:32:20.490089,2025-07-15 05:33:33.597107,0 days 00:01:13.107018,identity,min,0.0040653255303055805,5,15,bell,COMPLETE
459,7.072644802974537e-05,2025-07-15 05:33:33.598199,2025-07-15 05:34:44.062432,0 days 00:01:10.464233,identity,min,0.0043700351754169834,5,18,sigmoid,COMPLETE
460,5.596638948190957e-05,2025-07-15 05:34:44.063490,2025-07-15 05:35:56.453143,0 days 00:01:12.389653,identity,min,0.004867662792108268,5,14,bell,COMPLETE
461,3.966627900808817e-06,2025-07-15 05:35:56.454218,2025-07-15 05:37:10.087342,0 days 00:01:13.633124,relu,min,0.005107384878779209,5,15,bell,COMPLETE
462,6.1593727878062055e-06,2025-07-15 05:37:10.088426,2025-07-15 05:38:22.356415,0 days 00:01:12.267989,identity,min,0.005819434722917447,5,14,bell,COMPLETE
463,3.799296337092528e-06,2025-07-15 05:38:22.357497,2025-07-15 05:39:38.785151,0 days 00:01:16.427654,identity,min,0.005507103031694861,5,19,bell,COMPLETE
464,3.6116941828368e-06,2025-07-15 05:39:38.786233,2025-07-15 05:40:51.101304,0 days 00:01:12.315071,identity,min,0.003616163204224093,5,14,bell,COMPLETE
465,5.64488691452425e-05,2025-07-15 05:40:51.102384,2025-07-15 05:42:08.255770,0 days 00:01:17.153386,identity,min,0.004853267530832256,9,12,bell,COMPLETE
466,8.012274520297069e-06,2025-07-15 05:42:08.256838,2025-07-15 05:43:21.389881,0 days 00:01:13.133043,identity,min,0.005664737958777476,5,15,bell,COMPLETE
467,0.0020533560309559107,2025-07-15 05:43:21.390951,2025-07-15 05:44:33.625375,0 days 00:01:12.234424,identity,min,0.0043355741680890045,5,14,bell,COMPLETE
468,6.493025466625113e-06,2025-07-15 05:44:33.626434,2025-07-15 05:45:44.995339,0 days 00:01:11.368905,identity,min,0.005104819423073179,5,13,bell,COMPLETE
469,4.2090150600415654e-06,2025-07-15 05:45:44.996422,2025-07-15 05:46:58.125954,0 days 00:01:13.129532,identity,min,0.0060941035418486805,5,15,bell,COMPLETE
470,3.6831795569014503e-06,2025-07-15 05:46:58.127020,2025-07-15 05:48:09.700473,0 days 00:01:11.573453,identity,min,0.005503657018320513,5,13,bell,COMPLETE
471,9.577010132488795e-06,2025-07-15 05:48:09.701551,2025-07-15 05:49:21.991087,0 days 00:01:12.289536,identity,min,0.006269402104332076,5,14,bell,COMPLETE
472,0.00108593818731606,2025-07-15 05:49:21.992167,2025-07-15 05:50:33.467141,0 days 00:01:11.474974,identity,min,0.004867031381740237,5,13,bell,COMPLETE
473,3.81643121727393e-06,2025-07-15 05:50:33.468248,2025-07-15 05:51:42.095134,0 days 00:01:08.626886,identity,min,0.0039108594157652105,5,14,gaussian,COMPLETE
474,2.5758021365618333e-05,2025-07-15 05:51:42.096216,2025-07-15 05:52:56.980910,0 days 00:01:14.884694,identity,min,0.005670249293463563,7,12,bell,COMPLETE
475,3.7098357097420376e-06,2025-07-15 05:52:56.982017,2025-07-15 05:54:08.557343,0 days 00:01:11.575326,identity,min,0.006409117741293895,5,13,bell,COMPLETE
476,7.954187822178937e-06,2025-07-15 05:54:08.558435,2025-07-15 05:55:22.604311,0 days 00:01:14.045876,identity,min,0.007020756690902658,8,12,bell,COMPLETE
477,3.6845190152234863e-06,2025-07-15 05:55:22.605382,2025-07-15 05:56:34.193147,0 days 00:01:11.587765,identity,min,0.005332151289725827,5,13,bell,COMPLETE
478,5.369213795347605e-06,2025-07-15 05:56:34.194202,2025-07-15 05:57:49.942496,0 days 00:01:15.748294,identity,min,0.0059544884949894435,5,18,bell,COMPLETE
479,4.072656338394154e-06,2025-07-15 05:57:49.943614,2025-07-15 05:59:03.203521,0 days 00:01:13.259907,identity,min,0.006455482419378801,5,15,bell,COMPLETE
480,1.3172639608383179,2025-07-15 05:59:03.204627,2025-07-15 06:00:11.100391,0 days 00:01:07.895764,relu,min,0.007094906165230263,5,14,sigmoid,COMPLETE
481,0.10726508498191833,2025-07-15 06:00:11.101454,2025-07-15 06:01:22.688998,0 days 00:01:11.587544,identity,min,0.0007293951282369231,5,13,bell,COMPLETE
482,4.465050096769119e-06,2025-07-15 06:01:22.690075,2025-07-15 06:02:35.050665,0 days 00:01:12.360590,identity,min,0.00452522924236254,5,14,bell,COMPLETE
483,9.438564120500814e-06,2025-07-15 06:02:35.051749,2025-07-15 06:03:45.601841,0 days 00:01:10.550092,identity,min,0.005283766971540182,5,12,bell,COMPLETE
484,4.681064183387207e-06,2025-07-15 06:03:45.602915,2025-07-15 06:05:01.235976,0 days 00:01:15.633061,identity,min,0.0059957617398777325,5,18,bell,COMPLETE
485,3.482435658952454e-06,2025-07-15 06:05:01.237053,2025-07-15 06:06:12.701665,0 days 00:01:11.464612,identity,min,0.0033553358193182466,5,13,bell,COMPLETE
486,0.0011386843398213387,2025-07-15 06:06:12.702761,2025-07-15 06:07:24.235083,0 days 00:01:11.532322,identity,min,0.002460187733963367,5,13,bell,COMPLETE
487,1.785237509466242e-05,2025-07-15 06:07:24.236192,2025-07-15 06:08:36.495940,0 days 00:01:12.259748,identity,min,0.0035042466579836085,5,14,bell,COMPLETE
488,0.0011742571368813515,2025-07-15 06:08:36.497050,2025-07-15 06:09:47.995434,0 days 00:01:11.498384,identity,min,0.007529217119551339,5,13,bell,COMPLETE
489,4.303049536247272e-06,2025-07-15 06:09:47.996493,2025-07-15 06:11:03.884693,0 days 00:01:15.888200,identity,min,0.003912924745541637,6,16,bell,COMPLETE
490,6.200421012181323e-06,2025-07-15 06:11:03.885838,2025-07-15 06:12:16.269435,0 days 00:01:12.383597,identity,min,0.003246241964763363,5,14,bell,COMPLETE
491,3.886295871780021e-06,2025-07-15 06:12:16.270529,2025-07-15 06:13:27.820376,0 days 00:01:11.549847,identity,min,0.006609577549139394,5,13,bell,COMPLETE
492,0.00014228497457224876,2025-07-15 06:13:27.821460,2025-07-15 06:14:36.821865,0 days 00:01:09.000405,identity,min,0.00808693939948715,5,7,bell,COMPLETE
493,1.476229681429686e-05,2025-07-15 06:14:36.822967,2025-07-15 06:15:48.213806,0 days 00:01:11.390839,identity,min,0.007115307921884761,5,13,bell,COMPLETE
494,1.0746036423370242e-05,2025-07-15 06:15:48.214898,2025-07-15 06:17:00.661438,0 days 00:01:12.446540,identity,min,0.0076402348063447124,5,14,bell,COMPLETE
495,1.4333284525491763e-05,2025-07-15 06:17:00.662549,2025-07-15 06:18:13.908472,0 days 00:01:13.245923,identity,min,0.004450084924552178,5,15,bell,COMPLETE
496,0.014328349381685257,2025-07-15 06:18:13.909659,2025-07-15 06:19:22.706262,0 days 00:01:08.796603,identity,min,0.006661950013646216,5,14,gaussian,COMPLETE
497,4.33990180681576e-06,2025-07-15 06:19:22.707391,2025-07-15 06:20:34.278205,0 days 00:01:11.570814,identity,min,0.009348937615879816,5,13,bell,COMPLETE
498,0.12262749671936035,2025-07-15 06:20:34.279318,2025-07-15 06:21:45.906391,0 days 00:01:11.627073,identity,min,0.0012171590016630538,5,13,bell,COMPLETE
499,4.09337917517405e-06,2025-07-15 06:21:45.907511,2025-07-15 06:22:59.326341,0 days 00:01:13.418830,identity,min,0.008740176798527993,5,15,bell,COMPLETE
