number,value,datetime_start,datetime_complete,duration,params_activation,params_batch_size,params_h,params_lr,params_seq_length,state
285,4.806202468898846e-06,2025-07-15 20:53:30.007749,2025-07-15 20:55:26.918863,0 days 00:01:56.911114,identity,16,124,0.0002915340450317101,17,COMPLETE
286,1.2483929822337814e-05,2025-07-15 20:55:26.919757,2025-07-15 20:57:21.395720,0 days 00:01:54.475963,identity,16,125,0.0002838264149872911,16,COMPLETE
287,1.2934724509250373e-05,2025-07-15 20:57:21.396493,2025-07-15 20:59:15.722577,0 days 00:01:54.326084,identity,16,128,0.0002334625930499269,17,COMPLETE
288,5.136676918482408e-06,2025-07-15 20:59:15.723568,2025-07-15 21:01:14.491083,0 days 00:01:58.767515,identity,16,125,0.00026401283693794597,17,COMPLETE
289,4.334622644819319e-06,2025-07-15 21:01:14.491960,2025-07-15 21:03:10.082191,0 days 00:01:55.590231,identity,16,123,0.0003008040263814954,17,COMPLETE
290,4.401656497066142e-06,2025-07-15 21:03:10.083110,2025-07-15 21:05:06.741060,0 days 00:01:56.657950,identity,16,124,0.000303959139680356,17,COMPLETE
291,6.447574833146064e-06,2025-07-15 21:05:06.741803,2025-07-15 21:06:56.982360,0 days 00:01:50.240557,identity,16,126,0.00031487919324538373,15,COMPLETE
292,1.0128032954526134e-05,2025-07-15 21:06:56.983336,2025-07-15 21:08:49.407167,0 days 00:01:52.423831,identity,16,124,0.00030324205155484075,16,COMPLETE
293,1.3165440559387207,2025-07-15 21:08:49.408109,2025-07-15 21:09:53.441090,0 days 00:01:04.032981,relu,64,123,0.0003297358337295365,17,COMPLETE
294,1.8444456145516597e-05,2025-07-15 21:09:53.441616,2025-07-15 21:11:42.293428,0 days 00:01:48.851812,identity,16,128,0.0018599118062683911,16,COMPLETE
295,1.0471003406564705e-05,2025-07-15 21:11:42.294350,2025-07-15 21:13:43.270611,0 days 00:02:00.976261,identity,16,125,0.0002936312421570248,18,COMPLETE
296,0.0001629679318284616,2025-07-15 21:13:43.271598,2025-07-15 21:15:20.335588,0 days 00:01:37.063990,identity,16,85,0.00021418923045558454,17,COMPLETE
297,5.296173185342923e-06,2025-07-15 21:15:20.336537,2025-07-15 21:17:15.822571,0 days 00:01:55.486034,identity,16,123,0.000352054589185648,17,COMPLETE
298,2.716677226999309e-05,2025-07-15 21:17:15.823446,2025-07-15 21:19:04.900047,0 days 00:01:49.076601,identity,16,121,0.0002585185340835512,16,COMPLETE
299,4.419255219545448e-06,2025-07-15 21:19:04.900931,2025-07-15 21:21:01.205914,0 days 00:01:56.304983,identity,16,124,0.00032744811571609945,17,COMPLETE
300,4.597184215526795e-06,2025-07-15 21:21:01.206866,2025-07-15 21:22:55.350551,0 days 00:01:54.143685,identity,16,121,0.0003187006747734617,17,COMPLETE
301,4.793970674654702e-06,2025-07-15 21:22:55.351492,2025-07-15 21:24:48.690661,0 days 00:01:53.339169,identity,16,121,0.00031323899673960125,17,COMPLETE
302,6.21538356426754e-06,2025-07-15 21:24:48.691456,2025-07-15 21:26:40.083001,0 days 00:01:51.391545,identity,16,120,0.0003253953765841119,17,COMPLETE
303,0.0011418681824579835,2025-07-15 21:26:40.083844,2025-07-15 21:27:57.204979,0 days 00:01:17.121135,identity,32,121,0.0003252374386671929,17,COMPLETE
304,7.310947239602683e-06,2025-07-15 21:27:57.205675,2025-07-15 21:29:32.548172,0 days 00:01:35.342497,identity,16,91,0.00030290946399198044,16,COMPLETE
305,1.7331871276837774e-05,2025-07-15 21:29:32.549013,2025-07-15 21:31:26.760844,0 days 00:01:54.211831,identity,16,122,0.00026742973292344423,17,COMPLETE
306,5.729376880481141e-06,2025-07-15 21:31:26.761736,2025-07-15 21:33:21.553931,0 days 00:01:54.792195,identity,16,120,0.00036547063694953094,18,COMPLETE
307,9.1876536316704e-06,2025-07-15 21:33:21.554898,2025-07-15 21:35:12.435682,0 days 00:01:50.880784,identity,16,119,0.0003197305160056856,16,COMPLETE
308,1.1653610272333026e-05,2025-07-15 21:35:12.436664,2025-07-15 21:37:08.464453,0 days 00:01:56.027789,identity,16,123,0.00024410786261185282,17,COMPLETE
309,4.4545686250785366e-06,2025-07-15 21:37:08.465222,2025-07-15 21:39:10.243516,0 days 00:02:01.778294,identity,16,126,0.00028759630344928007,18,COMPLETE
310,0.0009219242492690682,2025-07-15 21:39:10.244455,2025-07-15 21:40:15.958583,0 days 00:01:05.714128,identity,128,126,0.0002707654048946302,18,COMPLETE
311,5.600403255812125e-06,2025-07-15 21:40:15.959265,2025-07-15 21:42:16.995095,0 days 00:02:01.035830,identity,16,125,0.00039780990537171477,18,COMPLETE
312,8.10107849247288e-06,2025-07-15 21:42:16.995819,2025-07-15 21:44:06.681307,0 days 00:01:49.685488,identity,16,126,0.0002954731755712545,15,COMPLETE
313,1.316388487815857,2025-07-15 21:44:06.682246,2025-07-15 21:46:17.041308,0 days 00:02:10.359062,relu,16,118,0.0003526165313805167,18,COMPLETE
314,1.6965490431175567e-05,2025-07-15 21:46:17.042315,2025-07-15 21:48:07.920701,0 days 00:01:50.878386,identity,16,128,0.00022682121557801555,16,COMPLETE
315,7.339859166677343e-06,2025-07-15 21:48:07.921670,2025-07-15 21:50:06.478970,0 days 00:01:58.557300,identity,16,123,0.000446183565573531,18,COMPLETE
316,1.2675716789090075e-05,2025-07-15 21:50:06.479988,2025-07-15 21:52:02.789907,0 days 00:01:56.309919,identity,16,123,0.00028934176313735326,17,COMPLETE
317,7.5512930379773024e-06,2025-07-15 21:52:02.790953,2025-07-15 21:53:32.857676,0 days 00:01:30.066723,identity,16,81,0.0002531017451906436,16,COMPLETE
318,5.052257165516494e-06,2025-07-15 21:53:32.858433,2025-07-15 21:55:25.232667,0 days 00:01:52.374234,identity,16,117,0.00038305190982522425,17,COMPLETE
319,1.9772187442868017e-05,2025-07-15 21:55:25.233708,2025-07-15 21:56:59.854083,0 days 00:01:34.620375,identity,16,88,0.00034690199420642036,17,COMPLETE
320,0.0009358386741951108,2025-07-15 21:56:59.855140,2025-07-15 21:57:59.451577,0 days 00:00:59.596437,identity,64,119,0.0004133999025283314,16,COMPLETE
321,6.300964287220268e-06,2025-07-15 21:57:59.452128,2025-07-15 21:59:32.127937,0 days 00:01:32.675809,identity,16,112,0.0004671375993683542,13,COMPLETE
322,6.822456725785742e-06,2025-07-15 21:59:32.128854,2025-07-15 22:01:26.206234,0 days 00:01:54.077380,identity,16,121,0.0003283096731498451,17,COMPLETE
323,7.2447096499672625e-06,2025-07-15 22:01:26.207026,2025-07-15 22:03:28.860118,0 days 00:02:02.653092,identity,16,110,0.0002826009917946286,18,COMPLETE
324,6.795233275624923e-06,2025-07-15 22:03:28.861101,2025-07-15 22:05:20.823309,0 days 00:01:51.962208,identity,16,115,0.00038040886680402357,17,COMPLETE
325,1.1105676094302908e-05,2025-07-15 22:05:20.824270,2025-07-15 22:07:13.262058,0 days 00:01:52.437788,identity,16,124,0.0002484692170818808,16,COMPLETE
326,8.789644198259339e-06,2025-07-15 22:07:13.263121,2025-07-15 22:09:14.264204,0 days 00:02:01.001083,identity,16,126,0.00043660985482780454,18,COMPLETE
327,6.154822131065885e-06,2025-07-15 22:09:14.265173,2025-07-15 22:11:03.068909,0 days 00:01:48.803736,identity,16,118,0.000304624380777263,15,COMPLETE
328,0.001268149120733142,2025-07-15 22:11:03.069800,2025-07-15 22:12:22.643651,0 days 00:01:19.573851,identity,32,113,0.0003436884736176835,17,COMPLETE
329,8.117212928482331e-06,2025-07-15 22:12:22.644385,2025-07-15 22:14:20.085863,0 days 00:01:57.441478,identity,16,122,0.000497403553459655,18,COMPLETE
330,1.4330530575534794e-05,2025-07-15 22:14:20.086799,2025-07-15 22:16:05.858236,0 days 00:01:45.771437,identity,16,108,0.00028082989002215127,17,COMPLETE
331,9.422871698916424e-06,2025-07-15 22:16:05.859222,2025-07-15 22:17:54.048257,0 days 00:01:48.189035,identity,16,128,0.00040396194789777697,16,COMPLETE
332,7.395102329610381e-06,2025-07-15 22:17:54.049199,2025-07-15 22:19:44.913040,0 days 00:01:50.863841,identity,16,116,0.00036109966240782643,17,COMPLETE
333,1.316388487815857,2025-07-15 22:19:44.913822,2025-07-15 22:21:44.122452,0 days 00:01:59.208630,relu,16,120,0.00031612509099070716,18,COMPLETE
334,0.0005525886081159115,2025-07-15 22:21:44.123420,2025-07-15 22:22:34.876961,0 days 00:00:50.753541,identity,128,124,0.0002631332548947581,15,COMPLETE
335,7.634180292370729e-06,2025-07-15 22:22:34.877655,2025-07-15 22:24:16.340058,0 days 00:01:41.462403,identity,16,112,0.0004444109051704194,16,COMPLETE
336,1.012610755424248e-05,2025-07-15 22:24:16.340794,2025-07-15 22:26:05.295226,0 days 00:01:48.954432,identity,16,110,0.00022696269990850682,17,COMPLETE
337,5.59966701985104e-06,2025-07-15 22:26:05.296121,2025-07-15 22:28:07.988858,0 days 00:02:02.692737,identity,16,119,0.0003323918557472213,19,COMPLETE
338,4.655070824810537e-06,2025-07-15 22:28:07.989860,2025-07-15 22:30:02.146304,0 days 00:01:54.156444,identity,16,114,0.00037846540816988095,18,COMPLETE
339,7.350843134190654e-06,2025-07-15 22:30:02.147325,2025-07-15 22:31:59.357823,0 days 00:01:57.210498,identity,16,114,0.0003867929752948543,19,COMPLETE
340,8.571159014536534e-06,2025-07-15 22:31:59.358837,2025-07-15 22:33:46.024623,0 days 00:01:46.665786,identity,16,106,0.000418020352923676,18,COMPLETE
341,1.4440907762036659e-05,2025-07-15 22:33:46.025659,2025-07-15 22:35:00.259118,0 days 00:01:14.233459,identity,16,94,0.0004849506591962203,7,COMPLETE
342,1.2767176485795062e-05,2025-07-15 22:35:00.259654,2025-07-15 22:36:32.492980,0 days 00:01:32.233326,identity,16,76,0.00037377037974500426,18,COMPLETE
343,9.126682016358245e-06,2025-07-15 22:36:32.493720,2025-07-15 22:38:24.140945,0 days 00:01:51.647225,identity,16,109,0.00044788551830387315,18,COMPLETE
344,0.00036853388883173466,2025-07-15 22:38:24.141751,2025-07-15 22:39:27.236415,0 days 00:01:03.094664,identity,64,114,0.000348523411980419,19,COMPLETE
345,5.058507667854428e-06,2025-07-15 22:39:27.237093,2025-07-15 22:41:14.484582,0 days 00:01:47.247489,identity,16,116,0.0005302957418737447,16,COMPLETE
346,7.112781531759538e-06,2025-07-15 22:41:14.485609,2025-07-15 22:42:58.104024,0 days 00:01:43.618415,identity,16,112,0.0004099118879250963,17,COMPLETE
347,5.119655270391377e-06,2025-07-15 22:42:58.104832,2025-07-15 22:44:51.834327,0 days 00:01:53.729495,identity,16,111,0.00037104696623310864,18,COMPLETE
348,1.5295630873879418e-05,2025-07-15 22:44:51.835368,2025-07-15 22:46:39.402676,0 days 00:01:47.567308,identity,16,116,0.00030762324431362123,16,COMPLETE
349,5.178002538741566e-06,2025-07-15 22:46:39.403636,2025-07-15 22:48:30.433929,0 days 00:01:51.030293,identity,16,107,0.0004819505564522983,19,COMPLETE
350,1.3015946024097502e-05,2025-07-15 22:48:30.434694,2025-07-15 22:50:24.846881,0 days 00:01:54.412187,identity,16,118,0.0004244267603840866,17,COMPLETE
351,3.50389200320933e-05,2025-07-15 22:50:24.847793,2025-07-15 22:52:25.989107,0 days 00:02:01.141314,identity,16,126,0.005927060183615508,18,COMPLETE
352,8.78578211995773e-05,2025-07-15 22:52:25.990009,2025-07-15 22:54:12.233441,0 days 00:01:46.243432,relu,16,103,0.00011059652718004049,17,COMPLETE
353,6.1414525589498226e-06,2025-07-15 22:54:12.234206,2025-07-15 22:56:10.867862,0 days 00:01:58.633656,identity,16,123,0.00033037633285427556,18,COMPLETE
354,0.0007913397275842726,2025-07-15 22:56:10.868847,2025-07-15 22:57:24.256835,0 days 00:01:13.387988,identity,32,114,0.0003825628630763927,16,COMPLETE
355,0.0025482058990746737,2025-07-15 22:57:24.257809,2025-07-15 22:58:22.008560,0 days 00:00:57.750751,identity,16,20,0.00030273989823938733,17,COMPLETE
356,8.931327101890929e-06,2025-07-15 22:58:22.009129,2025-07-15 23:00:13.450443,0 days 00:01:51.441314,identity,16,109,0.0003494217862603067,17,COMPLETE
357,5.30180932400981e-06,2025-07-15 23:00:13.457820,2025-07-15 23:01:58.863587,0 days 00:01:45.405767,identity,16,120,0.00044299979886238555,15,COMPLETE
358,7.775929589115549e-06,2025-07-15 23:01:58.864537,2025-07-15 23:03:40.489573,0 days 00:01:41.625036,identity,16,112,0.0005305034219403705,16,COMPLETE
359,0.0010061267530545592,2025-07-15 23:03:40.490559,2025-07-15 23:04:42.878561,0 days 00:01:02.388002,identity,128,117,0.00028035452059014577,17,COMPLETE
360,1.2707151654467452e-05,2025-07-15 23:04:42.879249,2025-07-15 23:06:44.685460,0 days 00:02:01.806211,identity,16,126,0.00039500540680720135,18,COMPLETE
361,2.4764707632130012e-05,2025-07-15 23:06:44.686255,2025-07-15 23:08:12.931977,0 days 00:01:28.245722,identity,16,122,0.0003334125038281855,8,COMPLETE
362,5.088329089630861e-06,2025-07-15 23:08:12.933155,2025-07-15 23:10:01.376741,0 days 00:01:48.443586,identity,16,115,0.0004725949529122066,16,COMPLETE
363,9.863706509349868e-06,2025-07-15 23:10:01.377497,2025-07-15 23:12:14.620304,0 days 00:02:13.242807,identity,16,124,0.0002457326551297286,22,COMPLETE
364,5.852985395904398e-06,2025-07-15 23:12:14.621337,2025-07-15 23:14:07.780925,0 days 00:01:53.159588,identity,16,128,0.00030303107227199307,17,COMPLETE
365,4.047145466756774e-06,2025-07-15 23:14:07.781947,2025-07-15 23:15:54.512240,0 days 00:01:46.730293,identity,16,105,0.0003603464288138826,18,COMPLETE
366,6.0240286074986216e-06,2025-07-15 23:15:54.513277,2025-07-15 23:17:43.263688,0 days 00:01:48.750411,identity,16,101,0.00032971807227702427,18,COMPLETE
367,1.2798551324522123e-05,2025-07-15 23:17:43.264740,2025-07-15 23:19:33.774161,0 days 00:01:50.509421,identity,16,106,0.00035686125957676897,19,COMPLETE
368,1.5476998669328168e-05,2025-07-15 23:19:33.774974,2025-07-15 23:21:20.793978,0 days 00:01:47.019004,identity,16,105,0.0002688359061542327,18,COMPLETE
369,0.000680090335663408,2025-07-15 23:21:20.794971,2025-07-15 23:21:58.878314,0 days 00:00:38.083343,identity,64,57,0.00036325319469311066,19,COMPLETE
370,8.29839518701192e-06,2025-07-15 23:21:58.878885,2025-07-15 23:23:57.251461,0 days 00:01:58.372576,identity,16,119,0.0002968662540674465,18,COMPLETE
371,0.00025148893473669887,2025-07-15 23:23:57.252407,2025-07-15 23:25:55.696055,0 days 00:01:58.443648,relu,16,122,0.00014954543707283106,18,COMPLETE
372,1.0750507499324158e-05,2025-07-15 23:25:55.697031,2025-07-15 23:27:59.699009,0 days 00:02:04.001978,identity,16,124,0.0003892776963557898,19,COMPLETE
373,4.287567662686342e-06,2025-07-15 23:27:59.699978,2025-07-15 23:29:51.695878,0 days 00:01:51.995900,identity,16,120,0.00031886900930869764,17,COMPLETE
374,8.685447028256021e-06,2025-07-15 23:29:51.696792,2025-07-15 23:31:47.500653,0 days 00:01:55.803861,identity,16,120,0.00026185068443043555,18,COMPLETE
375,5.639182290906319e-06,2025-07-15 23:31:47.501539,2025-07-15 23:33:41.231701,0 days 00:01:53.730162,identity,16,98,0.00040776427038801154,21,COMPLETE
376,5.5580232583452016e-05,2025-07-15 23:33:41.232668,2025-07-15 23:35:36.291531,0 days 00:01:55.058863,identity,16,118,0.00020486838935321086,17,COMPLETE
377,1.3040885278314818e-05,2025-07-15 23:35:36.292570,2025-07-15 23:37:37.883744,0 days 00:02:01.591174,identity,16,121,0.00029516758349328254,19,COMPLETE
378,0.0008821162628009915,2025-07-15 23:37:37.884759,2025-07-15 23:38:58.702032,0 days 00:01:20.817273,identity,32,125,0.00035235349928915724,17,COMPLETE
379,8.178194548236206e-06,2025-07-15 23:38:58.702773,2025-07-15 23:40:55.515238,0 days 00:01:56.812465,identity,16,117,0.00032400881694967564,18,COMPLETE
380,2.7562804461922497e-05,2025-07-15 23:40:55.516181,2025-07-15 23:42:17.400603,0 days 00:01:21.884422,identity,16,122,0.00043255138499339094,6,COMPLETE
381,5.462833087221952e-06,2025-07-15 23:42:17.401157,2025-07-15 23:44:11.873167,0 days 00:01:54.472010,identity,16,119,0.000372918485664644,17,COMPLETE
382,4.1609822801547125e-05,2025-07-15 23:44:11.874129,2025-07-15 23:45:51.257400,0 days 00:01:39.383271,identity,16,124,0.0002808189909699748,11,COMPLETE
383,2.328471418877598e-05,2025-07-15 23:45:51.258258,2025-07-15 23:47:47.031706,0 days 00:01:55.773448,identity,16,128,0.0002424979386987162,18,COMPLETE
384,8.515065928804688e-06,2025-07-15 23:47:47.032508,2025-07-15 23:49:19.970351,0 days 00:01:32.937843,identity,16,67,0.0003135365764576176,20,COMPLETE
385,2.0389052224345505e-05,2025-07-15 23:49:19.971122,2025-07-15 23:51:11.853849,0 days 00:01:51.882727,identity,16,116,0.0024518959614401497,17,COMPLETE
386,0.0005104414303787053,2025-07-15 23:51:11.854750,2025-07-15 23:52:15.283627,0 days 00:01:03.428877,identity,128,120,0.0004077003444437314,17,COMPLETE
387,5.1372712732700165e-06,2025-07-15 23:52:15.284275,2025-07-15 23:54:13.787576,0 days 00:01:58.503301,identity,16,122,0.00034495219474328556,18,COMPLETE
388,5.614926521957386e-06,2025-07-15 23:54:13.788664,2025-07-15 23:56:12.044765,0 days 00:01:58.256101,identity,16,113,0.0005682715525231787,19,COMPLETE
389,4.282876034267247e-06,2025-07-15 23:56:12.045564,2025-07-15 23:58:10.750047,0 days 00:01:58.704483,identity,16,126,0.00048705235154896173,17,COMPLETE
390,5.941188646829687e-06,2025-07-15 23:58:10.750982,2025-07-16 00:00:09.688082,0 days 00:01:58.937100,identity,16,126,0.00048231266981596207,17,COMPLETE
391,1.3165440559387207,2025-07-16 00:00:09.689072,2025-07-16 00:02:15.865303,0 days 00:02:06.176231,relu,16,126,0.00028528543244601143,17,COMPLETE
392,4.237057964928681e-06,2025-07-16 00:02:15.866300,2025-07-16 00:04:09.559308,0 days 00:01:53.693008,identity,16,124,0.0003772388626146923,16,COMPLETE
393,1.4275704415922519e-05,2025-07-16 00:04:09.560232,2025-07-16 00:05:23.227604,0 days 00:01:13.667372,identity,16,50,0.00383993277470304,16,COMPLETE
394,0.0007886815583333373,2025-07-16 00:05:23.228230,2025-07-16 00:06:25.540238,0 days 00:01:02.312008,identity,64,126,0.00032653746951271756,16,COMPLETE
395,7.4144272730336525e-06,2025-07-16 00:06:25.540951,2025-07-16 00:08:18.722403,0 days 00:01:53.181452,identity,16,124,0.00026647376510022713,16,COMPLETE
396,5.057260750618298e-06,2025-07-16 00:08:18.723208,2025-07-16 00:10:04.857632,0 days 00:01:46.134424,identity,16,128,0.00036818932182432597,15,COMPLETE
397,3.7082125345477834e-05,2025-07-16 00:10:04.858622,2025-07-16 00:12:00.709159,0 days 00:01:55.850537,identity,16,123,0.00018485421653272158,17,COMPLETE
398,0.0006534456042572856,2025-07-16 00:12:00.709929,2025-07-16 00:13:11.741318,0 days 00:01:11.031389,identity,16,38,0.0003009297637416423,15,COMPLETE
399,1.1440037269494496e-05,2025-07-16 00:13:11.742300,2025-07-16 00:15:04.357997,0 days 00:01:52.615697,identity,16,124,0.00023040876011947928,16,COMPLETE
400,4.814757630811073e-06,2025-07-16 00:15:04.359059,2025-07-16 00:16:59.768457,0 days 00:01:55.409398,identity,16,121,0.00044487274888693653,17,COMPLETE
401,6.661836778221186e-06,2025-07-16 00:16:59.769463,2025-07-16 00:18:48.551938,0 days 00:01:48.782475,identity,16,128,0.00033998994187384304,16,COMPLETE
402,5.508419690158917e-06,2025-07-16 00:18:48.552947,2025-07-16 00:20:47.441107,0 days 00:01:58.888160,identity,16,126,0.0003858613794980935,17,COMPLETE
403,0.00016909684927668422,2025-07-16 00:20:47.442031,2025-07-16 00:22:04.692664,0 days 00:01:17.250633,identity,32,122,0.00025355240410323654,16,COMPLETE
404,4.9648783715383615e-06,2025-07-16 00:22:04.693435,2025-07-16 00:24:02.551339,0 days 00:01:57.857904,identity,16,124,0.00030882747986043683,17,COMPLETE
405,5.222314030106645e-06,2025-07-16 00:24:02.552360,2025-07-16 00:26:01.376914,0 days 00:01:58.824554,identity,16,119,0.00035883043608726263,18,COMPLETE
406,1.0693626791180577e-05,2025-07-16 00:26:01.377669,2025-07-16 00:27:40.120794,0 days 00:01:38.743125,identity,16,121,0.0005232883181098548,12,COMPLETE
407,6.362087333400268e-06,2025-07-16 00:27:40.121840,2025-07-16 00:29:39.317045,0 days 00:01:59.195205,identity,16,125,0.000426338703103356,17,COMPLETE
408,5.006861101719551e-06,2025-07-16 00:29:39.317856,2025-07-16 00:31:38.948010,0 days 00:01:59.630154,identity,16,118,0.00028338513421076434,18,COMPLETE
409,0.0003813041257672012,2025-07-16 00:31:38.949119,2025-07-16 00:32:26.242914,0 days 00:00:47.293795,identity,128,123,0.0003291705814677667,14,COMPLETE
410,5.6851185945561156e-06,2025-07-16 00:32:26.243432,2025-07-16 00:34:15.777568,0 days 00:01:49.534136,identity,16,120,0.00047871206632096283,16,COMPLETE
411,4.666476797865471e-06,2025-07-16 00:34:15.778543,2025-07-16 00:36:15.188875,0 days 00:01:59.410332,relu,16,126,0.00038585374065659277,17,COMPLETE
412,7.053573881421471e-06,2025-07-16 00:36:15.189668,2025-07-16 00:38:15.806364,0 days 00:02:00.616696,relu,16,127,0.00038067493386642316,17,COMPLETE
413,1.3186047077178955,2025-07-16 00:38:15.807465,2025-07-16 00:39:59.847732,0 days 00:01:44.040267,relu,16,126,0.0003115103282369439,10,COMPLETE
414,1.3167331218719482,2025-07-16 00:39:59.848670,2025-07-16 00:42:00.873200,0 days 00:02:01.024530,relu,16,124,0.00036051651599788853,16,COMPLETE
415,1.3165440559387207,2025-07-16 00:42:00.874256,2025-07-16 00:44:01.622269,0 days 00:02:00.748013,relu,16,128,0.00026107574673192184,17,COMPLETE
416,1.3167331218719482,2025-07-16 00:44:01.623297,2025-07-16 00:45:58.338253,0 days 00:01:56.714956,relu,16,122,0.00040135420157099246,16,COMPLETE
417,1.3165440559387207,2025-07-16 00:45:58.339298,2025-07-16 00:48:04.263385,0 days 00:02:05.924087,relu,16,125,0.0012792349595420194,17,COMPLETE
418,1.3165440559387207,2025-07-16 00:48:04.264456,2025-07-16 00:50:07.167209,0 days 00:02:02.902753,relu,16,123,0.0003339299095533181,17,COMPLETE
419,0.0011522294953465462,2025-07-16 00:50:07.168232,2025-07-16 00:51:07.889815,0 days 00:01:00.721583,relu,64,121,0.0002828718698449317,17,COMPLETE
420,8.839037764118984e-05,2025-07-16 00:51:07.890539,2025-07-16 00:53:03.959987,0 days 00:01:56.069448,relu,16,126,0.00022030105298673043,16,COMPLETE
421,4.965829702996416e-06,2025-07-16 00:53:03.960906,2025-07-16 00:54:52.217856,0 days 00:01:48.256950,identity,16,118,0.0003039130141734779,15,COMPLETE
422,8.218590664910153e-06,2025-07-16 00:54:52.218833,2025-07-16 00:56:47.969354,0 days 00:01:55.750521,identity,16,122,0.0003492855274366027,17,COMPLETE
423,7.16861632099608e-06,2025-07-16 00:56:47.970377,2025-07-16 00:58:37.012647,0 days 00:01:49.042270,identity,16,128,0.00040817985425074696,16,COMPLETE
424,4.814733074454125e-06,2025-07-16 00:58:37.013635,2025-07-16 01:00:32.318194,0 days 00:01:55.304559,identity,16,119,0.00037698578761685193,17,COMPLETE
425,6.894114449096378e-06,2025-07-16 01:00:32.319272,2025-07-16 01:02:32.776721,0 days 00:02:00.457449,identity,16,124,0.0003264358694477268,18,COMPLETE
426,5.965701348031871e-06,2025-07-16 01:02:32.777860,2025-07-16 01:04:26.970780,0 days 00:01:54.192920,identity,16,117,0.0002496065908301895,17,COMPLETE
427,5.38787389814388e-06,2025-07-16 01:04:26.971788,2025-07-16 01:06:25.875406,0 days 00:01:58.903618,identity,16,121,0.00028802908641425957,18,COMPLETE
