number,value,datetime_start,datetime_complete,duration,params_activation,params_batch_size,params_h,params_lr,params_seq_length,state
428,6.963444775465177e-06,2025-07-16 01:06:25.876349,2025-07-16 01:08:24.620460,0 days 00:01:58.744111,identity,16,125,0.00045374728855162373,17,COMPLETE
429,6.657695394096663e-06,2025-07-16 01:08:24.621547,2025-07-16 01:10:13.466734,0 days 00:01:48.845187,identity,16,120,0.0003535484944070729,16,COMPLETE
430,0.0012430145870894194,2025-07-16 01:10:13.467818,2025-07-16 01:11:30.322284,0 days 00:01:16.854466,identity,32,116,0.0002708132913089368,17,COMPLETE
431,5.426657025964232e-06,2025-07-16 01:11:30.322887,2025-07-16 01:13:22.817691,0 days 00:01:52.494804,identity,16,123,0.0004113558363798987,16,COMPLETE
432,5.3249605116434395e-06,2025-07-16 01:13:22.818822,2025-07-16 01:15:18.944062,0 days 00:01:56.125240,identity,16,128,0.0003130583999531112,18,COMPLETE
433,1.7958966054720804e-05,2025-07-16 01:15:18.945173,2025-07-16 01:17:03.495301,0 days 00:01:44.550128,identity,16,126,0.00325918036656309,13,COMPLETE
434,6.796112302254187e-06,2025-07-16 01:17:03.496140,2025-07-16 01:18:58.930431,0 days 00:01:55.434291,relu,16,118,0.00038989683750677393,17,COMPLETE
435,8.317106221511494e-06,2025-07-16 01:18:58.931408,2025-07-16 01:20:59.113404,0 days 00:02:00.181996,identity,16,123,0.0004971073130615151,18,COMPLETE
436,0.00031863199546933174,2025-07-16 01:20:59.114410,2025-07-16 01:21:45.306965,0 days 00:00:46.192555,identity,128,115,0.00034107302413440574,15,COMPLETE
437,1.1015686141035985e-05,2025-07-16 01:21:45.307556,2025-07-16 01:23:34.630145,0 days 00:01:49.322589,identity,16,120,0.00029816095609474613,16,COMPLETE
438,2.007377042900771e-05,2025-07-16 01:23:34.631136,2025-07-16 01:25:34.646982,0 days 00:02:00.015846,identity,16,125,0.000235800894192312,17,COMPLETE
439,5.526975655811839e-06,2025-07-16 01:25:34.648032,2025-07-16 01:27:26.820339,0 days 00:01:52.172307,identity,16,122,0.00042299885157045765,16,COMPLETE
440,4.201229330647038e-06,2025-07-16 01:27:26.821370,2025-07-16 01:29:19.008980,0 days 00:01:52.187610,identity,16,114,0.00037506131229529167,17,COMPLETE
441,5.784489530924475e-06,2025-07-16 01:29:19.010045,2025-07-16 01:31:11.950139,0 days 00:01:52.940094,identity,16,113,0.000269279577194584,18,COMPLETE
442,7.227443347801454e-06,2025-07-16 01:31:11.951187,2025-07-16 01:33:00.650049,0 days 00:01:48.698862,identity,16,114,0.00031547519022761487,16,COMPLETE
443,6.387661869666772e-06,2025-07-16 01:33:00.651007,2025-07-16 01:34:54.715659,0 days 00:01:54.064652,identity,16,118,0.00035142632147703494,17,COMPLETE
444,0.0009736675419844687,2025-07-16 01:34:54.716734,2025-07-16 01:35:48.832354,0 days 00:00:54.115620,identity,64,115,0.0002892487033894821,15,COMPLETE
445,1.3996698726259638e-05,2025-07-16 01:35:48.832925,2025-07-16 01:37:43.343226,0 days 00:01:54.510301,identity,16,111,0.0004481735706047256,18,COMPLETE
446,7.483704393962398e-06,2025-07-16 01:37:43.344223,2025-07-16 01:39:35.437267,0 days 00:01:52.093044,identity,16,117,0.00032675794292181653,17,COMPLETE
447,5.722638888983056e-06,2025-07-16 01:39:35.438345,2025-07-16 01:41:24.165976,0 days 00:01:48.727631,identity,16,114,0.0003810013888036086,16,COMPLETE
448,5.4622391871816944e-06,2025-07-16 01:41:24.166806,2025-07-16 01:43:15.653906,0 days 00:01:51.487100,identity,16,120,0.0002605877895900779,17,COMPLETE
449,5.089324531581951e-06,2025-07-16 01:43:15.654926,2025-07-16 01:45:12.029188,0 days 00:01:56.374262,identity,16,116,0.00035987687571027835,18,COMPLETE
450,5.649130343954312e-06,2025-07-16 01:45:12.030471,2025-07-16 01:47:01.577668,0 days 00:01:49.547197,identity,16,110,0.0005323073355826395,17,COMPLETE
451,4.0662130231794436e-06,2025-07-16 01:47:01.578676,2025-07-16 01:48:54.068429,0 days 00:01:52.489753,identity,16,117,0.00030130010835723996,17,COMPLETE
452,0.0025155062321573496,2025-07-16 01:48:54.069478,2025-07-16 01:49:42.658985,0 days 00:00:48.589507,identity,32,64,0.0002909781867011278,16,COMPLETE
453,2.0361849237815477e-05,2025-07-16 01:49:42.659603,2025-07-16 01:51:35.164489,0 days 00:01:52.504886,identity,16,119,0.00024822587621716846,16,COMPLETE
454,6.1773484958393965e-06,2025-07-16 01:51:35.165554,2025-07-16 01:53:31.453145,0 days 00:01:56.287591,identity,16,121,0.0002710315578842983,17,COMPLETE
455,5.32818739884533e-06,2025-07-16 01:53:31.454218,2025-07-16 01:55:24.979607,0 days 00:01:53.525389,identity,16,117,0.0003162598957236424,17,COMPLETE
456,6.417757049348438e-06,2025-07-16 01:55:24.980461,2025-07-16 01:57:17.677512,0 days 00:01:52.697051,identity,16,123,0.0002936616017088372,16,COMPLETE
457,1.670614983595442e-05,2025-07-16 01:57:17.678538,2025-07-16 01:59:12.797818,0 days 00:01:55.119280,identity,16,119,0.00023716841012543261,17,COMPLETE
458,5.156819952389924e-06,2025-07-16 01:59:12.798897,2025-07-16 02:01:09.103564,0 days 00:01:56.304667,identity,16,121,0.0003279751576513989,17,COMPLETE
459,0.0011382410302758217,2025-07-16 02:01:09.104640,2025-07-16 02:01:59.573222,0 days 00:00:50.468582,identity,128,117,0.00021806989487455563,16,COMPLETE
460,1.5108994375623297e-05,2025-07-16 02:01:59.573803,2025-07-16 02:03:55.791080,0 days 00:01:56.217277,identity,16,123,0.0002776799837099356,17,COMPLETE
461,4.352547421149211e-06,2025-07-16 02:03:55.792055,2025-07-16 02:05:37.875383,0 days 00:01:42.083328,identity,16,112,0.00032246181403556017,16,COMPLETE
462,9.438888810109347e-06,2025-07-16 02:05:37.876536,2025-07-16 02:07:17.367496,0 days 00:01:39.490960,identity,16,112,0.00033232934508660336,15,COMPLETE
463,8.330789569299668e-06,2025-07-16 02:07:17.368536,2025-07-16 02:09:01.933639,0 days 00:01:44.565103,identity,16,108,0.00035246554716565084,16,COMPLETE
464,7.398202797048725e-06,2025-07-16 02:09:01.934698,2025-07-16 02:10:46.526312,0 days 00:01:44.591614,identity,16,113,0.0004698947737959745,15,COMPLETE
465,5.08052107761614e-06,2025-07-16 02:10:46.527268,2025-07-16 02:12:28.314223,0 days 00:01:41.786955,identity,16,112,0.0003024530555376692,16,COMPLETE
466,8.915849321056157e-06,2025-07-16 02:12:28.315152,2025-07-16 02:14:12.550892,0 days 00:01:44.235740,identity,16,108,0.0004077429106785513,16,COMPLETE
467,9.755828068591654e-05,2025-07-16 02:14:12.551926,2025-07-16 02:15:57.088645,0 days 00:01:44.536719,identity,16,110,0.008036037007923972,15,COMPLETE
468,1.7486459910287522e-05,2025-07-16 02:15:57.089696,2025-07-16 02:17:46.416322,0 days 00:01:49.326626,identity,16,115,0.00031975813101133374,16,COMPLETE
469,0.0008250830578617752,2025-07-16 02:17:46.417168,2025-07-16 02:18:40.078399,0 days 00:00:53.661231,identity,64,117,0.0003676050492935125,14,COMPLETE
470,8.514591172570363e-06,2025-07-16 02:18:40.079179,2025-07-16 02:20:08.715142,0 days 00:01:28.635963,identity,16,74,0.000430582366317044,17,COMPLETE
471,7.5749803727376275e-06,2025-07-16 02:20:08.715789,2025-07-16 02:22:00.465454,0 days 00:01:51.749665,identity,16,114,0.00034158975328285097,17,COMPLETE
472,0.00017789032426662743,2025-07-16 02:22:00.466526,2025-07-16 02:23:09.802758,0 days 00:01:09.336232,identity,16,43,0.0003007228361711781,16,COMPLETE
473,4.678260665968992e-06,2025-07-16 02:23:09.803370,2025-07-16 02:25:02.070856,0 days 00:01:52.267486,identity,16,110,0.0004787537145598265,18,COMPLETE
474,6.854520052002044e-06,2025-07-16 02:25:02.071879,2025-07-16 02:26:54.273543,0 days 00:01:52.201664,identity,16,120,0.0003800467762202317,17,COMPLETE
475,7.566698968730634e-06,2025-07-16 02:26:54.274603,2025-07-16 02:28:43.538598,0 days 00:01:49.263995,identity,16,116,0.00031611258484257315,16,COMPLETE
476,5.55994620299316e-06,2025-07-16 02:28:43.539383,2025-07-16 02:30:28.678916,0 days 00:01:45.139533,identity,16,112,0.0003488358979604383,17,COMPLETE
477,5.315225735103013e-06,2025-07-16 02:30:28.679994,2025-07-16 02:32:12.724748,0 days 00:01:44.044754,identity,16,107,0.0004072349183948473,16,COMPLETE
478,4.350423751020571e-06,2025-07-16 02:32:12.725840,2025-07-16 02:34:29.670809,0 days 00:02:16.944969,identity,16,125,0.00029133736254618894,22,COMPLETE
479,0.0006643972592428327,2025-07-16 02:34:29.671881,2025-07-16 02:36:05.234529,0 days 00:01:35.562648,identity,32,125,0.00026065454045135725,22,COMPLETE
480,7.450995326507837e-06,2025-07-16 02:36:05.235597,2025-07-16 02:38:19.967377,0 days 00:02:14.731780,identity,16,126,0.0002814162976843141,22,COMPLETE
481,5.04974650539225e-06,2025-07-16 02:38:19.968471,2025-07-16 02:40:32.676279,0 days 00:02:12.707808,identity,16,128,0.00030280534534320186,23,COMPLETE
482,1.642539973545354e-05,2025-07-16 02:40:32.677391,2025-07-16 02:42:41.850371,0 days 00:02:09.172980,identity,16,125,0.0002482927851004984,17,COMPLETE
483,5.151712230144767e-06,2025-07-16 02:42:41.851441,2025-07-16 02:44:38.279350,0 days 00:01:56.427909,identity,16,123,0.00028543720650943784,17,COMPLETE
484,0.0006899312720634043,2025-07-16 02:44:38.280375,2025-07-16 02:45:28.263603,0 days 00:00:49.983228,identity,128,128,0.000319888255228781,16,COMPLETE
485,1.1033031114493497e-05,2025-07-16 02:45:28.264369,2025-07-16 02:47:42.548516,0 days 00:02:14.284147,identity,16,121,0.0002689900328649763,23,COMPLETE
486,4.302505203668261e-06,2025-07-16 02:47:42.549596,2025-07-16 02:49:32.762848,0 days 00:01:50.213252,identity,16,119,0.0003319270728954982,15,COMPLETE
487,3.9730057324049994e-06,2025-07-16 02:49:32.763955,2025-07-16 02:51:22.118804,0 days 00:01:49.354849,identity,16,119,0.0003332175743547465,15,COMPLETE
488,5.034087735111825e-06,2025-07-16 02:51:22.119805,2025-07-16 02:53:07.539136,0 days 00:01:45.419331,identity,16,120,0.0003404933203867856,15,COMPLETE
489,1.2892376616946422e-05,2025-07-16 02:53:07.540162,2025-07-16 02:54:55.860731,0 days 00:01:48.320569,identity,16,118,0.00029189815473288256,15,COMPLETE
490,1.632907697057817e-05,2025-07-16 02:54:55.861768,2025-07-16 02:56:42.990059,0 days 00:01:47.128291,identity,16,124,0.00033831155218646197,14,COMPLETE
491,7.849806934245862e-06,2025-07-16 02:56:42.990903,2025-07-16 02:58:32.460018,0 days 00:01:49.469115,identity,16,119,0.0003038274806833986,15,COMPLETE
492,1.0426831067888997e-05,2025-07-16 02:58:32.461069,2025-07-16 03:00:18.008975,0 days 00:01:45.547906,identity,16,123,0.0014760491896475872,14,COMPLETE
493,0.000269995944108814,2025-07-16 03:00:18.010004,2025-07-16 03:01:14.554383,0 days 00:00:56.544379,identity,16,24,0.00034629207238412365,16,COMPLETE
494,1.4077058040129486e-05,2025-07-16 03:01:14.554991,2025-07-16 03:02:59.220361,0 days 00:01:44.665370,identity,16,118,0.0002573966168751202,14,COMPLETE
495,4.576030733005609e-06,2025-07-16 03:02:59.221408,2025-07-16 03:04:47.801696,0 days 00:01:48.580288,identity,16,122,0.00028888278722787595,15,COMPLETE
496,0.0007928021368570626,2025-07-16 03:04:47.802734,2025-07-16 03:05:44.293507,0 days 00:00:56.490773,identity,64,126,0.00036469842784659474,14,COMPLETE
497,1.0918181942543015e-05,2025-07-16 03:05:44.294300,2025-07-16 03:07:33.572192,0 days 00:01:49.277892,identity,16,119,0.0003145755885347874,15,COMPLETE
498,1.4172454029903747e-05,2025-07-16 03:07:33.573029,2025-07-16 03:09:23.214087,0 days 00:01:49.641058,identity,16,124,0.0002079371834262381,15,COMPLETE
499,1.1958286449953448e-05,2025-07-16 03:09:23.215187,2025-07-16 03:11:11.320715,0 days 00:01:48.105528,identity,16,121,0.00032765231726797567,15,COMPLETE
