number,value,datetime_start,datetime_complete,duration,params_activation,params_and_operator,params_lr,params_n_sets,params_seq_length,params_shape,state
278,8.167980013240594e-06,2025-07-15 03:49:29.048299,2025-07-15 03:51:05.074401,0 days 00:01:36.026102,identity,prod,0.0066396218183793175,8,15,bell,COMPLETE
279,3.650756298156921e-06,2025-07-15 03:51:05.075353,2025-07-15 03:52:46.573188,0 days 00:01:41.497835,identity,prod,0.007755740601742935,8,17,bell,COMPLETE
280,3.4311844956391724e-06,2025-07-15 03:52:46.574126,2025-07-15 03:54:22.685010,0 days 00:01:36.110884,identity,prod,0.008864810545066546,8,15,bell,COMPLETE
281,0.00042849467718042433,2025-07-15 03:54:22.685967,2025-07-15 03:55:37.278777,0 days 00:01:14.592810,identity,prod,0.00680033320528368,8,6,bell,COMPLETE
282,3.5746236335398862e-06,2025-07-15 03:55:37.279704,2025-07-15 03:57:40.279076,0 days 00:02:02.999372,identity,prod,0.008142389436717407,8,25,bell,COMPLETE
283,3.576877134037204e-06,2025-07-15 03:57:40.280013,2025-07-15 03:59:19.059499,0 days 00:01:38.779486,identity,prod,0.007456837545119429,8,16,bell,COMPLETE
284,3.7418237752717687e-06,2025-07-15 03:59:19.060425,2025-07-15 04:01:00.568524,0 days 00:01:41.508099,identity,prod,0.0063887984236918735,8,17,bell,COMPLETE
285,3.521411599649582e-06,2025-07-15 04:01:00.569471,2025-07-15 04:02:36.653903,0 days 00:01:36.084432,identity,prod,0.008704656099498224,8,15,bell,COMPLETE
286,0.0066764079965651035,2025-07-15 04:02:36.654840,2025-07-15 04:04:07.522481,0 days 00:01:30.867641,identity,prod,0.008494107121983634,8,15,sigmoid,COMPLETE
287,8.225000783568248e-06,2025-07-15 04:04:07.523432,2025-07-15 04:05:43.564131,0 days 00:01:36.040699,identity,prod,0.00702916327288397,8,15,bell,COMPLETE
288,4.048932623845758e-06,2025-07-15 04:05:43.565078,2025-07-15 04:07:22.329191,0 days 00:01:38.764113,identity,prod,0.008825757916015815,8,16,bell,COMPLETE
289,0.0001520871155662462,2025-07-15 04:07:22.330125,2025-07-15 04:08:58.742649,0 days 00:01:36.412524,relu,prod,0.005896409596125885,8,15,bell,COMPLETE
290,3.5666462281369604e-06,2025-07-15 04:08:58.743611,2025-07-15 04:10:33.308823,0 days 00:01:34.565212,identity,min,0.007939930027390574,8,15,bell,COMPLETE
291,5.717992098652758e-05,2025-07-15 04:10:33.309780,2025-07-15 04:12:07.897814,0 days 00:01:34.588034,identity,min,0.008960422310317413,8,15,bell,COMPLETE
292,4.18293711845763e-06,2025-07-15 04:12:07.898764,2025-07-15 04:13:42.539700,0 days 00:01:34.640936,identity,min,0.007982152431647639,8,15,bell,COMPLETE
293,0.00019643800624180585,2025-07-15 04:13:42.540671,2025-07-15 04:15:19.831915,0 days 00:01:37.291244,identity,min,0.00771122312523004,8,16,bell,COMPLETE
294,3.4566760405141395e-06,2025-07-15 04:15:19.832858,2025-07-15 04:16:46.920097,0 days 00:01:27.087239,identity,min,0.009402774933723147,8,11,bell,COMPLETE
295,3.932722847821424e-06,2025-07-15 04:16:46.921056,2025-07-15 04:18:14.046552,0 days 00:01:27.125496,identity,min,0.009799181787704695,8,11,bell,COMPLETE
296,7.788062794134021e-05,2025-07-15 04:18:14.047507,2025-07-15 04:19:41.203436,0 days 00:01:27.155929,identity,min,0.009153814687769792,8,11,bell,COMPLETE
297,3.860751348838676e-06,2025-07-15 04:19:41.204367,2025-07-15 04:21:08.296612,0 days 00:01:27.092245,identity,min,0.00838074413545144,8,11,bell,COMPLETE
298,3.830303285212722e-06,2025-07-15 04:21:08.297551,2025-07-15 04:22:33.611700,0 days 00:01:25.314149,identity,prod,0.009480616386633278,6,11,bell,COMPLETE
299,3.66802305507008e-06,2025-07-15 04:22:33.612620,2025-07-15 04:24:02.261435,0 days 00:01:28.648815,identity,prod,0.006086279267551949,8,11,bell,COMPLETE
300,4.331644959165715e-06,2025-07-15 04:24:02.262371,2025-07-15 04:25:28.608207,0 days 00:01:26.345836,relu,prod,0.007385834552588672,8,10,bell,COMPLETE
301,0.1968981921672821,2025-07-15 04:25:28.609146,2025-07-15 04:27:03.327891,0 days 00:01:34.718745,identity,prod,0.0015583153701359395,8,16,gaussian,COMPLETE
302,9.192514880851377e-06,2025-07-15 04:27:03.328828,2025-07-15 04:28:30.569269,0 days 00:01:27.240441,identity,prod,0.008804516760022979,7,12,bell,COMPLETE
303,4.929185251967283e-06,2025-07-15 04:28:30.570203,2025-07-15 04:30:09.325919,0 days 00:01:38.755716,identity,prod,0.0063368685744406,8,16,bell,COMPLETE
304,5.298298674460966e-06,2025-07-15 04:30:09.326879,2025-07-15 04:31:37.349550,0 days 00:01:28.022671,identity,prod,0.0056399435237226994,8,12,bell,COMPLETE
305,4.819895821128739e-06,2025-07-15 04:31:37.350507,2025-07-15 04:33:06.018670,0 days 00:01:28.668163,identity,prod,0.009935265420369188,8,11,bell,COMPLETE
306,5.102772774989717e-06,2025-07-15 04:33:06.019624,2025-07-15 04:34:46.071157,0 days 00:01:40.051533,identity,min,0.00713575784156764,8,17,bell,COMPLETE
307,0.006027740426361561,2025-07-15 04:34:46.072103,2025-07-15 04:36:19.429142,0 days 00:01:33.357039,identity,prod,0.0003631552018457742,8,14,bell,COMPLETE
308,6.3327747739094775e-06,2025-07-15 04:36:19.430052,2025-07-15 04:37:55.473388,0 days 00:01:36.043336,identity,prod,0.0065729323688689684,8,15,bell,COMPLETE
309,0.014597962610423565,2025-07-15 04:37:55.474329,2025-07-15 04:39:19.168905,0 days 00:01:23.694576,identity,prod,0.0002944409669623102,8,11,sigmoid,COMPLETE
310,2.79472405964043e-05,2025-07-15 04:39:19.169830,2025-07-15 04:40:58.070653,0 days 00:01:38.900823,identity,prod,0.005563761707442374,8,16,bell,COMPLETE
311,0.0012303210096433759,2025-07-15 04:40:58.071610,2025-07-15 04:42:33.726630,0 days 00:01:35.655020,identity,prod,0.0024720510197978303,7,15,bell,COMPLETE
312,0.00026800978230312467,2025-07-15 04:42:33.727583,2025-07-15 04:44:03.018368,0 days 00:01:29.290785,relu,prod,0.008497052309211009,8,11,bell,COMPLETE
313,0.04091006889939308,2025-07-15 04:44:03.019500,2025-07-15 04:45:29.005860,0 days 00:01:25.986360,identity,prod,0.0007085854419969839,8,10,bell,COMPLETE
314,5.596904884441756e-06,2025-07-15 04:45:29.006813,2025-07-15 04:47:10.634156,0 days 00:01:41.627343,identity,prod,0.007754468089256527,8,17,bell,COMPLETE
315,5.3686212595494e-06,2025-07-15 04:47:10.635108,2025-07-15 04:48:38.656939,0 days 00:01:28.021831,identity,prod,0.005111846077523662,8,12,bell,COMPLETE
316,5.045120360591682e-06,2025-07-15 04:48:38.657910,2025-07-15 04:50:15.969854,0 days 00:01:37.311944,identity,min,0.00893145702150472,8,16,bell,COMPLETE
317,4.200338480586652e-06,2025-07-15 04:50:15.970789,2025-07-15 04:51:43.942098,0 days 00:01:27.971309,identity,prod,0.006143821800689465,8,12,bell,COMPLETE
318,2.1554411432589404e-05,2025-07-15 04:51:43.943037,2025-07-15 04:53:12.014215,0 days 00:01:28.071178,identity,prod,0.006939283518642979,8,12,bell,COMPLETE
319,4.887809609499527e-06,2025-07-15 04:53:12.015197,2025-07-15 04:54:48.130396,0 days 00:01:36.115199,identity,prod,0.007496933419949036,8,15,bell,COMPLETE
320,3.908160579157993e-06,2025-07-15 04:54:48.131339,2025-07-15 04:56:16.870524,0 days 00:01:28.739185,identity,prod,0.005791023472391679,8,11,bell,COMPLETE
321,0.00025399684091098607,2025-07-15 04:56:16.871463,2025-07-15 04:57:50.325666,0 days 00:01:33.454203,identity,prod,0.008304870307285796,8,14,bell,COMPLETE
322,9.289279660151806e-06,2025-07-15 04:57:50.326608,2025-07-15 04:59:16.319593,0 days 00:01:25.992985,identity,prod,0.006643933236679753,8,10,bell,COMPLETE
323,4.321783308114391e-06,2025-07-15 04:59:16.320531,2025-07-15 05:01:07.147586,0 days 00:01:50.827055,relu,prod,0.009333010275208794,8,22,gaussian,COMPLETE
324,4.214467844576575e-05,2025-07-15 05:01:07.148530,2025-07-15 05:02:35.903277,0 days 00:01:28.754747,identity,prod,0.005386581990640592,8,11,bell,COMPLETE
325,3.7921809052932076e-06,2025-07-15 05:02:35.904239,2025-07-15 05:04:13.212165,0 days 00:01:37.307926,identity,min,0.007374664298925454,8,16,bell,COMPLETE
326,0.002387317596003413,2025-07-15 05:04:13.213148,2025-07-15 05:05:49.363262,0 days 00:01:36.150114,identity,prod,0.006452963739037203,8,15,bell,COMPLETE
327,4.210789938952075e-06,2025-07-15 05:05:49.364210,2025-07-15 05:07:25.515174,0 days 00:01:36.150964,identity,prod,0.00822486127833274,8,15,bell,COMPLETE
328,3.8034854696888942e-06,2025-07-15 05:07:25.516139,2025-07-15 05:09:07.616523,0 days 00:01:42.100384,identity,prod,0.005999337026669887,9,16,bell,COMPLETE
329,3.5386635772738373e-06,2025-07-15 05:09:07.617469,2025-07-15 05:10:41.040692,0 days 00:01:33.423223,identity,prod,0.00920891897850275,8,14,bell,COMPLETE
330,0.018164891749620438,2025-07-15 05:10:41.041638,2025-07-15 05:12:14.578134,0 days 00:01:33.536496,identity,prod,0.009893656609019403,8,14,bell,COMPLETE
331,6.347228008962702e-06,2025-07-15 05:12:14.579077,2025-07-15 05:13:48.018687,0 days 00:01:33.439610,identity,prod,0.008805632802559518,8,14,bell,COMPLETE
332,0.0029569556936621666,2025-07-15 05:13:48.019645,2025-07-15 05:15:16.339441,0 days 00:01:28.319796,identity,prod,0.009402871808387277,8,14,sigmoid,COMPLETE
333,4.172054104856215e-06,2025-07-15 05:15:16.340383,2025-07-15 05:16:45.546757,0 days 00:01:29.206374,identity,min,0.0052458425183879165,8,13,bell,COMPLETE
334,3.7396553125290666e-06,2025-07-15 05:16:45.547703,2025-07-15 05:18:16.228936,0 days 00:01:30.681233,identity,prod,0.008928122114581546,8,13,bell,COMPLETE
335,1.0198500156402588,2025-07-15 05:18:16.229880,2025-07-15 05:19:55.814639,0 days 00:01:39.584759,relu,prod,0.00684644011189362,9,15,bell,COMPLETE
336,3.6161693515168736e-06,2025-07-15 05:19:55.815585,2025-07-15 05:21:34.711850,0 days 00:01:38.896265,identity,prod,0.008006895924146004,8,16,bell,COMPLETE
337,4.1746770875761285e-06,2025-07-15 05:21:34.712837,2025-07-15 05:23:11.163688,0 days 00:01:36.450851,identity,prod,0.005794103230514067,9,14,bell,COMPLETE
338,4.790760158357443e-06,2025-07-15 05:23:11.164693,2025-07-15 05:24:52.795692,0 days 00:01:41.630999,identity,prod,0.009897177267070947,8,17,bell,COMPLETE
339,0.00012680098006967455,2025-07-15 05:24:52.796689,2025-07-15 05:26:29.110089,0 days 00:01:36.313400,identity,prod,0.004861908423382247,8,15,bell,COMPLETE
340,4.847311174671631e-06,2025-07-15 05:26:29.111079,2025-07-15 05:28:26.881172,0 days 00:01:57.770093,identity,prod,0.007134771922078149,8,23,bell,COMPLETE
341,0.0014898191438987851,2025-07-15 05:28:26.882140,2025-07-15 05:29:58.891751,0 days 00:01:32.009611,identity,min,0.008641790253482416,8,14,bell,COMPLETE
342,0.012529367581009865,2025-07-15 05:29:58.892700,2025-07-15 05:31:29.791093,0 days 00:01:30.898393,identity,prod,0.006536794819280645,9,12,bell,COMPLETE
343,5.175426394998794e-06,2025-07-15 05:31:29.792050,2025-07-15 05:33:05.964451,0 days 00:01:36.172401,identity,prod,0.007671933406407485,8,15,bell,COMPLETE
344,0.00018613760767038912,2025-07-15 05:33:05.965419,2025-07-15 05:34:36.694212,0 days 00:01:30.728793,identity,prod,0.006036422786988065,8,13,bell,COMPLETE
345,0.17814351618289948,2025-07-15 05:34:36.695188,2025-07-15 05:36:17.073275,0 days 00:01:40.378087,identity,prod,0.005455624996935239,9,17,gaussian,COMPLETE
346,4.189871560811298e-06,2025-07-15 05:36:17.074234,2025-07-15 05:37:53.578184,0 days 00:01:36.503950,relu,prod,0.009136569840735848,8,15,bell,COMPLETE
347,0.011132501065731049,2025-07-15 05:37:53.579169,2025-07-15 05:39:32.491532,0 days 00:01:38.912363,identity,prod,0.0008539200319930558,8,16,bell,COMPLETE
348,0.016667841002345085,2025-07-15 05:39:32.492545,2025-07-15 05:41:00.586986,0 days 00:01:28.094441,identity,prod,0.00011661308691578889,8,12,bell,COMPLETE
349,4.534608706308063e-06,2025-07-15 05:41:00.587946,2025-07-15 05:42:37.785651,0 days 00:01:37.197705,identity,min,0.008174152741069515,7,16,bell,COMPLETE
350,0.00032374446163885295,2025-07-15 05:42:37.786664,2025-07-15 05:44:08.706229,0 days 00:01:30.919565,identity,prod,0.007296675938668054,8,13,bell,COMPLETE
351,3.918215043086093e-06,2025-07-15 05:44:08.707214,2025-07-15 05:45:36.620533,0 days 00:01:27.913319,identity,prod,0.00409331777289494,5,14,bell,COMPLETE
352,0.00010320806177332997,2025-07-15 05:45:36.621501,2025-07-15 05:47:12.892716,0 days 00:01:36.271215,identity,prod,0.006464590846925386,8,15,bell,COMPLETE
353,4.157521743763937e-06,2025-07-15 05:47:12.893686,2025-07-15 05:48:43.754567,0 days 00:01:30.860881,identity,prod,0.007027879479928973,9,12,bell,COMPLETE
354,0.032151490449905396,2025-07-15 05:48:43.755563,2025-07-15 05:50:33.049538,0 days 00:01:49.293975,identity,prod,0.004986075698206207,8,22,sigmoid,COMPLETE
355,8.11197969596833e-06,2025-07-15 05:50:33.050532,2025-07-15 05:52:01.185862,0 days 00:01:28.135330,identity,prod,0.009911378119424087,8,12,bell,COMPLETE
356,4.354628799774218e-06,2025-07-15 05:52:01.186836,2025-07-15 05:53:34.874030,0 days 00:01:33.687194,identity,prod,0.005896750355837818,8,14,bell,COMPLETE
357,3.95885263060336e-06,2025-07-15 05:53:34.874977,2025-07-15 05:54:59.458770,0 days 00:01:24.583793,identity,min,0.00832404920447299,8,10,bell,COMPLETE
358,7.995413761818781e-05,2025-07-15 05:54:59.459727,2025-07-15 05:56:31.586250,0 days 00:01:32.126523,relu,prod,0.0011629967418105324,9,11,bell,COMPLETE
359,3.90845661968342e-06,2025-07-15 05:56:31.587211,2025-07-15 05:58:07.936678,0 days 00:01:36.349467,identity,prod,0.007773113225209913,8,15,bell,COMPLETE
360,3.161854328936897e-05,2025-07-15 05:58:07.937635,2025-07-15 05:59:46.439733,0 days 00:01:38.502098,identity,prod,0.00633393142529252,6,17,bell,COMPLETE
361,1.4124112567515112e-05,2025-07-15 05:59:46.440690,2025-07-15 06:01:25.531787,0 days 00:01:39.091097,identity,prod,0.009003005767412569,8,16,bell,COMPLETE
362,0.00013235713413450867,2025-07-15 06:01:25.532786,2025-07-15 06:03:23.338013,0 days 00:01:57.805227,identity,prod,0.005407047124215974,7,23,bell,COMPLETE
363,3.844007096631685e-06,2025-07-15 06:03:23.338992,2025-07-15 06:04:55.068400,0 days 00:01:31.729408,identity,prod,0.007063771902954216,9,11,bell,COMPLETE
364,4.434963557287119e-06,2025-07-15 06:04:55.069367,2025-07-15 06:06:33.995391,0 days 00:01:38.926024,identity,prod,0.007623259333287025,8,16,bell,COMPLETE
365,5.167784365767147e-06,2025-07-15 06:06:33.996361,2025-07-15 06:08:08.807563,0 days 00:01:34.811202,identity,min,0.008542017687586402,8,15,bell,COMPLETE
366,0.00030191088444553316,2025-07-15 06:08:08.808549,2025-07-15 06:09:42.301960,0 days 00:01:33.493411,identity,prod,0.005933179932311832,8,14,bell,COMPLETE
367,0.17019304633140564,2025-07-15 06:09:42.302937,2025-07-15 06:11:06.501602,0 days 00:01:24.198665,identity,prod,0.004632418827542919,8,12,gaussian,COMPLETE
368,0.10274848341941833,2025-07-15 06:11:06.502557,2025-07-15 06:12:37.274375,0 days 00:01:30.771818,identity,prod,0.0005420897260059748,8,13,bell,COMPLETE
369,0.005935932509601116,2025-07-15 06:12:37.275361,2025-07-15 06:14:22.833893,0 days 00:01:45.558532,relu,prod,0.006773045627319926,9,17,bell,COMPLETE
370,8.035327482502908e-06,2025-07-15 06:14:22.834882,2025-07-15 06:15:51.708922,0 days 00:01:28.874040,identity,prod,0.00896491386387132,8,11,bell,COMPLETE
371,1.9897392121492885e-05,2025-07-15 06:15:51.709893,2025-07-15 06:17:28.009353,0 days 00:01:36.299460,identity,prod,0.005424641387235266,8,15,bell,COMPLETE
372,1.0996044693456497e-05,2025-07-15 06:17:28.010369,2025-07-15 06:19:07.389747,0 days 00:01:39.379378,identity,prod,0.0029752798906483137,9,15,bell,COMPLETE
373,0.0007518324418924749,2025-07-15 06:19:07.390731,2025-07-15 06:20:36.828853,0 days 00:01:29.438122,identity,min,0.007504989324169356,8,13,bell,COMPLETE
374,2.457473055983428e-05,2025-07-15 06:20:36.829823,2025-07-15 06:22:26.693639,0 days 00:01:49.863816,identity,prod,0.006348579449166534,8,20,bell,COMPLETE
375,3.70375801139744e-06,2025-07-15 06:22:26.694637,2025-07-15 06:24:00.315311,0 days 00:01:33.620674,identity,prod,0.008211248517112284,8,14,bell,COMPLETE
376,1.4791441572015174e-05,2025-07-15 06:24:00.316300,2025-07-15 06:25:28.486022,0 days 00:01:28.169722,identity,prod,0.009464417875274335,8,12,bell,COMPLETE
377,0.01035173051059246,2025-07-15 06:25:28.487035,2025-07-15 06:26:49.700521,0 days 00:01:21.213486,identity,prod,0.006808939326512698,8,10,sigmoid,COMPLETE
378,3.709668590090587e-06,2025-07-15 06:26:49.701525,2025-07-15 06:28:21.431912,0 days 00:01:31.730387,identity,prod,0.005667835574936668,9,11,bell,COMPLETE
379,1.857489041867666e-05,2025-07-15 06:28:21.432929,2025-07-15 06:30:00.538920,0 days 00:01:39.105991,identity,prod,0.005067165803570671,8,16,bell,COMPLETE
380,0.00701918127015233,2025-07-15 06:30:00.539929,2025-07-15 06:31:31.914709,0 days 00:01:31.374780,relu,prod,0.009955841770718732,8,13,bell,COMPLETE
381,5.836587661178783e-06,2025-07-15 06:31:31.915689,2025-07-15 06:33:06.703410,0 days 00:01:34.787721,identity,min,0.0074699395727400066,8,15,bell,COMPLETE
382,0.0020904189441353083,2025-07-15 06:33:06.704397,2025-07-15 06:34:48.397656,0 days 00:01:41.693259,identity,prod,0.0059754535490193555,8,17,bell,COMPLETE
383,1.0111337360285688e-05,2025-07-15 06:34:48.398661,2025-07-15 06:36:27.387565,0 days 00:01:38.988904,identity,prod,0.008722864737635679,8,16,bell,COMPLETE
384,3.4893714655481745e-06,2025-07-15 06:36:27.388558,2025-07-15 06:38:15.248330,0 days 00:01:47.859772,identity,prod,0.006394440882085633,9,18,bell,COMPLETE
385,8.706789230927825e-06,2025-07-15 06:38:15.249311,2025-07-15 06:40:10.464916,0 days 00:01:55.215605,identity,prod,0.0065289044955367205,8,22,bell,COMPLETE
386,6.738064985256642e-05,2025-07-15 06:40:10.465910,2025-07-15 06:41:47.256088,0 days 00:01:36.790178,identity,prod,0.006196358707636171,9,14,bell,COMPLETE
387,3.7728350434917957e-06,2025-07-15 06:41:47.257079,2025-07-15 06:43:15.491611,0 days 00:01:28.234532,identity,prod,0.005492874244588303,8,12,bell,COMPLETE
388,0.13178154826164246,2025-07-15 06:43:15.492598,2025-07-15 06:45:00.084044,0 days 00:01:44.591446,identity,prod,0.006990617606192645,8,18,bell,COMPLETE
389,0.006424133200198412,2025-07-15 06:45:00.085033,2025-07-15 06:46:28.250849,0 days 00:01:28.165816,identity,prod,0.005056478897676411,8,12,bell,COMPLETE
390,2.9721455575781874e-05,2025-07-15 06:46:28.251844,2025-07-15 06:48:18.362144,0 days 00:01:50.110300,identity,min,0.004323860791388216,9,21,gaussian,COMPLETE
391,0.0029165418818593025,2025-07-15 06:48:18.363136,2025-07-15 06:49:47.216781,0 days 00:01:28.853645,identity,prod,0.0018616458378375128,8,11,bell,COMPLETE
392,3.80161850443983e-06,2025-07-15 06:49:47.217773,2025-07-15 06:51:31.715565,0 days 00:01:44.497792,identity,prod,0.006457169332322186,8,18,bell,COMPLETE
393,5.706975116481772e-06,2025-07-15 06:51:31.716570,2025-07-15 06:53:29.674293,0 days 00:01:57.957723,identity,prod,0.005714740545003605,8,23,bell,COMPLETE
394,1.4750689842912834e-05,2025-07-15 06:53:29.675291,2025-07-15 06:55:00.911811,0 days 00:01:31.236520,relu,prod,0.00710067250624902,8,13,bell,COMPLETE
395,8.126194188662339e-06,2025-07-15 06:55:00.912779,2025-07-15 06:56:36.677226,0 days 00:01:35.764447,identity,prod,0.006159413905225526,7,15,bell,COMPLETE
396,1.2922114365210291e-05,2025-07-15 06:56:36.678223,2025-07-15 06:58:30.104463,0 days 00:01:53.426240,identity,prod,0.007940675004274828,9,20,bell,COMPLETE
397,3.670638761832379e-06,2025-07-15 06:58:30.105469,2025-07-15 07:00:17.180251,0 days 00:01:47.074782,identity,prod,0.006812064453857371,8,19,bell,COMPLETE
398,2.5821869712672196e-05,2025-07-15 07:00:17.181258,2025-07-15 07:01:44.449144,0 days 00:01:27.267886,identity,min,0.004668851455930192,8,11,bell,COMPLETE
399,5.449054697237443e-06,2025-07-15 07:01:44.450184,2025-07-15 07:03:10.620184,0 days 00:01:26.170000,identity,prod,0.005825602571319661,8,10,bell,COMPLETE
400,3.5541868328436976e-06,2025-07-15 07:03:10.621202,2025-07-15 07:04:41.525715,0 days 00:01:30.904513,identity,prod,0.007526682009353467,9,12,bell,COMPLETE
401,0.03978568688035011,2025-07-15 07:04:41.526768,2025-07-15 07:06:09.868910,0 days 00:01:28.342142,identity,prod,0.005151212540275303,8,14,sigmoid,COMPLETE
402,7.774446203256957e-06,2025-07-15 07:06:09.869935,2025-07-15 07:07:43.626798,0 days 00:01:33.756863,identity,prod,0.006344926868470917,8,14,bell,COMPLETE
403,3.82269490728504e-06,2025-07-15 07:07:43.627814,2025-07-15 07:09:12.722681,0 days 00:01:29.094867,identity,prod,0.008045117517460449,8,11,bell,COMPLETE
404,3.5213963656133274e-06,2025-07-15 07:09:12.723676,2025-07-15 07:10:49.337994,0 days 00:01:36.614318,relu,prod,0.0070937466779182,8,15,bell,COMPLETE
405,0.03676893562078476,2025-07-15 07:10:49.339049,2025-07-15 07:12:26.085105,0 days 00:01:36.746056,relu,prod,0.0072858894317385505,8,15,bell,COMPLETE
406,0.0044722482562065125,2025-07-15 07:12:26.086085,2025-07-15 07:14:05.956626,0 days 00:01:39.870541,relu,prod,0.009149148897722725,9,15,bell,COMPLETE
407,3.5771652164839907e-06,2025-07-15 07:14:05.957645,2025-07-15 07:15:41.120420,0 days 00:01:35.162775,relu,min,0.005492782306189041,8,15,bell,COMPLETE
408,0.00016133366443682462,2025-07-15 07:15:41.121448,2025-07-15 07:17:14.999249,0 days 00:01:33.877801,relu,prod,0.00797857649550196,8,14,bell,COMPLETE
409,1.933732164616231e-05,2025-07-15 07:17:15.000266,2025-07-15 07:19:10.520109,0 days 00:01:55.519843,relu,prod,0.006524341034726354,8,22,bell,COMPLETE
410,1.3169734477996826,2025-07-15 07:19:10.521142,2025-07-15 07:20:47.074615,0 days 00:01:36.553473,relu,prod,0.006059701140940946,8,15,bell,COMPLETE
411,0.014976691454648972,2025-07-15 07:20:47.075687,2025-07-15 07:22:20.315925,0 days 00:01:33.240238,relu,prod,0.008666226526327418,7,14,bell,COMPLETE
412,0.0005020120297558606,2025-07-15 07:22:20.316958,2025-07-15 07:24:00.136892,0 days 00:01:39.819934,relu,prod,0.007273068580314724,9,15,bell,COMPLETE
413,1.084929499484133e-05,2025-07-15 07:24:00.137913,2025-07-15 07:25:35.398929,0 days 00:01:35.261016,relu,prod,0.00681456780476147,8,16,gaussian,COMPLETE
414,5.306468665366992e-06,2025-07-15 07:25:35.400178,2025-07-15 07:27:19.868023,0 days 00:01:44.467845,identity,prod,0.005764578822684504,8,18,bell,COMPLETE
415,3.998917691205861e-06,2025-07-15 07:27:19.869048,2025-07-15 07:28:54.633650,0 days 00:01:34.764602,identity,min,0.009893629881049245,8,15,bell,COMPLETE
416,3.196491888957098e-05,2025-07-15 07:28:54.634678,2025-07-15 07:30:56.389248,0 days 00:02:01.754570,identity,prod,0.008115596867998228,9,23,bell,COMPLETE
