number,value,datetime_start,datetime_complete,duration,params_activation,params_and_operator,params_lr,params_n_sets,params_seq_length,params_shape,state
417,3.5410803320701234e-06,2025-07-15 07:30:56.390224,2025-07-15 07:32:35.396629,0 days 00:01:39.006405,identity,prod,0.009083730298589197,8,16,bell,COMPLETE
418,4.346309651737101e-06,2025-07-15 07:32:35.397647,2025-07-15 07:34:14.318346,0 days 00:01:38.920699,identity,prod,0.009035253043877717,8,16,bell,COMPLETE
419,3.7489048736460973e-06,2025-07-15 07:34:14.319337,2025-07-15 07:35:56.492053,0 days 00:01:42.172716,identity,prod,0.008663255623070831,9,16,bell,COMPLETE
420,3.6002584238303825e-06,2025-07-15 07:35:56.493100,2025-07-15 07:37:35.375166,0 days 00:01:38.882066,identity,prod,0.008066338691280333,8,16,bell,COMPLETE
421,3.773654952965444e-06,2025-07-15 07:37:35.376182,2025-07-15 07:39:14.644008,0 days 00:01:39.267826,relu,prod,0.009388726086988977,8,16,bell,COMPLETE
422,4.4898320084030274e-06,2025-07-15 07:39:14.645047,2025-07-15 07:41:15.151459,0 days 00:02:00.506412,identity,prod,0.009945325003182666,8,24,bell,COMPLETE
423,0.01773463562130928,2025-07-15 07:41:15.152470,2025-07-15 07:42:51.390805,0 days 00:01:36.238335,identity,prod,0.007371489481706073,8,17,sigmoid,COMPLETE
424,0.08268807083368301,2025-07-15 07:42:51.391804,2025-07-15 07:44:31.883223,0 days 00:01:40.491419,identity,min,0.008399676754320518,9,16,bell,COMPLETE
425,0.3634604215621948,2025-07-15 07:44:31.884268,2025-07-15 07:46:10.857062,0 days 00:01:38.972794,identity,prod,0.00016494765707370798,8,16,bell,COMPLETE
426,1.0797955837915652e-05,2025-07-15 07:46:10.858077,2025-07-15 07:48:03.377518,0 days 00:01:52.519441,identity,prod,0.007576795246904337,8,21,bell,COMPLETE
427,3.6889091461489443e-06,2025-07-15 07:48:03.378518,2025-07-15 07:49:39.809650,0 days 00:01:36.431132,identity,prod,0.00920184263813799,8,15,bell,COMPLETE
428,5.588027852354571e-05,2025-07-15 07:49:39.810677,2025-07-15 07:51:16.230106,0 days 00:01:36.419429,identity,prod,0.008368693460274024,8,15,bell,COMPLETE
429,6.547126304212725e-06,2025-07-15 07:51:16.231137,2025-07-15 07:53:03.466739,0 days 00:01:47.235602,identity,prod,0.0069247789787711435,8,19,bell,COMPLETE
430,1.3172639608383179,2025-07-15 07:53:03.467729,2025-07-15 07:54:37.309679,0 days 00:01:33.841950,relu,prod,0.007703370934623108,8,14,bell,COMPLETE
431,5.337405582395149e-06,2025-07-15 07:54:37.310739,2025-07-15 07:56:19.318174,0 days 00:01:42.007435,identity,prod,0.009113727039919318,8,17,bell,COMPLETE
432,3.8086513995949645e-06,2025-07-15 07:56:19.319233,2025-07-15 07:57:57.101554,0 days 00:01:37.782321,identity,min,0.006338352179856681,9,15,bell,COMPLETE
433,3.805979531534831e-06,2025-07-15 07:57:57.102543,2025-07-15 07:59:52.260301,0 days 00:01:55.157758,identity,prod,0.0037035256773851615,8,22,bell,COMPLETE
434,3.508684358166647e-06,2025-07-15 07:59:52.261330,2025-07-15 08:01:03.992212,0 days 00:01:11.730882,identity,prod,0.006692101351152582,8,5,bell,COMPLETE
435,1.5487938071601093e-05,2025-07-15 08:01:03.993210,2025-07-15 08:02:37.597611,0 days 00:01:33.604401,identity,prod,0.006619970972404816,8,14,bell,COMPLETE
436,0.48676586151123047,2025-07-15 08:02:37.598661,2025-07-15 08:03:53.794376,0 days 00:01:16.195715,identity,prod,0.006016114318611825,9,7,gaussian,COMPLETE
437,3.5202010622015223e-06,2025-07-15 08:03:53.795424,2025-07-15 08:05:05.656166,0 days 00:01:11.860742,identity,prod,0.00709348385882026,8,5,bell,COMPLETE
438,3.53206792169658e-06,2025-07-15 08:05:05.657148,2025-07-15 08:06:19.869508,0 days 00:01:14.212360,identity,prod,0.006917142444201966,9,5,bell,COMPLETE
439,3.4631382277439116e-06,2025-07-15 08:06:19.870507,2025-07-15 08:07:33.953355,0 days 00:01:14.082848,identity,prod,0.006969529210068577,9,5,bell,COMPLETE
440,3.8919220060051885e-06,2025-07-15 08:07:33.954327,2025-07-15 08:08:49.384506,0 days 00:01:15.430179,relu,min,0.007058695301286446,9,6,bell,COMPLETE
441,3.3924809486052254e-06,2025-07-15 08:08:49.385522,2025-07-15 08:10:03.418398,0 days 00:01:14.032876,identity,prod,0.0064002150336859645,9,5,bell,COMPLETE
442,3.7350605452957097e-06,2025-07-15 08:10:03.419413,2025-07-15 08:11:20.583483,0 days 00:01:17.164070,identity,prod,0.007377126799153134,9,6,bell,COMPLETE
443,4.095025360584259e-06,2025-07-15 08:11:20.584509,2025-07-15 08:12:34.699342,0 days 00:01:14.114833,identity,prod,0.006582094548169477,9,5,bell,COMPLETE
444,4.817112767341314e-06,2025-07-15 08:12:34.700579,2025-07-15 08:13:48.781586,0 days 00:01:14.081007,identity,prod,0.007473841189543801,9,5,bell,COMPLETE
445,0.0206716638058424,2025-07-15 08:13:48.782595,2025-07-15 08:14:58.225729,0 days 00:01:09.443134,identity,prod,0.006622653028246057,9,5,sigmoid,COMPLETE
446,7.085805009410251e-06,2025-07-15 08:14:58.226734,2025-07-15 08:16:12.333656,0 days 00:01:14.106922,identity,prod,0.006130564120167588,9,5,bell,COMPLETE
447,3.726071099663386e-06,2025-07-15 08:16:12.334656,2025-07-15 08:17:26.457634,0 days 00:01:14.122978,identity,prod,0.007079354219667114,9,5,bell,COMPLETE
448,5.254488314676564e-06,2025-07-15 08:17:26.458655,2025-07-15 08:18:40.505455,0 days 00:01:14.046800,identity,prod,0.007632981999382492,9,5,bell,COMPLETE
449,5.18002570970566e-06,2025-07-15 08:18:40.506456,2025-07-15 08:19:55.933962,0 days 00:01:15.427506,relu,min,0.006081426856033448,9,6,bell,COMPLETE
450,3.49434253621439e-06,2025-07-15 08:19:55.934738,2025-07-15 08:21:16.012034,0 days 00:01:20.077296,identity,prod,0.006742310311436416,9,7,bell,COMPLETE
451,3.894227120326832e-06,2025-07-15 08:21:16.013057,2025-07-15 08:22:36.042886,0 days 00:01:20.029829,identity,prod,0.006717701110096877,9,7,bell,COMPLETE
452,5.449106538435444e-06,2025-07-15 08:22:36.043874,2025-07-15 08:23:53.180581,0 days 00:01:17.136707,identity,prod,0.007630033233435448,9,6,bell,COMPLETE
453,0.0005389740690588951,2025-07-15 08:23:53.181581,2025-07-15 08:25:16.322971,0 days 00:01:23.141390,identity,prod,0.006891139210210145,9,8,bell,COMPLETE
454,3.6382821235747542e-06,2025-07-15 08:25:16.323952,2025-07-15 08:26:30.425247,0 days 00:01:14.101295,identity,prod,0.007722114249588095,9,5,bell,COMPLETE
455,4.230185822962085e-06,2025-07-15 08:26:30.426276,2025-07-15 08:27:50.458538,0 days 00:01:20.032262,identity,prod,0.008139385798442799,9,7,bell,COMPLETE
456,3.981281679443782e-06,2025-07-15 08:27:50.459554,2025-07-15 08:29:07.519042,0 days 00:01:17.059488,identity,prod,0.006404007448739257,9,6,bell,COMPLETE
457,3.6535848266794346e-06,2025-07-15 08:29:07.520077,2025-07-15 08:30:21.855000,0 days 00:01:14.334923,relu,prod,0.006949968142498266,9,5,bell,COMPLETE
458,3.9046308302204125e-06,2025-07-15 08:30:21.855992,2025-07-15 08:31:36.863326,0 days 00:01:15.007334,identity,min,0.00721816652680586,9,6,bell,COMPLETE
459,0.00014008120342623442,2025-07-15 08:31:36.864295,2025-07-15 08:32:47.060718,0 days 00:01:10.196423,identity,prod,0.00812909178196694,9,5,gaussian,COMPLETE
460,3.7318973227229435e-06,2025-07-15 08:32:47.061761,2025-07-15 08:34:12.983804,0 days 00:01:25.922043,identity,prod,0.005941356792251601,9,9,bell,COMPLETE
461,3.515184971547569e-06,2025-07-15 08:34:12.984803,2025-07-15 08:35:35.939314,0 days 00:01:22.954511,identity,prod,0.006390644275055091,9,8,bell,COMPLETE
462,0.030159292742609978,2025-07-15 08:35:35.940296,2025-07-15 08:36:52.970622,0 days 00:01:17.030326,identity,prod,0.00023857052250803596,9,6,bell,COMPLETE
463,3.968648343288805e-06,2025-07-15 08:36:52.971638,2025-07-15 08:38:15.941680,0 days 00:01:22.970042,identity,prod,0.00640978067884992,9,8,bell,COMPLETE
464,2.3107808374334127e-05,2025-07-15 08:38:15.942667,2025-07-15 08:39:29.978486,0 days 00:01:14.035819,identity,prod,0.005824534897316954,9,5,bell,COMPLETE
465,0.000812397978734225,2025-07-15 08:39:29.979500,2025-07-15 08:40:50.085836,0 days 00:01:20.106336,identity,prod,0.00646095824551979,9,7,bell,COMPLETE
466,0.018178852275013924,2025-07-15 08:40:50.086824,2025-07-15 08:42:13.503841,0 days 00:01:23.417017,relu,prod,0.007283819935950427,9,8,bell,COMPLETE
467,3.6603182707040105e-06,2025-07-15 08:42:13.504827,2025-07-15 08:43:25.456437,0 days 00:01:11.951610,identity,min,0.008125921600113334,9,5,bell,COMPLETE
468,0.0015186890959739685,2025-07-15 08:43:25.457440,2025-07-15 08:44:45.520879,0 days 00:01:20.063439,identity,prod,0.0014480252625826949,9,7,bell,COMPLETE
469,0.0003512185357976705,2025-07-15 08:44:45.521824,2025-07-15 08:46:06.444981,0 days 00:01:20.923157,identity,prod,0.00605451419645802,9,9,sigmoid,COMPLETE
470,4.499954229686409e-06,2025-07-15 08:46:06.445991,2025-07-15 08:47:23.553626,0 days 00:01:17.107635,identity,prod,0.007029382926655256,9,6,bell,COMPLETE
471,3.881359134538798e-06,2025-07-15 08:47:23.554602,2025-07-15 08:48:37.641221,0 days 00:01:14.086619,identity,prod,0.007749121311329333,9,5,bell,COMPLETE
472,4.536118467513006e-06,2025-07-15 08:48:37.642205,2025-07-15 08:49:46.024509,0 days 00:01:08.382304,identity,prod,0.005432178058928283,6,5,bell,COMPLETE
473,3.6789172099815914e-06,2025-07-15 08:49:46.025501,2025-07-15 08:51:03.105271,0 days 00:01:17.079770,identity,prod,0.006516878216355736,9,6,bell,COMPLETE
474,3.460881316641462e-06,2025-07-15 08:51:03.106247,2025-07-15 08:52:17.497843,0 days 00:01:14.391596,relu,prod,0.008421256159148497,9,5,bell,COMPLETE
475,4.2963465602952056e-06,2025-07-15 08:52:17.499025,2025-07-15 08:53:29.808077,0 days 00:01:12.309052,relu,min,0.007075060429583024,9,5,bell,COMPLETE
476,9.279603546019644e-06,2025-07-15 08:53:29.809120,2025-07-15 08:54:44.195578,0 days 00:01:14.386458,relu,prod,0.005718917863376514,9,5,bell,COMPLETE
477,3.5018899779970525e-06,2025-07-15 08:54:44.196627,2025-07-15 08:56:01.608567,0 days 00:01:17.411940,relu,prod,0.008317709129034793,9,6,bell,COMPLETE
478,6.733812369930092e-06,2025-07-15 08:56:01.609605,2025-07-15 08:57:18.696017,0 days 00:01:17.086412,identity,prod,0.008306588682903963,9,6,bell,COMPLETE
479,0.017830010503530502,2025-07-15 08:57:18.697015,2025-07-15 08:58:36.279332,0 days 00:01:17.582317,relu,prod,0.00847678302290737,9,6,bell,COMPLETE
480,0.00013019965263083577,2025-07-15 08:58:36.280312,2025-07-15 08:59:50.900993,0 days 00:01:14.620681,relu,prod,0.009972898264543588,9,5,bell,COMPLETE
481,3.7540057746809907e-06,2025-07-15 08:59:50.902053,2025-07-15 09:01:08.399804,0 days 00:01:17.497751,relu,prod,0.0077952151804687965,9,6,bell,COMPLETE
482,0.21585683524608612,2025-07-15 09:01:08.400818,2025-07-15 09:02:22.973659,0 days 00:01:14.572841,relu,prod,0.008288272270844324,9,5,bell,COMPLETE
483,4.177171649644151e-05,2025-07-15 09:02:22.974746,2025-07-15 09:03:38.070762,0 days 00:01:15.096016,relu,min,0.00639662363572141,9,7,gaussian,COMPLETE
484,0.004178579896688461,2025-07-15 09:03:38.071794,2025-07-15 09:04:55.469979,0 days 00:01:17.398185,relu,prod,0.007551077134927234,9,6,bell,COMPLETE
485,0.1686178296804428,2025-07-15 09:04:55.471018,2025-07-15 09:06:18.939010,0 days 00:01:23.467992,relu,prod,0.008601356298757462,9,8,bell,COMPLETE
486,4.672368959290907e-05,2025-07-15 09:06:18.940028,2025-07-15 09:07:33.350377,0 days 00:01:14.410349,relu,prod,0.0058799644454616265,9,5,bell,COMPLETE
487,3.907371592504205e-06,2025-07-15 09:07:33.351375,2025-07-15 09:08:47.483782,0 days 00:01:14.132407,identity,prod,0.006733977045989378,9,5,bell,COMPLETE
488,8.267576049547642e-05,2025-07-15 09:08:47.484818,2025-07-15 09:10:04.544277,0 days 00:01:17.059459,identity,prod,0.0026703577709672084,9,6,bell,COMPLETE
489,3.761605967156356e-06,2025-07-15 09:10:04.545286,2025-07-15 09:11:18.566508,0 days 00:01:14.021222,identity,prod,0.007721192837842814,9,5,bell,COMPLETE
490,5.619879630103242e-06,2025-07-15 09:11:18.567517,2025-07-15 09:12:38.518383,0 days 00:01:19.950866,identity,prod,0.00890666832493882,9,7,bell,COMPLETE
491,0.0011109563056379557,2025-07-15 09:12:38.519398,2025-07-15 09:13:53.930943,0 days 00:01:15.411545,relu,min,0.0052777232439281205,9,6,bell,COMPLETE
492,0.019774343818426132,2025-07-15 09:13:53.931962,2025-07-15 09:15:09.121179,0 days 00:01:15.189217,identity,prod,0.009986259010933645,9,7,sigmoid,COMPLETE
493,3.3668623018456856e-06,2025-07-15 09:15:09.122166,2025-07-15 09:16:23.221635,0 days 00:01:14.099469,identity,prod,0.006225658599304488,9,5,bell,COMPLETE
494,6.722691523464164e-06,2025-07-15 09:16:23.222624,2025-07-15 09:17:37.271083,0 days 00:01:14.048459,identity,prod,0.005714806836669697,9,5,bell,COMPLETE
495,1.9776813132921234e-05,2025-07-15 09:17:37.272088,2025-07-15 09:19:03.152183,0 days 00:01:25.880095,identity,prod,0.005079027720275496,9,9,bell,COMPLETE
496,4.734367848868715e-06,2025-07-15 09:19:03.153214,2025-07-15 09:20:20.138043,0 days 00:01:16.984829,identity,prod,0.0061300968517413335,9,6,bell,COMPLETE
497,3.876587015838595e-06,2025-07-15 09:20:20.139085,2025-07-15 09:21:34.190456,0 days 00:01:14.051371,identity,prod,0.006320345510960351,9,5,bell,COMPLETE
498,3.625588988143136e-06,2025-07-15 09:21:34.191427,2025-07-15 09:22:51.659204,0 days 00:01:17.467777,relu,prod,0.0055224631773222515,9,6,bell,COMPLETE
499,5.770533334725769e-06,2025-07-15 09:22:51.660004,2025-07-15 09:24:39.631105,0 days 00:01:47.971101,identity,prod,0.006556373347560652,9,18,bell,COMPLETE
