number,value,datetime_start,datetime_complete,duration,params_activation,params_batch_size,params_h,params_lr,params_seq_length,state
427,5.235006938164588e-06,2025-07-16 02:57:50.529828,2025-07-16 03:00:08.562977,0 days 00:02:18.033149,identity,16,110,0.00036249999506278354,10,COMPLETE
428,4.702407750301063e-06,2025-07-16 03:00:08.564002,2025-07-16 03:02:15.879160,0 days 00:02:07.315158,identity,16,106,0.00026467563807564134,9,COMPLETE
429,1.7835385733633302e-05,2025-07-16 03:02:15.880115,2025-07-16 03:04:23.416848,0 days 00:02:07.536733,identity,16,104,0.0002497892796593017,9,COMPLETE
430,1.603499003977049e-05,2025-07-16 03:04:23.417810,2025-07-16 03:06:43.009252,0 days 00:02:19.591442,identity,16,106,0.00023079242229296566,10,COMPLETE
431,4.917325441056164e-06,2025-07-16 03:06:43.010235,2025-07-16 03:08:59.281448,0 days 00:02:16.271213,identity,16,102,0.0002699844255544073,10,COMPLETE
432,1.3633519301947672e-05,2025-07-16 03:08:59.282422,2025-07-16 03:11:11.033077,0 days 00:02:11.750655,identity,16,100,0.00027158366453891613,10,COMPLETE
433,9.135354957834352e-06,2025-07-16 03:11:11.034062,2025-07-16 03:13:20.415010,0 days 00:02:09.380948,relu,16,101,0.00027502894478478347,9,COMPLETE
434,5.3744583965453785e-06,2025-07-16 03:13:20.415973,2025-07-16 03:15:43.501499,0 days 00:02:23.085526,identity,16,103,0.00026169307490359376,10,COMPLETE
435,0.007065414916723967,2025-07-16 03:15:43.502455,2025-07-16 03:16:58.526191,0 days 00:01:15.023736,identity,16,64,0.00990084731980735,11,COMPLETE
436,5.553994014917407e-06,2025-07-16 03:16:58.526950,2025-07-16 03:19:07.461637,0 days 00:02:08.934687,identity,16,99,0.00029791320271133157,9,COMPLETE
437,1.705864087853115e-05,2025-07-16 03:19:07.462604,2025-07-16 03:20:04.672943,0 days 00:00:57.210339,identity,32,107,0.00025154083894991314,11,COMPLETE
438,5.089150818093913e-06,2025-07-16 03:20:04.673705,2025-07-16 03:21:47.378496,0 days 00:01:42.704791,identity,16,123,0.0002886121153804775,10,COMPLETE
439,1.710354263195768e-05,2025-07-16 03:21:47.379487,2025-07-16 03:22:58.926202,0 days 00:01:11.546715,identity,16,56,0.0003161618106799989,10,COMPLETE
440,2.0004192265332676e-05,2025-07-16 03:22:58.927213,2025-07-16 03:25:10.719287,0 days 00:02:11.792074,identity,16,103,0.00013938420254977902,9,COMPLETE
441,7.384900527540594e-06,2025-07-16 03:25:10.720274,2025-07-16 03:26:59.589085,0 days 00:01:48.868811,identity,16,126,0.0002452576690582116,11,COMPLETE
442,1.3469003533828072e-05,2025-07-16 03:26:59.590086,2025-07-16 03:29:33.512392,0 days 00:02:33.922306,identity,16,107,0.00027390513667012846,11,COMPLETE
443,0.0016785498009994626,2025-07-16 03:29:33.513419,2025-07-16 03:29:56.589967,0 days 00:00:23.076548,identity,128,102,0.00023378050059829616,9,COMPLETE
444,2.4253187802969478e-05,2025-07-16 03:29:56.590795,2025-07-16 03:31:38.625395,0 days 00:01:42.034600,identity,16,121,0.0015667489319580912,10,COMPLETE
445,8.155830983014312e-06,2025-07-16 03:31:38.626375,2025-07-16 03:33:54.774639,0 days 00:02:16.148264,identity,16,104,0.00029833218104340396,10,COMPLETE
446,5.852941285411362e-06,2025-07-16 03:33:54.775612,2025-07-16 03:36:08.446780,0 days 00:02:13.671168,identity,16,109,0.00026400622773932686,10,COMPLETE
447,6.458866664615925e-06,2025-07-16 03:36:08.447777,2025-07-16 03:38:33.034543,0 days 00:02:24.586766,identity,16,100,0.00022710858267986384,11,COMPLETE
448,1.0930791177088395e-05,2025-07-16 03:38:33.035575,2025-07-16 03:40:55.642416,0 days 00:02:22.606841,identity,16,68,0.0003228563677349495,22,COMPLETE
449,1.282892935705604e-05,2025-07-16 03:40:55.643431,2025-07-16 03:42:27.780867,0 days 00:01:32.137436,identity,16,128,0.0002509472953646848,9,COMPLETE
450,1.1590080248424783e-05,2025-07-16 03:42:27.781877,2025-07-16 03:44:51.409675,0 days 00:02:23.627798,identity,16,105,0.00028494449366032846,10,COMPLETE
451,0.0006504061748273671,2025-07-16 03:44:51.410684,2025-07-16 03:45:52.105538,0 days 00:01:00.694854,identity,16,15,0.00022183805012426365,11,COMPLETE
452,0.0009704423719085753,2025-07-16 03:45:52.106288,2025-07-16 03:46:26.291332,0 days 00:00:34.185044,identity,64,106,0.0004252834302645782,10,COMPLETE
453,1.3165440559387207,2025-07-16 03:46:26.292123,2025-07-16 03:49:41.751794,0 days 00:03:15.459671,relu,16,117,0.0002751824570949407,17,COMPLETE
454,2.4527471396140754e-05,2025-07-16 03:49:41.752794,2025-07-16 03:51:17.244278,0 days 00:01:35.491484,identity,16,123,0.00011410430751088671,9,COMPLETE
455,1.0595106687105726e-05,2025-07-16 03:51:17.245332,2025-07-16 03:54:00.771402,0 days 00:02:43.526070,identity,16,113,0.00019873621313486515,10,COMPLETE
456,0.0002600523876026273,2025-07-16 03:54:00.772395,2025-07-16 03:55:08.877749,0 days 00:01:08.105354,identity,16,20,0.00034376013031500393,11,COMPLETE
457,2.1620997358695604e-05,2025-07-16 03:55:08.878758,2025-07-16 03:57:36.453572,0 days 00:02:27.574814,identity,16,90,0.0002494657174771939,10,COMPLETE
458,1.331617204414215e-05,2025-07-16 03:57:36.454583,2025-07-16 04:00:18.113690,0 days 00:02:41.659107,identity,16,110,0.00029514260208376205,12,COMPLETE
459,9.651667824073229e-06,2025-07-16 04:00:18.114704,2025-07-16 04:01:50.014660,0 days 00:01:31.899956,identity,16,120,0.000328549747326133,9,COMPLETE
460,1.3099986063025426e-05,2025-07-16 04:01:50.015672,2025-07-16 04:04:06.081621,0 days 00:02:16.065949,identity,16,99,0.00021578728486399787,10,COMPLETE
461,4.797079327545362e-06,2025-07-16 04:04:06.082614,2025-07-16 04:06:45.563335,0 days 00:02:39.480721,identity,16,102,0.00038484601422850904,11,COMPLETE
462,7.79607034928631e-06,2025-07-16 04:06:45.564324,2025-07-16 04:07:42.575152,0 days 00:00:57.010828,identity,32,102,0.00039409526863201877,12,COMPLETE
463,1.07857204056927e-05,2025-07-16 04:07:42.575937,2025-07-16 04:10:26.325975,0 days 00:02:43.750038,identity,16,104,0.0004956838693880352,11,COMPLETE
464,9.794714969757479e-06,2025-07-16 04:10:26.326974,2025-07-16 04:13:01.084366,0 days 00:02:34.757392,identity,16,99,0.0006318908776555751,11,COMPLETE
465,7.316566097870236e-06,2025-07-16 04:13:01.085391,2025-07-16 04:15:51.836538,0 days 00:02:50.751147,identity,16,108,0.0003799577445185573,11,COMPLETE
466,1.7842075976659544e-05,2025-07-16 04:15:51.837551,2025-07-16 04:18:52.649309,0 days 00:03:00.811758,identity,16,101,0.0004103126887948166,12,COMPLETE
467,6.0380152717698365e-06,2025-07-16 04:18:52.650351,2025-07-16 04:21:14.754613,0 days 00:02:22.104262,identity,16,96,0.0004659859386200804,11,COMPLETE
468,0.0011874319752678275,2025-07-16 04:21:14.755830,2025-07-16 04:21:39.967399,0 days 00:00:25.211569,identity,128,106,0.0003560657609635974,10,COMPLETE
469,5.450175649457378e-06,2025-07-16 04:21:39.968200,2025-07-16 04:24:10.958096,0 days 00:02:30.989896,identity,16,103,0.00045601707690074263,11,COMPLETE
470,5.815575150336372e-06,2025-07-16 04:24:10.959091,2025-07-16 04:26:30.088363,0 days 00:02:19.129272,identity,16,108,0.00035603166575141665,11,COMPLETE
471,1.3186047077178955,2025-07-16 04:26:30.089380,2025-07-16 04:28:51.980136,0 days 00:02:21.890756,relu,16,105,0.0003172882420913637,10,COMPLETE
472,2.3349943148787133e-05,2025-07-16 04:28:51.981131,2025-07-16 04:31:05.694083,0 days 00:02:13.712952,identity,16,98,0.0010586485692198658,10,COMPLETE
473,1.1214681762794498e-05,2025-07-16 04:31:05.695094,2025-07-16 04:33:09.016203,0 days 00:02:03.321109,identity,16,101,0.0008446373727987645,9,COMPLETE
474,2.4377006411668845e-05,2025-07-16 04:33:09.017252,2025-07-16 04:35:43.099200,0 days 00:02:34.081948,identity,16,112,0.0004263197044735568,12,COMPLETE
475,0.0007439975161105394,2025-07-16 04:35:43.100233,2025-07-16 04:36:15.861504,0 days 00:00:32.761271,identity,64,104,0.0003737159472454052,10,COMPLETE
476,1.2516057722677942e-05,2025-07-16 04:36:15.862336,2025-07-16 04:38:53.139772,0 days 00:02:37.277436,identity,16,107,0.0003056551001695201,11,COMPLETE
477,1.349758076685248e-05,2025-07-16 04:38:53.140795,2025-07-16 04:41:28.415313,0 days 00:02:35.274518,identity,16,114,0.00027089980114824893,11,COMPLETE
478,1.7759743059286848e-05,2025-07-16 04:41:28.416315,2025-07-16 04:43:34.095563,0 days 00:02:05.679248,identity,16,110,0.0003351113731971202,9,COMPLETE
479,9.640813914302271e-06,2025-07-16 04:43:34.096572,2025-07-16 04:45:47.711773,0 days 00:02:13.615201,identity,16,101,0.0002945243405719746,10,COMPLETE
480,0.0015313195763155818,2025-07-16 04:45:47.712792,2025-07-16 04:46:43.814278,0 days 00:00:56.101486,identity,16,8,0.00018306609259413487,10,COMPLETE
481,0.00015207924298010767,2025-07-16 04:46:43.815028,2025-07-16 04:47:53.643742,0 days 00:01:09.828714,identity,16,34,0.0002376922033547866,11,COMPLETE
482,1.4930253200873267e-05,2025-07-16 04:47:53.644768,2025-07-16 04:49:57.805240,0 days 00:02:04.160472,identity,16,103,0.0005509421022247982,9,COMPLETE
483,6.718520580761833e-06,2025-07-16 04:49:57.806254,2025-07-16 04:52:13.072451,0 days 00:02:15.266197,identity,16,106,0.00039226765318604417,10,COMPLETE
484,6.587001280422555e-06,2025-07-16 04:52:13.073463,2025-07-16 04:53:57.908910,0 days 00:01:44.835447,identity,16,116,0.00026827240510715985,11,COMPLETE
485,3.100850517512299e-05,2025-07-16 04:53:57.909943,2025-07-16 04:56:14.518044,0 days 00:02:16.608101,identity,16,98,0.000320833292394419,10,COMPLETE
486,6.83878461131826e-05,2025-07-16 04:56:14.519068,2025-07-16 04:57:11.506124,0 days 00:00:56.987056,identity,32,108,0.00022361436649616235,12,COMPLETE
487,1.4273235137807205e-05,2025-07-16 04:57:11.506955,2025-07-16 04:59:25.871455,0 days 00:02:14.364500,identity,16,110,0.00027994497201126457,10,COMPLETE
488,9.27958626562031e-06,2025-07-16 04:59:25.872470,2025-07-16 05:01:31.990564,0 days 00:02:06.118094,identity,16,105,0.00036081887509655636,9,COMPLETE
489,4.680179245042382e-06,2025-07-16 05:01:31.991570,2025-07-16 05:03:59.727027,0 days 00:02:27.735457,identity,16,103,0.0002567521479142747,11,COMPLETE
490,1.31791353225708,2025-07-16 05:03:59.728062,2025-07-16 05:06:34.854375,0 days 00:02:35.126313,relu,16,101,0.00030822183772856936,12,COMPLETE
491,1.498056917625945e-05,2025-07-16 05:06:34.855408,2025-07-16 05:09:33.571562,0 days 00:02:58.716154,identity,16,94,0.00020047006844892877,14,COMPLETE
492,0.001972871134057641,2025-07-16 05:09:33.572582,2025-07-16 05:10:00.308944,0 days 00:00:26.736362,identity,128,102,0.00023679489832535686,11,COMPLETE
493,6.091594968893332e-06,2025-07-16 05:10:00.309762,2025-07-16 05:12:24.015892,0 days 00:02:23.706130,identity,16,104,0.00028526053923357393,11,COMPLETE
494,1.3317548109625932e-05,2025-07-16 05:12:24.016923,2025-07-16 05:14:46.697184,0 days 00:02:22.680261,identity,16,87,0.00026254534758376146,12,COMPLETE
495,5.44173281014082e-06,2025-07-16 05:14:46.698210,2025-07-16 05:17:25.510211,0 days 00:02:38.812001,identity,16,99,0.0003369346475719164,11,COMPLETE
496,9.931442036759108e-06,2025-07-16 05:17:25.511262,2025-07-16 05:20:01.616312,0 days 00:02:36.105050,identity,16,107,0.0004405681439673566,11,COMPLETE
497,1.692968544375617e-05,2025-07-16 05:20:01.617351,2025-07-16 05:22:16.229657,0 days 00:02:14.612306,identity,16,96,0.00021384450653904046,11,COMPLETE
498,1.679674824117683e-05,2025-07-16 05:22:16.230702,2025-07-16 05:24:41.304534,0 days 00:02:25.073832,identity,16,103,0.0002382149584485779,10,COMPLETE
499,5.074646196590038e-06,2025-07-16 05:24:41.305557,2025-07-16 05:27:08.219200,0 days 00:02:26.913643,identity,16,105,0.0003939914938294919,11,COMPLETE
