number,value,datetime_start,datetime_complete,duration,params_activation,params_batch_size,params_h,params_lr,params_seq_length,state
143,2.9169119443395175e-05,2025-07-15 17:32:27.080987,2025-07-15 17:34:03.766019,0 days 00:01:36.685032,identity,16,87,0.0003398670363265158,7,COMPLETE
144,1.0915049642790109e-05,2025-07-15 17:34:03.766902,2025-07-15 17:36:05.388968,0 days 00:02:01.622066,identity,16,95,0.0002706776842127504,9,COMPLETE
145,7.108683348633349e-06,2025-07-15 17:36:05.389800,2025-07-15 17:38:11.024735,0 days 00:02:05.634935,identity,16,98,0.00039853292597722507,7,COMPLETE
146,7.990163794602267e-06,2025-07-15 17:38:11.025600,2025-07-15 17:40:04.928563,0 days 00:01:53.902963,identity,16,91,0.000439784686205078,9,COMPLETE
147,5.077328751212917e-05,2025-07-15 17:40:04.929534,2025-07-15 17:41:13.235091,0 days 00:01:08.305557,identity,32,101,0.00022668412864911239,17,COMPLETE
148,1.584721394465305e-05,2025-07-15 17:41:13.235759,2025-07-15 17:43:18.241355,0 days 00:02:05.005596,identity,16,89,0.0002886736693011056,8,COMPLETE
149,7.899301635916345e-06,2025-07-15 17:43:18.242279,2025-07-15 17:45:03.775070,0 days 00:01:45.532791,identity,16,99,0.0005550826889594418,9,COMPLETE
150,1.316028118133545,2025-07-15 17:45:03.775913,2025-07-15 17:45:46.581267,0 days 00:00:42.805354,relu,128,93,0.0003577027173848967,21,COMPLETE
151,1.6202853657887317e-05,2025-07-15 17:45:46.581943,2025-07-15 17:46:56.135014,0 days 00:01:09.553071,identity,16,96,0.00040187537589577533,5,COMPLETE
152,7.568934051960241e-06,2025-07-15 17:46:56.135685,2025-07-15 17:48:22.926328,0 days 00:01:26.790643,identity,16,103,0.0003169754831750419,6,COMPLETE
153,7.341230229940265e-06,2025-07-15 17:48:22.927004,2025-07-15 17:50:14.921768,0 days 00:01:51.994764,identity,16,112,0.0003758412858728861,8,COMPLETE
154,1.3047741958871484e-05,2025-07-15 17:50:14.922611,2025-07-15 17:51:56.250296,0 days 00:01:41.327685,identity,16,115,0.0004947619742862604,6,COMPLETE
155,6.171911081764847e-06,2025-07-15 17:51:56.251144,2025-07-15 17:53:45.069991,0 days 00:01:48.818847,identity,16,109,0.0004517681759837069,8,COMPLETE
156,5.592440174950752e-06,2025-07-15 17:53:45.070865,2025-07-15 17:55:25.536220,0 days 00:01:40.465355,identity,16,108,0.000348507539212515,7,COMPLETE
157,3.255539195379242e-05,2025-07-15 17:55:25.537098,2025-07-15 17:57:04.188975,0 days 00:01:38.651877,identity,16,101,0.00025179211893475303,7,COMPLETE
158,5.275144758343231e-06,2025-07-15 17:57:04.189912,2025-07-15 17:58:55.618126,0 days 00:01:51.428214,identity,16,106,0.0003059024137854591,9,COMPLETE
159,1.1473717677290551e-05,2025-07-15 17:58:55.618969,2025-07-15 18:01:10.098256,0 days 00:02:14.479287,identity,16,106,0.00028897252750919287,9,COMPLETE
160,0.0005057588568888605,2025-07-15 18:01:10.099137,2025-07-15 18:01:36.441389,0 days 00:00:26.342252,identity,64,111,0.00034226464800478026,7,COMPLETE
161,7.200625077530276e-06,2025-07-15 18:01:36.442048,2025-07-15 18:03:40.671004,0 days 00:02:04.228956,identity,16,104,0.0003127792231024043,10,COMPLETE
162,1.0566951459622942e-05,2025-07-15 18:03:40.671885,2025-07-15 18:05:41.828877,0 days 00:02:01.156992,identity,16,99,0.00027185449049063154,9,COMPLETE
163,1.4308380741567817e-05,2025-07-15 18:05:41.829761,2025-07-15 18:10:46.557751,0 days 00:05:04.727990,identity,16,107,0.0003477982912089686,18,COMPLETE
164,1.1027468644897453e-05,2025-07-15 18:10:46.558685,2025-07-15 18:15:04.006230,0 days 00:04:17.447545,identity,16,95,0.00030914656641327853,23,COMPLETE
165,7.680667295062449e-06,2025-07-15 18:15:04.007287,2025-07-15 18:17:51.546740,0 days 00:02:47.539453,identity,16,102,0.0003989198408858995,8,COMPLETE
166,7.617560186190531e-06,2025-07-15 18:17:51.547634,2025-07-15 18:19:48.173831,0 days 00:01:56.626197,identity,16,109,0.0003501670261230358,10,COMPLETE
167,0.0018559589516371489,2025-07-15 18:19:48.174724,2025-07-15 18:20:48.413060,0 days 00:01:00.238336,identity,16,15,0.0002509171115168762,11,COMPLETE
168,1.0502652003197e-05,2025-07-15 18:20:48.413745,2025-07-15 18:21:47.081784,0 days 00:00:58.668039,identity,16,65,0.00029192592563075196,7,COMPLETE
169,1.698088090051897e-05,2025-07-15 18:21:47.082433,2025-07-15 18:23:24.119682,0 days 00:01:37.037249,identity,16,97,0.00042534097013114476,8,COMPLETE
170,8.81134928931715e-06,2025-07-15 18:23:24.120555,2025-07-15 18:25:14.917330,0 days 00:01:50.796775,identity,16,106,0.0003800554270459656,9,COMPLETE
171,6.412419679691084e-06,2025-07-15 18:25:14.918288,2025-07-15 18:26:53.379975,0 days 00:01:38.461687,identity,16,110,0.0004592128611309789,8,COMPLETE
172,9.85131373454351e-06,2025-07-15 18:26:53.380851,2025-07-15 18:28:19.592932,0 days 00:01:26.212081,identity,16,118,0.00034438762878503384,8,COMPLETE
173,0.008411822840571404,2025-07-15 18:28:19.593626,2025-07-15 18:30:10.084045,0 days 00:01:50.490419,identity,16,113,0.00841366460418481,9,COMPLETE
174,2.478889473422896e-05,2025-07-15 18:30:10.084917,2025-07-15 18:32:59.464884,0 days 00:02:49.379967,identity,16,109,0.0003225486238752627,8,COMPLETE
175,4.556086878437782e-06,2025-07-15 18:32:59.465749,2025-07-15 18:34:59.461116,0 days 00:01:59.995367,identity,16,103,0.00038885218826774685,10,COMPLETE
176,5.328830411599483e-06,2025-07-15 18:34:59.461977,2025-07-15 18:36:55.425330,0 days 00:01:55.963353,identity,16,104,0.00037482037955837853,10,COMPLETE
177,0.0009878380224108696,2025-07-15 18:36:55.426206,2025-07-15 18:37:25.890785,0 days 00:00:30.464579,identity,64,100,0.00038930921244212445,10,COMPLETE
178,6.489661245723255e-06,2025-07-15 18:37:25.891452,2025-07-15 18:39:23.160404,0 days 00:01:57.268952,identity,16,104,0.000430738337631242,10,COMPLETE
179,8.861324204190169e-06,2025-07-15 18:39:23.161285,2025-07-15 18:40:12.873927,0 days 00:00:49.712642,identity,32,93,0.00036048729101835833,10,COMPLETE
180,1.4249715604819357e-05,2025-07-15 18:40:12.874607,2025-07-15 18:42:16.697433,0 days 00:02:03.822826,identity,16,98,0.0011229760943877085,9,COMPLETE
181,9.259910257242154e-06,2025-07-15 18:42:16.698298,2025-07-15 18:44:44.732684,0 days 00:02:28.034386,identity,16,102,0.0003117742233907884,11,COMPLETE
182,4.962284037901554e-06,2025-07-15 18:44:44.733551,2025-07-15 18:47:03.261662,0 days 00:02:18.528111,identity,16,106,0.00027977316339558865,10,COMPLETE
183,4.8874676394916605e-06,2025-07-15 18:47:03.262556,2025-07-15 18:49:24.895587,0 days 00:02:21.633031,identity,16,107,0.00027298106012987324,10,COMPLETE
184,1.2340723515080754e-05,2025-07-15 18:49:24.896479,2025-07-15 18:51:43.969871,0 days 00:02:19.073392,identity,16,107,0.00027483386280248515,10,COMPLETE
185,2.216735992988106e-05,2025-07-15 18:51:43.970781,2025-07-15 18:53:43.068720,0 days 00:01:59.097939,relu,16,112,0.00021326245510862766,9,COMPLETE
186,5.1294609875185415e-06,2025-07-15 18:53:43.069606,2025-07-15 18:56:08.275762,0 days 00:02:25.206156,identity,16,115,0.00028505274195923726,10,COMPLETE
187,8.723505743546411e-06,2025-07-15 18:56:08.276668,2025-07-15 18:58:55.530120,0 days 00:02:47.253452,identity,16,115,0.00023457225658103355,16,COMPLETE
188,0.0014873038744553924,2025-07-15 18:58:55.531051,2025-07-15 18:59:18.292952,0 days 00:00:22.761901,identity,128,120,0.0002721279053552866,9,COMPLETE
189,6.5138974605361e-06,2025-07-15 18:59:18.293641,2025-07-15 19:01:33.377943,0 days 00:02:15.084302,identity,16,105,0.00029753336133399826,10,COMPLETE
190,5.605762453342322e-06,2025-07-15 19:01:33.378816,2025-07-15 19:03:39.348409,0 days 00:02:05.969593,identity,16,111,0.00024659683376959115,11,COMPLETE
191,1.3550852600019425e-05,2025-07-15 19:03:39.349276,2025-07-15 19:06:04.912380,0 days 00:02:25.563104,identity,16,111,0.00025945277424924026,11,COMPLETE
192,6.652278443652904e-06,2025-07-15 19:06:04.913249,2025-07-15 19:08:08.906618,0 days 00:02:03.993369,identity,16,109,0.0002325055617803857,11,COMPLETE
193,5.457211045722943e-06,2025-07-15 19:08:08.907508,2025-07-15 19:10:21.599039,0 days 00:02:12.691531,identity,16,107,0.0003007101834036709,10,COMPLETE
194,1.4161033504933584e-05,2025-07-15 19:10:21.599932,2025-07-15 19:12:18.415688,0 days 00:01:56.815756,identity,16,113,0.00029622796690948253,10,COMPLETE
195,5.164118647371652e-06,2025-07-15 19:12:18.416623,2025-07-15 19:14:59.271374,0 days 00:02:40.854751,identity,16,107,0.0002495782366900348,10,COMPLETE
196,1.9409235392231494e-05,2025-07-15 19:14:59.272304,2025-07-15 19:18:06.703862,0 days 00:03:07.431558,identity,16,107,0.00018381142438753388,10,COMPLETE
197,1.2482617421483155e-05,2025-07-15 19:18:06.704772,2025-07-15 19:19:56.616760,0 days 00:01:49.911988,identity,16,116,0.0002119851659553914,11,COMPLETE
198,4.989915396436118e-06,2025-07-15 19:19:56.617670,2025-07-15 19:22:28.486541,0 days 00:02:31.868871,identity,16,105,0.00024792695255545225,10,COMPLETE
199,5.6404473980364855e-06,2025-07-15 19:22:28.487454,2025-07-15 19:24:24.696907,0 days 00:01:56.209453,identity,16,108,0.000246437544118051,10,COMPLETE
200,1.7427122656954452e-05,2025-07-15 19:24:24.697801,2025-07-15 19:27:20.634013,0 days 00:02:55.936212,identity,16,105,0.00019933989710870678,11,COMPLETE
201,1.9276114471722394e-05,2025-07-15 19:27:20.634994,2025-07-15 19:29:51.138908,0 days 00:02:30.503914,identity,16,108,0.000245164374606631,10,COMPLETE
202,1.562143188493792e-05,2025-07-15 19:29:51.139803,2025-07-15 19:32:01.623137,0 days 00:02:10.483334,identity,16,107,0.00025291438404317283,10,COMPLETE
203,1.5606679880875163e-05,2025-07-15 19:32:01.624001,2025-07-15 19:34:22.625451,0 days 00:02:21.001450,identity,16,111,0.00022337774188528194,11,COMPLETE
204,1.3336990377865732e-05,2025-07-15 19:34:22.626355,2025-07-15 19:36:47.054093,0 days 00:02:24.427738,identity,16,103,0.0002684401253150711,10,COMPLETE
205,1.8374745195615105e-05,2025-07-15 19:36:47.055047,2025-07-15 19:38:40.181426,0 days 00:01:53.126379,identity,16,105,0.00028007076684103993,9,COMPLETE
206,1.1437041393946856e-05,2025-07-15 19:38:40.182336,2025-07-15 19:40:39.069203,0 days 00:01:58.886867,identity,16,114,0.00024036231530640112,10,COMPLETE
207,5.6351482271566056e-06,2025-07-15 19:40:39.070074,2025-07-15 19:42:46.050260,0 days 00:02:06.980186,identity,16,109,0.00031026116198364296,11,COMPLETE
208,7.713953891652636e-06,2025-07-15 19:42:46.051145,2025-07-15 19:45:57.641271,0 days 00:03:11.590126,identity,16,108,0.0002937418982408486,12,COMPLETE
209,4.559904027701123e-06,2025-07-15 19:45:57.642176,2025-07-15 19:48:04.526484,0 days 00:02:06.884308,identity,16,110,0.0002725609449379727,11,COMPLETE
210,7.817812729626894e-06,2025-07-15 19:48:04.527374,2025-07-15 19:50:50.173648,0 days 00:02:45.646274,identity,16,110,0.00031413981169381026,11,COMPLETE
211,1.4613626262871549e-05,2025-07-15 19:50:50.174506,2025-07-15 19:53:20.372893,0 days 00:02:30.198387,identity,16,106,0.00025928169534416136,10,COMPLETE
212,4.605672074831091e-06,2025-07-15 19:53:20.373771,2025-07-15 19:55:55.394193,0 days 00:02:35.020422,identity,16,103,0.00023634231931870202,11,COMPLETE
213,1.593558226886671e-05,2025-07-15 19:55:55.395076,2025-07-15 19:58:20.851425,0 days 00:02:25.456349,identity,16,103,0.0001995537595801734,11,COMPLETE
214,1.3478637811203953e-05,2025-07-15 19:58:20.852318,2025-07-15 20:00:37.337154,0 days 00:02:16.484836,identity,16,111,0.00022862039336285202,12,COMPLETE
215,5.94072844251059e-06,2025-07-15 20:00:37.338130,2025-07-15 20:03:35.443394,0 days 00:02:58.105264,identity,16,101,0.00028423759273112103,11,COMPLETE
216,6.399200174200814e-06,2025-07-15 20:03:35.444477,2025-07-15 20:05:46.813152,0 days 00:02:11.368675,identity,16,104,0.00032252876815552675,11,COMPLETE
217,9.139789654000197e-06,2025-07-15 20:05:46.814050,2025-07-15 20:08:24.240782,0 days 00:02:37.426732,identity,16,106,0.00026490470537883027,11,COMPLETE
218,5.397026143327821e-06,2025-07-15 20:08:24.241676,2025-07-15 20:10:35.072776,0 days 00:02:10.831100,identity,16,102,0.0002940982702455985,10,COMPLETE
219,1.3186047077178955,2025-07-15 20:10:35.073890,2025-07-15 20:12:49.516589,0 days 00:02:14.442699,relu,16,101,0.0002853903358772893,10,COMPLETE
220,1.5288278518710285e-05,2025-07-15 20:12:49.517476,2025-07-15 20:14:47.273917,0 days 00:01:57.756441,identity,16,99,0.00021332262165271967,10,COMPLETE
221,1.1231497410335578e-05,2025-07-15 20:14:47.274810,2025-07-15 20:17:19.042561,0 days 00:02:31.767751,identity,16,104,0.00031095414304188417,11,COMPLETE
222,1.049482943926705e-05,2025-07-15 20:17:19.043470,2025-07-15 20:19:31.680545,0 days 00:02:12.637075,identity,16,108,0.0003399575295352246,12,COMPLETE
223,2.0846317056566477e-05,2025-07-15 20:19:31.681438,2025-07-15 20:21:54.591823,0 days 00:02:22.910385,identity,16,102,0.0003633972251095453,10,COMPLETE
224,1.939063804456964e-05,2025-07-15 20:21:54.592728,2025-07-15 20:24:24.871633,0 days 00:02:30.278905,identity,16,106,0.00029641763921837766,10,COMPLETE
225,8.61651096784044e-06,2025-07-15 20:24:24.872511,2025-07-15 20:26:45.675444,0 days 00:02:20.802933,identity,16,110,0.00014835314648999566,11,COMPLETE
226,1.10977207441465e-05,2025-07-15 20:26:45.676348,2025-07-15 20:29:12.787183,0 days 00:02:27.110835,identity,16,112,0.00026900521715644984,9,COMPLETE
227,4.897262442682404e-06,2025-07-15 20:29:12.788059,2025-07-15 20:31:39.713214,0 days 00:02:26.925155,identity,16,104,0.000327535204255658,10,COMPLETE
228,6.375852990458952e-06,2025-07-15 20:31:39.714178,2025-07-15 20:32:27.891968,0 days 00:00:48.177790,identity,32,103,0.0003616188919398022,9,COMPLETE
229,1.3328552086022682e-05,2025-07-15 20:32:27.892655,2025-07-15 20:34:25.095200,0 days 00:01:57.202545,identity,16,100,0.00024059450110759976,10,COMPLETE
230,1.2405662346282043e-05,2025-07-15 20:34:25.096076,2025-07-15 20:37:08.301516,0 days 00:02:43.205440,identity,16,105,0.00032877533978057906,10,COMPLETE
231,1.7147101971204393e-05,2025-07-15 20:37:08.302400,2025-07-15 20:39:21.617391,0 days 00:02:13.314991,identity,16,108,0.0003069336882977669,11,COMPLETE
232,7.5440430009621195e-06,2025-07-15 20:39:21.618291,2025-07-15 20:41:20.875406,0 days 00:01:59.257115,identity,16,114,0.0002787591730621759,10,COMPLETE
233,7.470858690794557e-06,2025-07-15 20:41:20.876296,2025-07-15 20:44:28.339893,0 days 00:03:07.463597,identity,16,105,0.0003767563463619736,11,COMPLETE
234,5.832629085489316e-06,2025-07-15 20:44:28.340790,2025-07-15 20:46:46.873258,0 days 00:02:18.532468,identity,16,109,0.00032408490817957737,9,COMPLETE
235,1.6582274838583544e-05,2025-07-15 20:46:46.874179,2025-07-15 20:48:58.321336,0 days 00:02:11.447157,identity,16,102,0.00025964984737065306,10,COMPLETE
236,9.32208786252886e-06,2025-07-15 20:48:58.322242,2025-07-15 20:51:00.123787,0 days 00:02:01.801545,identity,16,98,0.0002952874492275386,10,COMPLETE
237,0.0013214951613917947,2025-07-15 20:51:00.124815,2025-07-15 20:51:31.105815,0 days 00:00:30.981000,identity,128,107,0.00034054152131633855,12,COMPLETE
238,7.991597158252262e-06,2025-07-15 20:51:31.106514,2025-07-15 20:54:13.065538,0 days 00:02:41.959024,identity,16,111,0.00039921731325581766,11,COMPLETE
239,5.16012687512557e-06,2025-07-15 20:54:13.066441,2025-07-15 20:56:02.321569,0 days 00:01:49.255128,identity,16,104,0.00031192782692829286,9,COMPLETE
240,7.30342026145081e-06,2025-07-15 20:56:02.322473,2025-07-15 20:58:08.777665,0 days 00:02:06.455192,identity,16,103,0.00022709216437083059,9,COMPLETE
241,1.0430441761855036e-05,2025-07-15 20:58:08.778548,2025-07-15 21:00:54.915408,0 days 00:02:46.136860,identity,16,106,0.0003181143361429115,10,COMPLETE
242,6.083571406634292e-06,2025-07-15 21:00:54.916425,2025-07-15 21:02:53.683962,0 days 00:01:58.767537,identity,16,104,0.00028573542200433205,9,COMPLETE
243,1.6031184713938273e-05,2025-07-15 21:02:53.684845,2025-07-15 21:04:04.371049,0 days 00:01:10.686204,identity,16,57,0.0003701142879365248,10,COMPLETE
244,7.730810466455296e-06,2025-07-15 21:04:04.371759,2025-07-15 21:06:09.034503,0 days 00:02:04.662744,identity,16,101,0.0002577778530545365,10,COMPLETE
245,1.1923571946681477e-05,2025-07-15 21:06:09.035410,2025-07-15 21:08:41.781590,0 days 00:02:32.746180,identity,16,109,0.00034144901972104876,11,COMPLETE
246,1.4012174688105006e-05,2025-07-15 21:08:41.782490,2025-07-15 21:10:53.102450,0 days 00:02:11.319960,identity,16,107,0.00030458351301354764,9,COMPLETE
247,9.380502888234332e-06,2025-07-15 21:10:53.103354,2025-07-15 21:13:01.837625,0 days 00:02:08.734271,identity,16,100,0.0002776914315412485,10,COMPLETE
248,5.1838687795680016e-05,2025-07-15 21:13:01.838501,2025-07-15 21:15:20.012363,0 days 00:02:18.173862,identity,16,113,0.001933981341111138,11,COMPLETE
249,5.887757652089931e-06,2025-07-15 21:15:20.013277,2025-07-15 21:16:53.531421,0 days 00:01:33.518144,identity,16,116,0.0003661727812405612,9,COMPLETE
250,1.8849466869141906e-05,2025-07-15 21:16:53.532387,2025-07-15 21:18:51.659168,0 days 00:01:58.126781,identity,16,104,0.0002475451887393715,10,COMPLETE
251,8.394881660933606e-06,2025-07-15 21:18:51.660069,2025-07-15 21:21:10.502369,0 days 00:02:18.842300,identity,16,110,0.0003187214717492106,10,COMPLETE
252,1.4761058082513046e-05,2025-07-15 21:21:10.503277,2025-07-15 21:23:19.850060,0 days 00:02:09.346783,identity,16,96,0.00041030547014915444,11,COMPLETE
253,8.372098818654194e-06,2025-07-15 21:23:19.850946,2025-07-15 21:25:23.782377,0 days 00:02:03.931431,relu,16,107,0.0003012610613393717,9,COMPLETE
254,1.0503386874916032e-05,2025-07-15 21:25:23.783289,2025-07-15 21:27:49.561853,0 days 00:02:25.778564,identity,16,103,0.0003594167731001716,10,COMPLETE
255,1.8709430150920525e-05,2025-07-15 21:27:49.562747,2025-07-15 21:31:20.266948,0 days 00:03:30.704201,identity,16,99,0.00033425446184158866,12,COMPLETE
256,5.112015060149133e-06,2025-07-15 21:31:20.267866,2025-07-15 21:34:09.348027,0 days 00:02:49.080161,identity,16,105,0.00026508344268869847,11,COMPLETE
257,1.5795261788298376e-05,2025-07-15 21:34:09.348911,2025-07-15 21:36:03.450005,0 days 00:01:54.101094,identity,16,105,0.00023541466774412885,9,COMPLETE
258,1.1825552974187303e-05,2025-07-15 21:36:03.450897,2025-07-15 21:38:43.831971,0 days 00:02:40.381074,identity,16,102,0.00026783059018967896,8,COMPLETE
259,5.028671694162767e-06,2025-07-15 21:38:43.832860,2025-07-15 21:41:40.278211,0 days 00:02:56.445351,identity,16,105,0.0002172656688735507,10,COMPLETE
260,6.291048521234188e-06,2025-07-15 21:41:40.279128,2025-07-15 21:43:52.073856,0 days 00:02:11.794728,identity,16,105,0.00022479041095769636,10,COMPLETE
261,5.356939709599828e-06,2025-07-15 21:43:52.074813,2025-07-15 21:45:53.324736,0 days 00:02:01.249923,identity,16,98,0.00028316564196114553,9,COMPLETE
262,0.00030886477907188237,2025-07-15 21:45:53.325684,2025-07-15 21:46:38.511669,0 days 00:00:45.185985,identity,32,97,0.0001824721109947023,9,COMPLETE
263,6.551190381287597e-06,2025-07-15 21:46:38.512377,2025-07-15 21:48:52.520780,0 days 00:02:14.008403,identity,16,100,0.0002141322674329337,9,COMPLETE
264,6.43967287032865e-05,2025-07-15 21:48:52.521784,2025-07-15 21:50:04.450934,0 days 00:01:11.929150,identity,16,41,0.00026447543603888834,10,COMPLETE
265,1.3739416317548603e-05,2025-07-15 21:50:04.451847,2025-07-15 21:52:34.699178,0 days 00:02:30.247331,identity,16,97,0.00028503972715924943,10,COMPLETE
266,1.9339047867106274e-05,2025-07-15 21:52:34.700085,2025-07-15 21:54:53.231046,0 days 00:02:18.530961,identity,16,103,0.0002432922130143525,9,COMPLETE
267,0.002782000694423914,2025-07-15 21:54:53.231967,2025-07-15 21:55:17.235417,0 days 00:00:24.003450,identity,128,101,0.00020270085286023488,10,COMPLETE
268,2.9065799026284367e-05,2025-07-15 21:55:17.236115,2025-07-15 21:57:11.873222,0 days 00:01:54.637107,identity,16,99,0.00012327461837631262,9,COMPLETE
269,7.473861387552461e-06,2025-07-15 21:57:11.874134,2025-07-15 21:59:08.467049,0 days 00:01:56.592915,identity,16,102,0.00028200033448053493,8,COMPLETE
270,2.2917503883945756e-05,2025-07-15 21:59:08.468031,2025-07-15 22:01:19.000565,0 days 00:02:10.532534,identity,16,96,0.00030194993479089446,10,COMPLETE
271,8.268025339930318e-06,2025-07-15 22:01:19.001487,2025-07-15 22:04:14.018288,0 days 00:02:55.016801,identity,16,105,0.0002512161726261798,11,COMPLETE
272,1.3186047077178955,2025-07-15 22:04:14.019226,2025-07-15 22:06:38.237479,0 days 00:02:24.218253,relu,16,99,0.0003940989474169193,10,COMPLETE
273,6.160740667837672e-06,2025-07-15 22:06:38.238407,2025-07-15 22:08:31.344777,0 days 00:01:53.106370,identity,16,106,0.00032706108905070666,9,COMPLETE
274,1.8191154595115222e-05,2025-07-15 22:08:31.345707,2025-07-15 22:11:05.365949,0 days 00:02:34.020242,identity,16,103,0.0002768279241091844,11,COMPLETE
275,4.4738149881595746e-05,2025-07-15 22:11:05.366877,2025-07-15 22:12:21.099357,0 days 00:01:15.732480,identity,16,70,0.00016301701208002684,10,COMPLETE
276,5.671135113516357e-06,2025-07-15 22:12:21.100122,2025-07-15 22:15:32.381953,0 days 00:03:11.281831,identity,16,107,0.0003051140257306432,8,COMPLETE
277,6.7518712967284955e-06,2025-07-15 22:15:32.382918,2025-07-15 22:17:29.051740,0 days 00:01:56.668822,identity,16,100,0.00034839085223960437,10,COMPLETE
278,0.00010084456152981147,2025-07-15 22:17:29.052642,2025-07-15 22:19:27.275906,0 days 00:01:58.223264,identity,16,104,0.003559276456154745,9,COMPLETE
279,5.945209068158874e-06,2025-07-15 22:19:27.276827,2025-07-15 22:21:54.120110,0 days 00:02:26.843283,identity,16,101,0.00042372171226956744,11,COMPLETE
280,9.345108082925435e-06,2025-07-15 22:21:54.121214,2025-07-15 22:24:01.629359,0 days 00:02:07.508145,identity,16,95,0.00021918751230855146,10,COMPLETE
281,1.2806981430912856e-05,2025-07-15 22:24:01.630276,2025-07-15 22:26:23.973508,0 days 00:02:22.343232,identity,16,108,0.0002612096596358963,10,COMPLETE
282,5.827108452649554e-06,2025-07-15 22:26:23.974465,2025-07-15 22:28:10.850235,0 days 00:01:46.875770,identity,16,98,0.0003738711775046654,9,COMPLETE
283,2.7165799110662192e-05,2025-07-15 22:28:10.851164,2025-07-15 22:29:55.195444,0 days 00:01:44.344280,identity,16,105,0.00029743648844211476,8,COMPLETE
284,6.236743956833379e-06,2025-07-15 22:29:55.196410,2025-07-15 22:31:49.796194,0 days 00:01:54.599784,identity,16,102,0.00032921209312567574,9,COMPLETE
