number,value,datetime_start,datetime_complete,duration,params_activation,params_batch_size,params_h,params_lr,params_seq_length,state
285,9.219804633175954e-05,2025-07-15 22:31:49.797156,2025-07-15 22:32:42.062001,0 days 00:00:52.264845,identity,32,112,0.000194445355358121,11,COMPLETE
286,4.96431857754942e-06,2025-07-15 22:32:42.062727,2025-07-15 22:34:55.700539,0 days 00:02:13.637812,identity,16,107,0.00026525022641432454,10,COMPLETE
287,7.197560989880003e-06,2025-07-15 22:34:55.701482,2025-07-15 22:37:07.009150,0 days 00:02:11.307668,identity,16,109,0.00022851023194347817,10,COMPLETE
288,8.669790076965e-06,2025-07-15 22:37:07.010037,2025-07-15 22:39:23.806970,0 days 00:02:16.796933,identity,16,114,0.00025487862365004973,9,COMPLETE
289,0.0014871973544359207,2025-07-15 22:39:23.807894,2025-07-15 22:39:49.367958,0 days 00:00:25.560064,identity,128,118,0.00026885628079659614,10,COMPLETE
290,1.1427767276472878e-05,2025-07-15 22:39:49.368678,2025-07-15 22:42:15.180843,0 days 00:02:25.812165,identity,16,106,0.00023072858577984618,10,COMPLETE
291,2.030819632636849e-05,2025-07-15 22:42:15.181749,2025-07-15 22:44:26.598590,0 days 00:02:11.416841,identity,16,109,0.00026825337270584626,9,COMPLETE
292,1.3186047077178955,2025-07-15 22:44:26.599531,2025-07-15 22:46:33.191960,0 days 00:02:06.592429,relu,16,107,0.0002879280922322755,10,COMPLETE
293,1.4831045518803876e-05,2025-07-15 22:46:33.192902,2025-07-15 22:48:30.623664,0 days 00:01:57.430762,identity,16,111,0.00038304239875224183,10,COMPLETE
294,1.397729374730261e-05,2025-07-15 22:48:30.624540,2025-07-15 22:50:32.574170,0 days 00:02:01.949630,identity,16,94,0.0002474965844092556,11,COMPLETE
295,1.1224056834180374e-05,2025-07-15 22:50:32.575075,2025-07-15 22:52:31.925827,0 days 00:01:59.350752,identity,16,103,0.000335799207364925,9,COMPLETE
296,2.6561776394373737e-05,2025-07-15 22:52:31.926740,2025-07-15 22:55:04.618293,0 days 00:02:32.691553,identity,16,106,0.00021133484903250994,8,COMPLETE
297,1.5062561942613684e-05,2025-07-15 22:55:04.619252,2025-07-15 22:57:00.164672,0 days 00:01:55.545420,identity,16,97,0.00029046929839097286,10,COMPLETE
298,5.620845968223875e-06,2025-07-15 22:57:00.165585,2025-07-15 22:58:50.151134,0 days 00:01:49.985549,identity,16,101,0.00045180087724580814,9,COMPLETE
299,0.001161120948381722,2025-07-15 22:58:50.152122,2025-07-15 22:59:23.392974,0 days 00:00:33.240852,identity,64,116,0.00031622479822726335,10,COMPLETE
300,1.6258127288892865e-05,2025-07-15 22:59:23.393706,2025-07-15 23:01:44.974507,0 days 00:02:21.580801,identity,16,104,0.0003556400076843671,11,COMPLETE
301,7.748676580376923e-06,2025-07-15 23:01:44.975415,2025-07-15 23:04:37.744229,0 days 00:02:52.768814,identity,16,110,0.00023622283834319986,15,COMPLETE
302,2.014377787418198e-05,2025-07-15 23:04:37.745158,2025-07-15 23:06:21.491031,0 days 00:01:43.745873,identity,16,107,0.00027611177812252,8,COMPLETE
303,7.100760740286205e-06,2025-07-15 23:06:21.491949,2025-07-15 23:08:18.937794,0 days 00:01:57.445845,identity,16,113,0.00039870584776227494,10,COMPLETE
304,2.182897151215002e-05,2025-07-15 23:08:18.938705,2025-07-15 23:10:23.303345,0 days 00:02:04.364640,identity,16,100,0.0003052812263750857,11,COMPLETE
305,7.187772553152172e-06,2025-07-15 23:10:23.304263,2025-07-15 23:12:20.222313,0 days 00:01:56.918050,identity,16,104,0.0002510391972345525,10,COMPLETE
306,6.457269591919612e-06,2025-07-15 23:12:20.223309,2025-07-15 23:14:57.173769,0 days 00:02:36.950460,identity,16,108,0.00034639769167723624,9,COMPLETE
307,6.884115919092437e-06,2025-07-15 23:14:57.174757,2025-07-15 23:17:08.691741,0 days 00:02:11.516984,identity,16,98,0.00041624249152111704,9,COMPLETE
308,1.1020164492947515e-05,2025-07-15 23:17:08.692684,2025-07-15 23:19:24.693845,0 days 00:02:16.001161,identity,16,102,0.0002911821280195908,10,COMPLETE
309,0.0005883514531888068,2025-07-15 23:19:24.694806,2025-07-15 23:20:12.065418,0 days 00:00:47.370612,identity,32,80,0.00019922435125202192,12,COMPLETE
310,1.165532103186706e-05,2025-07-15 23:20:12.066137,2025-07-15 23:22:42.099334,0 days 00:02:30.033197,identity,16,111,0.0003271572381250646,11,COMPLETE
311,1.2233917914272752e-05,2025-07-15 23:22:42.100263,2025-07-15 23:25:44.258934,0 days 00:03:02.158671,identity,16,105,0.001471858115978698,8,COMPLETE
312,5.813461939396802e-06,2025-07-15 23:25:44.259865,2025-07-15 23:27:38.835642,0 days 00:01:54.575777,identity,16,108,0.0002677090202001129,10,COMPLETE
313,1.3189793825149536,2025-07-15 23:27:38.836602,2025-07-15 23:30:17.974942,0 days 00:02:39.138340,relu,16,100,0.00037450662973834137,9,COMPLETE
314,0.0007717266562394798,2025-07-15 23:30:17.975862,2025-07-15 23:30:40.521731,0 days 00:00:22.545869,identity,128,96,0.0009081665550682983,11,COMPLETE
315,2.5139152057818137e-05,2025-07-15 23:30:40.522478,2025-07-15 23:32:50.239569,0 days 00:02:09.717091,identity,16,103,0.00023470882841624267,9,COMPLETE
316,4.719399385066936e-06,2025-07-15 23:32:50.240479,2025-07-15 23:35:04.965777,0 days 00:02:14.725298,identity,16,106,0.0003134692961917565,10,COMPLETE
317,9.037915333465207e-06,2025-07-15 23:35:04.966709,2025-07-15 23:37:18.886174,0 days 00:02:13.919465,identity,16,115,0.0003511135567107654,10,COMPLETE
318,6.104225121816853e-06,2025-07-15 23:37:18.887121,2025-07-15 23:39:20.857888,0 days 00:02:01.970767,identity,16,105,0.0003203664900961127,7,COMPLETE
319,1.3520158972823992e-05,2025-07-15 23:39:20.858839,2025-07-15 23:41:00.833716,0 days 00:01:39.974877,identity,16,93,0.00027757667395788443,8,COMPLETE
320,4.884720510744955e-06,2025-07-15 23:41:00.834645,2025-07-15 23:43:21.974318,0 days 00:02:21.139673,identity,16,102,0.0003862527796834429,10,COMPLETE
321,6.238436526473379e-06,2025-07-15 23:43:21.975234,2025-07-15 23:45:19.559723,0 days 00:01:57.584489,identity,16,102,0.00041756384027236143,10,COMPLETE
322,1.1738862667698413e-05,2025-07-15 23:45:19.560651,2025-07-15 23:47:36.936442,0 days 00:02:17.375791,identity,16,110,0.00025481206026105877,11,COMPLETE
323,4.8364199756179005e-06,2025-07-15 23:47:36.937402,2025-07-15 23:49:37.074436,0 days 00:02:00.137034,identity,16,106,0.00021773768889590765,10,COMPLETE
324,0.0010021826019510627,2025-07-15 23:49:37.075369,2025-07-15 23:50:10.395764,0 days 00:00:33.320395,identity,64,106,0.00018925880914259641,10,COMPLETE
325,1.3679336007044185e-05,2025-07-15 23:50:10.396519,2025-07-15 23:53:09.376330,0 days 00:02:58.979811,identity,16,112,0.00021774087759504114,11,COMPLETE
326,1.2772494301316328e-05,2025-07-15 23:53:09.377267,2025-07-15 23:55:22.596428,0 days 00:02:13.219161,identity,16,108,0.00021657018641728566,10,COMPLETE
327,2.1625313820550218e-05,2025-07-15 23:55:22.597484,2025-07-15 23:57:38.249140,0 days 00:02:15.651656,identity,16,104,0.00017692083457677548,10,COMPLETE
328,9.190807759296149e-06,2025-07-15 23:57:38.250075,2025-07-15 23:59:43.784860,0 days 00:02:05.534785,identity,16,109,0.00023829888229022307,9,COMPLETE
329,7.601372089993674e-06,2025-07-15 23:59:43.785812,2025-07-16 00:04:18.918911,0 days 00:04:35.133099,identity,16,106,0.00020225441577757892,11,COMPLETE
330,1.914103631861508e-05,2025-07-16 00:04:18.919879,2025-07-16 00:07:04.338312,0 days 00:02:45.418433,identity,16,113,0.0003859033648992428,12,COMPLETE
331,1.0100777217303403e-05,2025-07-16 00:07:04.339259,2025-07-16 00:08:52.059416,0 days 00:01:47.720157,identity,16,121,0.0004579225130686068,10,COMPLETE
332,1.082631843019044e-05,2025-07-16 00:08:52.060316,2025-07-16 00:10:44.437947,0 days 00:01:52.377631,relu,16,105,0.00048339956792096934,9,COMPLETE
333,6.712596132274484e-06,2025-07-16 00:10:44.438963,2025-07-16 00:12:54.358519,0 days 00:02:09.919556,identity,16,110,0.00023981106382487218,10,COMPLETE
334,4.410421752254479e-06,2025-07-16 00:12:54.359455,2025-07-16 00:14:43.766686,0 days 00:01:49.407231,identity,16,118,0.0002626479635019017,11,COMPLETE
335,1.3746003787673544e-05,2025-07-16 00:14:43.767610,2025-07-16 00:15:41.539705,0 days 00:00:57.772095,identity,32,119,0.00021397783556036562,11,COMPLETE
336,5.764201887359377e-06,2025-07-16 00:15:41.540433,2025-07-16 00:17:26.858236,0 days 00:01:45.317803,identity,16,116,0.00025108457196055726,11,COMPLETE
337,0.007823724299669266,2025-07-16 00:17:26.859188,2025-07-16 00:19:38.723210,0 days 00:02:11.864022,identity,16,114,0.006255967104659811,12,COMPLETE
338,0.00014953310892451555,2025-07-16 00:19:38.724162,2025-07-16 00:20:48.735797,0 days 00:01:10.011635,identity,16,25,0.00037619851181575526,11,COMPLETE
339,1.0914738595602103e-05,2025-07-16 00:20:48.736722,2025-07-16 00:22:42.174015,0 days 00:01:53.437293,identity,16,122,0.0003243120912481673,11,COMPLETE
340,1.2433933989086654e-05,2025-07-16 00:22:42.174944,2025-07-16 00:25:16.860031,0 days 00:02:34.685087,identity,16,107,0.0004343049817347369,12,COMPLETE
341,5.0098819883714896e-06,2025-07-16 00:25:16.860974,2025-07-16 00:26:59.583547,0 days 00:01:42.722573,identity,16,119,0.0002547777529331607,10,COMPLETE
342,4.75201750305132e-06,2025-07-16 00:26:59.584471,2025-07-16 00:28:43.685578,0 days 00:01:44.101107,identity,16,123,0.00022998117257683927,10,COMPLETE
343,0.001933456864207983,2025-07-16 00:28:43.686535,2025-07-16 00:29:12.667310,0 days 00:00:28.980775,identity,128,124,0.00022545106078194753,11,COMPLETE
344,7.86781674833037e-06,2025-07-16 00:29:12.668053,2025-07-16 00:30:54.715796,0 days 00:01:42.047743,identity,16,118,0.00021116005652876117,10,COMPLETE
345,1.5075120245455764e-05,2025-07-16 00:30:54.716751,2025-07-16 00:32:33.592395,0 days 00:01:38.875644,identity,16,116,0.00016999262370081514,10,COMPLETE
346,7.896475835877936e-06,2025-07-16 00:32:33.593376,2025-07-16 00:34:18.122411,0 days 00:01:44.529035,identity,16,125,0.00024177154860218847,10,COMPLETE
347,1.7276437574764714e-05,2025-07-16 00:34:18.123523,2025-07-16 00:36:03.162251,0 days 00:01:45.038728,identity,16,120,0.00018742969474754587,11,COMPLETE
348,1.0336660125176422e-05,2025-07-16 00:36:03.163213,2025-07-16 00:37:45.366487,0 days 00:01:42.203274,identity,16,122,0.0002599487136471928,10,COMPLETE
349,0.0011376994661986828,2025-07-16 00:37:45.367502,2025-07-16 00:38:21.108345,0 days 00:00:35.740843,identity,64,120,0.00023394300963213422,11,COMPLETE
350,6.468688752647722e-06,2025-07-16 00:38:21.109092,2025-07-16 00:40:11.835703,0 days 00:01:50.726611,identity,16,123,0.00020011990392465376,11,COMPLETE
351,6.7434684751788154e-06,2025-07-16 00:40:11.836633,2025-07-16 00:41:58.357237,0 days 00:01:46.520604,identity,16,127,0.00026454840746066696,10,COMPLETE
352,1.386351232213201e-05,2025-07-16 00:41:58.358200,2025-07-16 00:43:41.602441,0 days 00:01:43.244241,relu,16,119,0.00022649994454968216,10,COMPLETE
353,1.5947347492328845e-05,2025-07-16 00:43:41.603420,2025-07-16 00:45:34.185998,0 days 00:01:52.582578,identity,16,117,0.00026554020683499144,12,COMPLETE
354,5.101999249745859e-06,2025-07-16 00:45:34.186967,2025-07-16 00:47:17.903539,0 days 00:01:43.716572,identity,16,126,0.00024715788471631656,10,COMPLETE
355,1.588174382050056e-05,2025-07-16 00:47:17.904636,2025-07-16 00:49:03.817153,0 days 00:01:45.912517,identity,16,127,0.00022190862220868466,10,COMPLETE
356,5.02300963489688e-06,2025-07-16 00:49:03.818081,2025-07-16 00:50:44.720179,0 days 00:01:40.902098,identity,16,124,0.000249827374786043,10,COMPLETE
357,6.983736057009082e-06,2025-07-16 00:50:44.721139,2025-07-16 00:52:35.673279,0 days 00:01:50.952140,identity,16,123,0.00024540044325441874,11,COMPLETE
358,1.554358641442377e-05,2025-07-16 00:52:35.674219,2025-07-16 00:54:19.575919,0 days 00:01:43.901700,identity,16,126,0.0002774608181993366,10,COMPLETE
359,7.3554765549488366e-06,2025-07-16 00:54:19.576850,2025-07-16 00:56:12.651323,0 days 00:01:53.074473,identity,16,127,0.0001970501326440595,11,COMPLETE
360,5.7557670515961945e-05,2025-07-16 00:56:12.652289,2025-07-16 00:57:56.423497,0 days 00:01:43.771208,identity,16,123,0.0023744499511678847,10,COMPLETE
361,7.791142706992105e-06,2025-07-16 00:57:56.424421,2025-07-16 00:58:49.958844,0 days 00:00:53.534423,identity,32,124,0.00021209343163632147,10,COMPLETE
362,1.2619184417417273e-05,2025-07-16 00:58:49.959575,2025-07-16 01:00:39.312348,0 days 00:01:49.352773,identity,16,121,0.0002670300767100951,11,COMPLETE
363,5.353906090022065e-06,2025-07-16 01:00:39.313275,2025-07-16 01:02:21.156621,0 days 00:01:41.843346,identity,16,118,0.00023364419127112776,10,COMPLETE
364,1.003062970994506e-05,2025-07-16 01:02:21.157553,2025-07-16 01:04:00.143094,0 days 00:01:38.985541,identity,16,128,0.00028250832258639445,10,COMPLETE
365,1.3325541658559814e-05,2025-07-16 01:04:00.144037,2025-07-16 01:05:51.637673,0 days 00:01:51.493636,identity,16,125,0.0002463477344179261,11,COMPLETE
366,0.001532643218524754,2025-07-16 01:05:51.638635,2025-07-16 01:06:20.061257,0 days 00:00:28.422622,identity,128,125,0.0002988467906699194,10,COMPLETE
367,5.2361788220878225e-06,2025-07-16 01:06:20.062019,2025-07-16 01:07:54.764756,0 days 00:01:34.702737,identity,16,117,0.0002588194004524975,9,COMPLETE
368,7.032121175143402e-06,2025-07-16 01:07:54.765729,2025-07-16 01:09:57.746941,0 days 00:02:02.981212,identity,16,121,0.00022331129263474276,13,COMPLETE
369,1.2623853763216175e-05,2025-07-16 01:09:57.747884,2025-07-16 01:11:42.637484,0 days 00:01:44.889600,identity,16,120,0.0003003123995071985,11,COMPLETE
370,1.3173638762964401e-05,2025-07-16 01:11:42.638471,2025-07-16 01:14:00.726984,0 days 00:02:18.088513,identity,16,112,0.00027136627899374026,12,COMPLETE
371,7.082453521434218e-06,2025-07-16 01:14:00.727939,2025-07-16 01:16:27.253565,0 days 00:02:26.525626,identity,16,123,0.00017836892320453938,14,COMPLETE
372,1.3186047077178955,2025-07-16 01:16:27.254551,2025-07-16 01:18:50.769233,0 days 00:02:23.514682,relu,16,115,0.000242737034417313,10,COMPLETE
373,1.1744667062885128e-05,2025-07-16 01:18:50.770189,2025-07-16 01:20:32.140245,0 days 00:01:41.370056,identity,16,118,0.0002081594440512294,10,COMPLETE
374,1.006541060633026e-05,2025-07-16 01:20:32.141228,2025-07-16 01:22:04.679628,0 days 00:01:32.538400,identity,16,128,0.0003129172242174645,9,COMPLETE
375,4.956704287906177e-06,2025-07-16 01:22:04.680389,2025-07-16 01:24:19.385969,0 days 00:02:14.705580,identity,16,114,0.00028413656022154173,10,COMPLETE
376,0.0012542750919237733,2025-07-16 01:24:19.386949,2025-07-16 01:24:47.164685,0 days 00:00:27.777736,identity,64,75,0.0002846176347315374,9,COMPLETE
377,4.872522822552128e-06,2025-07-16 01:24:47.165419,2025-07-16 01:27:07.987778,0 days 00:02:20.822359,identity,16,114,0.00023202890568384133,10,COMPLETE
378,1.5093451111169998e-05,2025-07-16 01:27:07.988759,2025-07-16 01:29:33.899541,0 days 00:02:25.910782,identity,16,114,0.0001895184314123667,11,COMPLETE
379,1.0508088962524198e-05,2025-07-16 01:29:33.900484,2025-07-16 01:31:55.201355,0 days 00:02:21.300871,identity,16,115,0.0002254920430735387,10,COMPLETE
380,2.1039370039943606e-05,2025-07-16 01:31:55.202362,2025-07-16 01:33:47.773418,0 days 00:01:52.571056,identity,16,119,0.00015607082330392326,12,COMPLETE
381,2.1481300791492686e-05,2025-07-16 01:33:47.774376,2025-07-16 01:36:07.529732,0 days 00:02:19.755356,identity,16,112,0.00020609436091893488,11,COMPLETE
382,2.9624812668771483e-05,2025-07-16 01:36:07.530673,2025-07-16 01:37:20.733181,0 days 00:01:13.202508,identity,16,46,0.00024942396659102974,10,COMPLETE
383,4.798775989911519e-06,2025-07-16 01:37:20.734114,2025-07-16 01:39:09.472909,0 days 00:01:48.738795,identity,16,121,0.00023661472669730333,11,COMPLETE
384,1.1885004823852796e-05,2025-07-16 01:39:09.473858,2025-07-16 01:40:58.002688,0 days 00:01:48.528830,identity,16,123,0.00021820541010317092,11,COMPLETE
385,1.0656460290192626e-05,2025-07-16 01:40:58.003674,2025-07-16 01:42:46.685250,0 days 00:01:48.681576,identity,16,121,0.00023090871218700207,11,COMPLETE
386,1.8002134311245754e-05,2025-07-16 01:42:46.686283,2025-07-16 01:44:41.033050,0 days 00:01:54.346767,identity,16,125,0.00018850058776898257,12,COMPLETE
387,5.954325388302095e-06,2025-07-16 01:44:41.034024,2025-07-16 01:45:40.881617,0 days 00:00:59.847593,identity,32,121,0.0002458136377123381,11,COMPLETE
388,1.0867632227018476e-05,2025-07-16 01:45:40.882352,2025-07-16 01:48:16.780329,0 days 00:02:35.897977,identity,16,117,0.00020314384345578281,13,COMPLETE
389,1.0568098332441878e-05,2025-07-16 01:48:16.781339,2025-07-16 01:50:48.981304,0 days 00:02:32.199965,identity,16,110,0.00023170505847926865,12,COMPLETE
390,4.527601777226664e-05,2025-07-16 01:50:48.982331,2025-07-16 01:52:01.840010,0 days 00:01:12.857679,identity,16,60,0.0002167484750521338,10,COMPLETE
391,8.17817090137396e-06,2025-07-16 01:52:01.840991,2025-07-16 01:53:49.770030,0 days 00:01:47.929039,identity,16,122,0.00025691514374839007,11,COMPLETE
392,1.550063279864844e-05,2025-07-16 01:53:49.770977,2025-07-16 01:55:32.098322,0 days 00:01:42.327345,identity,16,126,0.000263869612382863,10,COMPLETE
393,0.0037185733672231436,2025-07-16 01:55:32.099299,2025-07-16 01:56:15.817356,0 days 00:00:43.718057,relu,128,109,0.00023365651999281205,19,COMPLETE
394,7.783735782140866e-06,2025-07-16 01:56:15.818158,2025-07-16 01:58:03.063732,0 days 00:01:47.245574,identity,16,118,0.00025873857368114415,11,COMPLETE
395,6.58202770864591e-06,2025-07-16 01:58:03.064779,2025-07-16 02:00:55.237997,0 days 00:02:52.173218,identity,16,113,0.00020715805893849515,10,COMPLETE
396,4.862953574047424e-06,2025-07-16 02:00:55.239002,2025-07-16 02:02:38.869046,0 days 00:01:43.630044,identity,16,125,0.0002809316279002271,10,COMPLETE
397,9.858959856501315e-06,2025-07-16 02:02:38.870060,2025-07-16 02:05:57.095463,0 days 00:03:18.225403,identity,16,125,0.0002824876086544759,24,COMPLETE
398,6.408499757526442e-06,2025-07-16 02:05:57.096433,2025-07-16 02:07:35.899557,0 days 00:01:38.803124,identity,16,128,0.0003356224513713561,10,COMPLETE
399,4.9699292503646575e-06,2025-07-16 02:07:35.900505,2025-07-16 02:09:18.494277,0 days 00:01:42.593772,identity,16,123,0.0002403737461465316,10,COMPLETE
400,5.680424237652915e-06,2025-07-16 02:09:18.495284,2025-07-16 02:11:00.841142,0 days 00:01:42.345858,identity,16,123,0.00018399686830451685,10,COMPLETE
401,9.495649464952294e-06,2025-07-16 02:11:00.842100,2025-07-16 02:11:36.042318,0 days 00:00:35.200218,identity,64,120,0.0007706195739791962,10,COMPLETE
402,1.4367030416906346e-05,2025-07-16 02:11:36.043097,2025-07-16 02:13:07.772355,0 days 00:01:31.729258,identity,16,120,0.0002341069566568333,9,COMPLETE
403,8.867782526067458e-06,2025-07-16 02:13:07.773403,2025-07-16 02:14:49.346779,0 days 00:01:41.573376,identity,16,122,0.00028618519303345033,10,COMPLETE
404,1.089678789867321e-05,2025-07-16 02:14:49.347741,2025-07-16 02:16:30.785975,0 days 00:01:41.438234,identity,16,119,0.00019770702812383012,10,COMPLETE
405,9.943286386260297e-06,2025-07-16 02:16:30.786940,2025-07-16 02:18:17.386522,0 days 00:01:46.599582,identity,16,124,0.0005175011657821431,11,COMPLETE
406,1.2445721949916333e-05,2025-07-16 02:18:17.387519,2025-07-16 02:19:50.038623,0 days 00:01:32.651104,identity,16,116,0.00022694416093565077,9,COMPLETE
407,1.2227080333104823e-05,2025-07-16 02:19:50.039639,2025-07-16 02:21:37.299023,0 days 00:01:47.259384,identity,16,117,0.00033368652298543754,11,COMPLETE
408,6.928597485966748e-06,2025-07-16 02:21:37.299975,2025-07-16 02:23:42.598175,0 days 00:02:05.298200,identity,16,111,0.00027007902119504957,9,COMPLETE
409,5.083617452328326e-06,2025-07-16 02:23:42.599216,2025-07-16 02:25:22.875459,0 days 00:01:40.276243,identity,16,124,0.00030600511872682994,10,COMPLETE
410,8.833651918394025e-06,2025-07-16 02:25:22.876443,2025-07-16 02:27:38.149633,0 days 00:02:15.273190,identity,16,114,0.00024278195872755177,10,COMPLETE
411,7.915477908682078e-06,2025-07-16 02:27:38.150617,2025-07-16 02:29:53.171002,0 days 00:02:15.020385,identity,16,108,0.00028271432234898175,10,COMPLETE
412,1.193684965983266e-05,2025-07-16 02:29:53.171983,2025-07-16 02:31:42.095657,0 days 00:01:48.923674,relu,16,121,0.00021138557778875504,11,COMPLETE
413,6.318844953057123e-06,2025-07-16 02:31:42.096617,2025-07-16 02:33:50.206386,0 days 00:02:08.109769,identity,16,102,0.00035256570504082005,9,COMPLETE
414,1.6335019608959556e-05,2025-07-16 02:33:50.207398,2025-07-16 02:36:10.662266,0 days 00:02:20.454868,identity,16,110,0.00025555304250370915,10,COMPLETE
415,0.0001938855421030894,2025-07-16 02:36:10.663272,2025-07-16 02:37:21.143483,0 days 00:01:10.480211,identity,16,29,0.00030146787649822847,11,COMPLETE
416,0.00015150241961237043,2025-07-16 02:37:21.144263,2025-07-16 02:38:23.111358,0 days 00:01:01.967095,identity,32,84,0.00022069687454903127,16,COMPLETE
417,6.6521911321615335e-06,2025-07-16 02:38:23.112141,2025-07-16 02:40:37.553424,0 days 00:02:14.441283,identity,16,112,0.0002624951417390685,10,COMPLETE
418,0.0006263960967771709,2025-07-16 02:40:37.554368,2025-07-16 02:41:02.660975,0 days 00:00:25.106607,identity,128,118,0.000337417089949246,9,COMPLETE
419,1.2201705430925358e-05,2025-07-16 02:41:02.661798,2025-07-16 02:42:21.467030,0 days 00:01:18.805232,identity,16,108,0.0004025392556270371,5,COMPLETE
420,1.2225630598550197e-05,2025-07-16 02:42:21.468037,2025-07-16 02:44:53.464141,0 days 00:02:31.996104,identity,16,106,0.0002881286651284476,11,COMPLETE
421,9.966830475605093e-06,2025-07-16 02:44:53.465171,2025-07-16 02:46:35.312423,0 days 00:01:41.847252,identity,16,122,0.0002397362877605836,10,COMPLETE
422,1.5304387488868088e-05,2025-07-16 02:46:35.313403,2025-07-16 02:48:54.417557,0 days 00:02:19.104154,identity,16,115,0.00020332602028661065,10,COMPLETE
423,1.9783794414252043e-05,2025-07-16 02:48:54.418534,2025-07-16 02:51:29.010910,0 days 00:02:34.592376,identity,16,103,0.0012107897422595423,12,COMPLETE
424,0.0042796749621629715,2025-07-16 02:51:29.011901,2025-07-16 02:53:18.621867,0 days 00:01:49.609966,identity,16,125,0.004137775231556334,11,COMPLETE
425,9.162375135929324e-06,2025-07-16 02:53:18.622892,2025-07-16 02:57:16.444990,0 days 00:03:57.822098,identity,16,101,0.0001689053238931189,20,COMPLETE
426,0.0007901605567894876,2025-07-16 02:57:16.445958,2025-07-16 02:57:50.529048,0 days 00:00:34.083090,identity,64,119,0.000314132858940635,9,COMPLETE
