number,value,datetime_start,datetime_complete,duration,params_activation,params_batch_size,params_h,params_lr,params_seq_length,state
285,3.3478436307632364e-06,2025-07-07 22:18:40.918423,2025-07-07 22:21:09.921988,0 days 00:02:29.003565,identity,16,122,0.00017364055955085083,19,COMPLETE
286,3.622463964347844e-06,2025-07-07 22:21:09.922780,2025-07-07 22:23:41.456511,0 days 00:02:31.533731,identity,16,125,0.0001443356399130328,19,COMPLETE
287,3.5613061299955007e-06,2025-07-07 22:23:41.457357,2025-07-07 22:26:21.188415,0 days 00:02:39.731058,identity,16,95,0.00017956846444115823,18,COMPLETE
288,3.4435922771081096e-06,2025-07-07 22:26:21.189210,2025-07-07 22:28:57.991532,0 days 00:02:36.802322,identity,16,122,0.00015483679317976825,20,COMPLETE
289,3.491849383863155e-06,2025-07-07 22:28:57.992358,2025-07-07 22:31:19.765274,0 days 00:02:21.772916,identity,16,118,0.00017416307723384353,18,COMPLETE
290,4.036643986182753e-06,2025-07-07 22:31:19.766067,2025-07-07 22:33:49.385004,0 days 00:02:29.618937,identity,16,126,0.00016400067578714383,18,COMPLETE
291,3.413951390029979e-06,2025-07-07 22:33:49.385892,2025-07-07 22:36:26.079716,0 days 00:02:36.693824,identity,16,122,0.0001256084090896658,20,COMPLETE
292,0.011649614199995995,2025-07-07 22:36:26.080532,2025-07-07 22:37:11.129682,0 days 00:00:45.049150,identity,128,124,0.00010014377373748373,18,COMPLETE
293,3.4930778838315746e-06,2025-07-07 22:37:11.130530,2025-07-07 22:38:53.528725,0 days 00:01:42.398195,identity,16,120,0.0001175386597687184,12,COMPLETE
294,9.868169399851467e-06,2025-07-07 22:38:53.529516,2025-07-07 22:40:38.981003,0 days 00:01:45.451487,identity,16,38,0.00013640538331455656,19,COMPLETE
295,3.620602910814341e-06,2025-07-07 22:40:38.981873,2025-07-07 22:43:16.035515,0 days 00:02:37.053642,identity,16,91,0.0001262143062953993,18,COMPLETE
296,1.3165440559387207,2025-07-07 22:43:16.036323,2025-07-07 22:45:59.963996,0 days 00:02:43.927673,relu,16,115,0.00010994950454239885,17,COMPLETE
297,3.4374907045275904e-06,2025-07-07 22:45:59.964855,2025-07-07 22:48:32.626612,0 days 00:02:32.661757,identity,16,126,0.00014914386499179726,19,COMPLETE
298,3.700323077282519e-06,2025-07-07 22:48:32.627408,2025-07-07 22:49:58.539554,0 days 00:01:25.912146,identity,16,122,0.00011696202863982956,9,COMPLETE
299,2.2565853214473464e-05,2025-07-07 22:49:58.540397,2025-07-07 22:52:19.282731,0 days 00:02:20.742334,identity,16,117,0.002720348976500195,18,COMPLETE
300,3.5466016470309114e-06,2025-07-07 22:52:19.283524,2025-07-07 22:54:55.706917,0 days 00:02:36.423393,identity,16,124,0.00013308207272443246,20,COMPLETE
301,5.155632607056759e-05,2025-07-07 22:54:55.707742,2025-07-07 22:55:54.707776,0 days 00:00:59.000034,identity,32,75,0.00010845369665031732,15,COMPLETE
302,3.6038861708220793e-06,2025-07-07 22:55:54.708564,2025-07-07 22:58:23.256583,0 days 00:02:28.548019,identity,16,128,0.00016727456788676555,19,COMPLETE
303,6.7146179389965255e-06,2025-07-07 22:58:23.257440,2025-07-07 23:00:08.064374,0 days 00:01:44.806934,identity,16,47,0.00012114021858901106,18,COMPLETE
304,6.08180062044994e-06,2025-07-07 23:00:08.065195,2025-07-07 23:01:39.372676,0 days 00:01:31.307481,identity,16,24,0.0001348691113293955,17,COMPLETE
305,3.792518555201241e-06,2025-07-07 23:01:39.373518,2025-07-07 23:04:01.229589,0 days 00:02:21.856071,identity,16,119,0.00011508192438874315,18,COMPLETE
306,3.428362788326922e-06,2025-07-07 23:04:01.230374,2025-07-07 23:06:57.029630,0 days 00:02:55.799256,identity,16,114,0.00019568320519555056,19,COMPLETE
307,3.572435616661096e-06,2025-07-07 23:06:57.030514,2025-07-07 23:09:19.471694,0 days 00:02:22.441180,identity,16,121,0.00015317119905167566,18,COMPLETE
308,4.5069773477735e-06,2025-07-07 23:09:19.472504,2025-07-07 23:11:57.201312,0 days 00:02:37.728808,identity,16,126,0.00010119357765179084,20,COMPLETE
309,7.989495497895405e-05,2025-07-07 23:11:57.202175,2025-07-07 23:12:54.275386,0 days 00:00:57.073211,identity,64,123,0.00012651137263601617,18,COMPLETE
310,3.5866830785380444e-06,2025-07-07 23:12:54.276185,2025-07-07 23:15:30.182724,0 days 00:02:35.906539,identity,16,110,0.00014122499988296594,17,COMPLETE
311,3.3543303743499564e-06,2025-07-07 23:15:30.183569,2025-07-07 23:17:58.261549,0 days 00:02:28.077980,identity,16,119,0.00011077024475642518,19,COMPLETE
312,3.4356194191786926e-06,2025-07-07 23:17:58.262330,2025-07-07 23:20:26.070056,0 days 00:02:27.807726,identity,16,125,0.00012551727580625924,18,COMPLETE
313,3.532415803420008e-06,2025-07-07 23:20:26.070890,2025-07-07 23:22:55.042863,0 days 00:02:28.971973,identity,16,122,0.00011566630010429906,19,COMPLETE
314,0.014078940264880657,2025-07-07 23:22:55.043660,2025-07-07 23:23:37.076788,0 days 00:00:42.033128,identity,128,116,0.00010005922998313559,18,COMPLETE
315,3.4293541375518544e-06,2025-07-07 23:23:37.077644,2025-07-07 23:26:05.731157,0 days 00:02:28.653513,identity,16,128,0.0001382158815892879,19,COMPLETE
316,1.316388487815857,2025-07-07 23:26:05.732006,2025-07-07 23:28:27.492644,0 days 00:02:21.760638,relu,16,120,0.00012440448942294618,18,COMPLETE
317,3.326235855638515e-06,2025-07-07 23:28:27.493499,2025-07-07 23:31:04.105941,0 days 00:02:36.612442,identity,16,124,0.00016234283031176314,20,COMPLETE
318,3.564148300938541e-06,2025-07-07 23:31:04.106752,2025-07-07 23:33:42.206124,0 days 00:02:38.099372,identity,16,125,0.0001829354234173375,20,COMPLETE
319,3.3609212550800294e-06,2025-07-07 23:33:42.206962,2025-07-07 23:36:18.081097,0 days 00:02:35.874135,identity,16,124,0.00017025090805840073,20,COMPLETE
320,3.5833163565257564e-06,2025-07-07 23:36:18.081914,2025-07-07 23:38:56.595314,0 days 00:02:38.513400,identity,16,126,0.0001588424685342802,20,COMPLETE
321,3.5284911064081825e-06,2025-07-07 23:38:56.596183,2025-07-07 23:41:34.049974,0 days 00:02:37.453791,identity,16,123,0.00015012816270516097,20,COMPLETE
322,3.5232867503509624e-06,2025-07-07 23:41:34.050760,2025-07-07 23:44:08.995600,0 days 00:02:34.944840,identity,16,118,0.0001410685622973976,20,COMPLETE
323,5.178867468202952e-06,2025-07-07 23:44:08.996445,2025-07-07 23:46:45.558006,0 days 00:02:36.561561,identity,16,128,0.0005422469352586906,20,COMPLETE
324,3.725044052771409e-06,2025-07-07 23:46:45.558852,2025-07-07 23:48:44.653285,0 days 00:01:59.094433,identity,16,122,0.0001614180415035008,14,COMPLETE
325,3.7190227430983214e-06,2025-07-07 23:48:44.654164,2025-07-07 23:51:17.776595,0 days 00:02:33.122431,identity,16,126,0.0002676086587142146,19,COMPLETE
326,2.8255490178707987e-05,2025-07-07 23:51:17.777414,2025-07-07 23:52:40.320143,0 days 00:01:22.542729,identity,32,119,0.0001320902362284865,19,COMPLETE
327,6.171313998493133e-06,2025-07-07 23:52:40.321004,2025-07-07 23:55:48.828878,0 days 00:03:08.507874,identity,16,114,0.0007553483797597395,20,COMPLETE
328,3.5012426451430656e-06,2025-07-07 23:55:48.829692,2025-07-07 23:58:20.011164,0 days 00:02:31.181472,identity,16,124,0.00018028500318778397,19,COMPLETE
329,3.4262070585100446e-06,2025-07-07 23:58:20.011996,2025-07-08 00:00:56.959773,0 days 00:02:36.947777,identity,16,121,0.00015183761337669082,20,COMPLETE
330,3.475549647191656e-06,2025-07-08 00:00:56.960620,2025-07-08 00:03:28.867778,0 days 00:02:31.907158,identity,16,126,0.00020481461562958062,19,COMPLETE
331,3.345702680235263e-06,2025-07-08 00:03:28.868656,2025-07-08 00:05:50.654244,0 days 00:02:21.785588,identity,16,117,0.00011983811986414723,18,COMPLETE
332,3.3747269299055915e-06,2025-07-08 00:05:50.655059,2025-07-08 00:08:29.793553,0 days 00:02:39.138494,identity,16,111,0.00011934996456522547,17,COMPLETE
333,3.6221445043338463e-06,2025-07-08 00:08:29.794441,2025-07-08 00:10:50.243786,0 days 00:02:20.449345,identity,16,116,0.00012780702044088715,18,COMPLETE
334,0.0002744980447459966,2025-07-08 00:10:50.244633,2025-07-08 00:11:45.012852,0 days 00:00:54.768219,identity,64,117,0.00011280386848349394,18,COMPLETE
335,8.636478742118925e-05,2025-07-08 00:11:45.013696,2025-07-08 00:13:17.465953,0 days 00:01:32.452257,relu,16,8,0.00013688483757404995,18,COMPLETE
336,3.3587195957807126e-06,2025-07-08 00:13:17.466833,2025-07-08 00:15:59.688498,0 days 00:02:42.221665,identity,16,112,0.00012021383547829781,18,COMPLETE
337,3.448957841101219e-06,2025-07-08 00:15:59.689373,2025-07-08 00:18:22.272798,0 days 00:02:22.583425,identity,16,119,0.00010925172540679704,18,COMPLETE
338,3.818261120613897e-06,2025-07-08 00:18:22.273643,2025-07-08 00:21:01.508079,0 days 00:02:39.234436,identity,16,114,0.00012873702498562937,17,COMPLETE
339,0.00827792752534151,2025-07-08 00:21:01.508929,2025-07-08 00:21:46.024773,0 days 00:00:44.515844,identity,128,128,0.00014204668898746783,18,COMPLETE
340,4.566798452287912e-06,2025-07-08 00:21:46.025577,2025-07-08 00:23:58.577153,0 days 00:02:12.551576,identity,16,124,0.00041901752622080845,16,COMPLETE
341,3.667963710540789e-06,2025-07-08 00:23:58.578008,2025-07-08 00:26:19.418465,0 days 00:02:20.840457,identity,16,118,0.00011630101284941052,18,COMPLETE
342,4.3040690798079595e-06,2025-07-08 00:26:19.419295,2025-07-08 00:28:39.195583,0 days 00:02:19.776288,identity,16,116,0.00010894440157813651,18,COMPLETE
343,3.699980425153626e-06,2025-07-08 00:28:39.196436,2025-07-08 00:31:14.782012,0 days 00:02:35.585576,identity,16,121,0.00012911565253404255,20,COMPLETE
344,4.440796146809589e-06,2025-07-08 00:31:14.782827,2025-07-08 00:33:01.517952,0 days 00:01:46.735125,identity,16,53,0.0001211324403555286,18,COMPLETE
345,3.320554924357566e-06,2025-07-08 00:33:01.518857,2025-07-08 00:35:20.433111,0 days 00:02:18.914254,identity,16,124,0.00010742745054119196,17,COMPLETE
346,3.6985179576731753e-06,2025-07-08 00:35:20.433916,2025-07-08 00:37:34.285786,0 days 00:02:13.851870,identity,16,126,0.00010763724050446809,16,COMPLETE
347,3.404398512429907e-06,2025-07-08 00:37:34.286633,2025-07-08 00:39:53.399769,0 days 00:02:19.113136,identity,16,124,0.00010800066645563209,17,COMPLETE
348,3.636662540884572e-06,2025-07-08 00:39:53.400566,2025-07-08 00:42:11.628694,0 days 00:02:18.228128,identity,16,128,0.00011958975303376419,17,COMPLETE
349,3.4277120448678033e-06,2025-07-08 00:42:11.629551,2025-07-08 00:44:32.072094,0 days 00:02:20.442543,identity,16,123,0.00010832365881166176,17,COMPLETE
350,3.5727175600186456e-06,2025-07-08 00:44:32.072923,2025-07-08 00:46:52.331585,0 days 00:02:20.258662,identity,16,120,0.00011709842495565486,18,COMPLETE
351,1.4407449270947836e-05,2025-07-08 00:46:52.332429,2025-07-08 00:48:09.537238,0 days 00:01:17.204809,identity,32,126,0.0001322209850190969,17,COMPLETE
352,4.005913979199249e-06,2025-07-08 00:48:09.538071,2025-07-08 00:50:15.412992,0 days 00:02:05.874921,identity,16,123,0.00010189280399405244,15,COMPLETE
353,3.269880608058884e-06,2025-07-08 00:50:15.413863,2025-07-08 00:52:53.757195,0 days 00:02:38.343332,identity,16,98,0.00012407918563870106,18,COMPLETE
354,3.7239681205392117e-06,2025-07-08 00:52:53.758011,2025-07-08 00:55:23.906629,0 days 00:02:30.148618,identity,16,107,0.0001397434524568799,16,COMPLETE
355,3.7126339975657174e-06,2025-07-08 00:55:23.907492,2025-07-08 00:57:50.257767,0 days 00:02:26.350275,relu,16,128,0.00013123669758618555,18,COMPLETE
356,1.176045770989731e-05,2025-07-08 00:57:50.258554,2025-07-08 01:00:19.683171,0 days 00:02:29.424617,identity,16,125,0.004377920157601145,18,COMPLETE
357,3.4433869586791843e-06,2025-07-08 01:00:19.684032,2025-07-08 01:02:49.528203,0 days 00:02:29.844171,identity,16,81,0.00011182515599428294,18,COMPLETE
358,0.00024832927738316357,2025-07-08 01:02:49.528999,2025-07-08 01:03:43.513215,0 days 00:00:53.984216,identity,64,122,0.00012517501754661238,17,COMPLETE
359,3.777816345973406e-06,2025-07-08 01:03:43.514064,2025-07-08 01:06:15.520886,0 days 00:02:32.006822,identity,16,86,0.00014758434991674505,18,COMPLETE
360,3.7553793390543433e-06,2025-07-08 01:06:15.521712,2025-07-08 01:08:48.643838,0 days 00:02:33.122126,identity,16,125,0.0001062325578916399,19,COMPLETE
361,3.770439661821001e-06,2025-07-08 01:08:48.644703,2025-07-08 01:11:10.558143,0 days 00:02:21.913440,identity,16,120,0.00011721860866157409,18,COMPLETE
362,3.4469760521460557e-06,2025-07-08 01:11:10.558953,2025-07-08 01:13:41.903669,0 days 00:02:31.344716,identity,16,123,0.00012939431395249897,19,COMPLETE
363,3.6658252611232456e-06,2025-07-08 01:13:41.904506,2025-07-08 01:16:10.744467,0 days 00:02:28.839961,identity,16,126,0.00010024126345265759,18,COMPLETE
364,0.006525526754558086,2025-07-08 01:16:10.745313,2025-07-08 01:16:57.618490,0 days 00:00:46.873177,identity,128,128,0.00014212513146635847,19,COMPLETE
365,3.302159029772156e-06,2025-07-08 01:16:57.619371,2025-07-08 01:19:39.446027,0 days 00:02:41.826656,identity,16,99,0.00011536911656250924,18,COMPLETE
366,4.245247964718146e-06,2025-07-08 01:19:39.446861,2025-07-08 01:22:19.635830,0 days 00:02:40.188969,identity,16,99,0.00011422879772712309,18,COMPLETE
367,4.0199679460783955e-06,2025-07-08 01:22:19.636622,2025-07-08 01:24:46.728382,0 days 00:02:27.091760,identity,16,123,0.00010892494625341054,18,COMPLETE
368,3.3896724289661506e-06,2025-07-08 01:24:46.729229,2025-07-08 01:27:15.587646,0 days 00:02:28.858417,identity,16,125,0.000121900272214891,18,COMPLETE
369,4.272844762454042e-06,2025-07-08 01:27:15.588519,2025-07-08 01:29:54.789732,0 days 00:02:39.201213,identity,16,97,0.00011635596929902437,18,COMPLETE
370,1.0662020031304564e-05,2025-07-08 01:29:54.790629,2025-07-08 01:32:38.990448,0 days 00:02:44.199819,identity,16,108,0.0016283591151057706,18,COMPLETE
371,3.3786118365242146e-06,2025-07-08 01:32:38.991249,2025-07-08 01:35:12.826153,0 days 00:02:33.834904,identity,16,102,0.0001296884638400764,17,COMPLETE
372,5.1100191740260925e-06,2025-07-08 01:35:12.826994,2025-07-08 01:36:57.701318,0 days 00:01:44.874324,identity,16,92,0.00010130246016095631,11,COMPLETE
373,3.5697009934665402e-06,2025-07-08 01:36:57.702120,2025-07-08 01:39:17.865863,0 days 00:02:20.163743,identity,16,120,0.0001122155262431977,18,COMPLETE
374,3.3230815006390912e-06,2025-07-08 01:39:17.866776,2025-07-08 01:41:45.131277,0 days 00:02:27.264501,identity,16,126,0.0001248337815359584,18,COMPLETE
375,1.316388487815857,2025-07-08 01:41:45.132134,2025-07-08 01:44:28.585896,0 days 00:02:43.453762,relu,16,103,0.00013151002394549844,18,COMPLETE
376,3.841696525341831e-06,2025-07-08 01:44:28.586737,2025-07-08 01:46:46.514878,0 days 00:02:17.928141,identity,16,128,0.0001223108002006776,17,COMPLETE
377,3.515653816066333e-06,2025-07-08 01:46:46.515688,2025-07-08 01:48:37.420386,0 days 00:01:50.904698,identity,16,126,0.0001403744544161268,13,COMPLETE
378,3.4914880870928755e-06,2025-07-08 01:48:37.421259,2025-07-08 01:50:59.834424,0 days 00:02:22.413165,identity,16,122,0.00010679501123457686,18,COMPLETE
379,3.300029220554279e-06,2025-07-08 01:50:59.835257,2025-07-08 01:53:28.429150,0 days 00:02:28.593893,identity,16,126,0.00012349412724974718,18,COMPLETE
380,3.3909295780176762e-06,2025-07-08 01:53:28.430036,2025-07-08 01:55:53.508845,0 days 00:02:25.078809,identity,16,128,0.00013506421901353415,18,COMPLETE
381,1.9966670151916333e-05,2025-07-08 01:55:53.509672,2025-07-08 01:57:14.144978,0 days 00:01:20.635306,identity,32,126,0.00012525299761908932,18,COMPLETE
382,3.9160095184342936e-06,2025-07-08 01:57:14.145861,2025-07-08 01:59:43.047440,0 days 00:02:28.901579,identity,16,88,0.00014736413449316566,18,COMPLETE
383,3.50342247656954e-06,2025-07-08 01:59:43.048261,2025-07-08 02:02:05.373282,0 days 00:02:22.325021,identity,16,122,0.00012148271653076132,18,COMPLETE
384,6.399556150427088e-05,2025-07-08 02:02:05.374158,2025-07-08 02:03:01.961706,0 days 00:00:56.587548,identity,64,124,0.00013338341567218563,18,COMPLETE
385,3.342273885209579e-06,2025-07-08 02:03:01.962567,2025-07-08 02:05:29.339581,0 days 00:02:27.377014,identity,16,126,0.00011577698989850953,18,COMPLETE
386,3.703189577208832e-06,2025-07-08 02:05:29.340456,2025-07-08 02:07:49.407682,0 days 00:02:20.067226,identity,16,120,0.00014456421556276167,18,COMPLETE
387,3.360547680131276e-06,2025-07-08 02:07:49.408540,2025-07-08 02:10:18.885013,0 days 00:02:29.476473,identity,16,124,0.00010030881353047411,19,COMPLETE
388,3.3922613056347473e-06,2025-07-08 02:10:18.885863,2025-07-08 02:12:47.415801,0 days 00:02:28.529938,identity,16,128,0.00012599538686876007,19,COMPLETE
389,0.012959211133420467,2025-07-08 02:12:47.416617,2025-07-08 02:13:30.862870,0 days 00:00:43.446253,identity,128,105,0.00011421536407564102,18,COMPLETE
390,3.7250736113492167e-06,2025-07-08 02:13:30.863767,2025-07-08 02:16:10.871665,0 days 00:02:40.007898,identity,16,100,0.00013405515637084474,18,COMPLETE
391,3.5904947708331747e-06,2025-07-08 02:16:10.872498,2025-07-08 02:18:34.926274,0 days 00:02:24.053776,identity,16,121,0.00015257432462115184,18,COMPLETE
392,5.646263616654323e-06,2025-07-08 02:18:34.927148,2025-07-08 02:20:28.825100,0 days 00:01:53.897952,identity,16,95,0.0001126083403273046,12,COMPLETE
393,3.5426860449661035e-06,2025-07-08 02:20:28.825943,2025-07-08 02:22:57.659207,0 days 00:02:28.833264,identity,16,118,0.00012380927067001505,19,COMPLETE
394,3.644773869382334e-06,2025-07-08 02:22:57.660104,2025-07-08 02:25:28.856271,0 days 00:02:31.196167,relu,16,125,0.00013722161845748765,18,COMPLETE
395,4.015453214378795e-06,2025-07-08 02:25:28.857126,2025-07-08 02:28:25.121011,0 days 00:02:56.263885,identity,16,113,0.00010754604628095424,19,COMPLETE
396,3.4348652206972474e-06,2025-07-08 02:28:25.121901,2025-07-08 02:30:48.930299,0 days 00:02:23.808398,identity,16,122,0.00012310775992164908,18,COMPLETE
397,3.579487020033412e-05,2025-07-08 02:30:48.931126,2025-07-08 02:33:25.091053,0 days 00:02:36.159927,identity,16,128,0.007955823183285407,20,COMPLETE
398,3.491221150397905e-06,2025-07-08 02:33:25.091952,2025-07-08 02:35:52.749449,0 days 00:02:27.657497,identity,16,124,0.0001575469333626977,18,COMPLETE
399,3.5592925087257754e-06,2025-07-08 02:35:52.750280,2025-07-08 02:38:15.093654,0 days 00:02:22.343374,identity,16,119,0.00011435649011597905,18,COMPLETE
400,3.2783905226096977e-06,2025-07-08 02:38:15.094592,2025-07-08 02:40:44.755004,0 days 00:02:29.660412,identity,16,121,0.0001378614613752712,19,COMPLETE
401,3.562207666618633e-06,2025-07-08 02:40:44.755845,2025-07-08 02:43:06.068129,0 days 00:02:21.312284,identity,16,125,0.00013453641743441157,17,COMPLETE
402,1.1473556696728338e-05,2025-07-08 02:43:06.069011,2025-07-08 02:44:32.187343,0 days 00:01:26.118332,identity,32,122,0.0001178480291881757,20,COMPLETE
403,4.494710992730688e-06,2025-07-08 02:44:32.188179,2025-07-08 02:46:59.486180,0 days 00:02:27.298001,identity,16,126,0.00029867744765803815,18,COMPLETE
404,3.4615268305060454e-06,2025-07-08 02:46:59.487045,2025-07-08 02:49:29.001942,0 days 00:02:29.514897,identity,16,121,0.00012590832579661168,19,COMPLETE
405,3.4880347357102437e-06,2025-07-08 02:49:29.002805,2025-07-08 02:51:49.193171,0 days 00:02:20.190366,identity,16,123,0.00010765034038772562,17,COMPLETE
406,3.7946949760225834e-06,2025-07-08 02:51:49.194079,2025-07-08 02:54:17.868564,0 days 00:02:28.674485,identity,16,128,0.0001005106402798923,19,COMPLETE
407,3.348399559399695e-06,2025-07-08 02:54:17.869414,2025-07-08 02:57:05.730832,0 days 00:02:47.861418,identity,16,115,0.00014292890225574466,18,COMPLETE
408,3.6860315049125347e-06,2025-07-08 02:57:05.731719,2025-07-08 02:59:34.299825,0 days 00:02:28.568106,identity,16,126,0.00012750861904710397,18,COMPLETE
409,3.67085226571362e-06,2025-07-08 02:59:34.300655,2025-07-08 03:02:02.235305,0 days 00:02:27.934650,identity,16,119,0.00011495807411360106,19,COMPLETE
410,1.0626779840094969e-05,2025-07-08 03:02:02.236219,2025-07-08 03:04:27.954103,0 days 00:02:25.717884,identity,16,124,0.0021415604585734286,18,COMPLETE
411,6.315773589449236e-06,2025-07-08 03:04:27.954980,2025-07-08 03:07:03.636298,0 days 00:02:35.681318,identity,16,81,0.001433654311490283,19,COMPLETE
412,3.4545723792689387e-06,2025-07-08 03:07:03.637175,2025-07-08 03:09:39.082890,0 days 00:02:35.445715,identity,16,121,0.00014039181003581841,20,COMPLETE
413,3.5038649457419524e-06,2025-07-08 03:09:39.083739,2025-07-08 03:12:06.433500,0 days 00:02:27.349761,identity,16,126,0.00010000210472820698,18,COMPLETE
414,0.011221746914088726,2025-07-08 03:12:06.434360,2025-07-08 03:12:52.343702,0 days 00:00:45.909342,relu,128,117,0.00012526241791171593,19,COMPLETE
415,0.0003403685404919088,2025-07-08 03:12:52.344541,2025-07-08 03:13:49.580589,0 days 00:00:57.236048,identity,64,123,0.0001118303698518067,18,COMPLETE
416,3.3874059681693325e-06,2025-07-08 03:13:49.581465,2025-07-08 03:16:07.865932,0 days 00:02:18.284467,identity,16,128,0.00013273150306430476,17,COMPLETE
417,3.6612873373087496e-06,2025-07-08 03:16:07.866801,2025-07-08 03:18:28.172410,0 days 00:02:20.305609,identity,16,120,0.00011914492004096976,18,COMPLETE
418,3.3468356832599966e-06,2025-07-08 03:18:28.173338,2025-07-08 03:21:34.054109,0 days 00:03:05.880771,identity,16,111,0.00014714942343269828,20,COMPLETE
419,3.6069359339307994e-06,2025-07-08 03:21:34.054957,2025-07-08 03:23:53.185148,0 days 00:02:19.130191,identity,16,124,0.00010899161419378095,17,COMPLETE
420,3.68404380424181e-06,2025-07-08 03:23:53.186039,2025-07-08 03:26:16.300668,0 days 00:02:23.114629,identity,16,122,0.00012587696436207216,18,COMPLETE
421,3.3474273095635e-06,2025-07-08 03:26:16.301529,2025-07-08 03:28:44.886813,0 days 00:02:28.585284,identity,16,126,0.00013735208244651412,18,COMPLETE
422,3.3275857731496217e-06,2025-07-08 03:28:44.887727,2025-07-08 03:31:12.722832,0 days 00:02:27.835105,identity,16,118,0.00011669064295514045,19,COMPLETE
423,4.5485776354325935e-06,2025-07-08 03:31:12.723688,2025-07-08 03:34:09.320035,0 days 00:02:56.596347,identity,16,114,0.00010827997595875259,19,COMPLETE
424,4.803106548934011e-06,2025-07-08 03:34:09.320925,2025-07-08 03:36:35.476762,0 days 00:02:26.155837,identity,16,116,0.0001169958432049229,19,COMPLETE
425,3.783101192311733e-06,2025-07-08 03:36:35.477613,2025-07-08 03:38:00.040316,0 days 00:01:24.562703,identity,16,118,0.00010788411132540213,9,COMPLETE
426,3.562092615538859e-06,2025-07-08 03:38:00.041180,2025-07-08 03:40:27.146847,0 days 00:02:27.105667,identity,16,120,0.00011845907668217265,19,COMPLETE
