number,value,datetime_start,datetime_complete,duration,params_activation,params_batch_size,params_h,params_lr,params_seq_length,state
0,1.319413423538208,2025-07-07 11:04:33.872924,2025-07-07 11:04:53.900014,0 days 00:00:20.027090,relu,128,94,0.003245207762348632,8,COMPLETE
1,1.528308894194197e-05,2025-07-07 11:04:53.900784,2025-07-07 11:05:40.691911,0 days 00:00:46.791127,identity,32,105,0.0030079565226959286,9,COMPLETE
2,1.5222647562040947e-05,2025-07-07 11:05:40.692602,2025-07-07 11:06:29.190260,0 days 00:00:48.497658,identity,64,102,0.0032233177416848874,17,COMPLETE
3,0.015917697921395302,2025-07-07 11:06:29.190955,2025-07-07 11:06:43.206081,0 days 00:00:14.015126,relu,128,22,0.00020305392933704923,11,COMPLETE
4,8.123153747874312e-06,2025-07-07 11:06:43.206676,2025-07-07 11:07:31.636843,0 days 00:00:48.430167,identity,32,20,0.0022477604926119375,17,COMPLETE
5,1.3169734477996826,2025-07-07 11:07:31.637303,2025-07-07 11:08:17.618899,0 days 00:00:45.981596,relu,64,110,0.00021374128214733228,15,COMPLETE
6,5.62593186259619e-06,2025-07-07 11:08:17.619626,2025-07-07 11:09:25.836910,0 days 00:01:08.217284,relu,32,60,0.0006899519216412972,14,COMPLETE
7,1.900467941595707e-05,2025-07-07 11:09:25.837589,2025-07-07 11:09:48.912126,0 days 00:00:23.074537,relu,64,70,0.002858509051686674,8,COMPLETE
8,3.407560143386945e-05,2025-07-07 11:09:48.912669,2025-07-07 11:10:23.134958,0 days 00:00:34.222289,relu,128,87,0.0007146369068532419,17,COMPLETE
9,0.012584331445395947,2025-07-07 11:10:23.135574,2025-07-07 11:10:49.239342,0 days 00:00:26.103768,relu,128,84,0.00013559132894388457,14,COMPLETE
10,4.837930646317545e-06,2025-07-07 11:10:49.239974,2025-07-07 11:12:36.713004,0 days 00:01:47.473030,identity,16,48,0.0006689422473902746,20,COMPLETE
11,4.360061211627908e-06,2025-07-07 11:12:36.713687,2025-07-07 11:14:28.852408,0 days 00:01:52.138721,identity,16,43,0.0006566835712653884,20,COMPLETE
12,2.0916580979246646e-05,2025-07-07 11:14:28.853100,2025-07-07 11:16:17.201773,0 days 00:01:48.348673,identity,16,40,0.009851760690514813,20,COMPLETE
13,4.462048309505917e-06,2025-07-07 11:16:17.202442,2025-07-07 11:18:17.029142,0 days 00:01:59.826700,identity,16,52,0.0004606356293180933,20,COMPLETE
14,4.845052899327129e-06,2025-07-07 11:18:17.029823,2025-07-07 11:20:01.549190,0 days 00:01:44.519367,identity,16,37,0.00036562094131480885,19,COMPLETE
15,2.74067551799817e-05,2025-07-07 11:20:01.549886,2025-07-07 11:21:35.053713,0 days 00:01:33.503827,identity,16,10,0.0013873713421522988,18,COMPLETE
16,5.118636636325391e-06,2025-07-07 11:21:35.054364,2025-07-07 11:22:53.655691,0 days 00:01:18.601327,identity,16,65,0.00039937940871840065,12,COMPLETE
17,5.278036042000167e-06,2025-07-07 11:22:53.656400,2025-07-07 11:24:48.019064,0 days 00:01:54.362664,identity,16,51,0.00041357031117859026,19,COMPLETE
18,7.868951797718182e-06,2025-07-07 11:24:48.019773,2025-07-07 11:26:16.879300,0 days 00:01:28.859527,identity,16,33,0.001556930438195087,16,COMPLETE
19,2.696795309020672e-05,2025-07-07 11:26:16.880002,2025-07-07 11:28:23.506550,0 days 00:02:06.626548,identity,16,75,0.006157689744844236,20,COMPLETE
20,5.116498869028874e-06,2025-07-07 11:28:23.507237,2025-07-07 11:29:45.124719,0 days 00:01:21.617482,identity,16,53,0.0010244714300287523,12,COMPLETE
21,4.5540209612227045e-06,2025-07-07 11:29:45.125439,2025-07-07 11:32:35.175410,0 days 00:02:50.049971,identity,16,123,0.0006051770643221388,20,COMPLETE
22,5.358178896130994e-06,2025-07-07 11:32:35.176116,2025-07-07 11:35:17.639986,0 days 00:02:42.463870,identity,16,124,0.0002777535137501982,19,COMPLETE
23,7.921078577055596e-06,2025-07-07 11:35:17.640683,2025-07-07 11:36:55.808578,0 days 00:01:38.167895,identity,16,30,0.0005695526340469195,18,COMPLETE
24,8.323992005898617e-06,2025-07-07 11:36:55.809269,2025-07-07 11:39:43.784931,0 days 00:02:47.975662,identity,16,125,0.0010349763660713464,18,COMPLETE
25,4.072119281772757e-06,2025-07-07 11:39:43.785630,2025-07-07 11:43:38.770236,0 days 00:03:54.984606,identity,16,78,0.0004752464045732601,20,COMPLETE
26,3.385807303857291e-06,2025-07-07 11:43:38.770926,2025-07-07 11:47:51.742980,0 days 00:04:12.972054,identity,16,77,0.00010941446888417477,19,COMPLETE
27,0.0011805343674495816,2025-07-07 11:47:51.743706,2025-07-07 11:48:31.428683,0 days 00:00:39.684977,identity,64,82,0.00010633215544085231,16,COMPLETE
28,9.688231330073904e-06,2025-07-07 11:48:31.429350,2025-07-07 11:50:06.906807,0 days 00:01:35.477457,identity,32,62,0.0001613891130182891,19,COMPLETE
29,0.0006286908173933625,2025-07-07 11:50:06.907521,2025-07-07 11:50:41.193014,0 days 00:00:34.285493,identity,128,96,0.0002906385606617862,18,COMPLETE
30,6.7162841332901735e-06,2025-07-07 11:50:41.193535,2025-07-07 11:54:47.118005,0 days 00:04:05.924470,identity,16,78,0.0016418070751232877,19,COMPLETE
31,4.307079507270828e-06,2025-07-07 11:54:47.118691,2025-07-07 11:56:47.890726,0 days 00:02:00.772035,identity,16,56,0.0004623990805791968,20,COMPLETE
32,3.5573996228777105e-06,2025-07-07 11:56:47.891408,2025-07-07 11:58:59.466393,0 days 00:02:11.574985,identity,16,67,0.0002745431048899635,20,COMPLETE
33,4.784095381182851e-06,2025-07-07 11:58:59.467104,2025-07-07 12:00:58.205047,0 days 00:01:58.737943,identity,16,71,0.0001074261510688347,19,COMPLETE
34,3.4982924717041897e-06,2025-07-07 12:00:58.205719,2025-07-07 12:04:47.981648,0 days 00:03:49.775929,identity,16,96,0.0002549301039048465,18,COMPLETE
35,1.861824785009958e-05,2025-07-07 12:04:47.982345,2025-07-07 12:05:57.828419,0 days 00:01:09.846074,identity,32,111,0.00022452202077653317,16,COMPLETE
36,1.1015644304279704e-05,2025-07-07 12:05:57.829085,2025-07-07 12:06:44.808528,0 days 00:00:46.979443,identity,64,93,0.00028005357699894417,17,COMPLETE
37,1.316388487815857,2025-07-07 12:06:44.809220,2025-07-07 12:10:31.872781,0 days 00:03:47.063561,relu,16,91,0.0001681340253655402,18,COMPLETE
38,0.006844976916909218,2025-07-07 12:10:31.873451,2025-07-07 12:10:55.509376,0 days 00:00:23.635925,identity,128,101,0.00013769969956060833,10,COMPLETE
39,1.5979470845195465e-05,2025-07-07 12:10:55.509921,2025-07-07 12:11:53.327199,0 days 00:00:57.817278,relu,32,79,0.0001985279238021431,15,COMPLETE
40,1.849278669396881e-05,2025-07-07 12:11:53.327863,2025-07-07 12:12:43.235733,0 days 00:00:49.907870,identity,64,113,0.00031167113550871045,17,COMPLETE
41,4.36877280662884e-06,2025-07-07 12:12:43.236442,2025-07-07 12:14:58.571459,0 days 00:02:15.335017,identity,16,72,0.0004630090257586335,20,COMPLETE
42,6.565745934494771e-06,2025-07-07 12:14:58.572129,2025-07-07 12:17:04.077982,0 days 00:02:05.505853,identity,16,58,0.0008357444276126207,19,COMPLETE
43,3.702095455082599e-06,2025-07-07 12:17:04.078679,2025-07-07 12:21:33.650239,0 days 00:04:29.571560,identity,16,85,0.00022693770820910678,18,COMPLETE
44,3.949491201638011e-06,2025-07-07 12:21:33.650972,2025-07-07 12:25:55.832196,0 days 00:04:22.181224,relu,16,87,0.00022611270466108937,18,COMPLETE
45,4.30030922871083e-06,2025-07-07 12:25:55.832968,2025-07-07 12:30:12.940729,0 days 00:04:17.107761,relu,16,102,0.00022406098701901523,17,COMPLETE
46,0.009828241541981697,2025-07-07 12:30:12.941489,2025-07-07 12:30:49.148143,0 days 00:00:36.206654,relu,128,87,0.00013978300648408154,18,COMPLETE
47,8.597582564107142e-06,2025-07-07 12:30:49.148960,2025-07-07 12:32:19.369997,0 days 00:01:30.221037,relu,16,66,0.00017179946101801368,14,COMPLETE
48,1.3169734477996826,2025-07-07 12:32:19.370677,2025-07-07 12:36:02.880209,0 days 00:03:43.509532,relu,16,98,0.0001164299784035675,15,COMPLETE
49,1.3165440559387207,2025-07-07 12:36:02.880923,2025-07-07 12:37:09.215403,0 days 00:01:06.334480,relu,32,87,0.0003338910974494854,17,COMPLETE
50,1.3167331218719482,2025-07-07 12:37:09.216088,2025-07-07 12:41:04.354580,0 days 00:03:55.138492,relu,16,90,0.0002456903626606422,16,COMPLETE
51,3.4259021504112752e-06,2025-07-07 12:41:04.355303,2025-07-07 12:45:39.731951,0 days 00:04:35.376648,identity,16,79,0.00019764759374283917,19,COMPLETE
52,3.4446909467078513e-06,2025-07-07 12:45:39.732671,2025-07-07 12:50:24.599952,0 days 00:04:44.867281,identity,16,107,0.00018255824196926996,18,COMPLETE
53,3.4772906474245246e-06,2025-07-07 12:50:24.600630,2025-07-07 12:55:31.925014,0 days 00:05:07.324384,identity,16,107,0.00018705988118312533,19,COMPLETE
54,3.623996235546656e-06,2025-07-07 12:55:31.925729,2025-07-07 13:00:31.407641,0 days 00:04:59.481912,identity,16,107,0.00018432458000786444,19,COMPLETE
55,3.42772068506747e-06,2025-07-07 13:00:31.408345,2025-07-07 13:05:20.537604,0 days 00:04:49.129259,identity,16,106,0.00013096363015457094,19,COMPLETE
56,3.7892825730523327e-06,2025-07-07 13:05:20.538326,2025-07-07 13:07:56.731289,0 days 00:02:36.192963,identity,16,117,0.0001309257412805011,19,COMPLETE
57,0.0002248759410576895,2025-07-07 13:07:56.732045,2025-07-07 13:08:54.496974,0 days 00:00:57.764929,identity,64,117,0.00012506204968865516,19,COMPLETE
58,4.3447271309560165e-06,2025-07-07 13:08:54.497972,2025-07-07 13:10:56.892252,0 days 00:02:02.394280,identity,16,104,0.00015399675830486732,8,COMPLETE
59,3.383226840014686e-06,2025-07-07 13:10:56.892950,2025-07-07 13:13:26.725906,0 days 00:02:29.832956,identity,16,118,0.00010067642332050432,18,COMPLETE
60,0.01625867933034897,2025-07-07 13:13:26.726665,2025-07-07 13:14:00.817142,0 days 00:00:34.090477,identity,128,128,0.00010491573515779138,13,COMPLETE
61,3.5014313652936835e-06,2025-07-07 13:14:00.817814,2025-07-07 13:19:10.431100,0 days 00:05:09.613286,identity,16,115,0.00015488265039790715,18,COMPLETE
62,4.338271992310183e-06,2025-07-07 13:19:10.431849,2025-07-07 13:24:15.327066,0 days 00:05:04.895217,identity,16,107,0.00018832230627619512,19,COMPLETE
63,3.629756520240335e-06,2025-07-07 13:24:15.327786,2025-07-07 13:26:44.750579,0 days 00:02:29.422793,identity,16,121,0.00012403711720788954,18,COMPLETE
64,2.1381847545853816e-05,2025-07-07 13:26:44.751328,2025-07-07 13:30:55.896337,0 days 00:04:11.145009,identity,16,99,0.004473568572638643,17,COMPLETE
65,3.551044983396423e-06,2025-07-07 13:30:55.897053,2025-07-07 13:36:32.476246,0 days 00:05:36.579193,identity,16,109,0.00015469585432392372,20,COMPLETE
66,3.3507599255244713e-06,2025-07-07 13:36:32.476988,2025-07-07 13:39:05.750152,0 days 00:02:33.273164,identity,16,120,0.00011527115403894148,19,COMPLETE
67,4.3691316022886895e-06,2025-07-07 13:39:05.750843,2025-07-07 13:41:39.782319,0 days 00:02:34.031476,identity,16,120,0.00010159379976734526,19,COMPLETE
68,3.4297788715775823e-06,2025-07-07 13:41:39.783047,2025-07-07 13:44:20.213233,0 days 00:02:40.430186,identity,16,128,0.00012015572726741365,20,COMPLETE
69,3.5029863738600397e-06,2025-07-07 13:44:20.213943,2025-07-07 13:47:00.747706,0 days 00:02:40.533763,identity,16,128,0.00011969353205749484,20,COMPLETE
70,2.2817295757704414e-05,2025-07-07 13:47:00.748477,2025-07-07 13:48:25.322057,0 days 00:01:24.573580,identity,32,120,0.00010035174717234788,20,COMPLETE
71,3.617497668528813e-06,2025-07-07 13:48:25.322769,2025-07-07 13:54:03.339378,0 days 00:05:38.016609,identity,16,115,0.00013127487447971004,19,COMPLETE
72,3.5561213280743686e-06,2025-07-07 13:54:03.340098,2025-07-07 13:58:55.116072,0 days 00:04:51.775974,identity,16,112,0.00014556035442811295,19,COMPLETE
73,3.6153044220554875e-06,2025-07-07 13:58:55.116771,2025-07-07 14:03:40.324311,0 days 00:04:45.207540,identity,16,107,0.0001896516256515929,20,COMPLETE
74,3.633328105934197e-06,2025-07-07 14:03:40.325056,2025-07-07 14:06:09.637082,0 days 00:02:29.312026,identity,16,118,0.00011808019321649887,19,COMPLETE
75,3.848528649541549e-06,2025-07-07 14:06:09.637790,2025-07-07 14:08:48.728126,0 days 00:02:39.090336,identity,16,124,0.00017317138120635098,17,COMPLETE
76,0.00036544815520755947,2025-07-07 14:08:48.728873,2025-07-07 14:09:47.391300,0 days 00:00:58.662427,identity,64,126,0.00011736351444544116,18,COMPLETE
77,3.3294456898147473e-06,2025-07-07 14:09:47.392038,2025-07-07 14:12:24.125142,0 days 00:02:36.733104,identity,16,122,0.00013874244372537734,20,COMPLETE
78,3.3469957543275086e-06,2025-07-07 14:12:24.125877,2025-07-07 14:15:00.450647,0 days 00:02:36.324770,identity,16,121,0.0001468195228907525,20,COMPLETE
79,0.00846712663769722,2025-07-07 14:15:00.451364,2025-07-07 14:15:50.448181,0 days 00:00:49.996817,identity,128,122,0.00013743090400550944,20,COMPLETE
80,1.2066799172316678e-05,2025-07-07 14:15:50.448938,2025-07-07 14:18:30.080104,0 days 00:02:39.631166,identity,16,125,0.0023347499809554494,20,COMPLETE
81,3.783520241995575e-06,2025-07-07 14:18:30.080845,2025-07-07 14:21:53.613230,0 days 00:03:23.532385,identity,16,115,0.0001113271389943,20,COMPLETE
82,3.41906388712232e-06,2025-07-07 14:21:53.613976,2025-07-07 14:24:22.716244,0 days 00:02:29.102268,identity,16,119,0.00015201782752156007,19,COMPLETE
83,3.396683723622118e-06,2025-07-07 14:24:22.716928,2025-07-07 14:26:50.146526,0 days 00:02:27.429598,identity,16,120,0.00014858932363554983,19,COMPLETE
84,3.569916771084536e-06,2025-07-07 14:26:50.147281,2025-07-07 14:30:04.743211,0 days 00:03:14.595930,identity,16,112,0.000148982457141223,19,COMPLETE
85,3.3993449051195057e-06,2025-07-07 14:30:04.743920,2025-07-07 14:32:32.161967,0 days 00:02:27.418047,identity,16,120,0.00016295919131696765,19,COMPLETE
86,3.5030072922381805e-06,2025-07-07 14:32:32.162754,2025-07-07 14:35:01.622089,0 days 00:02:29.459335,identity,16,122,0.00020778742047944642,19,COMPLETE
87,1.8177745005232282e-05,2025-07-07 14:35:01.622795,2025-07-07 14:36:45.011214,0 days 00:01:43.388419,identity,16,20,0.0001700639630129077,20,COMPLETE
88,3.929564172722166e-06,2025-07-07 14:36:45.011986,2025-07-07 14:39:06.410117,0 days 00:02:21.398131,identity,16,119,0.0002476788105693613,18,COMPLETE
89,4.636300218407996e-05,2025-07-07 14:39:06.410813,2025-07-07 14:40:36.472885,0 days 00:01:30.062072,identity,32,47,0.0001004478925221377,20,COMPLETE
90,3.591296263039112e-06,2025-07-07 14:40:36.473662,2025-07-07 14:42:34.501780,0 days 00:01:58.028118,identity,16,110,0.00015989310881983819,11,COMPLETE
91,3.5272337299829815e-06,2025-07-07 14:42:34.502510,2025-07-07 14:46:11.683030,0 days 00:03:37.180520,identity,16,115,0.0001340623280540448,19,COMPLETE
92,3.580365500965854e-06,2025-07-07 14:46:11.683782,2025-07-07 14:49:43.640121,0 days 00:03:31.956339,identity,16,123,0.0002058325821488633,19,COMPLETE
93,3.7703971429436933e-06,2025-07-07 14:49:43.640830,2025-07-07 14:51:44.173197,0 days 00:02:00.532367,identity,16,73,0.000139575891287125,19,COMPLETE
94,3.2778857530502137e-06,2025-07-07 14:51:44.173935,2025-07-07 14:54:05.687422,0 days 00:02:21.513487,identity,16,118,0.00011200412963977458,18,COMPLETE
95,2.8981005016248673e-05,2025-07-07 14:54:05.688129,2025-07-07 14:55:00.474456,0 days 00:00:54.786327,identity,64,118,0.00016102913603301204,18,COMPLETE
96,3.552462885636487e-06,2025-07-07 14:55:00.475225,2025-07-07 14:57:54.027610,0 days 00:02:53.552385,identity,16,113,0.00011703290884689594,18,COMPLETE
97,3.2881112019822467e-06,2025-07-07 14:57:54.028317,2025-07-07 15:00:32.423780,0 days 00:02:38.395463,identity,16,126,0.0001086708260802833,20,COMPLETE
98,3.65175110346172e-05,2025-07-07 15:00:32.424529,2025-07-07 15:02:18.791848,0 days 00:01:46.367319,identity,16,29,0.00010748964995685505,20,COMPLETE
99,3.256638956372626e-05,2025-07-07 15:02:18.792561,2025-07-07 15:03:09.390126,0 days 00:00:50.597565,identity,128,124,0.0012267405415395517,20,COMPLETE
100,3.4449931263225153e-06,2025-07-07 15:03:09.390866,2025-07-07 15:05:43.193587,0 days 00:02:33.802721,identity,16,120,0.0001452575776843217,20,COMPLETE
101,3.2670866403350374e-06,2025-07-07 15:05:43.194276,2025-07-07 15:08:14.214029,0 days 00:02:31.019753,identity,16,126,0.00012738973267908848,19,COMPLETE
102,3.651949737104587e-05,2025-07-07 15:08:14.214754,2025-07-07 15:09:51.304023,0 days 00:01:37.089269,identity,16,10,0.009151048377606205,19,COMPLETE
103,3.382752311154036e-06,2025-07-07 15:09:51.304731,2025-07-07 15:12:22.513190,0 days 00:02:31.208459,identity,16,126,0.00010821358761648064,19,COMPLETE
104,4.337775862950366e-06,2025-07-07 15:12:22.514151,2025-07-07 15:14:59.440860,0 days 00:02:36.926709,identity,16,127,0.00011009416693390684,18,COMPLETE
105,3.5077191569143906e-06,2025-07-07 15:14:59.441585,2025-07-07 15:17:32.176800,0 days 00:02:32.735215,identity,16,125,0.00011431164331403592,19,COMPLETE
106,3.619775952756754e-06,2025-07-07 15:17:32.177551,2025-07-07 15:20:08.962250,0 days 00:02:36.784699,identity,16,122,0.00012725687274953978,20,COMPLETE
107,3.641816419985844e-06,2025-07-07 15:20:08.962976,2025-07-07 15:23:13.968593,0 days 00:03:05.005617,identity,16,115,0.00010025412950971478,19,COMPLETE
108,3.4453960324754007e-06,2025-07-07 15:23:13.969336,2025-07-07 15:25:53.080632,0 days 00:02:39.111296,identity,16,126,0.00012598714734228986,20,COMPLETE
109,4.049488779855892e-06,2025-07-07 15:25:53.081342,2025-07-07 15:28:14.891492,0 days 00:02:21.810150,identity,16,117,0.00010887217514372867,18,COMPLETE
110,9.382207281305455e-06,2025-07-07 15:28:14.892234,2025-07-07 15:29:38.824251,0 days 00:01:23.932017,identity,32,123,0.00017443301563030742,19,COMPLETE
111,3.5001894502784126e-06,2025-07-07 15:29:38.824958,2025-07-07 15:32:08.249204,0 days 00:02:29.424246,identity,16,119,0.00014642212099104596,19,COMPLETE
112,3.4765773762046592e-06,2025-07-07 15:32:08.249938,2025-07-07 15:34:37.946815,0 days 00:02:29.696877,identity,16,128,0.0001317905607725239,19,COMPLETE
113,3.459538902461645e-06,2025-07-07 15:34:37.947542,2025-07-07 15:37:12.105486,0 days 00:02:34.157944,identity,16,120,0.00014329283075167646,20,COMPLETE
114,3.5432724416750716e-06,2025-07-07 15:37:12.106254,2025-07-07 15:39:53.701515,0 days 00:02:41.595261,identity,16,110,0.00016316402058262942,17,COMPLETE
115,3.595378075260669e-06,2025-07-07 15:39:53.702222,2025-07-07 15:42:28.481545,0 days 00:02:34.779323,identity,16,125,0.00011177876573635224,18,COMPLETE
116,3.310763531771954e-06,2025-07-07 15:42:28.482292,2025-07-07 15:44:56.803687,0 days 00:02:28.321395,identity,16,117,0.00012436483633876307,19,COMPLETE
117,4.106553660676582e-06,2025-07-07 15:44:56.804396,2025-07-07 15:48:37.886792,0 days 00:03:41.082396,relu,16,104,0.00012344014599412035,20,COMPLETE
118,3.949352503695991e-06,2025-07-07 15:48:37.887544,2025-07-07 15:50:34.482255,0 days 00:01:56.594711,identity,16,116,0.00011083662905978737,13,COMPLETE
119,0.0001299962168559432,2025-07-07 15:50:34.482968,2025-07-07 15:51:30.992893,0 days 00:00:56.509925,identity,64,121,0.0001321222467883047,18,COMPLETE
120,3.4897357181762345e-06,2025-07-07 15:51:30.993670,2025-07-07 15:54:29.716567,0 days 00:02:58.722897,identity,16,114,0.00011997487233646576,19,COMPLETE
121,3.783371084864484e-06,2025-07-07 15:54:29.717332,2025-07-07 15:56:56.865910,0 days 00:02:27.148578,identity,16,118,0.00015294609497054716,19,COMPLETE
122,3.5159546314389445e-06,2025-07-07 15:56:56.866656,2025-07-07 15:59:26.779320,0 days 00:02:29.912664,identity,16,123,0.00014044388663701847,19,COMPLETE
123,3.992569872934837e-06,2025-07-07 15:59:26.780062,2025-07-07 16:02:56.434827,0 days 00:03:29.654765,identity,16,112,0.00017210883762883275,20,COMPLETE
124,3.448208417466958e-06,2025-07-07 16:02:56.435574,2025-07-07 16:05:27.170142,0 days 00:02:30.734568,identity,16,126,0.00010015536143126264,19,COMPLETE
125,3.685327783387038e-06,2025-07-07 16:05:27.170863,2025-07-07 16:07:48.154280,0 days 00:02:20.983417,identity,16,120,0.00012083984405973961,18,COMPLETE
126,0.005469907075166702,2025-07-07 16:07:48.155067,2025-07-07 16:08:36.757881,0 days 00:00:48.602814,identity,128,117,0.00015438337454778275,20,COMPLETE
127,4.253908173268428e-06,2025-07-07 16:08:36.758641,2025-07-07 16:11:06.605413,0 days 00:02:29.846772,identity,16,128,0.0005231277507029723,19,COMPLETE
128,3.502837216728949e-06,2025-07-07 16:11:06.606149,2025-07-07 16:13:30.028713,0 days 00:02:23.422564,identity,16,122,0.00013616510408971503,18,COMPLETE
129,5.57053408556385e-06,2025-07-07 16:13:30.029459,2025-07-07 16:16:30.252035,0 days 00:03:00.222576,identity,16,110,0.00010862616278982932,19,COMPLETE
130,3.361569952176069e-06,2025-07-07 16:16:30.252790,2025-07-07 16:19:08.031103,0 days 00:02:37.778313,identity,16,124,0.0001811990718861025,20,COMPLETE
131,3.506858092805487e-06,2025-07-07 16:19:08.031821,2025-07-07 16:21:45.940938,0 days 00:02:37.909117,identity,16,124,0.0001794514071088231,20,COMPLETE
132,5.271876943879761e-06,2025-07-07 16:21:45.941715,2025-07-07 16:24:20.864914,0 days 00:02:34.923199,identity,16,118,0.0008142757037739004,20,COMPLETE
133,3.521917278703768e-06,2025-07-07 16:24:20.865639,2025-07-07 16:26:57.451042,0 days 00:02:36.585403,identity,16,121,0.0002098846252160644,20,COMPLETE
134,3.325166062495555e-06,2025-07-07 16:26:57.451794,2025-07-07 16:29:30.005736,0 days 00:02:32.553942,identity,16,126,0.0001294588522541051,19,COMPLETE
135,3.838110842480091e-06,2025-07-07 16:29:30.006456,2025-07-07 16:32:06.550519,0 days 00:02:36.544063,identity,16,128,0.0001257438098011685,20,COMPLETE
136,3.682524948089849e-06,2025-07-07 16:32:06.551300,2025-07-07 16:34:39.393272,0 days 00:02:32.841972,identity,16,125,0.0001109542460237019,19,COMPLETE
137,1.316251516342163,2025-07-07 16:34:39.394029,2025-07-07 16:36:04.251198,0 days 00:01:24.857169,relu,32,123,0.00013363883987146865,19,COMPLETE
138,6.2175499806471635e-06,2025-07-07 16:36:04.251989,2025-07-07 16:38:37.738395,0 days 00:02:33.486406,identity,16,61,0.00010140363247562075,20,COMPLETE
139,3.5927555472881068e-06,2025-07-07 16:38:37.739151,2025-07-07 16:41:12.261681,0 days 00:02:34.522530,identity,16,126,0.00011895566157433942,18,COMPLETE
140,3.6035580706084147e-06,2025-07-07 16:41:12.262438,2025-07-07 16:44:11.307492,0 days 00:02:59.045054,identity,16,113,0.00019212715601233586,19,COMPLETE
141,3.3970716231124243e-06,2025-07-07 16:44:11.308210,2025-07-07 16:46:39.868560,0 days 00:02:28.560350,identity,16,119,0.00014836176135924582,19,COMPLETE
142,3.4456284083717037e-06,2025-07-07 16:46:39.869311,2025-07-07 16:49:06.343380,0 days 00:02:26.474069,identity,16,116,0.0001450881301299009,19,COMPLETE
