number,value,datetime_start,datetime_complete,duration,params_activation,params_batch_size,params_h,params_lr,params_seq_length,state
427,9.17233046493493e-06,2025-07-08 03:40:27.147701,2025-07-08 03:41:37.140339,0 days 00:01:09.992638,identity,32,77,0.00012703284158963943,19,COMPLETE
428,3.816751359408954e-06,2025-07-08 03:41:37.141306,2025-07-08 03:44:33.754607,0 days 00:02:56.613301,identity,16,110,0.00011073503028437745,19,COMPLETE
429,3.672284492495237e-06,2025-07-08 03:44:33.755466,2025-07-08 03:47:04.439098,0 days 00:02:30.683632,identity,16,88,0.00011918454756199404,18,COMPLETE
430,3.5702382774616126e-06,2025-07-08 03:47:04.440007,2025-07-08 03:49:55.081599,0 days 00:02:50.641592,identity,16,115,0.00010063189870356497,18,COMPLETE
431,3.4713357308646664e-06,2025-07-08 03:49:55.082481,2025-07-08 03:52:26.218865,0 days 00:02:31.136384,identity,16,124,0.0001300538805562631,19,COMPLETE
432,3.44336672242207e-06,2025-07-08 03:52:26.219803,2025-07-08 03:54:53.233847,0 days 00:02:27.014044,identity,16,128,0.00011652847361517797,18,COMPLETE
433,3.477256996120559e-06,2025-07-08 03:54:53.234697,2025-07-08 03:57:15.733957,0 days 00:02:22.499260,identity,16,118,0.0001509550116411103,18,COMPLETE
434,1.316251516342163,2025-07-08 03:57:15.734873,2025-07-08 03:58:15.473535,0 days 00:00:59.738662,relu,64,121,0.00010727082936095289,19,COMPLETE
435,3.3773073937481968e-06,2025-07-08 03:58:15.474381,2025-07-08 04:00:37.688010,0 days 00:02:22.213629,identity,16,126,0.0001357784594473928,17,COMPLETE
436,3.492231144264224e-06,2025-07-08 04:00:37.688914,2025-07-08 04:02:32.955017,0 days 00:01:55.266103,identity,16,73,0.00012536416238134344,18,COMPLETE
437,3.3115866244770586e-06,2025-07-08 04:02:32.955871,2025-07-08 04:05:03.733425,0 days 00:02:30.777554,identity,16,123,0.00011599006745354887,19,COMPLETE
438,3.3243391044379678e-06,2025-07-08 04:05:03.734356,2025-07-08 04:07:29.804225,0 days 00:02:26.069869,identity,16,124,0.00010998210573142266,18,COMPLETE
439,3.5365721942071104e-06,2025-07-08 04:07:29.805065,2025-07-08 04:09:56.851738,0 days 00:02:27.046673,identity,16,123,0.00010572728283037366,18,COMPLETE
440,4.039211944473209e-06,2025-07-08 04:09:56.852627,2025-07-08 04:12:25.289556,0 days 00:02:28.436929,identity,16,126,0.0005992506445948207,18,COMPLETE
441,3.2159282454813365e-06,2025-07-08 04:12:25.290404,2025-07-08 04:14:47.960343,0 days 00:02:22.669939,identity,16,122,0.00010204899652785531,18,COMPLETE
442,8.043353773246054e-06,2025-07-08 04:14:47.961271,2025-07-08 04:16:39.504781,0 days 00:01:51.543510,identity,16,67,0.00010272200682632811,18,COMPLETE
443,3.983820988651132e-06,2025-07-08 04:16:39.505634,2025-07-08 04:19:02.408147,0 days 00:02:22.902513,identity,16,121,0.00010701788049912433,18,COMPLETE
444,3.5498730994731886e-06,2025-07-08 04:19:02.409042,2025-07-08 04:21:24.746637,0 days 00:02:22.337595,identity,16,122,0.00010726497095768903,18,COMPLETE
445,3.595878297346644e-05,2025-07-08 04:21:24.747490,2025-07-08 04:22:05.540884,0 days 00:00:40.793394,identity,128,120,0.0011593774887255243,17,COMPLETE
446,3.3844949030026328e-06,2025-07-08 04:22:05.541794,2025-07-08 04:24:31.568839,0 days 00:02:26.027045,identity,16,123,0.0001000002477305763,18,COMPLETE
447,3.3649482702458045e-06,2025-07-08 04:24:31.569689,2025-07-08 04:26:52.600077,0 days 00:02:21.030388,identity,16,124,0.00010048110911405928,17,COMPLETE
448,3.4850393149099546e-06,2025-07-08 04:26:52.601006,2025-07-08 04:29:13.779991,0 days 00:02:21.178985,identity,16,120,0.00011420614869900497,18,COMPLETE
449,5.566872005147161e-06,2025-07-08 04:29:13.780842,2025-07-08 04:31:51.435729,0 days 00:02:37.654887,identity,16,93,0.00011583171054354495,18,COMPLETE
450,3.516415063131717e-06,2025-07-08 04:31:51.436614,2025-07-08 04:34:17.426621,0 days 00:02:25.990007,identity,16,128,0.00010008085375727156,18,COMPLETE
451,3.429980324654025e-06,2025-07-08 04:34:17.427759,2025-07-08 04:36:39.390666,0 days 00:02:21.962907,identity,16,117,0.00011542605740382453,18,COMPLETE
452,1.737860839057248e-05,2025-07-08 04:36:39.391628,2025-07-08 04:37:59.311802,0 days 00:01:19.920174,identity,32,123,0.00011882092025769514,18,COMPLETE
453,4.1303824218630325e-06,2025-07-08 04:37:59.312672,2025-07-08 04:40:28.433577,0 days 00:02:29.120905,identity,16,125,0.0001099222170249753,18,COMPLETE
454,1.6210464309551753e-05,2025-07-08 04:40:28.434484,2025-07-08 04:42:04.440660,0 days 00:01:36.006176,identity,16,32,0.00012775748424452487,18,COMPLETE
455,4.409782832226483e-06,2025-07-08 04:42:04.441567,2025-07-08 04:44:36.175094,0 days 00:02:31.733527,relu,16,84,0.00012424824199977713,18,COMPLETE
456,3.3742908271960914e-06,2025-07-08 04:44:36.176004,2025-07-08 04:46:54.506670,0 days 00:02:18.330666,identity,16,120,0.00010980328055602541,17,COMPLETE
457,3.734082383743953e-06,2025-07-08 04:46:54.507546,2025-07-08 04:49:42.658789,0 days 00:02:48.151243,identity,16,113,0.00011963296888078174,18,COMPLETE
458,3.5275975278636906e-06,2025-07-08 04:49:42.659690,2025-07-08 04:52:11.565187,0 days 00:02:28.905497,identity,16,126,0.00010038452780917025,18,COMPLETE
459,1.1468957382021472e-05,2025-07-08 04:52:11.566051,2025-07-08 04:54:57.676168,0 days 00:02:46.110117,identity,16,105,0.0018240540514784533,18,COMPLETE
460,3.4360220979579026e-06,2025-07-08 04:54:57.677070,2025-07-08 04:57:17.276213,0 days 00:02:19.599143,identity,16,122,0.00013584700127018809,17,COMPLETE
461,0.0006335295038297772,2025-07-08 04:57:17.277076,2025-07-08 04:58:11.647093,0 days 00:00:54.370017,identity,64,118,0.00011148007754494911,18,COMPLETE
462,4.161974629823817e-06,2025-07-08 04:58:11.648017,2025-07-08 05:00:40.029339,0 days 00:02:28.381322,identity,16,125,0.00047453506179518756,18,COMPLETE
463,3.333852191644837e-06,2025-07-08 05:00:40.030227,2025-07-08 05:03:05.504722,0 days 00:02:25.474495,identity,16,128,0.00012718438637361132,18,COMPLETE
464,3.3067751701310044e-06,2025-07-08 05:03:05.505626,2025-07-08 05:05:25.854687,0 days 00:02:20.349061,identity,16,116,0.00012098737862225627,18,COMPLETE
465,0.03430110961198807,2025-07-08 05:05:25.855555,2025-07-08 05:05:47.890632,0 days 00:00:22.035077,identity,128,15,0.00014190327075001513,17,COMPLETE
466,3.5560462947614724e-06,2025-07-08 05:05:47.891585,2025-07-08 05:08:36.065237,0 days 00:02:48.173652,identity,16,115,0.0001238901392448958,18,COMPLETE
467,4.944597094436176e-06,2025-07-08 05:08:36.066132,2025-07-08 05:11:30.848049,0 days 00:02:54.781917,identity,16,109,0.00013633642937434034,19,COMPLETE
468,3.440584350755671e-06,2025-07-08 05:11:30.848958,2025-07-08 05:13:51.827078,0 days 00:02:20.978120,identity,16,116,0.00011879521042599221,18,COMPLETE
469,4.233510026097065e-06,2025-07-08 05:13:51.827954,2025-07-08 05:15:33.101394,0 days 00:01:41.273440,identity,16,44,0.00012926623665894323,18,COMPLETE
470,3.585171725717373e-06,2025-07-08 05:15:33.102348,2025-07-08 05:18:29.728930,0 days 00:02:56.626582,identity,16,113,0.00014675673687944665,19,COMPLETE
471,3.3061630801967112e-06,2025-07-08 05:18:29.729830,2025-07-08 05:20:51.891286,0 days 00:02:22.161456,identity,16,118,0.00011587297158521782,18,COMPLETE
472,4.045183231937699e-06,2025-07-08 05:20:51.892209,2025-07-08 05:23:30.891429,0 days 00:02:38.999220,identity,16,112,0.00010962842997949147,17,COMPLETE
473,3.6960484521841863e-06,2025-07-08 05:23:30.892291,2025-07-08 05:25:53.211239,0 days 00:02:22.318948,relu,16,118,0.0001152157086895186,18,COMPLETE
474,3.5794571431324584e-06,2025-07-08 05:25:53.212130,2025-07-08 05:28:42.299946,0 days 00:02:49.087816,identity,16,115,0.00010769842480019355,18,COMPLETE
475,3.500512320897542e-06,2025-07-08 05:28:42.300794,2025-07-08 05:31:09.595721,0 days 00:02:27.294927,identity,16,117,0.0001189364678043972,19,COMPLETE
476,6.222992396942573e-06,2025-07-08 05:31:09.596699,2025-07-08 05:33:37.446372,0 days 00:02:27.849673,identity,16,119,0.00010011037641326587,19,COMPLETE
477,2.9354903745115735e-05,2025-07-08 05:33:37.447218,2025-07-08 05:34:54.736530,0 days 00:01:17.289312,identity,32,117,0.00013353756298337049,18,COMPLETE
478,3.5818752621707972e-06,2025-07-08 05:34:54.737445,2025-07-08 05:37:42.607147,0 days 00:02:47.869702,identity,16,114,0.00012060726665790467,18,COMPLETE
479,3.4664869872358395e-06,2025-07-08 05:37:42.607999,2025-07-08 05:40:03.058684,0 days 00:02:20.450685,identity,16,120,0.00011038284509119249,18,COMPLETE
480,3.546166908563464e-06,2025-07-08 05:40:03.059652,2025-07-08 05:42:25.087289,0 days 00:02:22.027637,identity,16,119,0.00010040616318893083,18,COMPLETE
481,3.460684411038528e-06,2025-07-08 05:42:25.088190,2025-07-08 05:44:41.874921,0 days 00:02:16.786731,identity,16,116,0.00013618607471026684,17,COMPLETE
482,1.9310540665173903e-05,2025-07-08 05:44:41.875855,2025-07-08 05:47:28.175155,0 days 00:02:46.299300,identity,16,98,0.0033963467682852785,19,COMPLETE
483,3.4394718113617273e-06,2025-07-08 05:47:28.176043,2025-07-08 05:49:57.903329,0 days 00:02:29.727286,identity,16,121,0.00012618815626016364,19,COMPLETE
484,2.4996539650601335e-05,2025-07-08 05:49:57.904267,2025-07-08 05:50:49.596572,0 days 00:00:51.692305,identity,64,112,0.00015048000435133953,18,COMPLETE
485,3.4253894227731507e-06,2025-07-08 05:50:49.597447,2025-07-08 05:53:13.198187,0 days 00:02:23.600740,identity,16,121,0.00011596549070040942,18,COMPLETE
486,3.7801542021043133e-06,2025-07-08 05:53:13.199144,2025-07-08 05:55:36.027886,0 days 00:02:22.828742,identity,16,119,0.00011025156971100127,18,COMPLETE
487,3.853605448966846e-06,2025-07-08 05:55:36.028756,2025-07-08 05:58:28.001299,0 days 00:02:51.972543,identity,16,115,0.00013109728013887596,18,COMPLETE
488,1.5779978639329784e-05,2025-07-08 05:58:28.002226,2025-07-08 06:00:48.393396,0 days 00:02:20.391170,identity,16,122,0.003914849308514457,17,COMPLETE
489,3.65616028830118e-06,2025-07-08 06:00:48.394268,2025-07-08 06:03:46.658898,0 days 00:02:58.264630,identity,16,107,0.00012040022691495788,19,COMPLETE
490,0.007537839002907276,2025-07-08 06:03:46.659799,2025-07-08 06:04:30.076271,0 days 00:00:43.416472,identity,128,118,0.00014239631000488256,18,COMPLETE
491,3.557347099558683e-06,2025-07-08 06:04:30.077153,2025-07-08 06:07:01.119289,0 days 00:02:31.042136,identity,16,123,0.00010763729110400582,19,COMPLETE
492,1.3172639608383179,2025-07-08 06:07:01.120221,2025-07-08 06:09:01.653369,0 days 00:02:00.533148,relu,16,121,0.00012585848039558853,14,COMPLETE
493,3.6079841265745927e-06,2025-07-08 06:09:01.654235,2025-07-08 06:11:22.191767,0 days 00:02:20.537532,identity,16,116,0.00011607908724208972,18,COMPLETE
494,3.5450555060378974e-06,2025-07-08 06:11:22.192718,2025-07-08 06:14:21.023236,0 days 00:02:58.830518,identity,16,111,0.0001004658424034632,19,COMPLETE
495,5.812502422486432e-06,2025-07-08 06:14:21.024114,2025-07-08 06:16:11.921942,0 days 00:01:50.897828,identity,16,102,0.0009024189918071992,11,COMPLETE
496,3.3072374208131805e-06,2025-07-08 06:16:11.922925,2025-07-08 06:18:33.004798,0 days 00:02:21.081873,identity,16,123,0.00015970367277618833,17,COMPLETE
497,3.626987017923966e-05,2025-07-08 06:18:33.005678,2025-07-08 06:20:46.531208,0 days 00:02:13.525530,identity,16,123,0.005704956861252198,16,COMPLETE
498,3.586741286198958e-06,2025-07-08 06:20:46.532161,2025-07-08 06:22:53.846252,0 days 00:02:07.314091,identity,16,125,0.00015338364538419958,15,COMPLETE
499,3.33735488311504e-06,2025-07-08 06:22:53.847153,2025-07-08 06:25:11.394343,0 days 00:02:17.547190,identity,16,120,0.00013943640355460786,17,COMPLETE
