number,value,datetime_start,datetime_complete,duration,params_activation,params_batch_size,params_h,params_lr,params_seq_length,state
143,3.6528481359709986e-06,2025-07-07 16:49:06.344107,2025-07-07 16:51:41.588187,0 days 00:02:35.244080,identity,16,121,0.0001554389952493298,20,COMPLETE
144,3.603338655011612e-06,2025-07-07 16:51:41.588952,2025-07-07 16:54:11.348000,0 days 00:02:29.759048,identity,16,124,0.0001242905983610291,19,COMPLETE
145,3.432681751291966e-06,2025-07-07 16:54:11.348736,2025-07-07 16:56:45.980846,0 days 00:02:34.632110,identity,16,119,0.00016642032164697885,20,COMPLETE
146,3.5374498565943213e-06,2025-07-07 16:56:45.981615,2025-07-07 16:59:15.160826,0 days 00:02:29.179211,identity,16,122,0.00014043748052393942,19,COMPLETE
147,3.5542248042474966e-06,2025-07-07 16:59:15.161554,2025-07-07 17:01:44.282614,0 days 00:02:29.121060,identity,16,128,0.00011252915294246911,19,COMPLETE
148,3.317862137919292e-06,2025-07-07 17:01:44.283412,2025-07-07 17:04:36.109593,0 days 00:02:51.826181,identity,16,114,0.00012784857069125216,18,COMPLETE
149,0.00024547503562644124,2025-07-07 17:04:36.110317,2025-07-07 17:05:28.996528,0 days 00:00:52.886211,identity,64,114,0.000132450592951664,18,COMPLETE
150,0.014161358587443829,2025-07-07 17:05:28.997294,2025-07-07 17:06:10.366458,0 days 00:00:41.369164,identity,128,117,0.00010013622935584643,17,COMPLETE
151,3.4978531857632333e-06,2025-07-07 17:06:10.367222,2025-07-07 17:08:43.050842,0 days 00:02:32.683620,identity,16,124,0.0001240597911799878,18,COMPLETE
152,3.5745815694099292e-06,2025-07-07 17:08:43.051626,2025-07-07 17:11:04.201913,0 days 00:02:21.150287,identity,16,120,0.0001104757086522915,18,COMPLETE
153,3.6477899811870884e-06,2025-07-07 17:11:04.202692,2025-07-07 17:13:43.047971,0 days 00:02:38.845279,identity,16,126,0.00016155060737017891,20,COMPLETE
154,3.507783958411892e-06,2025-07-07 17:13:43.048701,2025-07-07 17:16:10.008020,0 days 00:02:26.959319,identity,16,116,0.0001454672772025559,19,COMPLETE
155,3.4439713090250734e-06,2025-07-07 17:16:10.008805,2025-07-07 17:18:34.939389,0 days 00:02:24.930584,identity,16,122,0.0001229134240207009,17,COMPLETE
156,3.335077735755476e-06,2025-07-07 17:18:34.940101,2025-07-07 17:21:04.112605,0 days 00:02:29.172504,identity,16,119,0.0001794318890721189,19,COMPLETE
157,3.669770876513212e-06,2025-07-07 17:21:04.113416,2025-07-07 17:23:55.603544,0 days 00:02:51.490128,identity,16,113,0.00023310963840581783,18,COMPLETE
158,3.690898438435397e-06,2025-07-07 17:23:55.604311,2025-07-07 17:26:31.640917,0 days 00:02:36.036606,identity,16,109,0.00018451370921719837,16,COMPLETE
159,4.46220383309992e-06,2025-07-07 17:26:31.641672,2025-07-07 17:29:07.070235,0 days 00:02:35.428563,relu,16,118,0.00011488791955235878,20,COMPLETE
160,3.566740815585945e-06,2025-07-07 17:29:07.070972,2025-07-07 17:31:40.129174,0 days 00:02:33.058202,identity,16,125,0.00013294886788342463,19,COMPLETE
161,3.5305188248457853e-06,2025-07-07 17:31:40.129979,2025-07-07 17:34:07.938074,0 days 00:02:27.808095,identity,16,120,0.00016520881304300293,19,COMPLETE
162,3.472804792181705e-06,2025-07-07 17:34:07.938796,2025-07-07 17:36:37.237656,0 days 00:02:29.298860,identity,16,122,0.0001474235135394053,19,COMPLETE
163,2.994676287926268e-05,2025-07-07 17:36:37.238431,2025-07-07 17:39:05.433347,0 days 00:02:28.194916,identity,16,118,0.0035365871753971936,19,COMPLETE
164,3.4981842418346787e-06,2025-07-07 17:39:05.434123,2025-07-07 17:42:17.221037,0 days 00:03:11.786914,identity,16,115,0.000132302538433213,20,COMPLETE
165,4.085705768375192e-06,2025-07-07 17:42:17.221829,2025-07-07 17:43:50.916243,0 days 00:01:33.694414,identity,16,126,0.0002013621127785888,10,COMPLETE
166,4.710759185400093e-06,2025-07-07 17:43:50.916960,2025-07-07 17:46:35.443089,0 days 00:02:44.526129,identity,16,83,0.00011103135560147385,19,COMPLETE
167,3.3610540413064882e-06,2025-07-07 17:46:35.443878,2025-07-07 17:49:08.104434,0 days 00:02:32.660556,identity,16,123,0.00012039993939673954,18,COMPLETE
168,9.529047019896097e-06,2025-07-07 17:49:08.105165,2025-07-07 17:50:50.668303,0 days 00:01:42.563138,identity,16,42,0.00011981225158965708,18,COMPLETE
169,5.983765731798485e-06,2025-07-07 17:50:50.669062,2025-07-07 17:51:57.387049,0 days 00:01:06.717987,identity,32,69,0.0019422774905787836,18,COMPLETE
170,3.3936676118173636e-06,2025-07-07 17:51:57.387860,2025-07-07 17:54:29.860492,0 days 00:02:32.472632,identity,16,123,0.00010763727718662295,18,COMPLETE
171,4.459425781533355e-06,2025-07-07 17:54:29.861309,2025-07-07 17:57:02.669430,0 days 00:02:32.808121,identity,16,123,0.00010033529570366229,18,COMPLETE
172,3.443028163019335e-06,2025-07-07 17:57:02.670176,2025-07-07 17:59:27.458988,0 days 00:02:24.788812,identity,16,128,0.00010655193158817447,17,COMPLETE
173,3.292993369541364e-06,2025-07-07 17:59:27.459758,2025-07-07 18:02:00.375555,0 days 00:02:32.915797,identity,16,124,0.00011806773502898817,18,COMPLETE
174,3.6764693049917696e-06,2025-07-07 18:02:00.376304,2025-07-07 18:04:32.944931,0 days 00:02:32.568627,identity,16,124,0.00011708865798520098,18,COMPLETE
175,3.4625848002178827e-06,2025-07-07 18:04:32.945707,2025-07-07 18:06:56.839095,0 days 00:02:23.893388,identity,16,122,0.00012914803539797626,18,COMPLETE
176,3.6326202916825423e-06,2025-07-07 18:06:56.839865,2025-07-07 18:09:31.908236,0 days 00:02:35.068371,identity,16,125,0.00010791669966860536,18,COMPLETE
177,3.5558359741116874e-06,2025-07-07 18:09:31.909048,2025-07-07 18:11:56.392341,0 days 00:02:24.483293,identity,16,128,0.00012290328930357965,17,COMPLETE
178,0.00020586926257237792,2025-07-07 18:11:56.393081,2025-07-07 18:12:50.449251,0 days 00:00:54.056170,identity,64,120,0.00013934300468167987,18,COMPLETE
179,3.276461939094588e-06,2025-07-07 18:12:50.450034,2025-07-07 18:15:24.263417,0 days 00:02:33.813383,identity,16,126,0.00011485158595402223,18,COMPLETE
180,3.6357789667817997e-06,2025-07-07 18:15:24.264163,2025-07-07 18:17:50.911764,0 days 00:02:26.647601,identity,16,126,0.0001090612214279666,17,COMPLETE
181,3.2215132250712486e-06,2025-07-07 18:17:50.912526,2025-07-07 18:20:23.009659,0 days 00:02:32.097133,identity,16,123,0.00011758200169856971,18,COMPLETE
182,3.3832372992037563e-06,2025-07-07 18:20:23.010377,2025-07-07 18:22:56.761291,0 days 00:02:33.750914,identity,16,123,0.00011791478637397838,18,COMPLETE
183,4.663559593609534e-06,2025-07-07 18:22:56.762067,2025-07-07 18:25:31.632254,0 days 00:02:34.870187,identity,16,126,0.000384917485364658,18,COMPLETE
184,3.3381293178535998e-06,2025-07-07 18:25:31.633019,2025-07-07 18:28:05.481697,0 days 00:02:33.848678,identity,16,124,0.00011993201721423972,18,COMPLETE
185,3.516661763569573e-06,2025-07-07 18:28:05.482480,2025-07-07 18:30:38.956339,0 days 00:02:33.473859,identity,16,123,0.00012102884051046922,18,COMPLETE
186,3.4981076169060543e-06,2025-07-07 18:30:38.957080,2025-07-07 18:33:11.340211,0 days 00:02:32.383131,identity,16,128,0.0001329167496592188,18,COMPLETE
187,3.3884016374940984e-06,2025-07-07 18:33:11.340979,2025-07-07 18:35:34.562930,0 days 00:02:23.221951,identity,16,121,0.00011679840864239656,18,COMPLETE
188,0.007709417957812548,2025-07-07 18:35:34.563666,2025-07-07 18:36:19.914221,0 days 00:00:45.350555,identity,128,125,0.00012855942228599064,17,COMPLETE
189,3.3083433663705364e-06,2025-07-07 18:36:19.914997,2025-07-07 18:38:40.560867,0 days 00:02:20.645870,identity,16,117,0.00010205311920270629,18,COMPLETE
190,3.969173576479079e-06,2025-07-07 18:38:40.561638,2025-07-07 18:41:04.823176,0 days 00:02:24.261538,relu,16,117,0.00010078570444777482,17,COMPLETE
191,3.4487277389416704e-06,2025-07-07 18:41:04.823961,2025-07-07 18:43:27.415494,0 days 00:02:22.591533,identity,16,122,0.00011428372578779342,18,COMPLETE
192,3.693988219310995e-06,2025-07-07 18:43:27.416232,2025-07-07 18:45:49.109186,0 days 00:02:21.692954,identity,16,119,0.00010016915547741607,18,COMPLETE
193,3.775431423491682e-06,2025-07-07 18:45:49.109961,2025-07-07 18:48:23.720122,0 days 00:02:34.610161,identity,16,125,0.00011831144986563751,18,COMPLETE
194,3.382337354196352e-06,2025-07-07 18:48:23.720898,2025-07-07 18:50:43.608878,0 days 00:02:19.887980,identity,16,116,0.00013003930175055838,18,COMPLETE
195,3.5544617276173085e-06,2025-07-07 18:50:43.609683,2025-07-07 18:53:36.923757,0 days 00:02:53.314074,identity,16,115,0.00013569335696843603,18,COMPLETE
196,3.943918272852898e-06,2025-07-07 18:53:36.924524,2025-07-07 18:55:58.559132,0 days 00:02:21.634608,identity,16,117,0.00014295040521355773,18,COMPLETE
197,3.535606992954854e-06,2025-07-07 18:55:58.559925,2025-07-07 18:58:40.260440,0 days 00:02:41.700515,identity,16,112,0.00012686965382377883,17,COMPLETE
198,3.5782588838628726e-06,2025-07-07 18:58:40.261179,2025-07-07 19:01:01.356633,0 days 00:02:21.095454,identity,16,120,0.00010949051242568948,18,COMPLETE
199,3.4366016734566074e-06,2025-07-07 19:01:01.357399,2025-07-07 19:03:34.000786,0 days 00:02:32.643387,identity,16,116,0.00015526375994424842,20,COMPLETE
200,3.37571100317291e-06,2025-07-07 19:03:34.001554,2025-07-07 19:05:56.846367,0 days 00:02:22.844813,identity,16,121,0.0001354656545359017,18,COMPLETE
201,3.6815447401750134e-06,2025-07-07 19:05:56.847150,2025-07-07 19:08:18.546195,0 days 00:02:21.699045,identity,16,119,0.00012904215401340782,18,COMPLETE
202,3.4868830880441237e-06,2025-07-07 19:08:18.546943,2025-07-07 19:10:29.230751,0 days 00:02:10.683808,identity,16,121,0.00013945842600116283,15,COMPLETE
203,3.2724822176533053e-06,2025-07-07 19:10:29.231545,2025-07-07 19:13:02.596816,0 days 00:02:33.365271,identity,16,124,0.00011551243769018042,18,COMPLETE
204,3.5278051200293703e-06,2025-07-07 19:13:02.597574,2025-07-07 19:15:37.992481,0 days 00:02:35.394907,identity,16,126,0.0001260764025900042,18,COMPLETE
205,3.5496109376254026e-06,2025-07-07 19:15:37.993268,2025-07-07 19:18:11.525734,0 days 00:02:33.532466,identity,16,124,0.00011471268791581305,18,COMPLETE
206,3.4219431199744577e-06,2025-07-07 19:18:11.526517,2025-07-07 19:20:41.806796,0 days 00:02:30.280279,identity,16,128,0.00014109181874586183,19,COMPLETE
207,3.808640485658543e-06,2025-07-07 19:20:41.807573,2025-07-07 19:23:16.415634,0 days 00:02:34.608061,identity,16,123,0.00015167751690731604,18,COMPLETE
208,2.3801134375389665e-05,2025-07-07 19:23:16.416379,2025-07-07 19:24:22.848581,0 days 00:01:06.432202,identity,32,126,0.00012161731540316467,14,COMPLETE
209,3.544295623214566e-06,2025-07-07 19:24:22.849383,2025-07-07 19:26:53.742977,0 days 00:02:30.893594,identity,16,121,0.00013202930288787803,19,COMPLETE
210,3.375799224158982e-06,2025-07-07 19:26:53.743733,2025-07-07 19:29:14.508696,0 days 00:02:20.764963,identity,16,124,0.00011007576948539643,17,COMPLETE
211,3.335916971991537e-06,2025-07-07 19:29:14.509525,2025-07-07 19:31:35.296229,0 days 00:02:20.786704,identity,16,124,0.00010835774571453126,17,COMPLETE
212,3.4909155601781094e-06,2025-07-07 19:31:35.296975,2025-07-07 19:33:49.274087,0 days 00:02:13.977112,identity,16,123,0.00011077991251316307,16,COMPLETE
213,3.676115056805429e-06,2025-07-07 19:33:49.274882,2025-07-07 19:36:08.490551,0 days 00:02:19.215669,identity,16,119,0.00012001701520774575,17,COMPLETE
214,3.7708800846303347e-06,2025-07-07 19:36:08.491318,2025-07-07 19:38:28.071771,0 days 00:02:19.580453,identity,16,124,0.0001091590246307751,17,COMPLETE
215,3.348351356180501e-06,2025-07-07 19:38:28.072543,2025-07-07 19:40:50.874188,0 days 00:02:22.801645,identity,16,121,0.00010055217830347234,18,COMPLETE
216,3.447494918873417e-06,2025-07-07 19:40:50.874988,2025-07-07 19:43:09.785884,0 days 00:02:18.910896,identity,16,121,0.00010144822259367358,17,COMPLETE
217,3.4117647373932414e-06,2025-07-07 19:43:09.786670,2025-07-07 19:45:22.347619,0 days 00:02:12.560949,identity,16,124,0.00010029889765233578,16,COMPLETE
218,3.361231847520685e-06,2025-07-07 19:45:22.348358,2025-07-07 19:47:47.236582,0 days 00:02:24.888224,identity,16,128,0.00011501638876844415,18,COMPLETE
219,3.2931372970779194e-06,2025-07-07 19:47:47.237378,2025-07-07 19:50:13.453728,0 days 00:02:26.216350,identity,16,128,0.0001175987183219744,18,COMPLETE
220,3.4662971302168444e-06,2025-07-07 19:50:13.454484,2025-07-07 19:52:43.934379,0 days 00:02:30.479895,identity,16,127,0.00011789794397530438,18,COMPLETE
221,3.4271206459379755e-06,2025-07-07 19:52:43.935169,2025-07-07 19:55:08.944160,0 days 00:02:25.008991,identity,16,128,0.00012228635104672366,18,COMPLETE
222,3.428933268878609e-06,2025-07-07 19:55:08.944908,2025-07-07 19:57:36.691707,0 days 00:02:27.746799,identity,16,126,0.00013556884350207036,18,COMPLETE
223,3.366350028954912e-06,2025-07-07 19:57:36.692527,2025-07-07 19:59:59.282345,0 days 00:02:22.589818,identity,16,122,0.00011314731801678216,18,COMPLETE
224,3.5284331261209445e-06,2025-07-07 19:59:59.283113,2025-07-07 20:02:26.992539,0 days 00:02:27.709426,identity,16,126,0.00010970793701405136,18,COMPLETE
225,0.00022235827054828405,2025-07-07 20:02:26.993314,2025-07-07 20:03:22.626300,0 days 00:00:55.632986,identity,64,128,0.00011492012920761591,18,COMPLETE
226,3.937897872674512e-06,2025-07-07 20:03:22.627070,2025-07-07 20:05:45.357088,0 days 00:02:22.730018,identity,16,122,0.00010041596361911555,18,COMPLETE
227,3.495751343507436e-06,2025-07-07 20:05:45.357900,2025-07-07 20:08:11.378339,0 days 00:02:26.020439,identity,16,124,0.00012183262347262494,18,COMPLETE
228,4.525114036368905e-06,2025-07-07 20:08:11.379121,2025-07-07 20:10:45.517181,0 days 00:02:34.138060,relu,16,118,0.00011218686799423663,20,COMPLETE
229,3.845499577437295e-06,2025-07-07 20:10:45.518052,2025-07-07 20:13:08.546299,0 days 00:02:23.028247,identity,16,121,0.00012486452607933868,18,COMPLETE
230,0.011523391120135784,2025-07-07 20:13:08.547268,2025-07-07 20:13:55.336803,0 days 00:00:46.789535,identity,128,128,0.00011169043910105937,19,COMPLETE
231,4.090546099178027e-06,2025-07-07 20:13:55.337631,2025-07-07 20:16:19.337298,0 days 00:02:23.999667,identity,16,121,0.00014047960874272853,18,COMPLETE
232,3.691308847919572e-06,2025-07-07 20:16:19.338046,2025-07-07 20:18:47.085023,0 days 00:02:27.746977,identity,16,124,0.00012610861929120005,18,COMPLETE
233,3.540735406204476e-06,2025-07-07 20:18:47.085826,2025-07-07 20:20:39.310362,0 days 00:01:52.224536,identity,16,122,0.00013307287769678507,13,COMPLETE
234,3.758941829801188e-06,2025-07-07 20:20:39.311114,2025-07-07 20:23:02.476774,0 days 00:02:23.165660,identity,16,119,0.00010660206384536169,18,COMPLETE
235,3.3981912110903068e-06,2025-07-07 20:23:02.477603,2025-07-07 20:25:32.263904,0 days 00:02:29.786301,identity,16,125,0.00014675120636506886,18,COMPLETE
236,3.3226092455151957e-06,2025-07-07 20:25:32.264689,2025-07-07 20:27:56.782415,0 days 00:02:24.517726,identity,16,122,0.00011874878858190573,18,COMPLETE
237,3.493560825518216e-06,2025-07-07 20:27:56.783228,2025-07-07 20:30:26.568072,0 days 00:02:29.784844,identity,16,126,0.00011823141987725307,18,COMPLETE
238,3.397389946258045e-06,2025-07-07 20:30:26.568837,2025-07-07 20:32:55.900423,0 days 00:02:29.331586,identity,16,118,0.0001059700619612973,19,COMPLETE
239,3.366467581145116e-06,2025-07-07 20:32:55.901264,2025-07-07 20:35:34.398525,0 days 00:02:38.497261,identity,16,123,0.00012076218901698976,20,COMPLETE
240,3.3198878099938156e-06,2025-07-07 20:35:34.399288,2025-07-07 20:38:04.266617,0 days 00:02:29.867329,identity,16,125,0.00011635870221691889,18,COMPLETE
241,3.430104015933466e-06,2025-07-07 20:38:04.267479,2025-07-07 20:40:34.688874,0 days 00:02:30.421395,identity,16,125,0.00011037469540135152,18,COMPLETE
242,3.5398954878473887e-06,2025-07-07 20:40:34.689647,2025-07-07 20:43:01.382879,0 days 00:02:26.693232,identity,16,128,0.00012026595856767962,18,COMPLETE
243,4.3668924263329245e-06,2025-07-07 20:43:01.383736,2025-07-07 20:45:29.086442,0 days 00:02:27.702706,identity,16,123,0.00010097643998888975,18,COMPLETE
244,3.3001858810166596e-06,2025-07-07 20:45:29.087214,2025-07-07 20:47:50.306027,0 days 00:02:21.218813,identity,16,120,0.00012778173155503813,18,COMPLETE
245,3.4508977933001006e-06,2025-07-07 20:47:50.306871,2025-07-07 20:50:11.925507,0 days 00:02:21.618636,identity,16,119,0.0001286582940817058,18,COMPLETE
246,3.6080964491702616e-06,2025-07-07 20:50:11.926266,2025-07-07 20:52:39.627206,0 days 00:02:27.700940,identity,16,126,0.00014077526773085102,18,COMPLETE
247,3.4948614029417513e-06,2025-07-07 20:52:39.628019,2025-07-07 20:55:06.725371,0 days 00:02:27.097352,identity,16,120,0.00012975960041104598,19,COMPLETE
248,3.427435331104789e-06,2025-07-07 20:55:06.726130,2025-07-07 20:57:45.289644,0 days 00:02:38.563514,identity,16,125,0.00015666335692744723,20,COMPLETE
249,3.4267836781509686e-06,2025-07-07 20:57:45.290440,2025-07-07 21:00:06.182770,0 days 00:02:20.892330,identity,16,117,0.00011520649866506757,18,COMPLETE
250,3.5860541629517684e-06,2025-07-07 21:00:06.183532,2025-07-07 21:02:25.815127,0 days 00:02:19.631595,identity,16,123,0.00012504946776554298,17,COMPLETE
251,3.559138349373825e-06,2025-07-07 21:02:25.815966,2025-07-07 21:04:54.802727,0 days 00:02:28.986761,identity,16,128,0.00010000953154896222,19,COMPLETE
252,1.715402686386369e-05,2025-07-07 21:04:54.803515,2025-07-07 21:06:13.583816,0 days 00:01:18.780301,identity,32,121,0.00011509478002353215,18,COMPLETE
253,3.462277163635008e-06,2025-07-07 21:06:13.584648,2025-07-07 21:09:11.089253,0 days 00:02:57.504605,identity,16,115,0.00014225701482217364,19,COMPLETE
254,3.545742629285087e-06,2025-07-07 21:09:11.090070,2025-07-07 21:11:49.494043,0 days 00:02:38.403973,identity,16,125,0.00013123841126206896,20,COMPLETE
255,3.4295230761927087e-06,2025-07-07 21:11:49.494861,2025-07-07 21:14:10.973981,0 days 00:02:21.479120,identity,16,119,0.000108507423456375,18,COMPLETE
256,3.282702891738154e-06,2025-07-07 21:14:10.974770,2025-07-07 21:16:37.285557,0 days 00:02:26.310787,identity,16,123,0.00012099029140084262,18,COMPLETE
257,1.316388487815857,2025-07-07 21:16:37.286371,2025-07-07 21:19:00.303708,0 days 00:02:23.017337,relu,16,122,0.00012024423547157347,18,COMPLETE
258,0.0004972139140591025,2025-07-07 21:19:00.304468,2025-07-07 21:19:52.291254,0 days 00:00:51.986786,identity,64,117,0.00010742714172518282,17,COMPLETE
259,3.356691377121024e-05,2025-07-07 21:19:52.292069,2025-07-07 21:22:22.032363,0 days 00:02:29.740294,identity,16,126,0.0065053283156548914,18,COMPLETE
260,7.83303585194517e-06,2025-07-07 21:22:22.033143,2025-07-07 21:24:45.975813,0 days 00:02:23.942670,identity,16,121,0.0012460861079828852,18,COMPLETE
261,3.593493829612271e-06,2025-07-07 21:24:45.976642,2025-07-07 21:27:14.049866,0 days 00:02:28.073224,identity,16,123,0.0001285689825878999,18,COMPLETE
262,3.732612185558537e-06,2025-07-07 21:27:14.050630,2025-07-07 21:30:12.813122,0 days 00:02:58.762492,identity,16,114,0.00011679892489179782,19,COMPLETE
263,3.4468723697500536e-06,2025-07-07 21:30:12.813946,2025-07-07 21:32:39.620138,0 days 00:02:26.806192,identity,16,128,0.00014239741191462592,18,COMPLETE
264,0.014209510758519173,2025-07-07 21:32:39.620931,2025-07-07 21:33:24.461790,0 days 00:00:44.840859,identity,128,119,0.00010005898127411041,18,COMPLETE
265,3.3754367905203253e-06,2025-07-07 21:33:24.462628,2025-07-07 21:35:57.431269,0 days 00:02:32.968641,identity,16,126,0.00012410194623404326,19,COMPLETE
266,3.60009289579466e-06,2025-07-07 21:35:57.432087,2025-07-07 21:38:18.641262,0 days 00:02:21.209175,identity,16,124,0.00011157832319225374,17,COMPLETE
267,3.6438414099393412e-06,2025-07-07 21:38:18.642063,2025-07-07 21:40:43.038547,0 days 00:02:24.396484,identity,16,121,0.00013312124892615265,18,COMPLETE
268,3.343763637531083e-06,2025-07-07 21:40:43.039364,2025-07-07 21:43:12.033325,0 days 00:02:28.993961,identity,16,117,0.000154661906321691,19,COMPLETE
269,5.462857188831549e-06,2025-07-07 21:43:12.034149,2025-07-07 21:45:40.794832,0 days 00:02:28.760683,identity,16,117,0.00015977440457759607,19,COMPLETE
270,3.519411393426708e-06,2025-07-07 21:45:40.795608,2025-07-07 21:48:40.702635,0 days 00:02:59.907027,identity,16,115,0.0001544462489650611,19,COMPLETE
271,3.547097549017053e-06,2025-07-07 21:48:40.703421,2025-07-07 21:51:38.558802,0 days 00:02:57.855381,identity,16,113,0.00014065617205384469,19,COMPLETE
272,5.396585493144812e-06,2025-07-07 21:51:38.559624,2025-07-07 21:54:06.891794,0 days 00:02:28.332170,identity,16,119,0.0006709055015707833,19,COMPLETE
273,4.393624749354785e-06,2025-07-07 21:54:06.892616,2025-07-07 21:55:58.961634,0 days 00:01:52.069018,identity,16,64,0.0001490455375094634,19,COMPLETE
274,3.7565280308626825e-06,2025-07-07 21:55:58.962404,2025-07-07 21:58:19.429287,0 days 00:02:20.466883,identity,16,117,0.0001662782123351433,18,COMPLETE
275,3.289840606157668e-06,2025-07-07 21:58:19.430084,2025-07-07 22:00:46.845926,0 days 00:02:27.415842,identity,16,120,0.0001273818741799392,19,COMPLETE
276,1.52639695443213e-05,2025-07-07 22:00:46.846722,2025-07-07 22:02:08.001900,0 days 00:01:21.155178,identity,32,120,0.00013354369468605913,19,COMPLETE
277,1.316251516342163,2025-07-07 22:02:08.002722,2025-07-07 22:04:35.497294,0 days 00:02:27.494572,relu,16,116,0.00012941235296540357,19,COMPLETE
278,4.437451480043819e-06,2025-07-07 22:04:35.498121,2025-07-07 22:07:04.779726,0 days 00:02:29.281605,identity,16,121,0.00033336968084256893,19,COMPLETE
279,7.287171683856286e-06,2025-07-07 22:07:04.780541,2025-07-07 22:09:31.736402,0 days 00:02:26.955861,identity,16,118,0.0009235357372017126,19,COMPLETE
280,3.916788500646362e-06,2025-07-07 22:09:31.737179,2025-07-07 22:10:58.208045,0 days 00:01:26.470866,identity,16,112,0.0001484251262418573,8,COMPLETE
281,1.1903295671800151e-05,2025-07-07 22:10:58.208855,2025-07-07 22:12:41.502737,0 days 00:01:43.293882,identity,16,57,0.00010603708444198008,17,COMPLETE
282,3.5622454106487567e-06,2025-07-07 22:12:41.503556,2025-07-07 22:15:11.610012,0 days 00:02:30.106456,identity,16,123,0.00012115536859111522,19,COMPLETE
283,0.00019421523029450327,2025-07-07 22:15:11.610837,2025-07-07 22:16:11.004843,0 days 00:00:59.394006,identity,64,120,0.00013808687130821426,20,COMPLETE
284,4.033724962937413e-06,2025-07-07 22:16:11.005626,2025-07-07 22:18:40.917597,0 days 00:02:29.911971,identity,16,124,0.00010832885311083142,19,COMPLETE
