number,value,datetime_start,datetime_complete,duration,params_activation,params_and_operator,params_lr,params_n_sets,params_seq_length,params_shape,state
0,1.3161295652389526,2025-07-10 19:19:50.236022,2025-07-10 19:22:21.255687,0 days 00:02:31.019665,relu,prod,0.0026619017194300446,7,25,sigmoid,COMPLETE
1,1.4644971997768153e-05,2025-07-10 19:22:21.273632,2025-07-10 19:24:39.411981,0 days 00:02:18.138349,relu,prod,0.009141659772065951,7,22,gaussian,COMPLETE
2,0.037473347038030624,2025-07-10 19:24:39.412879,2025-07-10 19:26:45.097006,0 days 00:02:05.684127,relu,min,0.00034666473322517876,6,19,bell,COMPLETE
3,0.1048496812582016,2025-07-10 19:26:45.097881,2025-07-10 19:28:36.828346,0 days 00:01:51.730465,relu,min,0.0008745206595064828,8,16,gaussian,COMPLETE
4,0.007975040934979916,2025-07-10 19:28:36.829215,2025-07-10 19:30:16.057882,0 days 00:01:39.228667,relu,prod,0.007419994798134991,9,12,sigmoid,COMPLETE
5,1.3376441529544536e-05,2025-07-10 19:30:16.058892,2025-07-10 19:31:26.418259,0 days 00:01:10.359367,identity,prod,0.0018548200578954123,6,5,bell,COMPLETE
6,0.04097194969654083,2025-07-10 19:31:26.418834,2025-07-10 19:33:23.829619,0 days 00:01:57.410785,identity,prod,0.0005173376822406343,9,15,bell,COMPLETE
7,0.002289101481437683,2025-07-10 19:33:23.830509,2025-07-10 19:34:51.758849,0 days 00:01:27.928340,relu,min,0.0001690016453993517,5,12,gaussian,COMPLETE
8,3.858038326143287e-06,2025-07-10 19:34:51.759420,2025-07-10 19:36:27.568632,0 days 00:01:35.809212,identity,prod,0.005470758727435346,7,12,gaussian,COMPLETE
9,4.062537118443288e-05,2025-07-10 19:36:27.569488,2025-07-10 19:37:37.175374,0 days 00:01:09.605886,identity,min,0.0032933203373294315,9,5,gaussian,COMPLETE
10,4.2768770072143525e-06,2025-07-10 19:37:37.175929,2025-07-10 19:38:58.041258,0 days 00:01:20.865329,identity,prod,0.004824928430605788,5,9,gaussian,COMPLETE
11,0.00024146356736309826,2025-07-10 19:38:58.041835,2025-07-10 19:40:18.965976,0 days 00:01:20.924141,identity,prod,0.00527882226059233,5,9,gaussian,COMPLETE
12,0.18929331004619598,2025-07-10 19:40:18.966559,2025-07-10 19:41:43.593871,0 days 00:01:24.627312,identity,prod,0.0013826182345691657,6,9,gaussian,COMPLETE
13,0.2863142490386963,2025-07-10 19:41:43.594455,2025-07-10 19:43:15.940219,0 days 00:01:32.345764,identity,prod,0.0043261556710421445,8,10,gaussian,COMPLETE
14,0.0003054888511542231,2025-07-10 19:43:15.941106,2025-07-10 19:44:57.767168,0 days 00:01:41.826062,identity,prod,0.0023652459150521436,5,15,gaussian,COMPLETE
15,0.026281675323843956,2025-07-10 19:44:57.768285,2025-07-10 19:46:15.063851,0 days 00:01:17.295566,identity,prod,0.00088743159123303,8,7,sigmoid,COMPLETE
16,3.6747384001500905e-05,2025-07-10 19:46:15.064439,2025-07-10 19:47:48.472560,0 days 00:01:33.408121,identity,prod,0.006022627656596987,6,12,gaussian,COMPLETE
17,3.815208856394747e-06,2025-07-10 19:47:48.473437,2025-07-10 19:49:53.666489,0 days 00:02:05.193052,identity,prod,0.009406228742825417,7,19,gaussian,COMPLETE
18,0.03257453441619873,2025-07-10 19:49:53.667557,2025-07-10 19:51:55.644786,0 days 00:02:01.977229,identity,min,0.00010453104581387981,7,19,sigmoid,COMPLETE
19,4.096201791981002e-06,2025-07-10 19:51:55.645703,2025-07-10 19:54:01.142486,0 days 00:02:05.496783,identity,prod,0.009976859150751876,7,18,bell,COMPLETE
20,0.00038006744580343366,2025-07-10 19:54:01.143485,2025-07-10 19:56:19.894081,0 days 00:02:18.750596,identity,prod,0.003475510995763608,8,22,gaussian,COMPLETE
21,0.0009060103329829872,2025-07-10 19:56:19.894956,2025-07-10 19:58:25.191571,0 days 00:02:05.296615,identity,prod,0.008705812767565439,7,18,bell,COMPLETE
22,3.4350709938735235e-06,2025-07-10 19:58:25.192469,2025-07-10 20:00:26.372180,0 days 00:02:01.179711,identity,prod,0.009029487721353237,7,17,bell,COMPLETE
23,2.6094983695656992e-05,2025-07-10 20:00:26.373041,2025-07-10 20:02:44.564155,0 days 00:02:18.191114,identity,prod,0.006542900866148831,7,21,bell,COMPLETE
24,3.5786174521490466e-06,2025-07-10 20:02:44.565073,2025-07-10 20:04:42.810420,0 days 00:01:58.245347,identity,prod,0.0040711420917512895,8,16,bell,COMPLETE
25,0.004303123336285353,2025-07-10 20:04:42.811332,2025-07-10 20:06:41.053492,0 days 00:01:58.242160,identity,prod,0.001751667276216133,8,16,bell,COMPLETE
26,1.1002178325725254e-05,2025-07-10 20:06:41.054350,2025-07-10 20:09:10.800120,0 days 00:02:29.745770,identity,min,0.0032737870436734275,8,24,bell,COMPLETE
27,4.150226232013665e-06,2025-07-10 20:09:10.801153,2025-07-10 20:10:56.504405,0 days 00:01:45.703252,identity,prod,0.009894921679442531,6,14,bell,COMPLETE
28,4.156038357905345e-06,2025-07-10 20:10:56.505223,2025-07-10 20:13:11.494885,0 days 00:02:14.989662,identity,prod,0.004234291466212779,8,20,bell,COMPLETE
29,0.010794413276016712,2025-07-10 20:13:11.495795,2025-07-10 20:15:40.814083,0 days 00:02:29.318288,relu,prod,0.002834021403532853,7,25,sigmoid,COMPLETE
30,0.003252066671848297,2025-07-10 20:15:40.815003,2025-07-10 20:17:41.970700,0 days 00:02:01.155697,identity,prod,0.007100541314182721,7,17,bell,COMPLETE
31,0.06365043669939041,2025-07-10 20:17:41.971738,2025-07-10 20:19:22.069467,0 days 00:01:40.097729,identity,prod,0.005708168836912137,7,13,gaussian,COMPLETE
32,3.7048662306915503e-06,2025-07-10 20:19:22.070446,2025-07-10 20:21:23.264812,0 days 00:02:01.194366,identity,prod,0.0070366846963038875,7,17,bell,COMPLETE
33,2.130887696694117e-05,2025-07-10 20:21:23.265790,2025-07-10 20:23:21.701369,0 days 00:01:58.435579,identity,prod,0.0077510078493230015,6,17,bell,COMPLETE
34,5.990592853777343e-06,2025-07-10 20:23:21.702364,2025-07-10 20:25:36.071763,0 days 00:02:14.369399,relu,prod,0.003888319830211321,7,20,bell,COMPLETE
35,0.0022548544220626354,2025-07-10 20:25:36.072656,2025-07-10 20:27:36.577112,0 days 00:02:00.504456,relu,min,0.0024225065164819935,8,17,bell,COMPLETE
36,0.015426778234541416,2025-07-10 20:27:36.577968,2025-07-10 20:29:43.323390,0 days 00:02:06.745422,identity,prod,0.0005222075255990159,6,19,bell,COMPLETE
37,0.00017085354193113744,2025-07-10 20:29:43.324316,2025-07-10 20:31:36.008528,0 days 00:01:52.684212,identity,prod,0.007175545295122454,9,14,bell,COMPLETE
38,0.04092841222882271,2025-07-10 20:31:36.009473,2025-07-10 20:33:25.952392,0 days 00:01:49.942919,relu,min,0.0013381124511359142,7,16,sigmoid,COMPLETE
39,4.22736684413394e-06,2025-07-10 20:33:25.953269,2025-07-10 20:35:53.529766,0 days 00:02:27.576497,identity,prod,0.00844994033317123,8,23,bell,COMPLETE
40,0.0025780622381716967,2025-07-10 20:35:53.551629,2025-07-10 20:38:08.688184,0 days 00:02:15.136555,identity,prod,0.0006522864057517312,6,21,bell,COMPLETE
41,0.41948288679122925,2025-07-10 20:38:08.689168,2025-07-10 20:39:57.177476,0 days 00:01:48.488308,identity,prod,0.005143187734035085,7,15,gaussian,COMPLETE
42,0.26515355706214905,2025-07-10 20:39:57.273831,2025-07-10 20:41:37.291550,0 days 00:01:40.017719,identity,prod,0.00027342690113847065,7,13,gaussian,COMPLETE
43,0.2736002206802368,2025-07-10 20:41:37.292406,2025-07-10 20:43:12.246464,0 days 00:01:34.954058,identity,prod,0.006019520556957708,7,11,gaussian,COMPLETE
44,0.0053626918233931065,2025-07-10 20:43:12.247468,2025-07-10 20:45:13.620522,0 days 00:02:01.373054,identity,prod,0.005132371195955431,7,18,gaussian,COMPLETE
45,3.637207328210934e-06,2025-07-10 20:45:13.621445,2025-07-10 20:47:10.467408,0 days 00:01:56.845963,identity,prod,0.007932720830754495,7,16,bell,COMPLETE
46,1.3167331218719482,2025-07-10 20:47:10.524981,2025-07-10 20:49:12.393875,0 days 00:02:01.868894,relu,prod,0.007478153451435151,9,16,bell,COMPLETE
47,3.414266302570468e-06,2025-07-10 20:49:12.827573,2025-07-10 20:51:12.046842,0 days 00:01:59.219269,identity,min,0.009604699021930476,7,17,bell,COMPLETE
48,1.1769533557526302e-05,2025-07-10 20:51:12.047711,2025-07-10 20:52:59.521194,0 days 00:01:47.473483,identity,min,0.004646427375478682,8,14,bell,COMPLETE
49,4.707746938947821e-06,2025-07-10 20:52:59.522040,2025-07-10 20:54:52.174555,0 days 00:01:52.652515,identity,min,0.006675163542263393,6,16,bell,COMPLETE
50,1.0577931789157446e-05,2025-07-10 20:54:52.175405,2025-07-10 20:56:52.453111,0 days 00:02:00.277706,identity,min,0.002779622262555966,8,17,bell,COMPLETE
51,4.355707915237872e-06,2025-07-10 20:56:52.454077,2025-07-10 20:58:55.918254,0 days 00:02:03.464177,identity,min,0.008982696991207302,7,18,bell,COMPLETE
52,0.0005490314215421677,2025-07-10 20:58:55.919366,2025-07-10 21:01:03.493319,0 days 00:02:07.573953,identity,min,0.009944272022327791,7,19,bell,COMPLETE
53,0.0005252958508208394,2025-07-10 21:01:03.494251,2025-07-10 21:02:53.413862,0 days 00:01:49.919611,identity,prod,0.007975312565461539,6,15,bell,COMPLETE
54,0.00025345582980662584,2025-07-10 21:02:53.414795,2025-07-10 21:05:01.634979,0 days 00:02:08.220184,identity,prod,0.006087420511443512,7,20,sigmoid,COMPLETE
55,0.00036994952824898064,2025-07-10 21:05:01.635851,2025-07-10 21:07:01.079902,0 days 00:01:59.444051,identity,min,0.008307512401840885,7,17,bell,COMPLETE
56,0.006078138016164303,2025-07-10 21:07:01.080768,2025-07-10 21:09:10.854309,0 days 00:02:09.773541,identity,prod,0.003695985759714652,7,19,bell,COMPLETE
57,0.00044385253568179905,2025-07-10 21:09:10.855417,2025-07-10 21:11:09.124830,0 days 00:01:58.269413,identity,prod,0.004384682728896982,8,16,bell,COMPLETE
58,3.5046459743171e-06,2025-07-10 21:11:09.125818,2025-07-10 21:13:11.717255,0 days 00:02:02.591437,identity,prod,0.0063495643608607105,6,18,bell,COMPLETE
59,4.075046945217764e-06,2025-07-10 21:13:11.718255,2025-07-10 21:15:09.110866,0 days 00:01:57.392611,identity,prod,0.005561029176710834,5,18,bell,COMPLETE
60,4.737586550618289e-06,2025-07-10 21:15:09.154167,2025-07-10 21:16:45.387400,0 days 00:01:36.233233,relu,min,0.00653672061024539,5,13,bell,COMPLETE
61,0.00038399314507842064,2025-07-10 21:16:45.388255,2025-07-10 21:18:37.998897,0 days 00:01:52.610642,identity,prod,0.008863699716564092,7,15,bell,COMPLETE
62,6.75930186844198e-06,2025-07-10 21:18:37.999888,2025-07-10 21:20:36.271948,0 days 00:01:58.272060,identity,prod,0.007638549198772633,6,17,bell,COMPLETE
63,0.005555678624659777,2025-07-10 21:20:36.272875,2025-07-10 21:22:48.600317,0 days 00:02:12.327442,identity,prod,0.006749386889543241,7,21,sigmoid,COMPLETE
64,3.7298375445971033e-06,2025-07-10 21:22:48.601233,2025-07-10 21:24:59.618398,0 days 00:02:11.017165,identity,prod,0.00990885896152276,6,20,bell,COMPLETE
65,4.341821841080673e-05,2025-07-10 21:24:59.619340,2025-07-10 21:27:02.337792,0 days 00:02:02.718452,identity,prod,0.0048918702407202,6,18,bell,COMPLETE
66,0.0002441647811792791,2025-07-10 21:27:02.338683,2025-07-10 21:29:13.467653,0 days 00:02:11.128970,identity,prod,0.009891896007639876,6,20,bell,COMPLETE
67,4.960020669386722e-05,2025-07-10 21:29:13.468703,2025-07-10 21:30:59.228116,0 days 00:01:45.759413,identity,prod,0.003232387004774976,6,14,bell,COMPLETE
68,0.07376795262098312,2025-07-10 21:30:59.229061,2025-07-10 21:32:48.617597,0 days 00:01:49.388536,identity,prod,0.002040371364700826,5,16,bell,COMPLETE
69,3.628832246249658e-06,2025-07-10 21:32:48.618493,2025-07-10 21:34:38.599919,0 days 00:01:49.981426,identity,prod,0.003996601705712501,6,15,bell,COMPLETE
70,0.000158196926349774,2025-07-10 21:34:38.600811,2025-07-10 21:36:28.553130,0 days 00:01:49.952319,identity,prod,0.0038437473288344647,6,15,bell,COMPLETE
71,0.00031747957109473646,2025-07-10 21:36:28.687710,2025-07-10 21:38:27.059070,0 days 00:01:58.371360,identity,prod,0.005733593942512207,6,17,bell,COMPLETE
72,3.7169215829635505e-06,2025-07-10 21:38:27.060224,2025-07-10 21:40:25.374543,0 days 00:01:58.314319,identity,prod,0.007395143993139087,6,17,bell,COMPLETE
73,0.0054220049642026424,2025-07-10 21:40:25.375428,2025-07-10 21:42:23.755748,0 days 00:01:58.380320,identity,prod,0.007281608792452489,6,17,bell,COMPLETE
74,0.06679149717092514,2025-07-10 21:42:23.756671,2025-07-10 21:44:21.262615,0 days 00:01:57.505944,identity,prod,0.006275513882906791,5,18,bell,COMPLETE
75,0.001927685458213091,2025-07-10 21:44:21.263541,2025-07-10 21:46:13.887717,0 days 00:01:52.624176,identity,prod,0.004216670331044759,7,15,bell,COMPLETE
76,0.00037042153417132795,2025-07-10 21:46:13.888690,2025-07-10 21:48:08.455827,0 days 00:01:54.567137,relu,prod,0.0012630185302402615,6,16,bell,COMPLETE
77,1.7329788533970714e-05,2025-07-10 21:48:08.456728,2025-07-10 21:50:17.203465,0 days 00:02:08.746737,identity,min,0.008494788662814003,8,19,bell,COMPLETE
78,6.209032108017709e-06,2025-07-10 21:50:17.204378,2025-07-10 21:52:09.978356,0 days 00:01:52.773978,identity,prod,0.005251772925315428,9,14,bell,COMPLETE
79,0.10359605401754379,2025-07-10 21:52:09.979289,2025-07-10 21:53:57.042317,0 days 00:01:47.063028,identity,prod,0.0002471332085102031,7,15,sigmoid,COMPLETE
80,1.2672899174503982e-05,2025-07-10 21:53:57.043203,2025-07-10 21:55:11.848085,0 days 00:01:14.804882,identity,prod,0.0030912083683355875,6,6,bell,COMPLETE
81,4.988635737390723e-06,2025-07-10 21:55:11.848685,2025-07-10 21:57:14.512379,0 days 00:02:02.663694,identity,prod,0.00798910739463093,6,18,bell,COMPLETE
82,2.0236146156094037e-05,2025-07-10 21:57:14.513336,2025-07-10 21:59:12.800633,0 days 00:01:58.287297,identity,prod,0.009017030592222275,6,17,bell,COMPLETE
83,0.00810917466878891,2025-07-10 21:59:12.801530,2025-07-10 22:01:23.660393,0 days 00:02:10.858863,identity,prod,0.007157574148893124,6,20,bell,COMPLETE
84,4.336774509283714e-06,2025-07-10 22:01:23.661421,2025-07-10 22:03:45.886877,0 days 00:02:22.225456,identity,prod,0.006492840145921927,7,22,bell,COMPLETE
85,3.98515885535744e-06,2025-07-10 22:03:45.887943,2025-07-10 22:05:39.849811,0 days 00:01:53.961868,identity,prod,0.0047915753745980455,6,16,bell,COMPLETE
86,4.665731012210017e-06,2025-07-10 22:05:39.850838,2025-07-10 22:07:40.798541,0 days 00:02:00.947703,identity,prod,0.009153854198255306,7,17,bell,COMPLETE
87,4.0519462345400825e-06,2025-07-10 22:07:40.813330,2025-07-10 22:09:41.857879,0 days 00:02:01.044549,identity,min,0.00781086847806753,6,18,bell,COMPLETE
88,0.00017701135948300362,2025-07-10 22:09:41.859267,2025-07-10 22:11:52.063649,0 days 00:02:10.204382,relu,prod,0.006084590125987002,7,19,bell,COMPLETE
89,3.6308638300397433e-06,2025-07-10 22:11:52.064559,2025-07-10 22:13:41.711650,0 days 00:01:49.647091,identity,prod,0.009950680616692215,5,16,bell,COMPLETE
90,0.028408795595169067,2025-07-10 22:13:41.712736,2025-07-10 22:15:20.993981,0 days 00:01:39.281245,identity,min,0.00012181461574076576,5,14,bell,COMPLETE
91,3.5787867091130465e-05,2025-07-10 22:15:20.994967,2025-07-10 22:17:06.541182,0 days 00:01:45.546215,identity,prod,0.009656450950140056,5,15,bell,COMPLETE
92,4.052789336128626e-06,2025-07-10 22:17:06.542175,2025-07-10 22:18:56.173113,0 days 00:01:49.630938,identity,prod,0.008365086903766453,5,16,bell,COMPLETE
93,3.6251162782718893e-06,2025-07-10 22:18:56.174124,2025-07-10 22:20:58.710632,0 days 00:02:02.536508,identity,prod,0.006930998306919343,8,17,bell,COMPLETE
94,0.0026742976624518633,2025-07-10 22:20:58.711581,2025-07-10 22:23:01.123726,0 days 00:02:02.412145,identity,prod,0.00725170309847586,8,17,bell,COMPLETE
95,0.2626892030239105,2025-07-10 22:23:01.124607,2025-07-10 22:24:59.234958,0 days 00:01:58.110351,identity,prod,0.005500584933154178,8,16,bell,COMPLETE
96,0.036308761686086655,2025-07-10 22:24:59.235887,2025-07-10 22:26:59.011891,0 days 00:01:59.776004,identity,prod,0.004209457996029009,8,18,sigmoid,COMPLETE
97,1.1608980457822327e-05,2025-07-10 22:26:59.012828,2025-07-10 22:28:55.822154,0 days 00:01:56.809326,identity,prod,0.0024911250723602917,7,16,bell,COMPLETE
98,5.610221705865115e-05,2025-07-10 22:28:55.823116,2025-07-10 22:30:58.205685,0 days 00:02:02.382569,identity,prod,0.006649202905494122,8,17,bell,COMPLETE
99,0.02633553184568882,2025-07-10 22:30:58.206735,2025-07-10 22:32:50.804292,0 days 00:01:52.597557,identity,prod,0.0007583651481701346,7,15,bell,COMPLETE
100,0.0001430576085112989,2025-07-10 22:32:50.805327,2025-07-10 22:34:50.066771,0 days 00:01:59.261444,identity,min,0.00812024486672633,7,17,bell,COMPLETE
101,3.6306228139437735e-06,2025-07-10 22:34:50.067810,2025-07-10 22:37:00.335602,0 days 00:02:10.267792,identity,prod,0.009939810496510274,9,18,bell,COMPLETE
102,0.014007282443344593,2025-07-10 22:37:00.336626,2025-07-10 22:39:10.444709,0 days 00:02:10.108083,identity,prod,0.008765305057581588,9,18,bell,COMPLETE
103,3.441787839619792e-06,2025-07-10 22:39:10.445736,2025-07-10 22:41:25.100888,0 days 00:02:14.655152,identity,prod,0.007077523935439229,9,19,bell,COMPLETE
104,1.1977655049122404e-05,2025-07-10 22:41:25.101857,2025-07-10 22:43:39.770755,0 days 00:02:14.668898,identity,prod,0.005780004250862364,9,19,bell,COMPLETE
105,5.641894404107006e-06,2025-07-10 22:43:39.771918,2025-07-10 22:45:50.026793,0 days 00:02:10.254875,identity,prod,0.006989980053969879,9,18,bell,COMPLETE
106,0.022208793088793755,2025-07-10 22:45:50.027794,2025-07-10 22:48:04.766979,0 days 00:02:14.739185,relu,prod,0.008824457047894209,9,19,bell,COMPLETE
107,3.417110974623938e-06,2025-07-10 22:48:04.767998,2025-07-10 22:49:53.208336,0 days 00:01:48.440338,identity,prod,0.00791494856298587,9,13,bell,COMPLETE
108,3.431885488680564e-06,2025-07-10 22:49:53.209360,2025-07-10 22:51:37.072024,0 days 00:01:43.862664,identity,prod,0.009268410358226533,9,12,bell,COMPLETE
109,0.028871916234493256,2025-07-10 22:51:37.072985,2025-07-10 22:53:16.967554,0 days 00:01:39.894569,identity,prod,0.0015653461311470815,9,12,gaussian,COMPLETE
110,3.7921327020740137e-06,2025-07-10 22:53:16.968596,2025-07-10 22:55:00.240550,0 days 00:01:43.271954,identity,prod,0.009310543002420367,9,11,bell,COMPLETE
111,4.495304892770946e-06,2025-07-10 22:55:00.241517,2025-07-10 22:56:44.300628,0 days 00:01:44.059111,identity,prod,0.007949469748046868,9,12,bell,COMPLETE
112,3.5065515930909896e-06,2025-07-10 22:56:44.301560,2025-07-10 22:58:23.433519,0 days 00:01:39.131959,identity,prod,0.006268915580664468,9,10,bell,COMPLETE
113,1.3258167200547177e-05,2025-07-10 22:58:23.434451,2025-07-10 23:00:02.648815,0 days 00:01:39.214364,identity,prod,0.006295362438885279,9,10,bell,COMPLETE
114,0.00015132600674405694,2025-07-10 23:00:02.649791,2025-07-10 23:01:32.598854,0 days 00:01:29.949063,identity,prod,0.009941824434854633,9,8,bell,COMPLETE
115,4.9467066673969384e-06,2025-07-10 23:01:32.599489,2025-07-10 23:03:16.195608,0 days 00:01:43.596119,identity,prod,0.00486225298085394,9,11,bell,COMPLETE
116,0.00799486879259348,2025-07-10 23:03:16.196581,2025-07-10 23:04:55.399826,0 days 00:01:39.203245,identity,prod,0.00214905648581026,9,10,bell,COMPLETE
117,0.018023885786533356,2025-07-10 23:04:55.400963,2025-07-10 23:06:35.817140,0 days 00:01:40.416177,identity,min,0.005373598772640761,9,13,sigmoid,COMPLETE
118,4.034719677292742e-05,2025-07-10 23:06:35.818165,2025-07-10 23:08:24.229589,0 days 00:01:48.411424,identity,prod,0.007456223597644477,9,13,bell,COMPLETE
119,7.3998635343741626e-06,2025-07-10 23:08:24.230589,2025-07-10 23:10:07.831569,0 days 00:01:43.600980,identity,prod,0.0036193817185094417,9,11,bell,COMPLETE
120,3.3777396311052144e-05,2025-07-10 23:10:07.832533,2025-07-10 23:11:51.056090,0 days 00:01:43.223557,identity,prod,0.008679540384403448,9,12,bell,COMPLETE
121,3.550160045051598e-06,2025-07-10 23:11:51.057073,2025-07-10 23:13:21.181378,0 days 00:01:30.124305,identity,prod,0.0068016313447485845,9,8,bell,COMPLETE
122,1.4715310499013867e-05,2025-07-10 23:13:21.182009,2025-07-10 23:14:51.322794,0 days 00:01:30.140785,identity,prod,0.0067081034198509335,9,8,bell,COMPLETE
123,0.0006965475622564554,2025-07-10 23:14:51.323416,2025-07-10 23:16:25.789856,0 days 00:01:34.466440,identity,prod,0.006095302342652277,9,9,bell,COMPLETE
124,5.115221483720234e-06,2025-07-10 23:16:25.790957,2025-07-10 23:17:55.983703,0 days 00:01:30.192746,identity,prod,0.00806046374378752,9,8,bell,COMPLETE
125,4.119729510421166e-06,2025-07-10 23:17:55.984327,2025-07-10 23:19:21.097460,0 days 00:01:25.113133,identity,prod,0.009397386763863763,9,7,bell,COMPLETE
126,0.001961625413969159,2025-07-10 23:19:21.098089,2025-07-10 23:20:37.365706,0 days 00:01:16.267617,identity,prod,0.0011549070953747352,9,5,bell,COMPLETE
127,3.508736699586734e-05,2025-07-10 23:20:37.366333,2025-07-10 23:22:26.212340,0 days 00:01:48.846007,relu,prod,0.007325063518367836,9,13,bell,COMPLETE
128,4.6985687731648795e-06,2025-07-10 23:22:26.213359,2025-07-10 23:24:02.910088,0 days 00:01:36.696729,identity,min,0.004403128421826113,9,10,bell,COMPLETE
129,0.006509630009531975,2025-07-10 23:24:02.911089,2025-07-10 23:26:01.037591,0 days 00:01:58.126502,identity,prod,0.005737708375767338,8,16,bell,COMPLETE
130,1.3512889381672721e-05,2025-07-10 23:26:01.038558,2025-07-10 23:27:22.721875,0 days 00:01:21.683317,identity,prod,0.006738982780347332,9,7,gaussian,COMPLETE
131,3.835677034658147e-06,2025-07-10 23:27:22.722503,2025-07-10 23:29:15.414599,0 days 00:01:52.692096,identity,prod,0.007937680285662847,9,14,bell,COMPLETE
132,3.6521364563668612e-06,2025-07-10 23:29:15.415592,2025-07-10 23:30:47.280743,0 days 00:01:31.865151,identity,prod,0.008641911675281144,8,9,bell,COMPLETE
133,3.675506150102592e-06,2025-07-10 23:30:47.281389,2025-07-10 23:32:57.516327,0 days 00:02:10.234938,identity,prod,0.00912353579505671,9,18,bell,COMPLETE
134,3.5042532999796094e-06,2025-07-10 23:32:57.517347,2025-07-10 23:34:47.039550,0 days 00:01:49.522203,identity,prod,0.009992716666185425,5,16,bell,COMPLETE
135,3.492027417451027e-06,2025-07-10 23:34:47.040522,2025-07-10 23:36:32.520546,0 days 00:01:45.480024,identity,prod,0.009859734645595449,5,15,bell,COMPLETE
136,4.526622069533914e-05,2025-07-10 23:36:32.521606,2025-07-10 23:38:17.960487,0 days 00:01:45.438881,identity,prod,0.0075065112690118636,5,15,bell,COMPLETE
137,0.11546874046325684,2025-07-10 23:38:17.961758,2025-07-10 23:39:42.457496,0 days 00:01:24.495738,identity,prod,0.00840141604046854,5,9,bell,COMPLETE
