number,value,datetime_start,datetime_complete,duration,params_activation,params_and_operator,params_lr,params_n_sets,params_seq_length,params_shape,state
416,3.864847712975461e-06,2025-07-11 08:09:04.770236,2025-07-11 08:10:50.900804,0 days 00:01:46.130568,identity,min,0.0067179008864156845,9,13,bell,COMPLETE
417,3.587669880289468e-06,2025-07-11 08:10:50.901872,2025-07-11 08:12:31.918139,0 days 00:01:41.016267,identity,min,0.008669380493090174,9,11,bell,COMPLETE
418,3.595528824007488e-06,2025-07-11 08:12:31.919221,2025-07-11 08:14:22.192012,0 days 00:01:50.272791,identity,min,0.007386263800039263,9,14,bell,COMPLETE
419,4.676461685448885e-06,2025-07-11 08:14:22.193022,2025-07-11 08:16:06.037036,0 days 00:01:43.844014,identity,prod,0.009265049667814947,9,12,bell,COMPLETE
420,4.385620286484482e-06,2025-07-11 08:16:06.038055,2025-07-11 08:17:51.915901,0 days 00:01:45.877846,identity,min,0.008022853797884952,9,13,bell,COMPLETE
421,3.7174211229284992e-06,2025-07-11 08:17:51.916980,2025-07-11 08:19:40.319396,0 days 00:01:48.402416,identity,prod,0.00924983347045143,9,13,bell,COMPLETE
422,0.2682178318500519,2025-07-11 08:19:40.320415,2025-07-11 08:22:07.613055,0 days 00:02:27.292640,identity,prod,0.0001909777681041836,9,22,bell,COMPLETE
423,0.12240137904882431,2025-07-11 08:22:07.614224,2025-07-11 08:23:45.575436,0 days 00:01:37.961212,identity,min,0.008469894600020072,9,12,gaussian,COMPLETE
424,0.0067453100346028805,2025-07-11 08:23:45.576446,2025-07-11 08:25:38.298349,0 days 00:01:52.721903,identity,prod,0.0008386209974700003,9,14,bell,COMPLETE
425,3.6176566027279478e-06,2025-07-11 08:25:38.299428,2025-07-11 08:27:20.356227,0 days 00:01:42.056799,identity,min,0.00999918245531261,7,13,bell,COMPLETE
426,3.763899030673201e-06,2025-07-11 08:27:20.357303,2025-07-11 08:29:03.893093,0 days 00:01:43.535790,identity,prod,0.006580867061477771,9,11,bell,COMPLETE
427,0.0009560129838064313,2025-07-11 08:29:03.894092,2025-07-11 08:30:48.188318,0 days 00:01:44.294226,relu,prod,0.0073960571130584326,9,12,bell,COMPLETE
428,4.057240857946454e-06,2025-07-11 08:30:48.189399,2025-07-11 08:32:38.463921,0 days 00:01:50.274522,identity,min,0.008132481013071539,9,14,bell,COMPLETE
429,2.7739097276935354e-05,2025-07-11 08:32:38.465066,2025-07-11 08:34:35.563956,0 days 00:01:57.098890,identity,prod,0.008807183581131415,9,15,bell,COMPLETE
430,3.8043603126425296e-05,2025-07-11 08:34:35.564987,2025-07-11 08:36:26.346578,0 days 00:01:50.781591,identity,min,0.007352741192776919,7,15,bell,COMPLETE
431,3.7576683098450303e-06,2025-07-11 08:36:26.347582,2025-07-11 08:38:28.041044,0 days 00:02:01.693462,identity,prod,0.009968575696603494,9,16,bell,COMPLETE
432,0.00043032134999521077,2025-07-11 08:38:28.042102,2025-07-11 08:40:16.542613,0 days 00:01:48.500511,identity,prod,0.007952767059660413,9,13,bell,COMPLETE
433,0.0005096530658192933,2025-07-11 08:40:16.543613,2025-07-11 08:41:52.921584,0 days 00:01:36.377971,identity,min,0.009097609907928754,9,12,sigmoid,COMPLETE
434,3.561154017006629e-06,2025-07-11 08:41:52.922609,2025-07-11 08:43:36.672619,0 days 00:01:43.750010,identity,prod,0.006851581654903216,9,11,bell,COMPLETE
435,4.3452848331071436e-05,2025-07-11 08:43:36.673597,2025-07-11 08:45:38.041855,0 days 00:02:01.368258,identity,prod,0.008587481466097667,9,16,bell,COMPLETE
436,3.8209273043321446e-06,2025-07-11 08:45:38.042873,2025-07-11 08:47:41.328014,0 days 00:02:03.285141,identity,min,0.009988168678344827,9,17,bell,COMPLETE
437,0.44922950863838196,2025-07-11 08:47:41.329105,2025-07-11 08:49:25.236506,0 days 00:01:43.907401,identity,prod,0.000330194757419942,9,12,bell,COMPLETE
438,3.772519221456605e-06,2025-07-11 08:49:25.237540,2025-07-11 08:51:19.921364,0 days 00:01:54.683824,identity,min,0.007655308273677154,9,15,bell,COMPLETE
439,5.296381004882278e-06,2025-07-11 08:51:19.922554,2025-07-11 08:53:08.284495,0 days 00:01:48.361941,identity,prod,0.00873161726438609,9,13,bell,COMPLETE
440,3.912874944944633e-06,2025-07-11 08:53:08.285481,2025-07-11 08:55:00.993023,0 days 00:01:52.707542,identity,prod,0.006454786662661194,9,14,bell,COMPLETE
441,0.02079557441174984,2025-07-11 08:55:00.994040,2025-07-11 08:56:46.913341,0 days 00:01:45.919301,identity,min,0.0006022255413257754,9,13,bell,COMPLETE
442,1.198654808831634e-05,2025-07-11 08:56:46.914450,2025-07-11 08:58:30.862680,0 days 00:01:43.948230,identity,prod,0.008077610825355762,9,12,bell,COMPLETE
443,3.6994290439906763e-06,2025-07-11 08:58:30.863736,2025-07-11 09:00:25.817951,0 days 00:01:54.954215,identity,min,0.009332959822088644,7,16,bell,COMPLETE
444,3.3850949421321275e-06,2025-07-11 09:00:25.819064,2025-07-11 09:02:31.630087,0 days 00:02:05.811023,identity,prod,0.007132564425703837,9,17,bell,COMPLETE
445,8.22400670585921e-06,2025-07-11 09:02:31.631148,2025-07-11 09:04:37.397237,0 days 00:02:05.766089,identity,prod,0.007053170167362378,9,17,bell,COMPLETE
446,0.035411685705184937,2025-07-11 09:04:37.398345,2025-07-11 09:06:14.624401,0 days 00:01:37.226056,identity,min,0.0021904128794538852,9,11,gaussian,COMPLETE
447,0.000299825391266495,2025-07-11 09:06:14.625448,2025-07-11 09:08:20.635697,0 days 00:02:06.010249,relu,prod,0.006244267173304737,9,17,bell,COMPLETE
448,0.002173987217247486,2025-07-11 09:08:20.636791,2025-07-11 09:10:23.879528,0 days 00:02:03.242737,identity,min,0.006995488309392528,9,17,bell,COMPLETE
449,0.00018635406740941107,2025-07-11 09:10:23.880598,2025-07-11 09:12:29.579545,0 days 00:02:05.698947,identity,prod,0.007367758080376731,9,17,bell,COMPLETE
450,3.43978604178119e-06,2025-07-11 09:12:29.580568,2025-07-11 09:14:35.389943,0 days 00:02:05.809375,identity,prod,0.007782557230531572,9,17,bell,COMPLETE
451,3.5669729641085723e-06,2025-07-11 09:14:35.390948,2025-07-11 09:16:41.287013,0 days 00:02:05.896065,identity,prod,0.007823271370401128,9,17,bell,COMPLETE
452,4.080714461451862e-06,2025-07-11 09:16:41.288002,2025-07-11 09:18:51.470516,0 days 00:02:10.182514,identity,prod,0.00828177258104042,9,18,bell,COMPLETE
453,0.08433417975902557,2025-07-11 09:18:51.471595,2025-07-11 09:20:57.251173,0 days 00:02:05.779578,identity,prod,0.007467097051137646,9,17,bell,COMPLETE
454,0.012209662236273289,2025-07-11 09:20:57.252350,2025-07-11 09:23:03.013177,0 days 00:02:05.760827,identity,prod,0.008356253469240679,9,17,bell,COMPLETE
455,0.0015026390319690108,2025-07-11 09:23:03.014223,2025-07-11 09:25:07.449858,0 days 00:02:04.435635,identity,prod,0.007803781871759608,9,18,sigmoid,COMPLETE
456,0.0015240457141771913,2025-07-11 09:25:07.450926,2025-07-11 09:27:08.937980,0 days 00:02:01.487054,identity,prod,0.008956074937040086,9,16,bell,COMPLETE
457,3.7264021557348315e-06,2025-07-11 09:27:08.939019,2025-07-11 09:29:14.825804,0 days 00:02:05.886785,identity,prod,0.007219033729503999,9,17,bell,COMPLETE
458,3.871240551234223e-06,2025-07-11 09:29:14.826848,2025-07-11 09:31:11.660329,0 days 00:01:56.833481,identity,prod,0.008512951289631438,7,16,bell,COMPLETE
459,0.0013240837724879384,2025-07-11 09:31:11.661391,2025-07-11 09:33:21.651876,0 days 00:02:09.990485,identity,prod,0.009171353068838177,9,18,bell,COMPLETE
460,3.978419954364654e-06,2025-07-11 09:33:21.652925,2025-07-11 09:35:27.434553,0 days 00:02:05.781628,identity,prod,0.006404336692210101,9,17,bell,COMPLETE
461,3.7595966659864644e-06,2025-07-11 09:35:27.435611,2025-07-11 09:37:28.914347,0 days 00:02:01.478736,identity,prod,0.007991170267932017,9,16,bell,COMPLETE
462,4.0019158404902555e-06,2025-07-11 09:37:28.915443,2025-07-11 09:39:12.529927,0 days 00:01:43.614484,identity,prod,0.00737337449425276,9,11,bell,COMPLETE
463,3.6440030726225814e-06,2025-07-11 09:39:12.530999,2025-07-11 09:41:18.400655,0 days 00:02:05.869656,identity,prod,0.009161801799983934,9,17,bell,COMPLETE
464,5.081406470708316e-06,2025-07-11 09:41:18.401694,2025-07-11 09:43:02.433524,0 days 00:01:44.031830,identity,prod,0.008423772555771494,9,12,bell,COMPLETE
465,0.000625101791229099,2025-07-11 09:43:02.434577,2025-07-11 09:45:03.897831,0 days 00:02:01.463254,identity,prod,0.006814509862026673,9,16,bell,COMPLETE
466,3.822231974481838e-06,2025-07-11 09:45:03.898847,2025-07-11 09:47:27.339837,0 days 00:02:23.440990,relu,prod,0.007830471653970685,9,21,bell,COMPLETE
467,0.005516841541975737,2025-07-11 09:47:27.340893,2025-07-11 09:49:11.338533,0 days 00:01:43.997640,identity,prod,0.009251915454741006,9,12,bell,COMPLETE
468,3.6914480006089434e-06,2025-07-11 09:49:11.339598,2025-07-11 09:51:12.537449,0 days 00:02:01.197851,identity,prod,0.008500086087727593,9,17,gaussian,COMPLETE
469,0.0004063592350576073,2025-07-11 09:51:12.538505,2025-07-11 09:52:56.121830,0 days 00:01:43.583325,identity,prod,0.007395167054941149,9,11,bell,COMPLETE
470,3.595999714889331e-06,2025-07-11 09:52:56.122942,2025-07-11 09:54:57.564181,0 days 00:02:01.441239,identity,prod,0.006044344178467837,9,16,bell,COMPLETE
471,0.0058563402853906155,2025-07-11 09:54:57.565291,2025-07-11 09:57:02.715202,0 days 00:02:05.149911,identity,prod,0.0013136754424392528,7,18,bell,COMPLETE
472,4.219543370709289e-06,2025-07-11 09:57:02.716285,2025-07-11 09:59:00.769442,0 days 00:01:58.053157,identity,prod,0.009246432727839333,8,16,bell,COMPLETE
473,3.673015498861787e-06,2025-07-11 09:59:00.770657,2025-07-11 10:01:06.534920,0 days 00:02:05.764263,identity,prod,0.00998241440320886,9,17,bell,COMPLETE
474,3.5134059999109013e-06,2025-07-11 10:01:06.536082,2025-07-11 10:02:48.159238,0 days 00:01:41.623156,identity,min,0.008306447817309354,9,12,bell,COMPLETE
475,1.3014481737627648e-05,2025-07-11 10:02:48.160349,2025-07-11 10:04:36.597515,0 days 00:01:48.437166,identity,prod,0.006736691881803641,9,13,bell,COMPLETE
476,7.801265383022837e-06,2025-07-11 10:04:36.598657,2025-07-11 10:06:20.641659,0 days 00:01:44.043002,identity,prod,0.00785380599493515,9,12,bell,COMPLETE
477,0.0008754857117310166,2025-07-11 10:06:20.642792,2025-07-11 10:08:18.446098,0 days 00:01:57.803306,identity,min,0.008840533909781734,9,17,sigmoid,COMPLETE
478,0.4589085280895233,2025-07-11 10:08:18.447139,2025-07-11 10:10:11.184763,0 days 00:01:52.737624,identity,prod,0.0001393616567640854,9,14,bell,COMPLETE
479,8.911062650440726e-06,2025-07-11 10:10:11.185802,2025-07-11 10:11:52.273285,0 days 00:01:41.087483,identity,min,0.009969834353843271,9,11,bell,COMPLETE
480,3.515617436278262e-06,2025-07-11 10:11:52.274359,2025-07-11 10:13:36.125816,0 days 00:01:43.851457,identity,prod,0.007287752682003655,7,13,bell,COMPLETE
481,3.6861638363916427e-06,2025-07-11 10:13:36.126856,2025-07-11 10:15:33.216225,0 days 00:01:57.089369,identity,prod,0.008601451586465348,9,15,bell,COMPLETE
482,3.761294465220999e-06,2025-07-11 10:15:33.217306,2025-07-11 10:17:14.674857,0 days 00:01:41.457551,identity,min,0.007759395587028335,9,12,bell,COMPLETE
483,3.534479901645682e-06,2025-07-11 10:17:14.675935,2025-07-11 10:19:16.096338,0 days 00:02:01.420403,identity,prod,0.006605881030874531,9,16,bell,COMPLETE
484,0.00096037273760885,2025-07-11 10:19:16.097377,2025-07-11 10:21:06.453100,0 days 00:01:50.355723,identity,min,0.009227665788183351,9,14,bell,COMPLETE
485,1.316388487815857,2025-07-11 10:21:06.454156,2025-07-11 10:23:17.091534,0 days 00:02:10.637378,relu,prod,0.008086573333463316,9,18,bell,COMPLETE
486,0.00253471452742815,2025-07-11 10:23:17.092598,2025-07-11 10:25:05.543969,0 days 00:01:48.451371,identity,prod,0.0016008733197357165,9,13,bell,COMPLETE
487,3.872421984851826e-06,2025-07-11 10:25:05.545065,2025-07-11 10:26:46.742614,0 days 00:01:41.197549,identity,min,0.00999853336707995,9,11,bell,COMPLETE
488,3.82637790607987e-06,2025-07-11 10:26:46.743731,2025-07-11 10:28:49.063219,0 days 00:02:02.319488,identity,prod,0.00888698350584801,8,17,bell,COMPLETE
489,0.0024595940485596657,2025-07-11 10:28:49.064274,2025-07-11 10:30:43.623920,0 days 00:01:54.559646,identity,min,0.007126010957368817,9,15,bell,COMPLETE
490,0.0023932061158120632,2025-07-11 10:30:43.625034,2025-07-11 10:32:27.544207,0 days 00:01:43.919173,identity,prod,0.008010836064744538,9,12,bell,COMPLETE
491,0.0006206072284840047,2025-07-11 10:32:27.545303,2025-07-11 10:34:16.209336,0 days 00:01:48.664033,identity,prod,0.00856818169580382,9,14,gaussian,COMPLETE
492,3.4860252071666764e-06,2025-07-11 10:34:16.210333,2025-07-11 10:36:45.718846,0 days 00:02:29.508513,identity,min,0.0062513834359365274,9,23,bell,COMPLETE
493,3.771267984120641e-06,2025-07-11 10:36:45.719924,2025-07-11 10:39:09.454156,0 days 00:02:23.734232,identity,prod,0.0058857060860178214,6,23,bell,COMPLETE
494,3.6770893530047033e-06,2025-07-11 10:39:09.455217,2025-07-11 10:41:25.963021,0 days 00:02:16.507804,identity,min,0.005483378127132438,9,20,bell,COMPLETE
495,3.4748211419355357e-06,2025-07-11 10:41:25.964091,2025-07-11 10:44:06.470438,0 days 00:02:40.506347,identity,prod,0.006174035646665569,9,25,bell,COMPLETE
496,3.5899754493584624e-06,2025-07-11 10:44:06.471480,2025-07-11 10:46:28.849860,0 days 00:02:22.378380,identity,prod,0.006145523009361774,7,22,bell,COMPLETE
497,0.06928130984306335,2025-07-11 10:46:28.850913,2025-07-11 10:48:30.300352,0 days 00:02:01.449439,identity,prod,0.006719493056318394,9,16,bell,COMPLETE
498,4.00524731958285e-06,2025-07-11 10:48:30.301397,2025-07-11 10:51:10.670523,0 days 00:02:40.369126,identity,prod,0.00578240254759225,9,25,bell,COMPLETE
499,0.0042467969469726086,2025-07-11 10:51:10.671670,2025-07-11 10:53:36.001369,0 days 00:02:25.329699,identity,prod,0.006973287282562934,5,25,bell,COMPLETE
