number,value,datetime_start,datetime_complete,duration,params_activation,params_and_operator,params_lr,params_n_sets,params_seq_length,params_shape,state
277,5.388084900914691e-06,2025-07-11 04:00:08.366685,2025-07-11 04:01:45.632363,0 days 00:01:37.265678,identity,prod,0.008499066161176948,5,13,bell,COMPLETE
278,3.4435388442943804e-06,2025-07-11 04:01:45.633365,2025-07-11 04:03:29.512033,0 days 00:01:43.878668,identity,prod,0.009257267331306064,9,12,bell,COMPLETE
279,4.110484496777644e-06,2025-07-11 04:03:29.513189,2025-07-11 04:05:13.085048,0 days 00:01:43.571859,identity,prod,0.009296991983676535,9,11,bell,COMPLETE
280,5.9859180510102306e-06,2025-07-11 04:05:13.086143,2025-07-11 04:06:56.967293,0 days 00:01:43.881150,identity,prod,0.0093930100596891,9,12,bell,COMPLETE
281,3.91453022530186e-06,2025-07-11 04:06:56.968303,2025-07-11 04:08:40.870603,0 days 00:01:43.902300,identity,prod,0.00986975181712084,9,12,bell,COMPLETE
282,3.433322490309365e-06,2025-07-11 04:08:40.871562,2025-07-11 04:10:24.395229,0 days 00:01:43.523667,identity,prod,0.008589239257895277,9,11,bell,COMPLETE
283,9.303986189479474e-06,2025-07-11 04:10:24.396310,2025-07-11 04:12:07.884671,0 days 00:01:43.488361,identity,prod,0.008510718303924655,9,11,bell,COMPLETE
284,3.9897436181490775e-06,2025-07-11 04:12:07.885654,2025-07-11 04:13:47.076820,0 days 00:01:39.191166,identity,prod,0.007123843016558899,9,10,bell,COMPLETE
285,3.80008214051486e-06,2025-07-11 04:13:47.077789,2025-07-11 04:15:28.172272,0 days 00:01:41.094483,identity,min,0.009992142145861211,9,11,bell,COMPLETE
286,7.779242878314108e-06,2025-07-11 04:15:28.173295,2025-07-11 04:17:11.791849,0 days 00:01:43.618554,identity,prod,0.00796342524195186,9,11,bell,COMPLETE
287,0.0021396109368652105,2025-07-11 04:17:11.792808,2025-07-11 04:18:42.768399,0 days 00:01:30.975591,identity,prod,0.009020379417765095,7,10,gaussian,COMPLETE
288,1.034883734973846e-05,2025-07-11 04:18:42.769079,2025-07-11 04:20:27.248237,0 days 00:01:44.479158,relu,prod,0.007097940633164391,9,12,bell,COMPLETE
289,0.001491472590714693,2025-07-11 04:20:27.249230,2025-07-11 04:22:11.332562,0 days 00:01:44.083332,identity,prod,0.0018852146707419284,9,12,bell,COMPLETE
290,0.0008889597374945879,2025-07-11 04:22:11.333526,2025-07-11 04:24:30.237545,0 days 00:02:18.904019,identity,prod,0.0015774802728087205,9,20,bell,COMPLETE
291,0.1814841628074646,2025-07-11 04:24:30.238524,2025-07-11 04:26:13.923770,0 days 00:01:43.685246,identity,prod,0.00904732034066063,9,11,bell,COMPLETE
292,0.0016784119652584195,2025-07-11 04:26:13.924718,2025-07-11 04:27:58.039533,0 days 00:01:44.114815,identity,prod,0.0064133956115031395,9,12,bell,COMPLETE
293,7.33417391529656e-06,2025-07-11 04:27:58.040568,2025-07-11 04:29:41.723441,0 days 00:01:43.682873,identity,prod,0.007796409641835825,9,11,bell,COMPLETE
294,9.805789886740968e-05,2025-07-11 04:29:41.724488,2025-07-11 04:31:16.379344,0 days 00:01:34.654856,identity,prod,0.008590222398491559,7,12,sigmoid,COMPLETE
295,3.732690174729214e-06,2025-07-11 04:31:16.380293,2025-07-11 04:33:39.734324,0 days 00:02:23.354031,identity,prod,0.009174394364800855,9,21,bell,COMPLETE
296,0.04482618346810341,2025-07-11 04:33:39.735401,2025-07-11 04:35:49.839747,0 days 00:02:10.104346,identity,prod,0.006873016688172979,9,18,bell,COMPLETE
297,3.7135973798285704e-06,2025-07-11 04:35:49.840963,2025-07-11 04:37:25.912218,0 days 00:01:36.071255,identity,min,0.009989450863322386,5,13,bell,COMPLETE
298,3.730535581780714e-06,2025-07-11 04:37:25.913250,2025-07-11 04:39:35.700748,0 days 00:02:09.787498,identity,prod,0.007661831019924798,7,19,bell,COMPLETE
299,3.5423208828433417e-06,2025-07-11 04:39:35.701718,2025-07-11 04:41:19.757647,0 days 00:01:44.055929,identity,prod,0.008393497778318349,9,12,bell,COMPLETE
300,0.012683163397014141,2025-07-11 04:41:19.758658,2025-07-11 04:43:21.158783,0 days 00:02:01.400125,identity,prod,0.009175401522629524,5,19,bell,COMPLETE
301,3.645689503173344e-06,2025-07-11 04:43:21.159742,2025-07-11 04:45:00.397098,0 days 00:01:39.237356,identity,prod,0.007422222166143488,9,10,bell,COMPLETE
302,3.7298059396562167e-06,2025-07-11 04:45:00.398069,2025-07-11 04:46:37.598560,0 days 00:01:37.200491,identity,prod,0.008223581244622176,5,13,bell,COMPLETE
303,3.6291521610110067e-06,2025-07-11 04:46:37.599552,2025-07-11 04:48:47.697327,0 days 00:02:10.097775,identity,prod,0.006512982716600364,9,18,bell,COMPLETE
304,3.701731202454539e-06,2025-07-11 04:48:47.698424,2025-07-11 04:50:36.084160,0 days 00:01:48.385736,identity,prod,0.009282404321616155,9,13,bell,COMPLETE
305,0.0017487331060692668,2025-07-11 04:50:36.085278,2025-07-11 04:52:17.310169,0 days 00:01:41.224891,identity,prod,0.008563872694296247,5,14,bell,COMPLETE
306,5.43211399417487e-06,2025-07-11 04:52:17.311127,2025-07-11 04:53:54.462091,0 days 00:01:37.150964,identity,prod,0.007172885364097977,6,12,bell,COMPLETE
307,3.6916255794494646e-06,2025-07-11 04:53:54.463093,2025-07-11 04:55:47.137339,0 days 00:01:52.674246,identity,prod,0.009938398470663723,9,14,bell,COMPLETE
308,4.271306352165993e-06,2025-07-11 04:55:47.138435,2025-07-11 04:57:29.141985,0 days 00:01:42.003550,relu,prod,0.007669000185125678,5,15,gaussian,COMPLETE
309,3.5145758374710567e-06,2025-07-11 04:57:29.142947,2025-07-11 04:59:15.076609,0 days 00:01:45.933662,identity,min,0.006350742665042999,9,13,bell,COMPLETE
310,4.239213922119234e-06,2025-07-11 04:59:15.077760,2025-07-11 05:01:00.946208,0 days 00:01:45.868448,identity,min,0.0062680893001533875,9,13,bell,COMPLETE
311,1.4499921235255897e-05,2025-07-11 05:01:00.947169,2025-07-11 05:02:46.919692,0 days 00:01:45.972523,identity,min,0.005410556408968413,9,13,bell,COMPLETE
312,3.723537929545273e-06,2025-07-11 05:02:46.920705,2025-07-11 05:04:28.472220,0 days 00:01:41.551515,identity,min,0.006550658233637638,9,12,bell,COMPLETE
313,3.5281479995319387e-06,2025-07-11 05:04:28.473219,2025-07-11 05:06:18.789600,0 days 00:01:50.316381,identity,min,0.005870263745388396,9,14,bell,COMPLETE
314,0.0005753801087848842,2025-07-11 05:06:18.790596,2025-07-11 05:08:04.761274,0 days 00:01:45.970678,identity,min,0.006922271638897899,9,13,bell,COMPLETE
315,7.438548891514074e-06,2025-07-11 05:08:04.762329,2025-07-11 05:09:45.820732,0 days 00:01:41.058403,identity,min,0.007847180386104227,9,11,bell,COMPLETE
316,0.0362338051199913,2025-07-11 05:09:45.821913,2025-07-11 05:11:53.534372,0 days 00:02:07.712459,identity,min,0.001110080623224093,9,18,bell,COMPLETE
317,3.731831384357065e-06,2025-07-11 05:11:53.535345,2025-07-11 05:13:41.929288,0 days 00:01:48.393943,identity,prod,0.004934977314043685,9,13,bell,COMPLETE
318,0.026105115190148354,2025-07-11 05:13:41.930299,2025-07-11 05:15:20.644901,0 days 00:01:38.714602,identity,prod,0.006230673821199109,9,12,sigmoid,COMPLETE
319,0.003042758209630847,2025-07-11 05:15:20.645982,2025-07-11 05:17:34.976823,0 days 00:02:14.330841,identity,prod,0.008333315310689551,9,19,bell,COMPLETE
320,0.0028640793170779943,2025-07-11 05:17:34.977788,2025-07-11 05:19:23.296969,0 days 00:01:48.319181,identity,prod,0.0005386201893398944,9,13,bell,COMPLETE
321,3.5436983125691768e-06,2025-07-11 05:19:23.297989,2025-07-11 05:21:02.574672,0 days 00:01:39.276683,identity,prod,0.007238928064655687,9,10,bell,COMPLETE
322,0.058209385722875595,2025-07-11 05:21:02.575754,2025-07-11 05:22:44.174208,0 days 00:01:41.598454,identity,min,0.008730955651555815,9,12,bell,COMPLETE
323,0.009071167558431625,2025-07-11 05:22:44.175199,2025-07-11 05:24:37.016120,0 days 00:01:52.840921,identity,prod,0.0056594832525486295,9,14,bell,COMPLETE
324,4.729079137177905e-06,2025-07-11 05:24:37.017118,2025-07-11 05:26:47.227477,0 days 00:02:10.210359,identity,prod,0.007812978196198545,9,18,bell,COMPLETE
325,3.638815542217344e-06,2025-07-11 05:26:47.228459,2025-07-11 05:28:30.931161,0 days 00:01:43.702702,identity,prod,0.0066484955340558715,9,11,bell,COMPLETE
326,0.007879524491727352,2025-07-11 05:28:30.932216,2025-07-11 05:30:24.501882,0 days 00:01:53.569666,identity,prod,0.009075900561697724,5,17,bell,COMPLETE
327,1.3161295652389526,2025-07-11 05:30:24.502920,2025-07-11 05:32:43.736164,0 days 00:02:19.233244,relu,prod,0.0071012126578854,9,20,bell,COMPLETE
328,3.573712547222385e-06,2025-07-11 05:32:43.737138,2025-07-11 05:34:27.639086,0 days 00:01:43.901948,identity,prod,0.009944969250208782,7,13,bell,COMPLETE
329,3.699891522046528e-06,2025-07-11 05:34:27.640340,2025-07-11 05:36:11.723855,0 days 00:01:44.083515,identity,prod,0.008250940790904727,9,12,bell,COMPLETE
330,4.351017651060829e-06,2025-07-11 05:36:11.724833,2025-07-11 05:37:57.577397,0 days 00:01:45.852564,identity,prod,0.009995760361191697,6,14,bell,COMPLETE
331,0.01679869554936886,2025-07-11 05:37:57.578437,2025-07-11 05:39:35.339401,0 days 00:01:37.760964,identity,prod,0.006073588682808219,5,14,gaussian,COMPLETE
332,3.4875422443292337e-06,2025-07-11 05:39:35.340435,2025-07-11 05:41:16.966045,0 days 00:01:41.625610,identity,min,0.008849593649144612,9,12,bell,COMPLETE
333,3.6599201848730445e-05,2025-07-11 05:41:16.967116,2025-07-11 05:43:00.901984,0 days 00:01:43.934868,identity,prod,0.007744194683689315,9,12,bell,COMPLETE
334,3.6845153772446793e-06,2025-07-11 05:43:00.903172,2025-07-11 05:44:46.733929,0 days 00:01:45.830757,identity,min,0.007024219443648447,9,13,bell,COMPLETE
335,3.963572453358211e-06,2025-07-11 05:44:46.734952,2025-07-11 05:46:27.773530,0 days 00:01:41.038578,identity,min,0.008618609853610694,9,11,bell,COMPLETE
336,3.3887356494233245e-06,2025-07-11 05:46:27.774529,2025-07-11 05:48:09.279884,0 days 00:01:41.505355,identity,min,0.008160806922673128,9,12,bell,COMPLETE
337,8.731421075935941e-06,2025-07-11 05:48:09.280850,2025-07-11 05:49:50.812381,0 days 00:01:41.531531,identity,min,0.007990079454504345,9,12,bell,COMPLETE
338,5.200693522056099e-06,2025-07-11 05:49:50.813510,2025-07-11 05:51:32.292433,0 days 00:01:41.478923,identity,min,0.008818148837141458,9,12,bell,COMPLETE
339,3.568074134818744e-06,2025-07-11 05:51:32.293419,2025-07-11 05:53:13.261764,0 days 00:01:40.968345,identity,min,0.007328319503067257,9,11,bell,COMPLETE
340,0.0002628589572850615,2025-07-11 05:53:13.262780,2025-07-11 05:54:49.495709,0 days 00:01:36.232929,identity,min,0.00819525926662882,9,12,sigmoid,COMPLETE
341,0.0005380002548918128,2025-07-11 05:54:49.496713,2025-07-11 05:56:27.252956,0 days 00:01:37.756243,identity,min,0.008949950404560479,7,12,bell,COMPLETE
342,0.28483331203460693,2025-07-11 05:56:27.253946,2025-07-11 05:58:13.086533,0 days 00:01:45.832587,identity,min,0.00024386957736916473,9,13,bell,COMPLETE
343,3.921817096852465e-06,2025-07-11 05:58:13.087577,2025-07-11 06:00:07.734157,0 days 00:01:54.646580,identity,min,0.007584302060366112,9,15,bell,COMPLETE
344,3.4819324810086982e-06,2025-07-11 06:00:07.735291,2025-07-11 06:01:48.680103,0 days 00:01:40.944812,identity,min,0.008455508002964195,9,11,bell,COMPLETE
345,4.202355285087833e-06,2025-07-11 06:01:48.681081,2025-07-11 06:03:29.646274,0 days 00:01:40.965193,identity,min,0.009173665993374297,9,11,bell,COMPLETE
346,3.866906808980275e-06,2025-07-11 06:03:29.647292,2025-07-11 06:05:06.316819,0 days 00:01:36.669527,identity,min,0.008416128315539234,9,10,bell,COMPLETE
347,3.72838417206367e-06,2025-07-11 06:05:06.317794,2025-07-11 06:06:47.832758,0 days 00:01:41.514964,identity,min,0.009210410265726542,9,12,bell,COMPLETE
348,1.3182570934295654,2025-07-11 06:06:47.833941,2025-07-11 06:08:29.216640,0 days 00:01:41.382699,relu,min,0.008180600542672518,9,11,bell,COMPLETE
349,3.727428975253133e-06,2025-07-11 06:08:29.217642,2025-07-11 06:10:04.869640,0 days 00:01:35.651998,identity,min,0.009200963729212206,6,12,bell,COMPLETE
350,3.92689844375127e-06,2025-07-11 06:10:04.870746,2025-07-11 06:11:46.994537,0 days 00:01:42.123791,identity,min,0.00786794091503825,7,13,bell,COMPLETE
351,0.00039695866871625185,2025-07-11 06:11:46.995610,2025-07-11 06:13:23.738150,0 days 00:01:36.742540,identity,min,0.008647717900159838,9,10,bell,COMPLETE
352,1.594026616658084e-05,2025-07-11 06:13:23.739168,2025-07-11 06:15:04.769664,0 days 00:01:41.030496,identity,min,0.007659740030812569,9,11,bell,COMPLETE
353,3.777816345973406e-06,2025-07-11 06:15:04.770646,2025-07-11 06:16:36.978093,0 days 00:01:32.207447,identity,min,0.009180873901331894,9,9,bell,COMPLETE
354,3.4890124425146496e-06,2025-07-11 06:16:36.979217,2025-07-11 06:18:22.972804,0 days 00:01:45.993587,identity,min,0.006743636387593061,9,13,bell,COMPLETE
355,4.3210864532738924e-05,2025-07-11 06:18:22.973876,2025-07-11 06:20:00.869145,0 days 00:01:37.895269,identity,min,0.008384785979586782,9,12,gaussian,COMPLETE
356,3.5725631732930196e-06,2025-07-11 06:20:00.870134,2025-07-11 06:21:46.767635,0 days 00:01:45.897501,identity,min,0.006916755961949222,9,13,bell,COMPLETE
357,0.00010046577517641708,2025-07-11 06:21:46.768696,2025-07-11 06:23:28.270162,0 days 00:01:41.501466,identity,min,0.007527738621028534,9,12,bell,COMPLETE
358,3.986116553278407e-06,2025-07-11 06:23:28.271222,2025-07-11 06:25:09.345423,0 days 00:01:41.074201,identity,min,0.009172735343673074,9,11,bell,COMPLETE
359,0.0006784762372262776,2025-07-11 06:25:09.346431,2025-07-11 06:26:55.298502,0 days 00:01:45.952071,identity,min,0.006456226472392351,9,13,bell,COMPLETE
360,3.5307273265061667e-06,2025-07-11 06:26:55.299596,2025-07-11 06:28:36.770988,0 days 00:01:41.471392,identity,min,0.00836591437076111,9,12,bell,COMPLETE
361,0.0008011408499442041,2025-07-11 06:28:36.772155,2025-07-11 06:30:18.794387,0 days 00:01:42.022232,identity,min,0.009473662012028938,7,13,bell,COMPLETE
362,3.478924099908909e-06,2025-07-11 06:30:18.795451,2025-07-11 06:32:04.719047,0 days 00:01:45.923596,identity,min,0.009960119391476981,9,13,bell,COMPLETE
363,4.122998234379338e-06,2025-07-11 06:32:04.720028,2025-07-11 06:33:41.385760,0 days 00:01:36.665732,identity,min,0.009964972506539466,9,10,bell,COMPLETE
364,4.3038653529947624e-05,2025-07-11 06:33:41.386768,2025-07-11 06:35:16.945705,0 days 00:01:35.558937,identity,min,0.00990554620888174,9,11,sigmoid,COMPLETE
365,1.073038947652094e-05,2025-07-11 06:35:16.946883,2025-07-11 06:36:54.723455,0 days 00:01:37.776572,identity,min,0.008785461433596469,7,12,bell,COMPLETE
366,0.0016574653564020991,2025-07-11 06:36:54.724516,2025-07-11 06:38:36.138696,0 days 00:01:41.414180,identity,min,0.0026416589790658864,9,12,bell,COMPLETE
367,4.452434495760826e-06,2025-07-11 06:38:36.139729,2025-07-11 06:40:21.948533,0 days 00:01:45.808804,identity,min,0.009973063690478744,9,13,bell,COMPLETE
368,0.048546433448791504,2025-07-11 06:40:21.949576,2025-07-11 06:42:10.625090,0 days 00:01:48.675514,relu,prod,0.008321135754550743,9,13,bell,COMPLETE
369,3.6019498566020047e-06,2025-07-11 06:42:10.626095,2025-07-11 06:43:41.520458,0 days 00:01:30.894363,identity,min,0.008955934936985318,6,10,bell,COMPLETE
370,3.5165830922778696e-06,2025-07-11 06:43:41.521183,2025-07-11 06:45:25.159453,0 days 00:01:43.638270,identity,prod,0.0076945674751496594,9,11,bell,COMPLETE
371,4.5652548578800634e-05,2025-07-11 06:45:25.160632,2025-07-11 06:46:59.901580,0 days 00:01:34.740948,identity,prod,0.00842894322686496,9,9,bell,COMPLETE
372,3.885472324327566e-06,2025-07-11 06:46:59.902602,2025-07-11 06:48:43.899477,0 days 00:01:43.996875,identity,prod,0.009188632219185889,9,12,bell,COMPLETE
373,3.473929609754123e-06,2025-07-11 06:48:43.900462,2025-07-11 06:50:43.019747,0 days 00:01:59.119285,identity,min,0.0076431566706465365,9,16,bell,COMPLETE
374,3.4977301766048186e-06,2025-07-11 06:50:43.020826,2025-07-11 06:52:39.050336,0 days 00:01:56.029510,identity,min,0.007842317302211639,8,16,bell,COMPLETE
375,3.966758868045872e-06,2025-07-11 06:52:39.051382,2025-07-11 06:54:35.054559,0 days 00:01:56.003177,identity,min,0.00759509092985516,8,16,bell,COMPLETE
376,3.5462339837977197e-06,2025-07-11 06:54:35.055684,2025-07-11 06:56:31.060559,0 days 00:01:56.004875,identity,min,0.007156596660455347,8,16,bell,COMPLETE
377,0.14283797144889832,2025-07-11 06:56:31.061594,2025-07-11 06:58:25.979683,0 days 00:01:54.918089,identity,min,0.00010851297431232206,9,16,gaussian,COMPLETE
378,3.982022917625727e-06,2025-07-11 06:58:25.980708,2025-07-11 07:00:17.787966,0 days 00:01:51.807258,identity,min,0.007958056470889034,8,15,bell,COMPLETE
379,0.024167492985725403,2025-07-11 07:00:17.789089,2025-07-11 07:02:12.759853,0 days 00:01:54.970764,identity,min,0.008134934324193491,7,16,bell,COMPLETE
380,3.4809959288395476e-06,2025-07-11 07:02:12.760899,2025-07-11 07:04:04.410620,0 days 00:01:51.649721,identity,min,0.0074609890409146305,8,15,bell,COMPLETE
381,3.601264552344219e-06,2025-07-11 07:04:04.411743,2025-07-11 07:05:56.145510,0 days 00:01:51.733767,identity,min,0.007223372641015103,8,15,bell,COMPLETE
382,3.684950797833153e-06,2025-07-11 07:05:56.146755,2025-07-11 07:07:47.800222,0 days 00:01:51.653467,identity,min,0.00853942154552573,8,15,bell,COMPLETE
383,0.0008132039220072329,2025-07-11 07:07:47.801266,2025-07-11 07:09:38.470920,0 days 00:01:50.669654,identity,min,0.0077548054994221235,7,15,bell,COMPLETE
384,3.937458586733555e-06,2025-07-11 07:09:38.472009,2025-07-11 07:11:34.386622,0 days 00:01:55.914613,identity,min,0.009995649961224156,8,16,bell,COMPLETE
385,3.693972757901065e-06,2025-07-11 07:11:34.387860,2025-07-11 07:13:28.962879,0 days 00:01:54.575019,identity,min,0.008580497955979281,9,15,bell,COMPLETE
386,3.6821463709202362e-06,2025-07-11 07:13:28.963894,2025-07-11 07:15:23.602736,0 days 00:01:54.638842,identity,min,0.009063999454335298,9,15,bell,COMPLETE
387,3.800755166594172e-06,2025-07-11 07:15:23.603744,2025-07-11 07:17:22.540643,0 days 00:01:58.936899,identity,min,0.007808338239887431,9,16,bell,COMPLETE
388,0.08143474906682968,2025-07-11 07:17:22.541737,2025-07-11 07:19:43.424692,0 days 00:02:20.882955,relu,min,0.007341717198712369,9,21,bell,COMPLETE
389,0.0016684349393472075,2025-07-11 07:19:43.425749,2025-07-11 07:22:02.880201,0 days 00:02:19.454452,identity,min,0.008651979071308259,8,23,sigmoid,COMPLETE
390,4.0606018956168555e-06,2025-07-11 07:22:02.881186,2025-07-11 07:24:01.939199,0 days 00:01:59.058013,identity,min,0.006946599313434391,9,16,bell,COMPLETE
391,4.269969394954387e-06,2025-07-11 07:24:01.940251,2025-07-11 07:25:56.656414,0 days 00:01:54.716163,identity,min,0.00928185279080653,9,15,bell,COMPLETE
392,3.4105335089407163e-06,2025-07-11 07:25:56.657452,2025-07-11 07:27:46.901491,0 days 00:01:50.244039,identity,min,0.009995662057727627,9,14,bell,COMPLETE
393,2.6003970560850576e-05,2025-07-11 07:27:46.902690,2025-07-11 07:29:37.150701,0 days 00:01:50.248011,identity,min,0.008195264713219075,9,14,bell,COMPLETE
394,3.4289926134078996e-06,2025-07-11 07:29:37.151720,2025-07-11 07:31:27.454500,0 days 00:01:50.302780,identity,min,0.007961147518056967,9,14,bell,COMPLETE
395,0.0001854107395047322,2025-07-11 07:31:27.455564,2025-07-11 07:33:17.671124,0 days 00:01:50.215560,identity,min,0.009954391207310918,9,14,bell,COMPLETE
396,6.136713636806235e-06,2025-07-11 07:33:17.672171,2025-07-11 07:35:07.972880,0 days 00:01:50.300709,identity,min,0.008950891269327542,9,14,bell,COMPLETE
397,4.081658062204951e-06,2025-07-11 07:35:07.973895,2025-07-11 07:36:58.217993,0 days 00:01:50.244098,identity,min,0.006915396897718379,9,14,bell,COMPLETE
398,0.0006363114225678146,2025-07-11 07:36:58.219026,2025-07-11 07:38:48.509428,0 days 00:01:50.290402,identity,min,0.008312244802062423,9,14,bell,COMPLETE
399,3.6654805626312736e-06,2025-07-11 07:38:48.510431,2025-07-11 07:40:38.860415,0 days 00:01:50.349984,identity,min,0.009194320392467184,9,14,bell,COMPLETE
400,3.6440978874452412e-06,2025-07-11 07:40:38.861443,2025-07-11 07:42:24.876164,0 days 00:01:46.014721,identity,min,0.007496691798233324,9,13,bell,COMPLETE
401,0.0024425433948636055,2025-07-11 07:42:24.877211,2025-07-11 07:44:07.234429,0 days 00:01:42.357218,identity,min,0.008379707096365787,9,13,gaussian,COMPLETE
402,3.745403546417947e-06,2025-07-11 07:44:07.235498,2025-07-11 07:46:02.002536,0 days 00:01:54.767038,identity,min,0.00924110556285647,9,15,bell,COMPLETE
403,0.04757490009069443,2025-07-11 07:46:02.003556,2025-07-11 07:47:52.464705,0 days 00:01:50.461149,identity,min,0.007549334392901695,9,14,bell,COMPLETE
404,0.004134326241910458,2025-07-11 07:47:52.465719,2025-07-11 07:49:38.542645,0 days 00:01:46.076926,identity,min,0.006793903112910368,9,13,bell,COMPLETE
405,4.905923105980037e-06,2025-07-11 07:49:38.543676,2025-07-11 07:51:20.198402,0 days 00:01:41.654726,identity,min,0.00824064826685806,9,12,bell,COMPLETE
406,0.050403036177158356,2025-07-11 07:51:20.199569,2025-07-11 07:53:01.976811,0 days 00:01:41.777242,identity,min,0.009127340080649315,9,12,bell,COMPLETE
407,3.6081262351217447e-06,2025-07-11 07:53:01.977764,2025-07-11 07:54:52.555677,0 days 00:01:50.577913,identity,min,0.007955286834184052,9,14,bell,COMPLETE
408,3.677472477647825e-06,2025-07-11 07:54:52.556707,2025-07-11 07:56:38.788039,0 days 00:01:46.231332,identity,min,0.009354242001898478,9,13,bell,COMPLETE
409,0.00045497107203118503,2025-07-11 07:56:38.789044,2025-07-11 07:58:20.462692,0 days 00:01:41.673648,relu,min,0.007073029581512571,9,11,bell,COMPLETE
410,0.002304286928847432,2025-07-11 07:58:20.463786,2025-07-11 08:00:05.473256,0 days 00:01:45.009470,identity,min,0.008654037263795707,9,14,sigmoid,COMPLETE
411,5.058573606220307e-06,2025-07-11 08:00:05.474281,2025-07-11 08:01:47.173191,0 days 00:01:41.698910,identity,min,0.009990030908935535,9,12,bell,COMPLETE
412,3.7029303712188266e-06,2025-07-11 08:01:47.174246,2025-07-11 08:03:42.018292,0 days 00:01:54.844046,identity,min,0.007589798806067167,9,15,bell,COMPLETE
413,4.37626249549794e-06,2025-07-11 08:03:42.019351,2025-07-11 08:05:28.166795,0 days 00:01:46.147444,identity,min,0.009993533518701187,9,13,bell,COMPLETE
414,3.7294771573215257e-06,2025-07-11 08:05:28.167875,2025-07-11 08:07:09.895449,0 days 00:01:41.727574,identity,min,0.008733613973260182,9,12,bell,COMPLETE
415,3.990068762504961e-06,2025-07-11 08:07:09.896531,2025-07-11 08:09:04.769124,0 days 00:01:54.872593,identity,min,0.00805394382320395,9,15,bell,COMPLETE
