number,value,datetime_start,datetime_complete,duration,params_activation,params_and_operator,params_lr,params_n_sets,params_seq_length,params_shape,state
417,0.0001665931340539828,2025-07-11 02:00:15.313176,2025-07-11 02:01:15.809958,0 days 00:01:00.496782,identity,prod,0.005625438123524835,8,25,bell,COMPLETE
418,3.5224841212766478e-06,2025-07-11 02:01:15.810690,2025-07-11 02:02:14.611899,0 days 00:00:58.801209,identity,min,0.006791785614773232,7,24,bell,COMPLETE
419,4.815442935068859e-06,2025-07-11 02:02:14.612623,2025-07-11 02:03:13.424907,0 days 00:00:58.812284,identity,min,0.004740277224852866,7,24,bell,COMPLETE
420,3.4897977911896305e-06,2025-07-11 02:03:13.425638,2025-07-11 02:04:13.919367,0 days 00:01:00.493729,identity,prod,0.0064834402661118964,7,24,bell,COMPLETE
421,3.6092819755140226e-06,2025-07-11 02:04:13.920107,2025-07-11 02:05:14.447588,0 days 00:01:00.527481,identity,prod,0.006716362117413095,7,24,bell,COMPLETE
422,3.491783218123601e-06,2025-07-11 02:05:14.448314,2025-07-11 02:06:13.282418,0 days 00:00:58.834104,identity,min,0.007057696588294294,7,24,bell,COMPLETE
423,3.6688750242319657e-06,2025-07-11 02:06:13.283159,2025-07-11 02:07:12.469187,0 days 00:00:59.186028,relu,min,0.00636169064449005,7,24,bell,COMPLETE
424,3.6961671412427677e-06,2025-07-11 02:07:12.469932,2025-07-11 02:08:11.436893,0 days 00:00:58.966961,identity,min,0.0069409494364449,7,25,bell,COMPLETE
425,0.06103741005063057,2025-07-11 02:08:11.437638,2025-07-11 02:09:09.971127,0 days 00:00:58.533489,identity,min,0.006049951504025557,7,24,bell,COMPLETE
426,4.222250026941765e-06,2025-07-11 02:09:09.971867,2025-07-11 02:10:08.631823,0 days 00:00:58.659956,identity,min,0.007204714021488245,7,24,bell,COMPLETE
427,7.488035407732241e-06,2025-07-11 02:10:08.632564,2025-07-11 02:11:07.576713,0 days 00:00:58.944149,identity,min,0.006232356710874159,7,25,bell,COMPLETE
428,3.794787062361138e-06,2025-07-11 02:11:07.577458,2025-07-11 02:12:06.245982,0 days 00:00:58.668524,identity,min,0.005554325396587175,7,24,bell,COMPLETE
429,0.0010927566327154636,2025-07-11 02:12:06.246750,2025-07-11 02:13:00.986026,0 days 00:00:54.739276,identity,min,0.006660547477354047,7,25,gaussian,COMPLETE
430,0.0036663957871496677,2025-07-11 02:13:00.986767,2025-07-11 02:13:59.461351,0 days 00:00:58.474584,identity,min,0.0073254735659707484,7,23,bell,COMPLETE
431,3.947998720832402e-06,2025-07-11 02:13:59.462094,2025-07-11 02:14:58.306199,0 days 00:00:58.844105,identity,min,0.0057529574845606125,7,24,bell,COMPLETE
432,8.575150422984734e-05,2025-07-11 02:14:58.306952,2025-07-11 02:15:57.365653,0 days 00:00:59.058701,identity,min,0.007719815158135343,7,25,bell,COMPLETE
433,3.7321533454814926e-06,2025-07-11 02:15:57.366396,2025-07-11 02:16:55.768983,0 days 00:00:58.402587,identity,min,0.006642729576334707,7,23,bell,COMPLETE
434,0.005642557982355356,2025-07-11 02:16:55.769733,2025-07-11 02:17:48.867084,0 days 00:00:53.097351,identity,min,0.0052819945042475915,7,25,sigmoid,COMPLETE
435,4.872797489952063e-06,2025-07-11 02:17:48.867818,2025-07-11 02:18:47.670878,0 days 00:00:58.803060,identity,min,0.0069155641693679675,7,24,bell,COMPLETE
436,7.848098903195933e-06,2025-07-11 02:18:47.671620,2025-07-11 02:19:46.719513,0 days 00:00:59.047893,identity,min,0.0060117038497048275,7,25,bell,COMPLETE
437,4.042399268655572e-06,2025-07-11 02:19:46.720256,2025-07-11 02:20:45.447913,0 days 00:00:58.727657,identity,min,0.007670717136706443,7,24,bell,COMPLETE
438,9.662880074756686e-06,2025-07-11 02:20:45.448658,2025-07-11 02:21:45.579581,0 days 00:01:00.130923,identity,prod,0.006388854657026453,7,23,bell,COMPLETE
439,3.5472219224175205e-06,2025-07-11 02:21:45.580331,2025-07-11 02:22:44.357595,0 days 00:00:58.777264,identity,min,0.008052013063180251,7,24,bell,COMPLETE
440,4.196729150862666e-06,2025-07-11 02:22:44.358354,2025-07-11 02:23:45.128805,0 days 00:01:00.770451,identity,prod,0.007027614465679179,7,25,bell,COMPLETE
441,5.091463663120521e-06,2025-07-11 02:23:45.129563,2025-07-11 02:24:41.492206,0 days 00:00:56.362643,identity,min,0.005684397932276021,7,11,bell,COMPLETE
442,3.567962949091452e-06,2025-07-11 02:24:41.492946,2025-07-11 02:25:42.421787,0 days 00:01:00.928841,identity,prod,0.005055881438423864,7,25,bell,COMPLETE
443,4.008449650427792e-06,2025-07-11 02:25:42.422547,2025-07-11 02:26:40.417766,0 days 00:00:57.995219,identity,min,0.008719541307462336,8,23,bell,COMPLETE
444,0.026725219562649727,2025-07-11 02:26:40.418521,2025-07-11 02:27:36.532858,0 days 00:00:56.114337,relu,prod,0.0016426904447113747,5,25,bell,COMPLETE
445,6.849420060461853e-06,2025-07-11 02:27:36.533605,2025-07-11 02:28:35.221334,0 days 00:00:58.687729,identity,min,0.006039596832180139,7,24,bell,COMPLETE
446,0.0007446640520356596,2025-07-11 02:28:35.222078,2025-07-11 02:29:35.492360,0 days 00:01:00.270282,identity,prod,0.007286731813392988,7,24,bell,COMPLETE
447,6.806257260905113e-06,2025-07-11 02:29:35.493281,2025-07-11 02:30:33.894641,0 days 00:00:58.401360,identity,min,0.006509568868699745,7,23,bell,COMPLETE
448,3.5862362892657984e-06,2025-07-11 02:30:33.895395,2025-07-11 02:31:31.798790,0 days 00:00:57.903395,identity,prod,0.008115937438732018,9,24,gaussian,COMPLETE
449,0.0004363852203823626,2025-07-11 02:31:31.799540,2025-07-11 02:32:30.848975,0 days 00:00:59.049435,identity,min,0.005384367219196616,7,25,bell,COMPLETE
450,4.408795575727709e-06,2025-07-11 02:32:30.849732,2025-07-11 02:33:31.306813,0 days 00:01:00.457081,identity,prod,0.007004801347552742,7,24,bell,COMPLETE
451,4.403362254379317e-06,2025-07-11 02:33:31.307556,2025-07-11 02:34:29.706735,0 days 00:00:58.399179,identity,min,0.006204152614115464,7,23,bell,COMPLETE
452,3.549995881257928e-06,2025-07-11 02:34:29.707484,2025-07-11 02:35:30.546138,0 days 00:01:00.838654,identity,prod,0.0038269430637805166,7,25,bell,COMPLETE
453,0.007017574273049831,2025-07-11 02:35:30.546901,2025-07-11 02:36:31.404582,0 days 00:01:00.857681,identity,prod,0.0001415302019498197,7,25,bell,COMPLETE
454,4.3978939174849074e-06,2025-07-11 02:36:31.405336,2025-07-11 02:37:30.246740,0 days 00:00:58.841404,identity,min,0.004762936485646363,7,24,bell,COMPLETE
455,3.4923277780762874e-06,2025-07-11 02:37:30.247491,2025-07-11 02:38:30.453150,0 days 00:01:00.205659,identity,prod,0.007761305819041339,7,23,bell,COMPLETE
456,4.41280280938372e-06,2025-07-11 02:38:30.453897,2025-07-11 02:39:23.103592,0 days 00:00:52.649695,identity,min,0.008605529420759579,7,23,sigmoid,COMPLETE
457,3.5170560295227915e-06,2025-07-11 02:39:23.104354,2025-07-11 02:40:23.343540,0 days 00:01:00.239186,identity,prod,0.00786835205140469,7,23,bell,COMPLETE
458,6.353216122079175e-06,2025-07-11 02:40:23.344299,2025-07-11 02:41:21.967202,0 days 00:00:58.622903,identity,prod,0.008324265203665875,7,18,bell,COMPLETE
459,0.059804342687129974,2025-07-11 02:41:21.967956,2025-07-11 02:42:22.074597,0 days 00:01:00.106641,identity,prod,0.008990953744174314,7,23,bell,COMPLETE
460,4.455091129784705e-06,2025-07-11 02:42:22.075351,2025-07-11 02:43:22.307713,0 days 00:01:00.232362,identity,prod,0.007704293878077246,7,23,bell,COMPLETE
461,4.770750365423737e-06,2025-07-11 02:43:22.308468,2025-07-11 02:44:22.559345,0 days 00:01:00.250877,identity,prod,0.007573762923911247,7,23,bell,COMPLETE
462,5.411959136836231e-06,2025-07-11 02:44:22.560099,2025-07-11 02:45:23.266516,0 days 00:01:00.706417,relu,prod,0.009214394953101501,7,23,bell,COMPLETE
463,3.6458238810155308e-06,2025-07-11 02:45:23.267288,2025-07-11 02:46:23.594214,0 days 00:01:00.326926,identity,prod,0.00831350119105318,7,23,bell,COMPLETE
464,4.3382506191846915e-06,2025-07-11 02:46:23.594966,2025-07-11 02:47:23.870069,0 days 00:01:00.275103,identity,prod,0.007844009097713529,7,23,bell,COMPLETE
465,9.888959903037176e-05,2025-07-11 02:47:23.870825,2025-07-11 02:48:21.563941,0 days 00:00:57.693116,identity,prod,0.002743846783586025,6,23,bell,COMPLETE
466,4.605808044289006e-06,2025-07-11 02:48:21.564697,2025-07-11 02:49:21.824050,0 days 00:01:00.259353,identity,prod,0.007396232113757204,7,23,bell,COMPLETE
467,3.881552402162924e-06,2025-07-11 02:49:21.824795,2025-07-11 02:50:20.920502,0 days 00:00:59.095707,identity,prod,0.008708480377739409,7,19,bell,COMPLETE
468,0.007278296165168285,2025-07-11 02:50:20.921265,2025-07-11 02:51:21.511860,0 days 00:01:00.590595,identity,prod,0.0009649455574206768,7,24,bell,COMPLETE
469,3.6613025713450043e-06,2025-07-11 02:51:21.512624,2025-07-11 02:52:21.816085,0 days 00:01:00.303461,identity,prod,0.0076503086794915635,7,23,bell,COMPLETE
470,0.017064761370420456,2025-07-11 02:52:21.816852,2025-07-11 02:53:17.720661,0 days 00:00:55.903809,identity,prod,0.007053433687037698,7,24,gaussian,COMPLETE
471,3.832567472272785e-06,2025-07-11 02:53:17.721416,2025-07-11 02:54:17.976635,0 days 00:01:00.255219,identity,prod,0.008379633407988397,7,23,bell,COMPLETE
472,5.8547002481645904e-06,2025-07-11 02:54:17.977394,2025-07-11 02:55:15.937352,0 days 00:00:57.959958,identity,prod,0.0067440864687918515,6,24,bell,COMPLETE
473,4.1657694964669645e-06,2025-07-11 02:55:15.938041,2025-07-11 02:56:16.193077,0 days 00:01:00.255036,identity,prod,0.00431945710962974,7,23,bell,COMPLETE
474,0.00011590444773901254,2025-07-11 02:56:16.193824,2025-07-11 02:57:12.701417,0 days 00:00:56.507593,identity,prod,0.00934240592605154,6,19,bell,COMPLETE
475,3.4047409371851245e-06,2025-07-11 02:57:12.702167,2025-07-11 02:58:09.851959,0 days 00:00:57.149792,identity,prod,0.0056544869165597806,7,14,bell,COMPLETE
476,0.0007258195546455681,2025-07-11 02:58:09.852713,2025-07-11 02:59:07.441271,0 days 00:00:57.588558,identity,prod,0.005118425155489023,7,15,bell,COMPLETE
477,3.6115934562985785e-06,2025-07-11 02:59:07.442027,2025-07-11 03:00:04.663528,0 days 00:00:57.221501,identity,prod,0.005568667852132758,7,14,bell,COMPLETE
478,0.0031800849828869104,2025-07-11 03:00:04.664287,2025-07-11 03:01:02.196556,0 days 00:00:57.532269,identity,prod,0.004647096816171579,7,15,bell,COMPLETE
479,2.287466122652404e-05,2025-07-11 03:01:02.197320,2025-07-11 03:01:54.706196,0 days 00:00:52.508876,identity,prod,0.0077955215861963785,6,25,sigmoid,COMPLETE
480,0.037029802799224854,2025-07-11 03:01:54.706936,2025-07-11 03:02:50.976327,0 days 00:00:56.269391,identity,prod,0.005821576852999292,7,12,bell,COMPLETE
481,4.500725481193513e-05,2025-07-11 03:02:50.977085,2025-07-11 03:03:48.474490,0 days 00:00:57.497405,relu,prod,0.0007885207485586585,7,14,bell,COMPLETE
482,0.0607326366007328,2025-07-11 03:03:48.475263,2025-07-11 03:04:45.116629,0 days 00:00:56.641366,identity,prod,0.007239219999334556,7,13,bell,COMPLETE
483,0.008236623369157314,2025-07-11 03:04:45.117381,2025-07-11 03:05:42.180594,0 days 00:00:57.063213,identity,prod,0.006499201605084262,7,14,bell,COMPLETE
484,3.893646862707101e-06,2025-07-11 03:05:42.181371,2025-07-11 03:06:43.012913,0 days 00:01:00.831542,identity,prod,0.005271558954244283,7,25,bell,COMPLETE
485,3.4489335121179465e-06,2025-07-11 03:06:43.013683,2025-07-11 03:07:37.561645,0 days 00:00:54.547962,identity,prod,0.008577485476383932,6,13,bell,COMPLETE
486,3.607342478062492e-06,2025-07-11 03:07:37.562409,2025-07-11 03:08:32.015985,0 days 00:00:54.453576,identity,prod,0.009304752945378345,6,13,bell,COMPLETE
487,4.297341547498945e-06,2025-07-11 03:08:32.016753,2025-07-11 03:09:26.431806,0 days 00:00:54.415053,identity,prod,0.008504174854176847,6,13,bell,COMPLETE
488,4.363294920040062e-06,2025-07-11 03:09:26.432748,2025-07-11 03:10:21.173362,0 days 00:00:54.740614,identity,prod,0.009982354583758726,6,14,bell,COMPLETE
489,0.004925400950014591,2025-07-11 03:10:21.174118,2025-07-11 03:11:15.910904,0 days 00:00:54.736786,identity,prod,0.00406984917549739,6,14,bell,COMPLETE
490,3.4626764318090864e-06,2025-07-11 03:11:15.911661,2025-07-11 03:12:10.245527,0 days 00:00:54.333866,identity,prod,0.005548417104529315,6,13,bell,COMPLETE
491,3.739830390259158e-06,2025-07-11 03:12:10.246289,2025-07-11 03:13:04.501784,0 days 00:00:54.255495,identity,prod,0.004679660474552921,6,13,bell,COMPLETE
492,4.1266775951953605e-06,2025-07-11 03:13:04.502539,2025-07-11 03:13:58.776652,0 days 00:00:54.274113,identity,prod,0.003293455065048278,6,13,bell,COMPLETE
493,0.009689107537269592,2025-07-11 03:13:58.777408,2025-07-11 03:14:49.084740,0 days 00:00:50.307332,identity,prod,0.004972074629402778,6,12,gaussian,COMPLETE
494,0.00011512178025441244,2025-07-11 03:14:49.085492,2025-07-11 03:15:44.355453,0 days 00:00:55.269961,identity,prod,0.00555891960967775,6,16,bell,COMPLETE
495,0.002262705937027931,2025-07-11 03:15:44.356221,2025-07-11 03:16:38.479800,0 days 00:00:54.123579,identity,prod,0.005846059480527585,6,13,bell,COMPLETE
496,6.004015176586108e-06,2025-07-11 03:16:38.480551,2025-07-11 03:17:33.068914,0 days 00:00:54.588363,identity,prod,0.005168744225625992,6,14,bell,COMPLETE
497,0.0002842723624780774,2025-07-11 03:17:33.069665,2025-07-11 03:18:27.293588,0 days 00:00:54.223923,identity,prod,0.0018998575841948809,6,13,bell,COMPLETE
498,3.861612185573904e-06,2025-07-11 03:18:27.294353,2025-07-11 03:19:21.509978,0 days 00:00:54.215625,identity,prod,0.009110629584810364,6,13,bell,COMPLETE
499,4.980830908607459e-06,2025-07-11 03:19:21.510741,2025-07-11 03:20:15.417323,0 days 00:00:53.906582,identity,prod,0.005846278873230079,6,12,bell,COMPLETE
