number,value,datetime_start,datetime_complete,duration,params_activation,params_batch_size,params_h,params_lr,params_seq_length,params_shuffle,params_weight_decay,state
482,4.621419066097587e-06,2025-07-04 14:46:34.322825,2025-07-04 14:46:46.667154,0 days 00:00:12.344329,identity,32,122,0.0004188407842436528,8,False,1.245207435585841e-05,COMPLETE
483,1.1704431017278694e-05,2025-07-04 14:46:46.667539,2025-07-04 14:46:59.636640,0 days 00:00:12.969101,identity,32,125,0.0005098200138951771,9,False,1.5022256345047819e-05,COMPLETE
484,5.702626822312595e-06,2025-07-04 14:46:59.637038,2025-07-04 14:47:11.869278,0 days 00:00:12.232240,identity,32,120,0.00027205871801181357,8,False,4.4683973478100524e-05,COMPLETE
485,0.03157290071249008,2025-07-04 14:47:11.869672,2025-07-04 14:47:24.211177,0 days 00:00:12.341505,sigmoid,32,128,0.00031797314578550047,8,False,2.0407046288699364e-05,COMPLETE
486,4.99407678944408e-06,2025-07-04 14:47:24.211572,2025-07-04 14:47:37.181617,0 days 00:00:12.970045,identity,32,123,0.0002970318952257686,9,False,2.3238614335855685e-05,COMPLETE
487,4.185385023447452e-06,2025-07-04 14:47:37.182023,2025-07-04 14:47:49.718784,0 days 00:00:12.536761,identity,32,126,0.0002529884680657022,8,False,1.711949863835903e-05,COMPLETE
488,4.655290922528366e-06,2025-07-04 14:47:49.719172,2025-07-04 14:48:02.689115,0 days 00:00:12.969943,identity,32,117,0.00039968430741179223,10,False,1.3602566859173255e-05,COMPLETE
489,1.3146940545993857e-05,2025-07-04 14:48:02.689511,2025-07-04 14:48:11.170763,0 days 00:00:08.481252,identity,64,121,0.0003498715870180381,9,False,1.1911773744801023e-05,COMPLETE
490,3.876186383422464e-06,2025-07-04 14:48:11.171172,2025-07-04 14:48:23.600644,0 days 00:00:12.429472,identity,32,124,0.0004687517997121446,8,False,1.546051207574434e-05,COMPLETE
491,6.276301519392291e-06,2025-07-04 14:48:23.601035,2025-07-04 14:48:36.163249,0 days 00:00:12.562214,identity,32,126,0.000486939327672961,8,False,1.5420592503458492e-05,COMPLETE
492,1.1490983524709009e-05,2025-07-04 14:48:36.163647,2025-07-04 14:48:48.437213,0 days 00:00:12.273566,identity,32,128,0.00045040579599204774,8,False,1.7622684080869477e-05,COMPLETE
493,1.0463196304044686e-05,2025-07-04 14:48:48.437605,2025-07-04 14:49:00.969024,0 days 00:00:12.531419,identity,32,123,0.0020354509120959763,8,False,1.610191047978765e-05,COMPLETE
494,5.442257588583743e-06,2025-07-04 14:49:00.969416,2025-07-04 14:49:21.111354,0 days 00:00:20.141938,identity,16,124,0.000543126603142313,8,False,1.424092981151843e-05,COMPLETE
495,5.450145181384869e-06,2025-07-04 14:49:21.111747,2025-07-04 14:49:33.644823,0 days 00:00:12.533076,identity,32,126,0.00045929332009671736,8,False,1.876498299733779e-05,COMPLETE
496,4.995737072022166e-06,2025-07-04 14:49:33.645216,2025-07-04 14:49:45.979410,0 days 00:00:12.334194,identity,32,119,0.0005087488084342353,8,False,1.6469294325389962e-05,COMPLETE
497,4.4253060877963435e-06,2025-07-04 14:49:45.979798,2025-07-04 14:49:58.130710,0 days 00:00:12.150912,identity,32,114,0.0004169017805919502,8,False,1.4724458435332163e-05,COMPLETE
498,4.846442152484087e-06,2025-07-04 14:49:58.131098,2025-07-04 14:50:10.616070,0 days 00:00:12.484972,identity,32,124,0.0003775609226512938,8,False,2.1855816085244514e-05,COMPLETE
499,3.5249067877884954e-05,2025-07-04 14:50:10.616466,2025-07-04 14:50:16.202915,0 days 00:00:05.586449,identity,128,98,0.0005789095152253045,8,False,1.3052340911558482e-05,COMPLETE
