number,value,datetime_start,datetime_complete,duration,params_activation,params_and_operator,params_lr,params_n_sets,params_seq_length,params_shape,state
0,0.1345725953578949,2025-07-10 19:21:41.534124,2025-07-10 19:22:31.567958,0 days 00:00:50.033834,identity,prod,0.0025890943815425455,5,6,gaussian,COMPLETE
1,1.3189793825149536,2025-07-10 19:22:31.568988,2025-07-10 19:23:22.935249,0 days 00:00:51.366261,relu,min,0.0019481181572359987,8,9,sigmoid,COMPLETE
2,0.20102138817310333,2025-07-10 19:23:22.935849,2025-07-10 19:24:23.343827,0 days 00:01:00.407978,relu,prod,0.00029415344288543114,8,25,bell,COMPLETE
3,0.0803738608956337,2025-07-10 19:24:23.345024,2025-07-10 19:25:16.256368,0 days 00:00:52.911344,relu,min,0.0003794567297038501,5,19,bell,COMPLETE
4,0.0001641160633880645,2025-07-10 19:25:16.256949,2025-07-10 19:26:10.182842,0 days 00:00:53.925893,identity,prod,0.008920905497319965,8,19,gaussian,COMPLETE
5,0.006597158033400774,2025-07-10 19:26:10.183422,2025-07-10 19:26:58.236178,0 days 00:00:48.052756,relu,prod,0.0006763454174573316,5,15,sigmoid,COMPLETE
6,0.01328141987323761,2025-07-10 19:26:58.236751,2025-07-10 19:27:46.998144,0 days 00:00:48.761393,relu,min,0.00019504020435902623,5,10,gaussian,COMPLETE
7,4.7766570787644014e-05,2025-07-10 19:27:46.998709,2025-07-10 19:28:36.171397,0 days 00:00:49.172688,identity,prod,0.0006035087070054423,5,16,gaussian,COMPLETE
8,6.6825687099481e-06,2025-07-10 19:28:36.171953,2025-07-10 19:29:24.667409,0 days 00:00:48.495456,identity,min,0.00952299991550127,6,9,sigmoid,COMPLETE
9,0.00044893575250171125,2025-07-10 19:29:24.667971,2025-07-10 19:30:15.070444,0 days 00:00:50.402473,identity,prod,0.0011637074712665676,6,6,gaussian,COMPLETE
10,1.81284049176611e-05,2025-07-10 19:30:15.071017,2025-07-10 19:31:05.948103,0 days 00:00:50.877086,identity,min,0.009393811336822357,7,11,sigmoid,COMPLETE
11,0.00011713484127540141,2025-07-10 19:31:05.948695,2025-07-10 19:31:56.701251,0 days 00:00:50.752556,identity,min,0.009685968440891958,7,11,sigmoid,COMPLETE
12,0.01745280623435974,2025-07-10 19:31:56.701812,2025-07-10 19:32:45.838190,0 days 00:00:49.136378,identity,min,0.004437120082898683,7,12,sigmoid,COMPLETE
13,0.0176452174782753,2025-07-10 19:32:45.838780,2025-07-10 19:33:33.910870,0 days 00:00:48.072090,identity,min,0.005052411829059269,6,8,sigmoid,COMPLETE
14,0.08544448018074036,2025-07-10 19:33:33.911445,2025-07-10 19:34:26.065256,0 days 00:00:52.153811,identity,min,0.00010132455296556671,9,15,sigmoid,COMPLETE
15,0.000925278989598155,2025-07-10 19:34:26.065856,2025-07-10 19:35:15.533847,0 days 00:00:49.467991,identity,min,0.0046774811739785345,7,13,sigmoid,COMPLETE
16,0.0038709058426320553,2025-07-10 19:35:15.534423,2025-07-10 19:36:02.927672,0 days 00:00:47.393249,identity,min,0.0024345849123109673,6,5,sigmoid,COMPLETE
17,3.909699898940744e-06,2025-07-10 19:36:02.928205,2025-07-10 19:36:56.035033,0 days 00:00:53.106828,identity,min,0.006349892930604402,6,8,bell,COMPLETE
18,0.0002627724898047745,2025-07-10 19:36:56.035611,2025-07-10 19:37:49.166633,0 days 00:00:53.131022,identity,min,0.0014903049949567537,6,8,bell,COMPLETE
19,3.7881738990108715e-06,2025-07-10 19:37:49.167223,2025-07-10 19:38:41.952993,0 days 00:00:52.785770,identity,min,0.0059120901715114605,6,7,bell,COMPLETE
20,0.0006104487692937255,2025-07-10 19:38:41.953574,2025-07-10 19:39:38.253942,0 days 00:00:56.300368,identity,min,0.0032849852792448107,6,25,bell,COMPLETE
21,3.5609130009106593e-06,2025-07-10 19:39:38.254529,2025-07-10 19:40:31.070416,0 days 00:00:52.815887,identity,min,0.006246640386477375,6,7,bell,COMPLETE
22,3.940868737117853e-06,2025-07-10 19:40:31.071019,2025-07-10 19:41:23.886656,0 days 00:00:52.815637,identity,min,0.005423727838276875,6,7,bell,COMPLETE
23,6.594026217499049e-06,2025-07-10 19:41:23.887243,2025-07-10 19:42:16.025428,0 days 00:00:52.138185,identity,min,0.006530949548701847,6,5,bell,COMPLETE
24,0.0003094166168011725,2025-07-10 19:42:16.026010,2025-07-10 19:43:10.702703,0 days 00:00:54.676693,identity,min,0.0035498571923360638,7,7,bell,COMPLETE
25,4.688400622399058e-06,2025-07-10 19:43:10.703296,2025-07-10 19:44:03.519759,0 days 00:00:52.816463,identity,min,0.006629240655468625,6,13,bell,COMPLETE
26,4.7810144678805955e-06,2025-07-10 19:44:03.520335,2025-07-10 19:44:55.674846,0 days 00:00:52.154511,relu,min,0.0033549923367173955,5,9,bell,COMPLETE
27,7.2171010288002435e-06,2025-07-10 19:44:55.675445,2025-07-10 19:45:49.541283,0 days 00:00:53.865838,identity,min,0.0016784233900640317,7,5,bell,COMPLETE
28,3.8992793633951806e-06,2025-07-10 19:45:49.541872,2025-07-10 19:46:43.698939,0 days 00:00:54.157067,identity,min,0.0063995890271083865,6,17,bell,COMPLETE
29,0.0002637226425576955,2025-07-10 19:46:43.699520,2025-07-10 19:47:37.353046,0 days 00:00:53.653526,identity,prod,0.002628363733310107,5,18,bell,COMPLETE
30,0.00021469988860189915,2025-07-10 19:47:37.353651,2025-07-10 19:48:34.911291,0 days 00:00:57.557640,identity,min,0.0024223635283171195,7,21,bell,COMPLETE
31,0.0011819637147709727,2025-07-10 19:48:34.911884,2025-07-10 19:49:30.161068,0 days 00:00:55.249184,identity,min,0.0066606739137376235,6,21,bell,COMPLETE
32,3.5595742247096496e-06,2025-07-10 19:49:30.161654,2025-07-10 19:50:22.993489,0 days 00:00:52.831835,identity,min,0.006823232724952135,6,7,bell,COMPLETE
33,5.210397830524016e-06,2025-07-10 19:50:22.994071,2025-07-10 19:51:17.099827,0 days 00:00:54.105756,identity,min,0.004245006039375753,6,17,bell,COMPLETE
34,5.804923603136558e-06,2025-07-10 19:51:17.100419,2025-07-10 19:52:08.467469,0 days 00:00:51.367050,relu,min,0.007647733836782082,5,13,bell,COMPLETE
35,3.5947739434050163e-06,2025-07-10 19:52:08.468056,2025-07-10 19:53:05.986121,0 days 00:00:57.518065,identity,min,0.003488863596771645,8,22,bell,COMPLETE
36,0.0034001190215349197,2025-07-10 19:53:05.986730,2025-07-10 19:54:05.673447,0 days 00:00:59.686717,relu,prod,0.003096378114400098,8,21,bell,COMPLETE
37,0.007686675526201725,2025-07-10 19:54:05.674047,2025-07-10 19:55:06.408820,0 days 00:01:00.734773,identity,min,0.0009009610128504606,9,25,bell,COMPLETE
38,0.006088961847126484,2025-07-10 19:55:06.409414,2025-07-10 19:56:00.631361,0 days 00:00:54.221947,relu,prod,0.004406874098637565,8,7,gaussian,COMPLETE
39,4.2805058910744265e-06,2025-07-10 19:56:00.631938,2025-07-10 19:56:58.291690,0 days 00:00:57.659752,identity,min,0.0021270794102608674,8,23,bell,COMPLETE
40,0.020558597519993782,2025-07-10 19:56:58.292296,2025-07-10 19:57:55.610370,0 days 00:00:57.318074,relu,prod,0.00040890390069435396,9,10,gaussian,COMPLETE
41,8.693272320670076e-06,2025-07-10 19:57:55.610967,2025-07-10 19:58:49.484318,0 days 00:00:53.873351,identity,min,0.005597864721559822,5,23,bell,COMPLETE
42,3.8030896121199476e-06,2025-07-10 19:58:49.484908,2025-07-10 19:59:44.324637,0 days 00:00:54.839729,identity,min,0.007836785371561534,6,19,bell,COMPLETE
43,3.5104317248624284e-06,2025-07-10 19:59:44.325233,2025-07-10 20:00:41.728987,0 days 00:00:57.403754,identity,min,0.008009623136570259,7,20,bell,COMPLETE
44,3.484535227471497e-06,2025-07-10 20:00:41.729589,2025-07-10 20:01:40.037987,0 days 00:00:58.308398,identity,min,0.008536508911060626,7,23,bell,COMPLETE
45,4.931338935421081e-06,2025-07-10 20:01:40.038603,2025-07-10 20:02:37.872090,0 days 00:00:57.833487,identity,min,0.007929939401424124,8,23,bell,COMPLETE
46,3.799624664679868e-06,2025-07-10 20:02:37.872688,2025-07-10 20:03:35.843579,0 days 00:00:57.970891,identity,min,0.009885345342549028,7,22,bell,COMPLETE
47,0.00014922396803740412,2025-07-10 20:03:35.844176,2025-07-10 20:04:28.612971,0 days 00:00:52.768795,identity,min,0.004146044218463437,8,20,gaussian,COMPLETE
48,3.7328757116483757e-06,2025-07-10 20:04:28.613570,2025-07-10 20:05:26.484006,0 days 00:00:57.870436,identity,min,0.007977003301879658,7,22,bell,COMPLETE
49,3.619216158767813e-06,2025-07-10 20:05:26.484596,2025-07-10 20:06:26.735037,0 days 00:01:00.250441,identity,prod,0.0083960417398178,7,24,bell,COMPLETE
50,3.6355029351398116e-06,2025-07-10 20:06:26.735635,2025-07-10 20:07:25.149044,0 days 00:00:58.413409,identity,min,0.005242231100778516,7,24,bell,COMPLETE
51,4.1100515772996005e-06,2025-07-10 20:07:25.149656,2025-07-10 20:08:25.419028,0 days 00:01:00.269372,identity,prod,0.00807256884820893,7,24,bell,COMPLETE
52,4.363712832855526e-06,2025-07-10 20:08:25.419628,2025-07-10 20:09:25.460576,0 days 00:01:00.040948,identity,prod,0.00961120388736051,8,24,bell,COMPLETE
53,3.5623270377982408e-06,2025-07-10 20:09:25.461172,2025-07-10 20:10:24.554763,0 days 00:00:59.093591,identity,prod,0.007294031687089131,7,20,bell,COMPLETE
54,0.00025380845181643963,2025-07-10 20:10:24.555370,2025-07-10 20:11:23.661140,0 days 00:00:59.105770,identity,prod,0.004057568395997036,7,20,bell,COMPLETE
55,4.419553079060279e-06,2025-07-10 20:11:23.661753,2025-07-10 20:12:17.271760,0 days 00:00:53.610007,identity,prod,0.004986512311886824,8,15,gaussian,COMPLETE
56,8.747705578571185e-06,2025-07-10 20:12:17.272367,2025-07-10 20:13:14.637885,0 days 00:00:57.365518,identity,min,0.007118778013122041,7,20,bell,COMPLETE
57,0.0423811711370945,2025-07-10 20:13:14.638501,2025-07-10 20:14:07.977145,0 days 00:00:53.338644,identity,min,0.005787771423150442,9,19,sigmoid,COMPLETE
58,0.07463914155960083,2025-07-10 20:14:07.977748,2025-07-10 20:15:07.709173,0 days 00:00:59.731425,identity,prod,0.00016244999122982733,7,22,bell,COMPLETE
59,0.012401925399899483,2025-07-10 20:15:07.709780,2025-07-10 20:16:03.479711,0 days 00:00:55.769931,relu,min,0.003701116171704448,8,14,bell,COMPLETE
60,0.009747241623699665,2025-07-10 20:16:03.480329,2025-07-10 20:17:00.074478,0 days 00:00:56.594149,identity,min,0.004903752411813199,7,18,bell,COMPLETE
61,3.7811398669873597e-06,2025-07-10 20:17:00.075112,2025-07-10 20:18:00.081811,0 days 00:01:00.006699,identity,prod,0.008981565781256513,7,23,bell,COMPLETE
62,0.00048011430772021413,2025-07-10 20:18:00.082424,2025-07-10 20:19:00.460362,0 days 00:01:00.377938,identity,prod,0.007049967555370234,7,24,bell,COMPLETE
63,3.8436819522758015e-06,2025-07-10 20:19:00.460983,2025-07-10 20:20:00.290652,0 days 00:00:59.829669,identity,prod,0.008306989423255494,7,22,bell,COMPLETE
64,0.06481423228979111,2025-07-10 20:20:00.291275,2025-07-10 20:20:56.575011,0 days 00:00:56.283736,identity,prod,0.002940740396332046,7,6,bell,COMPLETE
65,3.4114939353457885e-06,2025-07-10 20:20:56.575621,2025-07-10 20:21:54.706518,0 days 00:00:58.130897,identity,prod,0.005765556973201769,6,25,bell,COMPLETE
66,0.00011609995999606326,2025-07-10 20:21:54.707125,2025-07-10 20:22:45.520295,0 days 00:00:50.813170,identity,min,0.0059188191723149545,6,25,sigmoid,COMPLETE
67,3.999362888862379e-06,2025-07-10 20:22:45.520895,2025-07-10 20:23:40.951648,0 days 00:00:55.430753,identity,min,0.006573309314438753,6,21,bell,COMPLETE
68,0.0017757727764546871,2025-07-10 20:23:40.952262,2025-07-10 20:24:36.503003,0 days 00:00:55.550741,identity,prod,0.0011582139248654387,6,10,bell,COMPLETE
69,0.0008138793637044728,2025-07-10 20:24:36.503610,2025-07-10 20:25:29.157905,0 days 00:00:52.654295,identity,min,0.003803549889776103,6,6,bell,COMPLETE
70,4.062175321450923e-06,2025-07-10 20:25:29.158500,2025-07-10 20:26:21.634433,0 days 00:00:52.475933,identity,min,0.005174980661361951,5,18,bell,COMPLETE
71,6.088776444812538e-06,2025-07-10 20:26:21.635061,2025-07-10 20:27:19.651629,0 days 00:00:58.016568,identity,prod,0.00908754196260543,6,25,bell,COMPLETE
72,4.089653884875588e-06,2025-07-10 20:27:19.652246,2025-07-10 20:28:19.882894,0 days 00:01:00.230648,identity,prod,0.005909655958195435,7,24,bell,COMPLETE
73,0.0065326266922056675,2025-07-10 20:28:19.883498,2025-07-10 20:29:19.717635,0 days 00:00:59.834137,identity,prod,0.007468507544924562,7,23,bell,COMPLETE
74,5.12408405484166e-06,2025-07-10 20:29:19.718263,2025-07-10 20:30:16.854958,0 days 00:00:57.136695,identity,prod,0.004649772793783818,6,22,bell,COMPLETE
75,3.596652959458879e-06,2025-07-10 20:30:16.855572,2025-07-10 20:31:13.736711,0 days 00:00:56.881139,identity,prod,0.008846107888444442,6,21,bell,COMPLETE
76,7.209972409327747e-06,2025-07-10 20:31:13.737326,2025-07-10 20:32:06.248278,0 days 00:00:52.510952,identity,prod,0.006998309522912543,6,20,gaussian,COMPLETE
77,0.005944349803030491,2025-07-10 20:32:06.248889,2025-07-10 20:33:01.947866,0 days 00:00:55.698977,relu,min,0.0007275611720022206,6,21,bell,COMPLETE
78,0.00017649616347625852,2025-07-10 20:33:01.948472,2025-07-10 20:33:48.797743,0 days 00:00:46.849271,identity,min,0.00992787169011929,5,16,sigmoid,COMPLETE
79,3.7466109006345505e-06,2025-07-10 20:33:48.798358,2025-07-10 20:34:42.002704,0 days 00:00:53.204346,identity,min,0.006169301568874739,6,8,bell,COMPLETE
80,4.324073870520806e-06,2025-07-10 20:34:42.003276,2025-07-10 20:35:37.720381,0 days 00:00:55.717105,identity,prod,0.007109447817824039,6,11,bell,COMPLETE
81,3.5106406812701607e-06,2025-07-10 20:35:37.720995,2025-07-10 20:36:37.680841,0 days 00:00:59.959846,identity,prod,0.008555981303260102,7,23,bell,COMPLETE
82,5.831863290950423e-06,2025-07-10 20:36:37.681458,2025-07-10 20:37:37.697599,0 days 00:01:00.016141,identity,prod,0.009120207381248866,7,23,bell,COMPLETE
83,3.494887323540752e-06,2025-07-10 20:37:37.698221,2025-07-10 20:38:34.482830,0 days 00:00:56.784609,identity,prod,0.008460942993157873,6,21,bell,COMPLETE
84,4.35655829278403e-06,2025-07-10 20:38:34.483452,2025-07-10 20:39:34.209291,0 days 00:00:59.725839,identity,prod,0.005498825809007214,7,22,bell,COMPLETE
85,5.421067271527136e-06,2025-07-10 20:39:34.209916,2025-07-10 20:40:32.231171,0 days 00:00:58.021255,identity,prod,0.007596787329188154,6,25,bell,COMPLETE
86,4.086775788891828e-06,2025-07-10 20:40:32.231784,2025-07-10 20:41:31.707690,0 days 00:00:59.475906,identity,min,0.006419127822202446,9,20,bell,COMPLETE
87,1.3060393333435059,2025-07-10 20:41:31.708297,2025-07-10 20:42:29.166464,0 days 00:00:57.458167,relu,min,0.0016297731070793599,7,19,bell,COMPLETE
88,0.2062811553478241,2025-07-10 20:42:29.167097,2025-07-10 20:43:29.008011,0 days 00:00:59.840914,identity,prod,0.0004468221583947698,8,23,bell,COMPLETE
89,0.00041155374492518604,2025-07-10 20:43:29.008635,2025-07-10 20:44:20.320219,0 days 00:00:51.311584,identity,min,0.009928790439721523,6,21,gaussian,COMPLETE
90,3.4609929571161047e-06,2025-07-10 20:44:20.320795,2025-07-10 20:45:19.952495,0 days 00:00:59.631700,identity,prod,0.004559995164354458,7,22,bell,COMPLETE
91,3.662445351437782e-06,2025-07-10 20:45:19.953112,2025-07-10 20:46:19.549183,0 days 00:00:59.596071,identity,prod,0.008403994464964445,7,22,bell,COMPLETE
92,1.6661773770465516e-05,2025-07-10 20:46:19.549807,2025-07-10 20:47:18.654291,0 days 00:00:59.104484,identity,prod,0.005440149774396748,7,20,bell,COMPLETE
93,6.039457730366848e-06,2025-07-10 20:47:18.654923,2025-07-10 20:48:16.100519,0 days 00:00:57.445596,identity,prod,0.004515763028325472,6,23,bell,COMPLETE
94,0.00024135115381795913,2025-07-10 20:48:16.101137,2025-07-10 20:49:15.628407,0 days 00:00:59.527270,identity,prod,0.002798662681475275,8,22,bell,COMPLETE
95,3.5516357002052246e-06,2025-07-10 20:49:15.629029,2025-07-10 20:50:16.086841,0 days 00:01:00.457812,identity,prod,0.006270933190012478,7,24,bell,COMPLETE
96,3.5254315662314184e-06,2025-07-10 20:50:16.087456,2025-07-10 20:51:16.544882,0 days 00:01:00.457426,identity,prod,0.0073555504773134585,7,24,bell,COMPLETE
97,6.724369541188935e-06,2025-07-10 20:51:16.545493,2025-07-10 20:52:16.984713,0 days 00:01:00.439220,identity,prod,0.006725051376879655,7,24,bell,COMPLETE
98,0.0013559028739109635,2025-07-10 20:52:16.985328,2025-07-10 20:53:11.812918,0 days 00:00:54.827590,identity,prod,0.0060260173639871215,7,25,sigmoid,COMPLETE
99,0.09224563091993332,2025-07-10 20:53:11.813530,2025-07-10 20:54:12.004641,0 days 00:01:00.191111,identity,prod,0.007762889403010548,7,24,bell,COMPLETE
100,9.424776180821937e-06,2025-07-10 20:54:12.005262,2025-07-10 20:55:13.054472,0 days 00:01:01.049210,relu,prod,0.004882054981101188,7,25,bell,COMPLETE
101,3.670365003927145e-06,2025-07-10 20:55:13.055101,2025-07-10 20:56:09.271620,0 days 00:00:56.216519,identity,prod,0.008533349937091457,7,12,bell,COMPLETE
102,3.6451249343372183e-06,2025-07-10 20:56:09.272248,2025-07-10 20:57:06.312523,0 days 00:00:57.040275,identity,prod,0.006847825347675367,7,8,bell,COMPLETE
103,0.061492666602134705,2025-07-10 20:57:06.313106,2025-07-10 20:58:06.235257,0 days 00:00:59.922151,identity,prod,0.007777332064502408,7,23,bell,COMPLETE
104,3.4677541407290846e-06,2025-07-10 20:58:06.235890,2025-07-10 20:59:06.494599,0 days 00:01:00.258709,identity,prod,0.006182619916433338,7,24,bell,COMPLETE
105,5.333770786819514e-06,2025-07-10 20:59:06.495223,2025-07-10 21:00:06.811407,0 days 00:01:00.316184,identity,prod,0.00554182011303716,7,24,bell,COMPLETE
106,3.745004960364895e-06,2025-07-10 21:00:06.812025,2025-07-10 21:01:07.413395,0 days 00:01:00.601370,identity,prod,0.006188645605642265,7,25,bell,COMPLETE
107,4.515658292802982e-05,2025-07-10 21:01:07.414018,2025-07-10 21:02:04.850108,0 days 00:00:57.436090,identity,prod,0.003927812327198815,6,23,bell,COMPLETE
108,1.4333381841424853e-05,2025-07-10 21:02:04.850739,2025-07-10 21:03:05.117984,0 days 00:01:00.267245,identity,prod,0.008373903998687173,7,24,bell,COMPLETE
109,0.00022847394575364888,2025-07-10 21:03:05.118612,2025-07-10 21:03:58.453899,0 days 00:00:53.335287,identity,prod,0.004227977607142201,7,9,gaussian,COMPLETE
110,4.467161943466635e-06,2025-07-10 21:03:58.454520,2025-07-10 21:04:58.664565,0 days 00:01:00.210045,identity,prod,0.004853738395149103,7,24,bell,COMPLETE
111,3.836748874164186e-06,2025-07-10 21:04:58.665190,2025-07-10 21:05:55.092183,0 days 00:00:56.426993,identity,prod,0.00747785249377246,7,7,bell,COMPLETE
112,6.728764856234193e-05,2025-07-10 21:05:55.092799,2025-07-10 21:06:55.078001,0 days 00:00:59.985202,identity,prod,0.007085683192413274,7,23,bell,COMPLETE
113,0.02233421988785267,2025-07-10 21:06:55.078613,2025-07-10 21:07:54.438736,0 days 00:00:59.360123,identity,prod,0.00022775786058556313,7,21,bell,COMPLETE
114,3.831018148048315e-06,2025-07-10 21:07:54.439370,2025-07-10 21:08:54.743986,0 days 00:01:00.304616,identity,prod,0.008773914600579854,7,24,bell,COMPLETE
115,3.5268622013973072e-06,2025-07-10 21:08:54.744609,2025-07-10 21:09:51.576148,0 days 00:00:56.831539,identity,prod,0.0052067681280316995,6,21,bell,COMPLETE
116,0.007073971908539534,2025-07-10 21:09:51.576774,2025-07-10 21:10:47.143380,0 days 00:00:55.566606,identity,min,0.005330307678719263,6,22,bell,COMPLETE
117,4.0106351661961526e-06,2025-07-10 21:10:47.144010,2025-07-10 21:11:43.983117,0 days 00:00:56.839107,identity,prod,0.0063123997267102196,6,21,bell,COMPLETE
118,6.18188005319098e-06,2025-07-10 21:11:43.983754,2025-07-10 21:12:40.003189,0 days 00:00:56.019435,identity,min,0.003357955218594824,6,23,bell,COMPLETE
119,0.0009042999008670449,2025-07-10 21:12:40.003833,2025-07-10 21:13:29.187276,0 days 00:00:49.183443,identity,prod,0.005793500398451811,6,5,sigmoid,COMPLETE
120,4.820343747269362e-06,2025-07-10 21:13:29.187897,2025-07-10 21:14:23.548008,0 days 00:00:54.360111,identity,min,0.009335037439890814,5,25,bell,COMPLETE
121,3.979078428528737e-06,2025-07-10 21:14:23.548644,2025-07-10 21:15:19.814763,0 days 00:00:56.266119,identity,prod,0.006519454832492897,6,19,bell,COMPLETE
122,4.864805305260234e-06,2025-07-10 21:15:19.815395,2025-07-10 21:16:18.932288,0 days 00:00:59.116893,identity,prod,0.00736623719101863,7,20,bell,COMPLETE
123,3.7332856663852e-06,2025-07-10 21:16:18.932917,2025-07-10 21:17:16.166766,0 days 00:00:57.233849,identity,prod,0.007981481054883003,6,22,bell,COMPLETE
124,8.075345249380916e-06,2025-07-10 21:17:16.167400,2025-07-10 21:18:14.302063,0 days 00:00:58.134663,identity,prod,0.005131433242385323,7,17,bell,COMPLETE
125,3.5360812944418285e-06,2025-07-10 21:18:14.302698,2025-07-10 21:19:13.617132,0 days 00:00:59.314434,identity,prod,0.006891935324573667,7,21,bell,COMPLETE
126,1.1815091371536255,2025-07-10 21:19:13.617758,2025-07-10 21:20:10.852705,0 days 00:00:57.234947,relu,prod,0.005842366766171964,6,21,bell,COMPLETE
127,4.354232260084245e-06,2025-07-10 21:20:10.853339,2025-07-10 21:21:07.799702,0 days 00:00:56.946363,identity,prod,0.004440487216982466,7,14,bell,COMPLETE
128,3.7291563330654753e-06,2025-07-10 21:21:07.800261,2025-07-10 21:22:03.738225,0 days 00:00:55.937964,identity,min,0.00995404814658458,6,23,bell,COMPLETE
129,4.839177108806325e-06,2025-07-10 21:22:03.738863,2025-07-10 21:23:03.401365,0 days 00:00:59.662502,identity,prod,0.0070804606168151756,7,22,bell,COMPLETE
130,0.0004352910036686808,2025-07-10 21:23:03.401997,2025-07-10 21:24:01.972539,0 days 00:00:58.570542,identity,min,0.0062255719124617494,7,24,bell,COMPLETE
131,5.846470230608247e-06,2025-07-10 21:24:01.973162,2025-07-10 21:25:01.158895,0 days 00:00:59.185733,identity,prod,0.00872754060763138,7,20,bell,COMPLETE
132,3.885921159962891e-06,2025-07-10 21:25:01.159526,2025-07-10 21:26:00.553993,0 days 00:00:59.394467,identity,prod,0.006741341772809754,7,21,bell,COMPLETE
133,3.6360595458972966e-06,2025-07-10 21:26:00.554623,2025-07-10 21:27:00.321395,0 days 00:00:59.766772,identity,prod,0.007619303691672983,7,22,bell,COMPLETE
134,0.0005130099598318338,2025-07-10 21:27:00.322036,2025-07-10 21:27:56.845344,0 days 00:00:56.523308,identity,prod,0.005464591304189533,7,7,bell,COMPLETE
135,3.614569550336455e-06,2025-07-10 21:27:56.845970,2025-07-10 21:28:57.463959,0 days 00:01:00.617989,identity,prod,0.008166344399217755,7,25,bell,COMPLETE
136,0.015175610780715942,2025-07-10 21:28:57.464586,2025-07-10 21:29:53.380024,0 days 00:00:55.915438,identity,prod,0.00011121984462673729,6,18,bell,COMPLETE
137,0.11803745478391647,2025-07-10 21:29:53.380661,2025-07-10 21:30:47.897624,0 days 00:00:54.516963,identity,prod,0.0020881702646551818,7,19,gaussian,COMPLETE
138,3.545525714798714e-06,2025-07-10 21:30:47.898260,2025-07-10 21:31:45.479692,0 days 00:00:57.581432,identity,min,0.006608030260264981,7,21,bell,COMPLETE
