number,value,datetime_start,datetime_complete,duration,params_activation,params_and_operator,params_lr,params_n_sets,params_seq_length,params_shape,state
278,9.050186235981528e-06,2025-07-10 23:45:10.857395,2025-07-10 23:46:10.544591,0 days 00:00:59.687196,identity,prod,0.005838160810377429,7,22,bell,COMPLETE
279,3.6992951208958402e-06,2025-07-10 23:46:10.545282,2025-07-10 23:47:10.596977,0 days 00:01:00.051695,identity,prod,0.006949251170795696,7,23,bell,COMPLETE
280,0.0061834827065467834,2025-07-10 23:47:10.597670,2025-07-10 23:48:10.313398,0 days 00:00:59.715728,identity,prod,0.004566134377764694,7,22,bell,COMPLETE
281,3.6873457247565966e-06,2025-07-10 23:48:10.314102,2025-07-10 23:49:09.290875,0 days 00:00:58.976773,identity,min,0.00795321066559579,7,25,bell,COMPLETE
282,3.5446155379759148e-06,2025-07-10 23:49:09.291571,2025-07-10 23:50:08.731648,0 days 00:00:59.440077,identity,prod,0.00990905901634579,7,21,bell,COMPLETE
283,4.127671491005458e-05,2025-07-10 23:50:08.732337,2025-07-10 23:51:06.478907,0 days 00:00:57.746570,identity,min,0.0018199314041618835,7,21,bell,COMPLETE
284,7.497515980503522e-06,2025-07-10 23:51:06.479590,2025-07-10 23:52:06.314270,0 days 00:00:59.834680,identity,prod,0.009923345335359596,7,22,bell,COMPLETE
285,0.023518651723861694,2025-07-10 23:52:06.314972,2025-07-10 23:53:04.308007,0 days 00:00:57.993035,relu,min,0.009190824357392902,7,21,bell,COMPLETE
286,0.006192296743392944,2025-07-10 23:53:04.308704,2025-07-10 23:54:03.992981,0 days 00:00:59.684277,identity,prod,0.008828019806131111,7,22,bell,COMPLETE
287,4.57400983577827e-06,2025-07-10 23:54:03.993673,2025-07-10 23:55:01.763460,0 days 00:00:57.769787,identity,min,0.009433803550598198,7,21,bell,COMPLETE
288,4.29964211434708e-06,2025-07-10 23:55:01.764145,2025-07-10 23:55:56.756433,0 days 00:00:54.992288,identity,prod,0.008324271773880666,7,21,gaussian,COMPLETE
289,3.5496159398462623e-06,2025-07-10 23:55:56.757115,2025-07-10 23:56:54.209188,0 days 00:00:57.452073,identity,min,0.009827172689491738,7,20,bell,COMPLETE
290,3.850400844385149e-06,2025-07-10 23:56:54.209879,2025-07-10 23:57:51.458533,0 days 00:00:57.248654,identity,prod,0.007471864349292611,6,22,bell,COMPLETE
291,5.478749244502978e-06,2025-07-10 23:57:51.459213,2025-07-10 23:58:45.388019,0 days 00:00:53.928806,identity,min,0.008101050449078186,5,23,bell,COMPLETE
292,4.311161319492385e-06,2025-07-10 23:58:45.388707,2025-07-10 23:59:44.779133,0 days 00:00:59.390426,identity,prod,0.0035605084658201186,7,21,bell,COMPLETE
293,9.223513188771904e-06,2025-07-10 23:59:44.779819,2025-07-11 00:00:42.838258,0 days 00:00:58.058439,identity,min,0.005042584960970466,7,22,bell,COMPLETE
294,0.0022344961762428284,2025-07-11 00:00:42.838949,2025-07-11 00:01:41.931160,0 days 00:00:59.092211,identity,prod,0.0022784023090635535,7,20,bell,COMPLETE
295,4.184084900771268e-06,2025-07-11 00:01:41.931861,2025-07-11 00:02:39.674807,0 days 00:00:57.742946,identity,min,0.006958183295964373,7,21,bell,COMPLETE
296,1.5419176634168252e-05,2025-07-11 00:02:39.675511,2025-07-11 00:03:31.482592,0 days 00:00:51.807081,identity,prod,0.008796573345262753,6,22,sigmoid,COMPLETE
297,3.5125074191455496e-06,2025-07-11 00:03:31.483207,2025-07-11 00:04:27.591961,0 days 00:00:56.108754,identity,min,0.006626187599471962,6,23,bell,COMPLETE
298,3.5481305076245917e-06,2025-07-11 00:04:27.592662,2025-07-11 00:05:25.926058,0 days 00:00:58.333396,identity,min,0.005636089508659733,7,23,bell,COMPLETE
299,5.814912128698779e-06,2025-07-11 00:05:25.926758,2025-07-11 00:06:26.267736,0 days 00:01:00.340978,identity,prod,0.006272855773957509,7,24,bell,COMPLETE
300,3.6708838706545066e-06,2025-07-11 00:06:26.268437,2025-07-11 00:07:22.362651,0 days 00:00:56.094214,identity,min,0.0066069890298384795,6,23,bell,COMPLETE
301,3.448781399129075e-06,2025-07-11 00:07:22.363351,2025-07-11 00:08:23.093366,0 days 00:01:00.730015,identity,prod,0.007220990144571564,7,25,bell,COMPLETE
302,3.7747263377241325e-06,2025-07-11 00:08:23.094071,2025-07-11 00:09:21.443748,0 days 00:00:58.349677,identity,min,0.0054364435483658284,7,23,bell,COMPLETE
303,4.797196197614539e-06,2025-07-11 00:09:21.444446,2025-07-11 00:10:22.214420,0 days 00:01:00.769974,identity,prod,0.006030910948362319,7,25,bell,COMPLETE
304,4.88516934638028e-06,2025-07-11 00:10:22.215117,2025-07-11 00:11:18.735219,0 days 00:00:56.520102,relu,min,0.0070768997148157875,6,23,bell,COMPLETE
305,3.7368477023846935e-06,2025-07-11 00:11:18.735913,2025-07-11 00:12:19.136377,0 days 00:01:00.400464,identity,prod,0.006391299060779232,7,24,bell,COMPLETE
306,0.1026320680975914,2025-07-11 00:12:19.137081,2025-07-11 00:13:17.653225,0 days 00:00:58.516144,identity,min,0.004970739083737249,7,24,bell,COMPLETE
307,0.04128092899918556,2025-07-11 00:13:17.653922,2025-07-11 00:14:17.007642,0 days 00:00:59.353720,identity,prod,0.007119524314148017,7,21,bell,COMPLETE
308,4.355506462161429e-06,2025-07-11 00:14:17.008336,2025-07-11 00:15:10.966397,0 days 00:00:53.958061,identity,min,0.005799138007747336,6,16,bell,COMPLETE
309,3.574154561647447e-06,2025-07-11 00:15:10.967110,2025-07-11 00:16:10.127445,0 days 00:00:59.160335,identity,prod,0.006625214287606791,7,20,bell,COMPLETE
310,0.0011642473982647061,2025-07-11 00:16:10.128141,2025-07-11 00:17:02.346738,0 days 00:00:52.218597,identity,min,0.0010806464768637928,6,25,gaussian,COMPLETE
311,3.4760030303004896e-06,2025-07-11 00:17:02.347452,2025-07-11 00:18:01.809281,0 days 00:00:59.461829,identity,prod,0.006956017859852706,7,21,bell,COMPLETE
312,3.953379746235441e-06,2025-07-11 00:18:01.809982,2025-07-11 00:19:01.289834,0 days 00:00:59.479852,identity,prod,0.007752533018216145,7,21,bell,COMPLETE
313,8.57571740198182e-06,2025-07-11 00:19:01.290535,2025-07-11 00:20:00.468357,0 days 00:00:59.177822,identity,prod,0.007279873132320305,7,20,bell,COMPLETE
314,0.021784132346510887,2025-07-11 00:20:00.469048,2025-07-11 00:20:59.954755,0 days 00:00:59.485707,identity,prod,0.0001791204590755117,7,21,bell,COMPLETE
315,0.008084569126367569,2025-07-11 00:20:59.955464,2025-07-11 00:21:57.196784,0 days 00:00:57.241320,identity,prod,0.007920597779270832,6,22,bell,COMPLETE
316,3.6242063288227655e-06,2025-07-11 00:21:57.197477,2025-07-11 00:22:57.030259,0 days 00:00:59.832782,identity,prod,0.006833818223553272,7,22,bell,COMPLETE
317,7.283581362571567e-05,2025-07-11 00:22:57.030914,2025-07-11 00:23:56.500024,0 days 00:00:59.469110,identity,prod,0.0005741092746669772,7,21,bell,COMPLETE
318,0.00017234862025361508,2025-07-11 00:23:56.500725,2025-07-11 00:24:48.102060,0 days 00:00:51.601335,identity,prod,0.006456793051052562,6,21,sigmoid,COMPLETE
319,3.7663050989067415e-06,2025-07-11 00:24:48.102760,2025-07-11 00:25:47.365629,0 days 00:00:59.262869,identity,prod,0.00723525086562977,7,20,bell,COMPLETE
320,3.7643294490408152e-06,2025-07-11 00:25:47.366335,2025-07-11 00:26:47.476631,0 days 00:01:00.110296,identity,prod,0.007797768342924986,7,23,bell,COMPLETE
321,4.1663424781290814e-06,2025-07-11 00:26:47.477325,2025-07-11 00:27:46.069136,0 days 00:00:58.591811,identity,prod,0.008599410298114209,7,18,bell,COMPLETE
322,0.0018812825437635183,2025-07-11 00:27:46.069826,2025-07-11 00:28:43.414368,0 days 00:00:57.344542,identity,prod,0.0013519703810897824,6,22,bell,COMPLETE
323,1.3157320022583008,2025-07-11 00:28:43.415071,2025-07-11 00:29:43.179420,0 days 00:00:59.764349,relu,prod,0.006066505975733161,7,21,bell,COMPLETE
324,0.00019766973855439574,2025-07-11 00:29:43.180122,2025-07-11 00:30:43.189127,0 days 00:01:00.009005,identity,prod,0.0004733007187574433,7,23,bell,COMPLETE
325,0.2918798327445984,2025-07-11 00:30:43.189841,2025-07-11 00:31:40.439763,0 days 00:00:57.249922,identity,min,0.007020700507007663,7,20,bell,COMPLETE
326,0.000666616135276854,2025-07-11 00:31:40.440470,2025-07-11 00:32:37.668768,0 days 00:00:57.228298,identity,prod,0.0030214400334605917,6,22,bell,COMPLETE
327,3.6953899780201027e-06,2025-07-11 00:32:37.669461,2025-07-11 00:33:35.332109,0 days 00:00:57.662648,identity,min,0.009997906442485353,7,21,bell,COMPLETE
328,5.58024021302117e-06,2025-07-11 00:33:35.332809,2025-07-11 00:34:32.552856,0 days 00:00:57.220047,identity,prod,0.008179074186957543,6,22,bell,COMPLETE
329,5.9691637943615206e-06,2025-07-11 00:34:32.553485,2025-07-11 00:35:31.532514,0 days 00:00:58.979029,identity,min,0.006421773706103095,7,25,bell,COMPLETE
330,7.589994493173435e-05,2025-07-11 00:35:31.533214,2025-07-11 00:36:31.212461,0 days 00:00:59.679247,identity,prod,0.005507699565629629,8,23,bell,COMPLETE
331,0.10466167330741882,2025-07-11 00:36:31.213160,2025-07-11 00:37:28.701524,0 days 00:00:57.488364,identity,min,0.007581122419955948,7,21,bell,COMPLETE
332,3.611251941038063e-06,2025-07-11 00:37:28.702220,2025-07-11 00:38:26.080993,0 days 00:00:57.378773,identity,prod,0.009015712273459407,7,15,bell,COMPLETE
333,4.082027771801222e-06,2025-07-11 00:38:26.081696,2025-07-11 00:39:24.051828,0 days 00:00:57.970132,identity,min,0.006580961731495163,7,22,bell,COMPLETE
334,3.674512845464051e-05,2025-07-11 00:39:24.052525,2025-07-11 00:40:16.797591,0 days 00:00:52.745066,identity,prod,0.004303806709402722,6,21,gaussian,COMPLETE
335,0.016754169017076492,2025-07-11 00:40:16.798281,2025-07-11 00:41:14.226601,0 days 00:00:57.428320,identity,min,0.000866903669000714,7,20,bell,COMPLETE
336,3.5984187434223713e-06,2025-07-11 00:41:14.227307,2025-07-11 00:42:13.069988,0 days 00:00:58.842681,identity,prod,0.007272587778566958,7,19,bell,COMPLETE
337,4.812829502043314e-06,2025-07-11 00:42:13.070693,2025-07-11 00:43:09.681109,0 days 00:00:56.610416,identity,min,0.005282101120496139,6,25,bell,COMPLETE
338,5.523886557057267e-06,2025-07-11 00:43:09.681816,2025-07-11 00:44:09.394543,0 days 00:00:59.712727,identity,prod,0.008270471492863734,7,22,bell,COMPLETE
339,0.19315730035305023,2025-07-11 00:44:09.395266,2025-07-11 00:45:07.354973,0 days 00:00:57.959707,identity,min,0.00011848858230958785,7,22,bell,COMPLETE
340,4.008823907497572e-06,2025-07-11 00:45:07.355700,2025-07-11 00:46:07.497359,0 days 00:01:00.141659,identity,prod,0.006021208724882471,7,23,bell,COMPLETE
341,0.0032294916454702616,2025-07-11 00:46:07.498074,2025-07-11 00:46:57.416408,0 days 00:00:49.918334,identity,min,0.004640454869319661,6,21,sigmoid,COMPLETE
342,3.5807856875180732e-06,2025-07-11 00:46:57.417112,2025-07-11 00:47:58.026217,0 days 00:01:00.609105,identity,prod,0.006848133021892991,7,25,bell,COMPLETE
343,9.158488865068648e-06,2025-07-11 00:47:58.026933,2025-07-11 00:48:57.024908,0 days 00:00:58.997975,relu,min,0.0077005541804226,7,24,bell,COMPLETE
344,0.22164390981197357,2025-07-11 00:48:57.025617,2025-07-11 00:49:52.761184,0 days 00:00:55.735567,identity,prod,0.000266491682965288,6,17,bell,COMPLETE
345,3.896424914273666e-06,2025-07-11 00:49:52.761895,2025-07-11 00:50:51.065181,0 days 00:00:58.303286,identity,min,0.008886693246557173,7,23,bell,COMPLETE
346,3.699427452374948e-06,2025-07-11 00:50:51.065896,2025-07-11 00:51:45.410922,0 days 00:00:54.345026,identity,prod,0.006432308422243952,5,20,bell,COMPLETE
347,3.6941021335223923e-06,2025-07-11 00:51:45.411616,2025-07-11 00:52:43.081068,0 days 00:00:57.669452,identity,min,0.0059389805841743,7,21,bell,COMPLETE
348,3.661800519694225e-06,2025-07-11 00:52:43.081769,2025-07-11 00:53:42.868607,0 days 00:00:59.786838,identity,prod,0.007325423343202884,7,22,bell,COMPLETE
349,0.2405126839876175,2025-07-11 00:53:42.869318,2025-07-11 00:54:38.300531,0 days 00:00:55.431213,identity,min,0.0006887458285505395,6,21,bell,COMPLETE
350,1.3855815268470906e-05,2025-07-11 00:54:38.301228,2025-07-11 00:55:38.435883,0 days 00:01:00.134655,identity,prod,0.008198773532894858,8,24,bell,COMPLETE
351,5.798655365651939e-06,2025-07-11 00:55:38.436590,2025-07-11 00:56:36.543234,0 days 00:00:58.106644,identity,min,0.004983279584794989,7,22,bell,COMPLETE
352,4.529517354967538e-06,2025-07-11 00:56:36.543937,2025-07-11 00:57:35.987134,0 days 00:00:59.443197,identity,prod,0.006685195260854277,7,21,bell,COMPLETE
353,0.12397202849388123,2025-07-11 00:57:35.987851,2025-07-11 00:58:34.874424,0 days 00:00:58.886573,identity,min,0.0038955242854973858,7,25,bell,COMPLETE
354,4.732921297545545e-06,2025-07-11 00:58:34.875119,2025-07-11 00:59:32.507876,0 days 00:00:57.632757,identity,prod,0.005545029808807925,6,23,bell,COMPLETE
355,3.576196377252927e-06,2025-07-11 00:59:32.508607,2025-07-11 01:00:25.889848,0 days 00:00:53.381241,identity,min,0.00918023213185484,7,20,gaussian,COMPLETE
356,3.576016297301976e-06,2025-07-11 01:00:25.890570,2025-07-11 01:01:25.686430,0 days 00:00:59.795860,identity,prod,0.007449344646450706,7,22,bell,COMPLETE
357,3.670419800982927e-06,2025-07-11 01:01:25.687160,2025-07-11 01:02:22.023766,0 days 00:00:56.336606,identity,min,0.009927321899421627,6,24,bell,COMPLETE
358,5.7983370425063185e-06,2025-07-11 01:02:22.024480,2025-07-11 01:03:20.877651,0 days 00:00:58.853171,identity,prod,0.008310978852754272,7,19,bell,COMPLETE
359,4.108855500817299e-05,2025-07-11 01:03:20.878371,2025-07-11 01:04:19.839911,0 days 00:00:58.961540,identity,min,0.006099263195970754,7,25,bell,COMPLETE
360,4.6268578444141895e-06,2025-07-11 01:04:19.840623,2025-07-11 01:05:16.718363,0 days 00:00:56.877740,identity,prod,0.0069689498721646845,6,21,bell,COMPLETE
361,0.13028234243392944,2025-07-11 01:05:16.719079,2025-07-11 01:06:14.878174,0 days 00:00:58.159095,identity,min,0.007895694998501627,7,23,bell,COMPLETE
362,4.215789431327721e-06,2025-07-11 01:06:14.878905,2025-07-11 01:07:14.636665,0 days 00:00:59.757760,identity,prod,0.0066229960790829285,7,22,bell,COMPLETE
363,0.001989881508052349,2025-07-11 01:07:14.637388,2025-07-11 01:08:07.588334,0 days 00:00:52.950946,relu,min,0.005248528397774866,7,23,sigmoid,COMPLETE
364,0.00010930780263151973,2025-07-11 01:08:07.589049,2025-07-11 01:09:04.502005,0 days 00:00:56.912956,identity,prod,0.002532763705847364,6,21,bell,COMPLETE
365,4.215993158140918e-06,2025-07-11 01:09:04.502723,2025-07-11 01:10:05.210690,0 days 00:01:00.707967,identity,prod,0.008922297568634163,7,25,bell,COMPLETE
366,2.242576374555938e-05,2025-07-11 01:10:05.211420,2025-07-11 01:11:03.910168,0 days 00:00:58.698748,identity,min,0.007319288361858029,7,24,bell,COMPLETE
367,0.07074221968650818,2025-07-11 01:11:03.910903,2025-07-11 01:12:03.579087,0 days 00:00:59.668184,identity,prod,0.005855759060733153,7,22,bell,COMPLETE
368,4.459921910893172e-06,2025-07-11 01:12:03.579820,2025-07-11 01:12:58.866817,0 days 00:00:55.286997,identity,min,0.006405173021169937,6,20,bell,COMPLETE
369,4.902653472527163e-06,2025-07-11 01:12:58.867531,2025-07-11 01:13:58.304573,0 days 00:00:59.437042,identity,prod,0.00831882303747471,7,21,bell,COMPLETE
370,3.8100631627457915e-06,2025-07-11 01:13:58.305296,2025-07-11 01:14:59.093740,0 days 00:01:00.788444,identity,min,0.00720062389019178,9,24,bell,COMPLETE
371,3.588714889701805e-06,2025-07-11 01:14:59.094463,2025-07-11 01:15:59.019790,0 days 00:00:59.925327,identity,prod,0.007761612731139336,7,22,bell,COMPLETE
372,2.844876507879235e-05,2025-07-11 01:15:59.020514,2025-07-11 01:16:54.619062,0 days 00:00:55.598548,identity,min,0.0056745887603049825,6,21,bell,COMPLETE
373,4.1365387914993335e-06,2025-07-11 01:16:54.619789,2025-07-11 01:17:54.786182,0 days 00:01:00.166393,identity,prod,0.004793803605719686,7,23,bell,COMPLETE
374,9.618687727197539e-06,2025-07-11 01:17:54.786920,2025-07-11 01:18:52.196515,0 days 00:00:57.409595,identity,min,0.006693119808617458,7,20,bell,COMPLETE
375,3.585065542210941e-06,2025-07-11 01:18:52.197247,2025-07-11 01:19:50.214976,0 days 00:00:58.017729,identity,prod,0.009106876620868886,6,25,bell,COMPLETE
376,3.7255640563671477e-06,2025-07-11 01:19:50.215698,2025-07-11 01:20:48.241551,0 days 00:00:58.025853,identity,min,0.006163911825298165,7,22,bell,COMPLETE
377,3.57398425876454e-06,2025-07-11 01:20:48.242289,2025-07-11 01:21:47.620612,0 days 00:00:59.378323,identity,prod,0.007626793715019098,7,21,bell,COMPLETE
378,0.006150795612484217,2025-07-11 01:21:47.621340,2025-07-11 01:22:41.505695,0 days 00:00:53.884355,identity,min,0.008358370585452744,7,22,gaussian,COMPLETE
379,0.00018662989896256477,2025-07-11 01:22:41.506416,2025-07-11 01:23:39.146367,0 days 00:00:57.639951,identity,prod,0.007014365470545627,6,24,bell,COMPLETE
380,4.128998170926934e-06,2025-07-11 01:23:39.147095,2025-07-11 01:24:37.478164,0 days 00:00:58.331069,identity,min,0.009954503010167988,7,23,bell,COMPLETE
381,1.1680893898010254,2025-07-11 01:24:37.478889,2025-07-11 01:25:37.247281,0 days 00:00:59.768392,relu,prod,0.00530366224608618,7,21,bell,COMPLETE
382,3.5097839372610906e-06,2025-07-11 01:25:37.247997,2025-07-11 01:26:35.909886,0 days 00:00:58.661889,identity,min,0.0062220752097446,7,24,bell,COMPLETE
383,0.022833187133073807,2025-07-11 01:26:35.910608,2025-07-11 01:27:36.301663,0 days 00:01:00.391055,identity,prod,0.006001963943145771,7,24,bell,COMPLETE
384,3.9969490899238735e-06,2025-07-11 01:27:36.302397,2025-07-11 01:28:32.683640,0 days 00:00:56.381243,identity,min,0.004447176415238098,6,24,bell,COMPLETE
385,3.4827046420105034e-06,2025-07-11 01:28:32.684275,2025-07-11 01:29:33.367913,0 days 00:01:00.683638,identity,prod,0.005504999152557755,7,25,bell,COMPLETE
386,3.4621184568095487e-06,2025-07-11 01:29:33.368638,2025-07-11 01:30:32.433840,0 days 00:00:59.065202,identity,min,0.0050517477936790735,7,25,bell,COMPLETE
387,2.108546505041886e-05,2025-07-11 01:30:32.434569,2025-07-11 01:31:33.097939,0 days 00:01:00.663370,identity,prod,0.004877063771426684,7,25,bell,COMPLETE
388,0.01022630836814642,2025-07-11 01:31:33.098668,2025-07-11 01:32:26.177956,0 days 00:00:53.079288,identity,min,0.004126287840135798,7,25,sigmoid,COMPLETE
389,3.897502210747916e-06,2025-07-11 01:32:26.178666,2025-07-11 01:33:26.941654,0 days 00:01:00.762988,identity,prod,0.0051921397455263335,7,25,bell,COMPLETE
390,0.00017475041386205703,2025-07-11 01:33:26.942387,2025-07-11 01:34:25.973043,0 days 00:00:59.030656,identity,min,0.004758641048476996,7,25,bell,COMPLETE
391,0.00023725310165900737,2025-07-11 01:34:25.973771,2025-07-11 01:35:26.664458,0 days 00:01:00.690687,identity,prod,0.005580717585444217,7,25,bell,COMPLETE
392,3.6386163628776558e-06,2025-07-11 01:35:26.665173,2025-07-11 01:36:25.459421,0 days 00:00:58.794248,identity,min,0.0052445559784132095,7,24,bell,COMPLETE
393,6.237755314941751e-06,2025-07-11 01:36:25.460151,2025-07-11 01:37:22.135530,0 days 00:00:56.675379,identity,prod,0.00445900320270593,7,13,bell,COMPLETE
394,5.5064056141418405e-06,2025-07-11 01:37:22.136247,2025-07-11 01:38:21.178019,0 days 00:00:59.041772,identity,min,0.005664886374180488,7,25,bell,COMPLETE
395,3.5237756037531653e-06,2025-07-11 01:38:21.178754,2025-07-11 01:39:21.948171,0 days 00:01:00.769417,identity,prod,0.006175819196163319,7,25,bell,COMPLETE
396,4.2986498556274455e-06,2025-07-11 01:39:21.948903,2025-07-11 01:40:22.656613,0 days 00:01:00.707710,identity,prod,0.004924131787824882,7,25,bell,COMPLETE
397,3.585982085496653e-06,2025-07-11 01:40:22.657668,2025-07-11 01:41:23.388670,0 days 00:01:00.731002,identity,prod,0.006009375392511769,7,25,bell,COMPLETE
398,3.41576014761813e-06,2025-07-11 01:41:23.389405,2025-07-11 01:42:24.067826,0 days 00:01:00.678421,identity,prod,0.005602601053577209,7,25,bell,COMPLETE
399,4.27599343311158e-06,2025-07-11 01:42:24.068574,2025-07-11 01:43:24.790791,0 days 00:01:00.722217,identity,prod,0.005113278127196442,7,25,bell,COMPLETE
400,3.832592483377084e-06,2025-07-11 01:43:24.791528,2025-07-11 01:44:25.568520,0 days 00:01:00.776992,identity,prod,0.0054776701844849235,7,25,bell,COMPLETE
401,4.278756932762917e-06,2025-07-11 01:44:25.569252,2025-07-11 01:45:20.958289,0 days 00:00:55.389037,identity,prod,0.0057280754401666115,5,24,bell,COMPLETE
402,0.00045147514902055264,2025-07-11 01:45:20.959036,2025-07-11 01:46:17.594247,0 days 00:00:56.635211,relu,prod,0.004462559679356859,7,25,gaussian,COMPLETE
403,5.532573595701251e-06,2025-07-11 01:46:17.594983,2025-07-11 01:47:17.984790,0 days 00:01:00.389807,identity,prod,0.006165624409166883,7,24,bell,COMPLETE
404,7.81973449193174e-06,2025-07-11 01:47:17.985522,2025-07-11 01:48:18.626025,0 days 00:01:00.640503,identity,prod,0.004034909732726772,7,25,bell,COMPLETE
405,3.775005779971252e-06,2025-07-11 01:48:18.627058,2025-07-11 01:49:19.088831,0 days 00:01:00.461773,identity,prod,0.004943960068179447,7,24,bell,COMPLETE
406,8.143168088281527e-06,2025-07-11 01:49:19.089554,2025-07-11 01:50:19.723154,0 days 00:01:00.633600,identity,prod,0.005376801804759628,7,25,bell,COMPLETE
407,0.00035978149389848113,2025-07-11 01:50:19.723888,2025-07-11 01:51:20.346052,0 days 00:01:00.622164,identity,prod,0.006234121114495482,7,25,bell,COMPLETE
408,3.738750137927127e-06,2025-07-11 01:51:20.346785,2025-07-11 01:52:20.735645,0 days 00:01:00.388860,identity,prod,0.005590569204131747,7,24,bell,COMPLETE
409,0.00918903760612011,2025-07-11 01:52:20.736374,2025-07-11 01:53:21.054047,0 days 00:01:00.317673,identity,prod,0.006425252346593723,7,24,bell,COMPLETE
410,0.012500697746872902,2025-07-11 01:53:21.054778,2025-07-11 01:54:15.772589,0 days 00:00:54.717811,identity,prod,0.0035148789512207497,7,25,sigmoid,COMPLETE
411,3.8214079722820316e-06,2025-07-11 01:54:15.773324,2025-07-11 01:55:16.459525,0 days 00:01:00.686201,identity,prod,0.005888066785489668,7,25,bell,COMPLETE
412,4.845100193051621e-06,2025-07-11 01:55:16.460243,2025-07-11 01:56:16.772705,0 days 00:01:00.312462,identity,prod,0.0066000036615853856,7,24,bell,COMPLETE
413,5.403399427450495e-06,2025-07-11 01:56:16.773425,2025-07-11 01:57:17.398028,0 days 00:01:00.624603,identity,prod,0.004491914026854524,7,25,bell,COMPLETE
414,5.585721737588756e-06,2025-07-11 01:57:17.398776,2025-07-11 01:58:15.998984,0 days 00:00:58.600208,identity,min,0.005115750623464272,7,24,bell,COMPLETE
415,0.07083593308925629,2025-07-11 01:58:15.999724,2025-07-11 01:59:16.611531,0 days 00:01:00.611807,identity,prod,0.0003659735997897033,7,25,bell,COMPLETE
416,3.572153445929871e-06,2025-07-11 01:59:16.612252,2025-07-11 02:00:15.312447,0 days 00:00:58.700195,identity,min,0.006151564065300661,7,24,bell,COMPLETE
