number,value,datetime_start,datetime_complete,duration,params_activation,params_batch_size,params_lr,params_num_layers,params_shuffle,params_size_layers,params_weight_decay,state
484,4.993701168132247e-06,2025-07-01 21:56:11.967699,2025-07-01 21:56:15.786431,0 days 00:00:03.818732,identity,32,0.00025496556688117184,1,True,113,2.301702628471643e-05,COMPLETE
485,4.601959972205805e-06,2025-07-01 21:56:15.786819,2025-07-01 21:56:19.562421,0 days 00:00:03.775602,identity,32,0.00020615367199525858,1,False,100,2.4053497265495682e-05,COMPLETE
486,4.25183679908514e-06,2025-07-01 21:56:19.562807,2025-07-01 21:56:23.389462,0 days 00:00:03.826655,identity,32,0.00020114739144735727,1,True,101,2.861103376688257e-05,COMPLETE
487,4.279916083760327e-06,2025-07-01 21:56:23.389853,2025-07-01 21:56:27.229395,0 days 00:00:03.839542,identity,32,0.00021993839567994745,1,True,109,2.2877906297089132e-05,COMPLETE
488,4.543884642771445e-06,2025-07-01 21:56:27.229804,2025-07-01 21:56:31.055554,0 days 00:00:03.825750,identity,32,0.0002667055100369437,1,True,119,2.5235937139483048e-05,COMPLETE
489,0.04238569736480713,2025-07-01 21:56:31.055943,2025-07-01 21:56:35.079748,0 days 00:00:04.023805,sigmoid,32,0.00021144324651264947,1,True,103,2.6381959050468338e-05,COMPLETE
490,7.503765118599404e-06,2025-07-01 21:56:35.080168,2025-07-01 21:56:38.920194,0 days 00:00:03.840026,identity,32,0.00020214613309336697,1,True,107,2.2290541311307625e-05,COMPLETE
491,5.217158104642294e-06,2025-07-01 21:56:38.920607,2025-07-01 21:56:42.742172,0 days 00:00:03.821565,identity,32,0.0002435992921132598,1,True,100,2.6620155369033874e-05,COMPLETE
492,7.406511940644123e-06,2025-07-01 21:56:42.742585,2025-07-01 21:56:46.573211,0 days 00:00:03.830626,identity,32,0.00029658217608105646,1,True,105,2.317008079469651e-05,COMPLETE
493,0.0005048150196671486,2025-07-01 21:56:46.573611,2025-07-01 21:56:50.592727,0 days 00:00:04.019116,relu,32,0.00021557356900920953,1,True,124,2.9498995464033783e-05,COMPLETE
494,1.0325448783987667e-05,2025-07-01 21:56:50.593125,2025-07-01 21:56:54.404795,0 days 00:00:03.811670,identity,32,0.00018757392930315037,1,True,93,2.124286991561781e-05,COMPLETE
495,9.239314749720506e-06,2025-07-01 21:56:54.405191,2025-07-01 21:56:58.217544,0 days 00:00:03.812353,identity,32,0.00023561157476311703,1,True,98,3.05555266594807e-05,COMPLETE
496,1.0619366548780818e-05,2025-07-01 21:56:58.217957,2025-07-01 21:57:02.042216,0 days 00:00:03.824259,identity,32,0.0002323068721814402,1,True,103,2.503072861421271e-05,COMPLETE
497,5.409888672147645e-06,2025-07-01 21:57:02.042615,2025-07-01 21:57:05.857628,0 days 00:00:03.815013,identity,32,0.000271000181179195,1,True,71,2.7830536207157312e-05,COMPLETE
498,4.372041985334363e-06,2025-07-01 21:57:05.858022,2025-07-01 21:57:12.420204,0 days 00:00:06.562182,identity,32,0.00032697150967453165,3,True,69,2.2782986724443485e-05,COMPLETE
499,4.145345428696601e-06,2025-07-01 21:57:12.420640,2025-07-01 21:57:16.215878,0 days 00:00:03.795238,identity,32,0.00019238240193205155,1,True,51,1.9924331366661135e-05,COMPLETE
