number,value,datetime_start,datetime_complete,duration,params_activation,params_and_operator,params_lr,params_n_sets,params_seq_length,params_shape,state
0,0.07411317527294159,2025-07-10 19:17:00.667620,2025-07-10 19:18:17.404667,0 days 00:01:16.737047,relu,min,0.00016352160358979606,9,23,gaussian,COMPLETE
1,0.0005771898431703448,2025-07-10 19:18:17.405621,2025-07-10 19:19:11.289907,0 days 00:00:53.884286,identity,min,0.0021738435614939923,6,12,sigmoid,COMPLETE
2,3.86701185561833e-06,2025-07-10 19:19:11.290463,2025-07-10 19:20:22.579673,0 days 00:01:11.289210,relu,prod,0.008117230240238863,7,22,sigmoid,COMPLETE
3,0.005191087257117033,2025-07-10 19:20:22.580261,2025-07-10 19:21:30.868107,0 days 00:01:08.287846,identity,min,0.0005078293384652212,6,23,sigmoid,COMPLETE
4,0.0011234628036618233,2025-07-10 19:21:30.868659,2025-07-10 19:22:44.748654,0 days 00:01:13.879995,identity,min,0.0024387937379582274,8,21,bell,COMPLETE
5,0.19798758625984192,2025-07-10 19:22:44.749238,2025-07-10 19:23:34.448428,0 days 00:00:49.699190,relu,min,0.00012460850671239205,7,6,sigmoid,COMPLETE
6,0.000182072413736023,2025-07-10 19:23:34.448948,2025-07-10 19:24:38.730508,0 days 00:01:04.281560,identity,prod,0.005914143711325938,7,16,gaussian,COMPLETE
7,0.005572259891778231,2025-07-10 19:24:38.731076,2025-07-10 19:25:37.363143,0 days 00:00:58.632067,identity,min,0.00097319878055893,5,16,gaussian,COMPLETE
8,0.21241189539432526,2025-07-10 19:25:37.363669,2025-07-10 19:26:38.565403,0 days 00:01:01.201734,relu,min,0.0035747466356333044,5,15,bell,COMPLETE
9,0.007696016691625118,2025-07-10 19:26:38.565933,2025-07-10 19:27:44.994874,0 days 00:01:06.428941,relu,prod,0.00012640051099082423,9,15,gaussian,COMPLETE
10,1.1431030543462839e-05,2025-07-10 19:27:44.995397,2025-07-10 19:29:00.904254,0 days 00:01:15.908857,relu,prod,0.00983299359680754,8,25,sigmoid,COMPLETE
11,1.1904799938201904,2025-07-10 19:29:00.904836,2025-07-10 19:30:16.792709,0 days 00:01:15.887873,relu,prod,0.00983033632742205,8,25,sigmoid,COMPLETE
12,1.3161295652389526,2025-07-10 19:30:16.793281,2025-07-10 19:31:26.247101,0 days 00:01:09.453820,relu,prod,0.009967236182361495,8,20,sigmoid,COMPLETE
13,1.3161295652389526,2025-07-10 19:31:26.247683,2025-07-10 19:32:41.334153,0 days 00:01:15.086470,relu,prod,0.004572317822833242,7,25,sigmoid,COMPLETE
14,1.316251516342163,2025-07-10 19:32:41.334734,2025-07-10 19:33:49.636364,0 days 00:01:08.301630,relu,prod,0.001391004292142634,8,19,sigmoid,COMPLETE
15,0.0007829584064893425,2025-07-10 19:33:49.637145,2025-07-10 19:34:42.268138,0 days 00:00:52.630993,relu,prod,0.0003670813832383698,6,8,sigmoid,COMPLETE
16,3.92346646549413e-06,2025-07-10 19:34:42.268712,2025-07-10 19:36:02.910199,0 days 00:01:20.641487,relu,prod,0.0068935282871639605,9,22,bell,COMPLETE
17,0.005908810533583164,2025-07-10 19:36:02.911138,2025-07-10 19:37:17.910136,0 days 00:01:14.998998,relu,prod,0.005445962440642218,9,18,bell,COMPLETE
18,8.126366992655676e-06,2025-07-10 19:37:17.910731,2025-07-10 19:38:18.491158,0 days 00:01:00.580427,relu,prod,0.00269719723804171,6,12,bell,COMPLETE
19,0.001101997564546764,2025-07-10 19:38:18.491727,2025-07-10 19:39:35.520224,0 days 00:01:17.028497,relu,prod,0.001195162053228671,7,22,bell,COMPLETE
20,0.03288021311163902,2025-07-10 19:39:35.521272,2025-07-10 19:40:50.325721,0 days 00:01:14.804449,relu,prod,0.0006655505928384128,9,18,bell,COMPLETE
21,0.04814767464995384,2025-07-10 19:40:50.326306,2025-07-10 19:41:50.878014,0 days 00:01:00.551708,relu,prod,0.0029414515004105774,6,12,bell,COMPLETE
22,5.921149295318173e-06,2025-07-10 19:41:50.878595,2025-07-10 19:42:53.296124,0 days 00:01:02.417529,relu,prod,0.006351102492267938,7,10,bell,COMPLETE
23,1.1086777703894768e-05,2025-07-10 19:42:53.296701,2025-07-10 19:43:55.565969,0 days 00:01:02.269268,relu,prod,0.006367340511033116,7,10,bell,COMPLETE
24,0.4660096764564514,2025-07-10 19:43:55.566553,2025-07-10 19:44:50.294585,0 days 00:00:54.728032,relu,prod,0.003960426947053246,7,5,bell,COMPLETE
25,0.023455195128917694,2025-07-10 19:44:50.295163,2025-07-10 19:45:52.390306,0 days 00:01:02.095143,relu,prod,0.00159085891663539,8,9,bell,COMPLETE
26,3.669020316010574e-06,2025-07-10 19:45:52.390892,2025-07-10 19:46:57.805387,0 days 00:01:05.414495,identity,prod,0.007415149861207169,7,14,bell,COMPLETE
27,4.092446943104733e-06,2025-07-10 19:46:57.806261,2025-07-10 19:48:07.237607,0 days 00:01:09.431346,identity,prod,0.00739572469959416,7,17,bell,COMPLETE
28,0.0062317331321537495,2025-07-10 19:48:07.238186,2025-07-10 19:49:17.265574,0 days 00:01:10.027388,identity,prod,0.004155014150027768,8,20,gaussian,COMPLETE
29,0.32061004638671875,2025-07-10 19:49:17.266136,2025-07-10 19:50:24.529730,0 days 00:01:07.263594,identity,prod,0.0002879485285950895,9,13,bell,COMPLETE
30,4.7628423089918215e-06,2025-07-10 19:50:24.530316,2025-07-10 19:51:34.421337,0 days 00:01:09.891021,identity,prod,0.007599138533073144,6,22,gaussian,COMPLETE
31,0.005889974534511566,2025-07-10 19:51:34.421921,2025-07-10 19:52:43.842397,0 days 00:01:09.420476,identity,prod,0.007261668332949526,7,17,bell,COMPLETE
32,3.787270179600455e-05,2025-07-10 19:52:43.842980,2025-07-10 19:53:49.188063,0 days 00:01:05.345083,identity,prod,0.001963903144648994,7,14,bell,COMPLETE
33,3.877332801494049e-06,2025-07-10 19:53:49.188655,2025-07-10 19:55:06.888075,0 days 00:01:17.699420,identity,prod,0.004972529684006765,7,23,bell,COMPLETE
34,3.6137346342002274e-06,2025-07-10 19:55:06.888662,2025-07-10 19:56:20.727989,0 days 00:01:13.839327,identity,min,0.004877144204230111,6,23,bell,COMPLETE
35,2.623443833726924e-05,2025-07-10 19:56:20.728576,2025-07-10 19:57:28.580046,0 days 00:01:07.851470,identity,min,0.0033427796449924637,5,24,sigmoid,COMPLETE
36,0.018442422151565552,2025-07-10 19:57:28.580637,2025-07-10 19:58:42.300543,0 days 00:01:13.719906,identity,min,0.00489186605923538,6,23,bell,COMPLETE
37,0.00046244621626101434,2025-07-10 19:58:42.301131,2025-07-10 19:59:47.885545,0 days 00:01:05.584414,identity,min,0.0017544998595739518,6,21,sigmoid,COMPLETE
38,0.0002557711850386113,2025-07-10 19:59:47.886125,2025-07-10 20:01:01.547346,0 days 00:01:13.661221,identity,min,0.0027011444873634343,6,23,bell,COMPLETE
39,0.0006547055672854185,2025-07-10 20:01:01.547927,2025-07-10 20:02:10.457257,0 days 00:01:08.909330,identity,min,0.00089933127338018,5,24,gaussian,COMPLETE
40,0.00496105570346117,2025-07-10 20:02:10.457846,2025-07-10 20:03:22.509808,0 days 00:01:12.051962,identity,min,0.002285979984116359,7,20,bell,COMPLETE
41,3.6978901789552765e-06,2025-07-10 20:03:22.510407,2025-07-10 20:04:38.007510,0 days 00:01:15.497103,identity,min,0.007878331672982786,8,22,bell,COMPLETE
42,4.7528928917017765e-06,2025-07-10 20:04:38.008119,2025-07-10 20:05:51.918109,0 days 00:01:13.909990,identity,min,0.008270045262610038,8,21,bell,COMPLETE
43,4.715574959845981e-06,2025-07-10 20:05:51.918708,2025-07-10 20:07:09.987937,0 days 00:01:18.069229,identity,min,0.005310298761725092,8,24,bell,COMPLETE
44,0.00011353408626746386,2025-07-10 20:07:09.988534,2025-07-10 20:08:19.093130,0 days 00:01:09.104596,identity,min,0.00867241792277018,7,22,sigmoid,COMPLETE
45,0.010267977602779865,2025-07-10 20:08:19.093718,2025-07-10 20:09:27.412058,0 days 00:01:08.318340,identity,min,0.0033962924228918548,6,19,bell,COMPLETE
46,0.12914711236953735,2025-07-10 20:09:27.412648,2025-07-10 20:10:25.975611,0 days 00:00:58.562963,identity,min,0.004746891069526814,7,14,sigmoid,COMPLETE
47,0.010835755616426468,2025-07-10 20:10:25.976195,2025-07-10 20:11:44.091504,0 days 00:01:18.115309,identity,min,0.006044197276061493,8,24,bell,COMPLETE
48,5.689736553904368e-06,2025-07-10 20:11:44.092443,2025-07-10 20:12:58.727221,0 days 00:01:14.634778,identity,min,0.009586915604252188,7,25,gaussian,COMPLETE
49,0.06324393302202225,2025-07-10 20:12:58.727809,2025-07-10 20:14:02.535221,0 days 00:01:03.807412,identity,min,0.0002060247056888281,5,21,sigmoid,COMPLETE
50,0.005826420616358519,2025-07-10 20:14:02.535802,2025-07-10 20:15:21.282422,0 days 00:01:18.746620,identity,prod,0.0039988976684066126,8,23,bell,COMPLETE
51,0.002895361976698041,2025-07-10 20:15:21.283009,2025-07-10 20:16:41.958556,0 days 00:01:20.675547,relu,prod,0.006383833487869659,9,22,bell,COMPLETE
52,0.0010389316594228148,2025-07-10 20:16:41.959166,2025-07-10 20:18:00.741614,0 days 00:01:18.782448,identity,prod,0.007800778136648314,9,21,bell,COMPLETE
53,5.684671123162843e-05,2025-07-10 20:18:00.742210,2025-07-10 20:19:23.231350,0 days 00:01:22.489140,relu,prod,0.005101304799896423,9,23,bell,COMPLETE
54,3.6514789826469496e-05,2025-07-10 20:19:23.231941,2025-07-10 20:20:36.772460,0 days 00:01:13.540519,relu,prod,0.006253926727990708,8,19,bell,COMPLETE
55,3.876670234603807e-06,2025-07-10 20:20:36.773058,2025-07-10 20:21:44.762377,0 days 00:01:07.989319,identity,prod,0.009914978316470546,7,16,bell,COMPLETE
56,0.000133120731334202,2025-07-10 20:21:44.762969,2025-07-10 20:22:46.280273,0 days 00:01:01.517304,identity,prod,0.008718713936260333,7,15,sigmoid,COMPLETE
57,3.670571686598123e-06,2025-07-10 20:22:46.280848,2025-07-10 20:23:54.238739,0 days 00:01:07.957891,identity,prod,0.009569408593909763,7,16,bell,COMPLETE
58,3.4592892461660085e-06,2025-07-10 20:23:54.239644,2025-07-10 20:24:59.970307,0 days 00:01:05.730663,identity,prod,0.009987612648650473,6,16,bell,COMPLETE
59,4.9422324082115665e-06,2025-07-10 20:24:59.970889,2025-07-10 20:26:01.427430,0 days 00:01:01.456541,identity,min,0.008290664684244156,6,14,bell,COMPLETE
60,3.8300313462968916e-05,2025-07-10 20:26:01.428025,2025-07-10 20:27:03.435086,0 days 00:01:02.007061,identity,prod,0.0057516659111489015,6,17,sigmoid,COMPLETE
61,4.277680545783369e-06,2025-07-10 20:27:03.435939,2025-07-10 20:28:11.474341,0 days 00:01:08.038402,identity,prod,0.008960303185375901,7,16,bell,COMPLETE
62,4.4103262553107925e-06,2025-07-10 20:28:11.474935,2025-07-10 20:29:19.510741,0 days 00:01:08.035806,identity,prod,0.009797572301585247,7,16,bell,COMPLETE
63,3.856433067994658e-06,2025-07-10 20:29:19.511325,2025-07-10 20:30:21.015098,0 days 00:01:01.503773,identity,prod,0.0073577274998498,6,13,bell,COMPLETE
64,3.7102147416590014e-06,2025-07-10 20:30:21.015669,2025-07-10 20:31:22.105892,0 days 00:01:01.090223,identity,prod,0.0071829478801327005,6,11,bell,COMPLETE
65,0.050123315304517746,2025-07-10 20:31:22.106468,2025-07-10 20:32:23.344755,0 days 00:01:01.238287,identity,prod,0.0070438187918233095,6,11,bell,COMPLETE
66,0.00011190035002073273,2025-07-10 20:32:23.345345,2025-07-10 20:33:24.886215,0 days 00:01:01.540870,identity,prod,0.00427129810595354,6,13,bell,COMPLETE
67,5.140620942256646e-06,2025-07-10 20:33:24.886803,2025-07-10 20:34:23.930619,0 days 00:00:59.043816,identity,prod,0.007032725199531325,5,11,bell,COMPLETE
68,0.42652320861816406,2025-07-10 20:34:23.931204,2025-07-10 20:35:25.521475,0 days 00:01:01.590271,identity,prod,0.005673361016054244,6,13,bell,COMPLETE
69,3.786676188610727e-06,2025-07-10 20:35:25.522057,2025-07-10 20:36:21.000029,0 days 00:00:55.477972,identity,prod,0.007774204001113926,6,7,bell,COMPLETE
70,4.237357188685564e-06,2025-07-10 20:36:21.000603,2025-07-10 20:37:16.000933,0 days 00:00:55.000330,identity,prod,0.0036849929971333835,5,8,bell,COMPLETE
71,6.28761245025089e-06,2025-07-10 20:37:16.001512,2025-07-10 20:38:09.965279,0 days 00:00:53.963767,identity,prod,0.0077466766212275365,6,6,bell,COMPLETE
72,0.010595458559691906,2025-07-10 20:38:09.965869,2025-07-10 20:39:03.826810,0 days 00:00:53.860941,identity,prod,0.00010152468378565594,6,6,bell,COMPLETE
73,4.027630893688183e-06,2025-07-10 20:39:03.827400,2025-07-10 20:40:00.670500,0 days 00:00:56.843100,identity,prod,0.0071118987387840185,6,8,bell,COMPLETE
74,0.007315055467188358,2025-07-10 20:40:00.671092,2025-07-10 20:41:05.546014,0 days 00:01:04.874922,identity,prod,0.0064802657504418465,6,15,bell,COMPLETE
75,5.850925845152233e-06,2025-07-10 20:41:05.546627,2025-07-10 20:42:02.902598,0 days 00:00:57.355971,identity,prod,0.00839754926417282,6,11,gaussian,COMPLETE
76,0.0008155584800988436,2025-07-10 20:42:02.903195,2025-07-10 20:43:03.047402,0 days 00:01:00.144207,identity,prod,0.000531711578784689,6,12,bell,COMPLETE
77,0.0002391583111602813,2025-07-10 20:43:03.048015,2025-07-10 20:43:56.785728,0 days 00:00:53.737713,identity,min,0.005474063866111697,6,7,bell,COMPLETE
78,4.141228146181675e-06,2025-07-10 20:43:56.786313,2025-07-10 20:44:54.536851,0 days 00:00:57.750538,identity,prod,0.009981757501773278,5,10,bell,COMPLETE
79,4.718550826510182e-06,2025-07-10 20:44:54.537440,2025-07-10 20:45:58.975169,0 days 00:01:04.437729,identity,prod,0.007662828318081467,6,15,bell,COMPLETE
80,4.233495928929187e-06,2025-07-10 20:45:58.975763,2025-07-10 20:47:00.395276,0 days 00:01:01.419513,identity,min,0.0046445646421015355,6,14,bell,COMPLETE
81,1.5173486644926015e-05,2025-07-10 20:47:00.405214,2025-07-10 20:47:50.669427,0 days 00:00:50.264213,relu,prod,0.008623572880451484,7,5,sigmoid,COMPLETE
82,3.7940844777040184e-06,2025-07-10 20:47:50.670009,2025-07-10 20:49:01.455594,0 days 00:01:10.785585,identity,prod,0.006691111668849661,7,18,bell,COMPLETE
83,0.0010627255542203784,2025-07-10 20:49:01.456194,2025-07-10 20:50:05.145443,0 days 00:01:03.689249,identity,prod,0.006848049356981356,7,13,bell,COMPLETE
84,5.4646984608552884e-06,2025-07-10 20:50:05.146044,2025-07-10 20:51:16.123540,0 days 00:01:10.977496,identity,prod,0.005881618979065905,7,18,bell,COMPLETE
85,3.872407432936598e-06,2025-07-10 20:51:16.230085,2025-07-10 20:52:23.443741,0 days 00:01:07.213656,identity,prod,0.009018119830462835,6,17,bell,COMPLETE
86,1.5258284292940516e-05,2025-07-10 20:52:23.444359,2025-07-10 20:53:32.026741,0 days 00:01:08.582382,identity,prod,0.003055749468879057,6,18,bell,COMPLETE
87,0.00044487908598966897,2025-07-10 20:53:32.027343,2025-07-10 20:54:31.877498,0 days 00:00:59.850155,identity,min,0.004372746400683034,7,14,gaussian,COMPLETE
88,3.69261329069559e-06,2025-07-10 20:54:31.878092,2025-07-10 20:55:37.722359,0 days 00:01:05.844267,identity,prod,0.007621167535097676,6,16,bell,COMPLETE
89,4.071513558301376e-06,2025-07-10 20:55:37.723255,2025-07-10 20:56:46.148172,0 days 00:01:08.424917,identity,min,0.005317749162422441,8,17,bell,COMPLETE
90,3.4813017464330187e-06,2025-07-10 20:56:46.148787,2025-07-10 20:57:54.139255,0 days 00:01:07.990468,identity,prod,0.006363871671494968,7,16,bell,COMPLETE
91,7.912948058219627e-05,2025-07-10 20:57:54.139861,2025-07-10 20:59:02.142377,0 days 00:01:08.002516,identity,prod,0.00803821724502543,7,16,bell,COMPLETE
92,5.809108188259415e-06,2025-07-10 20:59:02.142973,2025-07-10 21:00:08.788941,0 days 00:01:06.645968,identity,prod,0.006521187092844932,7,15,bell,COMPLETE
93,0.00010360399028286338,2025-07-10 21:00:08.789540,2025-07-10 21:01:15.904221,0 days 00:01:07.114681,identity,prod,0.005961124672696895,6,17,bell,COMPLETE
94,5.5484774748038035e-06,2025-07-10 21:01:15.904820,2025-07-10 21:02:27.685328,0 days 00:01:11.780508,identity,prod,0.008892126831558572,8,18,bell,COMPLETE
95,0.014107683673501015,2025-07-10 21:02:27.685930,2025-07-10 21:03:35.635792,0 days 00:01:07.949862,identity,prod,0.0008475464247759087,7,16,bell,COMPLETE
96,8.146157597366255e-06,2025-07-10 21:03:35.636375,2025-07-10 21:04:45.412985,0 days 00:01:09.776610,identity,prod,0.004957192642318333,6,19,bell,COMPLETE
97,3.4756926652335096e-06,2025-07-10 21:04:45.413575,2025-07-10 21:05:51.592144,0 days 00:01:06.178569,identity,min,0.00764059387283059,7,16,bell,COMPLETE
98,0.07319437712430954,2025-07-10 21:05:51.592744,2025-07-10 21:06:48.296603,0 days 00:00:56.703859,identity,min,0.009038352710011783,6,9,bell,COMPLETE
99,3.587843366403831e-06,2025-07-10 21:06:48.297183,2025-07-10 21:07:54.611252,0 days 00:01:06.314069,identity,min,0.007873155660256922,7,16,bell,COMPLETE
100,0.021200871095061302,2025-07-10 21:07:54.612171,2025-07-10 21:08:59.420225,0 days 00:01:04.808054,identity,min,0.0012745993120161158,7,15,bell,COMPLETE
101,4.179983534413623e-06,2025-07-10 21:08:59.420822,2025-07-10 21:10:05.589691,0 days 00:01:06.168869,identity,min,0.007882479328016518,7,16,bell,COMPLETE
102,0.008590364828705788,2025-07-10 21:10:05.590286,2025-07-10 21:11:12.028056,0 days 00:01:06.437770,identity,min,0.007314237598838365,7,16,bell,COMPLETE
103,6.821494025643915e-06,2025-07-10 21:11:12.028645,2025-07-10 21:12:19.632600,0 days 00:01:07.603955,identity,min,0.00922970631087257,7,17,bell,COMPLETE
104,3.79754533241794e-06,2025-07-10 21:12:19.633215,2025-07-10 21:13:22.902695,0 days 00:01:03.269480,identity,min,0.007894359622795541,7,14,bell,COMPLETE
105,6.504820248665055e-06,2025-07-10 21:13:22.903307,2025-07-10 21:14:27.596791,0 days 00:01:04.693484,identity,min,0.0061087609930489525,7,15,bell,COMPLETE
106,7.907791768957395e-06,2025-07-10 21:14:27.597665,2025-07-10 21:15:29.629378,0 days 00:01:02.031713,identity,min,0.0067133910023276025,6,17,gaussian,COMPLETE
107,0.00021714063768740743,2025-07-10 21:15:29.629986,2025-07-10 21:16:41.942432,0 days 00:01:12.312446,identity,min,0.009875861568222483,8,20,bell,COMPLETE
108,6.839313300588401e-06,2025-07-10 21:16:41.943438,2025-07-10 21:17:40.342216,0 days 00:00:58.398778,identity,min,0.005476846045135328,7,9,bell,COMPLETE
109,5.414174211182399e-06,2025-07-10 21:17:40.342813,2025-07-10 21:18:46.385697,0 days 00:01:06.042884,identity,min,0.008297754266315642,7,16,bell,COMPLETE
110,0.10204308480024338,2025-07-10 21:18:46.386635,2025-07-10 21:20:02.552125,0 days 00:01:16.165490,identity,min,0.0003360487865354103,6,25,bell,COMPLETE
111,5.918130682402989e-06,2025-07-10 21:20:02.552734,2025-07-10 21:21:13.193147,0 days 00:01:10.640413,identity,prod,0.006276288029953619,7,18,bell,COMPLETE
112,0.0255949255079031,2025-07-10 21:21:13.193755,2025-07-10 21:22:21.109818,0 days 00:01:07.916063,identity,prod,0.006893907168049508,7,16,bell,COMPLETE
113,3.8110774767119437e-06,2025-07-10 21:22:21.110426,2025-07-10 21:23:25.347354,0 days 00:01:04.236928,identity,prod,0.007520257610766118,6,15,bell,COMPLETE
114,0.010012253187596798,2025-07-10 21:23:25.347947,2025-07-10 21:24:35.783715,0 days 00:01:10.435768,identity,prod,0.008465220015716628,8,17,bell,COMPLETE
115,4.538000212050974e-06,2025-07-10 21:24:35.784333,2025-07-10 21:25:38.643735,0 days 00:01:02.859402,identity,prod,0.006636491888818842,6,14,bell,COMPLETE
116,4.71659541290137e-06,2025-07-10 21:25:38.644333,2025-07-10 21:26:50.769745,0 days 00:01:12.125412,identity,prod,0.005746649085989853,7,19,bell,COMPLETE
117,4.90342154080281e-06,2025-07-10 21:26:50.770749,2025-07-10 21:27:54.182199,0 days 00:01:03.411450,identity,prod,0.005087688573202228,5,16,bell,COMPLETE
118,3.993711288785562e-06,2025-07-10 21:27:54.182808,2025-07-10 21:28:58.979417,0 days 00:01:04.796609,identity,min,0.00744732374280421,7,15,bell,COMPLETE
119,1.9477118257782422e-05,2025-07-10 21:28:58.980023,2025-07-10 21:30:15.528967,0 days 00:01:16.548944,identity,prod,0.009238236338823425,6,24,bell,COMPLETE
120,4.094264568266226e-06,2025-07-10 21:30:15.529586,2025-07-10 21:31:22.628076,0 days 00:01:07.098490,identity,prod,0.003795116672831958,6,17,bell,COMPLETE
121,0.08675847947597504,2025-07-10 21:31:22.628689,2025-07-10 21:32:26.048987,0 days 00:01:03.420298,identity,min,0.008014388015718741,7,14,bell,COMPLETE
122,3.762199867196614e-06,2025-07-10 21:32:26.049582,2025-07-10 21:33:30.993610,0 days 00:01:04.944028,identity,min,0.007131861470953651,7,15,bell,COMPLETE
123,9.604418664821424e-06,2025-07-10 21:33:30.994223,2025-07-10 21:34:37.186420,0 days 00:01:06.192197,identity,min,0.006892943220424555,7,16,bell,COMPLETE
124,3.436173074078397e-06,2025-07-10 21:34:37.187336,2025-07-10 21:35:42.051784,0 days 00:01:04.864448,identity,min,0.009960664307813281,7,15,bell,COMPLETE
125,5.884799611521885e-05,2025-07-10 21:35:42.052387,2025-07-10 21:36:43.970210,0 days 00:01:01.917823,identity,min,0.009204690654117666,7,13,bell,COMPLETE
126,4.0475683817930985e-06,2025-07-10 21:36:43.970813,2025-07-10 21:37:36.210626,0 days 00:00:52.239813,identity,min,0.009952124964087502,7,7,gaussian,COMPLETE
127,4.128608907194575e-06,2025-07-10 21:37:36.211224,2025-07-10 21:38:40.980091,0 days 00:01:04.768867,identity,min,0.008342602375810387,7,15,bell,COMPLETE
128,3.439104375502211e-06,2025-07-10 21:38:40.980697,2025-07-10 21:39:41.380042,0 days 00:01:00.399345,identity,min,0.0075224021984744505,7,12,bell,COMPLETE
129,0.049071766436100006,2025-07-10 21:39:41.380645,2025-07-10 21:40:41.743462,0 days 00:01:00.362817,identity,min,0.00017183129557679975,7,12,bell,COMPLETE
130,4.2034193938889075e-06,2025-07-10 21:40:41.744068,2025-07-10 21:41:43.066525,0 days 00:01:01.322457,identity,min,0.006142789892425841,7,11,bell,COMPLETE
131,3.475058747426374e-06,2025-07-10 21:41:43.067139,2025-07-10 21:42:43.486883,0 days 00:01:00.419744,identity,min,0.007400674602735833,7,12,bell,COMPLETE
132,4.580652785080019e-06,2025-07-10 21:42:43.487487,2025-07-10 21:43:43.919608,0 days 00:01:00.432121,identity,min,0.007285453114397206,7,12,bell,COMPLETE
133,3.761486823350424e-06,2025-07-10 21:43:43.920214,2025-07-10 21:44:45.296027,0 days 00:01:01.375813,identity,min,0.009033328240310941,7,11,bell,COMPLETE
134,4.489564162213355e-06,2025-07-10 21:44:45.296638,2025-07-10 21:45:45.243609,0 days 00:00:59.946971,identity,min,0.00875193783140136,7,10,bell,COMPLETE
135,3.399640945644933e-06,2025-07-10 21:45:45.244218,2025-07-10 21:46:46.762506,0 days 00:01:01.518288,identity,min,0.009882145774007426,7,11,bell,COMPLETE
136,0.058486130088567734,2025-07-10 21:46:46.763123,2025-07-10 21:47:47.256110,0 days 00:01:00.492987,identity,min,0.008026689286954552,7,12,bell,COMPLETE
137,6.578706233995035e-06,2025-07-10 21:47:47.256713,2025-07-10 21:48:48.073054,0 days 00:01:00.816341,relu,min,0.009944563429370147,7,12,bell,COMPLETE
138,3.7367867662396748e-06,2025-07-10 21:48:48.073657,2025-07-10 21:49:49.079897,0 days 00:01:01.006240,identity,min,0.008497894061352821,8,10,bell,COMPLETE
