number,value,datetime_start,datetime_complete,duration,params_activation,params_and_operator,params_lr,params_n_sets,params_seq_length,params_shape,state
420,0.0005449641030281782,2025-07-11 02:50:11.717974,2025-07-11 02:51:19.013638,0 days 00:01:07.295664,relu,min,0.000839281402313973,7,16,bell,COMPLETE
421,2.1178020688239485e-05,2025-07-11 02:51:19.014339,2025-07-11 02:52:24.195242,0 days 00:01:05.180903,identity,min,0.007903337924317423,7,15,bell,COMPLETE
422,0.0043388246558606625,2025-07-11 02:52:24.195943,2025-07-11 02:53:33.702217,0 days 00:01:09.506274,identity,prod,0.006196978833915176,8,16,bell,COMPLETE
423,7.508989256166387e-06,2025-07-11 02:53:33.702957,2025-07-11 02:54:34.462756,0 days 00:01:00.759799,identity,min,0.008586099895126098,7,10,bell,COMPLETE
424,7.522725809394615e-06,2025-07-11 02:54:34.463459,2025-07-11 02:55:33.779384,0 days 00:00:59.315925,identity,min,0.0070504753273674696,6,12,bell,COMPLETE
425,1.138862133026123,2025-07-11 02:55:33.780092,2025-07-11 02:56:31.624457,0 days 00:00:57.844365,relu,min,0.009292196380977056,6,9,bell,COMPLETE
426,0.000135876311105676,2025-07-11 02:56:31.625167,2025-07-11 02:57:40.469183,0 days 00:01:08.844016,identity,min,0.00798476808804768,8,17,bell,COMPLETE
427,6.3231582316802815e-06,2025-07-11 02:57:40.470227,2025-07-11 02:58:48.378638,0 days 00:01:07.908411,identity,prod,0.005132831090313133,8,15,bell,COMPLETE
428,0.03062448836863041,2025-07-11 02:58:48.379383,2025-07-11 02:59:49.207056,0 days 00:01:00.827673,identity,min,0.009951760901254637,7,10,bell,COMPLETE
429,3.7212000734143658e-06,2025-07-11 02:59:49.207763,2025-07-11 03:00:51.516663,0 days 00:01:02.308900,relu,min,0.008688259186315436,8,12,bell,COMPLETE
430,3.934373580705142e-06,2025-07-11 03:00:51.517717,2025-07-11 03:01:54.786503,0 days 00:01:03.268786,identity,min,0.006756352303010846,8,11,bell,COMPLETE
431,0.0032800238113850355,2025-07-11 03:01:54.787216,2025-07-11 03:02:56.594896,0 days 00:01:01.807680,identity,min,0.007553211740776307,7,16,sigmoid,COMPLETE
432,3.741929049283499e-06,2025-07-11 03:02:56.595602,2025-07-11 03:04:06.223103,0 days 00:01:09.627501,identity,prod,0.008516966030818031,8,16,bell,COMPLETE
433,0.004672276321798563,2025-07-11 03:04:06.224417,2025-07-11 03:05:15.217259,0 days 00:01:08.992842,relu,min,0.00016537454816381987,9,15,bell,COMPLETE
434,7.41998701414559e-06,2025-07-11 03:05:15.217984,2025-07-11 03:06:17.407545,0 days 00:01:02.189561,identity,min,0.009951802491951366,7,11,bell,COMPLETE
435,3.3826495382527355e-06,2025-07-11 03:06:17.408260,2025-07-11 03:07:19.217335,0 days 00:01:01.809075,identity,min,0.00914612567261862,8,12,bell,COMPLETE
436,3.4122081160603557e-06,2025-07-11 03:07:19.218048,2025-07-11 03:08:16.797515,0 days 00:00:57.579467,identity,min,0.007473564522038299,5,12,bell,COMPLETE
437,3.883394128934015e-06,2025-07-11 03:08:16.798217,2025-07-11 03:09:13.802022,0 days 00:00:57.003805,identity,min,0.007594035301810124,5,12,bell,COMPLETE
438,4.025348516734084e-06,2025-07-11 03:09:13.802749,2025-07-11 03:10:14.489578,0 days 00:01:00.686829,relu,prod,0.008092103249758205,6,12,bell,COMPLETE
439,0.002612964017316699,2025-07-11 03:10:14.490285,2025-07-11 03:11:13.788068,0 days 00:00:59.297783,identity,min,0.007202680669675945,6,12,bell,COMPLETE
440,0.007547129411250353,2025-07-11 03:11:13.788781,2025-07-11 03:12:13.219955,0 days 00:00:59.431174,identity,min,0.008952476348040556,6,12,bell,COMPLETE
441,0.0002306620590388775,2025-07-11 03:12:13.220677,2025-07-11 03:13:11.585998,0 days 00:00:58.365321,identity,min,0.00805169010114795,5,13,bell,COMPLETE
442,0.13158878684043884,2025-07-11 03:13:11.586738,2025-07-11 03:14:05.732282,0 days 00:00:54.145544,relu,min,0.00913898096284956,5,12,gaussian,COMPLETE
443,0.004209751728922129,2025-07-11 03:14:05.733001,2025-07-11 03:15:07.543034,0 days 00:01:01.810033,identity,prod,0.001431975283801169,6,13,bell,COMPLETE
444,3.4459135349607095e-06,2025-07-11 03:15:07.543733,2025-07-11 03:16:11.786930,0 days 00:01:04.243197,identity,min,0.006982367101745672,9,12,bell,COMPLETE
445,1.4992288924986497e-05,2025-07-11 03:16:11.787661,2025-07-11 03:17:18.786183,0 days 00:01:06.998522,identity,min,0.006813352572678598,9,14,bell,COMPLETE
446,5.0708995331660844e-06,2025-07-11 03:17:18.786912,2025-07-11 03:18:24.731245,0 days 00:01:05.944333,relu,min,0.006325878917523403,9,13,bell,COMPLETE
447,0.32814842462539673,2025-07-11 03:18:24.731968,2025-07-11 03:19:29.089055,0 days 00:01:04.357087,identity,min,0.007206815722612538,9,12,bell,COMPLETE
448,5.118038643558975e-06,2025-07-11 03:19:29.089759,2025-07-11 03:20:35.474920,0 days 00:01:06.385161,identity,prod,0.0066013563416941635,9,12,bell,COMPLETE
449,2.9539211027440615e-05,2025-07-11 03:20:35.475638,2025-07-11 03:21:42.657066,0 days 00:01:07.181428,identity,min,0.007366402219225762,9,14,bell,COMPLETE
450,8.361163963854779e-06,2025-07-11 03:21:42.657774,2025-07-11 03:22:55.922700,0 days 00:01:13.264926,relu,min,0.007910740593134416,9,18,bell,COMPLETE
451,8.450398127024528e-06,2025-07-11 03:22:55.923434,2025-07-11 03:24:01.241457,0 days 00:01:05.318023,identity,min,0.006902534867661279,9,11,bell,COMPLETE
452,0.0004985331324860454,2025-07-11 03:24:01.242180,2025-07-11 03:25:06.927435,0 days 00:01:05.685255,identity,min,0.005869230727369218,9,13,bell,COMPLETE
453,4.6828959057165775e-06,2025-07-11 03:25:06.928144,2025-07-11 03:26:01.559740,0 days 00:00:54.631596,relu,min,0.007670913120146201,5,8,bell,COMPLETE
454,4.770227405970218e-06,2025-07-11 03:26:01.560453,2025-07-11 03:27:00.953008,0 days 00:00:59.392555,identity,prod,0.008258898148426237,5,11,bell,COMPLETE
455,0.002946461085230112,2025-07-11 03:27:00.953742,2025-07-11 03:27:50.804454,0 days 00:00:49.850712,identity,min,0.007257469923363975,6,7,sigmoid,COMPLETE
456,3.7969696222717175e-06,2025-07-11 03:27:50.805158,2025-07-11 03:28:47.897949,0 days 00:00:57.092791,identity,min,0.008683565282182913,5,10,bell,COMPLETE
457,6.568457320099697e-05,2025-07-11 03:28:47.898662,2025-07-11 03:29:52.256218,0 days 00:01:04.357556,relu,min,0.0063011195340375685,9,12,bell,COMPLETE
458,3.918738457286963e-06,2025-07-11 03:29:52.256943,2025-07-11 03:31:00.855515,0 days 00:01:08.598572,identity,min,0.007936335080633811,9,15,bell,COMPLETE
459,4.164387974014971e-06,2025-07-11 03:31:00.856554,2025-07-11 03:32:04.876947,0 days 00:01:04.020393,identity,prod,0.00872992292353852,8,10,bell,COMPLETE
460,0.055860694497823715,2025-07-11 03:32:04.877677,2025-07-11 03:33:05.241769,0 days 00:01:00.364092,identity,min,0.006760292636838823,8,9,bell,COMPLETE
461,0.013656141236424446,2025-07-11 03:33:05.242486,2025-07-11 03:34:11.888539,0 days 00:01:06.646053,relu,min,0.0074785855220902905,6,17,bell,COMPLETE
462,5.6202084124379326e-06,2025-07-11 03:34:11.889262,2025-07-11 03:35:14.040730,0 days 00:01:02.151468,identity,min,0.008442372085323434,8,12,bell,COMPLETE
463,4.844820978178177e-06,2025-07-11 03:35:14.041450,2025-07-11 03:36:17.250233,0 days 00:01:03.208783,identity,min,0.005741423636729545,8,11,bell,COMPLETE
464,0.0166102834045887,2025-07-11 03:36:17.251289,2025-07-11 03:37:17.534538,0 days 00:01:00.283249,identity,prod,0.0090673535674945,8,12,gaussian,COMPLETE
465,0.00015914328105282038,2025-07-11 03:37:17.535265,2025-07-11 03:38:22.977927,0 days 00:01:05.442662,relu,min,0.007730148722036299,8,14,bell,COMPLETE
466,9.690088336355984e-05,2025-07-11 03:38:22.978967,2025-07-11 03:39:26.512052,0 days 00:01:03.533085,identity,min,0.0010919793744219393,8,13,bell,COMPLETE
467,0.23806358873844147,2025-07-11 03:39:26.512782,2025-07-11 03:40:34.378312,0 days 00:01:07.865530,identity,min,0.006605623142568142,8,16,bell,COMPLETE
468,0.0013675715308636427,2025-07-11 03:40:34.379050,2025-07-11 03:41:35.134234,0 days 00:01:00.755184,relu,min,0.009199888008355157,7,10,bell,COMPLETE
469,8.876505489752162e-06,2025-07-11 03:41:35.134968,2025-07-11 03:42:34.915130,0 days 00:00:59.780162,identity,prod,0.008300787241412283,5,11,bell,COMPLETE
470,0.00042054400546476245,2025-07-11 03:42:34.915862,2025-07-11 03:43:43.509076,0 days 00:01:08.593214,identity,min,0.0022948065540653382,9,15,bell,COMPLETE
471,6.417278927983716e-05,2025-07-11 03:43:43.509813,2025-07-11 03:44:46.680520,0 days 00:01:03.170707,identity,min,0.007170814982016436,8,11,bell,COMPLETE
472,0.00019990879809483886,2025-07-11 03:44:46.681251,2025-07-11 03:45:46.312802,0 days 00:00:59.631551,relu,min,0.009979523929337594,7,9,bell,COMPLETE
473,3.825468411378097e-06,2025-07-11 03:45:46.313525,2025-07-11 03:46:49.845459,0 days 00:01:03.531934,identity,min,0.009150662997588063,6,15,bell,COMPLETE
474,5.7467486840323545e-06,2025-07-11 03:46:49.846191,2025-07-11 03:47:48.052833,0 days 00:00:58.206642,identity,prod,0.008050519016329494,7,7,bell,COMPLETE
475,4.0691329559194855e-06,2025-07-11 03:47:48.053563,2025-07-11 03:48:53.001423,0 days 00:01:04.947860,identity,min,0.007378835870669334,8,14,bell,COMPLETE
476,3.490651124593569e-06,2025-07-11 03:48:53.002150,2025-07-11 03:50:03.157556,0 days 00:01:10.155406,relu,min,0.006208572609621589,7,18,bell,COMPLETE
477,0.00028048601234331727,2025-07-11 03:50:03.158284,2025-07-11 03:51:01.263220,0 days 00:00:58.104936,relu,min,0.0059986827529555226,7,13,sigmoid,COMPLETE
478,0.001042569987475872,2025-07-11 03:51:01.263941,2025-07-11 03:52:02.945110,0 days 00:01:01.681169,relu,min,0.005080254941553075,7,12,bell,COMPLETE
479,0.0006381721468642354,2025-07-11 03:52:02.945835,2025-07-11 03:53:14.509854,0 days 00:01:11.564019,relu,min,0.005798878272171667,7,19,bell,COMPLETE
480,0.04244235157966614,2025-07-11 03:53:14.510586,2025-07-11 03:54:27.862354,0 days 00:01:13.351768,relu,prod,0.0003042312094293785,7,19,bell,COMPLETE
481,0.002859414555132389,2025-07-11 03:54:27.863088,2025-07-11 03:55:28.997544,0 days 00:01:01.134456,relu,min,0.009245549054861076,7,10,bell,COMPLETE
482,4.229881596984342e-06,2025-07-11 03:55:28.998270,2025-07-11 03:56:30.559345,0 days 00:01:01.561075,relu,min,0.006307136454407461,7,12,bell,COMPLETE
483,3.915308298019227e-06,2025-07-11 03:56:30.560072,2025-07-11 03:57:43.445312,0 days 00:01:12.885240,relu,min,0.005527922172861878,7,20,bell,COMPLETE
484,3.5959753859060584e-06,2025-07-11 03:57:43.446059,2025-07-11 03:58:45.947595,0 days 00:01:02.501536,relu,min,0.008570265912708376,7,11,bell,COMPLETE
485,6.916646725585451e-06,2025-07-11 03:58:45.948332,2025-07-11 03:59:50.711361,0 days 00:01:04.763029,relu,prod,0.006563643422532377,7,13,bell,COMPLETE
486,1.3172639608383179,2025-07-11 03:59:50.712434,2025-07-11 04:00:55.220624,0 days 00:01:04.508190,relu,min,0.00994694070830507,7,14,bell,COMPLETE
487,0.03364967182278633,2025-07-11 04:00:55.221362,2025-07-11 04:01:57.784330,0 days 00:01:02.562968,relu,min,0.00842049038066673,7,11,bell,COMPLETE
488,0.004575786180794239,2025-07-11 04:01:57.785295,2025-07-11 04:03:01.712071,0 days 00:01:03.926776,relu,min,0.007003242052015312,6,15,bell,COMPLETE
489,0.0005208209040574729,2025-07-11 04:03:01.712794,2025-07-11 04:04:02.852881,0 days 00:01:01.140087,relu,min,0.007914526718780854,7,10,bell,COMPLETE
490,0.001078909495845437,2025-07-11 04:04:02.853613,2025-07-11 04:05:13.625075,0 days 00:01:10.771462,identity,prod,0.009196463070216964,9,18,gaussian,COMPLETE
491,3.4870110994233983e-06,2025-07-11 04:05:13.626149,2025-07-11 04:06:16.272626,0 days 00:01:02.646477,identity,min,0.007632614999309691,7,13,bell,COMPLETE
492,0.00508522056043148,2025-07-11 04:06:16.273350,2025-07-11 04:07:18.897634,0 days 00:01:02.624284,identity,min,0.00014418129139764276,7,13,bell,COMPLETE
493,0.0006442427984438837,2025-07-11 04:07:18.898655,2025-07-11 04:08:21.514922,0 days 00:01:02.616267,identity,min,0.00641840238538244,7,13,bell,COMPLETE
494,0.020150456577539444,2025-07-11 04:08:21.515650,2025-07-11 04:09:25.756226,0 days 00:01:04.240576,identity,min,0.00700016446363688,7,14,bell,COMPLETE
495,4.739247287943726e-06,2025-07-11 04:09:25.757339,2025-07-11 04:10:28.715996,0 days 00:01:02.958657,identity,prod,0.005458527617821189,7,12,bell,COMPLETE
496,3.4191991744592087e-06,2025-07-11 04:10:28.716727,2025-07-11 04:11:31.364124,0 days 00:01:02.647397,identity,min,0.007485597009815691,7,13,bell,COMPLETE
497,3.636324890976539e-06,2025-07-11 04:11:31.365116,2025-07-11 04:12:34.017215,0 days 00:01:02.652099,identity,min,0.007538332005937135,7,13,bell,COMPLETE
498,4.540741429082118e-06,2025-07-11 04:12:34.017957,2025-07-11 04:13:36.698424,0 days 00:01:02.680467,identity,min,0.0077277450902498036,7,13,bell,COMPLETE
499,4.158988758717896e-06,2025-07-11 04:13:36.699156,2025-07-11 04:14:39.414070,0 days 00:01:02.714914,identity,min,0.008279139184899921,7,13,bell,COMPLETE
