number,value,datetime_start,datetime_complete,duration,params_activation,params_batch_size,params_h,params_lr,params_seq_length,params_shuffle,params_weight_decay,state
492,6.302777364908252e-06,2025-07-04 16:09:32.882192,2025-07-04 16:10:03.470191,0 days 00:00:30.587999,relu,16,119,0.0010346699667789965,19,True,1.9591409424135067e-05,COMPLETE
493,5.393830178945791e-06,2025-07-04 16:10:03.470440,2025-07-04 16:10:34.527082,0 days 00:00:31.056642,relu,16,114,0.0010318195458285584,20,True,1.4074458448020746e-05,COMPLETE
494,4.50902962256805e-06,2025-07-04 16:10:34.527336,2025-07-04 16:11:04.863283,0 days 00:00:30.335947,relu,16,118,0.001159359731194258,19,True,2.0332666773907566e-05,COMPLETE
495,5.5766131481505e-06,2025-07-04 16:11:04.863537,2025-07-04 16:11:35.818398,0 days 00:00:30.954861,identity,16,128,0.0009784323611788926,20,True,1.6772560689961587e-05,COMPLETE
496,5.721277830161853e-06,2025-07-04 16:11:35.818670,2025-07-04 16:11:44.808665,0 days 00:00:08.989995,relu,64,120,0.0012176375344800654,13,True,1.8244646901888496e-05,COMPLETE
497,4.397086286189733e-06,2025-07-04 16:11:44.808955,2025-07-04 16:12:11.113065,0 days 00:00:26.304110,relu,16,125,0.0009288434779700606,15,True,1.5276921741839502e-05,COMPLETE
498,5.5266646086238325e-06,2025-07-04 16:12:11.113321,2025-07-04 16:12:41.463606,0 days 00:00:30.350285,relu,16,122,0.0010510876894441702,19,True,1.3266274243726938e-05,COMPLETE
499,0.02641475759446621,2025-07-04 16:12:41.463841,2025-07-04 16:13:10.079150,0 days 00:00:28.615309,sigmoid,16,85,0.004674132853003184,20,True,1.664355640846886e-05,COMPLETE
