number,value,datetime_start,datetime_complete,duration,params_activation,params_batch_size,params_h,params_lr,params_seq_length,params_shuffle,params_weight_decay,state
246,5.000298642698908e-06,2025-07-04 14:21:14.344888,2025-07-04 14:21:41.573818,0 days 00:00:27.228930,relu,16,124,0.0005327736338664746,16,True,1.635452073210721e-05,COMPLETE
247,6.299435881373938e-06,2025-07-04 14:21:41.574072,2025-07-04 14:22:08.667458,0 days 00:00:27.093386,relu,16,118,0.000588371619813072,16,True,1.4632714673846608e-05,COMPLETE
248,0.00010702529107220471,2025-07-04 14:22:08.667687,2025-07-04 14:22:35.804028,0 days 00:00:27.136341,relu,16,121,0.0006089546497065745,16,True,0.0007427087129923308,COMPLETE
249,5.803802650916623e-06,2025-07-04 14:22:35.804253,2025-07-04 14:23:03.124764,0 days 00:00:27.320511,relu,16,128,0.0006635437899637427,16,True,1.3037693999641348e-05,COMPLETE
250,5.163609330338659e-06,2025-07-04 14:23:03.124979,2025-07-04 14:23:31.817773,0 days 00:00:28.692794,relu,16,124,0.00048358126280224895,17,True,1.0717913224682245e-05,COMPLETE
251,1.0392302101536188e-05,2025-07-04 14:23:31.818003,2025-07-04 14:24:00.200823,0 days 00:00:28.382820,relu,16,119,0.0006361165986140537,17,False,1.854413186935677e-05,COMPLETE
252,6.003027920087334e-06,2025-07-04 14:24:00.201041,2025-07-04 14:24:27.964830,0 days 00:00:27.763789,relu,16,126,0.0005755885175252424,16,True,1.5718850924283724e-05,COMPLETE
253,4.223194991936907e-06,2025-07-04 14:24:27.965041,2025-07-04 14:24:57.358126,0 days 00:00:29.393085,relu,16,122,0.0006973824230396711,18,True,1.1858404987336764e-05,COMPLETE
254,4.418972821440548e-05,2025-07-04 14:25:38.523817,2025-07-04 14:25:46.102239,0 days 00:00:07.578422,relu,128,117,0.0006668619253200899,18,True,1.1629209238070052e-05,COMPLETE
255,5.877477633475792e-06,2025-07-04 14:25:46.102575,2025-07-04 14:26:15.531557,0 days 00:00:29.428982,relu,16,121,0.0007318199195061699,18,True,1.0072601613341888e-05,COMPLETE
256,4.974309831595747e-06,2025-07-04 14:26:15.531818,2025-07-04 14:26:43.789860,0 days 00:00:28.258042,relu,16,128,0.0005265662025211636,17,True,1.2098261079276486e-05,COMPLETE
257,5.191592208575457e-06,2025-07-04 14:26:43.790085,2025-07-04 14:27:12.193814,0 days 00:00:28.403729,relu,16,124,0.0006907011905257829,17,True,1.3136275028593818e-05,COMPLETE
258,5.224424057814758e-06,2025-07-04 14:27:12.194053,2025-07-04 14:27:41.477993,0 days 00:00:29.283940,relu,16,122,0.0007660847753303207,18,True,1.0979756061896085e-05,COMPLETE
259,5.539086032513296e-06,2025-07-04 14:27:41.478246,2025-07-04 14:27:58.391207,0 days 00:00:16.912961,relu,32,126,0.0006111976117893582,17,True,2.2846098080990677e-05,COMPLETE
260,4.035959591419669e-06,2025-07-04 14:27:58.391443,2025-07-04 14:28:27.625722,0 days 00:00:29.234279,relu,16,121,0.0006967259337585732,18,True,1.4194582872671624e-05,COMPLETE
261,5.338973096513655e-06,2025-07-04 14:30:06.129943,2025-07-04 14:30:35.488952,0 days 00:00:29.359009,relu,16,119,0.0006892456019617691,18,True,1.190623231571579e-05,COMPLETE
262,5.552690709009767e-06,2025-07-04 14:30:35.489242,2025-07-04 14:31:04.202631,0 days 00:00:28.713389,relu,16,116,0.0005516863408010862,18,True,1.4003585101219592e-05,COMPLETE
263,5.659548605763121e-06,2025-07-04 14:31:04.202864,2025-07-04 14:31:33.215062,0 days 00:00:29.012198,identity,16,121,0.0006294365598006686,18,True,1.2755673156049474e-05,COMPLETE
264,4.415661805978743e-06,2025-07-04 14:31:33.215368,2025-07-04 14:32:02.960535,0 days 00:00:29.745167,relu,16,125,0.0006954466872333445,18,True,1.1270035983853401e-05,COMPLETE
265,4.232369519741042e-06,2025-07-04 14:32:02.960807,2025-07-04 14:32:31.036014,0 days 00:00:28.075207,relu,16,128,0.0004628453092844007,17,True,1.4982228717434789e-05,COMPLETE
266,4.199350769340526e-06,2025-07-04 14:32:31.036263,2025-07-04 14:32:57.494957,0 days 00:00:26.458694,relu,16,126,0.0004955234358105276,15,True,1.399460181915326e-05,COMPLETE
267,5.315051112120273e-06,2025-07-04 14:32:57.495217,2025-07-04 14:33:23.317086,0 days 00:00:25.821869,relu,16,128,0.00048612001801054644,15,True,1.3138042635666043e-05,COMPLETE
268,0.02717515453696251,2025-07-04 14:33:23.317309,2025-07-04 14:33:49.190806,0 days 00:00:25.873497,sigmoid,16,128,0.0004923487193956596,15,True,1.2079514765913088e-05,COMPLETE
269,3.996764462499414e-06,2025-07-04 14:33:49.191087,2025-07-04 14:34:14.582816,0 days 00:00:25.391729,relu,16,126,0.0004453300545085367,14,True,3.6720731904427575e-05,COMPLETE
270,5.5660248108324595e-06,2025-07-04 14:34:14.583043,2025-07-04 14:34:39.909877,0 days 00:00:25.326834,relu,16,126,0.00038142834176339174,14,False,3.1146277578110795e-05,COMPLETE
271,5.8357991292723455e-06,2025-07-04 14:34:39.910098,2025-07-04 14:35:04.744379,0 days 00:00:24.834281,relu,16,128,0.00034369645965122344,14,True,2.693032803546351e-05,COMPLETE
272,8.840299415169284e-06,2025-07-04 14:35:04.744687,2025-07-04 14:35:27.184726,0 days 00:00:22.440039,relu,16,87,0.00042057472283857025,13,True,0.000142960794677963,COMPLETE
273,4.131122295802925e-06,2025-07-04 14:35:27.184978,2025-07-04 14:35:53.615830,0 days 00:00:26.430852,relu,16,125,0.000403733158697325,15,True,3.922159565352994e-05,COMPLETE
274,4.155368060310138e-06,2025-07-04 14:35:53.616110,2025-07-04 14:36:18.999573,0 days 00:00:25.383463,relu,16,126,0.0003845539638258469,14,True,2.5213623910967548e-05,COMPLETE
275,4.5985402721271385e-06,2025-07-04 14:36:18.999802,2025-07-04 14:36:44.404280,0 days 00:00:25.404478,relu,16,126,0.00044030168955119944,14,True,4.4310675797770745e-05,COMPLETE
276,6.991549980739364e-06,2025-07-04 14:36:44.404495,2025-07-04 14:37:09.221890,0 days 00:00:24.817395,relu,16,128,0.00040861115868352993,14,True,3.452218461443165e-05,COMPLETE
277,5.699961093341699e-06,2025-07-04 14:37:09.222150,2025-07-04 14:37:33.578047,0 days 00:00:24.355897,relu,16,125,0.000334889868245071,13,True,2.433027321607269e-05,COMPLETE
278,3.890384505211841e-06,2025-07-04 14:37:33.578298,2025-07-04 14:37:58.966300,0 days 00:00:25.388002,relu,16,126,0.00044613466295343834,14,True,2.235240940191106e-05,COMPLETE
279,5.8097043620364275e-06,2025-07-04 14:37:58.966571,2025-07-04 14:38:24.409527,0 days 00:00:25.442956,relu,16,126,0.00037972797066745153,14,True,2.2127154067461585e-05,COMPLETE
280,6.531098733830731e-06,2025-07-04 14:38:24.409746,2025-07-04 14:38:49.268278,0 days 00:00:24.858532,relu,16,128,0.0004383141725627184,14,True,3.8332175344755905e-05,COMPLETE
281,5.228883765084902e-06,2025-07-04 14:38:49.268506,2025-07-04 14:39:15.476477,0 days 00:00:26.207971,relu,16,124,0.00036439039150503935,15,True,2.4856938019863566e-05,COMPLETE
282,5.667356617777841e-06,2025-07-04 14:39:15.476746,2025-07-04 14:39:41.022311,0 days 00:00:25.545565,relu,16,126,0.0004531507593605101,14,True,2.7311929205748156e-05,COMPLETE
283,6.961160124774324e-06,2025-07-04 14:39:41.022537,2025-07-04 14:40:04.293197,0 days 00:00:23.270660,relu,16,61,0.00043374451001484667,15,True,1.970090399348282e-05,COMPLETE
284,4.476940375752747e-06,2025-07-04 14:40:04.293447,2025-07-04 14:40:29.828348,0 days 00:00:25.534901,relu,16,123,0.00028361127127594335,14,True,2.131563197613428e-05,COMPLETE
285,0.00013249347102828324,2025-07-04 14:40:29.828573,2025-07-04 14:40:46.651233,0 days 00:00:16.822660,relu,16,15,0.00046438104397637456,15,True,5.4258798012173216e-05,COMPLETE
286,5.173548743186984e-06,2025-07-04 14:40:46.651441,2025-07-04 14:41:11.438332,0 days 00:00:24.786891,identity,16,128,0.00039737272196369364,14,True,2.349347861683765e-05,COMPLETE
287,5.960374892310938e-06,2025-07-04 14:41:11.438565,2025-07-04 14:41:37.697864,0 days 00:00:26.259299,relu,16,124,0.0003099178037675845,15,True,3.065730641691803e-05,COMPLETE
288,4.160869139013812e-06,2025-07-04 14:41:37.698083,2025-07-04 14:42:03.276825,0 days 00:00:25.578742,relu,16,126,0.0005000126897986957,14,True,2.2116390375379405e-05,COMPLETE
289,4.981192887498764e-06,2025-07-04 14:42:03.277040,2025-07-04 14:42:27.896625,0 days 00:00:24.619585,relu,16,126,0.00035296626188898654,13,True,2.9235337541283326e-05,COMPLETE
290,5.335140485840384e-06,2025-07-04 14:42:27.896878,2025-07-04 14:42:52.939892,0 days 00:00:25.043014,relu,16,128,0.0004746963474160716,14,True,2.4846872700580427e-05,COMPLETE
291,7.380512670351891e-06,2025-07-04 14:42:52.940112,2025-07-04 14:43:18.112358,0 days 00:00:25.172246,relu,16,124,0.000494616292044645,14,False,2.1006080507448945e-05,COMPLETE
292,0.027520205825567245,2025-07-04 14:43:18.112626,2025-07-04 14:43:43.699219,0 days 00:00:25.586593,sigmoid,16,125,0.00043623047798468554,14,True,2.2200003821214857e-05,COMPLETE
293,3.857152023556409e-06,2025-07-04 14:43:43.699450,2025-07-04 14:44:09.186203,0 days 00:00:25.486753,relu,16,123,0.0003903346604222909,14,True,3.984450510075988e-05,COMPLETE
294,6.024234153301222e-06,2025-07-04 14:44:09.186490,2025-07-04 14:44:34.740120,0 days 00:00:25.553630,relu,16,123,0.00038641870107033175,14,True,4.172708465998972e-05,COMPLETE
295,4.6334421313076746e-06,2025-07-04 14:44:34.740358,2025-07-04 14:45:00.373253,0 days 00:00:25.632895,relu,16,126,0.0004029447588259941,14,True,2.9083910033321455e-05,COMPLETE
296,8.44400256028166e-06,2025-07-04 14:45:00.373469,2025-07-04 14:45:24.449392,0 days 00:00:24.075923,relu,16,128,0.007273820820543566,13,True,4.785778021779687e-05,COMPLETE
297,4.80436801808537e-06,2025-07-04 14:45:24.449628,2025-07-04 14:45:48.410095,0 days 00:00:23.960467,relu,16,97,0.0005276211150926738,14,True,3.850347910226123e-05,COMPLETE
298,6.7672117438632995e-06,2025-07-04 14:45:48.410303,2025-07-04 14:46:14.028796,0 days 00:00:25.618493,relu,16,123,0.0003657248274220472,14,True,3.833355663483735e-05,COMPLETE
299,5.364992830436677e-06,2025-07-04 14:46:14.029021,2025-07-04 14:46:40.764942,0 days 00:00:26.735921,relu,16,126,0.0004678277554811162,15,True,1.9706184299608524e-05,COMPLETE
300,3.0429166145040654e-05,2025-07-04 14:46:40.765162,2025-07-04 14:46:50.872081,0 days 00:00:10.106919,relu,64,122,0.0004173354871965994,15,True,8.15863733176755e-05,COMPLETE
301,7.293221187865129e-06,2025-07-04 14:46:50.872338,2025-07-04 14:47:13.270439,0 days 00:00:22.398101,relu,16,75,0.0003353349265127191,13,True,3.458106626651329e-05,COMPLETE
302,4.110072495677741e-06,2025-07-04 14:47:13.270675,2025-07-04 14:47:38.985580,0 days 00:00:25.714905,relu,16,125,0.0005027187304354359,14,True,2.552488487627277e-05,COMPLETE
303,6.092574494687142e-06,2025-07-04 14:47:38.985809,2025-07-04 14:48:04.403388,0 days 00:00:25.417579,relu,16,124,0.0005476532423809681,14,True,2.8451749216606912e-05,COMPLETE
304,8.110151611617766e-06,2025-07-04 14:48:04.403614,2025-07-04 14:48:29.708728,0 days 00:00:25.305114,relu,16,122,0.0004854409622263051,14,True,6.318783897567462e-05,COMPLETE
305,4.46511739937705e-06,2025-07-04 14:48:29.708950,2025-07-04 14:48:55.478835,0 days 00:00:25.769885,relu,16,126,0.00045182660270706856,14,True,2.6672898476449874e-05,COMPLETE
306,4.3447753341752104e-06,2025-07-04 14:48:55.479054,2025-07-04 14:49:22.351128,0 days 00:00:26.872074,relu,16,125,0.0005053788404880543,15,True,2.4993338348154432e-05,COMPLETE
307,5.344963938114233e-06,2025-07-04 14:49:22.351348,2025-07-04 14:49:47.624462,0 days 00:00:25.273114,relu,16,122,0.0004118202044604573,14,True,2.3491945202423623e-05,COMPLETE
308,5.7360261962458026e-06,2025-07-04 14:49:47.624679,2025-07-04 14:50:11.828520,0 days 00:00:24.203841,relu,16,128,0.0005625065492803891,13,True,3.403412478757232e-05,COMPLETE
309,5.598597908829106e-06,2025-07-04 14:50:11.828762,2025-07-04 14:50:37.167944,0 days 00:00:25.339182,relu,16,124,0.0004606627552258482,14,True,2.123564820735331e-05,COMPLETE
310,6.142187430668855e-06,2025-07-04 14:50:37.168173,2025-07-04 14:51:03.924508,0 days 00:00:26.756335,relu,16,126,0.0005076935274384463,15,True,2.417456525655816e-05,COMPLETE
311,5.533331204787828e-06,2025-07-04 14:51:03.924729,2025-07-04 14:51:30.763054,0 days 00:00:26.838325,identity,16,122,0.0005511600034367011,16,False,2.6611031057638103e-05,COMPLETE
312,4.570490091282409e-06,2025-07-04 14:51:30.763268,2025-07-04 14:51:55.845344,0 days 00:00:25.082076,relu,16,128,0.00038094516852135333,14,True,4.1360894891986466e-05,COMPLETE
313,1.110485663957661e-05,2025-07-04 14:51:55.845574,2025-07-04 14:52:23.474848,0 days 00:00:27.629274,relu,16,125,0.009404456452566995,16,True,1.930240620047658e-05,COMPLETE
314,2.513558320060838e-05,2025-07-04 14:52:23.475068,2025-07-04 14:52:29.990756,0 days 00:00:06.515688,relu,128,121,0.0005837749222883402,14,True,1.0443384854550309e-05,COMPLETE
315,0.027249885722994804,2025-07-04 14:52:29.991032,2025-07-04 14:52:57.227692,0 days 00:00:27.236660,sigmoid,16,124,0.00042275652546328783,16,True,2.290430525759e-05,COMPLETE
316,5.738478648709133e-06,2025-07-04 14:52:57.227928,2025-07-04 14:53:23.883050,0 days 00:00:26.655122,relu,16,126,0.0005286481397800148,15,True,1.0016398198748897e-05,COMPLETE
317,6.415622465283377e-06,2025-07-04 14:53:23.883269,2025-07-04 14:53:48.712130,0 days 00:00:24.828861,relu,16,120,0.00036303691568337755,14,True,5.095807739017133e-05,COMPLETE
318,3.926425051758997e-06,2025-07-04 14:53:48.712353,2025-07-04 14:54:16.017684,0 days 00:00:27.305331,relu,16,128,0.00047293596154422663,16,True,1.781277862033935e-05,COMPLETE
319,5.529013378691161e-06,2025-07-04 14:54:16.017897,2025-07-04 14:54:43.374252,0 days 00:00:27.356355,relu,16,128,0.0004621764258129779,16,True,2.084063557146403e-05,COMPLETE
320,4.136838470003568e-06,2025-07-04 14:54:43.374473,2025-07-04 14:55:10.688529,0 days 00:00:27.314056,relu,16,128,0.0003988794393804361,16,True,1.854978907662167e-05,COMPLETE
321,5.512616553460248e-06,2025-07-04 14:55:10.688774,2025-07-04 14:55:38.029432,0 days 00:00:27.340658,relu,16,128,0.0003101467616751458,16,True,1.80272461235782e-05,COMPLETE
322,5.768801656813594e-06,2025-07-04 14:55:38.029649,2025-07-04 14:56:05.328158,0 days 00:00:27.298509,relu,16,128,0.00041535547801350986,16,True,5.912746817844323e-05,COMPLETE
323,5.819687885377789e-06,2025-07-04 14:56:05.328372,2025-07-04 14:56:30.912159,0 days 00:00:25.583787,relu,16,126,0.0004439255388409214,14,True,1.690818043797486e-05,COMPLETE
324,5.597413746727398e-06,2025-07-04 14:56:30.912362,2025-07-04 14:56:57.543343,0 days 00:00:26.630981,relu,16,126,0.0003848536076207713,15,True,0.00010826118443658016,COMPLETE
325,5.2730920288013294e-06,2025-07-04 14:56:57.543554,2025-07-04 14:57:25.134353,0 days 00:00:27.590799,relu,16,123,0.0004885972398873867,16,True,1.8553860594580062e-05,COMPLETE
326,5.320093350746902e-06,2025-07-04 14:57:25.134583,2025-07-04 14:57:50.170898,0 days 00:00:25.036315,relu,16,128,0.0003583392357246979,14,True,3.248743997075645e-05,COMPLETE
327,5.4856018323334865e-06,2025-07-04 14:57:50.171107,2025-07-04 14:58:17.885186,0 days 00:00:27.714079,relu,16,125,0.0005096169838818655,16,True,1.784495081217273e-05,COMPLETE
328,5.935746230534278e-06,2025-07-04 14:58:17.885413,2025-07-04 14:58:44.442758,0 days 00:00:26.557345,relu,16,126,0.0005817668135809526,15,True,2.0109558633815225e-05,COMPLETE
329,1.0869574907701463e-05,2025-07-04 14:58:44.442974,2025-07-04 14:59:06.394572,0 days 00:00:21.951598,relu,16,51,0.0003976474835322784,14,True,2.2847933487006664e-05,COMPLETE
330,4.4174998947710264e-06,2025-07-04 14:59:06.394785,2025-07-04 14:59:33.936436,0 days 00:00:27.541651,relu,16,123,0.00045505804360229256,16,True,1.733678152017763e-05,COMPLETE
331,9.422471521247644e-06,2025-07-04 14:59:33.936654,2025-07-04 14:59:57.879555,0 days 00:00:23.942901,relu,16,128,0.0006063525741359911,13,False,1.1364369769701554e-05,COMPLETE
332,1.5207647265924606e-05,2025-07-04 14:59:57.879780,2025-07-04 15:00:08.328648,0 days 00:00:10.448868,relu,64,125,0.0003414846053834913,15,True,3.666761324931686e-05,COMPLETE
333,5.628577582683647e-06,2025-07-04 15:00:08.328909,2025-07-04 15:00:33.367321,0 days 00:00:25.038412,relu,16,122,0.0004210533149045424,14,True,2.5354397439594298e-05,COMPLETE
334,4.7929702304827515e-06,2025-07-04 15:00:33.367546,2025-07-04 15:01:00.458758,0 days 00:00:27.091212,identity,16,128,0.0005179822889909618,16,True,1.3687155901446264e-05,COMPLETE
335,5.515598786587361e-06,2025-07-04 15:01:00.458972,2025-07-04 15:01:26.706439,0 days 00:00:26.247467,relu,16,124,0.00048231045216645495,15,True,1.615786084755008e-05,COMPLETE
336,5.411306119640358e-06,2025-07-04 15:01:26.706672,2025-07-04 15:01:52.343659,0 days 00:00:25.636987,relu,16,126,0.00039698395725025487,14,True,2.9601674673568034e-05,COMPLETE
337,4.060123046656372e-06,2025-07-04 15:01:52.343887,2025-07-04 15:02:16.379999,0 days 00:00:24.036112,relu,16,121,0.0005740142015854341,13,True,1.89962071672733e-05,COMPLETE
338,4.6494515117956325e-06,2025-07-04 15:02:16.380206,2025-07-04 15:02:37.745851,0 days 00:00:21.365645,relu,16,82,0.0005783519589954446,12,True,1.9931043567357553e-05,COMPLETE
339,0.027617301791906357,2025-07-04 15:02:37.746062,2025-07-04 15:03:01.797997,0 days 00:00:24.051935,sigmoid,16,121,0.0005353644753099295,13,True,1.884430606987313e-05,COMPLETE
340,6.4553173615422565e-06,2025-07-04 15:03:01.798205,2025-07-04 15:03:24.558177,0 days 00:00:22.759972,relu,16,120,0.0004484086242157763,12,True,2.1808651413496476e-05,COMPLETE
341,2.2067668396630324e-05,2025-07-04 15:03:24.558383,2025-07-04 15:03:48.947481,0 days 00:00:24.389098,relu,16,123,0.0006332258998147453,13,True,0.00034102875180333037,COMPLETE
342,5.36374272996909e-06,2025-07-04 15:03:48.947681,2025-07-04 15:04:13.705753,0 days 00:00:24.758072,relu,16,120,0.0005686284906984764,14,True,7.421991490064296e-05,COMPLETE
343,4.28618150181137e-05,2025-07-04 15:04:13.705961,2025-07-04 15:04:20.515355,0 days 00:00:06.809394,relu,128,123,0.0005065857110056432,14,True,2.1224694153828092e-05,COMPLETE
344,4.087487468495965e-06,2025-07-04 15:04:20.515628,2025-07-04 15:04:51.568254,0 days 00:00:31.052626,relu,16,125,0.0006170331882967624,19,True,1.7478653619950554e-05,COMPLETE
345,5.57922430743929e-06,2025-07-04 15:04:51.568500,2025-07-04 15:05:22.685453,0 days 00:00:31.116953,relu,16,125,0.0002772991833662448,19,True,1.831454503708188e-05,COMPLETE
346,5.175856131245382e-06,2025-07-04 15:05:22.685688,2025-07-04 15:05:53.817452,0 days 00:00:31.131764,relu,16,126,0.000628717395760457,19,True,1.6840801146849217e-05,COMPLETE
347,6.452763500419678e-06,2025-07-04 15:05:53.817671,2025-07-04 15:06:24.296110,0 days 00:00:30.478439,relu,16,128,0.0004447549329849384,19,True,1.894392752140679e-05,COMPLETE
348,4.1139246604871005e-06,2025-07-04 15:06:24.296334,2025-07-04 15:06:53.880951,0 days 00:00:29.584617,relu,16,124,0.0003407539268395934,18,True,2.315769429341553e-05,COMPLETE
349,5.146900548425037e-06,2025-07-04 15:06:53.881189,2025-07-04 15:07:23.795417,0 days 00:00:29.914228,relu,16,123,0.0003508088587698716,18,True,1.7117019060129298e-05,COMPLETE
350,5.086284090793924e-06,2025-07-04 15:07:23.795633,2025-07-04 15:07:53.854336,0 days 00:00:30.058703,relu,16,126,0.0004144971705707824,18,True,2.0299824882612198e-05,COMPLETE
351,4.3765494410763495e-06,2025-07-04 15:07:53.854546,2025-07-04 15:08:17.026453,0 days 00:00:23.171907,relu,16,124,0.00034548820548198085,12,True,4.617218566903743e-05,COMPLETE
352,5.659058388118865e-06,2025-07-04 15:08:17.026675,2025-07-04 15:08:47.430167,0 days 00:00:30.403492,relu,16,121,0.00023170710625625734,19,False,2.5297925897963587e-05,COMPLETE
353,4.9879813559527975e-06,2025-07-04 15:08:47.430384,2025-07-04 15:09:16.870911,0 days 00:00:29.440527,relu,16,128,0.00037896234873463643,18,True,1.527310340463953e-05,COMPLETE
354,4.168206032773014e-06,2025-07-04 15:09:16.871126,2025-07-04 15:09:46.938176,0 days 00:00:30.067050,relu,16,125,0.0003066146412292807,18,True,2.201227326321502e-05,COMPLETE
355,5.967118795524584e-06,2025-07-04 15:09:46.938386,2025-07-04 15:10:16.427812,0 days 00:00:29.489426,relu,16,122,0.00029386836839244516,18,True,2.189445183330199e-05,COMPLETE
356,5.503859938471578e-06,2025-07-04 15:10:16.428040,2025-07-04 15:10:46.535249,0 days 00:00:30.107209,relu,16,125,0.00030899693876112154,18,True,2.6989650414267233e-05,COMPLETE
357,7.0965888880891725e-06,2025-07-04 15:10:46.535459,2025-07-04 15:10:57.966123,0 days 00:00:11.430664,relu,64,119,0.0003423538802208149,18,True,2.4480241743547173e-05,COMPLETE
358,5.500510724232299e-06,2025-07-04 15:10:57.966373,2025-07-04 15:11:28.745816,0 days 00:00:30.779443,identity,16,123,0.0003020262257689435,19,True,2.2833459218100432e-05,COMPLETE
359,4.199425802653423e-06,2025-07-04 15:11:28.746037,2025-07-04 15:11:58.824589,0 days 00:00:30.078552,relu,16,125,0.0006200127562080473,18,True,1.9192504833180486e-05,COMPLETE
360,4.354079010226997e-06,2025-07-04 15:11:58.824811,2025-07-04 15:12:28.962883,0 days 00:00:30.138072,relu,16,126,0.0003126914759425607,18,True,1.8819715051033542e-05,COMPLETE
361,5.648094884236343e-06,2025-07-04 15:12:28.963113,2025-07-04 15:12:59.057288,0 days 00:00:30.094175,relu,16,125,0.0003248528083814823,18,True,2.071968882504606e-05,COMPLETE
362,6.062364263925701e-06,2025-07-04 15:12:59.057503,2025-07-04 15:13:23.708402,0 days 00:00:24.650899,relu,16,126,0.00025059378516870443,13,True,2.3058407038637877e-05,COMPLETE
363,0.026658417657017708,2025-07-04 15:13:23.708613,2025-07-04 15:13:54.363261,0 days 00:00:30.654648,sigmoid,16,124,0.0006237471030465945,19,True,1.9445575689577702e-05,COMPLETE
364,4.318041646911297e-06,2025-07-04 15:13:54.363470,2025-07-04 15:14:20.449071,0 days 00:00:26.085601,relu,16,128,0.00037782622233392503,15,True,1.7953367486202027e-05,COMPLETE
365,1.8850318156182766e-05,2025-07-04 15:14:20.449308,2025-07-04 15:14:49.561244,0 days 00:00:29.111936,relu,16,120,0.0005774404999700229,18,True,0.0002653265276470492,COMPLETE
366,8.924286703404505e-06,2025-07-04 15:14:49.561468,2025-07-04 15:15:10.272796,0 days 00:00:20.711328,relu,16,65,0.0002740079770605738,11,True,2.027063887497616e-05,COMPLETE
367,5.516905730473809e-06,2025-07-04 15:15:10.273011,2025-07-04 15:15:41.161121,0 days 00:00:30.888110,relu,16,123,0.0005183419485711609,19,True,2.768165003847634e-05,COMPLETE
368,6.207815022207797e-05,2025-07-04 15:15:41.161342,2025-07-04 15:15:47.766921,0 days 00:00:06.605579,relu,128,126,0.0005555669797829782,13,True,1.708884319225284e-05,COMPLETE
