number,value,datetime_start,datetime_complete,duration,params_and_operator,params_batch_size,params_lr,params_n_sets,params_seq_length,params_shape,state
0,0.0019671909976750612,2025-07-17 17:54:25.027935,2025-07-17 17:56:13.843110,0 days 00:01:48.815175,min,32,0.008361084579696625,6,18,gaussian,COMPLETE
1,2.8259732723236084,2025-07-17 17:56:13.844149,2025-07-17 17:56:41.605656,0 days 00:00:27.761507,prod,128,2.4327821849514366e-05,5,12,gaussian,COMPLETE
2,0.07103926688432693,2025-07-17 17:56:41.606502,2025-07-17 17:58:35.494260,0 days 00:01:53.887758,min,32,8.709590299897664e-05,7,19,sigmoid,COMPLETE
3,0.12373022735118866,2025-07-17 17:58:35.495032,2025-07-17 17:59:23.270927,0 days 00:00:47.775895,min,128,0.007468114284047727,9,20,bell,COMPLETE
4,3.2657182216644287,2025-07-17 17:59:23.271572,2025-07-17 18:01:28.678167,0 days 00:02:05.406595,prod,16,0.0006928121102860702,7,8,gaussian,COMPLETE
5,0.4211322069168091,2025-07-17 18:01:28.678987,2025-07-17 18:03:40.688751,0 days 00:02:12.009764,min,32,0.00029024228071984414,6,23,bell,COMPLETE
6,0.01700674183666706,2025-07-17 18:03:40.689589,2025-07-17 18:04:08.261259,0 days 00:00:27.571670,min,128,0.007204000232197143,7,10,bell,COMPLETE
7,0.27029138803482056,2025-07-17 18:04:08.261859,2025-07-17 18:07:41.282842,0 days 00:03:33.020983,prod,16,0.002309034191729983,7,19,sigmoid,COMPLETE
8,0.012946469709277153,2025-07-17 18:07:41.283611,2025-07-17 18:09:05.660712,0 days 00:01:24.377101,prod,32,0.0010261797552540122,6,13,sigmoid,COMPLETE
9,0.43470901250839233,2025-07-17 18:09:05.661441,2025-07-17 18:10:56.133960,0 days 00:01:50.472519,min,32,1.493963608743581e-05,5,19,gaussian,COMPLETE
10,0.8806352019309998,2025-07-17 18:10:56.134902,2025-07-17 18:12:24.563699,0 days 00:01:28.428797,min,64,0.0001466310309119021,9,25,gaussian,COMPLETE
11,0.5428853034973145,2025-07-17 18:12:24.564533,2025-07-17 18:13:57.748121,0 days 00:01:33.183588,prod,32,0.0012955124675541228,6,15,sigmoid,COMPLETE
12,0.1719064712524414,2025-07-17 18:13:57.748922,2025-07-17 18:14:49.703843,0 days 00:00:51.954921,prod,32,0.003495280852131397,6,5,sigmoid,COMPLETE
13,0.2076156884431839,2025-07-17 18:14:49.704455,2025-07-17 18:15:42.622498,0 days 00:00:52.918043,prod,64,0.0006886291809642664,6,14,sigmoid,COMPLETE
14,0.8140699863433838,2025-07-17 18:15:42.623135,2025-07-17 18:17:22.080958,0 days 00:01:39.457823,min,32,0.002827522927177544,8,16,gaussian,COMPLETE
15,0.028212539851665497,2025-07-17 18:17:22.081817,2025-07-17 18:18:41.046881,0 days 00:01:18.965064,prod,32,0.009015155418177713,5,12,gaussian,COMPLETE
16,0.5839161276817322,2025-07-17 18:18:41.047747,2025-07-17 18:20:19.967408,0 days 00:01:38.919661,prod,32,0.0011957389450913158,8,16,sigmoid,COMPLETE
17,0.03742888942360878,2025-07-17 18:20:19.968298,2025-07-17 18:24:06.059103,0 days 00:03:46.090805,min,16,5.557746284043665e-05,6,21,gaussian,COMPLETE
18,0.4479353725910187,2025-07-17 18:24:06.059999,2025-07-17 18:24:43.302452,0 days 00:00:37.242453,min,64,0.0005032526261436239,8,8,sigmoid,COMPLETE
19,1.2821096181869507,2025-07-17 18:24:43.303016,2025-07-17 18:26:26.853281,0 days 00:01:43.550265,prod,32,0.000262020655545915,5,17,bell,COMPLETE
20,0.4537765383720398,2025-07-17 18:26:26.854188,2025-07-17 18:27:50.753691,0 days 00:01:23.899503,min,32,0.0037692901158753846,6,13,sigmoid,COMPLETE
21,0.5968328714370728,2025-07-17 18:27:50.754604,2025-07-17 18:28:18.276635,0 days 00:00:27.522031,min,128,0.0060002115471629695,7,10,bell,COMPLETE
22,0.8873277306556702,2025-07-17 18:28:18.277186,2025-07-17 18:28:45.793868,0 days 00:00:27.516682,min,128,0.0015681412751742956,7,10,bell,COMPLETE
23,2.636038064956665,2025-07-17 18:28:45.794522,2025-07-17 18:29:11.894110,0 days 00:00:26.099588,min,128,0.004987738630337356,6,10,bell,COMPLETE
24,0.03765363246202469,2025-07-17 18:29:11.894644,2025-07-17 18:29:35.159295,0 days 00:00:23.264651,min,128,0.008317009649034866,8,8,bell,COMPLETE
25,0.015348742716014385,2025-07-17 18:29:35.159852,2025-07-17 18:29:55.501014,0 days 00:00:20.341162,min,128,0.0018459339082226305,7,6,bell,COMPLETE
26,0.34044787287712097,2025-07-17 18:29:55.501514,2025-07-17 18:30:27.184867,0 days 00:00:31.683353,prod,64,0.001776146768219241,6,6,gaussian,COMPLETE
27,0.28535696864128113,2025-07-17 18:30:27.185536,2025-07-17 18:33:24.813743,0 days 00:02:57.628207,min,16,0.0008937541251511877,5,17,sigmoid,COMPLETE
28,0.19745852053165436,2025-07-17 18:33:24.814637,2025-07-17 18:34:18.814124,0 days 00:00:53.999487,prod,32,0.00042170569451290793,7,5,gaussian,COMPLETE
29,0.3273015320301056,2025-07-17 18:34:18.814786,2025-07-17 18:34:48.928435,0 days 00:00:30.113649,prod,128,0.002376169262366133,5,13,bell,COMPLETE
30,0.009969322010874748,2025-07-17 18:34:48.929119,2025-07-17 18:35:33.259804,0 days 00:00:44.330685,min,128,0.00018089659183958195,6,22,gaussian,COMPLETE
31,0.2820740044116974,2025-07-17 18:35:33.260489,2025-07-17 18:36:19.147137,0 days 00:00:45.886648,min,128,0.00013572181104782506,6,23,gaussian,COMPLETE
32,0.26274624466896057,2025-07-17 18:36:19.147849,2025-07-17 18:37:03.458531,0 days 00:00:44.310682,min,128,6.185375413134815e-05,6,22,gaussian,COMPLETE
33,0.2709972858428955,2025-07-17 18:37:03.459270,2025-07-17 18:37:55.410603,0 days 00:00:51.951333,min,128,0.0001978992917153865,7,25,gaussian,COMPLETE
34,0.03869836404919624,2025-07-17 18:37:55.411310,2025-07-17 18:38:32.383734,0 days 00:00:36.972424,min,128,3.63051356837699e-05,5,18,gaussian,COMPLETE
35,0.6436948180198669,2025-07-17 18:38:32.384423,2025-07-17 18:40:32.817066,0 days 00:02:00.432643,min,32,0.0004151359007917802,6,21,gaussian,COMPLETE
36,0.044842228293418884,2025-07-17 18:40:32.817895,2025-07-17 18:41:18.152312,0 days 00:00:45.334417,min,128,0.0007926338198626634,7,20,bell,COMPLETE
37,0.2990046441555023,2025-07-17 18:41:18.152966,2025-07-17 18:45:25.387156,0 days 00:04:07.234190,min,16,0.0001094593196484387,7,23,sigmoid,COMPLETE
38,0.2187909483909607,2025-07-17 18:45:25.387987,2025-07-17 18:46:27.975886,0 days 00:01:02.587899,prod,32,0.004464275501435068,6,7,gaussian,COMPLETE
39,1.9024189710617065,2025-07-17 18:46:27.976680,2025-07-17 18:46:59.141931,0 days 00:00:31.165251,min,128,0.0002484347969006323,7,12,bell,COMPLETE
40,0.06645001471042633,2025-07-17 18:46:59.142491,2025-07-17 18:48:51.168853,0 days 00:01:52.026362,min,32,0.0005905277199973731,9,18,sigmoid,COMPLETE
41,0.013278966769576073,2025-07-17 18:48:51.169709,2025-07-17 18:49:18.751195,0 days 00:00:27.581486,min,128,0.005341367975957797,7,10,bell,COMPLETE
42,1.4406682252883911,2025-07-17 18:49:18.751769,2025-07-17 18:49:47.194572,0 days 00:00:28.442803,min,128,0.006293515380539474,8,11,bell,COMPLETE
43,1.6862046718597412,2025-07-17 18:49:47.195215,2025-07-17 18:50:21.950572,0 days 00:00:34.755357,min,128,0.0029601298044158886,7,14,bell,COMPLETE
44,0.008913658559322357,2025-07-17 18:50:21.951099,2025-07-17 18:50:46.475951,0 days 00:00:24.524852,min,128,0.002007027680025294,6,9,bell,COMPLETE
45,0.5285347104072571,2025-07-17 18:50:46.476600,2025-07-17 18:51:27.560252,0 days 00:00:41.083652,min,64,0.0011300858891694007,6,9,bell,COMPLETE
46,0.9925986528396606,2025-07-17 18:51:27.560923,2025-07-17 18:52:46.612441,0 days 00:01:19.051518,prod,32,0.005683501957697092,5,12,gaussian,COMPLETE
47,0.34119296073913574,2025-07-17 18:52:46.613309,2025-07-17 18:53:09.919716,0 days 00:00:23.306407,min,128,0.008902374841483736,6,9,sigmoid,COMPLETE
48,0.0009099423768930137,2025-07-17 18:53:09.920266,2025-07-17 18:56:06.556654,0 days 00:02:56.636388,prod,16,0.0023162335118081007,6,15,gaussian,COMPLETE
49,0.10408003628253937,2025-07-17 18:56:06.557449,2025-07-17 18:59:03.387693,0 days 00:02:56.830244,prod,16,0.001004254273881691,6,15,gaussian,COMPLETE
50,0.09775868058204651,2025-07-17 18:59:03.388547,2025-07-17 19:02:08.060479,0 days 00:03:04.671932,prod,16,0.0022302473902589648,6,16,gaussian,COMPLETE
51,0.0007033986621536314,2025-07-17 19:02:08.061350,2025-07-17 19:04:56.156850,0 days 00:02:48.095500,prod,16,0.00421571770093051,6,14,gaussian,COMPLETE
52,0.14613035321235657,2025-07-17 19:04:56.157702,2025-07-17 19:07:44.157851,0 days 00:02:48.000149,prod,16,0.003859131732037677,6,14,gaussian,COMPLETE
53,0.00035189042682759464,2025-07-17 19:07:44.158753,2025-07-17 19:10:24.048299,0 days 00:02:39.889546,prod,16,0.002579609095959404,6,13,gaussian,COMPLETE
54,0.020568734034895897,2025-07-17 19:10:24.049196,2025-07-17 19:13:08.266411,0 days 00:02:44.217215,prod,16,0.0035619428957435395,5,15,gaussian,COMPLETE
55,0.16672609746456146,2025-07-17 19:13:08.267332,2025-07-17 19:15:47.797624,0 days 00:02:39.530292,prod,16,0.0026760380213080004,6,13,gaussian,COMPLETE
56,1.4522994756698608,2025-07-17 19:15:47.798485,2025-07-17 19:19:01.163361,0 days 00:03:13.364876,prod,16,0.0015688722206624775,6,17,gaussian,COMPLETE
57,0.0004939743666909635,2025-07-17 19:19:01.164293,2025-07-17 19:22:06.180243,0 days 00:03:05.015950,prod,16,0.0067802720741519116,6,16,gaussian,COMPLETE
58,0.0002982928999699652,2025-07-17 19:22:06.181135,2025-07-17 19:24:57.896443,0 days 00:02:51.715308,prod,16,0.0075269310184541815,5,16,gaussian,COMPLETE
59,0.0033711616415530443,2025-07-17 19:24:57.897346,2025-07-17 19:27:49.685033,0 days 00:02:51.787687,prod,16,0.009986792474663745,5,16,gaussian,COMPLETE
60,0.0022633466869592667,2025-07-17 19:27:49.685913,2025-07-17 19:30:56.772851,0 days 00:03:07.086938,prod,16,0.007876763855236852,5,18,gaussian,COMPLETE
61,0.00042059156112372875,2025-07-17 19:30:56.773772,2025-07-17 19:34:03.845083,0 days 00:03:07.071311,prod,16,0.006785577304613901,5,18,gaussian,COMPLETE
62,0.000322595500620082,2025-07-17 19:34:03.845988,2025-07-17 19:36:48.014967,0 days 00:02:44.168979,prod,16,0.007362818725816645,5,15,gaussian,COMPLETE
63,0.0049255238845944405,2025-07-17 19:36:48.015835,2025-07-17 19:39:32.095465,0 days 00:02:44.079630,prod,16,0.004672573207758402,5,15,gaussian,COMPLETE
64,0.00031078862957656384,2025-07-17 19:39:32.096365,2025-07-17 19:42:08.488237,0 days 00:02:36.391872,prod,16,0.006566701865158212,5,14,gaussian,COMPLETE
65,0.006333773955702782,2025-07-17 19:42:08.489087,2025-07-17 19:44:44.809962,0 days 00:02:36.320875,prod,16,0.006920603975567958,5,14,gaussian,COMPLETE
66,0.00029609992634505033,2025-07-17 19:44:44.810864,2025-07-17 19:47:36.426635,0 days 00:02:51.615771,prod,16,0.007175824984938512,5,16,gaussian,COMPLETE
67,0.010119287297129631,2025-07-17 19:47:36.427552,2025-07-17 19:50:35.727640,0 days 00:02:59.300088,prod,16,0.006569947092470581,5,17,gaussian,COMPLETE
68,0.0003133590507786721,2025-07-17 19:50:35.728502,2025-07-17 19:53:50.434124,0 days 00:03:14.705622,prod,16,0.007448626754476587,5,19,gaussian,COMPLETE
69,0.0005611223168671131,2025-07-17 19:53:50.435066,2025-07-17 19:57:05.152363,0 days 00:03:14.717297,prod,16,0.00985220868031225,5,19,gaussian,COMPLETE
70,0.06837784498929977,2025-07-17 19:57:05.153313,2025-07-17 20:00:27.527263,0 days 00:03:22.373950,prod,16,0.003359513135834468,5,20,gaussian,COMPLETE
71,0.001745752990245819,2025-07-17 20:00:27.528182,2025-07-17 20:03:19.258630,0 days 00:02:51.730448,prod,16,0.007267959335590733,5,16,gaussian,COMPLETE
72,0.0013851883122697473,2025-07-17 20:03:19.259560,2025-07-17 20:06:18.685925,0 days 00:02:59.426365,prod,16,0.005323317149270954,5,17,gaussian,COMPLETE
73,0.0002629065129440278,2025-07-17 20:06:18.686830,2025-07-17 20:09:25.859185,0 days 00:03:07.172355,prod,16,0.007931992568296358,5,18,gaussian,COMPLETE
74,0.0005395260523073375,2025-07-17 20:09:25.860153,2025-07-17 20:12:33.110957,0 days 00:03:07.250804,prod,16,0.007876959496719639,5,18,gaussian,COMPLETE
75,0.002974744886159897,2025-07-17 20:12:33.111905,2025-07-17 20:15:47.881274,0 days 00:03:14.769369,prod,16,0.0045881236172578095,5,19,gaussian,COMPLETE
76,0.27649620175361633,2025-07-17 20:15:47.882204,2025-07-17 20:18:54.974774,0 days 00:03:07.092570,prod,16,0.0056660287137183804,5,18,gaussian,COMPLETE
77,0.000860000669490546,2025-07-17 20:18:54.975713,2025-07-17 20:22:17.194483,0 days 00:03:22.218770,prod,16,0.008524103303605896,5,20,gaussian,COMPLETE
78,0.00033415123471058905,2025-07-17 20:22:17.195405,2025-07-17 20:25:16.543582,0 days 00:02:59.348177,prod,16,0.006181844173948496,5,17,gaussian,COMPLETE
79,0.193433478474617,2025-07-17 20:25:16.544519,2025-07-17 20:26:16.596560,0 days 00:01:00.052041,prod,64,0.0035056483208542027,5,17,gaussian,COMPLETE
80,0.016557617112994194,2025-07-17 20:26:16.597234,2025-07-17 20:28:45.169300,0 days 00:02:28.572066,prod,16,0.0029092130781469597,5,13,gaussian,COMPLETE
81,0.00039805585402064025,2025-07-17 20:28:45.170269,2025-07-17 20:31:44.425598,0 days 00:02:59.255329,prod,16,0.006202706505492585,5,17,gaussian,COMPLETE
82,0.005894103553146124,2025-07-17 20:31:44.426491,2025-07-17 20:34:59.251839,0 days 00:03:14.825348,prod,16,0.005399262107870201,5,19,gaussian,COMPLETE
83,3.2798399925231934,2025-07-17 20:34:59.252795,2025-07-17 20:37:51.060827,0 days 00:02:51.808032,prod,16,1.119205179447966e-05,5,16,gaussian,COMPLETE
84,0.00044559818343259394,2025-07-17 20:37:51.061735,2025-07-17 20:40:50.506870,0 days 00:02:59.445135,prod,16,0.00822880406752469,5,17,gaussian,COMPLETE
85,0.0794338658452034,2025-07-17 20:40:50.507789,2025-07-17 20:43:34.594580,0 days 00:02:44.086791,prod,16,0.004307911619247513,5,15,gaussian,COMPLETE
86,0.0009486565249972045,2025-07-17 20:43:34.595518,2025-07-17 20:46:10.933991,0 days 00:02:36.338473,prod,16,0.00618181846158297,5,14,gaussian,COMPLETE
87,0.0005749938427470624,2025-07-17 20:46:10.934887,2025-07-17 20:49:02.659002,0 days 00:02:51.724115,prod,16,0.009324828117474617,5,16,gaussian,COMPLETE
88,0.1394960880279541,2025-07-17 20:49:02.659929,2025-07-17 20:51:23.641692,0 days 00:02:20.981763,prod,16,0.004770574705589902,5,12,gaussian,COMPLETE
89,0.46870365738868713,2025-07-17 20:51:23.642606,2025-07-17 20:52:18.489154,0 days 00:00:54.846548,prod,64,0.007664123940209431,5,15,gaussian,COMPLETE
90,0.012514091096818447,2025-07-17 20:52:18.489844,2025-07-17 20:54:47.096356,0 days 00:02:28.606512,prod,16,0.003207656128163671,5,13,gaussian,COMPLETE
91,0.014627614989876747,2025-07-17 20:54:47.097279,2025-07-17 20:57:54.186665,0 days 00:03:07.089386,prod,16,0.006443821171691427,5,18,gaussian,COMPLETE
92,0.0018267609411850572,2025-07-17 20:57:54.187787,2025-07-17 21:01:01.413038,0 days 00:03:07.225251,prod,16,0.007174319002303485,5,18,gaussian,COMPLETE
93,0.0006263870163820684,2025-07-17 21:01:01.413942,2025-07-17 21:04:16.100694,0 days 00:03:14.686752,prod,16,0.0056983463671131255,5,19,gaussian,COMPLETE
94,0.0005002230755053461,2025-07-17 21:04:16.101619,2025-07-17 21:07:15.497027,0 days 00:02:59.395408,prod,16,0.004028503009662089,5,17,gaussian,COMPLETE
95,0.17072604596614838,2025-07-17 21:07:15.497970,2025-07-17 21:10:37.874387,0 days 00:03:22.376417,prod,16,0.009921115032209231,5,20,gaussian,COMPLETE
96,0.014331400394439697,2025-07-17 21:10:37.875323,2025-07-17 21:13:29.615381,0 days 00:02:51.740058,prod,16,0.008399092325850491,5,16,gaussian,COMPLETE
97,0.010070166550576687,2025-07-17 21:13:29.616278,2025-07-17 21:16:04.651140,0 days 00:02:35.034862,prod,16,0.005162655450354602,5,14,sigmoid,COMPLETE
98,0.008960479870438576,2025-07-17 21:16:04.652042,2025-07-17 21:19:19.370389,0 days 00:03:14.718347,prod,16,0.006362593090108161,5,19,gaussian,COMPLETE
99,0.00038473494350910187,2025-07-17 21:19:19.371305,2025-07-17 21:22:49.389459,0 days 00:03:30.018154,prod,16,0.007449634149524886,5,21,gaussian,COMPLETE
100,0.013597129844129086,2025-07-17 21:22:49.390414,2025-07-17 21:26:19.513317,0 days 00:03:30.122903,prod,16,0.004022382843000068,5,21,gaussian,COMPLETE
101,0.0003431654768064618,2025-07-17 21:26:19.514257,2025-07-17 21:29:26.607761,0 days 00:03:07.093504,prod,16,0.007200684704603079,5,18,gaussian,COMPLETE
102,0.0003010824730154127,2025-07-17 21:29:26.608680,2025-07-17 21:32:26.103756,0 days 00:02:59.495076,prod,16,0.007742388936347518,5,17,gaussian,COMPLETE
103,0.00029644949245266616,2025-07-17 21:32:26.104688,2025-07-17 21:36:19.101185,0 days 00:03:52.996497,prod,16,0.007618311906186462,5,24,gaussian,COMPLETE
104,0.0003301675897091627,2025-07-17 21:36:19.102145,2025-07-17 21:39:03.295455,0 days 00:02:44.193310,prod,16,0.008736870425092275,5,15,gaussian,COMPLETE
105,0.008386434987187386,2025-07-17 21:39:03.296328,2025-07-17 21:42:07.857480,0 days 00:03:04.561152,prod,16,0.008885375750832938,9,15,gaussian,COMPLETE
106,0.0027093139942735434,2025-07-17 21:42:07.858429,2025-07-17 21:46:00.981394,0 days 00:03:53.122965,prod,16,0.004884563893636847,5,24,gaussian,COMPLETE
107,0.0006319385138340294,2025-07-17 21:46:00.982358,2025-07-17 21:46:58.464294,0 days 00:00:57.481936,prod,64,0.008599138874571312,5,16,gaussian,COMPLETE
108,3.2968435287475586,2025-07-17 21:46:58.464947,2025-07-17 21:50:59.331875,0 days 00:04:00.866928,prod,16,2.6196785955514285e-05,5,25,gaussian,COMPLETE
109,0.00877205841243267,2025-07-17 21:50:59.332801,2025-07-17 21:53:59.110612,0 days 00:02:59.777811,prod,16,0.009992872341555655,5,17,gaussian,COMPLETE
110,0.04794488847255707,2025-07-17 21:53:59.111557,2025-07-17 21:56:49.498765,0 days 00:02:50.387208,prod,16,0.007701904082569065,5,16,sigmoid,COMPLETE
111,0.0007465424132533371,2025-07-17 21:56:49.499722,2025-07-17 22:00:42.451973,0 days 00:03:52.952251,prod,16,0.006026469541996141,5,24,gaussian,COMPLETE
112,0.0017949887551367283,2025-07-17 22:00:42.452922,2025-07-17 22:03:18.854638,0 days 00:02:36.401716,prod,16,0.006922262362221823,5,14,gaussian,COMPLETE
113,0.010128751397132874,2025-07-17 22:03:18.855641,2025-07-17 22:06:56.483298,0 days 00:03:37.627657,prod,16,0.005121592457382815,5,22,gaussian,COMPLETE
114,0.0006349139148369431,2025-07-17 22:06:56.484293,2025-07-17 22:09:40.509135,0 days 00:02:44.024842,prod,16,0.008542229974166591,5,15,gaussian,COMPLETE
115,0.0018223904771730304,2025-07-17 22:09:40.510124,2025-07-17 22:12:01.382839,0 days 00:02:20.872715,prod,16,0.00567778714140672,5,12,gaussian,COMPLETE
116,0.0008191412780433893,2025-07-17 22:12:01.383758,2025-07-17 22:14:29.986588,0 days 00:02:28.602830,prod,16,0.004428858285734844,5,13,gaussian,COMPLETE
117,0.0003063624899368733,2025-07-17 22:14:29.987522,2025-07-17 22:17:21.711500,0 days 00:02:51.723978,prod,16,0.007279529365023715,5,16,gaussian,COMPLETE
118,0.10897248983383179,2025-07-17 22:17:21.712444,2025-07-17 22:20:06.401632,0 days 00:02:44.689188,prod,16,0.007203242815241139,5,15,gaussian,COMPLETE
119,0.006911381613463163,2025-07-17 22:20:06.402586,2025-07-17 22:23:06.359898,0 days 00:02:59.957312,prod,16,0.009953237405981348,5,17,gaussian,COMPLETE
120,0.000260208616964519,2025-07-17 22:23:06.360829,2025-07-17 22:24:43.167160,0 days 00:01:36.806331,prod,32,0.007870490429884284,5,16,gaussian,COMPLETE
121,0.007156701758503914,2025-07-17 22:24:43.168105,2025-07-17 22:26:19.928361,0 days 00:01:36.760256,prod,32,0.007704056080446681,5,16,gaussian,COMPLETE
122,0.0077238790690898895,2025-07-17 22:26:19.929317,2025-07-17 22:28:08.414129,0 days 00:01:48.484812,prod,32,0.006086222560720932,8,18,gaussian,COMPLETE
123,0.0006181529024615884,2025-07-17 22:28:08.415025,2025-07-17 22:29:40.888933,0 days 00:01:32.473908,prod,32,0.008827773777515511,5,15,gaussian,COMPLETE
124,0.01889905147254467,2025-07-17 22:29:40.889801,2025-07-17 22:31:18.028323,0 days 00:01:37.138522,prod,32,0.006794589041626417,5,16,gaussian,COMPLETE
125,0.000560600368771702,2025-07-17 22:31:18.029333,2025-07-17 22:34:17.990496,0 days 00:02:59.961163,prod,16,0.0052944095459283745,5,17,gaussian,COMPLETE
126,0.0007737971027381718,2025-07-17 22:34:17.991418,2025-07-17 22:35:50.512579,0 days 00:01:32.521161,prod,32,0.007823476042412418,5,15,gaussian,COMPLETE
127,0.0005809522699564695,2025-07-17 22:35:50.513495,2025-07-17 22:38:50.572753,0 days 00:03:00.059258,prod,16,0.0046668302870916025,5,17,gaussian,COMPLETE
128,0.11749739199876785,2025-07-17 22:38:50.573659,2025-07-17 22:41:42.409467,0 days 00:02:51.835808,prod,16,0.005934203023717622,5,16,gaussian,COMPLETE
129,0.0937671810388565,2025-07-17 22:41:42.410460,2025-07-17 22:42:45.050323,0 days 00:01:02.639863,prod,64,0.008857128210556708,5,18,gaussian,COMPLETE
130,0.0019621180836111307,2025-07-17 22:42:45.051257,2025-07-17 22:45:29.002380,0 days 00:02:43.951123,prod,16,0.003746517473455574,5,15,gaussian,COMPLETE
131,0.00032769996323622763,2025-07-17 22:45:29.003306,2025-07-17 22:48:05.212179,0 days 00:02:36.208873,prod,16,0.006751468962162537,5,14,gaussian,COMPLETE
132,0.02826179563999176,2025-07-17 22:48:05.213084,2025-07-17 22:50:41.549181,0 days 00:02:36.336097,prod,16,0.0068748173860881555,5,14,gaussian,COMPLETE
133,0.0003428054042160511,2025-07-17 22:50:41.550119,2025-07-17 22:53:17.794621,0 days 00:02:36.244502,prod,16,0.007867475165012055,5,14,gaussian,COMPLETE
134,0.04978710412979126,2025-07-17 22:53:17.795562,2025-07-17 22:55:54.021135,0 days 00:02:36.225573,prod,16,0.00817423442649707,5,14,gaussian,COMPLETE
135,0.09309763461351395,2025-07-17 22:55:54.022081,2025-07-17 22:58:30.305107,0 days 00:02:36.283026,prod,16,0.005783157504754899,5,14,gaussian,COMPLETE
136,0.003523000283166766,2025-07-17 22:58:30.306090,2025-07-17 23:01:20.760844,0 days 00:02:50.454754,prod,16,0.005052568710306863,5,16,sigmoid,COMPLETE
137,0.0003440507862251252,2025-07-17 23:01:20.761800,2025-07-17 23:04:04.741720,0 days 00:02:43.979920,prod,16,0.00993403976603489,5,15,gaussian,COMPLETE
138,0.0017410239670425653,2025-07-17 23:04:04.746787,2025-07-17 23:06:48.698184,0 days 00:02:43.951397,prod,16,0.006593381622613635,5,15,gaussian,COMPLETE
139,0.0002394216862739995,2025-07-17 23:06:48.699162,2025-07-17 23:09:48.186767,0 days 00:02:59.487605,prod,16,0.00788435641117107,5,17,gaussian,COMPLETE
140,0.0006611120770685375,2025-07-17 23:09:48.187689,2025-07-17 23:12:51.273519,0 days 00:03:03.085830,prod,16,0.008818666670718104,5,17,bell,COMPLETE
141,0.0006179263000376523,2025-07-17 23:12:51.274503,2025-07-17 23:15:43.022071,0 days 00:02:51.747568,prod,16,0.008125034151391528,5,16,gaussian,COMPLETE
