number,value,datetime_start,datetime_complete,duration,params_and_operator,params_batch_size,params_lr,params_n_sets,params_seq_length,params_shape,state
425,0.01547788642346859,2025-07-18 13:17:47.467374,2025-07-18 13:19:57.744834,0 days 00:02:10.277460,min,16,0.00546007341959025,5,10,gaussian,COMPLETE
426,0.0003291900793556124,2025-07-18 13:19:57.745788,2025-07-18 13:23:59.640864,0 days 00:04:01.895076,prod,16,0.006981617237881605,5,25,gaussian,COMPLETE
427,0.05607312172651291,2025-07-18 13:23:59.641918,2025-07-18 13:28:26.396125,0 days 00:04:26.754207,prod,16,0.009999548597026342,9,24,sigmoid,COMPLETE
428,0.004286331124603748,2025-07-18 13:28:26.397160,2025-07-18 13:31:49.409049,0 days 00:03:23.011889,prod,16,0.007992929334684571,5,20,gaussian,COMPLETE
429,1.8384416103363037,2025-07-18 13:31:49.410136,2025-07-18 13:34:49.108971,0 days 00:02:59.698835,prod,16,1.1852320653818692e-05,5,17,gaussian,COMPLETE
430,0.0012862186413258314,2025-07-18 13:34:49.138985,2025-07-18 13:39:01.077015,0 days 00:04:11.938030,prod,16,0.0058230651135954235,7,23,gaussian,COMPLETE
431,0.018514206632971764,2025-07-18 13:39:01.078093,2025-07-18 13:41:19.354973,0 days 00:02:18.276880,min,16,0.004675901006907458,5,11,gaussian,COMPLETE
432,0.0054343082010746,2025-07-18 13:41:19.356023,2025-07-18 13:42:25.404848,0 days 00:01:06.048825,prod,32,0.007077189603647647,5,8,gaussian,COMPLETE
433,0.00032559054670855403,2025-07-18 13:42:25.405943,2025-07-18 13:45:33.138702,0 days 00:03:07.732759,prod,16,0.008669048731828591,5,18,gaussian,COMPLETE
434,0.0009267841815017164,2025-07-18 13:45:33.139731,2025-07-18 13:48:49.069323,0 days 00:03:15.929592,prod,16,0.006317823311843178,5,19,gaussian,COMPLETE
435,0.00031940662302076817,2025-07-18 13:48:49.070423,2025-07-18 13:51:40.928196,0 days 00:02:51.857773,prod,16,0.007738397645705827,5,16,gaussian,COMPLETE
436,0.003294949419796467,2025-07-18 13:51:40.929314,2025-07-18 13:54:25.065013,0 days 00:02:44.135699,prod,16,0.008607979678180569,6,13,bell,COMPLETE
437,0.1838214099407196,2025-07-18 13:54:25.066119,2025-07-18 13:55:01.993894,0 days 00:00:36.927775,min,128,0.005344342896822647,5,18,gaussian,COMPLETE
438,0.00032343584462068975,2025-07-18 13:55:01.994753,2025-07-18 13:58:55.251917,0 days 00:03:53.257164,prod,16,0.00691424875759598,5,24,gaussian,COMPLETE
439,0.0003550951660145074,2025-07-18 13:58:55.252942,2025-07-18 14:02:25.808485,0 days 00:03:30.555543,prod,16,0.008733666093872062,5,21,gaussian,COMPLETE
440,0.02083429880440235,2025-07-18 14:02:25.809678,2025-07-18 14:06:03.781863,0 days 00:03:37.972185,prod,16,0.0062182399573667965,5,22,gaussian,COMPLETE
441,0.0002752534637693316,2025-07-18 14:06:03.782950,2025-07-18 14:09:26.763507,0 days 00:03:22.980557,prod,16,0.007576338963894078,5,20,gaussian,COMPLETE
442,0.00030592578696087003,2025-07-18 14:09:26.764611,2025-07-18 14:12:49.644408,0 days 00:03:22.879797,prod,16,0.009956372239409572,5,20,gaussian,COMPLETE
443,0.006920143496245146,2025-07-18 14:12:49.645509,2025-07-18 14:16:12.847095,0 days 00:03:23.201586,prod,16,0.007876845853517542,5,20,gaussian,COMPLETE
444,1.0573359727859497,2025-07-18 14:16:12.848235,2025-07-18 14:17:21.042349,0 days 00:01:08.194114,min,64,0.007509214885426482,5,20,gaussian,COMPLETE
445,0.02912137098610401,2025-07-18 14:17:21.043419,2025-07-18 14:20:36.489069,0 days 00:03:15.445650,prod,16,0.008674151984883442,5,19,gaussian,COMPLETE
446,0.3420882225036621,2025-07-18 14:20:36.490199,2025-07-18 14:22:31.944293,0 days 00:01:55.454094,prod,32,0.007397502778632393,5,20,gaussian,COMPLETE
447,0.19537250697612762,2025-07-18 14:22:31.945404,2025-07-18 14:24:02.701325,0 days 00:01:30.755921,prod,16,0.0006455156348287251,5,5,gaussian,COMPLETE
448,0.00029740348691120744,2025-07-18 14:24:02.702344,2025-07-18 14:27:37.539282,0 days 00:03:34.836938,prod,16,0.008953535663575643,5,21,bell,COMPLETE
449,0.01570894382894039,2025-07-18 14:27:37.540391,2025-07-18 14:30:53.181990,0 days 00:03:15.641599,prod,16,0.006633711005176621,5,19,gaussian,COMPLETE
450,0.01562681794166565,2025-07-18 14:30:53.183157,2025-07-18 14:33:51.114273,0 days 00:02:57.931116,min,16,0.007788161411493839,5,17,sigmoid,COMPLETE
451,0.015122642740607262,2025-07-18 14:33:51.115381,2025-07-18 14:36:43.443999,0 days 00:02:52.328618,prod,16,0.00999708413991348,5,16,gaussian,COMPLETE
452,0.018349742516875267,2025-07-18 14:36:43.445005,2025-07-18 14:40:15.948888,0 days 00:03:32.503883,prod,16,0.006682558439961618,5,21,gaussian,COMPLETE
453,0.0173106137663126,2025-07-18 14:40:15.949969,2025-07-18 14:43:25.270376,0 days 00:03:09.320407,prod,16,0.008144713125802935,5,18,gaussian,COMPLETE
454,0.004037243314087391,2025-07-18 14:43:25.271399,2025-07-18 14:46:49.176739,0 days 00:03:23.905340,prod,16,0.006228165398507127,5,20,gaussian,COMPLETE
455,0.00029105853172950447,2025-07-18 14:46:49.177899,2025-07-18 14:50:07.480366,0 days 00:03:18.302467,prod,16,0.008851152159082668,8,17,gaussian,COMPLETE
456,0.008601322770118713,2025-07-18 14:50:07.481478,2025-07-18 14:54:10.241300,0 days 00:04:02.759822,prod,16,0.009273797797100714,5,25,gaussian,COMPLETE
457,0.030031809583306313,2025-07-18 14:54:10.242350,2025-07-18 14:57:52.800756,0 days 00:03:42.558406,min,16,0.008825512176887531,8,20,gaussian,COMPLETE
458,0.0003026643244083971,2025-07-18 14:57:52.801822,2025-07-18 15:01:27.661168,0 days 00:03:34.859346,prod,16,0.007948138813635418,8,19,gaussian,COMPLETE
459,0.48980486392974854,2025-07-18 15:01:27.662220,2025-07-18 15:03:17.682245,0 days 00:01:50.020025,prod,32,0.00879016176602149,8,18,gaussian,COMPLETE
460,0.07671625912189484,2025-07-18 15:03:17.683338,2025-07-18 15:06:35.716181,0 days 00:03:18.032843,prod,16,0.007290649067142517,8,17,gaussian,COMPLETE
461,0.0018543506739661098,2025-07-18 15:06:35.717300,2025-07-18 15:10:01.901961,0 days 00:03:26.184661,prod,16,0.00903334326284037,8,18,gaussian,COMPLETE
462,0.0003025998594239354,2025-07-18 15:10:01.903054,2025-07-18 15:13:30.891155,0 days 00:03:28.988101,prod,16,0.007669468147961303,5,20,bell,COMPLETE
463,0.04977487027645111,2025-07-18 15:13:30.892257,2025-07-18 15:16:40.965724,0 days 00:03:10.073467,prod,16,0.009856179557893514,8,16,gaussian,COMPLETE
464,0.13058315217494965,2025-07-18 15:16:40.966821,2025-07-18 15:17:22.460556,0 days 00:00:41.493735,min,128,0.007115188966593966,8,19,gaussian,COMPLETE
465,1.9936400651931763,2025-07-18 15:17:22.461275,2025-07-18 15:20:41.265372,0 days 00:03:18.804097,prod,16,0.00018381982251697792,8,17,gaussian,COMPLETE
466,0.0003030401421710849,2025-07-18 15:20:41.266445,2025-07-18 15:24:17.096475,0 days 00:03:35.830030,prod,16,0.008174393172716428,8,19,gaussian,COMPLETE
467,0.0003825888270512223,2025-07-18 15:24:17.097597,2025-07-18 15:26:53.647550,0 days 00:02:36.549953,prod,16,0.009991036846919306,5,14,gaussian,COMPLETE
468,0.008859725669026375,2025-07-18 15:26:53.648601,2025-07-18 15:30:47.072204,0 days 00:03:53.423603,prod,16,0.005885325521028076,8,21,gaussian,COMPLETE
469,0.04463079571723938,2025-07-18 15:30:47.073307,2025-07-18 15:31:50.339189,0 days 00:01:03.265882,prod,64,0.007138434522086728,5,18,gaussian,COMPLETE
470,0.0005871787434443831,2025-07-18 15:31:50.340251,2025-07-18 15:34:49.999058,0 days 00:02:59.658807,min,16,0.008537296483207321,5,17,gaussian,COMPLETE
471,0.13139279186725616,2025-07-18 15:34:50.000077,2025-07-18 15:38:02.040286,0 days 00:03:12.040209,prod,16,0.005449547211952521,7,16,gaussian,COMPLETE
472,0.5680662393569946,2025-07-18 15:38:02.041323,2025-07-18 15:41:54.011735,0 days 00:03:51.970412,prod,16,2.2739410713776852e-05,9,20,sigmoid,COMPLETE
473,0.0003545758663676679,2025-07-18 15:41:54.012813,2025-07-18 15:45:50.203521,0 days 00:03:56.190708,prod,16,0.0064874720493389056,5,24,gaussian,COMPLETE
474,0.061740390956401825,2025-07-18 15:45:50.204576,2025-07-18 15:48:08.443109,0 days 00:02:18.238533,prod,32,0.007888733181240972,5,25,gaussian,COMPLETE
475,0.002655383199453354,2025-07-18 15:48:08.444139,2025-07-18 15:51:37.720905,0 days 00:03:29.276766,prod,16,0.009031298631212683,5,20,bell,COMPLETE
476,0.0020109342876821756,2025-07-18 15:51:37.721957,2025-07-18 15:54:37.225394,0 days 00:02:59.503437,min,16,0.009984764501162065,5,17,gaussian,COMPLETE
477,0.0003333838831167668,2025-07-18 15:54:37.226401,2025-07-18 15:57:45.775536,0 days 00:03:08.549135,prod,16,0.006830373814020246,5,18,gaussian,COMPLETE
478,0.0010561825474724174,2025-07-18 15:57:45.776551,2025-07-18 16:01:01.385291,0 days 00:03:15.608740,prod,16,0.007971099709690557,5,19,gaussian,COMPLETE
479,0.014271234162151814,2025-07-18 16:01:01.386327,2025-07-18 16:03:38.563417,0 days 00:02:37.177090,prod,16,0.005819944775839671,8,12,gaussian,COMPLETE
480,0.0007164435810409486,2025-07-18 16:03:38.564401,2025-07-18 16:07:09.712084,0 days 00:03:31.147683,prod,16,0.007372829139318913,5,21,gaussian,COMPLETE
481,0.05523516237735748,2025-07-18 16:07:09.713159,2025-07-18 16:10:02.084397,0 days 00:02:52.371238,prod,16,0.0030482520417865534,5,16,gaussian,COMPLETE
482,0.00033612141851335764,2025-07-18 16:10:02.085407,2025-07-18 16:13:16.964288,0 days 00:03:14.878881,min,16,0.008768509305106628,5,19,gaussian,COMPLETE
483,0.021789833903312683,2025-07-18 16:13:16.979878,2025-07-18 16:17:13.568820,0 days 00:03:56.588942,prod,16,0.009973331065150273,5,24,gaussian,COMPLETE
484,0.0004326194175519049,2025-07-18 16:17:13.569852,2025-07-18 16:20:06.257842,0 days 00:02:52.687990,prod,16,0.005062482035160368,5,16,gaussian,COMPLETE
485,0.002116377465426922,2025-07-18 16:20:06.258895,2025-07-18 16:23:15.962551,0 days 00:03:09.703656,prod,16,0.006207284621040241,5,18,gaussian,COMPLETE
486,0.000551250297576189,2025-07-18 16:23:15.963602,2025-07-18 16:25:00.475968,0 days 00:01:44.512366,prod,32,0.007894574166977522,5,17,bell,COMPLETE
487,0.1701425015926361,2025-07-18 16:25:00.477040,2025-07-18 16:25:40.868257,0 days 00:00:40.391217,prod,128,0.006959394128623334,5,20,gaussian,COMPLETE
488,0.00037577690090984106,2025-07-18 16:25:40.869058,2025-07-18 16:27:51.989134,0 days 00:02:11.120076,prod,16,0.0018685584594321208,5,10,gaussian,COMPLETE
489,0.00030401235562749207,2025-07-18 16:27:51.990117,2025-07-18 16:30:59.641674,0 days 00:03:07.651557,min,16,0.008560880652637633,5,18,gaussian,COMPLETE
490,1.7992093563079834,2025-07-18 16:30:59.642756,2025-07-18 16:33:44.218188,0 days 00:02:44.575432,prod,16,0.00013529298482128324,5,15,gaussian,COMPLETE
491,0.0003167021495755762,2025-07-18 16:33:44.219250,2025-07-18 16:37:16.251994,0 days 00:03:32.032744,prod,16,0.005774728211216072,5,21,gaussian,COMPLETE
492,0.0007078825728967786,2025-07-18 16:37:16.253023,2025-07-18 16:39:53.143692,0 days 00:02:36.890669,prod,16,0.0071712619369864285,5,14,gaussian,COMPLETE
493,3.142977237701416,2025-07-18 16:39:53.144739,2025-07-18 16:43:38.825544,0 days 00:03:45.680805,prod,16,0.00044473643319222666,8,20,gaussian,COMPLETE
494,0.0005634112167172134,2025-07-18 16:43:38.826591,2025-07-18 16:46:38.249352,0 days 00:02:59.422761,prod,16,0.008603348188929522,5,17,sigmoid,COMPLETE
495,0.23720331490039825,2025-07-18 16:46:38.250356,2025-07-18 16:47:17.548382,0 days 00:00:39.298026,min,64,0.006394452335201574,5,9,gaussian,COMPLETE
496,0.0003169882111251354,2025-07-18 16:47:17.549232,2025-07-18 16:50:33.872992,0 days 00:03:16.323760,prod,16,0.007774834619835349,5,19,gaussian,COMPLETE
497,0.03093586303293705,2025-07-18 16:50:33.874023,2025-07-18 16:53:26.399820,0 days 00:02:52.525797,prod,16,0.005065091362068718,5,16,gaussian,COMPLETE
498,0.00028326164465397596,2025-07-18 16:53:26.400894,2025-07-18 16:56:42.664196,0 days 00:03:16.263302,prod,16,0.008841366746713179,5,19,gaussian,COMPLETE
499,0.003095885505899787,2025-07-18 16:56:42.665300,2025-07-18 16:59:58.916927,0 days 00:03:16.251627,prod,16,0.006820496038332849,5,19,gaussian,COMPLETE
