number,value,datetime_start,datetime_complete,duration,params_and_operator,params_batch_size,params_lr,params_n_sets,params_seq_length,params_shape,state
283,0.002892004558816552,2025-07-18 06:07:03.825309,2025-07-18 06:10:34.471583,0 days 00:03:30.646274,prod,16,0.004243251386996705,5,21,gaussian,COMPLETE
284,0.002715531038120389,2025-07-18 06:10:34.472555,2025-07-18 06:14:21.244300,0 days 00:03:46.771745,prod,16,0.0069731073480207685,5,23,gaussian,COMPLETE
285,0.00043798336992040277,2025-07-18 06:14:21.245330,2025-07-18 06:17:21.350613,0 days 00:03:00.105283,prod,16,0.005804225813055045,5,17,gaussian,COMPLETE
286,0.000291757402010262,2025-07-18 06:17:21.351667,2025-07-18 06:20:44.787469,0 days 00:03:23.435802,prod,16,0.009919701250354724,5,20,gaussian,COMPLETE
287,0.00026315104332752526,2025-07-18 06:20:44.788502,2025-07-18 06:24:07.963224,0 days 00:03:23.174722,prod,16,0.009344723309447302,5,20,gaussian,COMPLETE
288,0.014778255484998226,2025-07-18 06:24:07.964277,2025-07-18 06:24:48.245557,0 days 00:00:40.281280,prod,128,0.009387702710530518,5,20,gaussian,COMPLETE
289,0.0003124537179246545,2025-07-18 06:24:48.246241,2025-07-18 06:28:11.028929,0 days 00:03:22.782688,prod,16,0.009768198159984944,5,20,gaussian,COMPLETE
290,0.09671913832426071,2025-07-18 06:28:11.029872,2025-07-18 06:31:40.246477,0 days 00:03:29.216605,prod,16,0.009890319881030469,5,21,sigmoid,COMPLETE
291,0.027533918619155884,2025-07-18 06:31:40.247546,2025-07-18 06:35:27.138143,0 days 00:03:46.890597,prod,16,0.008507764051753226,7,20,gaussian,COMPLETE
292,0.0003671601298265159,2025-07-18 06:35:27.139213,2025-07-18 06:38:49.718526,0 days 00:03:22.579313,prod,16,0.008276844325365325,5,20,gaussian,COMPLETE
293,0.7408019304275513,2025-07-18 06:38:49.719573,2025-07-18 06:39:58.059653,0 days 00:01:08.340080,prod,64,0.005037590666496953,5,20,gaussian,COMPLETE
294,0.04700165614485741,2025-07-18 06:39:58.060582,2025-07-18 06:42:00.661220,0 days 00:02:02.600638,prod,32,0.006632828778795296,5,21,bell,COMPLETE
295,0.0005113051738590002,2025-07-18 06:42:00.662255,2025-07-18 06:43:39.540454,0 days 00:01:38.878199,prod,16,0.009952473864481516,5,6,gaussian,COMPLETE
296,0.03666849434375763,2025-07-18 06:43:39.541396,2025-07-18 06:47:02.491878,0 days 00:03:22.950482,prod,16,0.0005216297060960049,5,20,gaussian,COMPLETE
297,0.0002491669147275388,2025-07-18 06:47:02.492910,2025-07-18 06:50:17.890177,0 days 00:03:15.397267,prod,16,0.00754422780000338,5,19,gaussian,COMPLETE
298,0.0008361379732377827,2025-07-18 06:50:17.891207,2025-07-18 06:53:48.813015,0 days 00:03:30.921808,prod,16,0.008352890861448489,5,21,gaussian,COMPLETE
299,0.00029129136237315834,2025-07-18 06:53:48.814075,2025-07-18 06:57:42.476418,0 days 00:03:53.662343,prod,16,0.007593943515807678,5,24,gaussian,COMPLETE
300,0.005851301364600658,2025-07-18 06:57:42.477448,2025-07-18 07:01:44.453220,0 days 00:04:01.975772,prod,16,0.007515656941357993,5,25,gaussian,COMPLETE
301,0.003817251417785883,2025-07-18 07:01:44.454280,2025-07-18 07:05:37.881089,0 days 00:03:53.426809,min,16,0.005834587633457344,5,24,gaussian,COMPLETE
302,0.11003254354000092,2025-07-18 07:05:37.882117,2025-07-18 07:09:16.455096,0 days 00:03:38.572979,prod,16,0.008858676788257852,5,22,gaussian,COMPLETE
303,0.0029638856649398804,2025-07-18 07:09:16.456101,2025-07-18 07:13:10.327292,0 days 00:03:53.871191,prod,16,0.007457078118336815,5,24,gaussian,COMPLETE
304,0.0002889181487262249,2025-07-18 07:13:10.328327,2025-07-18 07:17:03.991658,0 days 00:03:53.663331,prod,16,0.006415234373305893,5,24,gaussian,COMPLETE
305,0.8786961436271667,2025-07-18 07:17:03.992635,2025-07-18 07:21:23.131996,0 days 00:04:19.139361,prod,16,0.0008741686097973603,8,24,gaussian,COMPLETE
306,0.0003380830748938024,2025-07-18 07:21:23.133053,2025-07-18 07:25:08.908014,0 days 00:03:45.774961,prod,16,0.008904909715384763,5,23,gaussian,COMPLETE
307,0.002114687580615282,2025-07-18 07:25:08.909005,2025-07-18 07:29:06.775724,0 days 00:03:57.866719,prod,16,0.0068754710536201675,5,24,bell,COMPLETE
308,0.0007131960010156035,2025-07-18 07:29:06.776761,2025-07-18 07:31:24.629135,0 days 00:02:17.852374,prod,32,0.004557368574771634,5,25,gaussian,COMPLETE
309,0.0011154463281854987,2025-07-18 07:31:24.630142,2025-07-18 07:35:18.173724,0 days 00:03:53.543582,prod,16,0.008026085067808306,5,24,gaussian,COMPLETE
310,0.047103144228458405,2025-07-18 07:35:18.174806,2025-07-18 07:39:04.053199,0 days 00:03:45.878393,prod,16,0.005658311307931343,5,23,gaussian,COMPLETE
311,0.0003450048970989883,2025-07-18 07:39:04.054206,2025-07-18 07:42:57.964962,0 days 00:03:53.910756,prod,16,0.009992633160844954,5,24,gaussian,COMPLETE
312,0.001793457311578095,2025-07-18 07:42:57.966056,2025-07-18 07:46:44.042699,0 days 00:03:46.076643,prod,16,0.006391901696512704,5,23,gaussian,COMPLETE
313,0.6966679096221924,2025-07-18 07:46:44.043754,2025-07-18 07:47:36.937764,0 days 00:00:52.894010,prod,128,0.007465003792425082,7,25,sigmoid,COMPLETE
314,0.006626966409385204,2025-07-18 07:47:36.938578,2025-07-18 07:51:29.987033,0 days 00:03:53.048455,prod,16,0.008280795419283579,9,20,gaussian,COMPLETE
315,0.000616003992035985,2025-07-18 07:51:29.988054,2025-07-18 07:55:08.364219,0 days 00:03:38.376165,prod,16,0.005013787303082039,5,22,gaussian,COMPLETE
316,0.0005807114066556096,2025-07-18 07:55:08.365291,2025-07-18 07:58:54.399156,0 days 00:03:46.033865,prod,16,0.006583389650569014,5,23,gaussian,COMPLETE
317,0.0006950050592422485,2025-07-18 07:58:54.400200,2025-07-18 08:03:10.452032,0 days 00:04:16.051832,prod,16,0.008874599554062853,6,24,gaussian,COMPLETE
318,0.01397473644465208,2025-07-18 08:03:10.453123,2025-07-18 08:04:16.354833,0 days 00:01:05.901710,prod,64,0.007261256063683522,5,19,gaussian,COMPLETE
319,0.00032233574893325567,2025-07-18 08:04:16.355810,2025-07-18 08:07:47.326518,0 days 00:03:30.970708,prod,16,0.005808386617111537,5,21,gaussian,COMPLETE
320,0.02121691219508648,2025-07-18 08:07:47.327604,2025-07-18 08:10:39.679449,0 days 00:02:52.351845,prod,16,0.008042999055155254,5,16,gaussian,COMPLETE
321,0.008218242786824703,2025-07-18 08:10:39.680473,2025-07-18 08:14:38.392007,0 days 00:03:58.711534,prod,16,0.009942971642728135,5,24,bell,COMPLETE
322,0.004120173864066601,2025-07-18 08:14:38.393094,2025-07-18 08:16:33.988543,0 days 00:01:55.595449,min,32,0.006444091112577831,5,20,gaussian,COMPLETE
323,0.07193940877914429,2025-07-18 08:16:33.989623,2025-07-18 08:20:36.201611,0 days 00:04:02.211988,prod,16,0.0032998224626436035,5,25,gaussian,COMPLETE
324,0.000744349614251405,2025-07-18 08:20:36.202704,2025-07-18 08:23:51.600775,0 days 00:03:15.398071,prod,16,0.003903719661286188,5,19,gaussian,COMPLETE
325,0.01377718523144722,2025-07-18 08:23:51.601859,2025-07-18 08:26:43.925895,0 days 00:02:52.324036,prod,16,0.005320157440363106,5,16,gaussian,COMPLETE
326,0.0002989236090797931,2025-07-18 08:26:43.926995,2025-07-18 08:30:22.421207,0 days 00:03:38.494212,prod,16,0.007313842580731729,5,22,gaussian,COMPLETE
327,0.0003966588992625475,2025-07-18 08:30:22.422246,2025-07-18 08:34:00.799530,0 days 00:03:38.377284,prod,16,0.008574577803090285,5,22,gaussian,COMPLETE
328,0.04315211996436119,2025-07-18 08:34:00.800623,2025-07-18 08:37:46.975946,0 days 00:03:46.175323,prod,16,0.007338082755352652,5,23,gaussian,COMPLETE
329,0.03317861631512642,2025-07-18 08:37:46.976967,2025-07-18 08:41:33.321214,0 days 00:03:46.344247,prod,16,0.009098461923799234,5,23,gaussian,COMPLETE
330,0.006315368693321943,2025-07-18 08:41:33.322305,2025-07-18 08:44:56.481411,0 days 00:03:23.159106,prod,16,0.00731862177193088,5,20,gaussian,COMPLETE
331,0.006682690232992172,2025-07-18 08:44:56.482438,2025-07-18 08:48:58.596334,0 days 00:04:02.113896,prod,16,0.007810615046340919,8,22,gaussian,COMPLETE
332,0.0003617799957282841,2025-07-18 08:48:58.597410,2025-07-18 08:52:52.340773,0 days 00:03:53.743363,prod,16,0.00660325747356554,5,24,gaussian,COMPLETE
333,0.0006142453639768064,2025-07-18 08:52:52.341877,2025-07-18 08:56:27.073532,0 days 00:03:34.731655,prod,16,0.008874396008192639,5,21,bell,COMPLETE
334,0.00030503550078719854,2025-07-18 08:56:27.074642,2025-07-18 09:00:13.218956,0 days 00:03:46.144314,prod,16,0.009923861197344295,5,23,gaussian,COMPLETE
335,2.058750867843628,2025-07-18 09:00:13.219980,2025-07-18 09:02:22.452608,0 days 00:02:09.232628,prod,32,0.002122771737993163,5,23,gaussian,COMPLETE
336,0.12473474442958832,2025-07-18 09:02:22.453709,2025-07-18 09:05:38.115960,0 days 00:03:15.662251,prod,16,0.007014462758787482,5,19,gaussian,COMPLETE
337,0.0003642818483058363,2025-07-18 09:05:38.117071,2025-07-18 09:09:16.279278,0 days 00:03:38.162207,prod,16,0.00589372889320201,5,22,gaussian,COMPLETE
338,0.0005303395446389914,2025-07-18 09:09:16.280390,2025-07-18 09:13:08.243442,0 days 00:03:51.963052,prod,16,0.008130555740000867,5,24,sigmoid,COMPLETE
339,0.28680649399757385,2025-07-18 09:13:08.244491,2025-07-18 09:13:43.673535,0 days 00:00:35.429044,prod,128,0.004666583650162417,5,17,gaussian,COMPLETE
340,0.0005253921262919903,2025-07-18 09:13:43.674259,2025-07-18 09:17:11.722262,0 days 00:03:28.048003,prod,16,0.006548729390148697,5,19,gaussian,COMPLETE
341,0.00027282070368528366,2025-07-18 09:17:11.723421,2025-07-18 09:20:37.990626,0 days 00:03:26.267205,min,16,0.008110109636267194,5,20,gaussian,COMPLETE
342,0.023520782589912415,2025-07-18 09:20:37.991726,2025-07-18 09:24:00.977962,0 days 00:03:22.986236,min,16,0.008783608203794082,5,20,gaussian,COMPLETE
343,0.02672375738620758,2025-07-18 09:24:00.979042,2025-07-18 09:27:23.518177,0 days 00:03:22.539135,min,16,9.223092416648866e-05,5,20,gaussian,COMPLETE
344,0.6869520545005798,2025-07-18 09:27:23.519252,2025-07-18 09:27:51.923434,0 days 00:00:28.404182,prod,64,0.008055191441172118,5,5,gaussian,COMPLETE
345,0.0011213365942239761,2025-07-18 09:27:51.924089,2025-07-18 09:31:14.970525,0 days 00:03:23.046436,prod,16,0.008999802668844424,5,20,gaussian,COMPLETE
346,0.0003313942579552531,2025-07-18 09:31:14.971586,2025-07-18 09:34:18.021204,0 days 00:03:03.049618,min,16,0.00552572714203661,5,17,bell,COMPLETE
347,0.034660454839468,2025-07-18 09:34:18.022312,2025-07-18 09:37:48.390441,0 days 00:03:30.368129,min,16,0.0063939022923734075,5,21,gaussian,COMPLETE
348,0.1583590805530548,2025-07-18 09:37:48.391538,2025-07-18 09:41:03.189833,0 days 00:03:14.798295,min,16,0.007382777471630417,5,19,gaussian,COMPLETE
349,1.3287445306777954,2025-07-18 09:41:03.190875,2025-07-18 09:42:35.962372,0 days 00:01:32.771497,min,32,0.001607457343692495,5,15,gaussian,COMPLETE
350,0.0003460150328464806,2025-07-18 09:42:35.963380,2025-07-18 09:46:16.908560,0 days 00:03:40.945180,min,16,0.009966553122873579,6,20,gaussian,COMPLETE
351,0.0002955254167318344,2025-07-18 09:46:16.909566,2025-07-18 09:49:01.241679,0 days 00:02:44.332113,prod,16,0.008078574475122445,5,15,gaussian,COMPLETE
352,1.055363416671753,2025-07-18 09:49:01.242774,2025-07-18 09:51:45.561998,0 days 00:02:44.319224,prod,16,0.0002501297828749961,5,15,gaussian,COMPLETE
353,0.0016889501130208373,2025-07-18 09:51:45.563082,2025-07-18 09:54:29.451382,0 days 00:02:43.888300,min,16,0.008447765670533038,5,15,gaussian,COMPLETE
354,0.0007253045332618058,2025-07-18 09:54:29.452424,2025-07-18 09:57:44.584947,0 days 00:03:15.132523,prod,16,0.005125064793105356,5,19,gaussian,COMPLETE
355,0.0006294532213360071,2025-07-18 09:57:44.585980,2025-07-18 10:01:40.307719,0 days 00:03:55.721739,prod,16,0.00996367079712681,7,21,gaussian,COMPLETE
356,0.0003218814672436565,2025-07-18 10:01:40.308791,2025-07-18 10:05:41.457888,0 days 00:04:01.149097,prod,16,0.007826550409567515,5,25,gaussian,COMPLETE
357,0.00040345912566408515,2025-07-18 10:05:41.458983,2025-07-18 10:08:25.951146,0 days 00:02:44.492163,prod,16,0.006579835919074706,5,15,gaussian,COMPLETE
358,0.0035389484837651253,2025-07-18 10:08:25.993277,2025-07-18 10:11:45.617043,0 days 00:03:19.623766,prod,16,0.0060166047588924325,5,19,bell,COMPLETE
359,0.1315290927886963,2025-07-18 10:11:45.618120,2025-07-18 10:14:22.423590,0 days 00:02:36.805470,prod,16,0.00856588915499144,5,14,gaussian,COMPLETE
360,0.0003522424085531384,2025-07-18 10:14:22.424649,2025-07-18 10:17:45.418759,0 days 00:03:22.994110,prod,16,0.0070399351573268145,5,20,gaussian,COMPLETE
361,0.06816162168979645,2025-07-18 10:17:45.419893,2025-07-18 10:21:37.937651,0 days 00:03:52.517758,prod,16,0.007851164782378343,5,24,sigmoid,COMPLETE
362,0.27363917231559753,2025-07-18 10:21:37.938743,2025-07-18 10:22:13.416705,0 days 00:00:35.477962,prod,128,0.0003591625669915277,5,17,gaussian,COMPLETE
363,0.012470816262066364,2025-07-18 10:22:13.417435,2025-07-18 10:23:46.526241,0 days 00:01:33.108806,prod,32,0.005743400430382338,5,15,gaussian,COMPLETE
364,0.021175555884838104,2025-07-18 10:23:46.527274,2025-07-18 10:27:09.382441,0 days 00:03:22.855167,prod,16,0.008922926728288792,5,20,gaussian,COMPLETE
365,0.03299453854560852,2025-07-18 10:27:09.383592,2025-07-18 10:30:01.499030,0 days 00:02:52.115438,prod,16,0.004658431141988711,5,16,gaussian,COMPLETE
366,0.0015792394988238811,2025-07-18 10:30:01.500039,2025-07-18 10:33:37.961555,0 days 00:03:36.461516,prod,16,0.007000934794595884,8,19,gaussian,COMPLETE
367,0.000288965180516243,2025-07-18 10:33:37.962645,2025-07-18 10:37:31.907263,0 days 00:03:53.944618,min,16,0.009994187119312553,5,24,gaussian,COMPLETE
368,0.0011442337417975068,2025-07-18 10:37:31.908418,2025-07-18 10:41:02.342880,0 days 00:03:30.434462,min,16,0.009927045819494437,5,21,gaussian,COMPLETE
369,0.003172086551785469,2025-07-18 10:41:02.343886,2025-07-18 10:42:32.972606,0 days 00:01:30.628720,min,64,0.009992806015735564,9,25,gaussian,COMPLETE
370,0.00030543378670699894,2025-07-18 10:42:32.973671,2025-07-18 10:45:32.432871,0 days 00:02:59.459200,min,16,0.008586281008702266,5,17,gaussian,COMPLETE
371,0.00035231615765951574,2025-07-18 10:45:32.433816,2025-07-18 10:49:26.020948,0 days 00:03:53.587132,min,16,0.008031262720288842,5,24,gaussian,COMPLETE
372,0.05103917792439461,2025-07-18 10:49:26.022050,2025-07-18 10:52:13.506150,0 days 00:02:47.484100,min,16,0.008758800624585394,5,15,bell,COMPLETE
373,0.0003112895356025547,2025-07-18 10:52:13.507166,2025-07-18 10:54:49.521374,0 days 00:02:36.014208,min,16,0.006523963063449949,5,14,gaussian,COMPLETE
374,0.00028903144993819296,2025-07-18 10:54:49.522429,2025-07-18 10:56:43.905213,0 days 00:01:54.382784,min,16,0.007561753578940574,5,8,gaussian,COMPLETE
375,0.00040345778688788414,2025-07-18 10:56:43.906165,2025-07-18 11:00:29.835502,0 days 00:03:45.929337,min,16,0.0073496833792076645,5,23,gaussian,COMPLETE
376,0.0003284630656708032,2025-07-18 11:00:29.836549,2025-07-18 11:02:40.128759,0 days 00:02:10.292210,min,16,0.008906820460797351,5,10,gaussian,COMPLETE
377,0.013201549649238586,2025-07-18 11:02:40.129733,2025-07-18 11:04:34.473107,0 days 00:01:54.343374,min,16,0.005892671571527562,5,8,gaussian,COMPLETE
378,0.0017167568439617753,2025-07-18 11:04:34.474078,2025-07-18 11:05:35.380743,0 days 00:01:00.906665,min,32,0.009948081316883687,5,7,gaussian,COMPLETE
379,0.0008819611975923181,2025-07-18 11:05:35.381432,2025-07-18 11:07:56.112225,0 days 00:02:20.730793,min,16,0.005221398098428469,5,12,gaussian,COMPLETE
380,0.00032035261392593384,2025-07-18 11:07:56.113227,2025-07-18 11:11:03.449395,0 days 00:03:07.336168,min,16,0.007855650363345162,5,18,gaussian,COMPLETE
381,0.027364449575543404,2025-07-18 11:11:03.450423,2025-07-18 11:14:35.945590,0 days 00:03:32.495167,min,16,0.006874105892168068,6,19,gaussian,COMPLETE
382,0.0006346058216877282,2025-07-18 11:14:35.946688,2025-07-18 11:16:21.951036,0 days 00:01:46.004348,min,16,0.007978110742953777,5,7,gaussian,COMPLETE
383,0.0905592292547226,2025-07-18 11:16:21.952130,2025-07-18 11:19:42.808389,0 days 00:03:20.856259,min,16,0.004333529431398575,5,20,sigmoid,COMPLETE
384,0.003407711861655116,2025-07-18 11:19:42.809413,2025-07-18 11:22:49.775137,0 days 00:03:06.965724,min,16,0.008852901264920074,5,18,gaussian,COMPLETE
385,0.0004358803271315992,2025-07-18 11:22:49.776219,2025-07-18 11:26:12.633758,0 days 00:03:22.857539,prod,16,0.00620767941225091,5,20,gaussian,COMPLETE
386,0.0006410033092834055,2025-07-18 11:26:12.634823,2025-07-18 11:30:02.911703,0 days 00:03:50.276880,prod,16,0.007328654012782699,5,23,bell,COMPLETE
387,1.1212774515151978,2025-07-18 11:30:02.912756,2025-07-18 11:33:33.638833,0 days 00:03:30.726077,prod,16,3.234383567573957e-05,5,21,gaussian,COMPLETE
388,0.14701785147190094,2025-07-18 11:33:33.639907,2025-07-18 11:33:56.538938,0 days 00:00:22.899031,prod,128,0.005217232022039421,5,9,gaussian,COMPLETE
389,0.08044344186782837,2025-07-18 11:33:56.539446,2025-07-18 11:37:50.400645,0 days 00:03:53.861199,prod,16,0.008910212682907193,5,24,gaussian,COMPLETE
390,0.000306784815620631,2025-07-18 11:37:50.401649,2025-07-18 11:41:51.974737,0 days 00:04:01.573088,prod,16,0.006526487840448596,5,25,gaussian,COMPLETE
391,0.00044912894372828305,2025-07-18 11:41:51.975860,2025-07-18 11:45:06.607489,0 days 00:03:14.631629,min,16,0.007785351818049114,5,19,gaussian,COMPLETE
392,0.15116620063781738,2025-07-18 11:45:06.608495,2025-07-18 11:46:48.300944,0 days 00:01:41.692449,prod,32,0.005931068892283242,5,17,gaussian,COMPLETE
393,0.2125127613544464,2025-07-18 11:46:48.301949,2025-07-18 11:49:22.144337,0 days 00:02:33.842388,prod,16,0.001284903368516789,7,11,gaussian,COMPLETE
394,0.00021288530842866749,2025-07-18 11:49:22.145366,2025-07-18 11:52:29.842308,0 days 00:03:07.696942,prod,16,0.008631967263367697,5,18,gaussian,COMPLETE
395,0.0007851962582208216,2025-07-18 11:52:29.843402,2025-07-18 11:53:33.158212,0 days 00:01:03.314810,prod,64,0.009054482630327428,5,18,gaussian,COMPLETE
396,0.007224364671856165,2025-07-18 11:53:33.159286,2025-07-18 11:55:52.158696,0 days 00:02:18.999410,prod,16,0.009778935531531915,5,11,gaussian,COMPLETE
397,0.00032412962173111737,2025-07-18 11:55:52.159672,2025-07-18 11:58:59.671455,0 days 00:03:07.511783,prod,16,0.0073612606833414725,5,18,gaussian,COMPLETE
398,0.0007604279671795666,2025-07-18 11:58:59.672470,2025-07-18 12:02:11.183337,0 days 00:03:11.510867,prod,16,0.006717380468289107,5,18,bell,COMPLETE
399,0.0003603105724323541,2025-07-18 12:02:11.184350,2025-07-18 12:05:25.877476,0 days 00:03:14.693126,min,16,0.009911367269871215,5,19,gaussian,COMPLETE
400,0.0003114132268819958,2025-07-18 12:05:25.878535,2025-07-18 12:08:33.395817,0 days 00:03:07.517282,prod,16,0.0037374772032717843,5,18,gaussian,COMPLETE
401,0.001787153072655201,2025-07-18 12:08:33.396844,2025-07-18 12:11:33.288198,0 days 00:02:59.891354,prod,16,0.00521719007216949,5,17,gaussian,COMPLETE
402,0.00035057624336332083,2025-07-18 12:11:33.289261,2025-07-18 12:14:56.374652,0 days 00:03:23.085391,prod,16,0.008189270125576747,5,20,gaussian,COMPLETE
403,0.00840288307517767,2025-07-18 12:14:56.375727,2025-07-18 12:17:56.242768,0 days 00:02:59.867041,prod,16,0.009997082959132894,5,17,gaussian,COMPLETE
404,0.00030152921681292355,2025-07-18 12:17:56.244971,2025-07-18 12:21:50.008357,0 days 00:03:53.763386,prod,16,0.005961070069298715,5,24,gaussian,COMPLETE
405,0.21604111790657043,2025-07-18 12:21:50.009421,2025-07-18 12:23:00.247018,0 days 00:01:10.237597,prod,32,6.210285338917932e-05,5,9,sigmoid,COMPLETE
406,0.0014034295454621315,2025-07-18 12:23:00.248018,2025-07-18 12:26:07.224298,0 days 00:03:06.976280,min,16,0.007074438879515283,5,18,gaussian,COMPLETE
407,0.25184571743011475,2025-07-18 12:26:07.225362,2025-07-18 12:29:22.390391,0 days 00:03:15.165029,prod,16,0.008421767639293257,5,19,gaussian,COMPLETE
408,0.00623317388817668,2025-07-18 12:29:22.391467,2025-07-18 12:32:45.454825,0 days 00:03:23.063358,prod,16,0.004764865710127403,5,20,gaussian,COMPLETE
409,0.00030245233210735023,2025-07-18 12:32:45.455895,2025-07-18 12:36:16.136395,0 days 00:03:30.680500,prod,16,0.006797590740553099,5,21,gaussian,COMPLETE
410,0.002519430359825492,2025-07-18 12:36:16.137457,2025-07-18 12:39:31.269474,0 days 00:03:15.132017,prod,16,0.007733364914416288,5,19,gaussian,COMPLETE
411,0.00047725357580929995,2025-07-18 12:39:31.270531,2025-07-18 12:41:13.513738,0 days 00:01:42.243207,prod,16,0.006017592127751548,5,6,bell,COMPLETE
412,0.00029967332375235856,2025-07-18 12:41:13.514789,2025-07-18 12:44:59.529826,0 days 00:03:46.015037,prod,16,0.008807431243649374,5,23,gaussian,COMPLETE
413,0.0018580799223855138,2025-07-18 12:44:59.530903,2025-07-18 12:48:06.589780,0 days 00:03:07.058877,min,16,0.005412821213746555,5,18,gaussian,COMPLETE
414,0.11856015026569366,2025-07-18 12:48:06.590826,2025-07-18 12:51:52.734829,0 days 00:03:46.144003,prod,16,0.007605643359545712,5,23,gaussian,COMPLETE
415,0.021469444036483765,2025-07-18 12:51:52.735885,2025-07-18 12:54:52.702756,0 days 00:02:59.966871,prod,16,0.006587662196134782,5,17,gaussian,COMPLETE
416,0.03953970596194267,2025-07-18 12:54:52.703819,2025-07-18 12:55:29.797012,0 days 00:00:37.093193,prod,128,0.008758483294766254,5,18,gaussian,COMPLETE
417,0.009605039842426777,2025-07-18 12:55:29.797687,2025-07-18 12:59:08.642378,0 days 00:03:38.844691,prod,16,0.007172138304370114,5,22,gaussian,COMPLETE
418,0.000456134119303897,2025-07-18 12:59:08.643376,2025-07-18 13:03:02.843602,0 days 00:03:54.200226,prod,16,0.008757194774388468,5,24,gaussian,COMPLETE
419,0.8221412301063538,2025-07-18 13:03:02.844705,2025-07-18 13:05:01.781657,0 days 00:01:58.936952,min,32,0.004159507384022301,8,20,gaussian,COMPLETE
420,0.7558108568191528,2025-07-18 13:05:01.782767,2025-07-18 13:08:33.249428,0 days 00:03:31.466661,prod,16,0.002589054871316513,5,21,gaussian,COMPLETE
421,0.00044504180550575256,2025-07-18 13:08:33.250510,2025-07-18 13:10:20.235882,0 days 00:01:46.985372,prod,16,0.006242528651002118,5,7,gaussian,COMPLETE
422,0.0005895574577152729,2025-07-18 13:10:20.236926,2025-07-18 13:13:20.219717,0 days 00:02:59.982791,prod,16,0.007982896809557697,5,17,gaussian,COMPLETE
423,2.573431968688965,2025-07-18 13:13:20.220777,2025-07-18 13:14:28.299232,0 days 00:01:08.078455,prod,64,0.0010903837398089536,6,19,gaussian,COMPLETE
424,0.0003151395358145237,2025-07-18 13:14:28.300240,2025-07-18 13:17:47.466350,0 days 00:03:19.166110,prod,16,0.009989455747362095,5,19,bell,COMPLETE
