number,value,datetime_start,datetime_complete,duration,params_and_operator,params_batch_size,params_lr,params_n_sets,params_seq_length,params_shape,state
428,0.014739521779119968,2025-07-17 22:49:08.707310,2025-07-17 22:50:28.074562,0 days 00:01:19.367252,min,16,0.006498658413117016,6,22,gaussian,COMPLETE
429,0.4895932078361511,2025-07-17 22:50:28.075603,2025-07-17 22:51:49.874251,0 days 00:01:21.798648,min,16,0.008957335186477997,7,21,gaussian,COMPLETE
430,0.0005250016693025827,2025-07-17 22:51:49.875281,2025-07-17 22:53:08.389966,0 days 00:01:18.514685,min,16,0.005150162930073832,6,21,gaussian,COMPLETE
431,0.002366996370255947,2025-07-17 22:53:08.390981,2025-07-17 22:54:27.599562,0 days 00:01:19.208581,min,16,0.007628863471631251,6,22,gaussian,COMPLETE
432,0.039574719965457916,2025-07-17 22:54:27.600575,2025-07-17 22:55:47.760373,0 days 00:01:20.159798,prod,16,0.0038630647034890962,6,24,sigmoid,COMPLETE
433,0.23119670152664185,2025-07-17 22:55:47.761371,2025-07-17 22:56:08.429459,0 days 00:00:20.668088,min,128,0.0060689236642165745,6,20,gaussian,COMPLETE
434,0.00033294837339781225,2025-07-17 22:56:08.430017,2025-07-17 22:57:29.984932,0 days 00:01:21.554915,min,16,0.009945358064148846,7,21,gaussian,COMPLETE
435,0.0012907319469377398,2025-07-17 22:57:29.985987,2025-07-17 22:58:45.116833,0 days 00:01:15.130846,min,16,0.009098629930515514,6,17,gaussian,COMPLETE
436,0.014834752306342125,2025-07-17 22:58:45.117824,2025-07-17 22:59:59.875856,0 days 00:01:14.758032,min,16,0.009823958592769298,8,15,gaussian,COMPLETE
437,0.02330392599105835,2025-07-17 22:59:59.876875,2025-07-17 23:01:23.459092,0 days 00:01:23.582217,min,16,0.009992067966281841,7,23,gaussian,COMPLETE
438,0.08418616652488708,2025-07-17 23:01:23.460131,2025-07-17 23:02:44.318100,0 days 00:01:20.857969,prod,16,0.007361159326402927,6,23,gaussian,COMPLETE
439,0.0009396025561727583,2025-07-17 23:02:44.319111,2025-07-17 23:04:01.244084,0 days 00:01:16.924973,min,16,0.00810424470242154,6,21,sigmoid,COMPLETE
440,0.017642531543970108,2025-07-17 23:04:01.245085,2025-07-17 23:05:20.663619,0 days 00:01:19.418534,min,16,0.004766198348750467,6,22,gaussian,COMPLETE
441,0.0016182727413251996,2025-07-17 23:05:20.664641,2025-07-17 23:06:39.777657,0 days 00:01:19.113016,min,16,0.007077697368073419,6,22,gaussian,COMPLETE
442,0.28847283124923706,2025-07-17 23:06:39.778682,2025-07-17 23:07:58.213268,0 days 00:01:18.434586,min,16,0.0012164601229262446,6,21,gaussian,COMPLETE
443,0.001269376720301807,2025-07-17 23:07:58.214363,2025-07-17 23:09:20.733897,0 days 00:01:22.519534,prod,16,0.005927351963980582,6,25,gaussian,COMPLETE
444,0.7286144495010376,2025-07-17 23:09:20.734980,2025-07-17 23:09:48.380459,0 days 00:00:27.645479,min,64,0.008861388189993585,6,16,gaussian,COMPLETE
445,0.03226032108068466,2025-07-17 23:09:48.381018,2025-07-17 23:11:08.436865,0 days 00:01:20.055847,min,16,0.006742650432381392,7,21,sigmoid,COMPLETE
446,0.010173833929002285,2025-07-17 23:11:08.437919,2025-07-17 23:12:27.778059,0 days 00:01:19.340140,min,16,0.007874120928753421,6,22,gaussian,COMPLETE
447,0.10218020528554916,2025-07-17 23:12:27.779085,2025-07-17 23:13:40.634572,0 days 00:01:12.855487,min,16,0.004138332623804926,6,14,gaussian,COMPLETE
448,0.011742795817553997,2025-07-17 23:13:40.635629,2025-07-17 23:15:06.310937,0 days 00:01:25.675308,prod,16,0.009921098149822751,6,23,bell,COMPLETE
449,0.05102546140551567,2025-07-17 23:15:06.311985,2025-07-17 23:16:26.032516,0 days 00:01:19.720531,min,16,0.0055266241505270855,6,22,gaussian,COMPLETE
450,0.025502458214759827,2025-07-17 23:16:26.033553,2025-07-17 23:17:14.051759,0 days 00:00:48.018206,min,32,0.008844995571368574,7,21,gaussian,COMPLETE
451,0.015113137662410736,2025-07-17 23:17:14.052523,2025-07-17 23:18:32.296580,0 days 00:01:18.244057,min,16,0.0022851535205454716,6,21,gaussian,COMPLETE
452,0.021071871742606163,2025-07-17 23:18:32.297624,2025-07-17 23:19:50.742179,0 days 00:01:18.444555,min,16,0.006788945659006946,6,23,sigmoid,COMPLETE
453,0.02414821833372116,2025-07-17 23:19:50.743285,2025-07-17 23:21:12.338910,0 days 00:01:21.595625,prod,16,0.003212291001517062,6,24,gaussian,COMPLETE
454,0.0011385200778022408,2025-07-17 23:21:12.339928,2025-07-17 23:22:31.523804,0 days 00:01:19.183876,min,16,0.007779001537820225,6,22,gaussian,COMPLETE
455,0.0014570752391591668,2025-07-17 23:22:31.524833,2025-07-17 23:23:50.130248,0 days 00:01:18.605415,min,16,0.008776189622404625,6,21,gaussian,COMPLETE
456,0.009166807867586613,2025-07-17 23:23:50.131296,2025-07-17 23:25:09.705731,0 days 00:01:19.574435,min,16,0.00504762458030011,6,22,gaussian,COMPLETE
457,0.0039797755889594555,2025-07-17 23:25:09.706793,2025-07-17 23:26:25.413353,0 days 00:01:15.706560,min,16,0.006247576617891832,6,17,gaussian,COMPLETE
458,0.017286574468016624,2025-07-17 23:26:25.414409,2025-07-17 23:26:48.004236,0 days 00:00:22.589827,prod,128,0.007723155109010187,6,22,gaussian,COMPLETE
459,0.45689669251441956,2025-07-17 23:26:48.004797,2025-07-17 23:28:08.440983,0 days 00:01:20.436186,min,16,0.0008041101113448392,7,21,sigmoid,COMPLETE
460,0.0003319900424685329,2025-07-17 23:28:08.442024,2025-07-17 23:29:27.928666,0 days 00:01:19.486642,min,16,0.009974492499154516,6,22,gaussian,COMPLETE
461,0.0004629336472135037,2025-07-17 23:29:27.929744,2025-07-17 23:30:48.073751,0 days 00:01:20.144007,min,16,0.009788288481966792,6,23,gaussian,COMPLETE
462,0.0011749804252758622,2025-07-17 23:30:48.074797,2025-07-17 23:32:05.244526,0 days 00:01:17.169729,min,16,0.00837207851302152,5,22,gaussian,COMPLETE
463,0.1326673924922943,2025-07-17 23:32:05.245556,2025-07-17 23:33:28.143979,0 days 00:01:22.898423,min,16,0.009766634802338902,7,22,gaussian,COMPLETE
464,0.00033745417022146285,2025-07-17 23:33:28.145031,2025-07-17 23:34:47.673042,0 days 00:01:19.528011,prod,16,0.00888466067318486,6,21,gaussian,COMPLETE
465,0.003531975671648979,2025-07-17 23:34:47.674095,2025-07-17 23:36:08.054975,0 days 00:01:20.380880,min,16,0.009903155267879838,6,23,gaussian,COMPLETE
466,0.0073328264988958836,2025-07-17 23:36:08.056007,2025-07-17 23:37:26.222275,0 days 00:01:18.166268,min,16,0.008141712522124124,6,22,sigmoid,COMPLETE
467,0.022535640746355057,2025-07-17 23:37:26.223316,2025-07-17 23:38:48.416427,0 days 00:01:22.193111,min,16,0.009948526924036338,9,20,gaussian,COMPLETE
468,0.0003124256618320942,2025-07-17 23:38:48.417457,2025-07-17 23:40:11.785271,0 days 00:01:23.367814,min,16,0.0074484445269148635,6,21,bell,COMPLETE
469,0.5503849983215332,2025-07-17 23:40:11.786315,2025-07-17 23:40:44.312079,0 days 00:00:32.525764,min,64,0.008680915298077796,6,21,bell,COMPLETE
470,0.0004688620683737099,2025-07-17 23:40:44.312859,2025-07-17 23:42:08.291810,0 days 00:01:23.978951,prod,16,0.007483861427733355,6,21,bell,COMPLETE
471,0.0034483217168599367,2025-07-17 23:42:08.292841,2025-07-17 23:43:24.749305,0 days 00:01:16.456464,min,16,0.008693464276272208,6,20,sigmoid,COMPLETE
472,0.0003573726280592382,2025-07-17 23:43:24.750350,2025-07-17 23:44:47.777706,0 days 00:01:23.027356,min,16,0.004495795124447788,6,21,bell,COMPLETE
473,0.0008886639843694866,2025-07-17 23:44:47.778760,2025-07-17 23:46:14.453063,0 days 00:01:26.674303,min,16,0.00372097505063721,7,21,bell,COMPLETE
474,0.002283709589391947,2025-07-17 23:46:14.454120,2025-07-17 23:47:41.154746,0 days 00:01:26.700626,min,16,0.007069468172121882,6,25,bell,COMPLETE
475,0.01798175647854805,2025-07-17 23:47:41.155800,2025-07-17 23:48:29.438366,0 days 00:00:48.282566,prod,32,0.00764898067412643,6,20,bell,COMPLETE
476,0.00037186325062066317,2025-07-17 23:48:29.439127,2025-07-17 23:49:51.732513,0 days 00:01:22.293386,min,16,0.008919683006551394,7,21,gaussian,COMPLETE
477,0.000333606731146574,2025-07-17 23:49:51.733541,2025-07-17 23:51:14.159629,0 days 00:01:22.426088,min,16,0.006318427732517578,6,20,bell,COMPLETE
478,0.0010110053699463606,2025-07-17 23:51:14.160675,2025-07-17 23:52:35.739065,0 days 00:01:21.578390,min,16,0.005727465925284943,6,19,bell,COMPLETE
479,0.0071960072964429855,2025-07-17 23:52:35.740110,2025-07-17 23:53:57.894687,0 days 00:01:22.154577,min,16,0.005198420020916532,6,20,bell,COMPLETE
480,0.0002924318250734359,2025-07-17 23:53:57.895717,2025-07-17 23:55:20.068801,0 days 00:01:22.173084,min,16,0.006302091695702732,6,20,bell,COMPLETE
481,0.007437439169734716,2025-07-17 23:55:20.069837,2025-07-17 23:56:43.106792,0 days 00:01:23.036955,prod,16,0.004402706442173166,6,20,bell,COMPLETE
482,0.00027653289726004004,2025-07-17 23:56:43.107842,2025-07-17 23:58:05.194025,0 days 00:01:22.086183,min,16,0.007890066559223733,6,20,bell,COMPLETE
483,0.0006243326351977885,2025-07-17 23:58:05.195062,2025-07-17 23:59:27.366582,0 days 00:01:22.171520,min,16,0.006615434746528105,6,20,bell,COMPLETE
484,1.905423879623413,2025-07-17 23:59:27.367674,2025-07-17 23:59:48.838671,0 days 00:00:21.470997,min,128,0.005787968872836545,6,18,bell,COMPLETE
485,0.003366651479154825,2025-07-17 23:59:48.839438,2025-07-18 00:01:11.412111,0 days 00:01:22.572673,min,16,0.0075253139637637525,6,20,bell,COMPLETE
486,0.015519012697041035,2025-07-18 00:01:11.413174,2025-07-18 00:02:33.009023,0 days 00:01:21.595849,prod,16,0.0034881980642152885,6,18,bell,COMPLETE
487,0.011894815601408482,2025-07-18 00:02:33.010051,2025-07-18 00:03:54.445228,0 days 00:01:21.435177,min,16,0.006721534454276601,6,19,bell,COMPLETE
488,1.2263821363449097,2025-07-18 00:03:54.446245,2025-07-18 00:05:15.814899,0 days 00:01:21.368654,min,16,0.00010959039851297782,6,19,bell,COMPLETE
489,0.0014614067040383816,2025-07-18 00:05:15.815918,2025-07-18 00:06:38.206663,0 days 00:01:22.390745,min,16,0.005047849921086771,6,20,bell,COMPLETE
490,0.00029645717586390674,2025-07-18 00:06:38.207684,2025-07-18 00:07:59.553631,0 days 00:01:21.345947,min,16,0.007644075003922523,6,19,bell,COMPLETE
491,0.0015481843147426844,2025-07-18 00:07:59.579985,2025-07-18 00:09:20.894153,0 days 00:01:21.314168,min,16,0.006265134163314676,6,19,bell,COMPLETE
492,0.003028696635738015,2025-07-18 00:09:20.895236,2025-07-18 00:10:43.198625,0 days 00:01:22.303389,prod,16,0.005519192013601132,6,19,bell,COMPLETE
493,0.00713544012978673,2025-07-18 00:10:43.199700,2025-07-18 00:12:03.738108,0 days 00:01:20.538408,min,16,0.007288473618760318,6,18,bell,COMPLETE
494,0.2957066297531128,2025-07-18 00:12:03.739192,2025-07-18 00:12:35.298370,0 days 00:00:31.559178,min,64,3.0527012646779146e-05,6,19,bell,COMPLETE
495,0.11857199668884277,2025-07-18 00:12:35.299158,2025-07-18 00:13:56.013149,0 days 00:01:20.713991,min,16,0.0005993272032476519,6,18,bell,COMPLETE
496,0.00028672596090473235,2025-07-18 00:13:56.014175,2025-07-18 00:15:18.494155,0 days 00:01:22.479980,min,16,0.007764583498082864,6,20,bell,COMPLETE
497,0.0004706466570496559,2025-07-18 00:15:18.495255,2025-07-18 00:16:40.855422,0 days 00:01:22.360167,prod,16,0.006170057268378928,6,19,bell,COMPLETE
498,0.0021971073001623154,2025-07-18 00:16:40.856512,2025-07-18 00:18:03.044909,0 days 00:01:22.188397,min,16,0.004555914078148773,6,20,bell,COMPLETE
499,0.07482832670211792,2025-07-18 00:18:03.046002,2025-07-18 00:19:25.267709,0 days 00:01:22.221707,min,16,0.006877127588081349,6,20,bell,COMPLETE
