number,value,datetime_start,datetime_complete,duration,params_and_operator,params_batch_size,params_lr,params_n_sets,params_seq_length,params_shape,state
0,0.18846462666988373,2025-07-17 14:50:38.233881,2025-07-17 14:51:23.897510,0 days 00:00:45.663629,prod,32,0.001818678429465789,7,8,sigmoid,COMPLETE
1,0.6692358255386353,2025-07-17 14:51:23.898513,2025-07-17 14:51:42.035816,0 days 00:00:18.137303,min,128,1.817005230221321e-05,7,11,gaussian,COMPLETE
2,0.7056617140769958,2025-07-17 14:51:42.036741,2025-07-17 14:52:08.893701,0 days 00:00:26.856960,prod,128,1.4142120552915142e-05,8,24,sigmoid,COMPLETE
3,0.5754683017730713,2025-07-17 14:52:08.894563,2025-07-17 14:52:24.944945,0 days 00:00:16.050382,min,128,8.795009769899294e-05,7,9,sigmoid,COMPLETE
4,0.0006267543649300933,2025-07-17 14:52:24.945607,2025-07-17 14:54:06.462682,0 days 00:01:41.517075,prod,16,0.004201775100719706,5,18,bell,COMPLETE
5,0.22796136140823364,2025-07-17 14:54:06.463612,2025-07-17 14:54:53.412399,0 days 00:00:46.948787,prod,32,0.005108165784627168,5,9,gaussian,COMPLETE
6,0.06614134460687637,2025-07-17 14:54:53.413083,2025-07-17 14:55:09.816419,0 days 00:00:16.403336,min,128,0.0001722271929155255,8,8,bell,COMPLETE
7,0.412923663854599,2025-07-17 14:55:09.817027,2025-07-17 14:55:56.514885,0 days 00:00:46.697858,prod,32,2.5740031707229088e-05,6,10,sigmoid,COMPLETE
8,0.3490668833255768,2025-07-17 14:55:56.515501,2025-07-17 14:56:25.367236,0 days 00:00:28.851735,min,64,0.0028954739958122846,6,12,gaussian,COMPLETE
9,0.5546658635139465,2025-07-17 14:56:25.367818,2025-07-17 14:56:50.224141,0 days 00:00:24.856323,prod,64,9.341404797233605e-05,9,7,sigmoid,COMPLETE
10,0.25612032413482666,2025-07-17 14:56:50.224568,2025-07-17 14:58:33.924294,0 days 00:01:43.699726,prod,16,0.0009688783931519569,5,19,bell,COMPLETE
11,0.10391578078269958,2025-07-17 14:58:33.925244,2025-07-17 15:00:20.535284,0 days 00:01:46.610040,min,16,0.0003648516234670071,9,17,bell,COMPLETE
12,0.000449118873802945,2025-07-17 15:00:20.536212,2025-07-17 15:02:15.496104,0 days 00:01:54.959892,min,16,0.008891792815403025,8,21,bell,COMPLETE
13,0.0008809544378891587,2025-07-17 15:02:15.496985,2025-07-17 15:04:09.565602,0 days 00:01:54.068617,min,16,0.009044716718754333,8,21,bell,COMPLETE
14,0.00036746702971868217,2025-07-17 15:04:09.566487,2025-07-17 15:05:45.393496,0 days 00:01:35.827009,min,16,0.00959081694281217,6,15,bell,COMPLETE
15,0.006149890832602978,2025-07-17 15:05:45.394400,2025-07-17 15:07:16.875232,0 days 00:01:31.480832,min,16,0.0010087723455005978,6,14,bell,COMPLETE
16,0.0003312200424261391,2025-07-17 15:07:16.876098,2025-07-17 15:09:22.568873,0 days 00:02:05.692775,min,16,0.009192197897233441,8,25,bell,COMPLETE
17,0.4283764362335205,2025-07-17 15:09:22.569827,2025-07-17 15:11:25.624406,0 days 00:02:03.054579,min,16,0.0005063922321678224,6,25,bell,COMPLETE
18,0.03985914587974548,2025-07-17 15:11:25.625321,2025-07-17 15:13:06.774450,0 days 00:01:41.149129,min,16,0.0017417612640579423,9,15,bell,COMPLETE
19,0.0726190060377121,2025-07-17 15:13:06.775416,2025-07-17 15:13:40.876102,0 days 00:00:34.100686,min,64,0.00972020636771732,7,13,bell,COMPLETE
20,0.06513907015323639,2025-07-17 15:13:40.876742,2025-07-17 15:14:47.476290,0 days 00:01:06.599548,min,16,0.003416488297589834,7,5,gaussian,COMPLETE
21,0.0003000647993758321,2025-07-17 15:14:47.477206,2025-07-17 15:16:47.516609,0 days 00:02:00.039403,min,16,0.009662360244244403,8,22,bell,COMPLETE
22,0.0010125648695975542,2025-07-17 15:16:47.517538,2025-07-17 15:18:47.317207,0 days 00:01:59.799669,min,16,0.006586657976947037,8,23,bell,COMPLETE
23,0.25999340415000916,2025-07-17 15:18:47.318133,2025-07-17 15:20:41.911419,0 days 00:01:54.593286,min,16,0.0020366032497647216,8,21,bell,COMPLETE
24,0.04110482707619667,2025-07-17 15:20:41.912365,2025-07-17 15:22:25.770126,0 days 00:01:43.857761,min,16,0.005313983786821601,9,16,bell,COMPLETE
25,0.11313183605670929,2025-07-17 15:22:25.771019,2025-07-17 15:24:23.836209,0 days 00:01:58.065190,min,16,0.0009438839091457778,6,23,bell,COMPLETE
26,0.0006692706374451518,2025-07-17 15:24:23.837140,2025-07-17 15:26:16.442927,0 days 00:01:52.605787,min,16,0.0031617246326461072,8,19,bell,COMPLETE
27,0.020326854661107063,2025-07-17 15:26:16.443855,2025-07-17 15:27:01.081807,0 days 00:00:44.637952,min,64,0.006198849442629178,7,22,bell,COMPLETE
28,4.061013698577881,2025-07-17 15:27:01.082489,2025-07-17 15:28:19.209041,0 days 00:01:18.126552,min,32,0.002508522054865148,9,25,gaussian,COMPLETE
29,0.40054965019226074,2025-07-17 15:28:19.210012,2025-07-17 15:29:26.192737,0 days 00:01:06.982725,min,32,0.0015086156080799155,7,20,bell,COMPLETE
30,0.07552070915699005,2025-07-17 15:29:26.193617,2025-07-17 15:31:00.250100,0 days 00:01:34.056483,min,16,0.005943688387494941,8,16,sigmoid,COMPLETE
31,0.0008200167212635279,2025-07-17 15:31:00.251064,2025-07-17 15:32:59.524395,0 days 00:01:59.273331,min,16,0.0075557700405266244,8,23,bell,COMPLETE
32,0.008857432752847672,2025-07-17 15:32:59.525234,2025-07-17 15:34:52.949540,0 days 00:01:53.424306,min,16,0.009603312238699441,8,21,bell,COMPLETE
33,0.0005288039101287723,2025-07-17 15:34:52.950397,2025-07-17 15:36:57.941856,0 days 00:02:04.991459,min,16,0.003863683673837906,7,25,bell,COMPLETE
34,2.229320526123047,2025-07-17 15:36:57.942747,2025-07-17 15:37:21.872042,0 days 00:00:23.929295,min,128,0.009891494572134299,8,18,bell,COMPLETE
35,0.12314708530902863,2025-07-17 15:37:21.872615,2025-07-17 15:39:25.482274,0 days 00:02:03.609659,min,16,3.0685453133337854e-05,7,24,bell,COMPLETE
36,0.1175525113940239,2025-07-17 15:39:25.483111,2025-07-17 15:39:49.663032,0 days 00:00:24.179921,prod,128,0.0040654591205113,8,22,sigmoid,COMPLETE
37,0.009486055001616478,2025-07-17 15:39:49.663586,2025-07-17 15:41:36.891600,0 days 00:01:47.228014,min,16,0.005593805871642302,9,19,gaussian,COMPLETE
38,0.5547621846199036,2025-07-17 15:41:36.892494,2025-07-17 15:42:47.963098,0 days 00:01:11.070604,prod,32,0.0013873496834651187,5,24,bell,COMPLETE
39,1.2879217863082886,2025-07-17 15:42:47.964049,2025-07-17 15:43:09.106311,0 days 00:00:21.142262,min,128,0.0006140725111159765,6,14,bell,COMPLETE
40,0.5698133707046509,2025-07-17 15:43:09.106880,2025-07-17 15:44:48.116510,0 days 00:01:39.009630,prod,16,0.0025752903289064442,8,17,sigmoid,COMPLETE
41,0.002813003258779645,2025-07-17 15:44:48.117406,2025-07-17 15:46:54.116128,0 days 00:02:05.998722,min,16,0.0045982679359642025,7,25,bell,COMPLETE
42,0.009971094317734241,2025-07-17 15:46:54.117057,2025-07-17 15:48:54.106478,0 days 00:01:59.989421,min,16,0.006926051738248385,7,22,bell,COMPLETE
43,0.007046644575893879,2025-07-17 15:48:54.107351,2025-07-17 15:50:58.669390,0 days 00:02:04.562039,min,16,0.0037135707193670453,6,24,bell,COMPLETE
44,0.0021198298782110214,2025-07-17 15:50:58.670261,2025-07-17 15:53:05.178010,0 days 00:02:06.507749,min,16,0.004652256038208287,8,25,bell,COMPLETE
45,0.03801755979657173,2025-07-17 15:53:05.178976,2025-07-17 15:53:32.791185,0 days 00:00:27.612209,min,64,0.007377848046911602,5,11,gaussian,COMPLETE
46,0.05981764197349548,2025-07-17 15:53:32.791804,2025-07-17 15:55:23.604550,0 days 00:01:50.812746,min,16,0.00014281259233074394,7,20,bell,COMPLETE
47,0.00030713295564055443,2025-07-17 15:55:23.605436,2025-07-17 15:57:23.945550,0 days 00:02:00.340114,prod,16,0.007595253356416207,8,23,bell,COMPLETE
48,0.4841212034225464,2025-07-17 15:57:23.946446,2025-07-17 15:59:11.296987,0 days 00:01:47.350541,prod,16,5.6793195886309984e-05,8,20,sigmoid,COMPLETE
49,0.08311633765697479,2025-07-17 15:59:11.297908,2025-07-17 16:00:29.736988,0 days 00:01:18.439080,prod,32,0.007773462500802694,9,23,bell,COMPLETE
50,3.3226065635681152,2025-07-17 16:00:29.737913,2025-07-17 16:00:58.088061,0 days 00:00:28.350148,prod,128,0.002174983825482295,8,22,bell,COMPLETE
51,0.005103376228362322,2025-07-17 16:00:58.088722,2025-07-17 16:03:01.822339,0 days 00:02:03.733617,prod,16,0.009956712165597946,8,24,bell,COMPLETE
52,0.004116239957511425,2025-07-17 16:03:01.823199,2025-07-17 16:05:08.490652,0 days 00:02:06.667453,prod,16,0.004560788255027798,8,25,bell,COMPLETE
53,0.00286673242226243,2025-07-17 16:05:08.491558,2025-07-17 16:07:05.190829,0 days 00:01:56.699271,min,16,0.0033195888266221965,6,23,bell,COMPLETE
54,0.0013263615546748042,2025-07-17 16:07:05.191698,2025-07-17 16:09:02.902120,0 days 00:01:57.710422,min,16,0.007795085347422357,9,21,bell,COMPLETE
55,0.009736808016896248,2025-07-17 16:09:02.902989,2025-07-17 16:10:35.754204,0 days 00:01:32.851215,prod,16,0.005568077929367591,7,13,bell,COMPLETE
56,0.35071566700935364,2025-07-17 16:10:35.755090,2025-07-17 16:11:21.270553,0 days 00:00:45.515463,min,64,0.007687339752875237,8,24,bell,COMPLETE
57,0.0007298921118490398,2025-07-17 16:11:21.271200,2025-07-17 16:12:55.885988,0 days 00:01:34.614788,min,16,0.0038299733423331596,8,15,gaussian,COMPLETE
58,0.45488855242729187,2025-07-17 16:12:55.887110,2025-07-17 16:14:57.154004,0 days 00:02:01.266894,min,16,0.0002784412879101464,7,22,bell,COMPLETE
59,0.050753094255924225,2025-07-17 16:14:57.154905,2025-07-17 16:16:38.905535,0 days 00:01:41.750630,min,16,0.002713248701701012,5,18,bell,COMPLETE
60,0.0024902471341192722,2025-07-17 16:16:38.906487,2025-07-17 16:18:39.212987,0 days 00:02:00.306500,prod,16,0.005739664373295681,6,23,bell,COMPLETE
61,0.009969203732907772,2025-07-17 16:18:39.213896,2025-07-17 16:20:18.738488,0 days 00:01:39.524592,prod,16,0.004653561170295035,5,17,bell,COMPLETE
62,0.0005579136777669191,2025-07-17 16:20:18.739418,2025-07-17 16:22:08.875302,0 days 00:01:50.135884,prod,16,0.008360663017400134,5,20,bell,COMPLETE
63,0.0005003759288229048,2025-07-17 16:22:08.876225,2025-07-17 16:24:03.292579,0 days 00:01:54.416354,prod,16,0.008151261642865148,5,21,bell,COMPLETE
64,0.0006545811193063855,2025-07-17 16:24:03.293525,2025-07-17 16:26:00.754460,0 days 00:01:57.460935,prod,16,0.006094699688194278,6,21,bell,COMPLETE
65,0.03152499347925186,2025-07-17 16:26:00.755390,2025-07-17 16:28:12.680908,0 days 00:02:11.925518,prod,16,0.009177211491535829,8,25,bell,COMPLETE
66,0.022707780823111534,2025-07-17 16:28:12.681892,2025-07-17 16:29:00.519384,0 days 00:00:47.837492,min,64,0.006640698538309436,6,24,bell,COMPLETE
67,0.016464347019791603,2025-07-17 16:29:00.520126,2025-07-17 16:30:59.052854,0 days 00:01:58.532728,min,16,0.003519547162836679,7,23,sigmoid,COMPLETE
68,1.1560235023498535,2025-07-17 16:30:59.053809,2025-07-17 16:32:08.017080,0 days 00:01:08.963271,min,32,1.0602130652839487e-05,8,21,bell,COMPLETE
69,0.0004410931724123657,2025-07-17 16:32:08.018075,2025-07-17 16:33:39.424333,0 days 00:01:31.406258,prod,16,0.009723250157169195,7,14,gaussian,COMPLETE
70,0.058749523013830185,2025-07-17 16:33:39.425280,2025-07-17 16:35:16.293564,0 days 00:01:36.868284,prod,16,0.008581148145058554,9,14,gaussian,COMPLETE
71,0.00041065874393098056,2025-07-17 16:35:16.294582,2025-07-17 16:36:44.316796,0 days 00:01:28.022214,prod,16,0.009895863888575001,7,12,gaussian,COMPLETE
72,0.0003890450461767614,2025-07-17 16:36:44.317799,2025-07-17 16:38:10.494276,0 days 00:01:26.176477,prod,16,0.006888908041927141,7,12,gaussian,COMPLETE
73,0.0007496090256609023,2025-07-17 16:38:10.495282,2025-07-17 16:39:38.110790,0 days 00:01:27.615508,prod,16,0.009769705386411648,7,12,gaussian,COMPLETE
74,0.0006217022892087698,2025-07-17 16:39:38.111764,2025-07-17 16:41:05.720031,0 days 00:01:27.608267,prod,16,0.006263887204923817,7,11,gaussian,COMPLETE
75,0.32145756483078003,2025-07-17 16:41:05.720963,2025-07-17 16:41:22.178508,0 days 00:00:16.457545,prod,128,0.0050864550708668195,7,9,gaussian,COMPLETE
76,0.003100732108578086,2025-07-17 16:41:22.179088,2025-07-17 16:42:51.269301,0 days 00:01:29.090213,prod,16,0.0068258780269775015,7,13,gaussian,COMPLETE
77,0.0004937008488923311,2025-07-17 16:42:51.270261,2025-07-17 16:44:17.147243,0 days 00:01:25.876982,prod,16,0.006964887585713504,7,12,gaussian,COMPLETE
78,0.006709275301545858,2025-07-17 16:44:17.148195,2025-07-17 16:45:53.061148,0 days 00:01:35.912953,prod,16,0.005221889034228619,8,15,gaussian,COMPLETE
79,0.002059423830360174,2025-07-17 16:45:53.062060,2025-07-17 16:47:33.674459,0 days 00:01:40.612399,prod,16,0.008561931340167339,7,16,gaussian,COMPLETE
80,0.3866432011127472,2025-07-17 16:47:33.675411,2025-07-17 16:48:26.711009,0 days 00:00:53.035598,prod,32,0.004183203090409199,8,13,gaussian,COMPLETE
81,0.0004683750157710165,2025-07-17 16:48:26.711737,2025-07-17 16:49:54.594985,0 days 00:01:27.883248,prod,16,0.006739872166223799,7,12,gaussian,COMPLETE
82,0.000448795995907858,2025-07-17 16:49:54.595899,2025-07-17 16:51:21.188015,0 days 00:01:26.592116,prod,16,0.009995916749142228,8,10,gaussian,COMPLETE
83,0.0004068698617629707,2025-07-17 16:51:21.189028,2025-07-17 16:52:47.412350,0 days 00:01:26.223322,prod,16,0.009806300473996643,8,10,gaussian,COMPLETE
84,0.024151448160409927,2025-07-17 16:52:47.413321,2025-07-17 16:54:13.497839,0 days 00:01:26.084518,prod,16,0.009469146977716626,8,10,gaussian,COMPLETE
85,0.0017270075622946024,2025-07-17 16:54:13.498789,2025-07-17 16:55:33.495711,0 days 00:01:19.996922,prod,16,0.009886485032666,8,8,gaussian,COMPLETE
86,0.049214184284210205,2025-07-17 16:55:33.496706,2025-07-17 16:56:59.143320,0 days 00:01:25.646614,prod,16,0.007656453888320044,8,10,gaussian,COMPLETE
87,0.11648592352867126,2025-07-17 16:56:59.144366,2025-07-17 16:58:28.713377,0 days 00:01:29.569011,prod,16,0.005122405067153186,8,11,gaussian,COMPLETE
88,3.242159128189087,2025-07-17 16:58:28.714320,2025-07-17 16:58:55.226864,0 days 00:00:26.512544,prod,64,0.005966162145422826,8,8,gaussian,COMPLETE
89,0.0005811955197714269,2025-07-17 16:58:55.227521,2025-07-17 17:00:20.788173,0 days 00:01:25.560652,prod,16,0.007871842088480076,7,10,gaussian,COMPLETE
90,2.4612927436828613,2025-07-17 17:00:20.789145,2025-07-17 17:00:38.566053,0 days 00:00:17.776908,prod,128,0.0065366888860912895,9,9,gaussian,COMPLETE
91,0.00040372551302425563,2025-07-17 17:00:38.566527,2025-07-17 17:02:07.756752,0 days 00:01:29.190225,prod,16,0.009939523529082742,8,11,gaussian,COMPLETE
92,0.0023407551925629377,2025-07-17 17:02:07.757706,2025-07-17 17:03:37.170408,0 days 00:01:29.412702,prod,16,0.009999792169385265,8,11,gaussian,COMPLETE
93,0.0006269596051424742,2025-07-17 17:03:37.171346,2025-07-17 17:05:11.843875,0 days 00:01:34.672529,prod,16,0.008371020546195493,8,14,gaussian,COMPLETE
94,0.09202674776315689,2025-07-17 17:05:11.844797,2025-07-17 17:06:37.862179,0 days 00:01:26.017382,prod,16,0.007324642077970335,8,10,gaussian,COMPLETE
95,0.027098527178168297,2025-07-17 17:06:37.863118,2025-07-17 17:08:06.388735,0 days 00:01:28.525617,prod,16,0.005701105522325503,8,12,gaussian,COMPLETE
96,0.001730839954689145,2025-07-17 17:08:06.389684,2025-07-17 17:09:23.153516,0 days 00:01:16.763832,prod,16,0.004874753206032103,8,7,gaussian,COMPLETE
97,0.06908364593982697,2025-07-17 17:09:23.154497,2025-07-17 17:10:53.126195,0 days 00:01:29.971698,prod,16,0.0085003683177988,8,13,sigmoid,COMPLETE
98,0.025929797440767288,2025-07-17 17:10:53.127151,2025-07-17 17:12:21.405813,0 days 00:01:28.278662,prod,16,0.0031885722479329127,7,11,gaussian,COMPLETE
99,0.010569024831056595,2025-07-17 17:12:21.406851,2025-07-17 17:13:44.833468,0 days 00:01:23.426617,prod,16,0.0008397543732654669,8,9,gaussian,COMPLETE
100,0.09631523489952087,2025-07-17 17:13:44.834422,2025-07-17 17:15:21.694316,0 days 00:01:36.859894,prod,16,0.004345496976990263,7,15,gaussian,COMPLETE
101,1.117025375366211,2025-07-17 17:15:21.695315,2025-07-17 17:16:46.542768,0 days 00:01:24.847453,min,16,0.0086187647827753,8,10,gaussian,COMPLETE
102,0.0007315173279494047,2025-07-17 17:16:46.543776,2025-07-17 17:18:14.162987,0 days 00:01:27.619211,min,16,0.007144511559297986,8,12,gaussian,COMPLETE
103,0.08484606444835663,2025-07-17 17:18:14.163944,2025-07-17 17:19:28.247157,0 days 00:01:14.083213,min,16,0.009942653442051553,8,7,sigmoid,COMPLETE
104,0.005360970739275217,2025-07-17 17:19:28.248302,2025-07-17 17:21:00.444858,0 days 00:01:32.196556,min,16,0.006153513565585947,8,11,bell,COMPLETE
105,1.2133387327194214,2025-07-17 17:21:00.445833,2025-07-17 17:22:14.828343,0 days 00:01:14.382510,min,32,0.00029201810511171383,8,22,bell,COMPLETE
106,0.415130615234375,2025-07-17 17:22:14.829261,2025-07-17 17:23:42.151255,0 days 00:01:27.321994,min,16,0.008365503719909354,6,13,gaussian,COMPLETE
107,1.9373302459716797,2025-07-17 17:23:42.152239,2025-07-17 17:24:17.842208,0 days 00:00:35.689969,prod,64,4.543359370810143e-05,8,14,bell,COMPLETE
108,0.013953284360468388,2025-07-17 17:24:17.842861,2025-07-17 17:26:11.353061,0 days 00:01:53.510200,prod,16,0.0073012499295193834,9,19,gaussian,COMPLETE
109,0.3996960520744324,2025-07-17 17:26:11.354016,2025-07-17 17:27:39.457007,0 days 00:01:28.102991,min,16,0.00021681207280332786,7,10,bell,COMPLETE
110,0.0016102822264656425,2025-07-17 17:27:39.457969,2025-07-17 17:29:12.996821,0 days 00:01:33.538852,prod,16,0.005791862999957169,8,11,bell,COMPLETE
111,0.01616326905786991,2025-07-17 17:29:12.997808,2025-07-17 17:30:41.344706,0 days 00:01:28.346898,prod,16,0.007072861916980497,7,12,gaussian,COMPLETE
112,0.4650857746601105,2025-07-17 17:30:41.345646,2025-07-17 17:32:18.403357,0 days 00:01:37.057711,prod,16,0.008845989778633124,6,16,gaussian,COMPLETE
113,0.009945298545062542,2025-07-17 17:32:18.404280,2025-07-17 17:33:46.561427,0 days 00:01:28.157147,prod,16,0.006603565055236477,7,12,gaussian,COMPLETE
114,2.1497344970703125,2025-07-17 17:33:46.562403,2025-07-17 17:35:20.895072,0 days 00:01:34.332669,prod,16,0.00041725589737525256,8,14,gaussian,COMPLETE
115,0.013538812287151814,2025-07-17 17:35:20.895994,2025-07-17 17:35:40.768089,0 days 00:00:19.872095,prod,128,0.008744115260474155,7,12,gaussian,COMPLETE
116,0.3740321397781372,2025-07-17 17:35:40.768756,2025-07-17 17:37:16.824629,0 days 00:01:36.055873,min,16,0.00010003879255441312,8,15,gaussian,COMPLETE
117,0.0014209976652637124,2025-07-17 17:37:16.825590,2025-07-17 17:38:49.787683,0 days 00:01:32.962093,prod,16,0.0050381367958266966,7,11,bell,COMPLETE
118,0.00043032519170083106,2025-07-17 17:38:49.788669,2025-07-17 17:40:17.824823,0 days 00:01:28.036154,prod,16,0.009981979527697443,6,13,gaussian,COMPLETE
119,0.0004233132931403816,2025-07-17 17:40:17.825797,2025-07-17 17:41:48.663860,0 days 00:01:30.838063,min,16,0.009932683742768676,6,13,bell,COMPLETE
120,0.004901526030153036,2025-07-17 17:41:48.664854,2025-07-17 17:43:14.174990,0 days 00:01:25.510136,min,16,0.009941345295802448,6,13,sigmoid,COMPLETE
121,0.0010193916969001293,2025-07-17 17:43:14.175954,2025-07-17 17:44:45.112155,0 days 00:01:30.936201,min,16,0.007907446670644584,6,13,bell,COMPLETE
122,0.000367309752618894,2025-07-17 17:44:45.113170,2025-07-17 17:46:16.048756,0 days 00:01:30.935586,min,16,0.008959174869365167,6,13,bell,COMPLETE
123,0.0008733170689083636,2025-07-17 17:46:16.049744,2025-07-17 17:47:46.969480,0 days 00:01:30.919736,min,16,0.007664301718845836,6,13,bell,COMPLETE
124,0.0003383157018106431,2025-07-17 17:47:46.970439,2025-07-17 17:49:20.987586,0 days 00:01:34.017147,min,16,0.009010189231648218,6,14,bell,COMPLETE
125,0.15435370802879333,2025-07-17 17:49:20.988525,2025-07-17 17:50:55.373214,0 days 00:01:34.384689,min,16,0.0063211875879188376,6,14,bell,COMPLETE
126,0.0951119065284729,2025-07-17 17:50:55.374167,2025-07-17 17:52:29.773414,0 days 00:01:34.399247,min,16,0.008901003872101713,6,14,bell,COMPLETE
127,0.008901513181626797,2025-07-17 17:52:29.774380,2025-07-17 17:54:00.861304,0 days 00:01:31.086924,min,16,0.005502486357428538,6,13,bell,COMPLETE
128,0.00040895110578276217,2025-07-17 17:54:00.862256,2025-07-17 17:55:35.317558,0 days 00:01:34.455302,min,16,0.0072460103201703934,6,14,bell,COMPLETE
129,0.01452457532286644,2025-07-17 17:55:35.318567,2025-07-17 17:56:34.158110,0 days 00:00:58.839543,min,32,0.007510865762924606,6,15,bell,COMPLETE
130,0.005699134431779385,2025-07-17 17:56:34.159028,2025-07-17 17:58:05.176275,0 days 00:01:31.017247,min,16,0.003979048394619262,6,12,bell,COMPLETE
131,0.008525987155735493,2025-07-17 17:58:05.177279,2025-07-17 17:59:40.026280,0 days 00:01:34.849001,min,16,0.009998082037669003,6,14,bell,COMPLETE
132,0.24965471029281616,2025-07-17 17:59:40.027284,2025-07-17 18:01:17.698621,0 days 00:01:37.671337,min,16,0.008435108908646188,6,15,bell,COMPLETE
133,0.00038640949060209095,2025-07-17 18:01:17.699600,2025-07-17 18:02:51.990930,0 days 00:01:34.291330,min,16,0.006552960495178222,6,14,bell,COMPLETE
134,0.0057471576146781445,2025-07-17 18:02:51.991898,2025-07-17 18:04:22.882476,0 days 00:01:30.890578,min,16,0.006359476750411857,6,13,bell,COMPLETE
135,0.000382734666345641,2025-07-17 18:04:22.883424,2025-07-17 18:05:53.911249,0 days 00:01:31.027825,min,16,0.006977833988081837,6,13,bell,COMPLETE
136,2.4041695594787598,2025-07-17 18:05:53.912247,2025-07-17 18:06:30.999649,0 days 00:00:37.087402,min,64,0.005272186052103487,6,16,bell,COMPLETE
137,0.0006036199047230184,2025-07-17 18:06:31.000371,2025-07-17 18:07:59.267785,0 days 00:01:28.267414,min,16,0.006823693449382396,6,12,bell,COMPLETE
138,1.147006869316101,2025-07-17 18:07:59.268781,2025-07-17 18:09:34.116245,0 days 00:01:34.847464,min,16,1.890719393732525e-05,6,14,bell,COMPLETE
139,0.0010470990091562271,2025-07-17 18:09:34.117282,2025-07-17 18:11:09.149714,0 days 00:01:35.032432,min,16,0.007769997534026645,6,14,bell,COMPLETE
140,0.3815130293369293,2025-07-17 18:11:09.150657,2025-07-17 18:11:23.181706,0 days 00:00:14.031049,min,128,0.004319475702529822,6,5,bell,COMPLETE
141,0.0007170528988353908,2025-07-17 18:11:23.182402,2025-07-17 18:12:55.161589,0 days 00:01:31.979187,min,16,0.008681543599730808,6,13,bell,COMPLETE
142,0.0003785997978411615,2025-07-17 18:12:55.162579,2025-07-17 18:14:33.347562,0 days 00:01:38.184983,min,16,0.0071858111486901724,6,15,bell,COMPLETE
143,0.0004941323422826827,2025-07-17 18:14:33.348513,2025-07-17 18:16:14.252748,0 days 00:01:40.904235,min,16,0.006188814601358765,6,16,bell,COMPLETE
