number,value,datetime_start,datetime_complete,duration,params_and_operator,params_batch_size,params_lr,params_n_sets,params_seq_length,params_shape,state
435,0.03662453964352608,2025-07-18 03:03:31.518250,2025-07-18 03:05:31.076510,0 days 00:01:59.558260,min,16,0.00883898188041273,8,23,bell,COMPLETE
436,0.013901801779866219,2025-07-18 03:05:31.077533,2025-07-18 03:07:33.490353,0 days 00:02:02.412820,min,16,0.0072394130995282885,8,24,bell,COMPLETE
437,0.0002745607926044613,2025-07-18 03:07:33.491391,2025-07-18 03:09:30.421793,0 days 00:01:56.930402,min,16,0.00874344025423388,8,22,bell,COMPLETE
438,0.00036773402825929224,2025-07-18 03:09:30.422818,2025-07-18 03:11:27.556296,0 days 00:01:57.133478,min,16,0.008900709007014047,8,22,bell,COMPLETE
439,0.1317867934703827,2025-07-18 03:11:27.557247,2025-07-18 03:13:24.755747,0 days 00:01:57.198500,min,16,0.008795669628565832,8,22,bell,COMPLETE
440,0.00030136085115373135,2025-07-18 03:13:24.756781,2025-07-18 03:15:21.950010,0 days 00:01:57.193229,min,16,0.00993943231860558,8,22,bell,COMPLETE
441,0.011780893430113792,2025-07-18 03:15:21.951031,2025-07-18 03:17:19.113382,0 days 00:01:57.162351,min,16,0.0024377591103760263,8,22,bell,COMPLETE
442,0.0003257495118305087,2025-07-18 03:17:19.114409,2025-07-18 03:19:16.248901,0 days 00:01:57.134492,min,16,0.009994111780338617,8,22,bell,COMPLETE
443,0.7690533399581909,2025-07-18 03:19:16.249920,2025-07-18 03:21:13.372699,0 days 00:01:57.122779,min,16,0.009934828997719095,8,22,bell,COMPLETE
444,0.007989510893821716,2025-07-18 03:21:13.373720,2025-07-18 03:23:10.483290,0 days 00:01:57.109570,min,16,0.008783468522210418,8,22,bell,COMPLETE
445,0.0004196134686935693,2025-07-18 03:23:10.484355,2025-07-18 03:25:07.581932,0 days 00:01:57.097577,min,16,0.00871874068585815,8,22,bell,COMPLETE
446,0.0003966311924159527,2025-07-18 03:25:07.582962,2025-07-18 03:26:19.706789,0 days 00:01:12.123827,min,32,0.009922678093133266,8,23,bell,COMPLETE
447,0.0007001713383942842,2025-07-18 03:26:19.707743,2025-07-18 03:28:19.561177,0 days 00:01:59.853434,min,16,0.007150431258883613,8,23,bell,COMPLETE
448,0.00030422452255152166,2025-07-18 03:28:19.562197,2025-07-18 03:30:16.718548,0 days 00:01:57.156351,min,16,0.007866135864904722,8,22,bell,COMPLETE
449,0.00043117976747453213,2025-07-18 03:30:16.719584,2025-07-18 03:32:16.596617,0 days 00:01:59.877033,min,16,0.006649010537010102,8,23,bell,COMPLETE
450,0.005107529927045107,2025-07-18 03:32:16.597663,2025-07-18 03:34:13.735439,0 days 00:01:57.137776,min,16,0.00800260975954206,8,22,bell,COMPLETE
451,1.7352434396743774,2025-07-18 03:34:13.736459,2025-07-18 03:34:56.727019,0 days 00:00:42.990560,min,64,0.005715864061813754,8,22,bell,COMPLETE
452,0.0032098961528390646,2025-07-18 03:34:56.727827,2025-07-18 03:36:56.549159,0 days 00:01:59.821332,min,16,0.007366587404780832,8,23,bell,COMPLETE
453,0.41167962551116943,2025-07-18 03:36:56.550176,2025-07-18 03:38:56.368349,0 days 00:01:59.818173,min,16,0.006465116555393555,8,23,bell,COMPLETE
454,0.01594340056180954,2025-07-18 03:38:56.369353,2025-07-18 03:40:53.606170,0 days 00:01:57.236817,min,16,0.008088471445186245,8,22,bell,COMPLETE
455,0.02934723161160946,2025-07-18 03:40:53.607195,2025-07-18 03:42:42.027018,0 days 00:01:48.419823,min,16,0.008773364620252582,8,21,sigmoid,COMPLETE
456,0.0006216467591002584,2025-07-18 03:42:42.028002,2025-07-18 03:44:41.805656,0 days 00:01:59.777654,min,16,0.007241830563207975,8,23,bell,COMPLETE
457,0.001164172077551484,2025-07-18 03:44:41.806695,2025-07-18 03:45:07.641380,0 days 00:00:25.834685,min,128,0.00879364199990945,8,21,bell,COMPLETE
458,0.0005278660682961345,2025-07-18 03:45:07.642070,2025-07-18 03:47:10.213033,0 days 00:02:02.570963,min,16,0.00763184154103415,8,24,bell,COMPLETE
459,0.01428955513983965,2025-07-18 03:47:10.214036,2025-07-18 03:49:02.903621,0 days 00:01:52.689585,min,16,0.006331127771056224,8,22,gaussian,COMPLETE
460,0.002066191518679261,2025-07-18 03:49:02.904638,2025-07-18 03:51:02.683814,0 days 00:01:59.779176,min,16,0.005154149324349418,8,23,bell,COMPLETE
461,0.00032037426717579365,2025-07-18 03:51:02.684846,2025-07-18 03:53:05.333080,0 days 00:02:02.648234,min,16,0.008685484386524516,8,24,bell,COMPLETE
462,0.0006961508770473301,2025-07-18 03:53:05.334114,2025-07-18 03:55:05.045936,0 days 00:01:59.711822,min,16,0.007502916116265664,8,23,bell,COMPLETE
463,0.028610022738575935,2025-07-18 03:55:05.046950,2025-07-18 03:57:05.694893,0 days 00:02:00.647943,min,16,0.0014307360722434059,9,22,bell,COMPLETE
464,0.0003094250860158354,2025-07-18 03:57:05.695931,2025-07-18 03:58:59.893177,0 days 00:01:54.197246,min,16,0.009917123527326306,8,21,bell,COMPLETE
465,0.0003237795608583838,2025-07-18 03:58:59.894224,2025-07-18 04:00:54.196800,0 days 00:01:54.302576,min,16,0.008908227638589958,8,21,bell,COMPLETE
466,0.018528958782553673,2025-07-18 04:00:54.197839,2025-07-18 04:02:48.525849,0 days 00:01:54.328010,min,16,0.006850157516205593,8,21,bell,COMPLETE
467,0.00031459922320209444,2025-07-18 04:02:48.526906,2025-07-18 04:04:42.799810,0 days 00:01:54.272904,min,16,0.007979815634091406,8,21,bell,COMPLETE
468,0.013762395828962326,2025-07-18 04:04:42.800880,2025-07-18 04:06:37.109908,0 days 00:01:54.309028,min,16,0.005830992398302615,8,21,bell,COMPLETE
469,0.0021494782995432615,2025-07-18 04:06:37.110964,2025-07-18 04:08:31.286634,0 days 00:01:54.175670,min,16,0.006771282257518962,8,21,bell,COMPLETE
470,0.08806411921977997,2025-07-18 04:08:31.287649,2025-07-18 04:10:25.556940,0 days 00:01:54.269291,min,16,0.007859125472108132,8,21,bell,COMPLETE
471,0.014118263497948647,2025-07-18 04:10:25.557956,2025-07-18 04:11:33.844029,0 days 00:01:08.286073,min,32,0.007979567651109154,8,21,bell,COMPLETE
472,0.006302992347627878,2025-07-18 04:11:33.845028,2025-07-18 04:13:30.824951,0 days 00:01:56.979923,min,16,0.006016337494298445,8,22,bell,COMPLETE
473,0.006832071579992771,2025-07-18 04:13:30.826016,2025-07-18 04:15:27.800810,0 days 00:01:56.974794,min,16,0.007016443325468962,8,22,bell,COMPLETE
474,0.0007470077252946794,2025-07-18 04:15:27.801874,2025-07-18 04:17:21.849130,0 days 00:01:54.047256,min,16,0.008552569791370928,8,21,bell,COMPLETE
475,0.02098892629146576,2025-07-18 04:17:21.850140,2025-07-18 04:19:18.751142,0 days 00:01:56.901002,min,16,0.007820175735664125,8,22,bell,COMPLETE
476,0.005356813780963421,2025-07-18 04:19:18.752141,2025-07-18 04:21:12.914204,0 days 00:01:54.162063,min,16,0.0054861496864135,8,21,bell,COMPLETE
477,0.0004974681651219726,2025-07-18 04:21:12.915284,2025-07-18 04:23:09.800521,0 days 00:01:56.885237,min,16,0.008974805659105611,8,22,bell,COMPLETE
478,0.6694969534873962,2025-07-18 04:23:09.801586,2025-07-18 04:23:49.753142,0 days 00:00:39.951556,min,64,0.0065137212054654494,8,22,sigmoid,COMPLETE
479,0.0014777177711948752,2025-07-18 04:23:49.753839,2025-07-18 04:25:43.828472,0 days 00:01:54.074633,min,16,0.007895143989896707,8,21,bell,COMPLETE
480,0.3430923819541931,2025-07-18 04:25:43.829508,2025-07-18 04:27:36.217962,0 days 00:01:52.388454,min,16,0.00010535357685893043,8,22,gaussian,COMPLETE
481,0.0009949594968929887,2025-07-18 04:27:36.218972,2025-07-18 04:29:30.370264,0 days 00:01:54.151292,min,16,0.008908707905384054,8,21,bell,COMPLETE
482,1.2273374795913696,2025-07-18 04:29:30.371277,2025-07-18 04:29:56.975549,0 days 00:00:26.604272,min,128,0.007114235513106929,8,22,bell,COMPLETE
483,0.00039098382694646716,2025-07-18 04:29:56.976243,2025-07-18 04:31:54.209360,0 days 00:01:57.233117,min,16,0.009933337077080238,8,22,bell,COMPLETE
484,0.0010112932650372386,2025-07-18 04:31:54.210342,2025-07-18 04:33:54.120872,0 days 00:01:59.910530,min,16,0.008092514148923088,8,23,bell,COMPLETE
485,0.0003788720350712538,2025-07-18 04:33:54.121926,2025-07-18 04:35:53.980057,0 days 00:01:59.858131,min,16,0.006397205543488758,8,23,bell,COMPLETE
486,0.00031119384220801294,2025-07-18 04:35:53.981124,2025-07-18 04:37:48.244891,0 days 00:01:54.263767,min,16,0.008721119663788156,8,21,bell,COMPLETE
487,0.00729884160682559,2025-07-18 04:37:48.245952,2025-07-18 04:39:42.540301,0 days 00:01:54.294349,min,16,0.00485156076992091,8,21,bell,COMPLETE
488,5.125147342681885,2025-07-18 04:39:42.541365,2025-07-18 04:41:36.838350,0 days 00:01:54.296985,min,16,8.00743287351671e-05,8,21,bell,COMPLETE
489,0.00046221064985729754,2025-07-18 04:41:36.839407,2025-07-18 04:43:31.097128,0 days 00:01:54.257721,min,16,0.007275469657178997,8,21,bell,COMPLETE
490,0.0014508016174659133,2025-07-18 04:43:31.098200,2025-07-18 04:45:28.180279,0 days 00:01:57.082079,min,16,0.005921525153072189,8,22,bell,COMPLETE
491,0.0004962892271578312,2025-07-18 04:45:28.181312,2025-07-18 04:47:25.942703,0 days 00:01:57.761391,min,16,0.007947795981317778,9,21,bell,COMPLETE
492,0.001483475905843079,2025-07-18 04:47:25.943740,2025-07-18 04:49:20.202677,0 days 00:01:54.258937,min,16,0.00865737239557021,8,21,bell,COMPLETE
493,0.0003983147908002138,2025-07-18 04:49:20.203683,2025-07-18 04:51:14.302031,0 days 00:01:54.098348,min,16,0.006954309419934921,8,21,bell,COMPLETE
494,0.13540150225162506,2025-07-18 04:51:14.303048,2025-07-18 04:53:11.300296,0 days 00:01:56.997248,min,16,3.74276002881538e-05,8,22,bell,COMPLETE
495,0.00044902824447490275,2025-07-18 04:53:11.301303,2025-07-18 04:55:11.127146,0 days 00:01:59.825843,min,16,0.008740456615304558,7,23,bell,COMPLETE
496,2.245224952697754,2025-07-18 04:55:11.128155,2025-07-18 04:57:08.386652,0 days 00:01:57.258497,min,16,2.3431363212513234e-05,8,22,bell,COMPLETE
497,0.05152194947004318,2025-07-18 04:57:08.387681,2025-07-18 04:58:13.017215,0 days 00:01:04.629534,min,32,0.009939563682595059,6,20,bell,COMPLETE
498,0.005005229264497757,2025-07-18 04:58:13.018210,2025-07-18 05:00:04.247312,0 days 00:01:51.229102,min,16,0.007476402609906282,6,21,bell,COMPLETE
499,0.058385249227285385,2025-07-18 05:00:04.248347,2025-07-18 05:02:01.415871,0 days 00:01:57.167524,min,16,0.006140098340797347,8,22,bell,COMPLETE
