number,value,datetime_start,datetime_complete,duration,params_activation,params_batch_size,params_h,params_lr,params_seq_length,state
0,0.0017444376135244966,2025-07-12 16:34:06.915649,2025-07-12 16:35:01.327914,0 days 00:00:54.412265,identity,128,123,0.00028025368843779224,18,COMPLETE
1,0.00030501006403937936,2025-07-12 16:35:01.328837,2025-07-12 16:37:26.792356,0 days 00:02:25.463519,identity,16,67,0.003251948278106155,19,COMPLETE
2,1.7180771827697754,2025-07-12 16:37:26.793176,2025-07-12 16:38:27.946960,0 days 00:01:01.153784,relu,128,21,0.0004433680109344327,25,COMPLETE
3,0.0003767547314055264,2025-07-12 16:38:27.947792,2025-07-12 16:39:29.366008,0 days 00:01:01.418216,identity,32,82,0.005975644732359553,15,COMPLETE
4,0.0007909759297035635,2025-07-12 16:39:29.366866,2025-07-12 16:39:57.303424,0 days 00:00:27.936558,identity,128,88,0.0005329159104347374,13,COMPLETE
5,0.0016544235404580832,2025-07-12 16:39:57.303912,2025-07-12 16:40:44.414771,0 days 00:00:47.110859,relu,64,42,0.0002276617951323572,22,COMPLETE
6,0.0011300267651677132,2025-07-12 16:40:44.415357,2025-07-12 16:41:06.782274,0 days 00:00:22.366917,identity,64,33,0.0006140087925919766,10,COMPLETE
7,0.000789062469266355,2025-07-12 16:41:06.782871,2025-07-12 16:42:06.738925,0 days 00:00:59.956054,relu,64,63,0.0003519384765841785,19,COMPLETE
8,0.0003513635019771755,2025-07-12 16:42:06.739533,2025-07-12 16:43:18.195515,0 days 00:01:11.455982,identity,128,57,0.009707800277308162,18,COMPLETE
9,1.6951563358306885,2025-07-12 16:43:18.196346,2025-07-12 16:44:00.971721,0 days 00:00:42.775375,relu,64,75,0.0008003218771263658,13,COMPLETE
10,0.0004020938358735293,2025-07-12 16:44:00.972321,2025-07-12 16:46:32.138050,0 days 00:02:31.165729,identity,16,109,0.002361309782055973,6,COMPLETE
11,0.0003453722456470132,2025-07-12 16:46:32.138864,2025-07-12 16:50:29.813158,0 days 00:03:57.674294,identity,16,52,0.00966214807732443,19,COMPLETE
12,0.00031053266138769686,2025-07-12 16:50:29.814136,2025-07-12 16:52:46.649474,0 days 00:02:16.835338,identity,16,50,0.002655645206105932,22,COMPLETE
13,0.0003338025417178869,2025-07-12 16:52:46.650293,2025-07-12 16:54:51.830261,0 days 00:02:05.179968,identity,16,16,0.0020273946671034017,25,COMPLETE
14,0.0003343131102155894,2025-07-12 16:54:51.831134,2025-07-12 16:58:57.699071,0 days 00:04:05.867937,identity,16,97,0.0021219526318365873,22,COMPLETE
15,0.00029163702856749296,2025-07-12 16:58:57.699897,2025-07-12 17:01:02.065091,0 days 00:02:04.365194,identity,16,36,0.003922102918768285,22,COMPLETE
16,0.00034401434822939336,2025-07-12 17:01:02.065890,2025-07-12 17:02:08.520041,0 days 00:01:06.454151,identity,32,31,0.00443489410117111,21,COMPLETE
17,0.0003520358877722174,2025-07-12 17:02:08.520867,2025-07-12 17:04:03.546434,0 days 00:01:55.025567,identity,16,71,0.0012459563682123973,16,COMPLETE
18,0.0009350350592285395,2025-07-12 17:04:03.547249,2025-07-12 17:06:01.736088,0 days 00:01:58.188839,relu,16,8,0.004217964909143207,24,COMPLETE
19,0.0007497704937122762,2025-07-12 17:06:01.736924,2025-07-12 17:07:35.356517,0 days 00:01:33.619593,identity,16,31,0.0001334360985180596,16,COMPLETE
20,0.0003866653423756361,2025-07-12 17:07:35.357349,2025-07-12 17:08:59.845448,0 days 00:01:24.488099,identity,32,43,0.004255406854731255,20,COMPLETE
21,0.00034169951686635613,2025-07-12 17:08:59.846284,2025-07-12 17:11:12.140182,0 days 00:02:12.293898,identity,16,50,0.001260249661610307,23,COMPLETE
22,0.00029673485551029444,2025-07-12 17:11:12.140994,2025-07-12 17:13:19.746733,0 days 00:02:07.605739,identity,16,64,0.002818383711208182,21,COMPLETE
23,0.0003137096355203539,2025-07-12 17:13:19.747579,2025-07-12 17:16:22.884332,0 days 00:03:03.136753,identity,16,93,0.0031912093054468223,20,COMPLETE
24,0.000341297360137105,2025-07-12 17:16:22.885170,2025-07-12 17:18:46.608137,0 days 00:02:23.722967,identity,16,65,0.006423166385151795,23,COMPLETE
25,0.0003324871649965644,2025-07-12 17:18:46.609154,2025-07-12 17:21:21.941897,0 days 00:02:35.332743,identity,16,82,0.0013547920239765047,17,COMPLETE
26,1.7180771827697754,2025-07-12 17:21:21.943174,2025-07-12 17:24:58.089696,0 days 00:03:36.146522,relu,16,104,0.0016410625993844815,20,COMPLETE
27,0.00034424522891640663,2025-07-12 17:24:58.090506,2025-07-12 17:27:11.408131,0 days 00:02:13.317625,identity,16,62,0.006151790725009486,21,COMPLETE
28,0.0003918689035344869,2025-07-12 17:27:11.409010,2025-07-12 17:28:09.159170,0 days 00:00:57.750160,identity,32,77,0.002974553509026192,13,COMPLETE
29,0.0015941362362354994,2025-07-12 17:28:09.159767,2025-07-12 17:28:35.809729,0 days 00:00:26.649962,identity,128,38,0.0008283021677533216,18,COMPLETE
30,0.0003947915101889521,2025-07-12 17:28:35.810322,2025-07-12 17:29:36.684094,0 days 00:01:00.873772,identity,16,120,0.0035320544877756464,5,COMPLETE
31,0.0003213636518921703,2025-07-12 17:29:36.684682,2025-07-12 17:31:48.288610,0 days 00:02:11.603928,identity,16,54,0.002528244640288874,22,COMPLETE
32,0.0003070503880735487,2025-07-12 17:31:48.289495,2025-07-12 17:34:01.873976,0 days 00:02:13.584481,identity,16,48,0.005081822534606764,24,COMPLETE
33,0.0003827530308626592,2025-07-12 17:34:01.874856,2025-07-12 17:36:12.087800,0 days 00:02:10.212944,identity,16,23,0.007230828356500683,25,COMPLETE
34,0.00035237567499279976,2025-07-12 17:36:12.088653,2025-07-12 17:36:46.103973,0 days 00:00:34.015320,identity,128,44,0.004451633061868062,24,COMPLETE
35,1.7192953824996948,2025-07-12 17:36:46.104496,2025-07-12 17:39:30.591196,0 days 00:02:44.486700,relu,16,71,0.005373987470099047,24,COMPLETE
36,0.0003329449682496488,2025-07-12 17:39:30.592057,2025-07-12 17:40:58.109128,0 days 00:01:27.517071,identity,32,58,0.008033729744652777,21,COMPLETE
37,0.0007312919478863478,2025-07-12 17:40:58.109965,2025-07-12 17:41:49.491383,0 days 00:00:51.381418,identity,64,24,0.001897924778657235,23,COMPLETE
38,0.0003458590363152325,2025-07-12 17:41:49.491990,2025-07-12 17:43:42.366139,0 days 00:01:52.874149,relu,16,37,0.003663301141285204,19,COMPLETE
39,0.00035757909063249826,2025-07-12 17:43:42.366984,2025-07-12 17:44:07.293996,0 days 00:00:24.927012,identity,128,84,0.005389650352844303,11,COMPLETE
40,0.0004709138011094183,2025-07-12 17:44:07.294605,2025-07-12 17:44:52.425617,0 days 00:00:45.131012,identity,64,60,0.001497300870386254,17,COMPLETE
41,0.00031092556309886277,2025-07-12 17:44:52.426240,2025-07-12 17:46:59.148632,0 days 00:02:06.722392,identity,16,49,0.002948723150373507,22,COMPLETE
42,0.0002932334318757057,2025-07-12 17:46:59.149514,2025-07-12 17:49:22.974205,0 days 00:02:23.824691,identity,16,65,0.0029332013593607676,23,COMPLETE
43,0.00031623870017938316,2025-07-12 17:49:22.975077,2025-07-12 17:52:00.108481,0 days 00:02:37.133404,identity,16,68,0.005059200427794292,25,COMPLETE
44,0.00037886950303800404,2025-07-12 17:52:00.109359,2025-07-12 17:54:16.321004,0 days 00:02:16.211645,identity,16,46,0.000980572167775855,23,COMPLETE
45,0.00034845186746679246,2025-07-12 17:54:16.321860,2025-07-12 17:56:43.942866,0 days 00:02:27.621006,identity,16,74,0.007991693375112909,21,COMPLETE
46,0.00031562807271257043,2025-07-12 17:56:43.943738,2025-07-12 17:58:47.000869,0 days 00:02:03.057131,relu,16,65,0.002403559501502194,19,COMPLETE
47,0.00038825179217383265,2025-07-12 17:58:47.001748,2025-07-12 17:59:39.311216,0 days 00:00:52.309468,identity,64,54,0.0018167011923583708,23,COMPLETE
48,0.000386699044611305,2025-07-12 17:59:39.311839,2025-07-12 18:00:42.022242,0 days 00:01:02.710403,identity,16,39,0.003717765371376977,8,COMPLETE
49,0.0010109998984262347,2025-07-12 18:00:42.023089,2025-07-12 18:01:29.144728,0 days 00:00:47.121639,identity,128,80,0.00048655223869000457,24,COMPLETE
50,0.00041006278479471803,2025-07-12 18:01:29.145348,2025-07-12 18:03:31.049359,0 days 00:02:01.904011,identity,16,56,0.0003672058776593657,20,COMPLETE
51,0.0003058635338675231,2025-07-12 18:03:31.050236,2025-07-12 18:05:36.258661,0 days 00:02:05.208425,identity,16,48,0.0028720115062634242,22,COMPLETE
52,0.0003100362082477659,2025-07-12 18:05:36.259546,2025-07-12 18:07:53.232348,0 days 00:02:16.972802,identity,16,68,0.0022841158340487573,21,COMPLETE
53,0.00029910416924394667,2025-07-12 18:07:53.233234,2025-07-12 18:10:07.771186,0 days 00:02:14.537952,identity,16,47,0.002867795072711664,22,COMPLETE
54,0.000608358473982662,2025-07-12 18:10:07.772089,2025-07-12 18:12:13.269089,0 days 00:02:05.497000,identity,16,35,0.0028691401576192216,22,COMPLETE
55,0.0003404546878300607,2025-07-12 18:12:13.269955,2025-07-12 18:14:26.399932,0 days 00:02:13.129977,identity,16,88,0.003466080082062132,15,COMPLETE
56,0.00040841256850399077,2025-07-12 18:14:26.400790,2025-07-12 18:15:43.231528,0 days 00:01:16.830738,identity,32,41,0.002010122141113058,18,COMPLETE
57,0.00038905840483494103,2025-07-12 18:15:43.232391,2025-07-12 18:17:35.257943,0 days 00:01:52.025552,relu,16,27,0.0006246193360536326,20,COMPLETE
58,0.0005611295928247273,2025-07-12 18:17:35.258837,2025-07-12 18:19:27.746346,0 days 00:01:52.487509,identity,16,16,0.00415570556030456,22,COMPLETE
59,0.00040240801172330976,2025-07-12 18:19:27.747232,2025-07-12 18:21:57.320301,0 days 00:02:29.573069,identity,16,72,0.00023880956774358588,21,COMPLETE
60,0.00040209098369814456,2025-07-12 18:21:57.321159,2025-07-12 18:22:54.500858,0 days 00:00:57.179699,identity,64,64,0.0026792278472625064,19,COMPLETE
61,0.00030272346339188516,2025-07-12 18:22:54.501509,2025-07-12 18:25:09.703993,0 days 00:02:15.202484,identity,16,48,0.004843151714664922,24,COMPLETE
62,0.00035110674798488617,2025-07-12 18:25:09.704830,2025-07-12 18:27:17.248806,0 days 00:02:07.543976,identity,16,31,0.0030846244109555177,23,COMPLETE
63,0.00044507524580694735,2025-07-12 18:27:17.249677,2025-07-12 18:29:50.564107,0 days 00:02:33.314430,identity,16,59,0.00010428278975941967,25,COMPLETE
64,0.00032784155337139964,2025-07-12 18:29:50.564969,2025-07-12 18:32:11.516382,0 days 00:02:20.951413,identity,16,53,0.004144879246734624,24,COMPLETE
65,0.0004664916777983308,2025-07-12 18:32:11.518199,2025-07-12 18:34:27.416225,0 days 00:02:15.898026,identity,16,45,0.006377519741013654,23,COMPLETE
66,0.0003326257865410298,2025-07-12 18:34:27.417077,2025-07-12 18:36:31.671895,0 days 00:02:04.254818,identity,16,51,0.0016231758729879453,21,COMPLETE
67,0.00039163080509752035,2025-07-12 18:36:31.672752,2025-07-12 18:38:01.872254,0 days 00:01:30.199502,identity,32,42,0.0011261747246088577,22,COMPLETE
68,0.0003081015311181545,2025-07-12 18:38:01.873094,2025-07-12 18:40:11.201671,0 days 00:02:09.328577,relu,16,62,0.0022456339619091052,20,COMPLETE
69,0.0003628996491897851,2025-07-12 18:40:11.202526,2025-07-12 18:43:52.581293,0 days 00:03:41.378767,identity,16,77,0.004878838481228419,22,COMPLETE
70,0.0003348850295878947,2025-07-12 18:43:52.582159,2025-07-12 18:44:30.155393,0 days 00:00:37.573234,identity,128,56,0.0032196851262274065,24,COMPLETE
71,0.0003417345869820565,2025-07-12 18:44:30.156016,2025-07-12 18:46:44.471462,0 days 00:02:14.315446,identity,16,48,0.005524305878952315,24,COMPLETE
72,0.0003669734578579664,2025-07-12 18:46:44.502968,2025-07-12 18:49:13.983637,0 days 00:02:29.480669,identity,16,47,0.0037916310156918807,25,COMPLETE
73,0.0004823408380616456,2025-07-12 18:49:13.984493,2025-07-12 18:51:21.925181,0 days 00:02:07.940688,identity,16,37,0.004596136970946976,22,COMPLETE
74,0.0005454937345348299,2025-07-12 18:51:21.926111,2025-07-12 18:52:45.991912,0 days 00:01:24.065801,identity,16,33,0.006950254665167389,14,COMPLETE
75,0.00028578698402270675,2025-07-12 18:52:45.992774,2025-07-12 18:55:12.408727,0 days 00:02:26.415953,identity,16,60,0.0026941958293108044,23,COMPLETE
76,0.0003002714365720749,2025-07-12 18:55:12.409614,2025-07-12 18:57:43.772374,0 days 00:02:31.362760,identity,16,61,0.002645385158684705,23,COMPLETE
77,0.00032126635778695345,2025-07-12 18:57:43.773235,2025-07-12 19:00:16.744482,0 days 00:02:32.971247,identity,16,68,0.002525459767797574,23,COMPLETE
78,0.0003036718990188092,2025-07-12 19:00:16.745334,2025-07-12 19:02:55.755332,0 days 00:02:39.009998,identity,16,67,0.0017488819096542997,23,COMPLETE
79,0.0003423269954510033,2025-07-12 19:02:55.756196,2025-07-12 19:05:27.508864,0 days 00:02:31.752668,identity,16,61,0.0017875575011325488,23,COMPLETE
80,0.00029984087450429797,2025-07-12 19:05:27.509702,2025-07-12 19:08:17.184537,0 days 00:02:49.674835,identity,16,71,0.001994503504979058,25,COMPLETE
81,0.00030376005452126265,2025-07-12 19:08:17.185385,2025-07-12 19:11:09.762870,0 days 00:02:52.577485,identity,16,71,0.0014641223136072636,25,COMPLETE
82,0.0003289446176495403,2025-07-12 19:11:09.763729,2025-07-12 19:13:47.673797,0 days 00:02:37.910068,identity,16,65,0.0020778870167645234,24,COMPLETE
83,0.0002906299487221986,2025-07-12 19:13:47.674666,2025-07-12 19:16:25.350868,0 days 00:02:37.676202,identity,16,59,0.002606086258502356,24,COMPLETE
84,0.0003036286507267505,2025-07-12 19:16:25.351734,2025-07-12 19:19:02.028722,0 days 00:02:36.676988,identity,16,57,0.002670593411852842,25,COMPLETE
85,0.00039711923454888165,2025-07-12 19:19:02.029597,2025-07-12 19:21:30.570284,0 days 00:02:28.540687,identity,16,54,0.0037784042033596273,24,COMPLETE
86,1.7192953824996948,2025-07-12 19:21:30.571165,2025-07-12 19:22:42.759529,0 days 00:01:12.188364,relu,64,76,0.003411440055595441,24,COMPLETE
87,0.0004165948193985969,2025-07-12 19:22:42.760401,2025-07-12 19:23:37.891905,0 days 00:00:55.131504,identity,32,58,0.0022149906483440716,11,COMPLETE
88,0.0003032617678400129,2025-07-12 19:23:37.892530,2025-07-12 19:26:22.031242,0 days 00:02:44.138712,identity,16,62,0.0031915388246691904,25,COMPLETE
89,0.000343335181241855,2025-07-12 19:26:22.032092,2025-07-12 19:26:59.599623,0 days 00:00:37.567531,identity,128,51,0.0028013656913725314,23,COMPLETE
90,0.000316404941258952,2025-07-12 19:26:59.600251,2025-07-12 19:29:28.154211,0 days 00:02:28.553960,identity,16,73,0.0024832343509201783,21,COMPLETE
91,0.000364673207513988,2025-07-12 19:29:28.155073,2025-07-12 19:32:12.318224,0 days 00:02:44.163151,identity,16,62,0.00322895613483796,25,COMPLETE
92,0.0003563870268408209,2025-07-12 19:32:12.319084,2025-07-12 19:35:00.490453,0 days 00:02:48.171369,identity,16,70,0.003971743692620851,25,COMPLETE
93,0.00037580731441266835,2025-07-12 19:35:00.491333,2025-07-12 19:38:35.323197,0 days 00:03:34.831864,identity,16,128,0.004544311470891171,24,COMPLETE
94,0.00029842319781892,2025-07-12 19:38:35.324074,2025-07-12 19:41:20.713919,0 days 00:02:45.389845,identity,16,66,0.0019734048682623863,25,COMPLETE
95,0.00030458284891210496,2025-07-12 19:41:20.714790,2025-07-12 19:43:53.175308,0 days 00:02:32.460518,identity,16,65,0.0020384536702229743,23,COMPLETE
96,0.00029264201293699443,2025-07-12 19:43:53.176187,2025-07-12 19:46:24.838383,0 days 00:02:31.662196,identity,16,58,0.0023189874050115623,24,COMPLETE
97,0.00031970549025572836,2025-07-12 19:46:24.839261,2025-07-12 19:48:49.529193,0 days 00:02:24.689932,identity,16,59,0.0015261287181771582,22,COMPLETE
98,0.0003396484244149178,2025-07-12 19:48:49.530115,2025-07-12 19:52:16.157870,0 days 00:03:26.627755,identity,16,79,0.002438604828563878,23,COMPLETE
99,1.7192953824996948,2025-07-12 19:52:16.158760,2025-07-12 19:54:58.970881,0 days 00:02:42.812121,relu,16,69,0.00127251704662814,24,COMPLETE
100,0.00035178064717911184,2025-07-12 19:54:58.971767,2025-07-12 19:56:04.842513,0 days 00:01:05.870746,identity,64,86,0.0020021492316393283,21,COMPLETE
101,0.00030132432584650815,2025-07-12 19:56:04.843157,2025-07-12 19:58:31.221787,0 days 00:02:26.378630,identity,16,56,0.002867764244588352,24,COMPLETE
102,0.0003010994987562299,2025-07-12 19:58:31.222682,2025-07-12 20:01:07.459727,0 days 00:02:36.237045,identity,16,55,0.0022758025201971657,25,COMPLETE
103,0.0003103578637819737,2025-07-12 20:01:07.460651,2025-07-12 20:03:51.198060,0 days 00:02:43.737409,identity,16,65,0.002237518200827253,25,COMPLETE
104,0.00032600248232483864,2025-07-12 20:03:51.198939,2025-07-12 20:06:23.293421,0 days 00:02:32.094482,identity,16,60,0.001667726801953906,25,COMPLETE
105,0.0003068629011977464,2025-07-12 20:06:23.294306,2025-07-12 20:08:53.583375,0 days 00:02:30.289069,identity,16,67,0.0019186506624777515,23,COMPLETE
106,0.0002953999792225659,2025-07-12 20:08:53.584245,2025-07-12 20:11:06.516362,0 days 00:02:12.932117,identity,16,54,0.0027195054995747072,22,COMPLETE
107,0.000300655112368986,2025-07-12 20:11:06.517269,2025-07-12 20:13:22.496603,0 days 00:02:15.979334,identity,16,52,0.003482735416422731,22,COMPLETE
108,0.00034094933653250337,2025-07-12 20:13:22.497478,2025-07-12 20:14:53.542863,0 days 00:01:31.045385,identity,32,74,0.003076137889196443,21,COMPLETE
109,0.0002980484568979591,2025-07-12 20:14:53.543752,2025-07-12 20:17:24.294462,0 days 00:02:30.750710,identity,16,63,0.0026777928166766296,22,COMPLETE
110,0.0009123847703449428,2025-07-12 20:17:24.295358,2025-07-12 20:17:53.533139,0 days 00:00:29.237781,identity,128,40,0.0024697358939086977,20,COMPLETE
111,0.00030765720293857157,2025-07-12 20:17:53.533777,2025-07-12 20:20:23.461323,0 days 00:02:29.927546,identity,16,63,0.0027186602307178176,22,COMPLETE
112,0.00030253591830842197,2025-07-12 20:20:23.462171,2025-07-12 20:22:38.865287,0 days 00:02:15.403116,identity,16,44,0.002562576025310045,23,COMPLETE
113,0.0003857743868138641,2025-07-12 20:22:38.866186,2025-07-12 20:25:01.201960,0 days 00:02:22.335774,identity,16,60,0.0029389593040202505,22,COMPLETE
114,0.00031927722739055753,2025-07-12 20:25:01.202863,2025-07-12 20:27:29.851911,0 days 00:02:28.649048,identity,16,58,0.00355970971233989,23,COMPLETE
115,0.00034364801831543446,2025-07-12 20:27:29.852831,2025-07-12 20:29:58.048798,0 days 00:02:28.195967,identity,16,64,0.0021396356542592453,24,COMPLETE
116,0.00032582649146206677,2025-07-12 20:29:58.049670,2025-07-12 20:32:17.054165,0 days 00:02:19.004495,identity,16,53,0.0018814594687788222,22,COMPLETE
117,0.0003431902441661805,2025-07-12 20:32:17.055066,2025-07-12 20:34:55.048854,0 days 00:02:37.993788,identity,16,71,0.0026510273894579826,23,COMPLETE
118,0.0003308453888166696,2025-07-12 20:34:55.049759,2025-07-12 20:37:16.951952,0 days 00:02:21.902193,identity,16,66,0.0014149002741707041,21,COMPLETE
119,1.7192953824996948,2025-07-12 20:37:16.952807,2025-07-12 20:39:30.726482,0 days 00:02:13.773675,relu,16,27,0.004076901055515532,24,COMPLETE
120,0.00035316619323566556,2025-07-12 20:39:30.727408,2025-07-12 20:40:28.860567,0 days 00:00:58.133159,identity,16,50,0.003246829933824317,7,COMPLETE
121,0.00030059300479479134,2025-07-12 20:40:28.861213,2025-07-12 20:42:47.009239,0 days 00:02:18.148026,identity,16,53,0.003525761254651977,22,COMPLETE
122,0.00028815402765758336,2025-07-12 20:42:47.010169,2025-07-12 20:45:09.500977,0 days 00:02:22.490808,identity,16,57,0.0030060392379864164,22,COMPLETE
123,0.00029827604885213077,2025-07-12 20:45:09.501878,2025-07-12 20:47:38.001841,0 days 00:02:28.499963,identity,16,61,0.0023737227907656,22,COMPLETE
124,0.0003066057397518307,2025-07-12 20:47:38.002701,2025-07-12 20:49:44.524760,0 days 00:02:06.522059,identity,16,56,0.003017862801763187,20,COMPLETE
125,0.00030482650618068874,2025-07-12 20:49:44.525669,2025-07-12 20:52:08.464238,0 days 00:02:23.938569,identity,16,58,0.0023586676523676647,22,COMPLETE
126,0.0002935700467787683,2025-07-12 20:52:08.465142,2025-07-12 20:54:34.452341,0 days 00:02:25.987199,identity,16,69,0.002117326877491757,21,COMPLETE
127,0.0003117325541097671,2025-07-12 20:54:34.453218,2025-07-12 20:56:57.424738,0 days 00:02:22.971520,identity,16,68,0.0023812453911231353,21,COMPLETE
128,0.00037249812157824636,2025-07-12 20:56:57.425635,2025-07-12 20:57:57.616630,0 days 00:01:00.190995,identity,64,63,0.0029740120935146668,20,COMPLETE
129,0.0003055526758544147,2025-07-12 20:57:57.617301,2025-07-12 21:00:20.309064,0 days 00:02:22.691763,identity,16,61,0.002173077969007157,21,COMPLETE
130,0.0003256895870435983,2025-07-12 21:00:20.309942,2025-07-12 21:02:33.677091,0 days 00:02:13.367149,identity,16,46,0.0017332508336397653,22,COMPLETE
131,0.000301617372315377,2025-07-12 21:02:33.678004,2025-07-12 21:04:56.785166,0 days 00:02:23.107162,identity,16,72,0.0018943944031354167,21,COMPLETE
132,0.0002785325632430613,2025-07-12 21:04:56.786061,2025-07-12 21:07:32.963572,0 days 00:02:36.177511,identity,16,67,0.002799950488769081,23,COMPLETE
133,0.00031045186915434897,2025-07-12 21:07:32.964456,2025-07-12 21:10:09.625865,0 days 00:02:36.661409,identity,16,67,0.0026925345551434797,23,COMPLETE
134,0.00028351027867756784,2025-07-12 21:10:09.626761,2025-07-12 21:12:40.664887,0 days 00:02:31.038126,identity,16,63,0.0038440598800581023,22,COMPLETE
135,0.0003975874569732696,2025-07-12 21:12:40.665754,2025-07-12 21:14:37.684085,0 days 00:01:57.018331,identity,16,16,0.0037213905810807952,23,COMPLETE
136,0.0003384143055882305,2025-07-12 21:14:37.685012,2025-07-12 21:16:13.328017,0 days 00:01:35.643005,identity,32,69,0.0033994842192346373,22,COMPLETE
137,0.00033915325184352696,2025-07-12 21:16:13.328892,2025-07-12 21:18:26.839630,0 days 00:02:13.510738,identity,16,64,0.0031929906297295703,21,COMPLETE
138,0.0003355701919645071,2025-07-12 21:18:26.840505,2025-07-12 21:19:19.040709,0 days 00:00:52.200204,identity,128,76,0.00439856370116392,22,COMPLETE
139,0.00030953207169659436,2025-07-12 21:19:19.041401,2025-07-12 21:21:53.632022,0 days 00:02:34.590621,identity,16,60,0.0040720474071158745,24,COMPLETE
140,0.00030308248824439943,2025-07-12 21:21:53.632951,2025-07-12 21:24:31.528005,0 days 00:02:37.895054,identity,16,63,0.0023736337666640087,23,COMPLETE
141,0.00029602067661471665,2025-07-12 21:24:31.528913,2025-07-12 21:26:44.679290,0 days 00:02:13.150377,identity,16,56,0.0028065404020363146,22,COMPLETE
142,0.0003237189375795424,2025-07-12 21:26:44.680171,2025-07-12 21:28:55.809636,0 days 00:02:11.129465,identity,16,57,0.0028309477383840426,21,COMPLETE
143,0.00031326714088208973,2025-07-12 21:28:55.810544,2025-07-12 21:31:11.423726,0 days 00:02:15.613182,identity,16,55,0.0025680018397060728,22,COMPLETE
