number,value,datetime_start,datetime_complete,duration,params_activation,params_batch_size,params_h,params_lr,params_seq_length,state
432,0.0003227407578378916,2025-07-13 09:53:40.556456,2025-07-13 09:56:46.534045,0 days 00:03:05.977589,identity,16,120,0.0022197727966194424,22,COMPLETE
433,0.00031946017406880856,2025-07-13 09:56:46.535054,2025-07-13 09:59:25.751262,0 days 00:02:39.216208,identity,16,69,0.0026689807056323915,23,COMPLETE
434,0.0002924409054685384,2025-07-13 09:59:25.752307,2025-07-13 10:02:07.653079,0 days 00:02:41.900772,identity,16,71,0.0023851272690957825,24,COMPLETE
435,0.0003026050399057567,2025-07-13 10:02:07.654241,2025-07-13 10:04:27.191243,0 days 00:02:19.537002,identity,16,76,0.0027988309664717464,21,COMPLETE
436,0.0003321085823699832,2025-07-13 10:04:27.192295,2025-07-13 10:06:48.272931,0 days 00:02:21.080636,identity,16,67,0.0008487927665173358,22,COMPLETE
437,0.0003086313372477889,2025-07-13 10:06:48.274065,2025-07-13 10:09:05.927010,0 days 00:02:17.652945,identity,16,57,0.002518834237003607,23,COMPLETE
438,0.0003138719766866416,2025-07-13 10:09:05.928051,2025-07-13 10:12:35.240228,0 days 00:03:29.312177,identity,16,111,0.0020641660860662215,22,COMPLETE
439,0.000327312242006883,2025-07-13 10:12:35.241228,2025-07-13 10:15:14.568714,0 days 00:02:39.327486,identity,16,73,0.0035395973517168442,23,COMPLETE
440,0.00031421551830135286,2025-07-13 10:15:14.569795,2025-07-13 10:17:16.028278,0 days 00:02:01.458483,identity,16,20,0.0029926714501885697,24,COMPLETE
441,0.00030139126465655863,2025-07-13 10:17:16.029298,2025-07-13 10:20:25.783782,0 days 00:03:09.754484,identity,16,80,0.0023029246034480797,23,COMPLETE
442,0.00030866829911246896,2025-07-13 10:20:25.784810,2025-07-13 10:22:42.496456,0 days 00:02:16.711646,identity,16,65,0.003280113819997595,22,COMPLETE
443,1.7199456691741943,2025-07-13 10:22:42.497597,2025-07-13 10:25:08.233924,0 days 00:02:25.736327,relu,16,68,0.0026305922952939834,23,COMPLETE
444,0.0008530039922334254,2025-07-13 10:25:08.235027,2025-07-13 10:26:17.790076,0 days 00:01:09.555049,identity,64,77,0.0002936123572496011,24,COMPLETE
445,0.00031613250030204654,2025-07-13 10:26:17.791167,2025-07-13 10:28:44.144046,0 days 00:02:26.352879,identity,16,70,0.0024251238920122787,22,COMPLETE
446,0.0002909177273977548,2025-07-13 10:28:44.145112,2025-07-13 10:30:55.943517,0 days 00:02:11.798405,identity,16,61,0.0030104847619751526,21,COMPLETE
447,0.0003199459461029619,2025-07-13 10:30:55.944708,2025-07-13 10:33:33.125359,0 days 00:02:37.180651,identity,16,74,0.0020708090223111627,23,COMPLETE
448,0.00030572598916478455,2025-07-13 10:33:33.126430,2025-07-13 10:36:03.339021,0 days 00:02:30.212591,identity,16,63,0.001872114644310038,24,COMPLETE
449,0.0002871036413125694,2025-07-13 10:36:03.340046,2025-07-13 10:38:34.020766,0 days 00:02:30.680720,identity,16,71,0.0027544594183613585,22,COMPLETE
450,0.0003365220327395946,2025-07-13 10:38:34.021797,2025-07-13 10:40:55.351139,0 days 00:02:21.329342,identity,16,70,0.0038062177484899672,21,COMPLETE
451,0.00035549671156331897,2025-07-13 10:40:55.352150,2025-07-13 10:42:14.423158,0 days 00:01:19.071008,identity,32,66,0.0027978380153698638,21,COMPLETE
452,0.0003217651683371514,2025-07-13 10:42:14.424271,2025-07-13 10:44:29.801976,0 days 00:02:15.377705,identity,16,59,0.003346778092483628,22,COMPLETE
453,0.0004067581903655082,2025-07-13 10:44:29.803124,2025-07-13 10:46:49.408218,0 days 00:02:19.605094,identity,16,68,0.0030495642848044637,22,COMPLETE
454,0.0003089051751885563,2025-07-13 10:46:49.409374,2025-07-13 10:49:08.807078,0 days 00:02:19.397704,identity,16,63,0.002801123221302038,22,COMPLETE
455,0.00038925211993046105,2025-07-13 10:49:08.808220,2025-07-13 10:49:39.701148,0 days 00:00:30.892928,identity,128,52,0.002234091199762372,19,COMPLETE
456,0.0003223837411496788,2025-07-13 10:49:39.701947,2025-07-13 10:52:05.008422,0 days 00:02:25.306475,identity,16,71,0.002597899431661884,21,COMPLETE
457,0.000323522777762264,2025-07-13 10:52:05.009433,2025-07-13 10:54:27.377559,0 days 00:02:22.368126,identity,16,65,0.0030782716986700225,22,COMPLETE
458,0.00033537435228936374,2025-07-13 10:54:27.378759,2025-07-13 10:56:29.704122,0 days 00:02:02.325363,identity,16,57,0.0016843694062463898,20,COMPLETE
459,0.00034511974081397057,2025-07-13 10:56:29.705277,2025-07-13 10:59:37.883611,0 days 00:03:08.178334,identity,16,78,0.003520858923221886,22,COMPLETE
460,0.0002903580025304109,2025-07-13 10:59:37.884735,2025-07-13 11:01:52.219495,0 days 00:02:14.334760,identity,16,68,0.0023683533171243117,21,COMPLETE
461,0.0003269081353209913,2025-07-13 11:01:52.220531,2025-07-13 11:05:21.610947,0 days 00:03:29.390416,identity,16,123,0.002737879922792739,23,COMPLETE
462,0.0003092282568104565,2025-07-13 11:05:21.612081,2025-07-13 11:08:03.135711,0 days 00:02:41.523630,relu,16,75,0.0019612904780400625,23,COMPLETE
463,0.0003585974336601794,2025-07-13 11:08:03.136750,2025-07-13 11:10:13.239207,0 days 00:02:10.102457,identity,16,54,0.00323255628790068,22,COMPLETE
464,0.00029408285627141595,2025-07-13 11:10:13.240312,2025-07-13 11:12:43.359813,0 days 00:02:30.119501,identity,16,72,0.0025041226038698726,23,COMPLETE
465,0.0003244452818762511,2025-07-13 11:12:43.360974,2025-07-13 11:14:56.227525,0 days 00:02:12.866551,identity,16,60,0.0021458778713034413,21,COMPLETE
466,0.00031577618210576475,2025-07-13 11:14:56.228647,2025-07-13 11:17:01.458100,0 days 00:02:05.229453,identity,16,49,0.002856163721231025,22,COMPLETE
467,0.00030105491168797016,2025-07-13 11:17:01.459269,2025-07-13 11:19:36.756536,0 days 00:02:35.297267,identity,16,66,0.0023164289538099994,24,COMPLETE
468,0.0003044532786589116,2025-07-13 11:19:36.757620,2025-07-13 11:21:59.668052,0 days 00:02:22.910432,identity,16,62,0.0026208385105509955,23,COMPLETE
469,0.0002887020818889141,2025-07-13 11:21:59.669216,2025-07-13 11:24:32.910528,0 days 00:02:33.241312,identity,16,69,0.0038292400619112203,23,COMPLETE
470,0.00035637940163724124,2025-07-13 11:24:32.911651,2025-07-13 11:27:06.488885,0 days 00:02:33.577234,identity,16,69,0.003918514380252484,23,COMPLETE
471,0.0003219751233700663,2025-07-13 11:27:06.489986,2025-07-13 11:28:16.145676,0 days 00:01:09.655690,identity,64,71,0.0037636955528933497,24,COMPLETE
472,0.00034407636849209666,2025-07-13 11:28:16.146730,2025-07-13 11:30:43.495540,0 days 00:02:27.348810,identity,16,67,0.0036792372543320295,23,COMPLETE
473,0.0003505980421323329,2025-07-13 11:30:43.496573,2025-07-13 11:33:16.259762,0 days 00:02:32.763189,identity,16,70,0.003182760157385687,23,COMPLETE
474,0.0003394162922631949,2025-07-13 11:33:16.260844,2025-07-13 11:35:54.171463,0 days 00:02:37.910619,identity,16,74,0.003469921308533442,23,COMPLETE
475,0.0003127792151644826,2025-07-13 11:35:54.172497,2025-07-13 11:38:22.089304,0 days 00:02:27.916807,identity,16,65,0.0021935822905128953,24,COMPLETE
476,0.0003599894989747554,2025-07-13 11:38:22.090381,2025-07-13 11:39:50.206763,0 days 00:01:28.116382,identity,32,72,0.0014663876239374768,23,COMPLETE
477,0.00028915301663801074,2025-07-13 11:39:50.207822,2025-07-13 11:42:10.454363,0 days 00:02:20.246541,identity,16,68,0.0019814980339213787,22,COMPLETE
478,0.00036979830474592745,2025-07-13 11:42:10.455447,2025-07-13 11:44:30.211877,0 days 00:02:19.756430,identity,16,63,0.003874624648833776,22,COMPLETE
479,0.0003926295612473041,2025-07-13 11:44:30.213011,2025-07-13 11:45:25.674909,0 days 00:00:55.461898,identity,128,75,0.002509249814924473,24,COMPLETE
480,0.00027481370489113033,2025-07-13 11:45:25.675706,2025-07-13 11:47:54.373782,0 days 00:02:28.698076,identity,16,59,0.0033955798271770366,23,COMPLETE
481,1.7180771827697754,2025-07-13 11:47:54.374824,2025-07-13 11:50:22.119938,0 days 00:02:27.745114,relu,16,57,0.004306545147217883,25,COMPLETE
482,0.0002968372718896717,2025-07-13 11:50:22.120974,2025-07-13 11:52:44.237368,0 days 00:02:22.116394,identity,16,58,0.0034090897248120057,24,COMPLETE
483,0.0003595096350181848,2025-07-13 11:52:44.238400,2025-07-13 11:54:58.551402,0 days 00:02:14.313002,identity,16,60,0.0032917874725245113,22,COMPLETE
484,0.0004297994018997997,2025-07-13 11:54:58.552510,2025-07-13 11:57:22.000956,0 days 00:02:23.448446,identity,16,61,0.000178583164620106,23,COMPLETE
485,0.0003118272579740733,2025-07-13 11:57:22.002038,2025-07-13 11:59:38.166470,0 days 00:02:16.164432,identity,16,55,0.003876306830325169,23,COMPLETE
486,0.0003463523753453046,2025-07-13 11:59:38.167708,2025-07-13 12:01:53.617953,0 days 00:02:15.450245,identity,16,59,0.001162502759994465,22,COMPLETE
487,0.00034682839759625494,2025-07-13 12:01:53.619160,2025-07-13 12:04:10.361197,0 days 00:02:16.742037,identity,16,64,0.004059048968884325,23,COMPLETE
488,0.000327927089529112,2025-07-13 12:04:10.362252,2025-07-13 12:05:30.641757,0 days 00:01:20.279505,identity,16,62,0.0035038491915882334,11,COMPLETE
489,0.0003271073510404676,2025-07-13 12:05:30.642939,2025-07-13 12:07:48.911498,0 days 00:02:18.268559,identity,16,56,0.003071335194912325,24,COMPLETE
490,0.0003209236601833254,2025-07-13 12:07:48.912578,2025-07-13 12:09:50.787326,0 days 00:02:01.874748,identity,16,34,0.0031074989468919396,22,COMPLETE
491,0.0003043372416868806,2025-07-13 12:09:50.788466,2025-07-13 12:12:07.583612,0 days 00:02:16.795146,identity,16,64,0.002864291285643076,23,COMPLETE
492,0.00034872759715653956,2025-07-13 12:12:07.584636,2025-07-13 12:14:20.983641,0 days 00:02:13.399005,identity,16,58,0.0034570583429732976,22,COMPLETE
493,0.0003008494677487761,2025-07-13 12:14:20.984755,2025-07-13 12:16:53.659554,0 days 00:02:32.674799,identity,16,67,0.002937450558242636,24,COMPLETE
494,0.0003221358638256788,2025-07-13 12:16:53.660671,2025-07-13 12:19:07.650171,0 days 00:02:13.989500,identity,16,54,0.002723209880176867,23,COMPLETE
495,0.00033187976805493236,2025-07-13 12:19:07.651237,2025-07-13 12:20:09.103194,0 days 00:01:01.451957,identity,64,62,0.0037108078823622917,23,COMPLETE
496,0.0002847440482582897,2025-07-13 12:20:09.104012,2025-07-13 12:22:42.007317,0 days 00:02:32.903305,identity,16,70,0.003189353183626254,23,COMPLETE
497,0.00031231678440235555,2025-07-13 12:22:42.008359,2025-07-13 12:24:40.187114,0 days 00:01:58.178755,identity,16,66,0.0033089011763588897,18,COMPLETE
498,0.00031144163222052157,2025-07-13 12:24:40.188130,2025-07-13 12:27:07.884609,0 days 00:02:27.696479,identity,16,69,0.0024897038712839085,22,COMPLETE
499,0.0003118677414022386,2025-07-13 12:27:07.885772,2025-07-13 12:29:25.396390,0 days 00:02:17.510618,identity,16,65,0.004223907380531936,22,COMPLETE
