number,value,datetime_start,datetime_complete,duration,params_activation,params_batch_size,params_h,params_lr,params_seq_length,state
288,0.0003081803733948618,2025-07-13 03:56:51.916288,2025-07-13 03:59:02.130508,0 days 00:02:10.214220,identity,16,59,0.0027896300607625005,21,COMPLETE
289,0.0002965846797451377,2025-07-13 03:59:02.131570,2025-07-13 04:02:26.028019,0 days 00:03:23.896449,identity,16,94,0.0037563688269652497,21,COMPLETE
290,0.00030442822026088834,2025-07-13 04:02:26.028979,2025-07-13 04:04:51.096992,0 days 00:02:25.068013,identity,16,63,0.0032337496169137924,23,COMPLETE
291,0.00029193705995567143,2025-07-13 04:04:51.097997,2025-07-13 04:06:58.321237,0 days 00:02:07.223240,identity,16,61,0.0028276697341545745,20,COMPLETE
292,0.0003202984808012843,2025-07-13 04:06:58.322319,2025-07-13 04:09:08.775920,0 days 00:02:10.453601,identity,16,56,0.003018872646244335,20,COMPLETE
293,0.0002878931409213692,2025-07-13 04:09:08.777009,2025-07-13 04:12:43.877006,0 days 00:03:35.099997,identity,16,62,0.0024380965149480805,21,COMPLETE
294,0.0003170415002387017,2025-07-13 04:12:43.878002,2025-07-13 04:14:53.289695,0 days 00:02:09.411693,identity,16,60,0.002419232906214007,21,COMPLETE
295,0.00036550010554492474,2025-07-13 04:14:53.290660,2025-07-13 04:15:51.835163,0 days 00:00:58.544503,identity,64,63,0.0025766304666708204,21,COMPLETE
296,0.0003232377057429403,2025-07-13 04:15:51.835914,2025-07-13 04:18:15.079710,0 days 00:02:23.243796,identity,16,61,0.002311645027972267,23,COMPLETE
297,0.00028874390409328043,2025-07-13 04:18:15.080727,2025-07-13 04:20:23.536400,0 days 00:02:08.455673,identity,16,58,0.0027036084104054103,21,COMPLETE
298,0.00031794249662198126,2025-07-13 04:20:23.537456,2025-07-13 04:22:25.892789,0 days 00:02:02.355333,identity,16,55,0.002431241092989177,20,COMPLETE
299,0.0003867984632961452,2025-07-13 04:22:25.893823,2025-07-13 04:24:34.284594,0 days 00:02:08.390771,identity,16,58,0.004427232077939622,21,COMPLETE
300,0.00033994956174865365,2025-07-13 04:24:34.285657,2025-07-13 04:26:42.573806,0 days 00:02:08.288149,identity,16,58,0.002750239994995159,21,COMPLETE
301,0.0003467894857749343,2025-07-13 04:26:42.574770,2025-07-13 04:28:38.083481,0 days 00:01:55.508711,identity,16,54,0.002182616263909612,19,COMPLETE
302,0.0003578807518351823,2025-07-13 04:28:38.084468,2025-07-13 04:30:05.587130,0 days 00:01:27.502662,identity,32,61,0.0035310701931423167,20,COMPLETE
303,0.00030405016150325537,2025-07-13 04:30:05.588086,2025-07-13 04:32:13.853964,0 days 00:02:08.265878,identity,16,57,0.0024751281923904617,21,COMPLETE
304,0.0003537758020684123,2025-07-13 04:32:13.854946,2025-07-13 04:34:34.100566,0 days 00:02:20.245620,identity,16,63,0.0007960423634183469,22,COMPLETE
305,0.0002892606134992093,2025-07-13 04:34:34.101526,2025-07-13 04:37:32.139485,0 days 00:02:58.037959,identity,16,84,0.002836410812484095,21,COMPLETE
306,1.719295620918274,2025-07-13 04:37:32.140475,2025-07-13 04:40:32.282325,0 days 00:03:00.141850,relu,16,84,0.002937083470719642,21,COMPLETE
307,0.00033151148818433285,2025-07-13 04:40:32.283349,2025-07-13 04:41:20.725748,0 days 00:00:48.442399,identity,128,85,0.003269360483044547,21,COMPLETE
308,0.0002938288962468505,2025-07-13 04:41:20.726495,2025-07-13 04:44:23.470930,0 days 00:03:02.744435,identity,16,89,0.002739610654887865,21,COMPLETE
309,0.0003223092353437096,2025-07-13 04:44:23.471900,2025-07-13 04:47:25.365958,0 days 00:03:01.894058,identity,16,87,0.0030474679947043413,20,COMPLETE
310,0.00032032246235758066,2025-07-13 04:47:25.366957,2025-07-13 04:51:12.183818,0 days 00:03:46.816861,identity,16,82,0.00404181940384422,22,COMPLETE
311,0.00030676674214191735,2025-07-13 04:51:12.184832,2025-07-13 04:53:13.457233,0 days 00:02:01.272401,identity,16,65,0.002665650673902503,19,COMPLETE
312,0.0003917809808626771,2025-07-13 04:53:13.458178,2025-07-13 04:55:31.961442,0 days 00:02:18.503264,identity,16,59,0.0035062234090955644,22,COMPLETE
313,0.0003508915251586586,2025-07-13 04:55:31.962554,2025-07-13 04:58:46.699775,0 days 00:03:14.737221,identity,16,82,0.001113879062852651,21,COMPLETE
314,0.00029652556986548007,2025-07-13 04:58:46.700729,2025-07-13 05:00:53.843366,0 days 00:02:07.142637,identity,16,61,0.002887112209397839,20,COMPLETE
315,0.00032949078013189137,2025-07-13 05:00:53.844354,2025-07-13 05:03:01.293288,0 days 00:02:07.448934,identity,16,52,0.002573693699604801,22,COMPLETE
316,0.0003620014467742294,2025-07-13 05:03:01.294329,2025-07-13 05:05:11.115508,0 days 00:02:09.821179,identity,16,56,0.0005065058720720181,22,COMPLETE
317,0.0003284475242253393,2025-07-13 05:05:11.116495,2025-07-13 05:07:25.329542,0 days 00:02:14.213047,identity,16,63,0.0032163364584257077,21,COMPLETE
318,0.00034447218058630824,2025-07-13 05:07:25.330559,2025-07-13 05:08:55.376261,0 days 00:01:30.045702,identity,16,66,0.002293636848882685,13,COMPLETE
319,0.000354163785232231,2025-07-13 05:08:55.377367,2025-07-13 05:11:40.281889,0 days 00:02:44.904522,identity,16,79,0.0028585974806178568,15,COMPLETE
320,0.00032919165096245706,2025-07-13 05:11:40.283015,2025-07-13 05:13:29.522869,0 days 00:01:49.239854,identity,16,59,0.002009972213903114,17,COMPLETE
321,0.00029772447305731475,2025-07-13 05:13:29.523883,2025-07-13 05:14:27.240618,0 days 00:00:57.716735,identity,64,64,0.009695914139368959,22,COMPLETE
322,0.0002955308009404689,2025-07-13 05:14:27.241384,2025-07-13 05:16:48.498779,0 days 00:02:21.257395,identity,16,67,0.0025291609783717134,22,COMPLETE
323,0.00034926232183352113,2025-07-13 05:16:48.499864,2025-07-13 05:18:46.019327,0 days 00:01:57.519463,identity,16,85,0.0036758236208074605,12,COMPLETE
324,0.0002902299165725708,2025-07-13 05:18:46.020242,2025-07-13 05:21:22.882255,0 days 00:02:36.862013,identity,16,61,0.0030723931952187007,23,COMPLETE
325,0.00034531287383288145,2025-07-13 05:21:22.883371,2025-07-13 05:24:06.478933,0 days 00:02:43.595562,identity,16,61,0.0031752112371048425,23,COMPLETE
326,1.7199456691741943,2025-07-13 05:24:06.501226,2025-07-13 05:27:24.221344,0 days 00:03:17.720118,relu,16,79,0.0034238548740420753,23,COMPLETE
327,0.0003127804957330227,2025-07-13 05:27:24.222323,2025-07-13 05:28:57.141547,0 days 00:01:32.919224,identity,32,64,0.002892709077701686,22,COMPLETE
328,0.0003408804477658123,2025-07-13 05:28:57.142601,2025-07-13 05:31:22.905753,0 days 00:02:25.763152,identity,16,68,0.0031372470486002078,23,COMPLETE
329,0.00037622838863171637,2025-07-13 05:31:22.910643,2025-07-13 05:33:22.789251,0 days 00:01:59.878608,identity,16,56,0.003734942649221929,20,COMPLETE
330,0.0003644065000116825,2025-07-13 05:33:22.790322,2025-07-13 05:34:08.500580,0 days 00:00:45.710258,identity,128,77,0.002663621175308934,21,COMPLETE
331,0.0002987899351865053,2025-07-13 05:34:08.501312,2025-07-13 05:36:35.978973,0 days 00:02:27.477661,identity,16,62,0.0023132624961038333,23,COMPLETE
332,0.0002896040678024292,2025-07-13 05:36:35.979982,2025-07-13 05:39:58.912788,0 days 00:03:22.932806,identity,16,82,0.002120048511017512,22,COMPLETE
333,0.0002908676688093692,2025-07-13 05:39:58.913890,2025-07-13 05:43:07.716856,0 days 00:03:08.802966,identity,16,84,0.0019804087455153408,23,COMPLETE
334,0.0003050952509511262,2025-07-13 05:43:07.717876,2025-07-13 05:46:32.590842,0 days 00:03:24.872966,identity,16,93,0.0018458986903907776,22,COMPLETE
335,0.0003106939257122576,2025-07-13 05:46:32.591871,2025-07-13 05:48:52.707534,0 days 00:02:20.115663,identity,16,59,0.0016879473253166566,23,COMPLETE
336,0.00032244023168459535,2025-07-13 05:48:52.708635,2025-07-13 05:51:06.499485,0 days 00:02:13.790850,identity,16,66,0.0021919128454162555,21,COMPLETE
337,0.0004252783255651593,2025-07-13 05:51:06.500485,2025-07-13 05:53:33.154956,0 days 00:02:26.654471,identity,16,70,0.00013096518880291647,22,COMPLETE
338,0.00032820491469465196,2025-07-13 05:53:33.155945,2025-07-13 05:55:57.717155,0 days 00:02:24.561210,identity,16,63,0.0034067600870227054,23,COMPLETE
339,0.00035396823659539223,2025-07-13 05:55:57.718273,2025-07-13 05:59:21.309011,0 days 00:03:23.590738,identity,16,90,0.002838963451888542,22,COMPLETE
340,0.0002890212053898722,2025-07-13 05:59:21.310015,2025-07-13 06:01:47.619490,0 days 00:02:26.309475,identity,16,72,0.002135759496166364,23,COMPLETE
341,0.00033354503102600574,2025-07-13 06:01:47.620569,2025-07-13 06:04:27.055896,0 days 00:02:39.435327,identity,16,73,0.002092346188360782,23,COMPLETE
342,0.00030930546927265823,2025-07-13 06:04:27.056937,2025-07-13 06:06:53.192307,0 days 00:02:26.135370,identity,16,72,0.0019194096727466442,23,COMPLETE
343,0.0003102692135144025,2025-07-13 06:06:53.193418,2025-07-13 06:09:23.655139,0 days 00:02:30.461721,identity,16,76,0.001503067295022429,23,COMPLETE
344,0.00032022432424128056,2025-07-13 06:09:23.656156,2025-07-13 06:11:50.481614,0 days 00:02:26.825458,identity,16,70,0.002102118979727166,22,COMPLETE
345,0.00030008223257027566,2025-07-13 06:11:50.482610,2025-07-13 06:14:28.061109,0 days 00:02:37.578499,identity,16,74,0.0018047162160237985,23,COMPLETE
346,0.0003284190024714917,2025-07-13 06:14:28.062286,2025-07-13 06:18:21.247232,0 days 00:03:53.184946,relu,16,79,0.002397686154816449,22,COMPLETE
347,0.0002772015577647835,2025-07-13 06:18:21.248272,2025-07-13 06:20:46.256723,0 days 00:02:25.008451,identity,16,68,0.0022139580494308737,23,COMPLETE
348,0.00036711571738123894,2025-07-13 06:20:46.257813,2025-07-13 06:21:53.642231,0 days 00:01:07.384418,identity,64,70,0.002127513913892311,21,COMPLETE
349,0.00039988680509850383,2025-07-13 06:21:53.643289,2025-07-13 06:24:25.194851,0 days 00:02:31.551562,identity,16,68,0.00024828698009943386,24,COMPLETE
350,0.00029114296194165945,2025-07-13 06:24:25.195873,2025-07-13 06:29:31.688054,0 days 00:05:06.492181,identity,16,82,0.002352956020430698,23,COMPLETE
351,0.0003172028809785843,2025-07-13 06:29:31.689158,2025-07-13 06:32:02.380741,0 days 00:02:30.691583,identity,16,72,0.0018949487140029518,22,COMPLETE
352,0.0003120742621831596,2025-07-13 06:32:02.381734,2025-07-13 06:34:33.129906,0 days 00:02:30.748172,identity,16,68,0.00223379609678597,21,COMPLETE
353,0.00036525202449411154,2025-07-13 06:34:33.130943,2025-07-13 06:36:08.980306,0 days 00:01:35.849363,identity,32,87,0.0016574773239259593,22,COMPLETE
354,0.0004235647793393582,2025-07-13 06:36:08.981280,2025-07-13 06:38:05.699944,0 days 00:01:56.718664,identity,16,12,0.0025732658191598076,23,COMPLETE
355,0.0003183756780344993,2025-07-13 06:38:05.700993,2025-07-13 06:40:44.994635,0 days 00:02:39.293642,identity,16,76,0.0020205502003028996,24,COMPLETE
356,0.00035752379335463047,2025-07-13 06:40:44.995622,2025-07-13 06:41:33.510266,0 days 00:00:48.514644,identity,128,74,0.0022773503817812677,22,COMPLETE
357,0.0003442894958425313,2025-07-13 06:41:33.511000,2025-07-13 06:43:58.901660,0 days 00:02:25.390660,identity,16,71,0.0024826740526285272,21,COMPLETE
358,0.000288770766928792,2025-07-13 06:43:58.902705,2025-07-13 06:46:27.015109,0 days 00:02:28.112404,identity,16,67,0.002736491209999517,23,COMPLETE
359,0.0002910557668656111,2025-07-13 06:46:27.016157,2025-07-13 06:49:12.685263,0 days 00:02:45.669106,identity,16,66,0.002707017550485913,23,COMPLETE
360,0.00032436702167615294,2025-07-13 06:49:12.686360,2025-07-13 06:51:45.662300,0 days 00:02:32.975940,identity,16,69,0.0027036217196974004,23,COMPLETE
361,0.0002880877291318029,2025-07-13 06:51:45.663311,2025-07-13 06:54:05.779297,0 days 00:02:20.115986,identity,16,66,0.0025100517790241274,22,COMPLETE
362,0.000323417509207502,2025-07-13 06:54:05.780337,2025-07-13 06:56:37.798097,0 days 00:02:32.017760,identity,16,67,0.0024682923383211814,22,COMPLETE
363,0.00033123436151072383,2025-07-13 06:56:37.799250,2025-07-13 06:59:04.413795,0 days 00:02:26.614545,identity,16,68,0.001322352587735591,23,COMPLETE
364,0.0003332212509121746,2025-07-13 06:59:04.414869,2025-07-13 07:01:21.066606,0 days 00:02:16.651737,identity,16,65,0.0021523658656562175,22,COMPLETE
365,1.7199456691741943,2025-07-13 07:01:21.067651,2025-07-13 07:03:52.966440,0 days 00:02:31.898789,relu,16,66,0.0024931869417035134,23,COMPLETE
366,0.00032380889751948416,2025-07-13 07:03:52.967405,2025-07-13 07:09:02.559269,0 days 00:05:09.591864,identity,16,85,0.002957581283292277,22,COMPLETE
367,0.00031161255901679397,2025-07-13 07:09:02.560286,2025-07-13 07:11:56.987647,0 days 00:02:54.427361,identity,16,70,0.0022693130283623127,23,COMPLETE
368,0.0003078666632063687,2025-07-13 07:11:56.988620,2025-07-13 07:15:41.062250,0 days 00:03:44.073630,identity,16,82,0.002711349685804657,22,COMPLETE
369,0.0003108603705186397,2025-07-13 07:15:41.063308,2025-07-13 07:19:21.642784,0 days 00:03:40.579476,identity,16,77,0.0024648773580124013,23,COMPLETE
370,0.00035723112523555756,2025-07-13 07:19:21.643785,2025-07-13 07:21:54.807295,0 days 00:02:33.163510,identity,16,73,0.0030014548624612727,22,COMPLETE
371,0.00034975120797753334,2025-07-13 07:21:54.808289,2025-07-13 07:22:53.566180,0 days 00:00:58.757891,identity,64,66,0.002611243930716621,23,COMPLETE
372,0.00030008150497451425,2025-07-13 07:22:53.566950,2025-07-13 07:25:19.914370,0 days 00:02:26.347420,identity,16,70,0.0022970357703335307,22,COMPLETE
373,0.00029333485872484744,2025-07-13 07:25:19.915359,2025-07-13 07:28:48.731983,0 days 00:03:28.816624,identity,16,99,0.00402478708830566,24,COMPLETE
374,0.00029757909942418337,2025-07-13 07:28:48.732933,2025-07-13 07:31:56.003956,0 days 00:03:07.271023,identity,16,80,0.002101421705101179,23,COMPLETE
375,0.0003397980472072959,2025-07-13 07:31:56.004908,2025-07-13 07:34:04.635235,0 days 00:02:08.630327,identity,16,53,0.007671058499937357,22,COMPLETE
376,0.00033049940248019993,2025-07-13 07:34:04.636287,2025-07-13 07:36:21.019926,0 days 00:02:16.383639,identity,16,64,0.0029145347874332374,23,COMPLETE
377,0.00029911682941019535,2025-07-13 07:36:21.020922,2025-07-13 07:39:01.731395,0 days 00:02:40.710473,identity,16,75,0.0032051319141656602,23,COMPLETE
378,0.00034569541458040476,2025-07-13 07:39:01.732473,2025-07-13 07:40:32.580896,0 days 00:01:30.848423,identity,32,78,0.0025718017900015324,22,COMPLETE
379,0.00031916674925014377,2025-07-13 07:40:32.581882,2025-07-13 07:43:02.628669,0 days 00:02:30.046787,identity,16,68,0.002307677447082968,24,COMPLETE
380,0.0003686388081405312,2025-07-13 07:43:02.629698,2025-07-13 07:44:25.093385,0 days 00:01:22.463687,identity,16,73,0.002780581228791529,10,COMPLETE
381,0.0003251356247346848,2025-07-13 07:44:25.094366,2025-07-13 07:47:35.228168,0 days 00:03:10.133802,identity,16,89,0.0019800910831783403,22,COMPLETE
382,0.00035782178747467697,2025-07-13 07:47:35.229188,2025-07-13 07:48:31.570542,0 days 00:00:56.341354,identity,128,71,0.002421416873340654,23,COMPLETE
383,0.000336223078193143,2025-07-13 07:48:31.571302,2025-07-13 07:52:29.808104,0 days 00:03:58.236802,identity,16,86,0.0033790279488958965,24,COMPLETE
384,0.0003001816221512854,2025-07-13 07:52:29.809119,2025-07-13 07:54:41.269345,0 days 00:02:11.460226,identity,16,64,0.0028975665824738776,22,COMPLETE
385,1.719295620918274,2025-07-13 07:54:41.270306,2025-07-13 07:57:53.759548,0 days 00:03:12.489242,relu,16,83,0.0021405666536503227,21,COMPLETE
386,0.0003803504223469645,2025-07-13 07:57:53.760558,2025-07-13 08:00:08.154603,0 days 00:02:14.394045,identity,16,56,0.005005297042311594,23,COMPLETE
387,0.00034894797136075795,2025-07-13 08:00:08.155607,2025-07-13 08:02:33.062757,0 days 00:02:24.907150,identity,16,68,0.0006034013896782408,23,COMPLETE
388,0.00031212373869493604,2025-07-13 08:02:33.063720,2025-07-13 08:05:07.688344,0 days 00:02:34.624624,identity,16,75,0.0026540135528017347,22,COMPLETE
389,0.00031672659679315984,2025-07-13 08:05:07.693632,2025-07-13 08:08:11.067910,0 days 00:03:03.374278,identity,16,95,0.0017760438656441138,20,COMPLETE
390,0.00028956023743376136,2025-07-13 08:08:11.068919,2025-07-13 08:10:49.737744,0 days 00:02:38.668825,identity,16,72,0.004497218354557418,24,COMPLETE
391,0.0003004610480275005,2025-07-13 08:10:49.738788,2025-07-13 08:13:34.932763,0 days 00:02:45.193975,identity,16,73,0.00402082763928934,24,COMPLETE
392,0.0003437919949647039,2025-07-13 08:13:34.933762,2025-07-13 08:16:04.987232,0 days 00:02:30.053470,identity,16,66,0.005824745640619253,24,COMPLETE
393,0.00034208621946163476,2025-07-13 08:16:04.988200,2025-07-13 08:18:36.449992,0 days 00:02:31.461792,identity,16,72,0.004709330903795875,24,COMPLETE
394,0.0003916131390724331,2025-07-13 08:18:36.451009,2025-07-13 08:19:32.770276,0 days 00:00:56.319267,identity,16,70,0.004225845743902753,6,COMPLETE
395,0.00036418880335986614,2025-07-13 08:19:32.771026,2025-07-13 08:22:10.991241,0 days 00:02:38.220215,identity,16,69,0.003696054582978486,24,COMPLETE
396,0.00031004450283944607,2025-07-13 08:22:10.992213,2025-07-13 08:23:08.773232,0 days 00:00:57.781019,identity,64,64,0.004281378723116574,24,COMPLETE
397,0.00032609773916192353,2025-07-13 08:23:08.773996,2025-07-13 08:25:27.177137,0 days 00:02:18.403141,identity,16,58,0.004877844159823373,23,COMPLETE
398,0.0003048873913940042,2025-07-13 08:25:27.178146,2025-07-13 08:27:53.604705,0 days 00:02:26.426559,identity,16,72,0.0030606699628885716,23,COMPLETE
399,0.00035278001450933516,2025-07-13 08:27:53.605747,2025-07-13 08:30:25.579799,0 days 00:02:31.974052,identity,16,76,0.0033883898357418302,23,COMPLETE
400,0.0003374349616933614,2025-07-13 08:30:25.614270,2025-07-13 08:33:04.799462,0 days 00:02:39.185192,identity,16,69,0.0037238987187390112,24,COMPLETE
401,0.0003404220915399492,2025-07-13 08:33:04.800467,2025-07-13 08:34:29.820503,0 days 00:01:25.020036,identity,32,66,0.003082673344007858,23,COMPLETE
402,0.00029772595735266805,2025-07-13 08:34:29.821470,2025-07-13 08:36:54.038737,0 days 00:02:24.217267,identity,16,60,0.00442905164858151,23,COMPLETE
403,0.0003349280741531402,2025-07-13 08:36:54.039771,2025-07-13 08:39:19.374941,0 days 00:02:25.335170,identity,16,74,0.0027496370883354922,21,COMPLETE
404,0.00033346752752549946,2025-07-13 08:39:19.375932,2025-07-13 08:42:31.589491,0 days 00:03:12.213559,relu,16,63,0.0024495269155267348,24,COMPLETE
405,0.00033207854721695185,2025-07-13 08:42:31.590557,2025-07-13 08:44:57.746128,0 days 00:02:26.155571,identity,16,67,0.0026206958294454005,23,COMPLETE
406,0.00035795941948890686,2025-07-13 08:44:57.747148,2025-07-13 08:45:42.962869,0 days 00:00:45.215721,identity,128,77,0.0029317949657129074,21,COMPLETE
407,0.00034206846612505615,2025-07-13 08:45:42.963626,2025-07-13 08:48:13.365750,0 days 00:02:30.402124,identity,16,71,0.0032193967291626966,22,COMPLETE
408,0.00034260336542502046,2025-07-13 08:48:13.376203,2025-07-13 08:50:56.282091,0 days 00:02:42.905888,identity,16,74,0.0023444914327441085,24,COMPLETE
409,0.0003045587509404868,2025-07-13 08:50:56.283068,2025-07-13 08:52:58.573011,0 days 00:02:02.289943,identity,16,51,0.0027839395967608066,21,COMPLETE
410,0.0003465444315224886,2025-07-13 08:52:58.574073,2025-07-13 08:55:12.591218,0 days 00:02:14.017145,identity,16,54,0.003501663983041576,23,COMPLETE
411,0.0002841456444002688,2025-07-13 08:55:12.592222,2025-07-13 08:58:33.427301,0 days 00:03:20.835079,identity,16,118,0.0024477563077319577,23,COMPLETE
412,0.00030336243798956275,2025-07-13 08:58:33.428342,2025-07-13 09:00:46.376815,0 days 00:02:12.948473,identity,16,57,0.0025163386805848783,22,COMPLETE
413,0.00030524510657414794,2025-07-13 09:00:46.377925,2025-07-13 09:03:08.886243,0 days 00:02:22.508318,identity,16,61,0.0022750081164452677,23,COMPLETE
414,0.00035856140311807394,2025-07-13 09:03:08.887326,2025-07-13 09:05:30.746554,0 days 00:02:21.859228,identity,16,65,0.0004183281862077239,23,COMPLETE
415,0.00030617599259130657,2025-07-13 09:05:30.747682,2025-07-13 09:08:43.274155,0 days 00:03:12.526473,identity,16,106,0.0025726366312101043,20,COMPLETE
416,0.00029998435638844967,2025-07-13 09:08:43.275246,2025-07-13 09:12:39.570308,0 days 00:03:56.295062,identity,16,114,0.0028473151919360174,22,COMPLETE
417,0.00032361436751671135,2025-07-13 09:12:39.571345,2025-07-13 09:16:12.665576,0 days 00:03:33.094231,identity,16,103,0.002226081047043685,22,COMPLETE
418,0.00031415250850841403,2025-07-13 09:16:12.666642,2025-07-13 09:20:49.596239,0 days 00:04:36.929597,identity,16,115,0.002459334836406607,23,COMPLETE
419,0.00032167398603633046,2025-07-13 09:20:49.597226,2025-07-13 09:24:54.415657,0 days 00:04:04.818431,identity,16,111,0.003191888934603982,23,COMPLETE
420,0.0004289486678317189,2025-07-13 09:24:54.416695,2025-07-13 09:26:18.793025,0 days 00:01:24.376330,identity,64,60,0.0020120290044998053,22,COMPLETE
421,0.0002983020676765591,2025-07-13 09:26:18.794098,2025-07-13 09:28:38.398258,0 days 00:02:19.604160,identity,16,63,0.002680814730659721,22,COMPLETE
422,0.00032696881680749357,2025-07-13 09:28:38.399319,2025-07-13 09:31:50.423470,0 days 00:03:12.024151,identity,16,123,0.002942181419137918,21,COMPLETE
423,1.7199456691741943,2025-07-13 09:31:50.424477,2025-07-13 09:35:23.161205,0 days 00:03:32.736728,relu,16,103,0.0022898176265772376,23,COMPLETE
424,0.00030860654078423977,2025-07-13 09:35:23.162253,2025-07-13 09:39:13.434198,0 days 00:03:50.271945,identity,16,79,0.0024194200167347852,22,COMPLETE
425,0.00029305642237886786,2025-07-13 09:39:13.435219,2025-07-13 09:41:44.027077,0 days 00:02:30.591858,identity,16,68,0.0027055563657046467,23,COMPLETE
426,0.00029167113825678825,2025-07-13 09:41:44.028126,2025-07-13 09:44:04.036759,0 days 00:02:20.008633,identity,16,59,0.0030632136228032985,23,COMPLETE
427,0.0003575240261852741,2025-07-13 09:44:04.037782,2025-07-13 09:45:42.279911,0 days 00:01:38.242129,identity,32,55,0.002525155618207462,22,COMPLETE
428,0.0003015658294316381,2025-07-13 09:45:42.280949,2025-07-13 09:48:04.110907,0 days 00:02:21.829958,identity,16,65,0.0021103056339243785,23,COMPLETE
429,0.00034179529757238925,2025-07-13 09:48:04.111958,2025-07-13 09:48:45.180774,0 days 00:00:41.068816,identity,128,62,0.002899302436075289,21,COMPLETE
430,0.00037524657091125846,2025-07-13 09:48:45.181609,2025-07-13 09:50:29.910088,0 days 00:01:44.728479,identity,16,100,0.0018556239012220775,9,COMPLETE
431,0.0003070691891480237,2025-07-13 09:50:29.911062,2025-07-13 09:53:40.555418,0 days 00:03:10.644356,identity,16,127,0.0032649398237053514,20,COMPLETE
