number,value,datetime_start,datetime_complete,duration,params_activation,params_and_operator,params_batch_size,params_lr,params_n_sets,params_seq_length,params_shape,state
274,0.000347517168847844,2025-07-13 05:34:19.882547,2025-07-13 05:36:24.324797,0 days 00:02:04.442250,identity,min,16,0.008709629238678745,6,19,bell,COMPLETE
275,0.0003435984253883362,2025-07-13 05:36:24.325818,2025-07-13 05:38:33.288055,0 days 00:02:08.962237,identity,min,16,0.009935223456685825,6,20,bell,COMPLETE
276,0.4862665832042694,2025-07-13 05:38:33.289109,2025-07-13 05:40:40.262075,0 days 00:02:06.972966,identity,min,16,0.00010381045789478304,9,19,sigmoid,COMPLETE
277,0.0017829795833677053,2025-07-13 05:40:40.265217,2025-07-13 05:43:06.046338,0 days 00:02:25.781121,identity,prod,16,0.008660264273376425,6,24,bell,COMPLETE
278,0.18024499714374542,2025-07-13 05:43:06.047309,2025-07-13 05:44:08.380834,0 days 00:01:02.333525,identity,min,32,0.007221768152723696,8,17,gaussian,COMPLETE
279,0.16205346584320068,2025-07-13 05:44:08.381594,2025-07-13 05:45:55.758104,0 days 00:01:47.376510,identity,min,16,0.0023837299930170746,6,15,bell,COMPLETE
280,0.0009165970259346068,2025-07-13 05:45:55.759164,2025-07-13 05:47:55.214861,0 days 00:01:59.455697,identity,min,16,0.009182805165563024,6,18,bell,COMPLETE
281,0.0005340864881873131,2025-07-13 05:47:55.215939,2025-07-13 05:49:51.288517,0 days 00:01:56.072578,identity,min,16,0.00798353330977828,6,17,bell,COMPLETE
282,0.0004131356836296618,2025-07-13 05:49:51.289478,2025-07-13 05:51:51.375361,0 days 00:02:00.085883,relu,min,16,0.00918033358667214,6,18,bell,COMPLETE
283,0.0003780493570957333,2025-07-13 05:51:51.376482,2025-07-13 05:53:47.747761,0 days 00:01:56.371279,identity,min,16,0.008190935321582288,6,17,bell,COMPLETE
284,0.00031037640292197466,2025-07-13 05:53:47.748811,2025-07-13 05:55:44.899046,0 days 00:01:57.150235,identity,min,16,0.009901296767623378,6,17,bell,COMPLETE
285,0.00035880703944712877,2025-07-13 05:55:44.899993,2025-07-13 05:57:42.151795,0 days 00:01:57.251802,identity,min,16,0.00984623830257166,6,17,bell,COMPLETE
286,0.11525879055261612,2025-07-13 05:57:42.152833,2025-07-13 05:59:36.017539,0 days 00:01:53.864706,identity,prod,16,0.009006960696550851,6,16,bell,COMPLETE
287,0.0036149530205875635,2025-07-13 05:59:36.018551,2025-07-13 06:01:28.907098,0 days 00:01:52.888547,identity,min,16,0.00924105482327125,6,16,bell,COMPLETE
288,0.0003714962804224342,2025-07-13 06:01:28.908133,2025-07-13 06:03:25.416631,0 days 00:01:56.508498,identity,min,16,0.009925661321228222,6,17,bell,COMPLETE
289,0.00044533441541716456,2025-07-13 06:03:25.417614,2025-07-13 06:05:21.846681,0 days 00:01:56.429067,identity,min,16,0.009993167406939568,6,17,bell,COMPLETE
290,0.0003606360114645213,2025-07-13 06:05:21.847690,2025-07-13 06:07:13.282245,0 days 00:01:51.434555,identity,min,16,0.008460896423411196,6,16,bell,COMPLETE
291,0.0003631975851021707,2025-07-13 06:07:13.283226,2025-07-13 06:09:13.075425,0 days 00:01:59.792199,identity,min,16,0.008540479053528251,7,17,bell,COMPLETE
292,0.00036182848270982504,2025-07-13 06:09:13.076386,2025-07-13 06:11:00.717518,0 days 00:01:47.641132,identity,min,16,0.007105951111245923,6,15,bell,COMPLETE
293,0.0005144034512341022,2025-07-13 06:11:00.718497,2025-07-13 06:12:56.085751,0 days 00:01:55.367254,identity,min,16,0.0078114431468542835,6,17,bell,COMPLETE
294,0.30355462431907654,2025-07-13 06:12:56.086661,2025-07-13 06:13:36.285075,0 days 00:00:40.198414,identity,min,64,0.009088278904992256,6,18,bell,COMPLETE
295,0.0003191393334418535,2025-07-13 06:13:36.285835,2025-07-13 06:15:28.712637,0 days 00:01:52.426802,identity,prod,16,0.008576054348320452,6,16,bell,COMPLETE
296,0.7852144837379456,2025-07-13 06:15:28.713675,2025-07-13 06:15:50.836744,0 days 00:00:22.123069,identity,min,128,0.008329563110067018,6,16,bell,COMPLETE
297,0.002924857661128044,2025-07-13 06:15:50.837514,2025-07-13 06:17:39.260434,0 days 00:01:48.422920,identity,min,16,0.006793084988122512,6,15,bell,COMPLETE
298,0.002521032700315118,2025-07-13 06:17:39.261476,2025-07-13 06:19:32.023851,0 days 00:01:52.762375,identity,min,16,0.007709339669403544,6,16,bell,COMPLETE
299,0.0003371427010279149,2025-07-13 06:19:32.030140,2025-07-13 06:21:20.332133,0 days 00:01:48.301993,identity,min,16,0.009998333558723118,6,15,bell,COMPLETE
300,0.00041342893382534385,2025-07-13 06:21:20.333111,2025-07-13 06:23:03.759874,0 days 00:01:43.426763,identity,min,16,0.008536670455331252,6,14,bell,COMPLETE
301,1.1238207817077637,2025-07-13 06:23:03.760828,2025-07-13 06:25:17.069274,0 days 00:02:13.308446,relu,prod,16,0.007406492568312407,6,22,sigmoid,COMPLETE
302,0.00033782172249630094,2025-07-13 06:25:17.070258,2025-07-13 06:27:25.464738,0 days 00:02:08.394480,identity,min,16,0.0091580147054144,6,20,bell,COMPLETE
303,0.00035242829471826553,2025-07-13 06:27:25.465724,2025-07-13 06:29:17.205214,0 days 00:01:51.739490,identity,min,16,0.009999847019512214,6,16,bell,COMPLETE
304,0.004996318370103836,2025-07-13 06:29:17.206204,2025-07-13 06:31:12.679884,0 days 00:01:55.473680,identity,min,16,0.008180507250666129,6,18,gaussian,COMPLETE
305,0.003995821811258793,2025-07-13 06:31:12.680773,2025-07-13 06:33:03.927775,0 days 00:01:51.247002,identity,min,16,0.008914984767165188,6,16,bell,COMPLETE
306,0.23757608234882355,2025-07-13 06:33:03.928769,2025-07-13 06:34:10.992851,0 days 00:01:07.064082,identity,min,32,0.008037432037105694,6,19,bell,COMPLETE
307,0.07275185734033585,2025-07-13 06:34:10.993859,2025-07-13 06:36:08.727582,0 days 00:01:57.733723,identity,min,16,0.006494086710005728,7,17,bell,COMPLETE
308,0.004460983909666538,2025-07-13 06:36:08.728616,2025-07-13 06:38:07.880490,0 days 00:01:59.151874,identity,min,16,0.0073311246856610085,6,18,bell,COMPLETE
309,0.002320792991667986,2025-07-13 06:38:07.881562,2025-07-13 06:40:12.115752,0 days 00:02:04.234190,identity,prod,16,0.009100871891248636,6,19,bell,COMPLETE
310,0.0018598848255351186,2025-07-13 06:40:12.116688,2025-07-13 06:41:58.639217,0 days 00:01:46.522529,identity,min,16,0.009988145534253295,6,15,bell,COMPLETE
311,0.00036894658114761114,2025-07-13 06:41:58.640083,2025-07-13 06:43:53.565009,0 days 00:01:54.924926,identity,min,16,0.008600967421904132,6,17,bell,COMPLETE
312,0.03582645580172539,2025-07-13 06:43:53.565999,2025-07-13 06:45:53.025260,0 days 00:01:59.459261,identity,min,16,0.007861769967981448,6,18,bell,COMPLETE
313,0.00034826385672204196,2025-07-13 06:45:53.026196,2025-07-13 06:47:22.773733,0 days 00:01:29.747537,identity,min,16,0.009019954993542446,6,10,bell,COMPLETE
314,0.01871892437338829,2025-07-13 06:47:22.774707,2025-07-13 06:49:05.956270,0 days 00:01:43.181563,identity,min,16,0.0072388823934527785,6,14,bell,COMPLETE
315,0.11553701758384705,2025-07-13 06:49:05.957312,2025-07-13 06:51:01.362605,0 days 00:01:55.405293,identity,min,16,0.0004908021526765299,6,17,bell,COMPLETE
316,0.09158693999052048,2025-07-13 06:51:01.363692,2025-07-13 06:52:53.147112,0 days 00:01:51.783420,identity,min,16,0.00824787181642535,6,16,bell,COMPLETE
317,0.0009218673803843558,2025-07-13 06:52:53.148051,2025-07-13 06:55:10.749678,0 days 00:02:17.601627,identity,prod,16,0.009129199394105718,8,21,bell,COMPLETE
318,0.000411262852139771,2025-07-13 06:55:10.750603,2025-07-13 06:57:11.685508,0 days 00:02:00.934905,identity,min,16,0.009963254971177369,6,18,bell,COMPLETE
319,0.00034371187211945653,2025-07-13 06:57:11.686402,2025-07-13 06:59:07.636742,0 days 00:01:55.950340,identity,min,16,0.008385090343828344,6,17,bell,COMPLETE
320,0.07797183096408844,2025-07-13 06:59:07.637746,2025-07-13 06:59:45.155780,0 days 00:00:37.518034,identity,min,64,0.006694386283060936,6,16,bell,COMPLETE
321,0.0004154538328293711,2025-07-13 06:59:45.156567,2025-07-13 07:01:33.198784,0 days 00:01:48.042217,relu,min,16,0.007699529798584594,6,15,bell,COMPLETE
322,0.0018090974772349,2025-07-13 07:01:33.199807,2025-07-13 07:03:23.903017,0 days 00:01:50.703210,identity,min,16,0.009175844679924341,7,16,sigmoid,COMPLETE
323,0.003275670576840639,2025-07-13 07:03:23.904068,2025-07-13 07:05:24.000460,0 days 00:02:00.096392,identity,min,16,0.008639434710136434,6,18,bell,COMPLETE
324,0.0029224411118775606,2025-07-13 07:05:24.001437,2025-07-13 07:05:49.227646,0 days 00:00:25.226209,identity,min,128,0.00724593447461432,6,19,bell,COMPLETE
325,0.9213114976882935,2025-07-13 07:05:49.228430,2025-07-13 07:07:42.247761,0 days 00:01:53.019331,identity,prod,16,0.0011395800369279566,6,17,gaussian,COMPLETE
326,0.00032159691909328103,2025-07-13 07:07:42.248658,2025-07-13 07:09:37.832555,0 days 00:01:55.583897,identity,min,16,0.009274158989774416,6,17,bell,COMPLETE
327,0.26556703448295593,2025-07-13 07:09:37.833617,2025-07-13 07:11:39.200483,0 days 00:02:01.366866,identity,min,16,0.008013945999198822,6,18,bell,COMPLETE
328,0.0005806912668049335,2025-07-13 07:11:39.201475,2025-07-13 07:13:48.174441,0 days 00:02:08.972966,identity,min,16,0.00603511128381284,6,20,bell,COMPLETE
329,0.15266689658164978,2025-07-13 07:13:48.175353,2025-07-13 07:14:50.888176,0 days 00:01:02.712823,identity,min,32,0.009324046361155334,6,17,bell,COMPLETE
330,0.05811566859483719,2025-07-13 07:14:50.888930,2025-07-13 07:16:56.277768,0 days 00:02:05.388838,identity,min,16,0.008377158844025007,6,19,bell,COMPLETE
331,0.0003408923221286386,2025-07-13 07:16:56.278676,2025-07-13 07:18:47.186890,0 days 00:01:50.908214,identity,min,16,0.009355100880358506,6,16,bell,COMPLETE
332,0.004364117048680782,2025-07-13 07:18:47.187898,2025-07-13 07:20:43.244651,0 days 00:01:56.056753,identity,min,16,0.009944585311851667,6,17,bell,COMPLETE
333,0.00038474801112897694,2025-07-13 07:20:43.245538,2025-07-13 07:22:40.847669,0 days 00:01:57.602131,identity,prod,16,0.007707736128838729,6,17,bell,COMPLETE
334,0.17009872198104858,2025-07-13 07:22:40.848657,2025-07-13 07:24:27.830437,0 days 00:01:46.981780,identity,min,16,0.008658146520861307,6,15,bell,COMPLETE
335,0.00033156274002976716,2025-07-13 07:24:27.831445,2025-07-13 07:26:27.794382,0 days 00:01:59.962937,identity,min,16,0.00687484065512755,6,18,bell,COMPLETE
336,0.00041607976891100407,2025-07-13 07:26:27.795454,2025-07-13 07:28:19.617955,0 days 00:01:51.822501,identity,min,16,0.009191019104923174,6,16,bell,COMPLETE
337,0.004076891113072634,2025-07-13 07:28:19.618962,2025-07-13 07:30:15.845783,0 days 00:01:56.226821,identity,min,16,0.007876943021915498,6,17,bell,COMPLETE
338,0.00032819469925016165,2025-07-13 07:30:15.846801,2025-07-13 07:32:16.490857,0 days 00:02:00.644056,identity,min,16,0.009985300633046049,6,18,bell,COMPLETE
339,0.016612447798252106,2025-07-13 07:32:16.491823,2025-07-13 07:34:06.977519,0 days 00:01:50.485696,identity,min,16,0.008734243707158295,6,16,bell,COMPLETE
340,0.0003231329028494656,2025-07-13 07:34:06.978613,2025-07-13 07:36:10.598052,0 days 00:02:03.619439,relu,min,16,0.0073501169900173045,6,19,bell,COMPLETE
341,0.0008808428538031876,2025-07-13 07:36:10.599001,2025-07-13 07:38:14.232606,0 days 00:02:03.633605,relu,min,16,0.009989282622343198,6,19,bell,COMPLETE
342,0.005265156738460064,2025-07-13 07:38:14.233588,2025-07-13 07:40:18.505237,0 days 00:02:04.271649,identity,prod,16,0.008353674379888336,6,19,bell,COMPLETE
343,0.0003690216108225286,2025-07-13 07:40:18.506205,2025-07-13 07:42:14.656575,0 days 00:01:56.150370,relu,min,16,0.007436381666536892,5,19,bell,COMPLETE
344,1.7140681743621826,2025-07-13 07:42:14.657635,2025-07-13 07:44:19.957185,0 days 00:02:05.299550,relu,min,16,0.009062685047310151,7,18,bell,COMPLETE
345,0.06849465519189835,2025-07-13 07:44:19.958192,2025-07-13 07:44:46.891818,0 days 00:00:26.933626,relu,min,128,0.00015901973206838827,9,20,gaussian,COMPLETE
346,0.05529080331325531,2025-07-13 07:44:46.892635,2025-07-13 07:45:20.121657,0 days 00:00:33.229022,relu,min,64,0.008143209629042757,6,15,sigmoid,COMPLETE
347,0.0003207398985978216,2025-07-13 07:45:20.122409,2025-07-13 07:47:16.242510,0 days 00:01:56.120101,relu,min,16,0.009215280255878469,5,19,bell,COMPLETE
348,1.719295620918274,2025-07-13 07:47:16.243555,2025-07-13 07:49:19.933316,0 days 00:02:03.689761,relu,min,16,0.009956482763873878,5,21,bell,COMPLETE
349,0.0006670549046248198,2025-07-13 07:49:19.934390,2025-07-13 07:51:15.896598,0 days 00:01:55.962208,relu,min,16,0.009160706426175426,5,19,bell,COMPLETE
350,0.0003754310018848628,2025-07-13 07:51:15.897532,2025-07-13 07:53:15.723010,0 days 00:01:59.825478,relu,min,16,0.00655018805462042,5,20,bell,COMPLETE
351,0.001408006763085723,2025-07-13 07:53:15.723985,2025-07-13 07:55:12.463619,0 days 00:01:56.739634,relu,prod,16,0.007979161052846337,5,19,bell,COMPLETE
352,0.004111559130251408,2025-07-13 07:55:12.464575,2025-07-13 07:57:08.629171,0 days 00:01:56.164596,relu,min,16,0.009998493750779396,5,19,bell,COMPLETE
353,0.0005058427341282368,2025-07-13 07:57:08.630194,2025-07-13 07:59:08.702859,0 days 00:02:00.072665,relu,min,16,0.008712499009308905,5,20,bell,COMPLETE
354,0.6412143111228943,2025-07-13 07:59:08.703793,2025-07-13 08:00:15.165234,0 days 00:01:06.461441,relu,min,32,0.001903690658261147,5,19,bell,COMPLETE
355,0.0003220810031052679,2025-07-13 08:00:15.166232,2025-07-13 08:02:17.048274,0 days 00:02:01.882042,relu,min,16,0.007321215663931,6,18,bell,COMPLETE
356,0.00035238443524576724,2025-07-13 08:02:17.049241,2025-07-13 08:04:09.391282,0 days 00:01:52.342041,relu,min,16,0.006097785067484656,5,18,bell,COMPLETE
357,0.0030268519185483456,2025-07-13 08:04:09.392326,2025-07-13 08:06:11.025742,0 days 00:02:01.633416,relu,min,16,0.007039863109587162,6,18,bell,COMPLETE
358,1.089500069618225,2025-07-13 08:06:11.026697,2025-07-13 08:08:20.823212,0 days 00:02:09.796515,relu,min,16,0.009176850086537274,8,19,bell,COMPLETE
359,0.0003337134839966893,2025-07-13 08:08:20.824211,2025-07-13 08:10:21.940980,0 days 00:02:01.116769,relu,prod,16,0.008510468648238883,6,18,bell,COMPLETE
360,0.002490455051884055,2025-07-13 08:10:21.942045,2025-07-13 08:12:22.538998,0 days 00:02:00.596953,relu,min,16,0.0013646442623105064,6,18,bell,COMPLETE
361,0.0005261548794806004,2025-07-13 08:12:22.539945,2025-07-13 08:14:27.627938,0 days 00:02:05.087993,relu,min,16,0.007344738205539495,6,19,bell,COMPLETE
362,0.0014789061388000846,2025-07-13 08:14:27.628931,2025-07-13 08:16:28.638564,0 days 00:02:01.009633,relu,min,16,0.009263698030112238,6,18,bell,COMPLETE
363,0.00042470303014852107,2025-07-13 08:16:28.639610,2025-07-13 08:18:38.186667,0 days 00:02:09.547057,relu,min,16,0.007761598026544067,6,20,bell,COMPLETE
364,0.0009549057576805353,2025-07-13 08:18:38.187730,2025-07-13 08:20:44.175827,0 days 00:02:05.988097,relu,min,16,0.009244599349485922,6,19,bell,COMPLETE
365,0.00047973162145353854,2025-07-13 08:20:44.176832,2025-07-13 08:21:52.191172,0 days 00:01:08.014340,relu,min,16,0.008424795905673842,6,5,bell,COMPLETE
366,0.0004379887250252068,2025-07-13 08:21:52.198429,2025-07-13 08:23:52.911631,0 days 00:02:00.713202,identity,min,16,0.006883174697350066,6,18,bell,COMPLETE
367,0.0024027167819440365,2025-07-13 08:23:52.912690,2025-07-13 08:25:54.150988,0 days 00:02:01.238298,identity,prod,16,0.0033434993892233205,6,18,bell,COMPLETE
368,0.03256555646657944,2025-07-13 08:25:54.151978,2025-07-13 08:27:46.635435,0 days 00:01:52.483457,identity,min,16,0.009101289431602544,6,17,gaussian,COMPLETE
369,0.00157638406381011,2025-07-13 08:27:46.636457,2025-07-13 08:29:44.585713,0 days 00:01:57.949256,identity,min,16,0.00759519049111984,6,19,sigmoid,COMPLETE
370,0.0008699445752426982,2025-07-13 08:29:44.586663,2025-07-13 08:30:21.035321,0 days 00:00:36.448658,identity,min,64,0.009932688550811577,5,17,bell,COMPLETE
371,0.00036802684189751744,2025-07-13 08:30:21.036097,2025-07-13 08:32:22.273063,0 days 00:02:01.236966,identity,min,16,0.00845337727903229,6,18,bell,COMPLETE
372,0.00032657262636348605,2025-07-13 08:32:22.274160,2025-07-13 08:34:13.346785,0 days 00:01:51.072625,identity,min,16,0.009168444949675586,6,16,bell,COMPLETE
373,0.07710697501897812,2025-07-13 08:34:13.347822,2025-07-13 08:34:40.524254,0 days 00:00:27.176432,identity,min,128,0.006483025307574223,7,20,bell,COMPLETE
374,0.00046911806566640735,2025-07-13 08:34:40.525092,2025-07-13 08:36:02.017783,0 days 00:01:21.492691,relu,min,16,0.008070911220003673,6,8,bell,COMPLETE
375,0.032281432300806046,2025-07-13 08:36:02.018725,2025-07-13 08:38:04.308635,0 days 00:02:02.289910,identity,prod,16,0.009921618470372573,6,18,bell,COMPLETE
376,0.00033118764986284077,2025-07-13 08:38:04.309694,2025-07-13 08:40:00.277621,0 days 00:01:55.967927,identity,min,16,0.007369588834696991,6,17,bell,COMPLETE
377,0.000957745942287147,2025-07-13 08:40:00.278678,2025-07-13 08:42:00.436572,0 days 00:02:00.157894,identity,min,16,0.008563481155856712,6,18,bell,COMPLETE
378,0.0059228213503956795,2025-07-13 08:42:00.437618,2025-07-13 08:43:08.993296,0 days 00:01:08.555678,identity,min,32,0.009121290461744874,6,19,bell,COMPLETE
379,0.0007386559154838324,2025-07-13 08:43:08.994314,2025-07-13 08:45:01.355749,0 days 00:01:52.361435,identity,min,16,0.008130196817497042,6,16,bell,COMPLETE
380,0.000638779194559902,2025-07-13 08:45:01.356832,2025-07-13 08:46:57.156092,0 days 00:01:55.799260,identity,min,16,0.009270272203962026,6,17,bell,COMPLETE
381,0.0004862823407165706,2025-07-13 08:46:57.157297,2025-07-13 08:49:05.977006,0 days 00:02:08.819709,identity,min,16,0.007140084410994917,6,20,bell,COMPLETE
382,0.00031755154486745596,2025-07-13 08:49:05.978010,2025-07-13 08:50:54.254616,0 days 00:01:48.276606,relu,min,16,0.009951118659143448,5,17,bell,COMPLETE
383,1.7113302946090698,2025-07-13 08:50:54.255551,2025-07-13 08:52:42.384514,0 days 00:01:48.128963,relu,min,16,0.009984217419772038,5,17,bell,COMPLETE
384,0.00043006756459362805,2025-07-13 08:52:42.385441,2025-07-13 08:54:27.562471,0 days 00:01:45.177030,relu,prod,16,0.009159317316578548,5,16,bell,COMPLETE
385,0.012325424700975418,2025-07-13 08:54:27.563615,2025-07-13 08:56:15.597798,0 days 00:01:48.034183,identity,min,16,0.00992708684686957,5,17,bell,COMPLETE
386,0.01695133000612259,2025-07-13 08:56:15.598798,2025-07-13 08:58:00.205274,0 days 00:01:44.606476,relu,min,16,0.008547972853025802,5,16,bell,COMPLETE
387,0.11973245441913605,2025-07-13 08:58:00.206227,2025-07-13 08:59:48.885560,0 days 00:01:48.679333,relu,min,16,0.00019618713729299916,5,17,bell,COMPLETE
388,0.0016886192606762052,2025-07-13 08:59:48.886593,2025-07-13 09:01:38.571542,0 days 00:01:49.684949,relu,min,16,0.008620737288585409,5,17,bell,COMPLETE
389,0.0004022973298560828,2025-07-13 09:01:38.572592,2025-07-13 09:03:24.129511,0 days 00:01:45.556919,relu,min,16,0.009249152909096935,5,16,bell,COMPLETE
390,0.0003088070370722562,2025-07-13 09:03:24.130530,2025-07-13 09:05:13.508108,0 days 00:01:49.377578,relu,min,16,0.00992552070434877,5,17,bell,COMPLETE
391,1.719295620918274,2025-07-13 09:05:13.509091,2025-07-13 09:07:13.323497,0 days 00:01:59.814406,relu,min,16,0.0003420046212464761,5,21,sigmoid,COMPLETE
392,0.004273551050573587,2025-07-13 09:07:13.324529,2025-07-13 09:09:03.534709,0 days 00:01:50.210180,relu,prod,16,0.009996785558993011,5,17,bell,COMPLETE
393,0.0009338208474218845,2025-07-13 09:09:03.535713,2025-07-13 09:10:56.952208,0 days 00:01:53.416495,relu,min,16,0.00999956343686381,5,18,bell,COMPLETE
394,0.001713270554319024,2025-07-13 09:10:56.953190,2025-07-13 09:12:38.734664,0 days 00:01:41.781474,relu,min,16,0.008271630805285528,5,16,gaussian,COMPLETE
395,0.5277418494224548,2025-07-13 09:12:38.735633,2025-07-13 09:13:15.496770,0 days 00:00:36.761137,relu,min,64,0.009122583016331393,5,17,bell,COMPLETE
396,0.0003860033175442368,2025-07-13 09:13:15.497504,2025-07-13 09:15:12.716418,0 days 00:01:57.218914,relu,min,16,0.007927179597829981,5,19,bell,COMPLETE
397,0.4464426040649414,2025-07-13 09:15:12.717377,2025-07-13 09:15:38.848129,0 days 00:00:26.130752,relu,min,128,0.0028668643381427887,5,22,bell,COMPLETE
398,0.0004895167658105493,2025-07-13 09:15:38.848614,2025-07-13 09:17:24.384132,0 days 00:01:45.535518,relu,min,16,0.008654236454012653,5,16,bell,COMPLETE
399,0.0005848038126714528,2025-07-13 09:17:24.385064,2025-07-13 09:19:13.853310,0 days 00:01:49.468246,relu,min,16,0.009264526017907225,5,17,bell,COMPLETE
400,0.0003740338725037873,2025-07-13 09:19:13.854357,2025-07-13 09:21:19.329428,0 days 00:02:05.475071,relu,prod,16,0.00995690972515223,7,18,bell,COMPLETE
401,0.0004900319036096334,2025-07-13 09:21:19.330407,2025-07-13 09:23:16.752896,0 days 00:01:57.422489,relu,min,16,0.008081981834716836,5,19,bell,COMPLETE
402,0.0003898529976140708,2025-07-13 09:23:16.753947,2025-07-13 09:25:10.196226,0 days 00:01:53.442279,relu,min,16,0.008764401563683143,5,18,bell,COMPLETE
403,0.0003745785215869546,2025-07-13 09:25:10.197213,2025-07-13 09:27:11.862922,0 days 00:02:01.665709,identity,min,16,0.007781738613035801,8,17,bell,COMPLETE
404,0.021687274798750877,2025-07-13 09:27:11.863887,2025-07-13 09:28:22.364857,0 days 00:01:10.500970,relu,min,32,0.009252689384832376,6,20,bell,COMPLETE
405,0.0003547836095094681,2025-07-13 09:28:22.365834,2025-07-13 09:30:11.191329,0 days 00:01:48.825495,identity,min,16,0.00849326562766768,6,15,bell,COMPLETE
406,0.0003165318339597434,2025-07-13 09:30:11.192383,2025-07-13 09:32:11.752342,0 days 00:02:00.559959,identity,min,16,0.009957649556232667,6,18,bell,COMPLETE
407,0.00031187530839815736,2025-07-13 09:32:11.753373,2025-07-13 09:34:12.974328,0 days 00:02:01.220955,identity,min,16,0.009287209934169394,6,18,bell,COMPLETE
408,0.04735558107495308,2025-07-13 09:34:12.975297,2025-07-13 09:36:09.996082,0 days 00:01:57.020785,identity,min,16,0.009260040533978458,6,17,bell,COMPLETE
409,0.0006863517919555306,2025-07-13 09:36:09.997096,2025-07-13 09:37:26.308485,0 days 00:01:16.311389,identity,prod,16,0.009349519802640255,7,6,bell,COMPLETE
410,0.001207741443067789,2025-07-13 09:37:26.309483,2025-07-13 09:39:11.445119,0 days 00:01:45.135636,identity,min,16,0.009911332354884785,5,16,bell,COMPLETE
411,0.00032658185227774084,2025-07-13 09:39:11.446149,2025-07-13 09:41:08.099170,0 days 00:01:56.653021,identity,min,16,0.00996754036188832,6,17,bell,COMPLETE
