number,value,datetime_start,datetime_complete,duration,params_activation,params_and_operator,params_batch_size,params_lr,params_n_sets,params_seq_length,params_shape,state
412,0.004206798505038023,2025-07-13 09:41:08.101739,2025-07-13 09:43:09.443033,0 days 00:02:01.341294,identity,min,16,0.009994668324386256,6,18,bell,COMPLETE
413,0.002042823238298297,2025-07-13 09:43:09.444091,2025-07-13 09:45:00.919590,0 days 00:01:51.475499,identity,min,16,0.008448330622293197,6,17,sigmoid,COMPLETE
414,0.0003959921596106142,2025-07-13 09:45:00.920617,2025-07-13 09:46:53.139130,0 days 00:01:52.218513,identity,min,16,0.008995928098279392,6,16,bell,COMPLETE
415,0.007900414057075977,2025-07-13 09:46:53.140105,2025-07-13 09:48:50.784364,0 days 00:01:57.644259,identity,min,16,0.004055502863477128,6,18,gaussian,COMPLETE
416,0.053261276334524155,2025-07-13 09:48:50.785347,2025-07-13 09:50:42.491864,0 days 00:01:51.706517,identity,min,16,0.000665659151680821,6,16,bell,COMPLETE
417,0.001656225649639964,2025-07-13 09:50:42.492811,2025-07-13 09:52:32.384609,0 days 00:01:49.891798,identity,prod,16,0.009169772183079924,5,17,bell,COMPLETE
418,0.00040704765706323087,2025-07-13 09:52:32.385602,2025-07-13 09:54:32.763986,0 days 00:02:00.378384,identity,min,16,0.008597314943006197,6,18,bell,COMPLETE
419,0.08611191809177399,2025-07-13 09:54:32.764998,2025-07-13 09:55:11.925848,0 days 00:00:39.160850,identity,min,64,0.009993030631540176,6,17,bell,COMPLETE
420,0.000336507277097553,2025-07-13 09:55:11.926599,2025-07-13 09:57:14.401884,0 days 00:02:02.475285,identity,min,16,0.008671630317823711,6,18,bell,COMPLETE
421,0.013210996054112911,2025-07-13 09:57:14.402863,2025-07-13 09:59:10.999234,0 days 00:01:56.596371,identity,min,16,0.009995939638838063,6,17,bell,COMPLETE
422,0.011354347690939903,2025-07-13 09:59:11.000160,2025-07-13 09:59:33.974649,0 days 00:00:22.974489,identity,min,128,0.009197837426891049,6,16,bell,COMPLETE
423,0.000388904707506299,2025-07-13 09:59:33.975462,2025-07-13 10:01:27.015615,0 days 00:01:53.040153,identity,min,16,0.008188702875487664,5,18,bell,COMPLETE
424,0.0003436775878071785,2025-07-13 10:01:27.016614,2025-07-13 10:03:16.613503,0 days 00:01:49.596889,identity,min,16,0.00918983944110444,6,15,bell,COMPLETE
425,0.30815693736076355,2025-07-13 10:03:16.614467,2025-07-13 10:05:14.436289,0 days 00:01:57.821822,identity,min,16,0.008026081825388847,6,17,bell,COMPLETE
426,0.0006391620263457298,2025-07-13 10:05:14.437299,2025-07-13 10:07:13.499667,0 days 00:01:59.062368,identity,prod,16,0.008616670233188378,6,17,bell,COMPLETE
427,0.00030574577976949513,2025-07-13 10:07:13.500662,2025-07-13 10:09:14.635047,0 days 00:02:01.134385,identity,min,16,0.009273045334617853,6,18,bell,COMPLETE
428,0.000407445797463879,2025-07-13 10:09:14.636009,2025-07-13 10:11:15.750532,0 days 00:02:01.114523,identity,min,16,0.007888674503527338,6,18,bell,COMPLETE
429,0.001088870456442237,2025-07-13 10:11:15.751595,2025-07-13 10:13:17.434715,0 days 00:02:01.683120,identity,min,16,0.009997330061297273,6,18,bell,COMPLETE
430,0.0007479201885871589,2025-07-13 10:13:17.435716,2025-07-13 10:14:25.323767,0 days 00:01:07.888051,identity,min,32,0.008646942514948729,6,19,bell,COMPLETE
431,0.0003947569348383695,2025-07-13 10:14:25.324788,2025-07-13 10:16:26.697189,0 days 00:02:01.372401,identity,min,16,0.009101967812901067,6,18,bell,COMPLETE
432,0.0006544733187183738,2025-07-13 10:16:26.698206,2025-07-13 10:18:32.216277,0 days 00:02:05.518071,identity,min,16,0.007953845417408685,6,19,bell,COMPLETE
433,0.0008547990000806749,2025-07-13 10:18:32.217303,2025-07-13 10:20:34.751051,0 days 00:02:02.533748,identity,min,16,0.00918717105553095,6,18,bell,COMPLETE
434,0.0003108274831902236,2025-07-13 10:20:34.752137,2025-07-13 10:22:37.306486,0 days 00:02:02.554349,identity,prod,16,0.008565932341170328,6,18,bell,COMPLETE
435,0.011382654309272766,2025-07-13 10:22:37.307509,2025-07-13 10:24:40.739273,0 days 00:02:03.431764,identity,prod,16,0.007819420778214497,6,18,bell,COMPLETE
436,0.9099331498146057,2025-07-13 10:24:40.740250,2025-07-13 10:26:39.475079,0 days 00:01:58.734829,identity,prod,16,0.00839881098317098,6,18,gaussian,COMPLETE
437,0.1576775312423706,2025-07-13 10:26:39.476055,2025-07-13 10:28:39.778486,0 days 00:02:00.302431,identity,prod,16,0.008522563097494041,6,19,sigmoid,COMPLETE
438,0.053400155156850815,2025-07-13 10:28:39.779481,2025-07-13 10:30:41.924071,0 days 00:02:02.144590,identity,prod,16,0.0005927001043863542,6,18,bell,COMPLETE
439,0.00031166189000941813,2025-07-13 10:30:41.925048,2025-07-13 10:32:46.256580,0 days 00:02:04.331532,identity,prod,16,0.0076781775495348,6,19,bell,COMPLETE
440,0.00043041849858127534,2025-07-13 10:32:46.257656,2025-07-13 10:34:47.582953,0 days 00:02:01.325297,identity,prod,16,0.007138088298939082,6,18,bell,COMPLETE
441,0.2840484082698822,2025-07-13 10:34:47.584012,2025-07-13 10:36:52.458404,0 days 00:02:04.874392,identity,prod,16,0.00771022328575179,6,19,bell,COMPLETE
442,0.0005540233105421066,2025-07-13 10:36:52.459433,2025-07-13 10:38:53.481098,0 days 00:02:01.021665,identity,prod,16,0.006754897194240994,6,18,bell,COMPLETE
443,0.00043146623647771776,2025-07-13 10:38:53.482215,2025-07-13 10:40:59.763766,0 days 00:02:06.281551,identity,prod,16,0.0076878691816337314,6,19,bell,COMPLETE
444,0.0005308816325850785,2025-07-13 10:40:59.764804,2025-07-13 10:43:01.161693,0 days 00:02:01.396889,identity,prod,16,0.008445377306463218,6,18,bell,COMPLETE
445,0.3264072835445404,2025-07-13 10:43:01.162772,2025-07-13 10:43:24.392246,0 days 00:00:23.229474,identity,prod,128,0.009969098736376079,6,17,bell,COMPLETE
446,0.16857168078422546,2025-07-13 10:43:24.393024,2025-07-13 10:44:04.189479,0 days 00:00:39.796455,identity,prod,64,0.007548972823292128,6,18,bell,COMPLETE
447,0.00035671921796165407,2025-07-13 10:44:04.190262,2025-07-13 10:46:02.119194,0 days 00:01:57.928932,identity,prod,16,0.008789830721712596,6,17,bell,COMPLETE
448,0.002732575638219714,2025-07-13 10:46:02.120166,2025-07-13 10:48:02.503621,0 days 00:02:00.383455,identity,prod,16,0.008243085065974322,6,18,bell,COMPLETE
449,0.07890243083238602,2025-07-13 10:48:02.504729,2025-07-13 10:49:59.756682,0 days 00:01:57.251953,identity,prod,16,0.009277501412143707,6,17,bell,COMPLETE
450,0.0003130710974801332,2025-07-13 10:49:59.757767,2025-07-13 10:52:05.324035,0 days 00:02:05.566268,identity,prod,16,0.009963433117982035,6,19,bell,COMPLETE
451,0.00044619603431783617,2025-07-13 10:52:05.325057,2025-07-13 10:54:10.646398,0 days 00:02:05.321341,identity,prod,16,0.009984562450828882,6,19,bell,COMPLETE
452,0.0003423463203944266,2025-07-13 10:54:10.647509,2025-07-13 10:56:20.487417,0 days 00:02:09.839908,identity,prod,16,0.00999194705146078,6,20,bell,COMPLETE
453,0.0006481390446424484,2025-07-13 10:56:20.488404,2025-07-13 10:58:26.551110,0 days 00:02:06.062706,identity,prod,16,0.009202324728699786,6,19,bell,COMPLETE
454,0.02369515597820282,2025-07-13 10:58:26.552224,2025-07-13 10:59:34.468265,0 days 00:01:07.916041,identity,prod,32,0.009078731667734673,6,19,bell,COMPLETE
455,0.0003341362171340734,2025-07-13 10:59:34.469311,2025-07-13 11:01:42.832024,0 days 00:02:08.362713,identity,prod,16,0.008277454888107626,6,20,bell,COMPLETE
456,0.01633470319211483,2025-07-13 11:01:42.833012,2025-07-13 11:03:47.236022,0 days 00:02:04.403010,identity,min,16,0.009968891807925298,6,19,bell,COMPLETE
457,0.0012587730307132006,2025-07-13 11:03:47.237209,2025-07-13 11:05:47.141569,0 days 00:01:59.904360,identity,min,16,0.009129963085566635,6,18,bell,COMPLETE
458,0.0016902233473956585,2025-07-13 11:05:47.142811,2025-07-13 11:07:47.470852,0 days 00:02:00.328041,identity,min,16,0.0073618961469739995,6,18,bell,COMPLETE
459,0.0014388682320713997,2025-07-13 11:07:47.471944,2025-07-13 11:09:48.599553,0 days 00:02:01.127609,identity,prod,16,0.008605479418178298,6,19,gaussian,COMPLETE
460,0.6615525484085083,2025-07-13 11:09:48.600646,2025-07-13 11:11:51.130132,0 days 00:02:02.529486,identity,min,16,0.0008321199621899095,6,20,sigmoid,COMPLETE
461,0.0003191177675034851,2025-07-13 11:11:51.131211,2025-07-13 11:13:51.384014,0 days 00:02:00.252803,identity,min,16,0.009986054638618468,6,18,bell,COMPLETE
462,0.02319963090121746,2025-07-13 11:13:51.385107,2025-07-13 11:15:54.964563,0 days 00:02:03.579456,identity,min,16,0.0020629379619804726,6,19,bell,COMPLETE
463,0.1110866442322731,2025-07-13 11:15:54.965625,2025-07-13 11:17:53.642669,0 days 00:01:58.677044,identity,min,16,0.007902145771968438,6,18,bell,COMPLETE
464,0.046745993196964264,2025-07-13 11:17:53.643825,2025-07-13 11:19:53.005816,0 days 00:01:59.361991,identity,min,16,0.00013047801847420064,6,18,bell,COMPLETE
465,0.00030836756923235953,2025-07-13 11:19:53.006872,2025-07-13 11:21:49.121684,0 days 00:01:56.114812,identity,min,16,0.009089863706626023,6,17,bell,COMPLETE
466,0.00042021009721793234,2025-07-13 11:21:49.122737,2025-07-13 11:23:54.487873,0 days 00:02:05.365136,identity,prod,16,0.006501262130251397,6,19,bell,COMPLETE
467,0.0007815234712325037,2025-07-13 11:23:54.488940,2025-07-13 11:26:02.496085,0 days 00:02:08.007145,identity,min,16,0.007119482333800508,6,20,bell,COMPLETE
468,0.0009248760179616511,2025-07-13 11:26:02.497198,2025-07-13 11:27:58.367072,0 days 00:01:55.869874,identity,min,16,0.008203960210880434,6,17,bell,COMPLETE
469,0.00042368893628008664,2025-07-13 11:27:58.368190,2025-07-13 11:30:11.735805,0 days 00:02:13.367615,identity,min,16,0.0089481845569669,6,21,bell,COMPLETE
470,0.00037374792736954987,2025-07-13 11:30:11.736930,2025-07-13 11:32:08.709715,0 days 00:01:56.972785,identity,min,16,0.007534994173521735,6,17,bell,COMPLETE
471,0.004616076592355967,2025-07-13 11:32:08.710842,2025-07-13 11:32:49.071825,0 days 00:00:40.360983,identity,min,64,0.008746267864703961,6,18,bell,COMPLETE
472,0.12807214260101318,2025-07-13 11:32:49.072491,2025-07-13 11:34:55.716139,0 days 00:02:06.643648,identity,prod,16,0.00025521079211453593,6,19,bell,COMPLETE
473,0.4573991298675537,2025-07-13 11:34:55.717155,2025-07-13 11:35:20.598897,0 days 00:00:24.881742,identity,min,128,0.00914878710721412,6,18,bell,COMPLETE
474,0.001759676611982286,2025-07-13 11:35:20.599601,2025-07-13 11:37:43.950203,0 days 00:02:23.350602,identity,min,16,0.008189590424472542,6,23,bell,COMPLETE
475,0.0006859684945084155,2025-07-13 11:37:43.951185,2025-07-13 11:39:41.072960,0 days 00:01:57.121775,identity,min,16,0.009196707081626601,6,17,bell,COMPLETE
476,0.0003525304200593382,2025-07-13 11:39:41.074185,2025-07-13 11:41:20.046312,0 days 00:01:38.972127,identity,min,16,0.007837379906350984,6,13,bell,COMPLETE
477,0.01075147744268179,2025-07-13 11:41:20.047355,2025-07-13 11:43:19.879051,0 days 00:01:59.831696,identity,min,16,0.00999491555720575,6,18,bell,COMPLETE
478,0.45055195689201355,2025-07-13 11:43:19.880087,2025-07-13 11:45:16.674972,0 days 00:01:56.794885,identity,prod,16,0.00094945886006963,6,17,bell,COMPLETE
479,0.0007567566935904324,2025-07-13 11:45:16.676145,2025-07-13 11:46:24.073623,0 days 00:01:07.397478,identity,min,32,0.008416537947304428,6,19,bell,COMPLETE
480,0.0004802919866051525,2025-07-13 11:46:24.074632,2025-07-13 11:48:20.111911,0 days 00:01:56.037279,identity,min,16,0.00719519035509927,6,17,bell,COMPLETE
481,0.0004004299407824874,2025-07-13 11:48:20.113006,2025-07-13 11:50:21.107778,0 days 00:02:00.994772,identity,min,16,0.009175494689266834,6,18,bell,COMPLETE
482,0.19029168784618378,2025-07-13 11:50:21.108812,2025-07-13 11:52:20.020122,0 days 00:01:58.911310,identity,min,16,0.005810763717123264,6,19,sigmoid,COMPLETE
483,0.0003136860905215144,2025-07-13 11:52:20.021179,2025-07-13 11:54:17.457956,0 days 00:01:57.436777,identity,prod,16,0.00793838070947364,6,17,bell,COMPLETE
484,0.000678288284689188,2025-07-13 11:54:17.459147,2025-07-13 11:56:10.075844,0 days 00:01:52.616697,identity,prod,16,0.006967170352628274,6,17,gaussian,COMPLETE
485,0.0003694990882650018,2025-07-13 11:56:10.076898,2025-07-13 11:58:06.773454,0 days 00:01:56.696556,identity,prod,16,0.006572088506883367,6,17,bell,COMPLETE
486,0.0003874006506521255,2025-07-13 11:58:06.774498,2025-07-13 12:00:04.012658,0 days 00:01:57.238160,identity,prod,16,0.007803564718572592,6,17,bell,COMPLETE
487,0.00034714085632003844,2025-07-13 12:00:04.013726,2025-07-13 12:02:05.906050,0 days 00:02:01.892324,identity,prod,16,0.007799028504026844,6,18,bell,COMPLETE
488,0.03885701671242714,2025-07-13 12:02:05.907208,2025-07-13 12:04:03.293312,0 days 00:01:57.386104,identity,prod,16,0.0025954964422361324,6,17,bell,COMPLETE
489,0.02912016399204731,2025-07-13 12:04:03.294340,2025-07-13 12:06:04.757192,0 days 00:02:01.462852,identity,prod,16,0.008584357130911166,6,18,bell,COMPLETE
490,0.00818282924592495,2025-07-13 12:06:04.758281,2025-07-13 12:08:01.672681,0 days 00:01:56.914400,identity,prod,16,0.0037357402077897476,6,17,bell,COMPLETE
491,0.0039102244190871716,2025-07-13 12:08:01.673691,2025-07-13 12:10:02.767707,0 days 00:02:01.094016,identity,prod,16,0.007085340273319295,6,18,bell,COMPLETE
492,0.0003463730972725898,2025-07-13 12:10:02.768780,2025-07-13 12:11:59.821182,0 days 00:01:57.052402,identity,prod,16,0.008215350433806506,6,17,bell,COMPLETE
493,0.00039435134385712445,2025-07-13 12:11:59.822261,2025-07-13 12:14:01.267182,0 days 00:02:01.444921,identity,prod,16,0.0075838793463828755,6,18,bell,COMPLETE
494,0.0003114952123723924,2025-07-13 12:14:01.268206,2025-07-13 12:16:10.366631,0 days 00:02:09.098425,identity,prod,16,0.008651401626416888,6,20,bell,COMPLETE
495,0.002117689698934555,2025-07-13 12:16:10.367896,2025-07-13 12:18:20.817305,0 days 00:02:10.449409,identity,prod,16,0.006179070219394614,6,20,bell,COMPLETE
496,0.39203599095344543,2025-07-13 12:18:20.825328,2025-07-13 12:19:04.433202,0 days 00:00:43.607874,identity,prod,64,0.007553534525894256,6,21,bell,COMPLETE
497,1.4890512228012085,2025-07-13 12:19:04.434021,2025-07-13 12:19:29.661729,0 days 00:00:25.227708,identity,prod,128,0.008452484400986162,6,20,bell,COMPLETE
498,0.00029700170853175223,2025-07-13 12:19:29.662561,2025-07-13 12:21:37.865588,0 days 00:02:08.203027,identity,prod,16,0.00672741745990745,6,20,bell,COMPLETE
499,0.0008237309521064162,2025-07-13 12:21:37.866790,2025-07-13 12:23:47.572543,0 days 00:02:09.705753,identity,prod,16,0.006566840045468068,6,20,bell,COMPLETE
