number,value,datetime_start,datetime_complete,duration,params_activation,params_batch_size,params_h,params_lr,params_seq_length,state
0,0.0013195326318964362,2025-07-12 16:34:10.971063,2025-07-12 16:34:34.731930,0 days 00:00:23.760867,identity,32,10,0.0013147853726745045,17,COMPLETE
1,0.0004126712155994028,2025-07-12 16:34:34.732814,2025-07-12 16:35:25.182332,0 days 00:00:50.449518,identity,16,108,0.0015619662496119163,15,COMPLETE
2,0.0008066647569648921,2025-07-12 16:35:25.183120,2025-07-12 16:35:46.808775,0 days 00:00:21.625655,identity,128,102,0.0003943072383099092,13,COMPLETE
3,0.0011070528998970985,2025-07-12 16:35:46.809386,2025-07-12 16:35:55.788661,0 days 00:00:08.979275,identity,128,22,0.0029864967826287547,14,COMPLETE
4,1.6798341274261475,2025-07-12 16:35:55.789139,2025-07-12 16:36:28.963444,0 days 00:00:33.174305,relu,16,34,0.0007177565886060803,10,COMPLETE
5,0.009129377081990242,2025-07-12 16:36:28.964188,2025-07-12 16:36:39.888813,0 days 00:00:10.924625,identity,64,11,0.0002004106238093608,14,COMPLETE
6,0.00040211027953773737,2025-07-12 16:36:39.889328,2025-07-12 16:37:13.160451,0 days 00:00:33.271123,relu,32,126,0.007297992688885095,13,COMPLETE
7,1.662611484527588,2025-07-12 16:37:13.160864,2025-07-12 16:37:32.968131,0 days 00:00:19.807267,relu,32,45,0.003955386893661054,7,COMPLETE
8,0.0004171885666437447,2025-07-12 16:37:32.968656,2025-07-12 16:38:15.218492,0 days 00:00:42.249836,identity,16,85,0.0016558199859224307,12,COMPLETE
9,0.0005175222177058458,2025-07-12 16:38:15.219084,2025-07-12 16:38:32.070209,0 days 00:00:16.851125,identity,32,32,0.0019812590169646207,6,COMPLETE
10,1.7199456691741943,2025-07-12 16:38:32.070626,2025-07-12 16:39:08.589153,0 days 00:00:36.518527,relu,64,128,0.006291829948870825,23,COMPLETE
11,1.7162741422653198,2025-07-12 16:39:08.589751,2025-07-12 16:40:10.543612,0 days 00:01:01.953861,relu,16,125,0.006593400835823007,19,COMPLETE
12,1.719295620918274,2025-07-12 16:40:10.544503,2025-07-12 16:41:08.510799,0 days 00:00:57.966296,relu,16,102,0.0005780736154833522,21,COMPLETE
13,1.7113302946090698,2025-07-12 16:41:08.511387,2025-07-12 16:41:43.752068,0 days 00:00:35.240681,relu,32,107,0.00834224008683074,17,COMPLETE
14,0.0007758405408822,2025-07-12 16:41:43.752683,2025-07-12 16:42:07.654192,0 days 00:00:23.901509,identity,32,65,0.00011813024160692465,10,COMPLETE
15,0.0003565977967809886,2025-07-12 16:42:07.654759,2025-07-12 16:42:54.154444,0 days 00:00:46.499685,relu,16,81,0.0039757258530816655,17,COMPLETE
16,1.7180771827697754,2025-07-12 16:42:54.155053,2025-07-12 16:43:17.686176,0 days 00:00:23.531123,relu,128,70,0.00371081284138936,25,COMPLETE
17,0.00033415513462387025,2025-07-12 16:43:17.686794,2025-07-12 16:43:43.018886,0 days 00:00:25.332092,relu,64,79,0.009705701296399335,19,COMPLETE
18,1.7150795459747314,2025-07-12 16:43:43.019334,2025-07-12 16:44:04.889345,0 days 00:00:21.870011,relu,64,65,0.00990853899500366,20,COMPLETE
19,1.7113302946090698,2025-07-12 16:44:04.889890,2025-07-12 16:44:28.226418,0 days 00:00:23.336528,relu,64,90,0.002617419598102049,17,COMPLETE
20,1.7199455499649048,2025-07-12 16:44:28.226858,2025-07-12 16:44:47.824482,0 days 00:00:19.597624,relu,64,51,0.005904198199637607,22,COMPLETE
21,1.7140681743621826,2025-07-12 16:44:47.825226,2025-07-12 16:45:36.263748,0 days 00:00:48.438522,relu,16,84,0.004873111083136303,18,COMPLETE
22,1.6798341274261475,2025-07-12 16:45:36.264355,2025-07-12 16:46:02.274417,0 days 00:00:26.010062,relu,32,76,0.008756037857338198,10,COMPLETE
23,1.707970380783081,2025-07-12 16:46:02.274997,2025-07-12 16:46:20.169601,0 days 00:00:17.894604,relu,64,58,0.0025784895158692638,16,COMPLETE
24,1.690132975578308,2025-07-12 16:46:20.170041,2025-07-12 16:46:50.163745,0 days 00:00:29.993704,relu,32,94,0.0050153694211322805,12,COMPLETE
25,1.7180771827697754,2025-07-12 16:46:50.164273,2025-07-12 16:47:48.513235,0 days 00:00:58.348962,relu,16,116,0.009714350779750209,20,COMPLETE
26,1.7199456691741943,2025-07-12 16:47:48.513815,2025-07-12 16:48:16.286635,0 days 00:00:27.772820,relu,64,78,0.004005385045387204,23,COMPLETE
27,0.0003801135753747076,2025-07-12 16:48:16.287187,2025-07-12 16:48:39.680202,0 days 00:00:23.393015,relu,128,116,0.006785633749561624,15,COMPLETE
28,0.00045030564069747925,2025-07-12 16:48:39.680791,2025-07-12 16:49:06.283368,0 days 00:00:26.602577,relu,128,114,0.0008213230212888173,19,COMPLETE
29,0.00039370113518089056,2025-07-12 16:49:06.283795,2025-07-12 16:49:27.197231,0 days 00:00:20.913436,relu,128,94,0.0022408196494211924,16,COMPLETE
30,1.7140681743621826,2025-07-12 16:49:27.197801,2025-07-12 16:49:42.871065,0 days 00:00:15.673264,relu,128,55,0.0011898329124488023,18,COMPLETE
31,0.00033820298267528415,2025-07-12 16:49:42.871492,2025-07-12 16:50:02.512098,0 days 00:00:19.640606,relu,128,96,0.0022177780962817054,16,COMPLETE
32,1.7041062116622925,2025-07-12 16:50:02.512666,2025-07-12 16:50:27.086510,0 days 00:00:24.573844,relu,128,117,0.003327817815660304,15,COMPLETE
33,1.707970380783081,2025-07-12 16:50:27.086959,2025-07-12 16:50:48.447770,0 days 00:00:21.360811,relu,128,97,0.005239570016423864,16,COMPLETE
34,1.7140681743621826,2025-07-12 16:50:48.448338,2025-07-12 16:51:09.260162,0 days 00:00:20.811824,relu,128,79,0.0016175962361402465,18,COMPLETE
35,0.000380475859856233,2025-07-12 16:51:09.260592,2025-07-12 16:51:31.069652,0 days 00:00:21.809060,relu,128,106,0.004356192380988888,15,COMPLETE
36,0.0003800143313128501,2025-07-12 16:51:31.070214,2025-07-12 16:51:49.674514,0 days 00:00:18.604300,identity,128,87,0.0031413166773297547,14,COMPLETE
37,0.00036783513496629894,2025-07-12 16:51:49.674958,2025-07-12 16:52:34.385367,0 days 00:00:44.710409,identity,16,84,0.0013730227136321493,13,COMPLETE
38,0.0004921421059407294,2025-07-12 16:52:34.385926,2025-07-12 16:53:15.701717,0 days 00:00:41.315791,identity,16,74,0.0004801192951831029,11,COMPLETE
39,0.0006317916559055448,2025-07-12 16:53:15.702301,2025-07-12 16:53:59.272524,0 days 00:00:43.570223,identity,16,82,0.0011548900036424242,13,COMPLETE
40,0.000482400122564286,2025-07-12 16:53:59.273111,2025-07-12 16:54:41.180897,0 days 00:00:41.907786,identity,16,98,0.00030093807482100643,8,COMPLETE
41,0.00037230938323773444,2025-07-12 16:54:41.181489,2025-07-12 16:55:28.058439,0 days 00:00:46.876950,identity,16,87,0.0019189697240259405,14,COMPLETE
42,0.0005980569985695183,2025-07-12 16:55:28.059024,2025-07-12 16:56:11.221609,0 days 00:00:43.162585,identity,16,70,0.0014574073341029415,14,COMPLETE
43,0.0004034388985019177,2025-07-12 16:56:11.222171,2025-07-12 16:56:55.553200,0 days 00:00:44.331029,identity,16,89,0.0008953016955132558,12,COMPLETE
44,0.0003937172587029636,2025-07-12 16:56:55.553664,2025-07-12 16:57:37.972984,0 days 00:00:42.419320,identity,16,61,0.001961277920820759,16,COMPLETE
45,0.0005809059366583824,2025-07-12 16:57:37.973599,2025-07-12 16:58:26.802936,0 days 00:00:48.829337,identity,16,102,0.0018273582306689352,13,COMPLETE
46,0.0003291801258455962,2025-07-12 16:58:26.803537,2025-07-12 16:59:13.773774,0 days 00:00:46.970237,identity,16,72,0.0023696814193615618,19,COMPLETE
47,0.000504329102113843,2025-07-12 16:59:13.774361,2025-07-12 16:59:35.588473,0 days 00:00:21.814112,identity,64,72,0.0025038418712522844,19,COMPLETE
48,0.0003467835485935211,2025-07-12 16:59:35.588902,2025-07-12 17:00:17.112781,0 days 00:00:41.523879,identity,16,39,0.0012752417108984767,21,COMPLETE
49,0.00041216216050088406,2025-07-12 17:00:17.113372,2025-07-12 17:00:52.945567,0 days 00:00:35.832195,identity,16,22,0.000704715309095618,21,COMPLETE
50,0.0005631881067529321,2025-07-12 17:00:52.946179,2025-07-12 17:01:12.772229,0 days 00:00:19.826050,identity,64,39,0.000997315278760629,25,COMPLETE
51,0.00033168974914588034,2025-07-12 17:01:12.772804,2025-07-12 17:01:59.960324,0 days 00:00:47.187520,identity,16,66,0.0014267501782672227,20,COMPLETE
52,0.00032032886520028114,2025-07-12 17:01:59.960923,2025-07-12 17:02:41.556967,0 days 00:00:41.596044,identity,16,44,0.0030025013684489743,21,COMPLETE
53,0.00035289835068397224,2025-07-12 17:02:41.557565,2025-07-12 17:03:20.781697,0 days 00:00:39.224132,identity,16,29,0.0011291740818567758,23,COMPLETE
54,0.00035456762998364866,2025-07-12 17:03:20.782295,2025-07-12 17:04:04.078837,0 days 00:00:43.296542,identity,16,46,0.0022284197328444285,21,COMPLETE
55,0.00031614338513463736,2025-07-12 17:04:04.079429,2025-07-12 17:04:44.090215,0 days 00:00:40.010786,identity,16,38,0.002883541658763707,20,COMPLETE
56,0.0003804467269219458,2025-07-12 17:04:44.090811,2025-07-12 17:05:15.801324,0 days 00:00:31.710513,identity,16,12,0.0027925049405109676,20,COMPLETE
57,0.0003741002583410591,2025-07-12 17:05:15.801879,2025-07-12 17:05:35.860274,0 days 00:00:20.058395,identity,64,52,0.0033698293839683605,22,COMPLETE
58,0.0003287856816314161,2025-07-12 17:05:35.860699,2025-07-12 17:06:17.267204,0 days 00:00:41.406505,identity,16,48,0.001685570428885848,24,COMPLETE
59,0.0004281858855392784,2025-07-12 17:06:17.267797,2025-07-12 17:07:07.421954,0 days 00:00:50.154157,identity,16,65,0.0015371509694890033,24,COMPLETE
60,0.0003109262033831328,2025-07-12 17:07:07.422546,2025-07-12 17:07:50.430284,0 days 00:00:43.007738,identity,16,46,0.007419526493893602,22,COMPLETE
61,0.00032093460322357714,2025-07-12 17:07:50.430755,2025-07-12 17:08:31.278865,0 days 00:00:40.848110,identity,16,41,0.008183789323700804,22,COMPLETE
62,0.00031738626421429217,2025-07-12 17:08:31.279459,2025-07-12 17:09:13.043854,0 days 00:00:41.764395,identity,16,42,0.007406391078146819,24,COMPLETE
63,0.0003045150951948017,2025-07-12 17:09:13.044422,2025-07-12 17:09:57.904075,0 days 00:00:44.859653,identity,16,46,0.007787513012161735,24,COMPLETE
64,0.0003101035545114428,2025-07-12 17:09:57.904530,2025-07-12 17:10:42.164506,0 days 00:00:44.259976,identity,16,45,0.007748031909094446,24,COMPLETE
65,0.0003098076267633587,2025-07-12 17:10:42.165100,2025-07-12 17:11:25.918158,0 days 00:00:43.753058,identity,16,39,0.008207102750299932,24,COMPLETE
66,0.0003703847760334611,2025-07-12 17:11:25.918779,2025-07-12 17:12:06.797650,0 days 00:00:40.878871,identity,16,34,0.0075607655920673904,24,COMPLETE
67,0.00030675448942929506,2025-07-12 17:12:06.798268,2025-07-12 17:12:44.641726,0 days 00:00:37.843458,identity,16,28,0.006125229835605692,23,COMPLETE
68,0.00029845788958482444,2025-07-12 17:12:44.642334,2025-07-12 17:13:23.208715,0 days 00:00:38.566381,identity,16,27,0.005875203077058532,25,COMPLETE
69,0.00041690285434015095,2025-07-12 17:13:23.209366,2025-07-12 17:13:46.092710,0 days 00:00:22.883344,identity,32,26,0.005634513948925938,25,COMPLETE
70,0.00041199367842637,2025-07-12 17:13:46.093170,2025-07-12 17:14:20.991190,0 days 00:00:34.898020,identity,16,15,0.006334485311390314,23,COMPLETE
71,0.00030906693427823484,2025-07-12 17:14:20.991841,2025-07-12 17:15:02.399805,0 days 00:00:41.407964,identity,16,35,0.007037920191244105,24,COMPLETE
72,0.00035591048072092235,2025-07-12 17:15:02.400431,2025-07-12 17:15:44.653756,0 days 00:00:42.253325,identity,16,36,0.004770730138578474,25,COMPLETE
73,0.000301926804240793,2025-07-12 17:15:44.654410,2025-07-12 17:16:24.547430,0 days 00:00:39.893020,identity,16,30,0.008458142451267739,24,COMPLETE
74,0.00029751876718364656,2025-07-12 17:16:24.548051,2025-07-12 17:17:02.032723,0 days 00:00:37.484672,identity,16,22,0.00856263510643767,24,COMPLETE
75,0.0003365098382346332,2025-07-12 17:17:02.033337,2025-07-12 17:17:37.931082,0 days 00:00:35.897745,identity,16,20,0.009076092666523422,24,COMPLETE
76,0.00031542687793262303,2025-07-12 17:17:37.931663,2025-07-12 17:18:14.892496,0 days 00:00:36.960833,identity,16,26,0.006522084513553438,23,COMPLETE
77,0.0003096461296081543,2025-07-12 17:18:14.892930,2025-07-12 17:18:55.341054,0 days 00:00:40.448124,identity,16,29,0.00836391430645152,25,COMPLETE
78,0.0003617933252826333,2025-07-12 17:18:55.341696,2025-07-12 17:19:20.719857,0 days 00:00:25.378161,identity,32,31,0.005645634983729157,25,COMPLETE
79,0.00030288947164081037,2025-07-12 17:19:20.720448,2025-07-12 17:19:55.779768,0 days 00:00:35.059320,identity,16,19,0.008488794958205472,23,COMPLETE
80,0.00030974007677286863,2025-07-12 17:19:55.780219,2025-07-12 17:20:30.316181,0 days 00:00:34.535962,identity,16,18,0.004628660225244025,23,COMPLETE
81,0.00037446600617840886,2025-07-12 17:20:30.316848,2025-07-12 17:21:04.508288,0 days 00:00:34.191440,identity,16,17,0.009957576554029048,23,COMPLETE
82,0.00032000680221244693,2025-07-12 17:21:04.508926,2025-07-12 17:21:40.893960,0 days 00:00:36.385034,identity,16,25,0.004494454055223344,23,COMPLETE
83,0.00033007358433678746,2025-07-12 17:21:40.894597,2025-07-12 17:22:17.072843,0 days 00:00:36.178246,identity,16,19,0.006928262898701277,25,COMPLETE
84,0.0003022915043402463,2025-07-12 17:22:17.073433,2025-07-12 17:22:49.638102,0 days 00:00:32.564669,identity,16,12,0.005501824463190042,22,COMPLETE
85,0.000419416232034564,2025-07-12 17:22:49.638524,2025-07-12 17:23:20.181122,0 days 00:00:30.542598,identity,16,8,0.008909946351389924,22,COMPLETE
86,0.00035712344106286764,2025-07-12 17:23:20.181747,2025-07-12 17:23:54.979825,0 days 00:00:34.798078,identity,16,14,0.005293172045831682,25,COMPLETE
87,0.00029863938107155263,2025-07-12 17:23:54.980233,2025-07-12 17:24:33.091617,0 days 00:00:38.111384,identity,16,28,0.005794611164635099,24,COMPLETE
88,0.00031509759719483554,2025-07-12 17:24:33.092283,2025-07-12 17:25:07.993190,0 days 00:00:34.900907,identity,16,24,0.006100680135518064,22,COMPLETE
89,0.0003305590944364667,2025-07-12 17:25:07.993777,2025-07-12 17:25:48.740849,0 days 00:00:40.747072,identity,16,33,0.0038746044953896245,24,COMPLETE
90,0.00041383469942957163,2025-07-12 17:25:48.741292,2025-07-12 17:26:11.092139,0 days 00:00:22.350847,identity,32,22,0.006871462736219603,23,COMPLETE
91,0.00031865754863247275,2025-07-12 17:26:11.092568,2025-07-12 17:26:44.917698,0 days 00:00:33.825130,identity,16,12,0.00884956680959843,25,COMPLETE
92,0.0004163799458183348,2025-07-12 17:26:44.918291,2025-07-12 17:27:24.933860,0 days 00:00:40.015569,identity,16,29,0.00587409396404033,24,COMPLETE
93,0.0007696771644987166,2025-07-12 17:27:24.934375,2025-07-12 17:28:05.657600,0 days 00:00:40.723225,identity,16,29,0.00011585526765225924,25,COMPLETE
94,0.00033486573374830186,2025-07-12 17:28:05.658136,2025-07-12 17:28:46.029633,0 days 00:00:40.371497,identity,16,30,0.008242417241332,24,COMPLETE
95,0.000425267789978534,2025-07-12 17:28:46.030246,2025-07-12 17:29:27.401380,0 days 00:00:41.371134,identity,16,35,0.00015075174500196444,23,COMPLETE
96,0.000332576542859897,2025-07-12 17:29:27.401814,2025-07-12 17:29:59.506622,0 days 00:00:32.104808,identity,16,16,0.005420208422667789,22,COMPLETE
97,0.00030983719625510275,2025-07-12 17:29:59.507233,2025-07-12 17:30:36.905062,0 days 00:00:37.397829,identity,16,22,0.006510211147590543,24,COMPLETE
98,0.00032950908644124866,2025-07-12 17:30:36.905508,2025-07-12 17:31:15.239275,0 days 00:00:38.333767,identity,16,27,0.00938369640550334,25,COMPLETE
99,0.0003149392723571509,2025-07-12 17:31:15.239910,2025-07-12 17:31:47.322109,0 days 00:00:32.082199,identity,16,9,0.007229229263083287,23,COMPLETE
100,0.00031260904506780207,2025-07-12 17:31:47.322504,2025-07-12 17:32:24.383779,0 days 00:00:37.061275,identity,16,21,0.005056345635672903,24,COMPLETE
101,0.00036504340823739767,2025-07-12 17:32:24.384401,2025-07-12 17:32:59.219821,0 days 00:00:34.835420,identity,16,18,0.004390028536571372,23,COMPLETE
102,0.00030709587736055255,2025-07-12 17:32:59.220441,2025-07-12 17:33:34.084875,0 days 00:00:34.864434,identity,16,24,0.008114056683027894,22,COMPLETE
103,0.0003390289784874767,2025-07-12 17:33:34.085334,2025-07-12 17:34:08.940169,0 days 00:00:34.854835,identity,16,24,0.00830269497419189,22,COMPLETE
104,0.0003072762629017234,2025-07-12 17:34:08.940787,2025-07-12 17:34:47.465674,0 days 00:00:38.524887,identity,16,32,0.005992265848284391,25,COMPLETE
105,0.00041134515777230263,2025-07-12 17:34:47.466119,2025-07-12 17:35:25.581335,0 days 00:00:38.115216,identity,16,32,0.006157502763805353,24,COMPLETE
106,0.00032305449713021517,2025-07-12 17:35:25.581957,2025-07-12 17:36:05.876720,0 days 00:00:40.294763,identity,16,35,0.003661932005679634,22,COMPLETE
107,0.0003248642024118453,2025-07-12 17:36:05.877156,2025-07-12 17:36:40.010012,0 days 00:00:34.132856,identity,16,14,0.007615585605454053,21,COMPLETE
108,0.00032816873863339424,2025-07-12 17:36:40.010619,2025-07-12 17:37:18.071437,0 days 00:00:38.060818,identity,16,27,0.009997706487547803,24,COMPLETE
109,0.0007791841053403914,2025-07-12 17:37:18.071876,2025-07-12 17:37:30.918571,0 days 00:00:12.846695,identity,64,11,0.006859260960885489,23,COMPLETE
110,0.000368626817362383,2025-07-12 17:37:30.918981,2025-07-12 17:38:01.897251,0 days 00:00:30.978270,identity,16,23,0.0059023582413020685,8,COMPLETE
111,0.0003013936511706561,2025-07-12 17:38:01.897876,2025-07-12 17:38:45.391270,0 days 00:00:43.493394,identity,16,37,0.007979216191977594,25,COMPLETE
112,0.00038209668127819896,2025-07-12 17:38:45.391871,2025-07-12 17:39:16.167171,0 days 00:00:30.775300,identity,16,36,0.007680338907194074,5,COMPLETE
113,0.00030948230414651334,2025-07-12 17:39:16.167618,2025-07-12 17:39:54.975080,0 days 00:00:38.807462,identity,16,32,0.004158087484550972,25,COMPLETE
114,0.000387770269298926,2025-07-12 17:39:54.975719,2025-07-12 17:40:37.828056,0 days 00:00:42.852337,identity,16,37,0.0002950215429155561,24,COMPLETE
115,0.0003087022923864424,2025-07-12 17:40:37.828659,2025-07-12 17:41:20.146129,0 days 00:00:42.317470,identity,16,41,0.005057284455774643,25,COMPLETE
116,0.00034547445829957724,2025-07-12 17:41:20.146584,2025-07-12 17:41:49.851392,0 days 00:00:29.704808,identity,32,51,0.004902995988190352,25,COMPLETE
117,0.0003905385674443096,2025-07-12 17:41:49.851882,2025-07-12 17:42:32.456726,0 days 00:00:42.604844,identity,16,42,0.005399820860723035,25,COMPLETE
118,0.0003722514375112951,2025-07-12 17:42:32.457270,2025-07-12 17:43:09.130212,0 days 00:00:36.672942,identity,16,26,0.006605499714734185,23,COMPLETE
119,0.00031484515056945384,2025-07-12 17:43:09.130708,2025-07-12 17:43:51.432927,0 days 00:00:42.302219,identity,16,41,0.009314065204576434,25,COMPLETE
120,0.0003072039980906993,2025-07-12 17:43:51.433486,2025-07-12 17:44:27.905199,0 days 00:00:36.471713,identity,16,20,0.006078312159357415,24,COMPLETE
121,0.0003185060922987759,2025-07-12 17:44:27.905806,2025-07-12 17:45:04.137562,0 days 00:00:36.231756,identity,16,20,0.006118158183247689,24,COMPLETE
122,0.0003073000116273761,2025-07-12 17:45:04.138195,2025-07-12 17:45:41.851803,0 days 00:00:37.713608,identity,16,28,0.007881732436280727,23,COMPLETE
123,0.00031599862268194556,2025-07-12 17:45:41.852255,2025-07-12 17:46:19.615869,0 days 00:00:37.763614,identity,16,28,0.008188752668931626,23,COMPLETE
124,0.00043272238690406084,2025-07-12 17:46:19.616469,2025-07-12 17:46:29.532044,0 days 00:00:09.915575,identity,128,24,0.007585946309058004,22,COMPLETE
125,0.0003138697938993573,2025-07-12 17:46:29.532466,2025-07-12 17:47:07.810681,0 days 00:00:38.278215,identity,16,32,0.008800750617029065,24,COMPLETE
126,0.0003085391945205629,2025-07-12 17:47:07.811141,2025-07-12 17:47:43.515124,0 days 00:00:35.703983,identity,16,20,0.007100017618969471,23,COMPLETE
127,0.000306379864923656,2025-07-12 17:47:43.515726,2025-07-12 17:48:22.125864,0 days 00:00:38.610138,identity,16,30,0.005693450587267673,21,COMPLETE
128,0.0003038642171304673,2025-07-12 17:48:22.126309,2025-07-12 17:48:56.131293,0 days 00:00:34.004984,identity,16,17,0.005616172295207048,21,COMPLETE
129,0.0003326760488562286,2025-07-12 17:48:56.131892,2025-07-12 17:49:30.153576,0 days 00:00:34.021684,identity,16,15,0.006446172959326548,20,COMPLETE
130,0.0003418072301428765,2025-07-12 17:49:30.154029,2025-07-12 17:50:04.185322,0 days 00:00:34.031293,identity,16,17,0.005602055664337975,21,COMPLETE
131,0.00030683702789247036,2025-07-12 17:50:04.185929,2025-07-12 17:50:41.205876,0 days 00:00:37.019947,identity,16,23,0.005925627291692757,21,COMPLETE
132,0.0003803992294706404,2025-07-12 17:50:41.206336,2025-07-12 17:51:15.354339,0 days 00:00:34.148003,identity,16,13,0.004506735214982542,22,COMPLETE
133,0.00031440885504707694,2025-07-12 17:51:15.354949,2025-07-12 17:51:51.504194,0 days 00:00:36.149245,identity,16,22,0.006859186607721783,21,COMPLETE
134,0.00032060593366622925,2025-07-12 17:51:51.504653,2025-07-12 17:52:26.170144,0 days 00:00:34.665491,identity,16,19,0.0053992766831286315,21,COMPLETE
135,0.00041434800368733704,2025-07-12 17:52:26.170756,2025-07-12 17:52:40.904631,0 days 00:00:14.733875,identity,64,26,0.0088500812703232,21,COMPLETE
136,0.0005059580435045063,2025-07-12 17:52:40.905053,2025-07-12 17:53:12.959150,0 days 00:00:32.054097,identity,16,16,0.004879092896874199,22,COMPLETE
137,0.00040523262578062713,2025-07-12 17:53:12.959603,2025-07-12 17:53:44.924561,0 days 00:00:31.964958,identity,16,10,0.006421676953990344,22,COMPLETE
138,0.0003153079014737159,2025-07-12 17:53:44.925004,2025-07-12 17:54:21.186472,0 days 00:00:36.261468,identity,16,23,0.0074091975493057495,20,COMPLETE
139,0.0003487940994091332,2025-07-12 17:54:21.187094,2025-07-12 17:54:45.890882,0 days 00:00:24.703788,identity,32,30,0.008912060083522057,24,COMPLETE
140,0.00031407451024279,2025-07-12 17:54:45.891297,2025-07-12 17:55:21.275500,0 days 00:00:35.384203,identity,16,25,0.0036815341608225105,20,COMPLETE
141,0.00029971482581458986,2025-07-12 17:55:21.276151,2025-07-12 17:56:02.064003,0 days 00:00:40.787852,identity,16,33,0.0057761563400798525,24,COMPLETE
142,0.00031189218861982226,2025-07-12 17:56:02.064616,2025-07-12 17:56:37.784269,0 days 00:00:35.719653,identity,16,20,0.005702113936384465,23,COMPLETE
143,0.0003585537779144943,2025-07-12 17:56:37.784729,2025-07-12 17:57:17.770556,0 days 00:00:39.985827,identity,16,30,0.006143674557786708,24,COMPLETE
144,0.0003248917346354574,2025-07-12 17:57:17.771180,2025-07-12 17:57:57.140985,0 days 00:00:39.369805,identity,16,34,0.008042446208779724,21,COMPLETE
