number,value,datetime_start,datetime_complete,duration,params_activation,params_and_operator,params_batch_size,params_lr,params_n_sets,params_seq_length,params_shape,state
414,0.0006417510448954999,2025-07-13 20:02:58.534977,2025-07-13 20:03:53.817272,0 days 00:00:55.282295,identity,min,16,0.008590653903515929,5,14,bell,COMPLETE
415,0.0017562094144523144,2025-07-13 20:03:53.818024,2025-07-13 20:04:49.643211,0 days 00:00:55.825187,identity,min,16,0.00593123449696986,5,15,bell,COMPLETE
416,0.0006112847477197647,2025-07-13 20:04:49.643972,2025-07-13 20:05:44.981376,0 days 00:00:55.337404,identity,min,16,0.008066486040938339,5,14,bell,COMPLETE
417,0.0011882864637300372,2025-07-13 20:05:44.982134,2025-07-13 20:06:35.751690,0 days 00:00:50.769556,identity,min,16,0.009222006404396405,5,15,sigmoid,COMPLETE
418,0.00034890766255557537,2025-07-13 20:06:35.752458,2025-07-13 20:07:31.100262,0 days 00:00:55.347804,identity,min,16,0.00843277887055811,5,14,bell,COMPLETE
419,0.0003725941642187536,2025-07-13 20:07:31.101023,2025-07-13 20:08:26.511556,0 days 00:00:55.410533,identity,min,16,0.008507264037881653,5,14,bell,COMPLETE
420,1.0650936365127563,2025-07-13 20:08:26.512331,2025-07-13 20:08:40.027504,0 days 00:00:13.515173,identity,min,128,0.007548768842888964,5,15,bell,COMPLETE
421,0.012291235849261284,2025-07-13 20:08:40.028002,2025-07-13 20:09:35.428741,0 days 00:00:55.400739,identity,min,16,0.008631228769135371,5,14,bell,COMPLETE
422,0.00040843524038791656,2025-07-13 20:09:35.429508,2025-07-13 20:10:32.941811,0 days 00:00:57.512303,identity,min,16,0.0068828984141029205,6,15,bell,COMPLETE
423,0.04243457317352295,2025-07-13 20:10:32.942576,2025-07-13 20:11:27.166999,0 days 00:00:54.224423,identity,min,16,0.007848723532951454,5,12,bell,COMPLETE
424,0.0023440015502274036,2025-07-13 20:11:27.167769,2025-07-13 20:12:23.455424,0 days 00:00:56.287655,identity,min,16,0.009342079591287663,5,16,bell,COMPLETE
425,0.00045426120050251484,2025-07-13 20:12:23.456194,2025-07-13 20:13:18.695660,0 days 00:00:55.239466,identity,min,16,0.008318835728537805,5,14,bell,COMPLETE
426,0.010457057505846024,2025-07-13 20:13:18.696425,2025-07-13 20:13:39.001235,0 days 00:00:20.304810,identity,min,64,0.009252841083122989,5,15,bell,COMPLETE
427,0.0014807803090661764,2025-07-13 20:13:39.001774,2025-07-13 20:14:33.807400,0 days 00:00:54.805626,identity,min,16,0.0075174409856169095,5,13,bell,COMPLETE
428,0.0005240418831817806,2025-07-13 20:14:33.808156,2025-07-13 20:15:28.060461,0 days 00:00:54.252305,identity,min,16,0.0068195793137177975,5,12,bell,COMPLETE
429,0.0003389807534404099,2025-07-13 20:15:28.061226,2025-07-13 20:16:22.916156,0 days 00:00:54.854930,identity,min,16,0.00874346574184645,5,13,bell,COMPLETE
430,0.036226850003004074,2025-07-13 20:16:22.916919,2025-07-13 20:17:18.938453,0 days 00:00:56.021534,identity,min,16,0.008619432512025075,6,12,bell,COMPLETE
431,0.0006898536812514067,2025-07-13 20:17:18.939188,2025-07-13 20:18:13.723603,0 days 00:00:54.784415,identity,min,16,0.009971886989008166,5,13,bell,COMPLETE
432,1.0922685861587524,2025-07-13 20:18:13.724378,2025-07-13 20:19:11.893688,0 days 00:00:58.169310,identity,min,16,0.0004681321370562063,5,20,bell,COMPLETE
433,0.002267829142510891,2025-07-13 20:19:11.894469,2025-07-13 20:20:06.842256,0 days 00:00:54.947787,identity,min,16,0.007964293672704867,5,13,bell,COMPLETE
434,0.0004959586076438427,2025-07-13 20:20:06.843038,2025-07-13 20:21:05.546694,0 days 00:00:58.703656,identity,min,16,0.008941715330260712,5,21,bell,COMPLETE
435,0.0003993443096987903,2025-07-13 20:21:05.547474,2025-07-13 20:22:00.507149,0 days 00:00:54.959675,identity,min,16,0.009173884594560984,5,13,bell,COMPLETE
436,0.002362574217841029,2025-07-13 20:22:00.507801,2025-07-13 20:22:54.936235,0 days 00:00:54.428434,identity,min,16,0.007822465575172155,5,12,bell,COMPLETE
437,0.0012581777991726995,2025-07-13 20:22:54.936999,2025-07-13 20:23:49.896352,0 days 00:00:54.959353,identity,min,16,0.008243392881559316,5,13,bell,COMPLETE
438,0.0631730929017067,2025-07-13 20:23:49.897116,2025-07-13 20:24:41.249154,0 days 00:00:51.352038,identity,min,16,0.007121322771249001,5,16,sigmoid,COMPLETE
439,0.0012351736659184098,2025-07-13 20:24:41.249804,2025-07-13 20:25:37.270337,0 days 00:00:56.020533,identity,min,16,0.009241458948225076,5,15,bell,COMPLETE
440,0.01383258681744337,2025-07-13 20:25:37.271118,2025-07-13 20:26:31.706400,0 days 00:00:54.435282,identity,min,16,0.009901552552108984,5,12,bell,COMPLETE
441,0.018185723572969437,2025-07-13 20:26:31.707183,2025-07-13 20:27:36.565741,0 days 00:01:04.858558,identity,min,16,0.008493982029276387,9,19,bell,COMPLETE
442,0.00614949781447649,2025-07-13 20:27:36.566701,2025-07-13 20:28:31.340313,0 days 00:00:54.773612,identity,min,16,0.007614881023199882,5,13,bell,COMPLETE
443,3.4191277027130127,2025-07-13 20:28:31.341086,2025-07-13 20:28:45.132062,0 days 00:00:13.790976,identity,min,128,0.00037608942877444723,5,16,bell,COMPLETE
444,0.00033828767482191324,2025-07-13 20:28:45.132678,2025-07-13 20:29:40.421315,0 days 00:00:55.288637,identity,min,16,0.008499907087484285,5,14,bell,COMPLETE
445,0.0015698432689532638,2025-07-13 20:29:40.421969,2025-07-13 20:30:35.710229,0 days 00:00:55.288260,identity,min,16,0.009132247480580348,5,14,bell,COMPLETE
446,0.00045696800225414336,2025-07-13 20:30:35.711015,2025-07-13 20:31:31.489319,0 days 00:00:55.778304,identity,min,16,0.008453998536053995,5,15,bell,COMPLETE
447,0.00035201359423808753,2025-07-13 20:31:31.490106,2025-07-13 20:32:26.764079,0 days 00:00:55.273973,identity,min,16,0.009910653633344526,5,14,bell,COMPLETE
448,0.0003315062785986811,2025-07-13 20:32:26.764850,2025-07-13 20:33:22.598990,0 days 00:00:55.834140,identity,min,16,0.009814420854331268,5,15,bell,COMPLETE
449,0.5737456679344177,2025-07-13 20:33:22.599764,2025-07-13 20:33:42.896935,0 days 00:00:20.297171,identity,min,64,0.009948539938328296,5,15,bell,COMPLETE
450,0.012308512814342976,2025-07-13 20:33:42.897603,2025-07-13 20:34:38.686105,0 days 00:00:55.788502,identity,min,16,0.009933120364026148,5,15,bell,COMPLETE
451,0.0008999272249639034,2025-07-13 20:34:38.686898,2025-07-13 20:35:34.857628,0 days 00:00:56.170730,identity,min,16,0.009998773910388987,5,16,bell,COMPLETE
452,0.0003357132663950324,2025-07-13 20:35:34.858416,2025-07-13 20:36:31.004680,0 days 00:00:56.146264,identity,min,16,0.00902559437989324,5,16,bell,COMPLETE
453,0.0015516540734097362,2025-07-13 20:36:31.005458,2025-07-13 20:37:27.210281,0 days 00:00:56.204823,identity,min,16,0.009128193989502102,5,16,bell,COMPLETE
454,0.00031652377219870687,2025-07-13 20:37:27.211067,2025-07-13 20:38:23.404326,0 days 00:00:56.193259,identity,min,16,0.009156131496637633,5,16,bell,COMPLETE
455,0.14175203442573547,2025-07-13 20:38:23.405114,2025-07-13 20:39:19.723154,0 days 00:00:56.318040,identity,min,16,0.0011038771721150727,5,16,bell,COMPLETE
456,0.005752000492066145,2025-07-13 20:39:19.723935,2025-07-13 20:40:16.006800,0 days 00:00:56.282865,identity,min,16,0.008707158556414168,5,16,bell,COMPLETE
457,0.0009081079624593258,2025-07-13 20:40:16.007572,2025-07-13 20:41:14.035999,0 days 00:00:58.028427,identity,min,16,0.00837201544385134,6,16,bell,COMPLETE
458,0.00455531757324934,2025-07-13 20:41:14.036770,2025-07-13 20:42:10.301200,0 days 00:00:56.264430,identity,min,16,0.008966173608535886,5,16,bell,COMPLETE
459,0.0037332174833863974,2025-07-13 20:42:10.301980,2025-07-13 20:43:01.112772,0 days 00:00:50.810792,identity,min,16,0.009199959376231637,5,15,sigmoid,COMPLETE
460,0.0003284401900600642,2025-07-13 20:43:01.113539,2025-07-13 20:43:57.963615,0 days 00:00:56.850076,identity,min,16,0.008494459877903197,5,17,bell,COMPLETE
461,0.0018497902201488614,2025-07-13 20:43:57.964412,2025-07-13 20:44:54.822640,0 days 00:00:56.858228,identity,min,16,0.008125653152168975,5,17,bell,COMPLETE
462,0.00045190108357928693,2025-07-13 20:44:54.823426,2025-07-13 20:45:51.631141,0 days 00:00:56.807715,identity,min,16,0.008382133130862663,5,17,bell,COMPLETE
463,0.0007792074466124177,2025-07-13 20:45:51.631915,2025-07-13 20:46:48.396047,0 days 00:00:56.764132,identity,min,16,0.007748970368218212,5,17,bell,COMPLETE
464,0.0003280575620010495,2025-07-13 20:46:48.396820,2025-07-13 20:47:44.670895,0 days 00:00:56.274075,identity,min,16,0.008631585368149038,5,16,bell,COMPLETE
465,0.3763209581375122,2025-07-13 20:47:44.671673,2025-07-13 20:48:40.798944,0 days 00:00:56.127271,identity,min,16,0.0008569804791970276,5,16,bell,COMPLETE
466,0.0009180316119454801,2025-07-13 20:48:40.799719,2025-07-13 20:49:36.891957,0 days 00:00:56.092238,identity,min,16,0.009103830665049191,5,16,bell,COMPLETE
467,0.0008709966205060482,2025-07-13 20:49:36.892736,2025-07-13 20:50:33.434658,0 days 00:00:56.541922,identity,min,16,0.00991952729368781,5,17,bell,COMPLETE
468,0.213246151804924,2025-07-13 20:50:33.435438,2025-07-13 20:50:47.198212,0 days 00:00:13.762774,identity,min,128,0.0076190999728721984,5,16,bell,COMPLETE
469,0.00032221281435340643,2025-07-13 20:50:47.198770,2025-07-13 20:51:43.344593,0 days 00:00:56.145823,identity,min,16,0.00853826368663979,5,16,bell,COMPLETE
470,0.0023098732344806194,2025-07-13 20:51:43.345370,2025-07-13 20:52:39.423889,0 days 00:00:56.078519,identity,min,16,0.008247276406771994,5,16,bell,COMPLETE
471,0.0048214709386229515,2025-07-13 20:52:39.424659,2025-07-13 20:53:35.541986,0 days 00:00:56.117327,identity,min,16,0.007346879694716515,5,16,bell,COMPLETE
472,0.0003451552474871278,2025-07-13 20:53:35.542767,2025-07-13 20:54:32.305215,0 days 00:00:56.762448,identity,min,16,0.008584170225415374,5,17,bell,COMPLETE
473,0.0004182092088740319,2025-07-13 20:54:32.306008,2025-07-13 20:55:29.144253,0 days 00:00:56.838245,identity,min,16,0.0077110497923920844,5,17,bell,COMPLETE
474,0.5562728047370911,2025-07-13 20:55:29.145029,2025-07-13 20:55:50.029693,0 days 00:00:20.884664,identity,min,64,0.007236208135556411,5,17,bell,COMPLETE
475,0.0015397683018818498,2025-07-13 20:55:50.030441,2025-07-13 20:56:46.804396,0 days 00:00:56.773955,identity,min,16,0.008603319384743029,5,17,bell,COMPLETE
476,0.0014511957997456193,2025-07-13 20:56:46.805165,2025-07-13 20:57:43.054598,0 days 00:00:56.249433,identity,min,16,0.008283937928089197,5,16,bell,COMPLETE
477,0.0028239779639989138,2025-07-13 20:57:43.055388,2025-07-13 20:58:39.262854,0 days 00:00:56.207466,identity,min,16,0.006909980981626757,5,16,bell,COMPLETE
478,0.004557761829346418,2025-07-13 20:58:39.263636,2025-07-13 20:59:36.061335,0 days 00:00:56.797699,identity,min,16,0.007878692278694087,5,17,bell,COMPLETE
479,0.0006523200427182019,2025-07-13 20:59:36.062120,2025-07-13 21:00:32.342356,0 days 00:00:56.280236,identity,min,16,0.0087402024350581,5,16,bell,COMPLETE
480,0.000725636666174978,2025-07-13 21:00:32.343141,2025-07-13 21:01:23.572708,0 days 00:00:51.229567,identity,min,16,0.007418069535081561,5,16,sigmoid,COMPLETE
481,0.0009878803975880146,2025-07-13 21:01:23.573491,2025-07-13 21:02:19.393807,0 days 00:00:55.820316,identity,min,16,0.00905352797343681,5,15,bell,COMPLETE
482,0.4234817922115326,2025-07-13 21:02:19.394589,2025-07-13 21:03:16.134835,0 days 00:00:56.740246,identity,min,16,0.0005846527263918529,5,17,bell,COMPLETE
483,0.00032447767443954945,2025-07-13 21:03:16.135615,2025-07-13 21:04:12.304233,0 days 00:00:56.168618,identity,min,16,0.008154033214790276,5,16,bell,COMPLETE
484,0.0003742944390978664,2025-07-13 21:04:12.305016,2025-07-13 21:05:08.465756,0 days 00:00:56.160740,identity,min,16,0.006724967098107658,5,16,bell,COMPLETE
485,0.0008592247613705695,2025-07-13 21:05:08.466540,2025-07-13 21:06:04.653268,0 days 00:00:56.186728,identity,min,16,0.007836480068333054,5,16,bell,COMPLETE
486,0.00035000807838514447,2025-07-13 21:06:04.654054,2025-07-13 21:07:00.376015,0 days 00:00:55.721961,identity,min,16,0.007110453440459662,5,15,bell,COMPLETE
487,0.00033073805388994515,2025-07-13 21:07:00.376805,2025-07-13 21:07:56.110032,0 days 00:00:55.733227,identity,min,16,0.008136408144704359,5,15,bell,COMPLETE
488,0.004989128094166517,2025-07-13 21:07:56.110831,2025-07-13 21:08:51.870190,0 days 00:00:55.759359,identity,min,16,0.007847444581764833,5,15,bell,COMPLETE
489,0.0003511355316732079,2025-07-13 21:08:51.870997,2025-07-13 21:09:47.619772,0 days 00:00:55.748775,identity,min,16,0.007280670999623307,5,15,bell,COMPLETE
490,0.02359900251030922,2025-07-13 21:09:47.620562,2025-07-13 21:10:43.782933,0 days 00:00:56.162371,identity,min,16,0.0065213626407967665,5,16,bell,COMPLETE
491,0.00040170649299398065,2025-07-13 21:10:43.783711,2025-07-13 21:11:39.546545,0 days 00:00:55.762834,identity,min,16,0.00817889210852231,5,15,bell,COMPLETE
492,0.18885496258735657,2025-07-13 21:11:39.547339,2025-07-13 21:12:35.718251,0 days 00:00:56.170912,identity,min,16,0.00023381618632270414,5,16,bell,COMPLETE
493,0.0144108971580863,2025-07-13 21:12:35.719040,2025-07-13 21:12:49.804414,0 days 00:00:14.085374,identity,min,128,0.007091229720768484,5,17,bell,COMPLETE
494,0.0004134751216042787,2025-07-13 21:12:49.805127,2025-07-13 21:13:45.601132,0 days 00:00:55.796005,identity,min,16,0.007943069735558807,5,15,bell,COMPLETE
495,0.2323397696018219,2025-07-13 21:13:45.601900,2025-07-13 21:14:41.627219,0 days 00:00:56.025319,identity,min,16,0.00014138536863157918,5,16,bell,COMPLETE
496,0.0003366223827470094,2025-07-13 21:14:41.628003,2025-07-13 21:15:37.188374,0 days 00:00:55.560371,identity,min,16,0.008767720443366643,5,15,bell,COMPLETE
497,0.007229484152048826,2025-07-13 21:15:37.189158,2025-07-13 21:16:32.773981,0 days 00:00:55.584823,identity,min,16,0.008863090654178356,5,15,bell,COMPLETE
498,0.4095104932785034,2025-07-13 21:16:32.774779,2025-07-13 21:16:53.023951,0 days 00:00:20.249172,identity,min,64,0.007597348256492091,5,15,bell,COMPLETE
499,0.0010312681552022696,2025-07-13 21:16:53.024584,2025-07-13 21:17:48.649004,0 days 00:00:55.624420,identity,min,16,0.006615095994066084,5,15,bell,COMPLETE
