number,value,datetime_start,datetime_complete,duration,params_activation,params_and_operator,params_batch_size,params_lr,params_n_sets,params_seq_length,params_shape,state
0,0.13311083614826202,2025-07-13 14:53:52.087701,2025-07-13 14:54:06.900993,0 days 00:00:14.813292,relu,prod,128,0.00041586723418735185,9,11,bell,COMPLETE
1,0.1976141631603241,2025-07-13 14:54:06.901953,2025-07-13 14:55:00.506604,0 days 00:00:53.604651,relu,min,16,0.00025357121504097544,8,15,sigmoid,COMPLETE
2,0.9506106376647949,2025-07-13 14:55:00.507493,2025-07-13 14:56:07.722663,0 days 00:01:07.215170,relu,prod,16,0.000610359620333583,9,23,bell,COMPLETE
3,1.355483889579773,2025-07-13 14:56:07.723463,2025-07-13 14:56:26.288375,0 days 00:00:18.564912,relu,prod,64,0.0032244410639553703,5,15,gaussian,COMPLETE
4,0.3500487208366394,2025-07-13 14:56:26.288864,2025-07-13 14:57:21.734034,0 days 00:00:55.445170,relu,prod,16,0.0007509906958520523,7,13,gaussian,COMPLETE
5,0.29439836740493774,2025-07-13 14:57:21.734950,2025-07-13 14:57:41.305484,0 days 00:00:19.570534,relu,min,64,0.009535460172237779,7,15,sigmoid,COMPLETE
6,1.7041062116622925,2025-07-13 14:57:41.305967,2025-07-13 14:58:32.374511,0 days 00:00:51.068544,relu,prod,16,0.0013336357996212296,5,15,sigmoid,COMPLETE
7,1.8126482963562012,2025-07-13 14:58:32.375097,2025-07-13 14:58:47.228595,0 days 00:00:14.853498,identity,min,128,0.0017172580622075821,7,20,gaussian,COMPLETE
8,1.2844512462615967,2025-07-13 14:58:47.229095,2025-07-13 14:59:04.670572,0 days 00:00:17.441477,relu,min,128,0.001741339671434641,9,22,bell,COMPLETE
9,1.690132975578308,2025-07-13 14:59:04.671105,2025-07-13 14:59:54.431004,0 days 00:00:49.759899,relu,prod,16,0.002395979320473372,5,12,sigmoid,COMPLETE
10,3.311635732650757,2025-07-13 14:59:54.431578,2025-07-13 15:00:27.956929,0 days 00:00:33.525351,identity,prod,32,0.00010656374418454846,8,8,bell,COMPLETE
11,0.10519638657569885,2025-07-13 15:00:27.957430,2025-07-13 15:00:38.906122,0 days 00:00:10.948692,identity,min,128,0.0002706247089722411,8,5,bell,COMPLETE
12,0.19349907338619232,2025-07-13 15:00:38.906582,2025-07-13 15:00:49.834002,0 days 00:00:10.927420,identity,min,128,0.00031376848780029454,8,5,bell,COMPLETE
13,0.26487359404563904,2025-07-13 15:00:49.834400,2025-07-13 15:01:02.601110,0 days 00:00:12.766710,identity,min,128,0.0002440510774549405,9,9,bell,COMPLETE
14,0.24425089359283447,2025-07-13 15:01:02.601683,2025-07-13 15:01:13.664068,0 days 00:00:11.062385,identity,prod,128,0.00010620284211841368,8,5,bell,COMPLETE
15,2.6054227352142334,2025-07-13 15:01:13.664455,2025-07-13 15:01:45.382157,0 days 00:00:31.717702,identity,min,32,0.0003992072096315318,6,9,bell,COMPLETE
16,0.30127474665641785,2025-07-13 15:01:45.382765,2025-07-13 15:01:57.532271,0 days 00:00:12.149506,identity,min,128,0.00018648365004917758,9,7,bell,COMPLETE
17,5.877870082855225,2025-07-13 15:01:57.532780,2025-07-13 15:02:10.206161,0 days 00:00:12.673381,identity,prod,128,0.0005785448313762363,8,11,bell,COMPLETE
18,0.8541929721832275,2025-07-13 15:02:10.206563,2025-07-13 15:02:25.058644,0 days 00:00:14.852081,relu,min,128,0.00017328873284859017,6,18,bell,COMPLETE
19,0.49868065118789673,2025-07-13 15:02:25.059174,2025-07-13 15:02:46.046306,0 days 00:00:20.987132,identity,prod,64,0.0008748132677744966,9,18,gaussian,COMPLETE
20,0.0021988670341670513,2025-07-13 15:02:46.046945,2025-07-13 15:03:20.843122,0 days 00:00:34.796177,relu,prod,32,0.0004139194185644738,8,11,bell,COMPLETE
21,1.6851037740707397,2025-07-13 15:03:20.843728,2025-07-13 15:03:55.668777,0 days 00:00:34.825049,relu,prod,32,0.00044172103193134023,8,11,bell,COMPLETE
22,0.6268126964569092,2025-07-13 15:03:55.669388,2025-07-13 15:04:28.765088,0 days 00:00:33.095700,relu,prod,32,0.00039225120865751584,8,7,bell,COMPLETE
23,0.1499270796775818,2025-07-13 15:04:28.765645,2025-07-13 15:05:07.894505,0 days 00:00:39.128860,relu,prod,32,0.00014546767232323838,9,25,bell,COMPLETE
24,0.08044424653053284,2025-07-13 15:05:07.895122,2025-07-13 15:05:42.308214,0 days 00:00:34.413092,relu,prod,32,0.0010587648219235767,7,10,bell,COMPLETE
25,0.3783653974533081,2025-07-13 15:05:42.308818,2025-07-13 15:06:14.159074,0 days 00:00:31.850256,relu,prod,32,0.001044561119586546,6,13,bell,COMPLETE
26,0.5447686910629272,2025-07-13 15:06:14.159519,2025-07-13 15:06:45.739533,0 days 00:00:31.580014,identity,min,32,0.005121172009092913,7,6,bell,COMPLETE
27,0.17163969576358795,2025-07-13 15:06:45.740143,2025-07-13 15:07:19.651964,0 days 00:00:33.911821,relu,prod,32,0.000606041944057621,7,9,bell,COMPLETE
28,1.6423064470291138,2025-07-13 15:07:19.652570,2025-07-13 15:07:48.832626,0 days 00:00:29.180056,identity,min,32,0.001227421984858144,6,10,sigmoid,COMPLETE
29,1.628279447555542,2025-07-13 15:07:48.833199,2025-07-13 15:08:19.968289,0 days 00:00:31.135090,relu,prod,32,0.0002912057051501599,7,13,gaussian,COMPLETE
30,0.8671978116035461,2025-07-13 15:08:19.968912,2025-07-13 15:08:41.614730,0 days 00:00:21.645818,relu,prod,64,0.0005011456209256384,8,17,bell,COMPLETE
31,1.4440622329711914,2025-07-13 15:08:41.615195,2025-07-13 15:08:54.295461,0 days 00:00:12.680266,relu,prod,128,0.00021373904962735608,8,11,bell,COMPLETE
32,0.42174094915390015,2025-07-13 15:08:54.295866,2025-07-13 15:09:06.561466,0 days 00:00:12.265600,relu,prod,128,0.0003238062891909925,9,7,bell,COMPLETE
33,1.3378374576568604,2025-07-13 15:09:06.562031,2025-07-13 15:09:21.114250,0 days 00:00:14.552219,relu,prod,128,0.0007204813837384539,7,14,bell,COMPLETE
34,0.01225328166037798,2025-07-13 15:09:21.114707,2025-07-13 15:10:24.362794,0 days 00:01:03.248087,relu,prod,16,0.0008505056088093407,9,10,bell,COMPLETE
35,0.35137027502059937,2025-07-13 15:10:24.363660,2025-07-13 15:11:27.641404,0 days 00:01:03.277744,relu,prod,16,0.0008996101883773227,9,10,bell,COMPLETE
36,0.06382867693901062,2025-07-13 15:11:27.642014,2025-07-13 15:12:22.739695,0 days 00:00:55.097681,relu,prod,16,0.003265108112555741,8,8,sigmoid,COMPLETE
37,0.007634328678250313,2025-07-13 15:12:22.740313,2025-07-13 15:13:16.895849,0 days 00:00:54.155536,relu,prod,16,0.005731283183371071,7,8,sigmoid,COMPLETE
38,0.12082064151763916,2025-07-13 15:13:16.896467,2025-07-13 15:14:11.034253,0 days 00:00:54.137786,relu,prod,16,0.004938976989056124,7,8,sigmoid,COMPLETE
39,0.6516947150230408,2025-07-13 15:14:11.034871,2025-07-13 15:15:07.772504,0 days 00:00:56.737633,relu,prod,16,0.0077608333536317055,9,12,sigmoid,COMPLETE
40,0.06700225174427032,2025-07-13 15:15:07.773129,2025-07-13 15:16:02.911325,0 days 00:00:55.138196,relu,prod,16,0.0032269294604829867,8,8,sigmoid,COMPLETE
41,0.04519180953502655,2025-07-13 15:16:02.911938,2025-07-13 15:16:57.986456,0 days 00:00:55.074518,relu,prod,16,0.0037654286678875325,8,8,sigmoid,COMPLETE
42,1.6562120914459229,2025-07-13 15:16:57.987073,2025-07-13 15:17:52.428975,0 days 00:00:54.441902,relu,prod,16,0.0040595813216435855,8,6,sigmoid,COMPLETE
43,0.044944193214178085,2025-07-13 15:17:52.429598,2025-07-13 15:18:47.915621,0 days 00:00:55.486023,relu,prod,16,0.0019563268702037285,8,9,sigmoid,COMPLETE
44,1.6868706941604614,2025-07-13 15:18:47.916240,2025-07-13 15:19:41.751704,0 days 00:00:53.835464,relu,prod,16,0.0020429420145721086,7,12,sigmoid,COMPLETE
45,0.0019197401124984026,2025-07-13 15:19:41.752327,2025-07-13 15:20:39.563949,0 days 00:00:57.811622,relu,prod,16,0.007229570538541823,9,9,sigmoid,COMPLETE
46,0.22655171155929565,2025-07-13 15:20:39.564565,2025-07-13 15:21:37.687446,0 days 00:00:58.122881,relu,prod,16,0.009579173070713385,9,10,sigmoid,COMPLETE
47,0.13381363451480865,2025-07-13 15:21:37.688072,2025-07-13 15:22:35.419546,0 days 00:00:57.731474,relu,prod,16,0.006972032680417992,9,9,sigmoid,COMPLETE
48,0.23399999737739563,2025-07-13 15:22:35.420168,2025-07-13 15:23:33.115381,0 days 00:00:57.695213,relu,prod,16,0.0023279223876295297,9,14,sigmoid,COMPLETE
49,0.26892033219337463,2025-07-13 15:23:33.116008,2025-07-13 15:24:30.744472,0 days 00:00:57.628464,relu,prod,16,0.0014823432552060801,9,6,gaussian,COMPLETE
50,0.34679335355758667,2025-07-13 15:24:30.745102,2025-07-13 15:25:27.413193,0 days 00:00:56.668091,relu,prod,16,0.006664969375053833,9,12,sigmoid,COMPLETE
51,0.16924966871738434,2025-07-13 15:25:27.413814,2025-07-13 15:26:22.252389,0 days 00:00:54.838575,relu,prod,16,0.005160090521870342,8,7,sigmoid,COMPLETE
52,0.44712594151496887,2025-07-13 15:26:22.253012,2025-07-13 15:27:17.737084,0 days 00:00:55.484072,relu,prod,16,0.004252348711208118,8,9,sigmoid,COMPLETE
53,0.19515666365623474,2025-07-13 15:27:17.737713,2025-07-13 15:28:13.652487,0 days 00:00:55.914774,relu,prod,16,0.002506346545366303,8,10,sigmoid,COMPLETE
54,0.2986767292022705,2025-07-13 15:28:13.653104,2025-07-13 15:28:32.352342,0 days 00:00:18.699238,relu,prod,64,0.007630097819924811,7,11,sigmoid,COMPLETE
55,1.668532133102417,2025-07-13 15:28:32.352914,2025-07-13 15:29:27.664700,0 days 00:00:55.311786,relu,prod,16,0.003910750074220128,8,8,sigmoid,COMPLETE
56,1.662611484527588,2025-07-13 15:29:27.665325,2025-07-13 15:30:22.559865,0 days 00:00:54.894540,relu,prod,16,0.005988118074987476,8,7,sigmoid,COMPLETE
57,0.8943657875061035,2025-07-13 15:30:22.560503,2025-07-13 15:31:21.353034,0 days 00:00:58.792531,relu,prod,16,0.002844456532756737,9,9,gaussian,COMPLETE
58,0.43988046050071716,2025-07-13 15:31:21.353665,2025-07-13 15:32:15.721491,0 days 00:00:54.367826,relu,prod,16,0.0015307655165609309,8,6,sigmoid,COMPLETE
59,0.2528318166732788,2025-07-13 15:32:15.722117,2025-07-13 15:32:33.540100,0 days 00:00:17.817983,relu,prod,64,0.002049498948352918,6,11,sigmoid,COMPLETE
60,1.707970380783081,2025-07-13 15:32:33.540503,2025-07-13 15:33:27.907244,0 days 00:00:54.366741,relu,min,16,0.00867229693227568,7,16,sigmoid,COMPLETE
61,0.15901237726211548,2025-07-13 15:33:27.907881,2025-07-13 15:34:23.171225,0 days 00:00:55.263344,relu,prod,16,0.003656867975752904,8,8,sigmoid,COMPLETE
62,0.23766839504241943,2025-07-13 15:34:23.171855,2025-07-13 15:35:18.437134,0 days 00:00:55.265279,relu,prod,16,0.003205899760586191,8,8,sigmoid,COMPLETE
63,0.11258316040039062,2025-07-13 15:35:18.437768,2025-07-13 15:36:11.203767,0 days 00:00:52.765999,relu,prod,16,0.0061975644488433314,7,5,sigmoid,COMPLETE
64,0.2196294516324997,2025-07-13 15:36:11.204400,2025-07-13 15:37:09.479038,0 days 00:00:58.274638,relu,prod,16,0.004577129087873667,9,10,sigmoid,COMPLETE
65,0.009584333747625351,2025-07-13 15:37:09.479670,2025-07-13 15:38:05.998813,0 days 00:00:56.519143,relu,prod,16,0.005594157465710745,8,9,gaussian,COMPLETE
66,0.2434319704771042,2025-07-13 15:38:05.999446,2025-07-13 15:39:05.039590,0 days 00:00:59.040144,relu,prod,16,0.0007828368672939415,7,20,gaussian,COMPLETE
67,1.5364781618118286,2025-07-13 15:39:05.040231,2025-07-13 15:39:34.478673,0 days 00:00:29.438442,relu,prod,32,0.005782818463751175,5,9,gaussian,COMPLETE
68,0.13300810754299164,2025-07-13 15:39:34.479145,2025-07-13 15:40:29.955882,0 days 00:00:55.476737,identity,min,16,0.0012210699338655274,8,11,gaussian,COMPLETE
69,0.27842843532562256,2025-07-13 15:40:29.956514,2025-07-13 15:40:48.875493,0 days 00:00:18.918979,relu,prod,64,0.0003637169070171579,9,9,gaussian,COMPLETE
70,0.0011651954846456647,2025-07-13 15:40:48.875944,2025-07-13 15:41:44.795499,0 days 00:00:55.919555,relu,prod,16,0.005261283961850951,8,7,gaussian,COMPLETE
71,0.07765783369541168,2025-07-13 15:41:44.796129,2025-07-13 15:42:40.860799,0 days 00:00:56.064670,relu,prod,16,0.005572134181543594,8,7,gaussian,COMPLETE
72,0.02860448881983757,2025-07-13 15:42:40.861421,2025-07-13 15:43:38.012787,0 days 00:00:57.151366,relu,prod,16,0.004607685004039076,8,10,gaussian,COMPLETE
73,1.6798341274261475,2025-07-13 15:43:38.013414,2025-07-13 15:44:35.366561,0 days 00:00:57.353147,relu,prod,16,0.008515884936360938,8,10,gaussian,COMPLETE
74,0.31360116600990295,2025-07-13 15:44:35.367191,2025-07-13 15:45:07.291228,0 days 00:00:31.924037,relu,prod,32,0.00048756404009180304,8,9,gaussian,COMPLETE
75,0.05817094072699547,2025-07-13 15:45:07.291799,2025-07-13 15:46:05.757883,0 days 00:00:58.466084,relu,prod,16,0.004605677355452875,9,13,gaussian,COMPLETE
76,0.0012132144765928388,2025-07-13 15:46:05.758516,2025-07-13 15:47:02.896566,0 days 00:00:57.138050,relu,prod,16,0.0068041987671682526,8,10,gaussian,COMPLETE
77,0.07408457249403,2025-07-13 15:47:02.897204,2025-07-13 15:47:59.003107,0 days 00:00:56.105903,identity,prod,16,0.007488666201207774,7,10,gaussian,COMPLETE
78,0.0037388892378658056,2025-07-13 15:47:59.003744,2025-07-13 15:48:29.822295,0 days 00:00:30.818551,relu,prod,32,0.008783712635319567,7,12,gaussian,COMPLETE
79,0.0022982803639024496,2025-07-13 15:48:29.822884,2025-07-13 15:48:58.716066,0 days 00:00:28.893182,relu,min,32,0.008623593599299489,6,12,gaussian,COMPLETE
80,1.698878526687622,2025-07-13 15:48:58.716679,2025-07-13 15:49:28.196735,0 days 00:00:29.480056,relu,min,32,0.00894641454770906,6,14,gaussian,COMPLETE
81,1.690132975578308,2025-07-13 15:49:28.197203,2025-07-13 15:49:56.995330,0 days 00:00:28.798127,relu,min,32,0.00974406632601705,6,12,gaussian,COMPLETE
82,0.13150618970394135,2025-07-13 15:49:56.995954,2025-07-13 15:50:26.690468,0 days 00:00:29.694514,relu,min,32,0.0065434408681563595,5,11,gaussian,COMPLETE
83,0.011735805310308933,2025-07-13 15:50:26.691067,2025-07-13 15:50:55.644478,0 days 00:00:28.953411,relu,min,32,0.008119627972157607,6,12,gaussian,COMPLETE
84,0.0045950328931212425,2025-07-13 15:50:55.645094,2025-07-13 15:51:24.876608,0 days 00:00:29.231514,relu,min,32,0.007950150662043666,6,13,gaussian,COMPLETE
85,0.4702838063240051,2025-07-13 15:51:24.877084,2025-07-13 15:51:54.950241,0 days 00:00:30.073157,relu,min,32,0.00739452915243946,6,15,gaussian,COMPLETE
86,0.7368048429489136,2025-07-13 15:51:54.950849,2025-07-13 15:52:23.353613,0 days 00:00:28.402764,relu,min,32,0.005451518149521106,5,13,gaussian,COMPLETE
87,0.0003733944322448224,2025-07-13 15:52:23.354250,2025-07-13 15:52:53.621898,0 days 00:00:30.267648,relu,min,32,0.009939904999301617,7,12,gaussian,COMPLETE
88,0.00498344749212265,2025-07-13 15:52:53.622354,2025-07-13 15:53:23.093248,0 days 00:00:29.470894,identity,min,32,0.009532731237739872,6,14,gaussian,COMPLETE
89,0.015759794041514397,2025-07-13 15:53:23.093887,2025-07-13 15:53:52.502096,0 days 00:00:29.408209,identity,min,32,0.009511613415124916,6,14,gaussian,COMPLETE
90,0.0055502112954854965,2025-07-13 15:53:52.502693,2025-07-13 15:54:21.526909,0 days 00:00:29.024216,identity,min,32,0.006890358470063565,6,13,gaussian,COMPLETE
91,0.00040528105455450714,2025-07-13 15:54:21.527543,2025-07-13 15:54:50.628717,0 days 00:00:29.101174,identity,min,32,0.006920425060180877,6,13,gaussian,COMPLETE
92,0.026715094223618507,2025-07-13 15:54:50.629198,2025-07-13 15:55:20.792318,0 days 00:00:30.163120,identity,min,32,0.009991416111367377,6,16,gaussian,COMPLETE
93,0.05888283625245094,2025-07-13 15:55:20.792930,2025-07-13 15:55:50.226688,0 days 00:00:29.433758,identity,min,32,0.008248005433760948,6,14,gaussian,COMPLETE
94,0.006484383251518011,2025-07-13 15:55:50.227297,2025-07-13 15:56:20.030288,0 days 00:00:29.802991,identity,min,32,0.007121540986458432,6,15,gaussian,COMPLETE
95,0.6864223480224609,2025-07-13 15:56:20.030927,2025-07-13 15:56:48.820165,0 days 00:00:28.789238,identity,min,32,0.006492964568575517,6,12,gaussian,COMPLETE
96,0.2787279784679413,2025-07-13 15:56:48.820638,2025-07-13 15:57:17.966115,0 days 00:00:29.145477,identity,min,32,0.008468948035914045,6,13,gaussian,COMPLETE
97,0.0004102349339518696,2025-07-13 15:57:17.966752,2025-07-13 15:57:47.400115,0 days 00:00:29.433363,identity,min,32,0.007714838965572576,5,11,gaussian,COMPLETE
98,0.11770311743021011,2025-07-13 15:57:47.400715,2025-07-13 15:58:16.911361,0 days 00:00:29.510646,identity,min,32,0.007739424288453786,5,11,gaussian,COMPLETE
99,0.41055360436439514,2025-07-13 15:58:16.912004,2025-07-13 15:58:44.881263,0 days 00:00:27.969259,identity,min,32,0.006576140794633315,5,12,gaussian,COMPLETE
100,1.2264878749847412,2025-07-13 15:58:44.881734,2025-07-13 15:59:13.130515,0 days 00:00:28.248781,identity,min,32,0.00015598764254544766,5,13,gaussian,COMPLETE
101,0.6202725768089294,2025-07-13 15:59:13.131123,2025-07-13 15:59:44.848812,0 days 00:00:31.717689,identity,min,32,0.00896043521578174,7,11,gaussian,COMPLETE
102,0.8391096591949463,2025-07-13 15:59:44.849456,2025-07-13 16:00:14.933100,0 days 00:00:30.083644,identity,min,32,0.009081014993249108,7,12,gaussian,COMPLETE
103,0.04168511927127838,2025-07-13 16:00:14.933564,2025-07-13 16:00:44.250637,0 days 00:00:29.317073,identity,min,32,0.007330311339305443,6,14,gaussian,COMPLETE
104,0.0037566518876701593,2025-07-13 16:00:44.251288,2025-07-13 16:01:15.952048,0 days 00:00:31.700760,identity,min,32,0.008059480940144928,7,11,gaussian,COMPLETE
105,0.04105586186051369,2025-07-13 16:01:15.952692,2025-07-13 16:01:47.653381,0 days 00:00:31.700689,identity,min,32,0.006168944284936046,7,11,gaussian,COMPLETE
106,0.821842610836029,2025-07-13 16:01:47.653974,2025-07-13 16:02:17.889403,0 days 00:00:30.235429,relu,min,32,0.00011917980352282214,7,12,gaussian,COMPLETE
107,0.05322953686118126,2025-07-13 16:02:17.890042,2025-07-13 16:02:52.061241,0 days 00:00:34.171199,relu,min,32,0.00495563598613224,7,11,bell,COMPLETE
108,0.2793142795562744,2025-07-13 16:02:52.061697,2025-07-13 16:03:04.815342,0 days 00:00:12.753645,relu,min,128,0.007989708522607858,7,12,gaussian,COMPLETE
109,0.04874204844236374,2025-07-13 16:03:04.815948,2025-07-13 16:03:39.684138,0 days 00:00:34.868190,relu,min,32,0.00022186939723513227,7,25,gaussian,COMPLETE
110,0.002688954584300518,2025-07-13 16:03:39.684774,2025-07-13 16:04:11.339311,0 days 00:00:31.654537,identity,min,32,0.00696887553411212,7,11,gaussian,COMPLETE
111,1.9687751531600952,2025-07-13 16:04:11.339770,2025-07-13 16:04:43.147555,0 days 00:00:31.807785,identity,min,32,0.006943342632193249,7,11,gaussian,COMPLETE
112,0.316152423620224,2025-07-13 16:04:43.148198,2025-07-13 16:05:14.555206,0 days 00:00:31.407008,identity,min,32,0.005926640234555894,7,10,gaussian,COMPLETE
113,0.03441246226429939,2025-07-13 16:05:14.555825,2025-07-13 16:05:44.618822,0 days 00:00:30.062997,identity,min,32,0.008217094876559784,7,12,gaussian,COMPLETE
114,0.015534462407231331,2025-07-13 16:05:44.619471,2025-07-13 16:06:15.114845,0 days 00:00:30.495374,identity,min,32,0.005345087678382411,7,13,gaussian,COMPLETE
115,0.2811237573623657,2025-07-13 16:06:15.115311,2025-07-13 16:06:33.683157,0 days 00:00:18.567846,relu,min,64,0.006366465286258366,7,10,gaussian,COMPLETE
116,0.009524360299110413,2025-07-13 16:06:33.683698,2025-07-13 16:07:07.694626,0 days 00:00:34.010928,identity,min,32,0.009955168437615885,7,11,bell,COMPLETE
117,0.9592519402503967,2025-07-13 16:07:07.695149,2025-07-13 16:07:36.279269,0 days 00:00:28.584120,relu,min,32,0.007740060962054629,5,13,gaussian,COMPLETE
118,0.11591412127017975,2025-07-13 16:07:36.280112,2025-07-13 16:08:06.565581,0 days 00:00:30.285469,relu,min,32,0.007168481845160441,7,12,gaussian,COMPLETE
119,0.002151137450709939,2025-07-13 16:08:06.566181,2025-07-13 16:08:38.512602,0 days 00:00:31.946421,relu,min,32,0.008729111338415146,7,11,gaussian,COMPLETE
120,1.67254638671875,2025-07-13 16:08:38.513245,2025-07-13 16:08:50.929944,0 days 00:00:12.416699,identity,min,128,0.008782033322678741,7,11,gaussian,COMPLETE
121,0.0008796583861112595,2025-07-13 16:08:50.930369,2025-07-13 16:09:22.592530,0 days 00:00:31.662161,relu,min,32,0.008766732273808453,7,10,gaussian,COMPLETE
122,0.4859684407711029,2025-07-13 16:09:22.593182,2025-07-13 16:09:54.369558,0 days 00:00:31.776376,relu,min,32,0.00864891456676922,7,10,gaussian,COMPLETE
123,0.016719738021492958,2025-07-13 16:09:54.370047,2025-07-13 16:10:26.059420,0 days 00:00:31.689373,relu,min,32,0.0061992815716494214,7,10,gaussian,COMPLETE
124,0.030451547354459763,2025-07-13 16:10:26.060066,2025-07-13 16:10:58.006866,0 days 00:00:31.946800,relu,min,32,0.007230062903738978,7,11,gaussian,COMPLETE
125,0.0026901564560830593,2025-07-13 16:10:58.007488,2025-07-13 16:11:31.367361,0 days 00:00:33.359873,relu,min,32,0.008903096568250016,7,9,bell,COMPLETE
126,0.010243331082165241,2025-07-13 16:11:31.367966,2025-07-13 16:12:04.696670,0 days 00:00:33.328704,relu,min,32,0.008956487397179452,7,9,bell,COMPLETE
127,0.11111513525247574,2025-07-13 16:12:04.697320,2025-07-13 16:12:24.705464,0 days 00:00:20.008144,relu,prod,64,0.009922238835853626,7,9,bell,COMPLETE
128,0.03458911180496216,2025-07-13 16:12:24.705927,2025-07-13 16:12:58.573766,0 days 00:00:33.867839,relu,min,32,0.006561684353663549,7,10,bell,COMPLETE
129,0.5415008068084717,2025-07-13 16:12:58.574420,2025-07-13 16:13:31.727251,0 days 00:00:33.152831,relu,prod,32,0.0006900261234889396,7,7,bell,COMPLETE
130,0.017178675159811974,2025-07-13 16:13:31.727856,2025-07-13 16:14:05.575654,0 days 00:00:33.847798,relu,min,32,0.005075050540768418,8,10,bell,COMPLETE
131,0.000718231254722923,2025-07-13 16:14:05.576298,2025-07-13 16:14:37.462258,0 days 00:00:31.885960,relu,min,32,0.00800469197440089,7,11,gaussian,COMPLETE
132,1.096571683883667,2025-07-13 16:14:37.462894,2025-07-13 16:15:07.795002,0 days 00:00:30.332108,relu,min,32,0.007474545464726067,7,12,gaussian,COMPLETE
133,1.5220441818237305,2025-07-13 16:15:07.795470,2025-07-13 16:15:39.666705,0 days 00:00:31.871235,relu,min,32,0.008805414568020309,7,11,gaussian,COMPLETE
134,0.026830483227968216,2025-07-13 16:15:39.667360,2025-07-13 16:16:10.125601,0 days 00:00:30.458241,relu,min,32,0.0068581284454215545,7,12,gaussian,COMPLETE
135,0.01611972600221634,2025-07-13 16:16:10.126216,2025-07-13 16:16:42.446999,0 days 00:00:32.320783,relu,prod,32,0.005746632591230307,7,10,gaussian,COMPLETE
136,0.008375884965062141,2025-07-13 16:16:42.447628,2025-07-13 16:17:15.832716,0 days 00:00:33.385088,relu,min,32,0.007991132999041039,7,9,bell,COMPLETE
137,0.0003807235334534198,2025-07-13 16:17:15.833193,2025-07-13 16:17:46.745032,0 days 00:00:30.911839,relu,min,32,0.009296591401840157,8,8,gaussian,COMPLETE
