number,value,datetime_start,datetime_complete,duration,params_activation,params_batch_size,params_h,params_lr,params_seq_length,state
433,0.00034348657936789095,2025-07-12 21:22:25.842257,2025-07-12 21:22:59.502410,0 days 00:00:33.660153,identity,32,65,0.005904586916347651,23,COMPLETE
434,0.0003291480243206024,2025-07-12 21:22:59.503107,2025-07-12 21:23:41.081688,0 days 00:00:41.578581,identity,16,31,0.0066107125107058755,24,COMPLETE
435,0.0010138783836737275,2025-07-12 21:23:41.082212,2025-07-12 21:23:47.961403,0 days 00:00:06.879191,identity,128,25,0.0053800058728070265,5,COMPLETE
436,0.00033932283986359835,2025-07-12 21:23:47.961895,2025-07-12 21:24:31.013125,0 days 00:00:43.051230,identity,16,48,0.00116313755725216,25,COMPLETE
437,0.0003451341181062162,2025-07-12 21:24:31.013869,2025-07-12 21:25:17.144901,0 days 00:00:46.131032,identity,16,56,0.004627132770619458,24,COMPLETE
438,0.00031106165261007845,2025-07-12 21:25:17.145643,2025-07-12 21:26:00.080674,0 days 00:00:42.935031,identity,16,35,0.0051233031846532615,25,COMPLETE
439,0.00031606247648596764,2025-07-12 21:26:00.081223,2025-07-12 21:26:50.092567,0 days 00:00:50.011344,identity,16,62,0.00637481251299243,23,COMPLETE
440,0.00029844281380064785,2025-07-12 21:26:50.093313,2025-07-12 21:27:33.453883,0 days 00:00:43.360570,identity,16,42,0.005730490022464756,25,COMPLETE
441,0.0003027795464731753,2025-07-12 21:27:33.454454,2025-07-12 21:28:16.376719,0 days 00:00:42.922265,identity,16,41,0.007153620636783561,25,COMPLETE
442,0.0005051498883403838,2025-07-12 21:28:16.377434,2025-07-12 21:28:59.582377,0 days 00:00:43.204943,identity,16,43,0.00013350421399716136,24,COMPLETE
443,0.000328585971146822,2025-07-12 21:28:59.582927,2025-07-12 21:29:44.150000,0 days 00:00:44.567073,relu,16,44,0.005855398844644989,25,COMPLETE
444,0.00031662965193390846,2025-07-12 21:29:44.150519,2025-07-12 21:30:26.998856,0 days 00:00:42.848337,identity,16,38,0.006395111245170697,23,COMPLETE
445,0.00032147570163942873,2025-07-12 21:30:26.999609,2025-07-12 21:31:12.396445,0 days 00:00:45.396836,identity,16,46,0.00569445056627218,24,COMPLETE
446,0.0003214726457372308,2025-07-12 21:31:12.397020,2025-07-12 21:31:55.147379,0 days 00:00:42.750359,identity,16,42,0.00418054120487878,25,COMPLETE
447,0.0003938620211556554,2025-07-12 21:31:55.148111,2025-07-12 21:32:11.747272,0 days 00:00:16.599161,identity,64,28,0.004816159635129857,24,COMPLETE
448,0.00035866687539964914,2025-07-12 21:32:11.747767,2025-07-12 21:32:54.008624,0 days 00:00:42.260857,identity,16,37,0.005663943432329984,23,COMPLETE
449,0.00030720329959876835,2025-07-12 21:32:54.009346,2025-07-12 21:34:02.647883,0 days 00:01:08.638537,identity,16,121,0.0065978189768410855,25,COMPLETE
450,0.000341785023920238,2025-07-12 21:34:02.648668,2025-07-12 21:34:41.082358,0 days 00:00:38.433690,identity,16,22,0.0035055340430281906,25,COMPLETE
451,0.0003241834638174623,2025-07-12 21:34:41.083140,2025-07-12 21:35:25.922241,0 days 00:00:44.839101,identity,16,39,0.005318480969736042,25,COMPLETE
452,0.0003571055131033063,2025-07-12 21:35:25.922839,2025-07-12 21:36:07.168487,0 days 00:00:41.245648,identity,16,34,0.007215561340329402,24,COMPLETE
453,0.0003004967875313014,2025-07-12 21:36:07.169199,2025-07-12 21:36:52.240339,0 days 00:00:45.071140,identity,16,49,0.004498231241042457,24,COMPLETE
454,0.00033307488774880767,2025-07-12 21:36:52.240916,2025-07-12 21:37:36.644528,0 days 00:00:44.403612,identity,16,49,0.0039001195336068935,23,COMPLETE
455,0.0004120663506910205,2025-07-12 21:37:36.645273,2025-07-12 21:38:20.950452,0 days 00:00:44.305179,identity,16,47,0.00048682420298357414,22,COMPLETE
456,0.0003591254644561559,2025-07-12 21:38:20.951182,2025-07-12 21:38:50.071807,0 days 00:00:29.120625,identity,32,46,0.0043750656013394115,24,COMPLETE
457,0.0003751463955268264,2025-07-12 21:38:50.072370,2025-07-12 21:39:34.439204,0 days 00:00:44.366834,identity,16,49,0.00454718267450181,23,COMPLETE
458,0.0003418093256186694,2025-07-12 21:39:34.439728,2025-07-12 21:40:21.020177,0 days 00:00:46.580449,identity,16,52,0.00396773485249985,24,COMPLETE
459,0.0003029094368685037,2025-07-12 21:40:21.020970,2025-07-12 21:41:03.618737,0 days 00:00:42.597767,identity,16,42,0.004725536338865718,24,COMPLETE
460,0.0004065590619575232,2025-07-12 21:41:03.619304,2025-07-12 21:41:13.141188,0 days 00:00:09.521884,identity,128,50,0.003308103602434167,7,COMPLETE
461,0.0003076734719797969,2025-07-12 21:41:13.141696,2025-07-12 21:41:55.814384,0 days 00:00:42.672688,identity,16,44,0.004942519447420303,22,COMPLETE
462,0.0004961185622960329,2025-07-12 21:41:55.815094,2025-07-12 21:42:40.704191,0 days 00:00:44.889097,identity,16,45,0.004283877511119104,24,COMPLETE
463,1.7199456691741943,2025-07-12 21:42:40.704720,2025-07-12 21:43:26.212148,0 days 00:00:45.507428,relu,16,47,0.005221923834176145,23,COMPLETE
464,0.0003094202547799796,2025-07-12 21:43:26.213130,2025-07-12 21:44:09.490398,0 days 00:00:43.277268,identity,16,51,0.004586131226298465,19,COMPLETE
465,0.0003467982751317322,2025-07-12 21:44:09.491141,2025-07-12 21:44:52.481781,0 days 00:00:42.990640,identity,16,41,0.006013745103513275,24,COMPLETE
466,0.0003028092614840716,2025-07-12 21:44:52.482361,2025-07-12 21:45:39.748841,0 days 00:00:47.266480,identity,16,54,0.003918921389761078,23,COMPLETE
467,0.00030821989639662206,2025-07-12 21:45:39.749580,2025-07-12 21:46:24.324267,0 days 00:00:44.574687,identity,16,39,0.00496858586915262,24,COMPLETE
468,0.00031463082996197045,2025-07-12 21:46:24.324838,2025-07-12 21:47:19.187142,0 days 00:00:54.862304,identity,16,68,0.005526434724463892,25,COMPLETE
469,0.0003072163672186434,2025-07-12 21:47:19.187912,2025-07-12 21:48:07.660325,0 days 00:00:48.472413,identity,16,54,0.006264735714191039,24,COMPLETE
470,0.000336514349328354,2025-07-12 21:48:07.660903,2025-07-12 21:48:51.138697,0 days 00:00:43.477794,identity,16,44,0.0009602629823370857,25,COMPLETE
471,0.00030357559444382787,2025-07-12 21:48:51.139431,2025-07-12 21:49:32.303926,0 days 00:00:41.164495,identity,16,48,0.004299221995945463,23,COMPLETE
472,0.0003879685827996582,2025-07-12 21:49:32.304497,2025-07-12 21:49:49.279032,0 days 00:00:16.974535,identity,64,34,0.007872603434795665,24,COMPLETE
473,0.00037518705357797444,2025-07-12 21:49:49.279687,2025-07-12 21:50:30.393167,0 days 00:00:41.113480,identity,16,31,0.006939196158467937,25,COMPLETE
474,0.0004177165392320603,2025-07-12 21:50:30.393831,2025-07-12 21:51:13.884011,0 days 00:00:43.490180,identity,16,37,0.005022658366118743,25,COMPLETE
475,0.0003134069265797734,2025-07-12 21:51:13.884583,2025-07-12 21:52:14.785129,0 days 00:01:00.900546,identity,16,106,0.0054785011031782075,24,COMPLETE
476,0.0003090024692937732,2025-07-12 21:52:14.785867,2025-07-12 21:53:00.779604,0 days 00:00:45.993737,identity,16,53,0.0036228119951923895,23,COMPLETE
477,0.0002960684651043266,2025-07-12 21:53:00.780354,2025-07-12 21:53:51.966065,0 days 00:00:51.185711,identity,16,66,0.0061362450181986095,24,COMPLETE
478,0.0003048652724828571,2025-07-12 21:53:51.966626,2025-07-12 21:54:44.343881,0 days 00:00:52.377255,identity,16,73,0.004721939868297591,24,COMPLETE
479,0.0003396454267203808,2025-07-12 21:54:44.344613,2025-07-12 21:55:28.249653,0 days 00:00:43.905040,identity,16,67,0.005391383579077272,15,COMPLETE
480,0.00031527114333584905,2025-07-12 21:55:28.250357,2025-07-12 21:56:22.102976,0 days 00:00:53.852619,identity,16,69,0.00418231002675214,24,COMPLETE
481,0.0003593173751141876,2025-07-12 21:56:22.103671,2025-07-12 21:56:53.208811,0 days 00:00:31.105140,identity,32,64,0.005836578414831766,25,COMPLETE
482,1.7180771827697754,2025-07-12 21:56:53.209474,2025-07-12 21:57:47.341843,0 days 00:00:54.132369,relu,16,66,0.00465191964695592,25,COMPLETE
483,0.0003058051224797964,2025-07-12 21:57:47.342532,2025-07-12 21:58:41.153718,0 days 00:00:53.811186,identity,16,69,0.004986059403303879,24,COMPLETE
484,0.00030690987478010356,2025-07-12 21:58:41.154535,2025-07-12 21:59:38.900442,0 days 00:00:57.745907,identity,16,77,0.006292633252582908,25,COMPLETE
485,0.0003280234814155847,2025-07-12 21:59:38.901191,2025-07-12 22:00:01.123301,0 days 00:00:22.222110,identity,128,63,0.00695808470571544,24,COMPLETE
486,0.00034851382952183485,2025-07-12 22:00:01.123828,2025-07-12 22:00:50.547175,0 days 00:00:49.423347,identity,16,60,0.005332241988185176,25,COMPLETE
487,0.00032867019763216376,2025-07-12 22:00:50.548006,2025-07-12 22:01:44.363112,0 days 00:00:53.815106,identity,16,72,0.00440076557126872,25,COMPLETE
488,0.0003054728440474719,2025-07-12 22:01:44.363689,2025-07-12 22:02:36.301072,0 days 00:00:51.937383,identity,16,66,0.005744046017160396,24,COMPLETE
489,0.0003060902818106115,2025-07-12 22:02:36.301843,2025-07-12 22:03:22.810530,0 days 00:00:46.508687,identity,16,56,0.005020900508850744,25,COMPLETE
490,0.0002979240089189261,2025-07-12 22:03:22.811082,2025-07-12 22:04:04.211874,0 days 00:00:41.400792,identity,16,36,0.007412110860733712,24,COMPLETE
491,0.0003265423874836415,2025-07-12 22:04:04.212607,2025-07-12 22:05:02.494327,0 days 00:00:58.281720,identity,16,89,0.007879939440444449,24,COMPLETE
492,0.0003170254931319505,2025-07-12 22:05:02.494918,2025-07-12 22:05:45.273302,0 days 00:00:42.778384,identity,16,36,0.008488094064857916,25,COMPLETE
493,0.00032787316013127565,2025-07-12 22:05:45.274096,2025-07-12 22:06:26.290220,0 days 00:00:41.016124,identity,16,33,0.0064723538453150915,24,COMPLETE
494,0.0003143672947771847,2025-07-12 22:06:26.290786,2025-07-12 22:07:09.081469,0 days 00:00:42.790683,identity,16,36,0.00766953667825401,25,COMPLETE
495,0.0003092258994001895,2025-07-12 22:07:09.082201,2025-07-12 22:07:50.925169,0 days 00:00:41.842968,identity,16,40,0.007242852611798897,24,COMPLETE
496,0.0003830273053608835,2025-07-12 22:07:50.925711,2025-07-12 22:08:09.879088,0 days 00:00:18.953377,identity,64,31,0.006431513788872249,25,COMPLETE
497,0.0003201837826054543,2025-07-12 22:08:09.879836,2025-07-12 22:08:54.873390,0 days 00:00:44.993554,identity,16,39,0.007517745933339207,25,COMPLETE
498,0.0003060755552724004,2025-07-12 22:08:54.873980,2025-07-12 22:09:37.418523,0 days 00:00:42.544543,identity,16,36,0.006825072510801239,24,COMPLETE
499,0.00031491476693190634,2025-07-12 22:09:37.419301,2025-07-12 22:10:18.729569,0 days 00:00:41.310268,identity,16,33,0.008383110994188755,24,COMPLETE
