number,value,datetime_start,datetime_complete,duration,params_activation,params_batch_size,params_h,params_lr,params_seq_length,state
289,0.00030429515754804015,2025-07-12 19:42:54.247076,2025-07-12 19:43:40.666474,0 days 00:00:46.419398,identity,16,51,0.004639114444786386,24,COMPLETE
290,0.0003145170630887151,2025-07-12 19:43:40.667070,2025-07-12 19:44:32.546484,0 days 00:00:51.879414,identity,16,63,0.0038789427043074897,25,COMPLETE
291,0.0003058086440432817,2025-07-12 19:44:32.547119,2025-07-12 19:45:13.624833,0 days 00:00:41.077714,identity,16,30,0.006042468635534191,25,COMPLETE
292,0.0003016133268829435,2025-07-12 19:45:13.625388,2025-07-12 19:45:52.475171,0 days 00:00:38.849783,identity,16,23,0.004921519172965179,24,COMPLETE
293,0.0003368888283148408,2025-07-12 19:45:52.475732,2025-07-12 19:46:26.663824,0 days 00:00:34.188092,identity,16,23,0.005203355776514838,15,COMPLETE
294,0.0003642926167231053,2025-07-12 19:46:26.664447,2025-07-12 19:47:03.640211,0 days 00:00:36.975764,identity,16,21,0.0009088793231116445,23,COMPLETE
295,0.00030967718339525163,2025-07-12 19:47:03.640705,2025-07-12 19:47:40.209416,0 days 00:00:36.568711,identity,16,24,0.006772899420817712,25,COMPLETE
296,0.0004272071528248489,2025-07-12 19:47:40.210050,2025-07-12 19:47:54.529285,0 days 00:00:14.319235,identity,64,18,0.004875085616824473,24,COMPLETE
297,0.0003012112865690142,2025-07-12 19:47:54.529756,2025-07-12 19:48:32.877262,0 days 00:00:38.347506,identity,16,26,0.0057319008781286825,25,COMPLETE
298,0.0003133939462713897,2025-07-12 19:48:32.877767,2025-07-12 19:49:11.038201,0 days 00:00:38.160434,identity,16,21,0.006187624097828017,25,COMPLETE
299,0.0003178977931383997,2025-07-12 19:49:11.038922,2025-07-12 19:49:49.246649,0 days 00:00:38.207727,identity,16,25,0.005627052430054202,25,COMPLETE
300,0.0003160260966978967,2025-07-12 19:49:49.247151,2025-07-12 19:50:28.340622,0 days 00:00:39.093471,identity,16,27,0.007988423210337771,25,COMPLETE
301,0.00031554640736430883,2025-07-12 19:50:28.341321,2025-07-12 19:51:05.146432,0 days 00:00:36.805111,identity,16,19,0.006701524311126205,25,COMPLETE
302,0.00029861400253139436,2025-07-12 19:51:05.146935,2025-07-12 19:51:44.342488,0 days 00:00:39.195553,identity,16,23,0.00592335415871491,25,COMPLETE
303,0.0004860201443079859,2025-07-12 19:51:44.343232,2025-07-12 19:52:14.360140,0 days 00:00:30.016908,identity,16,25,0.005727631767401912,6,COMPLETE
304,0.00031708585447631776,2025-07-12 19:52:14.360826,2025-07-12 19:53:03.859351,0 days 00:00:49.498525,identity,16,59,0.006111086834151087,25,COMPLETE
305,0.00037456845166161656,2025-07-12 19:53:03.859849,2025-07-12 19:53:33.938790,0 days 00:00:30.078941,identity,32,56,0.00544751588187355,25,COMPLETE
306,0.00030302483355626464,2025-07-12 19:53:33.939476,2025-07-12 19:54:13.629507,0 days 00:00:39.690031,relu,16,28,0.006410011904490206,25,COMPLETE
307,0.00037901708856225014,2025-07-12 19:54:13.630014,2025-07-12 19:54:47.445622,0 days 00:00:33.815608,identity,16,23,0.005309779872117679,14,COMPLETE
308,0.0003045597695745528,2025-07-12 19:54:47.446344,2025-07-12 19:55:31.884674,0 days 00:00:44.438330,identity,16,37,0.005827458393729872,25,COMPLETE
309,0.00038086005952209234,2025-07-12 19:55:31.885395,2025-07-12 19:56:10.972017,0 days 00:00:39.086622,identity,16,28,0.004776906303758654,24,COMPLETE
310,0.0003267910215072334,2025-07-12 19:56:10.972721,2025-07-12 19:56:30.234985,0 days 00:00:19.262264,identity,128,53,0.006672649103388327,25,COMPLETE
311,0.00032106038997881114,2025-07-12 19:56:30.235502,2025-07-12 19:57:19.372540,0 days 00:00:49.137038,identity,16,60,0.005254910851489194,24,COMPLETE
312,0.000313987402478233,2025-07-12 19:57:19.373223,2025-07-12 19:58:01.142873,0 days 00:00:41.769650,identity,16,33,0.00603270774943115,25,COMPLETE
313,0.00031002232572063804,2025-07-12 19:58:01.143339,2025-07-12 19:58:45.376639,0 days 00:00:44.233300,identity,16,39,0.007480337008994965,24,COMPLETE
314,0.0002901754924096167,2025-07-12 19:58:45.377369,2025-07-12 19:59:26.449984,0 days 00:00:41.072615,identity,16,30,0.004711570269597469,25,COMPLETE
315,0.00031920147011987865,2025-07-12 19:59:26.450500,2025-07-12 20:00:04.367685,0 days 00:00:37.917185,identity,16,25,0.004509214703172479,25,COMPLETE
316,0.00033899617847055197,2025-07-12 20:00:04.368353,2025-07-12 20:00:45.434997,0 days 00:00:41.066644,identity,16,30,0.0049599987098395805,25,COMPLETE
317,0.00031605601543560624,2025-07-12 20:00:45.435527,2025-07-12 20:01:28.404137,0 days 00:00:42.968610,identity,16,35,0.004206913882270827,25,COMPLETE
318,0.00033267709659412503,2025-07-12 20:01:28.404785,2025-07-12 20:02:06.766142,0 days 00:00:38.361357,identity,16,26,0.004674103929783804,25,COMPLETE
319,0.00030940299620851874,2025-07-12 20:02:06.766653,2025-07-12 20:02:45.089303,0 days 00:00:38.322650,identity,16,22,0.005533652035199517,25,COMPLETE
320,0.0006426050676964223,2025-07-12 20:02:45.089813,2025-07-12 20:03:25.604226,0 days 00:00:40.514413,identity,16,29,0.0012831713829966848,24,COMPLETE
321,0.0003082830517087132,2025-07-12 20:03:25.604905,2025-07-12 20:04:17.264350,0 days 00:00:51.659445,identity,16,62,0.004017540987599171,25,COMPLETE
322,0.00033581943716853857,2025-07-12 20:04:17.265043,2025-07-12 20:04:34.671338,0 days 00:00:17.406295,identity,64,33,0.006968846918847605,24,COMPLETE
323,0.00032310414826497436,2025-07-12 20:04:34.671849,2025-07-12 20:05:21.535792,0 days 00:00:46.863943,identity,16,56,0.005048667454285778,25,COMPLETE
324,0.0003323926357552409,2025-07-12 20:05:21.536254,2025-07-12 20:06:02.060045,0 days 00:00:40.523791,identity,16,30,0.006170586705547081,24,COMPLETE
325,0.00035585230216383934,2025-07-12 20:06:02.060742,2025-07-12 20:06:50.415363,0 days 00:00:48.354621,identity,16,59,0.0018159218852549337,24,COMPLETE
326,0.0003313952183816582,2025-07-12 20:06:50.415999,2025-07-12 20:07:43.336568,0 days 00:00:52.920569,identity,16,66,0.004537311939701541,25,COMPLETE
327,0.000346625893143937,2025-07-12 20:07:43.337188,2025-07-12 20:08:22.969609,0 days 00:00:39.632421,relu,16,27,0.005438685990287948,25,COMPLETE
328,0.00036938648554496467,2025-07-12 20:08:22.970204,2025-07-12 20:09:06.310329,0 days 00:00:43.340125,identity,16,43,0.0006119638569846363,24,COMPLETE
329,0.0003072427643928677,2025-07-12 20:09:06.310955,2025-07-12 20:09:45.589286,0 days 00:00:39.278331,identity,16,32,0.004886719304231579,25,COMPLETE
330,0.00030683321529068053,2025-07-12 20:09:45.589833,2025-07-12 20:10:22.240892,0 days 00:00:36.651059,identity,16,24,0.0032008013960185427,25,COMPLETE
331,0.0003034135443158448,2025-07-12 20:10:22.241566,2025-07-12 20:11:04.443800,0 days 00:00:42.202234,identity,16,35,0.007234717986147758,24,COMPLETE
332,0.0003358307294547558,2025-07-12 20:11:04.444392,2025-07-12 20:11:35.478782,0 days 00:00:31.034390,identity,32,57,0.005886988352337192,25,COMPLETE
333,0.00030352853354997933,2025-07-12 20:11:35.479394,2025-07-12 20:12:23.446233,0 days 00:00:47.966839,identity,16,54,0.006337627230390624,24,COMPLETE
334,0.0003150411357637495,2025-07-12 20:12:23.446932,2025-07-12 20:13:11.656683,0 days 00:00:48.209751,identity,16,64,0.0025793432518921625,25,COMPLETE
335,0.0003546403895597905,2025-07-12 20:13:11.657344,2025-07-12 20:13:25.498331,0 days 00:00:13.840987,identity,128,40,0.0036658242068486604,24,COMPLETE
336,0.0005050209583714604,2025-07-12 20:13:25.498918,2025-07-12 20:14:04.624004,0 days 00:00:39.125086,identity,16,27,0.00034931252022277816,25,COMPLETE
337,0.0003342865384183824,2025-07-12 20:14:04.624516,2025-07-12 20:14:45.879064,0 days 00:00:41.254548,identity,16,31,0.0042873505507867735,24,COMPLETE
338,0.0003287714789621532,2025-07-12 20:14:45.879660,2025-07-12 20:15:49.807909,0 days 00:01:03.928249,identity,16,112,0.0021347864624709834,25,COMPLETE
339,0.00035604860750027,2025-07-12 20:15:49.808520,2025-07-12 20:16:35.917360,0 days 00:00:46.108840,identity,16,52,0.005228465249058673,24,COMPLETE
340,0.00037166851689107716,2025-07-12 20:16:35.918093,2025-07-12 20:17:15.945833,0 days 00:00:40.027740,identity,16,37,0.0058133616641974405,19,COMPLETE
341,0.0003157151222694665,2025-07-12 20:17:15.946515,2025-07-12 20:18:05.877513,0 days 00:00:49.930998,identity,16,60,0.006633665547683836,25,COMPLETE
342,0.00031942606437951326,2025-07-12 20:18:05.878237,2025-07-12 20:18:57.080747,0 days 00:00:51.202510,identity,16,62,0.004695917320671246,25,COMPLETE
343,0.000310891424305737,2025-07-12 20:18:57.081490,2025-07-12 20:19:34.776943,0 days 00:00:37.695453,identity,16,21,0.007719894475051638,24,COMPLETE
344,1.7180771827697754,2025-07-12 20:19:34.777452,2025-07-12 20:20:17.215598,0 days 00:00:42.438146,relu,16,34,0.005407399243506843,25,COMPLETE
345,0.0004010333213955164,2025-07-12 20:20:17.216122,2025-07-12 20:20:52.862067,0 days 00:00:35.645945,identity,16,24,0.00512985425189065,23,COMPLETE
346,0.0003245908592361957,2025-07-12 20:20:52.862723,2025-07-12 20:21:33.813257,0 days 00:00:40.950534,identity,16,29,0.0042996306580805575,25,COMPLETE
347,0.0003352755156811327,2025-07-12 20:21:33.813764,2025-07-12 20:21:59.551728,0 days 00:00:25.737964,identity,64,67,0.009462449848182218,24,COMPLETE
348,0.0003095319261774421,2025-07-12 20:21:59.552236,2025-07-12 20:22:41.362918,0 days 00:00:41.810682,identity,16,31,0.005909496810102403,25,COMPLETE
349,0.0003084125346504152,2025-07-12 20:22:41.363570,2025-07-12 20:23:29.154070,0 days 00:00:47.790500,identity,16,55,0.0038971302628553472,23,COMPLETE
350,0.0003144287911709398,2025-07-12 20:23:29.154651,2025-07-12 20:24:11.488878,0 days 00:00:42.334227,identity,16,36,0.007167562395258897,24,COMPLETE
351,0.0003049165243282914,2025-07-12 20:24:11.489510,2025-07-12 20:24:50.540833,0 days 00:00:39.051323,identity,16,27,0.008474472990481489,25,COMPLETE
352,0.00031173849129118025,2025-07-12 20:24:50.541343,2025-07-12 20:25:37.195586,0 days 00:00:46.654243,identity,16,50,0.006464235751705818,25,COMPLETE
353,0.000315798562951386,2025-07-12 20:25:37.196288,2025-07-12 20:26:25.051610,0 days 00:00:47.855322,identity,16,58,0.004760546855466726,24,COMPLETE
354,0.0003079353191424161,2025-07-12 20:26:25.052178,2025-07-12 20:27:02.399180,0 days 00:00:37.347002,identity,16,22,0.005620331885175834,23,COMPLETE
355,0.00032388948602601886,2025-07-12 20:27:02.399815,2025-07-12 20:27:59.768868,0 days 00:00:57.369053,identity,16,82,0.005159045633347238,25,COMPLETE
356,0.00038082755054347217,2025-07-12 20:27:59.769395,2025-07-12 20:28:24.402631,0 days 00:00:24.633236,identity,32,33,0.006070917809527199,24,COMPLETE
357,0.0003149517870042473,2025-07-12 20:28:24.403327,2025-07-12 20:29:05.501004,0 days 00:00:41.097677,identity,16,29,0.0044966474833353625,25,COMPLETE
358,0.0003404126618988812,2025-07-12 20:29:05.501533,2025-07-12 20:29:43.135980,0 days 00:00:37.634447,identity,16,25,0.006636127639466863,24,COMPLETE
359,0.0003348267055116594,2025-07-12 20:29:43.136475,2025-07-12 20:30:35.187852,0 days 00:00:52.051377,identity,16,63,0.005528428322927273,25,COMPLETE
360,0.0004576590727083385,2025-07-12 20:30:35.188603,2025-07-12 20:30:50.253159,0 days 00:00:15.064556,identity,128,69,0.004952047991621071,12,COMPLETE
361,0.0003004281024914235,2025-07-12 20:30:50.253655,2025-07-12 20:31:33.759337,0 days 00:00:43.505682,identity,16,38,0.004067151552650637,24,COMPLETE
362,0.0003102133923675865,2025-07-12 20:31:33.759965,2025-07-12 20:32:20.793420,0 days 00:00:47.033455,identity,16,58,0.007252599141329976,23,COMPLETE
363,0.00033921675640158355,2025-07-12 20:32:20.794143,2025-07-12 20:33:02.061276,0 days 00:00:41.267133,identity,16,40,0.008322197622113215,23,COMPLETE
364,1.7192953824996948,2025-07-12 20:33:02.061800,2025-07-12 20:33:38.806092,0 days 00:00:36.744292,relu,16,19,0.004070135149197119,24,COMPLETE
365,0.00030177950975485146,2025-07-12 20:33:38.806801,2025-07-12 20:34:23.764872,0 days 00:00:44.958071,identity,16,45,0.005638238215857027,24,COMPLETE
366,0.00033716781763359904,2025-07-12 20:34:23.765392,2025-07-12 20:35:08.632442,0 days 00:00:44.867050,identity,16,45,0.00562937917836419,24,COMPLETE
367,0.00031094171572476625,2025-07-12 20:35:08.633153,2025-07-12 20:35:51.740590,0 days 00:00:43.107437,identity,16,43,0.006173090419857751,24,COMPLETE
368,0.0003085191419813782,2025-07-12 20:35:51.741110,2025-07-12 20:36:37.395855,0 days 00:00:45.654745,identity,16,47,0.005117456517618162,24,COMPLETE
369,0.0003662031376734376,2025-07-12 20:36:37.396566,2025-07-12 20:37:14.155046,0 days 00:00:36.758480,identity,16,39,0.005740006743932534,13,COMPLETE
370,0.00032393456785939634,2025-07-12 20:37:14.155569,2025-07-12 20:37:59.215421,0 days 00:00:45.059852,identity,16,56,0.004440094875068292,23,COMPLETE
371,0.00032015418400987983,2025-07-12 20:37:59.216119,2025-07-12 20:38:41.758696,0 days 00:00:42.542577,identity,16,41,0.0049950909854226165,25,COMPLETE
372,0.0003382000722922385,2025-07-12 20:38:41.759369,2025-07-12 20:39:03.278440,0 days 00:00:21.519071,identity,64,52,0.006171972873276277,24,COMPLETE
373,0.0003075038839597255,2025-07-12 20:39:03.279029,2025-07-12 20:39:53.668631,0 days 00:00:50.389602,identity,16,61,0.005463280362989467,25,COMPLETE
374,0.00030681598582305014,2025-07-12 20:39:53.669156,2025-07-12 20:40:36.598618,0 days 00:00:42.929462,identity,16,37,0.0037147124636083897,24,COMPLETE
375,0.0002992886584252119,2025-07-12 20:40:36.599370,2025-07-12 20:41:20.306191,0 days 00:00:43.706821,identity,16,43,0.004725147095603195,25,COMPLETE
376,0.0003098679590038955,2025-07-12 20:41:20.306741,2025-07-12 20:42:04.389326,0 days 00:00:44.082585,identity,16,45,0.005197562692751552,23,COMPLETE
377,0.0003187185793649405,2025-07-12 20:42:04.390039,2025-07-12 20:42:47.408079,0 days 00:00:43.018040,identity,16,43,0.00634644733510464,24,COMPLETE
378,0.00031949966796673834,2025-07-12 20:42:47.408609,2025-07-12 20:43:30.184550,0 days 00:00:42.775941,identity,16,41,0.004248629961481873,25,COMPLETE
379,0.00030188748496584594,2025-07-12 20:43:30.185253,2025-07-12 20:44:13.157240,0 days 00:00:42.971987,identity,16,43,0.005734493267613466,24,COMPLETE
380,0.0003299304225947708,2025-07-12 20:44:13.157765,2025-07-12 20:44:59.584610,0 days 00:00:46.426845,identity,16,50,0.006653042256888862,25,COMPLETE
381,0.00037996916216798127,2025-07-12 20:44:59.585347,2025-07-12 20:45:40.934182,0 days 00:00:41.348835,identity,16,48,0.00483428881617692,22,COMPLETE
382,0.0003169831761624664,2025-07-12 20:45:40.934796,2025-07-12 20:46:30.364933,0 days 00:00:49.430137,identity,16,55,0.005567175603605967,25,COMPLETE
383,0.0002990259963553399,2025-07-12 20:46:30.365566,2025-07-12 20:47:15.421913,0 days 00:00:45.056347,identity,16,46,0.00463893022325526,24,COMPLETE
384,1.7180771827697754,2025-07-12 20:47:15.422649,2025-07-12 20:47:35.438846,0 days 00:00:20.016197,relu,128,53,0.004048774374209471,25,COMPLETE
385,0.0003072027175221592,2025-07-12 20:47:35.439352,2025-07-12 20:48:19.993057,0 days 00:00:44.553705,identity,16,39,0.004588976667457709,25,COMPLETE
386,0.00040942314080893993,2025-07-12 20:48:19.993767,2025-07-12 20:49:03.953920,0 days 00:00:43.960153,identity,16,60,0.0033717565910667004,18,COMPLETE
387,0.0003166668175254017,2025-07-12 20:49:03.954446,2025-07-12 20:49:51.798681,0 days 00:00:47.844235,identity,16,64,0.004158626898047348,24,COMPLETE
388,0.0003408336779102683,2025-07-12 20:49:51.799417,2025-07-12 20:50:22.405754,0 days 00:00:30.606337,identity,32,58,0.0029190842749103924,24,COMPLETE
389,0.0002960877900477499,2025-07-12 20:50:22.406286,2025-07-12 20:51:15.373231,0 days 00:00:52.966945,identity,16,66,0.004836850317433665,25,COMPLETE
390,0.0003146157832816243,2025-07-12 20:51:15.373944,2025-07-12 20:52:09.111522,0 days 00:00:53.737578,identity,16,68,0.004518590672658155,25,COMPLETE
391,0.0003196893085259944,2025-07-12 20:52:09.112046,2025-07-12 20:53:01.441832,0 days 00:00:52.329786,identity,16,65,0.0037031902502143747,25,COMPLETE
392,0.0003114975115749985,2025-07-12 20:53:01.442595,2025-07-12 20:53:54.983587,0 days 00:00:53.540992,identity,16,67,0.005137549581162421,25,COMPLETE
393,0.00030481567955575883,2025-07-12 20:53:54.984342,2025-07-12 20:54:46.720925,0 days 00:00:51.736583,identity,16,63,0.0069975382962086915,25,COMPLETE
394,0.0003405155730433762,2025-07-12 20:54:46.721662,2025-07-12 20:55:31.983698,0 days 00:00:45.262036,identity,16,66,0.004461192060090623,17,COMPLETE
395,0.0003087855002377182,2025-07-12 20:55:31.984228,2025-07-12 20:56:23.078785,0 days 00:00:51.094557,identity,16,62,0.0052082318190751495,25,COMPLETE
396,0.0003198391932528466,2025-07-12 20:56:23.079559,2025-07-12 20:57:26.137297,0 days 00:01:03.057738,identity,16,99,0.006036539072999563,25,COMPLETE
397,0.0003069457015953958,2025-07-12 20:57:26.138081,2025-07-12 20:58:10.370556,0 days 00:00:44.232475,identity,16,38,0.003964187071959186,25,COMPLETE
398,0.00032193309743888676,2025-07-12 20:58:10.371133,2025-07-12 20:58:56.074130,0 days 00:00:45.702997,identity,16,49,0.004715172169330236,25,COMPLETE
399,0.00046107236994430423,2025-07-12 20:58:56.074833,2025-07-12 20:59:19.448715,0 days 00:00:23.373882,identity,64,60,0.0007736300751536,24,COMPLETE
400,0.0003571805136743933,2025-07-12 20:59:19.449218,2025-07-12 20:59:59.349796,0 days 00:00:39.900578,identity,16,70,0.006604650917185774,9,COMPLETE
401,0.0003172928700223565,2025-07-12 20:59:59.350512,2025-07-12 21:00:42.002453,0 days 00:00:42.651941,identity,16,41,0.0050104762892806114,25,COMPLETE
402,0.0003227461129426956,2025-07-12 21:00:42.003072,2025-07-12 21:01:28.461008,0 days 00:00:46.457936,identity,16,57,0.005931548914804915,23,COMPLETE
403,1.7192953824996948,2025-07-12 21:01:28.461722,2025-07-12 21:02:16.448211,0 days 00:00:47.986489,relu,16,54,0.004303757287107573,24,COMPLETE
404,0.00031941532506607473,2025-07-12 21:02:16.448929,2025-07-12 21:03:05.518691,0 days 00:00:49.069762,identity,16,64,0.005319350355837662,25,COMPLETE
405,0.0003465899790171534,2025-07-12 21:03:05.519460,2025-07-12 21:03:37.722384,0 days 00:00:32.202924,identity,32,59,0.007475265591087438,25,COMPLETE
406,0.00030599356978200376,2025-07-12 21:03:37.722946,2025-07-12 21:04:23.662087,0 days 00:00:45.939141,identity,16,51,0.004748962654616806,24,COMPLETE
407,0.0002995353424921632,2025-07-12 21:04:23.662713,2025-07-12 21:05:05.261049,0 days 00:00:41.598336,identity,16,36,0.006249744418035504,23,COMPLETE
408,0.0003441916487645358,2025-07-12 21:05:05.261700,2025-07-12 21:05:46.264759,0 days 00:00:41.003059,identity,16,35,0.006649747622703189,22,COMPLETE
409,0.0003335039073135704,2025-07-12 21:05:46.265473,2025-07-12 21:06:27.297073,0 days 00:00:41.031600,identity,16,35,0.0076539062730170745,22,COMPLETE
410,0.00036318282946012914,2025-07-12 21:06:27.297611,2025-07-12 21:06:42.464699,0 days 00:00:15.167088,identity,128,38,0.006205207745298036,23,COMPLETE
411,0.00031859264709055424,2025-07-12 21:06:42.465424,2025-07-12 21:07:24.789055,0 days 00:00:42.323631,identity,16,42,0.006920014837335607,23,COMPLETE
412,0.0003114481514785439,2025-07-12 21:07:24.789593,2025-07-12 21:08:07.199138,0 days 00:00:42.409545,identity,16,37,0.005638363423753624,23,COMPLETE
413,0.0003182796062901616,2025-07-12 21:08:07.199931,2025-07-12 21:08:48.349145,0 days 00:00:41.149214,identity,16,40,0.005259590630856534,23,COMPLETE
414,0.0003295570786576718,2025-07-12 21:08:48.349924,2025-07-12 21:09:26.996384,0 days 00:00:38.646460,identity,16,32,0.003934412975915795,24,COMPLETE
415,0.00030106003396213055,2025-07-12 21:09:26.996925,2025-07-12 21:10:11.663817,0 days 00:00:44.666892,identity,16,46,0.006211816865208047,23,COMPLETE
416,0.0003045733901672065,2025-07-12 21:10:11.664547,2025-07-12 21:10:54.332156,0 days 00:00:42.667609,identity,16,44,0.006153151511889985,23,COMPLETE
417,0.00032327903318218887,2025-07-12 21:10:54.332706,2025-07-12 21:11:36.567275,0 days 00:00:42.234569,identity,16,43,0.004930675123057172,22,COMPLETE
418,0.000308430491713807,2025-07-12 21:11:36.568000,2025-07-12 21:12:16.833698,0 days 00:00:40.265698,identity,16,47,0.005907016309881837,16,COMPLETE
419,0.0003130811674054712,2025-07-12 21:12:16.834243,2025-07-12 21:13:01.435632,0 days 00:00:44.601389,identity,16,47,0.0044263211586414095,23,COMPLETE
420,0.0003489911032374948,2025-07-12 21:13:01.436206,2025-07-12 21:13:53.305792,0 days 00:00:51.869586,identity,16,72,0.0015675177141976438,23,COMPLETE
421,0.00030337413772940636,2025-07-12 21:13:53.306499,2025-07-12 21:14:36.699361,0 days 00:00:43.392862,identity,16,46,0.0054151424112890865,22,COMPLETE
422,0.0003438094281591475,2025-07-12 21:14:36.700099,2025-07-12 21:14:58.093509,0 days 00:00:21.393410,identity,64,51,0.006392125451414204,23,COMPLETE
423,1.7199455499649048,2025-07-12 21:14:58.094031,2025-07-12 21:15:52.122220,0 days 00:00:54.028189,relu,16,69,0.004783798070355283,22,COMPLETE
424,0.00031666041468270123,2025-07-12 21:15:52.123035,2025-07-12 21:16:30.775410,0 days 00:00:38.652375,identity,16,27,0.0055352013403457195,24,COMPLETE
425,0.00031708451570011675,2025-07-12 21:16:30.775959,2025-07-12 21:17:22.232167,0 days 00:00:51.456208,identity,16,66,0.004364914151031807,23,COMPLETE
426,0.00031434791162610054,2025-07-12 21:17:22.232921,2025-07-12 21:18:12.877039,0 days 00:00:50.644118,identity,16,62,0.006021941051646858,24,COMPLETE
427,0.00031592155573889613,2025-07-12 21:18:12.877550,2025-07-12 21:18:58.418403,0 days 00:00:45.540853,identity,16,45,0.005211180041704023,24,COMPLETE
428,0.0004148755979258567,2025-07-12 21:18:58.419216,2025-07-12 21:19:39.980979,0 days 00:00:41.561763,identity,16,40,0.00024652981826467043,23,COMPLETE
429,0.0003223122621420771,2025-07-12 21:19:39.981698,2025-07-12 21:20:20.562098,0 days 00:00:40.580400,identity,16,29,0.004854158119672235,24,COMPLETE
430,0.00032158292015083134,2025-07-12 21:20:20.562655,2025-07-12 21:21:06.214411,0 days 00:00:45.651756,identity,16,50,0.00695989746012112,24,COMPLETE
431,0.0003744384157471359,2025-07-12 21:21:06.215152,2025-07-12 21:21:44.525325,0 days 00:00:38.310173,identity,16,53,0.003661495786594584,11,COMPLETE
432,0.0003054860862903297,2025-07-12 21:21:44.525869,2025-07-12 21:22:25.841661,0 days 00:00:41.315792,identity,16,33,0.004124151326216558,24,COMPLETE
