number,value,datetime_start,datetime_complete,duration,params_activation,params_batch_size,params_lr,params_num_layers,params_size_layers,state
287,0.00038630032213404775,2025-07-12 17:40:20.876975,2025-07-12 17:40:35.492787,0 days 00:00:14.615812,identity,16,0.000844753062302422,1,110,COMPLETE
288,0.0003584754595067352,2025-07-12 17:40:35.493117,2025-07-12 17:40:50.123833,0 days 00:00:14.630716,identity,16,0.0006903013280787963,1,113,COMPLETE
289,0.00035765860229730606,2025-07-12 17:40:50.124390,2025-07-12 17:41:04.706880,0 days 00:00:14.582490,identity,16,0.0006351569521691516,1,116,COMPLETE
290,0.0003576137241907418,2025-07-12 17:41:04.707442,2025-07-12 17:41:19.289424,0 days 00:00:14.581982,identity,16,0.0006343693042544472,1,117,COMPLETE
291,0.0003676102787721902,2025-07-12 17:41:19.289981,2025-07-12 17:41:33.922213,0 days 00:00:14.632232,identity,16,0.0006331972288018504,1,117,COMPLETE
292,0.0003578127652872354,2025-07-12 17:41:33.922537,2025-07-12 17:41:48.555498,0 days 00:00:14.632961,identity,16,0.0006296369077181002,1,114,COMPLETE
293,0.0003575276641640812,2025-07-12 17:41:48.556052,2025-07-12 17:42:03.241483,0 days 00:00:14.685431,identity,16,0.0005730830438233225,1,116,COMPLETE
294,0.0004174518398940563,2025-07-12 17:42:03.242187,2025-07-12 17:42:08.577718,0 days 00:00:05.335531,identity,64,0.0006417905931560318,1,115,COMPLETE
295,0.0003588532854337245,2025-07-12 17:42:08.578048,2025-07-12 17:42:23.261805,0 days 00:00:14.683757,identity,16,0.0006016948763681133,1,112,COMPLETE
296,0.0003810953348875046,2025-07-12 17:42:23.262368,2025-07-12 17:42:43.120669,0 days 00:00:19.858301,identity,16,0.0005617842583532923,2,116,COMPLETE
297,0.00035798840690404177,2025-07-12 17:42:43.121185,2025-07-12 17:42:57.826118,0 days 00:00:14.704933,identity,16,0.0006864357521863874,1,117,COMPLETE
298,0.0003593314322642982,2025-07-12 17:42:57.826469,2025-07-12 17:43:12.510834,0 days 00:00:14.684365,identity,16,0.0006019540861832961,1,112,COMPLETE
299,0.0004891714779660106,2025-07-12 17:43:12.511371,2025-07-12 17:43:27.165646,0 days 00:00:14.654275,identity,16,0.0001380714459644049,1,115,COMPLETE
300,0.0005093479994684458,2025-07-12 17:43:27.166183,2025-07-12 17:43:35.791798,0 days 00:00:08.625615,identity,32,0.0006636084419250719,1,110,COMPLETE
301,0.00035754620330408216,2025-07-12 17:43:35.792133,2025-07-12 17:43:50.470657,0 days 00:00:14.678524,identity,16,0.000544055831535447,1,119,COMPLETE
302,0.0003604637167882174,2025-07-12 17:43:50.471043,2025-07-12 17:44:05.115243,0 days 00:00:14.644200,identity,16,0.0005486837811413479,1,74,COMPLETE
303,0.0003573760623112321,2025-07-12 17:44:05.115816,2025-07-12 17:44:19.798539,0 days 00:00:14.682723,identity,16,0.0007294887839187825,1,119,COMPLETE
304,1.6183620691299438,2025-07-12 17:44:19.799115,2025-07-12 17:44:35.267716,0 days 00:00:15.468601,relu,16,0.0007818220113281024,1,119,COMPLETE
305,0.0005122455768287182,2025-07-12 17:44:35.268044,2025-07-12 17:44:38.914282,0 days 00:00:03.646238,identity,128,0.0007242469118343349,1,121,COMPLETE
306,0.00035798002500087023,2025-07-12 17:44:38.914840,2025-07-12 17:44:53.553062,0 days 00:00:14.638222,identity,16,0.0006681854367606851,1,119,COMPLETE
307,0.00037378352135419846,2025-07-12 17:44:53.553398,2025-07-12 17:45:08.219621,0 days 00:00:14.666223,identity,16,0.0007655736132934334,1,124,COMPLETE
308,0.0003586919337976724,2025-07-12 17:45:08.220199,2025-07-12 17:45:22.895303,0 days 00:00:14.675104,identity,16,0.0005865118053810902,1,128,COMPLETE
309,0.000372296548448503,2025-07-12 17:45:22.895891,2025-07-12 17:45:37.546747,0 days 00:00:14.650856,identity,16,0.0008640808197695582,1,105,COMPLETE
310,0.0003578512114472687,2025-07-12 17:45:37.547092,2025-07-12 17:45:52.188398,0 days 00:00:14.641306,identity,16,0.0006298026708111901,1,119,COMPLETE
311,0.0003597988688852638,2025-07-12 17:45:52.188975,2025-07-12 17:46:06.824169,0 days 00:00:14.635194,identity,16,0.0005397701672126958,1,108,COMPLETE
312,0.00035890250001102686,2025-07-12 17:46:06.824746,2025-07-12 17:46:21.464567,0 days 00:00:14.639821,identity,16,0.0007008448049941617,1,113,COMPLETE
313,0.0003600963100325316,2025-07-12 17:46:21.465141,2025-07-12 17:46:36.006953,0 days 00:00:14.541812,identity,16,0.0013557804441778763,1,56,COMPLETE
314,0.00037484924541786313,2025-07-12 17:46:36.007305,2025-07-12 17:46:50.653225,0 days 00:00:14.645920,identity,16,0.0010404382399659047,1,123,COMPLETE
315,0.0003573647700250149,2025-07-12 17:46:50.653800,2025-07-12 17:47:05.387276,0 days 00:00:14.733476,identity,16,0.0005967440865800642,1,121,COMPLETE
316,0.00035955317434854805,2025-07-12 17:47:05.387857,2025-07-12 17:47:20.067509,0 days 00:00:14.679652,identity,16,0.0005764275468870829,1,121,COMPLETE
317,0.00036982595338486135,2025-07-12 17:47:20.068082,2025-07-12 17:47:39.922358,0 days 00:00:19.854276,identity,16,0.0005141599021192419,2,117,COMPLETE
318,0.00035831573768518865,2025-07-12 17:47:39.922889,2025-07-12 17:47:54.556574,0 days 00:00:14.633685,identity,16,0.0006104469945452479,1,120,COMPLETE
319,0.00036009232280775905,2025-07-12 17:47:54.556905,2025-07-12 17:48:09.184898,0 days 00:00:14.627993,identity,16,0.0005455684728445909,1,126,COMPLETE
320,0.0005143324378877878,2025-07-12 17:48:09.185264,2025-07-12 17:48:14.470591,0 days 00:00:05.285327,identity,64,0.0006408308696642736,1,118,COMPLETE
321,0.00035787204978987575,2025-07-12 17:48:14.470909,2025-07-12 17:48:29.118608,0 days 00:00:14.647699,identity,16,0.0005773714189952761,1,123,COMPLETE
322,0.00035857289913110435,2025-07-12 17:48:29.119135,2025-07-12 17:48:43.756554,0 days 00:00:14.637419,identity,16,0.000674850802041684,1,121,COMPLETE
323,0.00038821992347948253,2025-07-12 17:48:43.756938,2025-07-12 17:48:58.299579,0 days 00:00:14.542641,identity,16,0.0007696977402554941,1,45,COMPLETE
324,0.00035878588096238673,2025-07-12 17:48:58.299903,2025-07-12 17:49:12.910438,0 days 00:00:14.610535,identity,16,0.0005081585922617882,1,128,COMPLETE
325,0.0004962647217325866,2025-07-12 17:49:12.911014,2025-07-12 17:49:21.545718,0 days 00:00:08.634704,identity,32,0.0006098292074398424,1,124,COMPLETE
326,0.002770907711237669,2025-07-12 17:49:21.546305,2025-07-12 17:49:36.955975,0 days 00:00:15.409670,relu,16,0.0007063770377322472,1,114,COMPLETE
327,0.0003649023128673434,2025-07-12 17:49:36.956313,2025-07-12 17:49:51.609852,0 days 00:00:14.653539,identity,16,0.0005445327730273037,1,117,COMPLETE
328,0.0003582232748158276,2025-07-12 17:49:51.610429,2025-07-12 17:50:06.321132,0 days 00:00:14.710703,identity,16,0.002136150271530561,1,111,COMPLETE
329,0.00037655633059330285,2025-07-12 17:50:06.321719,2025-07-12 17:50:20.963463,0 days 00:00:14.641744,identity,16,0.00045116423104612884,1,119,COMPLETE
330,0.000357554730726406,2025-07-12 17:50:20.964053,2025-07-12 17:50:35.572311,0 days 00:00:14.608258,identity,16,0.0006597861492255257,1,115,COMPLETE
331,0.00038422111538238823,2025-07-12 17:50:35.572650,2025-07-12 17:50:41.236544,0 days 00:00:05.663894,identity,128,0.0005922918539099656,3,115,COMPLETE
332,0.0003663587267510593,2025-07-12 17:50:41.237094,2025-07-12 17:50:55.841316,0 days 00:00:14.604222,identity,16,0.0006390389516753747,1,117,COMPLETE
333,0.0003593838482629508,2025-07-12 17:50:55.841656,2025-07-12 17:51:10.467750,0 days 00:00:14.626094,identity,16,0.0008097731198654462,1,122,COMPLETE
334,0.0003580495831556618,2025-07-12 17:51:10.468114,2025-07-12 17:51:25.078318,0 days 00:00:14.610204,identity,16,0.000518267423318549,1,113,COMPLETE
335,0.000357740354957059,2025-07-12 17:51:25.078823,2025-07-12 17:51:39.717397,0 days 00:00:14.638574,identity,16,0.0007278032863900532,1,120,COMPLETE
336,0.00035771194961853325,2025-07-12 17:51:39.717778,2025-07-12 17:51:54.353635,0 days 00:00:14.635857,identity,16,0.0005662024455473731,1,125,COMPLETE
337,0.00044492437154985964,2025-07-12 17:51:54.353952,2025-07-12 17:52:08.951078,0 days 00:00:14.597126,identity,16,0.001528358111608597,1,116,COMPLETE
338,0.0003624928940553218,2025-07-12 17:52:08.951629,2025-07-12 17:52:23.595752,0 days 00:00:14.644123,identity,16,0.0006513327244550183,1,119,COMPLETE
339,0.00035770106478594244,2025-07-12 17:52:23.596335,2025-07-12 17:52:38.227461,0 days 00:00:14.631126,identity,16,0.0004760561539663719,1,113,COMPLETE
340,0.0003891780215781182,2025-07-12 17:52:38.227808,2025-07-12 17:53:07.106523,0 days 00:00:28.878715,identity,16,0.0006076346020388183,4,116,COMPLETE
341,0.00039512853254564106,2025-07-12 17:53:07.107145,2025-07-12 17:53:21.626029,0 days 00:00:14.518884,identity,16,0.0009814760174821234,1,20,COMPLETE
342,0.00038911012234166265,2025-07-12 17:53:21.626562,2025-07-12 17:53:36.277524,0 days 00:00:14.650962,identity,16,0.0011192160288788261,1,122,COMPLETE
343,0.0003577337774913758,2025-07-12 17:53:36.277867,2025-07-12 17:53:50.911533,0 days 00:00:14.633666,identity,16,0.0007143079882187523,1,125,COMPLETE
344,1.6183620691299438,2025-07-12 17:53:50.911914,2025-07-12 17:54:06.347584,0 days 00:00:15.435670,relu,16,0.0008632015434819199,1,111,COMPLETE
345,0.0005166693590581417,2025-07-12 17:54:06.348176,2025-07-12 17:54:11.654493,0 days 00:00:05.306317,identity,64,0.0005445452142996315,1,118,COMPLETE
346,0.0003588042454794049,2025-07-12 17:54:11.654834,2025-07-12 17:54:26.282851,0 days 00:00:14.628017,identity,16,0.0006633242402227037,1,114,COMPLETE
347,0.00038780373870395124,2025-07-12 17:54:26.283429,2025-07-12 17:54:45.172914,0 days 00:00:18.889485,identity,16,0.0007566377648399342,2,70,COMPLETE
348,0.0003595066082198173,2025-07-12 17:54:45.173475,2025-07-12 17:54:59.748498,0 days 00:00:14.575023,identity,16,0.0005984587364327966,1,94,COMPLETE
349,0.000357556069502607,2025-07-12 17:54:59.748871,2025-07-12 17:55:14.343222,0 days 00:00:14.594351,identity,16,0.0005114952727618872,1,128,COMPLETE
350,0.0005117706605233252,2025-07-12 17:55:14.343545,2025-07-12 17:55:22.946004,0 days 00:00:08.602459,identity,32,0.0004563972934861901,1,127,COMPLETE
351,0.0003864512837026268,2025-07-12 17:55:22.946530,2025-07-12 17:55:47.577577,0 days 00:00:24.631047,identity,16,0.0004915428847753672,3,128,COMPLETE
352,0.0003602469223551452,2025-07-12 17:55:47.577963,2025-07-12 17:56:02.241389,0 days 00:00:14.663426,identity,16,0.00040912651839251847,1,126,COMPLETE
353,0.00036927592009305954,2025-07-12 17:56:02.241920,2025-07-12 17:56:16.802626,0 days 00:00:14.560706,identity,16,0.000520878155922298,1,88,COMPLETE
354,0.00035950448364019394,2025-07-12 17:56:16.802979,2025-07-12 17:56:31.387421,0 days 00:00:14.584442,identity,16,0.0005657103993103622,1,124,COMPLETE
355,0.0003641772782430053,2025-07-12 17:56:31.387789,2025-07-12 17:56:45.957890,0 days 00:00:14.570101,identity,16,0.0005105078642048058,1,128,COMPLETE
356,0.0005143636371940374,2025-07-12 17:56:45.958444,2025-07-12 17:56:49.604719,0 days 00:00:03.646275,identity,128,0.0004362856429478022,1,121,COMPLETE
357,0.0003576320596039295,2025-07-12 17:56:49.605046,2025-07-12 17:57:04.252541,0 days 00:00:14.647495,identity,16,0.0005717220783854916,1,123,COMPLETE
358,0.0003681778034660965,2025-07-12 17:57:04.253119,2025-07-12 17:57:18.875138,0 days 00:00:14.622019,identity,16,0.00047563970013928604,1,124,COMPLETE
359,0.0003589465341065079,2025-07-12 17:57:18.875894,2025-07-12 17:57:33.479272,0 days 00:00:14.603378,identity,16,0.0005446777475737537,1,122,COMPLETE
360,0.00035954758641310036,2025-07-12 17:57:33.479615,2025-07-12 17:57:48.085262,0 days 00:00:14.605647,identity,16,0.0005668967824465719,1,125,COMPLETE
361,0.0003588203981053084,2025-07-12 17:57:48.085837,2025-07-12 17:58:02.682852,0 days 00:00:14.597015,identity,16,0.004970756605589051,1,126,COMPLETE
362,0.0003623737138696015,2025-07-12 17:58:02.683404,2025-07-12 17:58:17.269813,0 days 00:00:14.586409,identity,16,0.0005075142517953475,1,123,COMPLETE
363,0.0003583689103834331,2025-07-12 17:58:17.270132,2025-07-12 17:58:31.880620,0 days 00:00:14.610488,identity,16,0.0005999076679135291,1,119,COMPLETE
364,0.0004396617296151817,2025-07-12 17:58:31.881199,2025-07-12 17:58:47.299567,0 days 00:00:15.418368,relu,16,0.0006877718211958088,1,128,COMPLETE
365,0.0003730186144821346,2025-07-12 17:58:47.300156,2025-07-12 17:59:01.897437,0 days 00:00:14.597281,identity,16,0.0007732441510129266,1,121,COMPLETE
366,0.00035996735095977783,2025-07-12 17:59:01.898015,2025-07-12 17:59:16.504880,0 days 00:00:14.606865,identity,16,0.0008875054765255507,1,123,COMPLETE
367,0.0003646812110673636,2025-07-12 17:59:16.505225,2025-07-12 17:59:31.098967,0 days 00:00:14.593742,identity,16,0.0006232588878780397,1,120,COMPLETE
368,0.0003663579700514674,2025-07-12 17:59:31.099553,2025-07-12 17:59:45.700110,0 days 00:00:14.600557,identity,16,0.0005479211465212623,1,118,COMPLETE
369,0.00036131058004684746,2025-07-12 17:59:45.700691,2025-07-12 18:00:00.303758,0 days 00:00:14.603067,identity,16,0.0030424829999417835,1,115,COMPLETE
370,0.0004911988507956266,2025-07-12 18:00:00.304341,2025-07-12 18:00:05.599986,0 days 00:00:05.295645,identity,64,0.0012225861531099797,1,126,COMPLETE
371,0.000364518171409145,2025-07-12 18:00:05.600322,2025-07-12 18:00:25.377053,0 days 00:00:19.776731,identity,16,0.00048275584169862055,2,111,COMPLETE
372,0.0003622813383117318,2025-07-12 18:00:25.377604,2025-07-12 18:00:40.047436,0 days 00:00:14.669832,identity,16,0.0006890766443755777,1,123,COMPLETE
373,0.0003607052203733474,2025-07-12 18:00:40.047831,2025-07-12 18:00:54.680481,0 days 00:00:14.632650,identity,16,0.0005990662377569864,1,117,COMPLETE
374,0.00037162817898206413,2025-07-12 18:00:54.680808,2025-07-12 18:01:09.275808,0 days 00:00:14.595000,identity,16,0.00044538977107784825,1,120,COMPLETE
375,0.00035848512197844684,2025-07-12 18:01:09.276319,2025-07-12 18:01:23.933026,0 days 00:00:14.656707,identity,16,0.0008029607759502104,1,114,COMPLETE
376,0.00047581468243151903,2025-07-12 18:01:23.933424,2025-07-12 18:01:32.545845,0 days 00:00:08.612421,identity,32,0.0006454367633627656,1,126,COMPLETE
377,0.0003594065783545375,2025-07-12 18:01:32.546171,2025-07-12 18:01:47.167616,0 days 00:00:14.621445,identity,16,0.0005246081611820549,1,112,COMPLETE
378,0.00040266269934363663,2025-07-12 18:01:47.168202,2025-07-12 18:02:01.824914,0 days 00:00:14.656712,identity,16,0.0009283836322736359,1,121,COMPLETE
379,0.00035838436451740563,2025-07-12 18:02:01.825500,2025-07-12 18:02:16.464897,0 days 00:00:14.639397,identity,16,0.0005730525087231255,1,118,COMPLETE
380,0.0003579491749405861,2025-07-12 18:02:16.465242,2025-07-12 18:02:31.087458,0 days 00:00:14.622216,identity,16,0.000713126293826053,1,124,COMPLETE
381,0.0005102307768538594,2025-07-12 18:02:31.088048,2025-07-12 18:02:34.748680,0 days 00:00:03.660632,identity,128,0.0006475998913941238,1,109,COMPLETE
382,0.00039122856105677783,2025-07-12 18:02:34.749020,2025-07-12 18:02:49.363514,0 days 00:00:14.614494,identity,16,0.009857447563802265,1,128,COMPLETE
383,0.005709005519747734,2025-07-12 18:02:49.364117,2025-07-12 18:03:04.792323,0 days 00:00:15.428206,relu,16,0.0005790826621495268,1,115,COMPLETE
384,0.00035833893343806267,2025-07-12 18:03:04.792907,2025-07-12 18:03:19.396029,0 days 00:00:14.603122,identity,16,0.0005165223182847776,1,117,COMPLETE
385,0.00038773834239691496,2025-07-12 18:03:19.396618,2025-07-12 18:03:34.006414,0 days 00:00:14.609796,identity,16,0.0007100658790935032,1,113,COMPLETE
386,0.0003632479056250304,2025-07-12 18:03:34.006784,2025-07-12 18:03:48.677711,0 days 00:00:14.670927,identity,16,0.0006178568874533858,1,122,COMPLETE
387,0.00035855566966347396,2025-07-12 18:03:48.678324,2025-07-12 18:04:03.312500,0 days 00:00:14.634176,identity,16,0.0008176021670147542,1,110,COMPLETE
388,0.0003649172140285373,2025-07-12 18:04:03.313097,2025-07-12 18:04:17.940618,0 days 00:00:14.627521,identity,16,0.0004770734034038861,1,125,COMPLETE
389,0.000357960001565516,2025-07-12 18:04:17.940972,2025-07-12 18:04:32.546674,0 days 00:00:14.605702,identity,16,0.0005563222070323123,1,120,COMPLETE
390,0.0003583582292776555,2025-07-12 18:04:32.547289,2025-07-12 18:04:47.143759,0 days 00:00:14.596470,identity,16,0.0007554551754018974,1,116,COMPLETE
391,0.00035805001971311867,2025-07-12 18:04:47.144359,2025-07-12 18:05:01.737374,0 days 00:00:14.593015,identity,16,0.0006602840723869958,1,112,COMPLETE
392,0.00035874758032150567,2025-07-12 18:05:01.737969,2025-07-12 18:05:16.349815,0 days 00:00:14.611846,identity,16,0.0005896109708870053,1,123,COMPLETE
393,0.000364552135579288,2025-07-12 18:05:16.350163,2025-07-12 18:05:30.967441,0 days 00:00:14.617278,identity,16,0.000534184635302543,1,119,COMPLETE
394,0.00037475742283277214,2025-07-12 18:05:30.968043,2025-07-12 18:05:50.691984,0 days 00:00:19.723941,identity,16,0.0010137685704581486,2,114,COMPLETE
395,0.0005165899056009948,2025-07-12 18:05:50.692527,2025-07-12 18:05:55.986840,0 days 00:00:05.294313,identity,64,0.0006766050758086193,1,128,COMPLETE
396,0.0003600585332605988,2025-07-12 18:05:55.987192,2025-07-12 18:06:10.627329,0 days 00:00:14.640137,identity,16,0.00043643837984891365,1,118,COMPLETE
397,0.00035805118386633694,2025-07-12 18:06:10.627746,2025-07-12 18:06:25.276965,0 days 00:00:14.649219,identity,16,0.0006285823354157508,1,107,COMPLETE
398,0.00038854777812957764,2025-07-12 18:06:25.277493,2025-07-12 18:06:39.921255,0 days 00:00:14.643762,identity,16,0.0007583617992711368,1,121,COMPLETE
399,0.0005090326885692775,2025-07-12 18:06:39.921675,2025-07-12 18:06:48.545484,0 days 00:00:08.623809,identity,32,0.0005293372127328146,1,110,COMPLETE
400,0.0003579418989829719,2025-07-12 18:06:48.545819,2025-07-12 18:07:03.170593,0 days 00:00:14.624774,identity,16,0.00048199508220771474,1,125,COMPLETE
401,0.0003578274336177856,2025-07-12 18:07:03.171205,2025-07-12 18:07:17.800767,0 days 00:00:14.629562,identity,16,0.0005876680025623345,1,115,COMPLETE
402,0.0008408185094594955,2025-07-12 18:07:17.801119,2025-07-12 18:07:33.262551,0 days 00:00:15.461432,relu,16,0.0006952272721078105,1,117,COMPLETE
403,0.00035919391666539013,2025-07-12 18:07:33.263185,2025-07-12 18:07:47.859669,0 days 00:00:14.596484,identity,16,0.0008782083556337596,1,123,COMPLETE
404,0.00035829219268634915,2025-07-12 18:07:47.860279,2025-07-12 18:08:02.434644,0 days 00:00:14.574365,identity,16,0.0006246388504370932,1,112,COMPLETE
405,0.00043582834769040346,2025-07-12 18:08:02.435254,2025-07-12 18:08:07.216649,0 days 00:00:04.781395,identity,128,0.008442035766298641,2,126,COMPLETE
406,0.000361079815775156,2025-07-12 18:08:07.217029,2025-07-12 18:08:21.798014,0 days 00:00:14.580985,identity,16,0.0005547546274731291,1,99,COMPLETE
407,0.00035762443440034986,2025-07-12 18:08:21.798582,2025-07-12 18:08:36.411264,0 days 00:00:14.612682,identity,16,0.0008077670021402056,1,103,COMPLETE
408,0.00037612521555274725,2025-07-12 18:08:36.411634,2025-07-12 18:09:04.785377,0 days 00:00:28.373743,identity,16,0.0009674416192542269,4,102,COMPLETE
409,0.0003680014342535287,2025-07-12 18:09:04.786007,2025-07-12 18:09:19.386672,0 days 00:00:14.600665,identity,16,0.0008194111008230919,1,104,COMPLETE
410,0.0003956661676056683,2025-07-12 18:09:19.387100,2025-07-12 18:09:33.926448,0 days 00:00:14.539348,identity,16,0.0010678583476333074,1,99,COMPLETE
411,0.00035792923881672323,2025-07-12 18:09:33.926808,2025-07-12 18:09:48.517648,0 days 00:00:14.590840,identity,16,0.0008600524422829834,1,102,COMPLETE
412,0.000374203926185146,2025-07-12 18:09:48.518198,2025-07-12 18:10:03.116215,0 days 00:00:14.598017,identity,16,0.0007519663598291244,1,107,COMPLETE
413,0.00036459218244999647,2025-07-12 18:10:03.116635,2025-07-12 18:10:17.711103,0 days 00:00:14.594468,identity,16,0.0008034596715282043,1,106,COMPLETE
414,0.0003581367200240493,2025-07-12 18:10:17.711445,2025-07-12 18:10:32.235380,0 days 00:00:14.523935,identity,16,0.0003980429002375711,1,96,COMPLETE
415,0.0003930969978682697,2025-07-12 18:10:32.236000,2025-07-12 18:10:56.522516,0 days 00:00:24.286516,identity,16,0.000687754255748118,3,110,COMPLETE
416,0.0004902430227957666,2025-07-12 18:10:56.523107,2025-07-12 18:11:10.973950,0 days 00:00:14.450843,identity,16,0.0009546853766787836,1,9,COMPLETE
417,0.00035901510273106396,2025-07-12 18:11:10.974377,2025-07-12 18:11:25.562300,0 days 00:00:14.587923,identity,16,0.0007316385302308838,1,105,COMPLETE
418,0.00035808878601528704,2025-07-12 18:11:25.562845,2025-07-12 18:11:40.140615,0 days 00:00:14.577770,identity,16,0.0004958366386493444,1,114,COMPLETE
419,0.00041599420364946127,2025-07-12 18:11:40.141035,2025-07-12 18:11:45.430498,0 days 00:00:05.289463,identity,64,0.0006332024056095697,1,109,COMPLETE
420,0.00037302609416656196,2025-07-12 18:11:45.430841,2025-07-12 18:11:59.997900,0 days 00:00:14.567059,identity,16,0.0008297150470532224,1,116,COMPLETE
421,0.00038864678936079144,2025-07-12 18:11:59.998496,2025-07-12 18:12:14.602167,0 days 00:00:14.603671,identity,16,0.0007361674419496086,1,119,COMPLETE
422,0.0005179058061912656,2025-07-12 18:12:14.602522,2025-07-12 18:12:29.186977,0 days 00:00:14.584455,identity,16,0.00010280081449334677,1,101,COMPLETE
423,0.00037444906774908304,2025-07-12 18:12:29.187600,2025-07-12 18:12:44.582039,0 days 00:00:15.394439,relu,16,0.0005738416494313687,1,113,COMPLETE
424,0.0003582643112167716,2025-07-12 18:12:44.582649,2025-07-12 18:12:59.161717,0 days 00:00:14.579068,identity,16,0.0006631109416080351,1,104,COMPLETE
425,0.0003597513714339584,2025-07-12 18:12:59.162070,2025-07-12 18:13:13.755370,0 days 00:00:14.593300,identity,16,0.0005218675932711858,1,117,COMPLETE
426,0.0005088023608550429,2025-07-12 18:13:13.755982,2025-07-12 18:13:22.354770,0 days 00:00:08.598788,identity,32,0.00046367552735988784,1,108,COMPLETE
427,0.000419795309426263,2025-07-12 18:13:22.355387,2025-07-12 18:13:36.954107,0 days 00:00:14.598720,identity,16,0.0009019889065367693,1,120,COMPLETE
428,0.0003818507248070091,2025-07-12 18:13:36.954453,2025-07-12 18:13:51.592266,0 days 00:00:14.637813,identity,16,0.000690084666586285,1,111,COMPLETE
429,0.0003575454466044903,2025-07-12 18:13:51.592881,2025-07-12 18:14:06.158379,0 days 00:00:14.565498,identity,16,0.0005950848010286186,1,114,COMPLETE
