number,value,datetime_start,datetime_complete,duration,params_activation,params_batch_size,params_lr,params_num_layers,params_size_layers,state
430,0.0004901972133666277,2025-07-12 18:14:06.159016,2025-07-12 18:14:09.790642,0 days 00:00:03.631626,identity,128,0.0007674454072299751,1,114,COMPLETE
431,0.0003588456893339753,2025-07-12 18:14:09.790987,2025-07-12 18:14:24.345936,0 days 00:00:14.554949,identity,16,0.000629190394062337,1,112,COMPLETE
432,0.00035930771264247596,2025-07-12 18:14:24.346528,2025-07-12 18:14:38.946185,0 days 00:00:14.599657,identity,16,0.0006768391871634961,1,115,COMPLETE
433,0.00036705422098748386,2025-07-12 18:14:38.946535,2025-07-12 18:14:53.524157,0 days 00:00:14.577622,identity,16,0.0011382006952772824,1,110,COMPLETE
434,0.0003587347746361047,2025-07-12 18:14:53.524774,2025-07-12 18:15:08.119811,0 days 00:00:14.595037,identity,16,0.000525621985365596,1,116,COMPLETE
435,0.00039190647657960653,2025-07-12 18:15:08.120423,2025-07-12 18:15:27.818244,0 days 00:00:19.697821,identity,16,0.0006013914306504578,2,113,COMPLETE
436,0.0003661994996946305,2025-07-12 18:15:27.818816,2025-07-12 18:15:42.401450,0 days 00:00:14.582634,identity,16,0.0007938431757430951,1,108,COMPLETE
437,0.00036380396340973675,2025-07-12 18:15:42.401876,2025-07-12 18:15:56.889287,0 days 00:00:14.487411,identity,16,0.0007239496859650389,1,40,COMPLETE
438,0.0003593531728256494,2025-07-12 18:15:56.889633,2025-07-12 18:16:11.508603,0 days 00:00:14.618970,identity,16,0.0006229493992251971,1,118,COMPLETE
439,0.0003591061686165631,2025-07-12 18:16:11.509174,2025-07-12 18:16:26.098155,0 days 00:00:14.588981,identity,16,0.0005433647411373075,1,113,COMPLETE
440,0.000360794278094545,2025-07-12 18:16:26.098593,2025-07-12 18:16:40.717679,0 days 00:00:14.619086,identity,16,0.0004279052779712992,1,115,COMPLETE
441,0.0003590744163375348,2025-07-12 18:16:40.718287,2025-07-12 18:16:55.343140,0 days 00:00:14.624853,identity,16,0.000670825962357705,1,111,COMPLETE
442,0.00036051718052476645,2025-07-12 18:16:55.343487,2025-07-12 18:17:10.003764,0 days 00:00:14.660277,identity,16,0.000579644900748594,1,118,COMPLETE
443,0.003928775433450937,2025-07-12 18:17:10.004406,2025-07-12 18:17:25.375108,0 days 00:00:15.370702,relu,16,0.0009238334644699705,1,90,COMPLETE
444,0.0003829870547633618,2025-07-12 18:17:25.375720,2025-07-12 18:17:30.669812,0 days 00:00:05.294092,identity,64,0.0007441989085966976,1,107,COMPLETE
445,0.00042449022294022143,2025-07-12 18:17:30.670166,2025-07-12 18:17:52.461762,0 days 00:00:21.791596,identity,16,0.000505089744702125,3,49,COMPLETE
446,0.00035979095264337957,2025-07-12 18:17:52.462343,2025-07-12 18:18:07.069132,0 days 00:00:14.606789,identity,16,0.0006348135537038828,1,104,COMPLETE
447,0.0003590130072552711,2025-07-12 18:18:07.069547,2025-07-12 18:18:21.730472,0 days 00:00:14.660925,identity,16,0.0004659976643237751,1,116,COMPLETE
448,0.0003608873812481761,2025-07-12 18:18:21.731034,2025-07-12 18:18:36.388337,0 days 00:00:14.657303,identity,16,0.0005813621135509835,1,120,COMPLETE
449,0.00037636785418726504,2025-07-12 18:18:36.388699,2025-07-12 18:18:51.022644,0 days 00:00:14.633945,identity,16,0.0012892500783320076,1,100,COMPLETE
450,0.0005134788807481527,2025-07-12 18:18:51.023066,2025-07-12 18:18:59.648602,0 days 00:00:08.625536,identity,32,0.0007036948542989054,1,112,COMPLETE
451,0.00038593963836319745,2025-07-12 18:18:59.649210,2025-07-12 18:19:14.263800,0 days 00:00:14.614590,identity,16,0.0008388714045974613,1,110,COMPLETE
452,0.00035910800215788186,2025-07-12 18:19:14.264159,2025-07-12 18:19:28.921500,0 days 00:00:14.657341,identity,16,0.0005440067396406676,1,114,COMPLETE
453,0.00036005492438562214,2025-07-12 18:19:28.922112,2025-07-12 18:19:43.544703,0 days 00:00:14.622591,identity,16,0.0006393767935547778,1,117,COMPLETE
454,0.0004511399893090129,2025-07-12 18:19:43.545313,2025-07-12 18:19:58.185261,0 days 00:00:14.639948,identity,16,0.0007625598123396267,1,120,COMPLETE
455,0.0005144618335179985,2025-07-12 18:19:58.185633,2025-07-12 18:20:01.835523,0 days 00:00:03.649890,identity,128,0.0005939087944135808,1,98,COMPLETE
456,0.0003578769974410534,2025-07-12 18:20:01.836136,2025-07-12 18:20:16.460083,0 days 00:00:14.623947,identity,16,0.0004869518151465943,1,105,COMPLETE
457,0.000357741373591125,2025-07-12 18:20:16.460461,2025-07-12 18:20:31.105915,0 days 00:00:14.645454,identity,16,0.0006694927597715134,1,115,COMPLETE
458,0.0003689278964884579,2025-07-12 18:20:31.106549,2025-07-12 18:20:45.626963,0 days 00:00:14.520414,identity,16,0.0010052955418429345,1,31,COMPLETE
459,0.0003585843078326434,2025-07-12 18:20:45.627591,2025-07-12 18:21:00.232096,0 days 00:00:14.604505,identity,16,0.0005469143648846145,1,118,COMPLETE
460,1.6183620691299438,2025-07-12 18:21:00.232708,2025-07-12 18:21:15.667354,0 days 00:00:15.434646,relu,16,0.0008391215880347067,1,109,COMPLETE
461,0.0004308558127377182,2025-07-12 18:21:15.667726,2025-07-12 18:21:30.347849,0 days 00:00:14.680123,identity,16,0.0001749257135791772,1,122,COMPLETE
462,0.0003933985426556319,2025-07-12 18:21:30.348480,2025-07-12 18:21:44.992999,0 days 00:00:14.644519,identity,16,0.0005982513546913965,1,63,COMPLETE
463,0.00035756881698034704,2025-07-12 18:21:44.993636,2025-07-12 18:21:59.594868,0 days 00:00:14.601232,identity,16,0.000729408187938573,1,112,COMPLETE
464,0.00035788939567282796,2025-07-12 18:21:59.595498,2025-07-12 18:22:14.208135,0 days 00:00:14.612637,identity,16,0.0007025313168192881,1,113,COMPLETE
465,0.0003618575574364513,2025-07-12 18:22:14.208504,2025-07-12 18:22:28.797581,0 days 00:00:14.589077,identity,16,0.000642319068869532,1,112,COMPLETE
466,0.0003609781851992011,2025-07-12 18:22:28.798207,2025-07-12 18:22:43.406602,0 days 00:00:14.608395,identity,16,0.0005106315347452989,1,116,COMPLETE
467,0.00036233433638699353,2025-07-12 18:22:43.407230,2025-07-12 18:22:58.042403,0 days 00:00:14.635173,identity,16,0.000559086307977096,1,110,COMPLETE
468,0.00044316824642010033,2025-07-12 18:22:58.042781,2025-07-12 18:23:03.348974,0 days 00:00:05.306193,identity,64,0.0006941689126586147,1,77,COMPLETE
469,0.00035853104782290757,2025-07-12 18:23:03.349590,2025-07-12 18:23:17.972742,0 days 00:00:14.623152,identity,16,0.0004376100521876981,1,114,COMPLETE
470,0.00035979069070890546,2025-07-12 18:23:17.973123,2025-07-12 18:23:32.594566,0 days 00:00:14.621443,identity,16,0.0006157561248362726,1,119,COMPLETE
471,0.0003630769206210971,2025-07-12 18:23:32.595221,2025-07-12 18:23:47.186753,0 days 00:00:14.591532,identity,16,0.0007498683548708717,1,128,COMPLETE
472,0.000359438854502514,2025-07-12 18:23:47.187423,2025-07-12 18:24:01.780422,0 days 00:00:14.592999,identity,16,0.0005057224346339696,1,112,COMPLETE
473,0.000503599876537919,2025-07-12 18:24:01.781053,2025-07-12 18:24:10.379566,0 days 00:00:08.598513,identity,32,0.0006475724149304254,1,117,COMPLETE
474,0.0003636943001765758,2025-07-12 18:24:10.380030,2025-07-12 18:24:25.011678,0 days 00:00:14.631648,identity,16,0.0005691156895332272,1,121,COMPLETE
475,0.00040161682409234345,2025-07-12 18:24:25.012334,2025-07-12 18:24:44.553601,0 days 00:00:19.541267,identity,16,0.0007244200197360406,2,109,COMPLETE
476,0.00035827988176606596,2025-07-12 18:24:44.554192,2025-07-12 18:24:59.191203,0 days 00:00:14.637011,identity,16,0.0006025188540945862,1,114,COMPLETE
477,0.00036744496901519597,2025-07-12 18:24:59.191601,2025-07-12 18:25:13.810032,0 days 00:00:14.618431,identity,16,0.00046189842984172214,1,124,COMPLETE
478,0.00035855601890943944,2025-07-12 18:25:13.810464,2025-07-12 18:25:28.477219,0 days 00:00:14.666755,identity,16,0.0005361653112249149,1,116,COMPLETE
479,0.0005142809241078794,2025-07-12 18:25:28.477790,2025-07-12 18:25:32.137496,0 days 00:00:03.659706,identity,128,0.00039449528881680936,1,111,COMPLETE
480,1.6183620691299438,2025-07-12 18:25:32.137842,2025-07-12 18:25:47.645574,0 days 00:00:15.507732,relu,16,0.0006451742793765427,1,119,COMPLETE
481,0.00036303422530181706,2025-07-12 18:25:47.646003,2025-07-12 18:26:02.295849,0 days 00:00:14.649846,identity,16,0.0006746537914390571,1,121,COMPLETE
482,0.0003642481460701674,2025-07-12 18:26:02.296475,2025-07-12 18:26:16.918553,0 days 00:00:14.622078,identity,16,0.0007730109472221846,1,107,COMPLETE
483,0.0003621921641752124,2025-07-12 18:26:16.918922,2025-07-12 18:26:31.574422,0 days 00:00:14.655500,identity,16,0.000579132257484571,1,115,COMPLETE
484,0.00036783533869311213,2025-07-12 18:26:31.575085,2025-07-12 18:26:46.253315,0 days 00:00:14.678230,identity,16,0.0004900067650709326,1,126,COMPLETE
485,0.00036609984817914665,2025-07-12 18:26:46.253954,2025-07-12 18:27:00.862622,0 days 00:00:14.608668,identity,16,0.0008814904290512968,1,112,COMPLETE
486,0.0005110473721288145,2025-07-12 18:27:00.863275,2025-07-12 18:27:15.361927,0 days 00:00:14.498652,identity,16,0.0007011288761273362,1,16,COMPLETE
487,0.00040978670585900545,2025-07-12 18:27:15.362290,2025-07-12 18:27:44.865973,0 days 00:00:29.503683,identity,16,0.0006160423660982414,4,118,COMPLETE
488,0.0003589366388041526,2025-07-12 18:27:44.866636,2025-07-12 18:27:59.492305,0 days 00:00:14.625669,identity,16,0.0005492036392370811,1,122,COMPLETE
489,0.0003589701955206692,2025-07-12 18:27:59.492673,2025-07-12 18:28:14.119116,0 days 00:00:14.626443,identity,16,0.0005130483447800502,1,114,COMPLETE
490,0.0003756062069442123,2025-07-12 18:28:14.119684,2025-07-12 18:28:38.676378,0 days 00:00:24.556694,identity,16,0.0007651335979515677,3,128,COMPLETE
491,0.00035949653829447925,2025-07-12 18:28:38.676826,2025-07-12 18:28:53.323583,0 days 00:00:14.646757,identity,16,0.0006640375874759699,1,117,COMPLETE
492,0.0003574657312128693,2025-07-12 18:28:53.324163,2025-07-12 18:29:07.970896,0 days 00:00:14.646733,identity,16,0.0006015850712155693,1,110,COMPLETE
493,0.0005166757619008422,2025-07-12 18:29:07.971323,2025-07-12 18:29:13.291664,0 days 00:00:05.320341,identity,64,0.0005729999994381387,1,108,COMPLETE
494,0.00038239723653532565,2025-07-12 18:29:13.292009,2025-07-12 18:29:27.947046,0 days 00:00:14.655037,identity,16,0.00044519042554513384,1,109,COMPLETE
495,0.0003612639266066253,2025-07-12 18:29:27.947682,2025-07-12 18:29:42.617723,0 days 00:00:14.670041,identity,16,0.0005294394204586243,1,106,COMPLETE
496,0.0003764307766687125,2025-07-12 18:29:42.618354,2025-07-12 18:29:57.238665,0 days 00:00:14.620311,identity,16,0.0011568280198805021,1,111,COMPLETE
497,0.000357562123099342,2025-07-12 18:29:57.239035,2025-07-12 18:30:11.899550,0 days 00:00:14.660515,identity,16,0.0005975426102194775,1,109,COMPLETE
498,0.0005090230843052268,2025-07-12 18:30:11.900188,2025-07-12 18:30:20.525504,0 days 00:00:08.625316,identity,32,0.0005890214227639326,1,109,COMPLETE
499,0.006221887655556202,2025-07-12 18:30:20.526130,2025-07-12 18:30:35.927699,0 days 00:00:15.401569,relu,16,0.0004870912216269998,1,107,COMPLETE
