number,value,datetime_start,datetime_complete,duration,params_and_operator,params_batch_size,params_lr,params_n_sets_protein,params_n_sets_salt,params_shape,state
301,0.82,2025-08-26 12:38:57.886771,2025-08-26 12:39:00.531282,0 days 00:00:02.644511,min,16,0.0008418673846302534,3,7,bell,COMPLETE
302,0.45272727272727276,2025-08-26 12:39:00.531630,2025-08-26 12:39:03.176116,0 days 00:00:02.644486,min,16,1.236785110843647e-05,3,7,bell,COMPLETE
303,0.82,2025-08-26 12:39:03.176462,2025-08-26 12:39:05.642003,0 days 00:00:02.465541,prod,16,0.0009269463228442153,3,6,gaussian,COMPLETE
304,0.78,2025-08-26 12:39:05.642343,2025-08-26 12:39:08.284903,0 days 00:00:02.642560,min,16,0.0005392063471055958,3,7,bell,COMPLETE
305,0.8018181818181818,2025-08-26 12:39:08.285244,2025-08-26 12:39:11.373426,0 days 00:00:03.088182,min,16,0.0007952326136237384,4,7,bell,COMPLETE
306,0.8399999999999999,2025-08-26 12:39:11.373762,2025-08-26 12:39:14.019889,0 days 00:00:02.646127,min,16,0.0007162404801307958,3,7,bell,COMPLETE
307,0.72,2025-08-26 12:39:14.020241,2025-08-26 12:39:15.524361,0 days 00:00:01.504120,min,32,0.0008479062385571651,3,6,sigmoid,COMPLETE
308,0.8018181818181818,2025-08-26 12:39:15.524686,2025-08-26 12:39:17.714856,0 days 00:00:02.190170,min,16,0.0009943979796741289,2,7,bell,COMPLETE
309,0.8399999999999999,2025-08-26 12:39:17.715188,2025-08-26 12:39:20.172676,0 days 00:00:02.457488,min,16,0.0009174834394474436,3,7,gaussian,COMPLETE
310,0.8399999999999999,2025-08-26 12:39:20.173038,2025-08-26 12:39:22.817459,0 days 00:00:02.644421,min,16,0.0007590100669981059,3,7,bell,COMPLETE
311,0.8399999999999999,2025-08-26 12:39:22.817791,2025-08-26 12:39:25.604413,0 days 00:00:02.786622,prod,16,0.0006514874884671092,3,7,bell,COMPLETE
312,0.82,2025-08-26 12:39:25.604754,2025-08-26 12:39:28.690846,0 days 00:00:03.086092,min,16,0.0005771683471391251,4,7,bell,COMPLETE
313,0.8036363636363635,2025-08-26 12:39:28.691185,2025-08-26 12:39:31.142626,0 days 00:00:02.451441,min,16,0.0008462251608162723,3,6,bell,COMPLETE
314,0.8399999999999999,2025-08-26 12:39:31.142961,2025-08-26 12:39:33.601315,0 days 00:00:02.458354,min,16,0.0009301109455856427,3,7,gaussian,COMPLETE
315,0.7854545454545454,2025-08-26 12:39:33.601678,2025-08-26 12:39:36.246503,0 days 00:00:02.644825,min,16,0.0006997044183871906,3,7,bell,COMPLETE
316,0.8399999999999999,2025-08-26 12:39:36.246849,2025-08-26 12:39:38.697373,0 days 00:00:02.450524,min,16,0.0009994425536198467,3,6,bell,COMPLETE
317,0.8399999999999999,2025-08-26 12:39:38.697697,2025-08-26 12:39:42.238648,0 days 00:00:03.540951,min,16,0.0007811809566620167,5,7,bell,COMPLETE
318,0.6472727272727272,2025-08-26 12:39:42.238985,2025-08-26 12:39:44.885172,0 days 00:00:02.646187,min,16,0.0002249917274430876,3,7,bell,COMPLETE
319,0.76,2025-08-26 12:39:44.885510,2025-08-26 12:39:45.878632,0 days 00:00:00.993122,prod,64,0.000861039732360221,3,7,gaussian,COMPLETE
320,0.82,2025-08-26 12:39:45.878947,2025-08-26 12:39:48.522131,0 days 00:00:02.643184,min,16,0.0008000898831716647,3,7,bell,COMPLETE
321,0.7854545454545454,2025-08-26 12:39:48.522480,2025-08-26 12:39:50.904696,0 days 00:00:02.382216,min,16,0.0009092773415291302,3,7,sigmoid,COMPLETE
322,0.82,2025-08-26 12:39:50.905041,2025-08-26 12:39:53.354962,0 days 00:00:02.449921,min,16,0.0006211523856743782,3,6,bell,COMPLETE
323,0.8,2025-08-26 12:39:53.355300,2025-08-26 12:39:56.441347,0 days 00:00:03.086047,min,16,0.0007154389675574174,4,7,bell,COMPLETE
324,0.8,2025-08-26 12:39:56.441698,2025-08-26 12:39:59.085357,0 days 00:00:02.643659,min,16,0.0008347252016497027,3,7,bell,COMPLETE
325,0.5836363636363637,2025-08-26 12:39:59.085706,2025-08-26 12:40:00.957308,0 days 00:00:01.871602,min,16,0.00018048990381769176,2,6,gaussian,COMPLETE
326,0.76,2025-08-26 12:40:00.957650,2025-08-26 12:40:04.045060,0 days 00:00:03.087410,min,16,0.0007587433705372403,4,7,bell,COMPLETE
327,0.44363636363636366,2025-08-26 12:40:04.045404,2025-08-26 12:40:06.832950,0 days 00:00:02.787546,prod,16,0.00010106300788824029,3,7,bell,COMPLETE
328,0.76,2025-08-26 12:40:06.833293,2025-08-26 12:40:08.893273,0 days 00:00:02.059980,min,16,0.0009240926159600606,3,4,bell,COMPLETE
329,0.78,2025-08-26 12:40:08.893613,2025-08-26 12:40:11.151368,0 days 00:00:02.257755,min,16,0.0008583683331019047,3,5,bell,COMPLETE
330,0.6836363636363637,2025-08-26 12:40:11.151718,2025-08-26 12:40:12.839924,0 days 00:00:01.688206,min,32,0.0006645678821932997,3,7,gaussian,COMPLETE
331,0.82,2025-08-26 12:40:12.840262,2025-08-26 12:40:15.485079,0 days 00:00:02.644817,min,16,0.000989744836004236,3,7,bell,COMPLETE
332,0.7436363636363637,2025-08-26 12:40:15.485430,2025-08-26 12:40:17.677856,0 days 00:00:02.192426,min,16,0.0007453088130590201,3,6,sigmoid,COMPLETE
333,0.5599999999999999,2025-08-26 12:40:17.678186,2025-08-26 12:40:20.323665,0 days 00:00:02.645479,min,16,0.00013250229646154243,3,7,bell,COMPLETE
334,0.7799999999999999,2025-08-26 12:40:20.324007,2025-08-26 12:40:22.969587,0 days 00:00:02.645580,min,16,0.0008185002020038697,3,7,bell,COMPLETE
335,0.8399999999999999,2025-08-26 12:40:22.969942,2025-08-26 12:40:26.250586,0 days 00:00:03.280644,prod,16,0.0009127090679688426,4,7,bell,COMPLETE
336,0.82,2025-08-26 12:40:26.250937,2025-08-26 12:40:28.709726,0 days 00:00:02.458789,min,16,0.0005882439444350599,3,7,gaussian,COMPLETE
337,0.8018181818181818,2025-08-26 12:40:28.710062,2025-08-26 12:40:30.769057,0 days 00:00:02.058995,min,16,0.000671988483283328,2,6,bell,COMPLETE
338,0.8399999999999999,2025-08-26 12:40:30.769323,2025-08-26 12:40:33.412260,0 days 00:00:02.642937,min,16,0.0009998124802555592,3,7,bell,COMPLETE
339,0.8018181818181818,2025-08-26 12:40:33.412613,2025-08-26 12:40:36.057376,0 days 00:00:02.644763,min,16,0.0007949660913383385,3,7,bell,COMPLETE
340,0.82,2025-08-26 12:40:36.057719,2025-08-26 12:40:39.599355,0 days 00:00:03.541636,min,16,0.0008764167446143996,5,7,bell,COMPLETE
341,0.6072727272727272,2025-08-26 12:40:39.599712,2025-08-26 12:40:40.441953,0 days 00:00:00.842241,min,64,0.0004846891870355763,3,6,gaussian,COMPLETE
342,0.82,2025-08-26 12:40:40.442255,2025-08-26 12:40:43.088433,0 days 00:00:02.646178,min,16,0.0007295852885998758,3,7,bell,COMPLETE
343,0.7672727272727272,2025-08-26 12:40:43.088790,2025-08-26 12:40:45.875745,0 days 00:00:02.786955,prod,16,0.0009133618768014113,3,7,bell,COMPLETE
344,0.82,2025-08-26 12:40:45.876089,2025-08-26 12:40:49.883476,0 days 00:00:04.007387,min,16,0.0007930523353681696,6,7,bell,COMPLETE
345,0.8399999999999999,2025-08-26 12:40:49.883834,2025-08-26 12:40:52.268846,0 days 00:00:02.385012,min,16,0.000858661138537022,3,7,sigmoid,COMPLETE
346,0.7654545454545454,2025-08-26 12:40:52.269192,2025-08-26 12:40:54.721629,0 days 00:00:02.452437,min,16,0.0006815794777923547,3,6,bell,COMPLETE
347,0.74,2025-08-26 12:40:54.721964,2025-08-26 12:40:56.393095,0 days 00:00:01.671131,min,16,0.0005307802944937131,3,3,gaussian,COMPLETE
348,0.34545454545454546,2025-08-26 12:40:56.393401,2025-08-26 12:40:59.482719,0 days 00:00:03.089318,min,16,2.8254780853668523e-05,4,7,bell,COMPLETE
349,0.8399999999999999,2025-08-26 12:40:59.483074,2025-08-26 12:41:02.130138,0 days 00:00:02.647064,min,16,0.0006137085577727474,3,7,bell,COMPLETE
350,0.8218181818181817,2025-08-26 12:41:02.130484,2025-08-26 12:41:04.778490,0 days 00:00:02.648006,min,16,0.0009999888811344899,3,7,bell,COMPLETE
351,0.7454545454545454,2025-08-26 12:41:04.778835,2025-08-26 12:41:06.544454,0 days 00:00:01.765619,prod,32,0.0007493823467015131,3,6,bell,COMPLETE
352,0.8399999999999999,2025-08-26 12:41:06.544795,2025-08-26 12:41:09.007815,0 days 00:00:02.463020,min,16,0.0008542010735318632,3,7,gaussian,COMPLETE
353,0.82,2025-08-26 12:41:09.008160,2025-08-26 12:41:12.551377,0 days 00:00:03.543217,min,16,0.0009261002523107992,5,7,bell,COMPLETE
354,0.7854545454545454,2025-08-26 12:41:12.551719,2025-08-26 12:41:15.643358,0 days 00:00:03.091639,min,16,0.0007883504719386226,4,7,bell,COMPLETE
355,0.86,2025-08-26 12:41:15.643708,2025-08-26 12:41:18.291194,0 days 00:00:02.647486,min,16,0.000726812252793385,3,7,bell,COMPLETE
356,0.8,2025-08-26 12:41:18.291539,2025-08-26 12:41:20.354819,0 days 00:00:02.063280,min,16,0.0006578241970749013,2,6,bell,COMPLETE
357,0.82,2025-08-26 12:41:20.355160,2025-08-26 12:41:23.001368,0 days 00:00:02.646208,min,16,0.0007115478629781994,3,7,bell,COMPLETE
358,0.650909090909091,2025-08-26 12:41:23.001722,2025-08-26 12:41:25.387306,0 days 00:00:02.385584,min,16,0.0005971804213435467,3,7,sigmoid,COMPLETE
359,0.8399999999999999,2025-08-26 12:41:25.387650,2025-08-26 12:41:27.848650,0 days 00:00:02.461000,min,16,0.0009092368515555718,3,7,gaussian,COMPLETE
360,0.8036363636363635,2025-08-26 12:41:27.849016,2025-08-26 12:41:30.638976,0 days 00:00:02.789960,prod,16,0.0008481385605115402,3,7,bell,COMPLETE
361,0.78,2025-08-26 12:41:30.639299,2025-08-26 12:41:33.474010,0 days 00:00:02.834711,min,16,0.0007195209534711737,4,6,bell,COMPLETE
362,0.82,2025-08-26 12:41:33.474354,2025-08-26 12:41:36.123244,0 days 00:00:02.648890,min,16,0.0009328352318432573,3,7,bell,COMPLETE
363,0.6636363636363637,2025-08-26 12:41:36.123592,2025-08-26 12:41:37.101905,0 days 00:00:00.978313,min,64,0.0009951135270096245,3,7,bell,COMPLETE
364,0.8399999999999999,2025-08-26 12:41:37.102229,2025-08-26 12:41:39.563483,0 days 00:00:02.461254,min,16,0.0007839574115592244,3,7,gaussian,COMPLETE
365,0.82,2025-08-26 12:41:39.563841,2025-08-26 12:41:42.213122,0 days 00:00:02.649281,min,16,0.0005604835038819286,3,7,bell,COMPLETE
366,0.8399999999999999,2025-08-26 12:41:42.213484,2025-08-26 12:41:44.670818,0 days 00:00:02.457334,min,16,0.0008421232114278771,3,6,bell,COMPLETE
367,0.7018181818181818,2025-08-26 12:41:44.671182,2025-08-26 12:41:47.320758,0 days 00:00:02.649576,min,16,0.00040249315223383385,3,7,bell,COMPLETE
368,0.7799999999999999,2025-08-26 12:41:47.321110,2025-08-26 12:41:50.113725,0 days 00:00:02.792615,prod,16,0.0006423220293545558,3,7,bell,COMPLETE
369,0.8,2025-08-26 12:41:50.114083,2025-08-26 12:41:52.574396,0 days 00:00:02.460313,min,16,0.0007479705553902484,3,7,gaussian,COMPLETE
370,0.8399999999999999,2025-08-26 12:41:52.574748,2025-08-26 12:41:55.798424,0 days 00:00:03.223676,min,16,0.0008771759405818632,5,6,bell,COMPLETE
371,0.8218181818181817,2025-08-26 12:41:55.798763,2025-08-26 12:41:58.625367,0 days 00:00:02.826604,min,16,0.0009994413805637704,4,7,sigmoid,COMPLETE
372,0.761818181818182,2025-08-26 12:41:58.625723,2025-08-26 12:42:00.886438,0 days 00:00:02.260715,min,16,0.0006933412012122553,3,5,bell,COMPLETE
373,0.82,2025-08-26 12:42:00.886791,2025-08-26 12:42:03.535746,0 days 00:00:02.648955,min,16,0.0008008747035330544,3,7,bell,COMPLETE
374,0.72,2025-08-26 12:42:03.536105,2025-08-26 12:42:05.352205,0 days 00:00:01.816100,min,32,0.0009099384002613842,3,7,bell,COMPLETE
375,0.8036363636363635,2025-08-26 12:42:05.352565,2025-08-26 12:42:07.815684,0 days 00:00:02.463119,min,16,0.0008200805421924609,3,7,gaussian,COMPLETE
376,0.7799999999999999,2025-08-26 12:42:07.816052,2025-08-26 12:42:09.961624,0 days 00:00:02.145572,prod,16,0.0007326370016290856,2,6,bell,COMPLETE
377,0.7799999999999999,2025-08-26 12:42:09.961972,2025-08-26 12:42:13.053667,0 days 00:00:03.091695,min,16,0.0006328911102201376,4,7,bell,COMPLETE
378,0.8399999999999999,2025-08-26 12:42:13.054031,2025-08-26 12:42:15.702788,0 days 00:00:02.648757,min,16,0.0009047186185726391,3,7,bell,COMPLETE
379,0.8399999999999999,2025-08-26 12:42:15.703147,2025-08-26 12:42:18.352889,0 days 00:00:02.649742,min,16,0.0007949698936138232,3,7,bell,COMPLETE
380,0.29818181818181816,2025-08-26 12:42:18.353245,2025-08-26 12:42:21.736554,0 days 00:00:03.383309,min,16,8.120440719236971e-05,6,6,gaussian,COMPLETE
381,0.78,2025-08-26 12:42:21.736939,2025-08-26 12:42:23.798597,0 days 00:00:02.061658,min,16,0.0009969331876417264,3,4,bell,COMPLETE
382,0.8399999999999999,2025-08-26 12:42:23.798951,2025-08-26 12:42:26.446757,0 days 00:00:02.647806,min,16,0.0008605676170873765,3,7,bell,COMPLETE
383,0.649090909090909,2025-08-26 12:42:26.447123,2025-08-26 12:42:28.833828,0 days 00:00:02.386705,min,16,0.0004626546821706129,3,7,sigmoid,COMPLETE
384,0.6199999999999999,2025-08-26 12:42:28.834193,2025-08-26 12:42:32.118152,0 days 00:00:03.283959,prod,16,0.0003156166943587976,4,7,bell,COMPLETE
385,0.8,2025-08-26 12:42:32.118520,2025-08-26 12:42:34.767936,0 days 00:00:02.649416,min,16,0.0006828911513459406,3,7,bell,COMPLETE
386,0.82,2025-08-26 12:42:34.768294,2025-08-26 12:42:37.035831,0 days 00:00:02.267537,min,16,0.0007486639975563163,3,6,gaussian,COMPLETE
387,0.66,2025-08-26 12:42:37.036192,2025-08-26 12:42:38.013595,0 days 00:00:00.977403,min,64,0.0009237660634298111,3,7,bell,COMPLETE
388,0.8,2025-08-26 12:42:38.013960,2025-08-26 12:42:41.558019,0 days 00:00:03.544059,min,16,0.0005535817377070217,5,7,bell,COMPLETE
389,0.7836363636363636,2025-08-26 12:42:41.558387,2025-08-26 12:42:43.753735,0 days 00:00:02.195348,min,16,0.0008320429297924588,2,7,bell,COMPLETE
390,0.8,2025-08-26 12:42:43.754066,2025-08-26 12:42:46.208842,0 days 00:00:02.454776,min,16,0.0006272875744937938,3,6,bell,COMPLETE
391,0.7836363636363636,2025-08-26 12:42:46.209170,2025-08-26 12:42:48.671103,0 days 00:00:02.461933,min,16,0.0007502988404395964,3,7,gaussian,COMPLETE
392,0.8399999999999999,2025-08-26 12:42:48.671469,2025-08-26 12:42:51.957253,0 days 00:00:03.285784,prod,16,0.000918063360808415,4,7,bell,COMPLETE
393,0.7036363636363635,2025-08-26 12:42:51.957620,2025-08-26 12:42:56.362145,0 days 00:00:04.404525,min,16,0.000685255257542494,7,7,bell,COMPLETE
394,0.8399999999999999,2025-08-26 12:42:56.362512,2025-08-26 12:42:58.817307,0 days 00:00:02.454795,min,16,0.000816083095327775,3,6,bell,COMPLETE
395,0.8399999999999999,2025-08-26 12:42:58.817670,2025-08-26 12:43:01.203551,0 days 00:00:02.385881,min,16,0.0009332878294870969,3,7,sigmoid,COMPLETE
396,0.7218181818181819,2025-08-26 12:43:01.203917,2025-08-26 12:43:02.759089,0 days 00:00:01.555172,min,32,0.0008529002858626081,3,5,bell,COMPLETE
397,0.6272727272727273,2025-08-26 12:43:02.759442,2025-08-26 12:43:04.246059,0 days 00:00:01.486617,min,16,0.0007716485817574322,3,2,gaussian,COMPLETE
398,0.82,2025-08-26 12:43:04.246418,2025-08-26 12:43:06.895118,0 days 00:00:02.648700,min,16,0.0009952408764189297,3,7,bell,COMPLETE
399,0.8,2025-08-26 12:43:06.895478,2025-08-26 12:43:09.543831,0 days 00:00:02.648353,min,16,0.0007122142214724911,3,7,bell,COMPLETE
400,0.7836363636363636,2025-08-26 12:43:09.544193,2025-08-26 12:43:12.000029,0 days 00:00:02.455836,min,16,0.0008558908931826015,3,6,bell,COMPLETE
401,0.82,2025-08-26 12:43:12.000384,2025-08-26 12:43:14.792320,0 days 00:00:02.791936,prod,16,0.000614753045594217,3,7,bell,COMPLETE
402,0.82,2025-08-26 12:43:14.792683,2025-08-26 12:43:17.253438,0 days 00:00:02.460755,min,16,0.0009061749117007471,3,7,gaussian,COMPLETE
403,0.74,2025-08-26 12:43:17.253811,2025-08-26 12:43:20.345827,0 days 00:00:03.092016,min,16,0.0005218969589685744,4,7,bell,COMPLETE
404,0.78,2025-08-26 12:43:20.346193,2025-08-26 12:43:22.994103,0 days 00:00:02.647910,min,16,0.000786013026175326,3,7,bell,COMPLETE
405,0.7836363636363636,2025-08-26 12:43:22.994463,2025-08-26 12:43:25.449391,0 days 00:00:02.454928,min,16,0.0006792414856255124,3,6,bell,COMPLETE
406,0.7836363636363636,2025-08-26 12:43:25.449752,2025-08-26 12:43:28.098190,0 days 00:00:02.648438,min,16,0.0009275436807677818,3,7,bell,COMPLETE
407,0.8399999999999999,2025-08-26 12:43:28.098559,2025-08-26 12:43:30.560688,0 days 00:00:02.462129,min,16,0.0008334588672987174,3,7,gaussian,COMPLETE
408,0.74,2025-08-26 12:43:30.561067,2025-08-26 12:43:32.759791,0 days 00:00:02.198724,min,16,0.0003521911076110904,2,7,bell,COMPLETE
409,0.7799999999999999,2025-08-26 12:43:32.760149,2025-08-26 12:43:35.293467,0 days 00:00:02.533318,prod,16,0.000744876100780646,3,7,sigmoid,COMPLETE
410,0.30727272727272725,2025-08-26 12:43:35.293839,2025-08-26 12:43:38.518478,0 days 00:00:03.224639,min,16,5.102784842075611e-05,5,6,bell,COMPLETE
411,0.7054545454545454,2025-08-26 12:43:38.518833,2025-08-26 12:43:39.495270,0 days 00:00:00.976437,min,64,0.000995779060251737,3,7,bell,COMPLETE
412,0.8799999999999999,2025-08-26 12:43:39.495506,2025-08-26 12:43:42.143617,0 days 00:00:02.648111,min,16,0.0005724451042355112,3,7,bell,COMPLETE
413,0.8399999999999999,2025-08-26 12:43:42.143980,2025-08-26 12:43:44.792427,0 days 00:00:02.648447,min,16,0.0005057218099721119,3,7,bell,COMPLETE
414,0.8399999999999999,2025-08-26 12:43:44.792801,2025-08-26 12:43:47.256010,0 days 00:00:02.463209,min,16,0.0005682060850012209,3,7,gaussian,COMPLETE
415,0.78,2025-08-26 12:43:47.256377,2025-08-26 12:43:49.713581,0 days 00:00:02.457204,min,16,0.0005701370088616712,3,6,bell,COMPLETE
416,0.82,2025-08-26 12:43:49.713951,2025-08-26 12:43:52.364680,0 days 00:00:02.650729,min,16,0.0005859363394657858,3,7,bell,COMPLETE
417,0.8399999999999999,2025-08-26 12:43:52.365056,2025-08-26 12:43:55.157947,0 days 00:00:02.792891,prod,16,0.0006387474163797285,3,7,bell,COMPLETE
418,0.82,2025-08-26 12:43:55.158314,2025-08-26 12:43:57.807133,0 days 00:00:02.648819,min,16,0.0006677743884680127,3,7,bell,COMPLETE
419,0.7818181818181819,2025-08-26 12:43:57.807489,2025-08-26 12:44:00.268513,0 days 00:00:02.461024,min,16,0.0004860195203287079,3,7,gaussian,COMPLETE
420,0.8,2025-08-26 12:44:00.268879,2025-08-26 12:44:02.726123,0 days 00:00:02.457244,min,16,0.0007280594916043704,3,6,bell,COMPLETE
421,0.7654545454545454,2025-08-26 12:44:02.726476,2025-08-26 12:44:04.541822,0 days 00:00:01.815346,min,32,0.0006560478102348736,3,7,bell,COMPLETE
422,0.8054545454545454,2025-08-26 12:44:04.542190,2025-08-26 12:44:06.541315,0 days 00:00:01.999125,min,16,0.0007900839561025908,3,5,sigmoid,COMPLETE
423,0.8399999999999999,2025-08-26 12:44:06.541664,2025-08-26 12:44:09.189361,0 days 00:00:02.647697,min,16,0.0007097388823194723,3,7,bell,COMPLETE
424,0.82,2025-08-26 12:44:09.189715,2025-08-26 12:44:11.838960,0 days 00:00:02.649245,min,16,0.0008558866237552842,3,7,bell,COMPLETE
425,0.7854545454545454,2025-08-26 12:44:11.839323,2025-08-26 12:44:14.263565,0 days 00:00:02.424242,prod,16,0.0006076394857170195,3,6,gaussian,COMPLETE
426,0.8399999999999999,2025-08-26 12:44:14.263945,2025-08-26 12:44:16.915471,0 days 00:00:02.651526,min,16,0.0005441077489217988,3,7,bell,COMPLETE
427,0.8399999999999999,2025-08-26 12:44:16.915843,2025-08-26 12:44:19.565969,0 days 00:00:02.650126,min,16,0.0007832409339628377,3,7,bell,COMPLETE
428,0.82,2025-08-26 12:44:19.566335,2025-08-26 12:44:22.216438,0 days 00:00:02.650103,min,16,0.0008593095254354768,3,7,bell,COMPLETE
429,0.82,2025-08-26 12:44:22.216820,2025-08-26 12:44:24.867135,0 days 00:00:02.650315,min,16,0.0007026189287919853,3,7,bell,COMPLETE
430,0.5072727272727272,2025-08-26 12:44:24.867510,2025-08-26 12:44:25.712193,0 days 00:00:00.844683,min,64,0.0004273300238859996,3,6,gaussian,COMPLETE
431,0.8399999999999999,2025-08-26 12:44:25.712524,2025-08-26 12:44:28.365219,0 days 00:00:02.652695,min,16,0.0007608475938130834,3,7,bell,COMPLETE
432,0.76,2025-08-26 12:44:28.365589,2025-08-26 12:44:31.015259,0 days 00:00:02.649670,min,16,0.0008940648844142237,3,7,bell,COMPLETE
433,0.7290909090909091,2025-08-26 12:44:31.015634,2025-08-26 12:44:33.160989,0 days 00:00:02.145355,prod,16,0.0006335339634430993,2,6,bell,COMPLETE
434,0.78,2025-08-26 12:44:33.161342,2025-08-26 12:44:35.546481,0 days 00:00:02.385139,min,16,0.00083991049855658,3,7,sigmoid,COMPLETE
435,0.76,2025-08-26 12:44:35.546827,2025-08-26 12:44:38.196415,0 days 00:00:02.649588,min,16,0.0007794485550398563,3,7,bell,COMPLETE
436,0.3,2025-08-26 12:44:38.196783,2025-08-26 12:44:40.657657,0 days 00:00:02.460874,min,16,3.4935938171780006e-05,3,7,gaussian,COMPLETE
437,0.8018181818181818,2025-08-26 12:44:40.658035,2025-08-26 12:44:44.668765,0 days 00:00:04.010730,min,16,0.0009206717295718048,6,7,bell,COMPLETE
438,0.8036363636363635,2025-08-26 12:44:44.669147,2025-08-26 12:44:47.896332,0 days 00:00:03.227185,min,16,0.0006964992055171766,5,6,bell,COMPLETE
439,0.7036363636363636,2025-08-26 12:44:47.896716,2025-08-26 12:44:50.545079,0 days 00:00:02.648363,min,16,0.0001937923373375199,3,7,bell,COMPLETE
440,0.8399999999999999,2025-08-26 12:44:50.545455,2025-08-26 12:44:53.195425,0 days 00:00:02.649970,min,16,0.0008063955205433142,3,7,bell,COMPLETE
441,0.8,2025-08-26 12:44:53.195802,2025-08-26 12:44:55.658763,0 days 00:00:02.462961,min,16,0.0009184836652562606,3,7,gaussian,COMPLETE
442,0.7854545454545454,2025-08-26 12:44:55.659134,2025-08-26 12:44:58.452474,0 days 00:00:02.793340,prod,16,0.0007331996868031154,3,7,bell,COMPLETE
443,0.76,2025-08-26 12:44:58.452863,2025-08-26 12:45:00.267569,0 days 00:00:01.814706,min,32,0.0005129136987107483,3,7,bell,COMPLETE
444,0.82,2025-08-26 12:45:00.267919,2025-08-26 12:45:02.722648,0 days 00:00:02.454729,min,16,0.0005980245150755205,3,6,bell,COMPLETE
445,0.8399999999999999,2025-08-26 12:45:02.722928,2025-08-26 12:45:05.369037,0 days 00:00:02.646109,min,16,0.0009932930097106287,3,7,bell,COMPLETE
446,0.76,2025-08-26 12:45:05.369394,2025-08-26 12:45:07.242664,0 days 00:00:01.873270,min,16,0.0008546336015508579,3,4,gaussian,COMPLETE
447,0.7472727272727273,2025-08-26 12:45:07.243026,2025-08-26 12:45:09.630074,0 days 00:00:02.387048,min,16,0.0006479756293089875,3,7,sigmoid,COMPLETE
448,0.7200000000000001,2025-08-26 12:45:09.630437,2025-08-26 12:45:13.177373,0 days 00:00:03.546936,min,16,0.0002416295952337494,5,7,bell,COMPLETE
449,0.43636363636363634,2025-08-26 12:45:13.177765,2025-08-26 12:45:15.439192,0 days 00:00:02.261427,min,16,0.0001426816270383658,3,5,bell,COMPLETE
450,0.8399999999999999,2025-08-26 12:45:15.439563,2025-08-26 12:45:17.732421,0 days 00:00:02.292858,prod,16,0.0007845724688456363,2,7,bell,COMPLETE
451,0.8399999999999999,2025-08-26 12:45:17.732809,2025-08-26 12:45:20.382845,0 days 00:00:02.650036,min,16,0.0009279805287316301,3,7,bell,COMPLETE
452,0.2381818181818182,2025-08-26 12:45:20.383212,2025-08-26 12:45:22.845608,0 days 00:00:02.462396,min,16,6.552109472273112e-05,3,7,gaussian,COMPLETE
