number,value,datetime_start,datetime_complete,duration,params_and_operator,params_batch_size,params_lr,params_n_sets_protein,params_n_sets_salt,params_shape,state
453,0.6636363636363637,2025-08-26 12:45:22.845990,2025-08-26 12:45:23.757869,0 days 00:00:00.911879,min,64,0.0007063429580686836,3,6,bell,COMPLETE
454,0.82,2025-08-26 12:45:23.758230,2025-08-26 12:45:26.409545,0 days 00:00:02.651315,min,16,0.0008570565138792571,3,7,bell,COMPLETE
455,0.82,2025-08-26 12:45:26.409916,2025-08-26 12:45:28.864797,0 days 00:00:02.454881,min,16,0.0007673362556284835,3,6,bell,COMPLETE
456,0.8399999999999999,2025-08-26 12:45:28.865141,2025-08-26 12:45:31.513383,0 days 00:00:02.648242,min,16,0.0009210041375300852,3,7,bell,COMPLETE
457,0.78,2025-08-26 12:45:31.513766,2025-08-26 12:45:33.973595,0 days 00:00:02.459829,min,16,0.0005592223314418278,3,7,gaussian,COMPLETE
458,0.7436363636363635,2025-08-26 12:45:33.973973,2025-08-26 12:45:36.768936,0 days 00:00:02.794963,prod,16,0.0006723104981459966,3,7,bell,COMPLETE
459,0.8036363636363635,2025-08-26 12:45:36.769320,2025-08-26 12:45:39.155709,0 days 00:00:02.386389,min,16,0.0008303660759718549,3,7,sigmoid,COMPLETE
460,0.8399999999999999,2025-08-26 12:45:39.156089,2025-08-26 12:45:41.221639,0 days 00:00:02.065550,min,16,0.000995094882109276,2,6,bell,COMPLETE
461,0.8,2025-08-26 12:45:41.222015,2025-08-26 12:45:43.873355,0 days 00:00:02.651340,min,16,0.0007309545679961363,3,7,bell,COMPLETE
462,0.82,2025-08-26 12:45:43.873728,2025-08-26 12:45:46.522395,0 days 00:00:02.648667,min,16,0.0008656481894700823,3,7,bell,COMPLETE
463,0.8399999999999999,2025-08-26 12:45:46.522780,2025-08-26 12:45:48.985062,0 days 00:00:02.462282,min,16,0.0008117414774268086,3,7,gaussian,COMPLETE
464,0.7054545454545453,2025-08-26 12:45:48.985445,2025-08-26 12:45:50.802430,0 days 00:00:01.816985,min,32,0.0006177746577913833,3,7,bell,COMPLETE
465,0.82,2025-08-26 12:45:50.802807,2025-08-26 12:45:53.259451,0 days 00:00:02.456644,min,16,0.000903786464477474,3,6,bell,COMPLETE
466,0.7854545454545454,2025-08-26 12:45:53.259824,2025-08-26 12:45:56.053099,0 days 00:00:02.793275,prod,16,0.0007435164662516064,3,7,bell,COMPLETE
467,0.33999999999999997,2025-08-26 12:45:56.053476,2025-08-26 12:45:58.510030,0 days 00:00:02.456554,min,16,2.246282660169771e-05,3,6,bell,COMPLETE
468,0.8,2025-08-26 12:45:58.510407,2025-08-26 12:46:00.973605,0 days 00:00:02.463198,min,16,0.0006577323344654878,3,7,gaussian,COMPLETE
469,0.35090909090909095,2025-08-26 12:46:00.973987,2025-08-26 12:46:04.519499,0 days 00:00:03.545512,min,16,1.0760045841798667e-05,5,7,bell,COMPLETE
470,0.74,2025-08-26 12:46:04.519905,2025-08-26 12:46:07.169741,0 days 00:00:02.649836,min,16,0.0009245088235001945,3,7,bell,COMPLETE
471,0.8,2025-08-26 12:46:07.170131,2025-08-26 12:46:09.559503,0 days 00:00:02.389372,min,16,0.0007987336531464233,3,7,sigmoid,COMPLETE
472,0.8399999999999999,2025-08-26 12:46:09.559888,2025-08-26 12:46:12.018443,0 days 00:00:02.458555,min,16,0.0009909273270003714,3,6,bell,COMPLETE
473,0.7636363636363637,2025-08-26 12:46:12.018823,2025-08-26 12:46:14.668912,0 days 00:00:02.650089,min,16,0.00046352223814730386,3,7,bell,COMPLETE
474,0.8018181818181818,2025-08-26 12:46:14.669301,2025-08-26 12:46:16.865180,0 days 00:00:02.195879,prod,16,0.0005902727170361622,2,7,gaussian,COMPLETE
475,0.3890909090909091,2025-08-26 12:46:16.865557,2025-08-26 12:46:19.515459,0 days 00:00:02.649902,min,16,1.5344635112676545e-05,3,7,bell,COMPLETE
476,0.7818181818181819,2025-08-26 12:46:19.515836,2025-08-26 12:46:22.168615,0 days 00:00:02.652779,min,16,0.0007003618926348736,3,7,bell,COMPLETE
477,0.6672727272727272,2025-08-26 12:46:22.169018,2025-08-26 12:46:23.079322,0 days 00:00:00.910304,min,64,0.000855177318970866,3,6,bell,COMPLETE
478,0.8399999999999999,2025-08-26 12:46:23.079625,2025-08-26 12:46:25.727283,0 days 00:00:02.647658,min,16,0.0009984082003779162,3,7,bell,COMPLETE
479,0.7799999999999999,2025-08-26 12:46:25.727660,2025-08-26 12:46:27.799903,0 days 00:00:02.072243,min,16,0.0007870239211213375,3,5,gaussian,COMPLETE
480,0.8036363636363635,2025-08-26 12:46:27.800289,2025-08-26 12:46:30.449296,0 days 00:00:02.649007,min,16,0.0005275017732201101,3,7,bell,COMPLETE
481,0.8399999999999999,2025-08-26 12:46:30.449685,2025-08-26 12:46:33.097364,0 days 00:00:02.647679,min,16,0.0009058466758683151,3,7,bell,COMPLETE
482,0.78,2025-08-26 12:46:33.097744,2025-08-26 12:46:35.890057,0 days 00:00:02.792313,prod,16,0.0007380140392930899,3,7,bell,COMPLETE
483,0.7,2025-08-26 12:46:35.890449,2025-08-26 12:46:38.345090,0 days 00:00:02.454641,min,16,0.0008500994976821033,3,6,bell,COMPLETE
484,0.7436363636363635,2025-08-26 12:46:38.345467,2025-08-26 12:46:40.732275,0 days 00:00:02.386808,min,16,0.0006473141330437734,3,7,sigmoid,COMPLETE
485,0.7799999999999999,2025-08-26 12:46:40.732669,2025-08-26 12:46:42.423433,0 days 00:00:01.690764,min,32,0.0008094491673567753,3,7,gaussian,COMPLETE
486,0.8399999999999999,2025-08-26 12:46:42.423815,2025-08-26 12:46:45.075330,0 days 00:00:02.651515,min,16,0.0009139499926810484,3,7,bell,COMPLETE
487,0.8,2025-08-26 12:46:45.075713,2025-08-26 12:46:48.621295,0 days 00:00:03.545582,min,16,0.0007106199527827745,5,7,bell,COMPLETE
488,0.82,2025-08-26 12:46:48.621674,2025-08-26 12:46:51.078964,0 days 00:00:02.457290,min,16,0.0007705029593396632,3,6,bell,COMPLETE
489,0.76,2025-08-26 12:46:51.079328,2025-08-26 12:46:53.728313,0 days 00:00:02.648985,min,16,0.0005893299907386323,3,7,bell,COMPLETE
490,0.7999999999999999,2025-08-26 12:46:53.728721,2025-08-26 12:46:55.929823,0 days 00:00:02.201102,prod,16,0.0008639638175865598,2,7,gaussian,COMPLETE
491,0.82,2025-08-26 12:46:55.930200,2025-08-26 12:46:58.579190,0 days 00:00:02.648990,min,16,0.0006644374778431271,3,7,bell,COMPLETE
492,0.8399999999999999,2025-08-26 12:46:58.579579,2025-08-26 12:47:01.039203,0 days 00:00:02.459624,min,16,0.0009250555113099908,3,6,bell,COMPLETE
493,0.76,2025-08-26 12:47:01.039588,2025-08-26 12:47:04.132786,0 days 00:00:03.093198,min,16,0.000805760927340336,4,7,bell,COMPLETE
494,0.8399999999999999,2025-08-26 12:47:04.133185,2025-08-26 12:47:06.784908,0 days 00:00:02.651723,min,16,0.0009936739676442213,3,7,bell,COMPLETE
495,0.8399999999999999,2025-08-26 12:47:06.785294,2025-08-26 12:47:09.248778,0 days 00:00:02.463484,min,16,0.0007522586454227666,3,7,gaussian,COMPLETE
496,0.82,2025-08-26 12:47:09.249169,2025-08-26 12:47:11.708668,0 days 00:00:02.459499,min,16,0.00086939509583961,3,6,bell,COMPLETE
497,0.5272727272727273,2025-08-26 12:47:11.709064,2025-08-26 12:47:12.594744,0 days 00:00:00.885680,min,64,0.0006831890301015921,3,7,sigmoid,COMPLETE
498,0.8399999999999999,2025-08-26 12:47:12.595108,2025-08-26 12:47:16.900452,0 days 00:00:04.305344,prod,16,0.0008276505290153823,6,7,bell,COMPLETE
499,0.609090909090909,2025-08-26 12:47:16.900854,2025-08-26 12:47:18.768197,0 days 00:00:01.867343,min,16,0.000927921665609675,3,3,bell,COMPLETE
