number,value,datetime_start,datetime_complete,duration,params_activation,params_batch_size,params_hidden_dim,params_lr,params_n_layers,state
473,0.8,2025-08-26 12:52:49.425087,2025-08-26 12:52:50.052680,0 days 00:00:00.627593,relu,32,34,0.0009949229078147965,4,COMPLETE
474,0.8399999999999999,2025-08-26 12:52:50.053001,2025-08-26 12:52:50.923680,0 days 00:00:00.870679,tanh,16,32,0.000719380093015933,4,COMPLETE
475,0.8399999999999999,2025-08-26 12:52:50.923988,2025-08-26 12:52:51.803681,0 days 00:00:00.879693,relu,16,29,0.0009996438368384487,4,COMPLETE
476,0.8,2025-08-26 12:52:51.804035,2025-08-26 12:52:52.174760,0 days 00:00:00.370725,tanh,64,31,0.0008645654782536749,4,COMPLETE
477,0.82,2025-08-26 12:52:52.175102,2025-08-26 12:52:53.056672,0 days 00:00:00.881570,relu,16,30,0.000795268063445577,4,COMPLETE
478,0.6854545454545455,2025-08-26 12:52:53.056952,2025-08-26 12:52:53.969445,0 days 00:00:00.912493,tanh,16,63,0.00010991429132153062,4,COMPLETE
479,0.8399999999999999,2025-08-26 12:52:53.969762,2025-08-26 12:52:54.853213,0 days 00:00:00.883451,relu,16,34,0.0009135572035945886,4,COMPLETE
480,0.45272727272727276,2025-08-26 12:52:54.853583,2025-08-26 12:52:55.223186,0 days 00:00:00.369603,relu,64,36,8.401215070430133e-05,4,COMPLETE
481,0.8,2025-08-26 12:52:55.223410,2025-08-26 12:52:56.086489,0 days 00:00:00.863079,tanh,16,19,0.0008190961253657539,4,COMPLETE
482,0.8,2025-08-26 12:52:56.086728,2025-08-26 12:52:56.966321,0 days 00:00:00.879593,relu,16,33,0.0009214909481058505,4,COMPLETE
483,0.78,2025-08-26 12:52:56.966690,2025-08-26 12:52:57.334327,0 days 00:00:00.367637,tanh,64,32,0.000666510213844947,4,COMPLETE
484,0.8,2025-08-26 12:52:57.334546,2025-08-26 12:52:58.212663,0 days 00:00:00.878117,relu,16,28,0.0009995974956396106,4,COMPLETE
485,0.7218181818181819,2025-08-26 12:52:58.213044,2025-08-26 12:52:59.089720,0 days 00:00:00.876676,tanh,16,30,0.0002842798998641702,4,COMPLETE
486,0.6654545454545455,2025-08-26 12:52:59.090075,2025-08-26 12:52:59.459359,0 days 00:00:00.369284,relu,64,31,0.0007375411668057275,4,COMPLETE
487,0.8218181818181817,2025-08-26 12:52:59.459617,2025-08-26 12:53:00.340387,0 days 00:00:00.880770,tanh,16,37,0.0008393837151923327,4,COMPLETE
488,0.7799999999999999,2025-08-26 12:53:00.340739,2025-08-26 12:53:01.222147,0 days 00:00:00.881408,relu,16,33,0.0009231142452207664,4,COMPLETE
489,0.8399999999999999,2025-08-26 12:53:01.222488,2025-08-26 12:53:02.109018,0 days 00:00:00.886530,relu,16,35,0.0008634898288867335,4,COMPLETE
490,0.82,2025-08-26 12:53:02.109388,2025-08-26 12:53:02.478576,0 days 00:00:00.369188,tanh,64,29,0.0007661574692938054,4,COMPLETE
491,0.8399999999999999,2025-08-26 12:53:02.478816,2025-08-26 12:53:03.354774,0 days 00:00:00.875958,relu,16,32,0.0009122919364663905,4,COMPLETE
492,0.37272727272727274,2025-08-26 12:53:03.355149,2025-08-26 12:53:04.225972,0 days 00:00:00.870823,sigmoid,16,34,0.0008355594181123072,4,COMPLETE
493,0.7218181818181819,2025-08-26 12:53:04.226216,2025-08-26 12:53:04.594502,0 days 00:00:00.368286,tanh,64,31,0.0003255537676632941,4,COMPLETE
494,0.8,2025-08-26 12:53:04.594723,2025-08-26 12:53:05.476868,0 days 00:00:00.882145,relu,16,36,0.0009162989161082974,4,COMPLETE
495,0.76,2025-08-26 12:53:05.477101,2025-08-26 12:53:06.098518,0 days 00:00:00.621417,tanh,32,32,0.0009957144619972603,4,COMPLETE
496,0.7799999999999999,2025-08-26 12:53:06.098744,2025-08-26 12:53:06.977862,0 days 00:00:00.879118,relu,16,30,0.0007045730290724006,4,COMPLETE
497,0.82,2025-08-26 12:53:06.978130,2025-08-26 12:53:07.349538,0 days 00:00:00.371408,tanh,64,35,0.0007863553212688046,4,COMPLETE
498,0.8399999999999999,2025-08-26 12:53:07.349738,2025-08-26 12:53:08.229240,0 days 00:00:00.879502,relu,16,33,0.0009168672458287837,4,COMPLETE
499,0.5672727272727273,2025-08-26 12:53:08.229472,2025-08-26 12:53:08.769274,0 days 00:00:00.539802,relu,16,29,0.000645050308493974,1,COMPLETE
